,datetime,title,source,link,sentiment_class,sentiment_score
322,10/16/2023 6:08:15 PM,"Lululemon, PCTEL, Consolidated Communications, Other Stocks Jumping Higher On Monday",Benzinga,/news/stocks/lululemon-pctel-consolidated-communications-other-stocks-jumping-higher-on-monday-1032709438,negative,0.8786102533340454
323,10/16/2023 7:09:54 PM,Why Streamline Health Solutions Shares Are Trading Lower By Over 68%? Here Are Other Stocks Moving In Monday's Mid-Day Session,Benzinga,/news/stocks/why-streamline-health-solutions-shares-are-trading-lower-by-over-68-here-are-other-stocks-moving-in-monday-s-mid-day-session-1032709593,neutral,0.8964755535125732
324,10/16/2023 8:30:39 PM,Crude Oil Moves Lower; Consolidated Communications Shares Jump,Benzinga,/news/stocks/crude-oil-moves-lower-consolidated-communications-shares-jump-1032709735,neutral,0.871936023235321
325,10/16/2023 10:50:05 PM,Amphenol’s Potential Growth and Profitability Boost Post PCTEL Acquisition: A Comprehensive Buy Rating Analysis,TipRanks,/news/stocks/amphenol-s-potential-growth-and-profitability-boost-post-pctel-acquisition-a-comprehensive-buy-rating-analysis-1032710048,negative,0.74946129322052
326,10/19/2023 2:25:31 AM,Amphenol (APH) Receives a Rating Update from a Top Analyst,TipRanks,/news/stocks/amphenol-aph-receives-a-rating-update-from-a-top-analyst-1032718684,positive,0.8037503957748413
327,10/24/2023 3:01:13 PM,Here's what to expect from Amphenol's earnings,Markets Insider Automation,/news/stocks/amphenol-q3-earnings-preview-1032733273,positive,0.9386256337165833
328,10/24/2023 8:30:00 PM,Quant Ratings Updated on 62 Stocks,InvestorPlace,/news/stocks/101723-quant-ratings-2-1032735140,positive,0.9259970188140869
329,10/25/2023 2:17:34 PM,"Amphenol Corp. Q3 Income Climbs, Beats estimates",RTTNews,/news/stocks/amphenol-corp-q3-income-climbs-beats-estimates-1032738413,negative,0.9352113008499146
330,10/25/2023 2:45:00 PM,Amphenol hosts conference call for investors,Markets Insider Automation,/news/stocks/amphenol_conference-1029579492,positive,0.9365413188934326
331,10/26/2023 3:07:04 AM,Amphenol Corp.’s Growth Potential and Financial Discipline: A Buy Rating Analysis,TipRanks,/news/stocks/amphenol-corp-s-growth-potential-and-financial-discipline-a-buy-rating-analysis-1032744847,positive,0.7259127497673035
332,10/26/2023 9:29:09 AM,Amphenol’s Robust Performance and Growth Prospects Justify Buy Rating: A Strategic Analysis,TipRanks,/news/stocks/amphenol-s-robust-performance-and-growth-prospects-justify-buy-rating-a-strategic-analysis-1032745762,positive,0.8270358443260193
333,12/15/2023 12:41:12 PM,Analysts Conflicted on These Technology Names: Amphenol (APH) and Intel (INTC),TipRanks,/news/stocks/analysts-conflicted-on-these-technology-names-amphenol-aph-and-intel-intc-1032906254,positive,0.515410840511322
334,12/18/2023 1:39:19 PM,This Analyst With 83% Accuracy Rate Sees Around 17% Upside In Micron Technology - Here Are 5 Stock Picks For Last Week From Wall Street's Most Accurate Analysts,Benzinga,/news/stocks/this-analyst-with-83-accuracy-rate-sees-around-17-upside-in-micron-technology---here-are-5-stock-picks-for-last-week-from-wall-street-s-most-accurate-analysts-1032908698,positive,0.9049586057662964
335,1/23/2024 3:01:13 PM,Here's what Wall Street expects from Amphenol's earnings report,Markets Insider Automation,/news/stocks/amphenol-quarter-earnings-preview-q4-1032987862,positive,0.9125818014144897
336,1/23/2024 3:45:41 PM,Notable earnings before Wednesday's open,Seeking Alpha,https://seekingalpha.com/news/4057415-notable-earnings-before-wednesdays-open?utm_source=businessinsider&utm_medium=referral&feed_item_type=news,negative,0.855887770652771
337,1/23/2024 5:04:05 PM,Amphenol Q4 2023 Earnings Preview,Seeking Alpha,https://seekingalpha.com/news/4057453-amphenol-q4-2023-earnings-preview?utm_source=businessinsider&utm_medium=referral&feed_item_type=news,positive,0.9281530380249023
338,1/24/2024 1:04:00 PM,"Amphenol Non-GAAP EPS of $0.82 beats by $0.05, revenue of $3.33B beats by $170M",Seeking Alpha,https://seekingalpha.com/news/4057786-amphenol-non-gaap-eps-of-0_82-beats-0_05-revenue-of-3_33b-beats-170m?utm_source=businessinsider&utm_medium=referral&feed_item_type=news,positive,0.730065107345581
339,1/24/2024 2:06:48 PM,"Amphenol Corp. Q4 Profit Increases, beats estimates",RTTNews,/news/stocks/amphenol-corp-q4-profit-increases-beats-estimates-1032992098,negative,0.9424532651901245
340,1/24/2024 2:41:21 PM,Amphenol Guides Q1 Adj. EPS In Line With Estimates - Update ,RTTNews,/news/stocks/amphenol-guides-q1-adj-eps-in-line-with-estimates-update-1032992254,positive,0.775261640548706
341,1/24/2024 9:35:26 PM,Amphenol’s Growth Trajectory and Buy Rating Justified by Strong Financials and Market Positioning,TipRanks,/news/stocks/amphenol-s-growth-trajectory-and-buy-rating-justified-by-strong-financials-and-market-positioning-1032994445,negative,0.8149354457855225
342,1/25/2024 10:46:17 AM,Amphenol Stock Buy Rating Affirmed: Strong Q4 Performance and Strategic Acquisitions Signal Growth Potential,TipRanks,/news/stocks/amphenol-stock-buy-rating-affirmed-strong-q4-performance-and-strategic-acquisitions-signal-growth-potential-1032996813,negative,0.953876793384552
343,1/25/2024 11:40:20 AM,"Analysts’ Opinions Are Mixed on These Technology Stocks: International Business Machines (IBM), ServiceNow (NOW) and Amphenol (APH)",TipRanks,/news/stocks/analysts-opinions-are-mixed-on-these-technology-stocks-international-business-machines-ibm-servicenow-now-and-amphenol-aph-1032997085,neutral,0.7355813384056091
344,1/25/2024 12:27:08 PM,Stifel Nicolaus Reaffirms Their Hold Rating on Amphenol (APH),TipRanks,/news/stocks/stifel-nicolaus-reaffirms-their-hold-rating-on-amphenol-aph-1032997589,positive,0.8069373369216919
345,1/25/2024 4:01:17 PM,What Analysts Are Saying About Amphenol Stock,Benzinga,/news/stocks/what-analysts-are-saying-about-amphenol-stock-1032997473,positive,0.9340968132019043
346,1/30/2024 1:22:35 PM,Amphenol to buy CIT business from Carlisle for $2B,Seeking Alpha,https://seekingalpha.com/news/4059976-amphenol-to-buy-cit-business-from-carlisle-for-2b?utm_source=businessinsider&utm_medium=referral&feed_item_type=news,positive,0.9179279804229736
347,1/30/2024 2:55:48 PM,Amphenol To Buy CIT Business From Carlisle In $2.025 Bln Cash Deal ,RTTNews,/news/stocks/amphenol-to-buy-cit-business-from-carlisle-in-2-025-bln-cash-deal-1033010221,positive,0.8321658372879028
348,1/31/2024 5:15:51 AM,Maintaining Hold on Amphenol: Balancing Improving Fundamentals Against High Valuation Concerns,TipRanks,/news/stocks/maintaining-hold-on-amphenol-balancing-improving-fundamentals-against-high-valuation-concerns-1033013607,negative,0.9077751636505127
349,1/31/2024 10:30:43 AM,"Analysts Offer Insights on Technology Companies: Amphenol (APH), Teradyne (TER) and HubSpot (HUBS)",TipRanks,/news/stocks/analysts-offer-insights-on-technology-companies-amphenol-aph-teradyne-ter-and-hubspot-hubs-1033014995,positive,0.9156871438026428
350,2/1/2024 1:37:13 PM,Amphenol declares $0.22 dividend,Seeking Alpha,https://seekingalpha.com/news/4061206-amphenol-corporation-declares-0_22-dividend?utm_source=businessinsider&utm_medium=referral&feed_item_type=news,positive,0.9229658842086792
351,2/28/2024 10:55:45 AM,Buy Rating Affirmed for Amphenol Amid Strong AI-Driven IT Datacom Performance,TipRanks,/news/stocks/buy-rating-affirmed-for-amphenol-amid-strong-ai-driven-it-datacom-performance-1033112750,negative,0.9503565430641174
352,3/25/2024 7:17:19 PM,Should Vanguard Mid-Cap ETF (VO) Be on Your Investing Radar?,Benzinga,/news/etf/should-vanguard-mid-cap-etf-vo-be-on-your-investing-radar-1033194404,positive,0.925869345664978
353,3/25/2024 8:01:42 PM,Evaluating Amphenol: Insights From 5 Financial Analysts,Benzinga,/news/stocks/evaluating-amphenol-insights-from-5-financial-analysts-1033194479,positive,0.7481586933135986
354,4/4/2024 9:17:52 AM,Amphenol Poised for Growth: Strategic Acquisitions and AI Infrastructure Spending Drive Buy Rating,TipRanks,/news/stocks/amphenol-poised-for-growth-strategic-acquisitions-and-ai-infrastructure-spending-drive-buy-rating-1033222247,negative,0.7701712250709534
355,4/11/2024 2:01:44 PM,Where Amphenol Stands With Analysts,Benzinga,/news/stocks/where-amphenol-stands-with-analysts-1033240660,positive,0.9055609703063965
356,4/19/2024 1:35:26 PM,Amphenol: A Resilient Growth Prospect with Strong M&A Strategy,TipRanks,/news/stocks/amphenol-a-resilient-growth-prospect-with-strong-m-a-strategy-1033267036,negative,0.9347087144851685
357,4/23/2024 2:25:34 PM,Notable earnings before Wednesday's open,Seeking Alpha,https://seekingalpha.com/news/4092543-notable-earnings-before-wednesdays-open?utm_source=businessinsider&utm_medium=referral&feed_item_type=news,negative,0.855887770652771
358,4/23/2024 3:01:13 PM,Here's what Wall Street expects from Amphenol's earnings report,Markets Insider Automation,/news/stocks/amphenol-q1-quarterly-earnings-preview-stock-1033276091,positive,0.9125818014144897
359,4/23/2024 5:40:33 PM,Amphenol Q1 2024 Earnings Preview,Seeking Alpha,https://seekingalpha.com/news/4092707-amphenol-q1-2024-earnings-preview?utm_source=businessinsider&utm_medium=referral&feed_item_type=news,positive,0.9261479377746582
360,4/24/2024 12:03:03 PM,Amphenol beats top-line and bottom-line estimates; initiates Q2 outlook,Seeking Alpha,https://seekingalpha.com/news/4093060-amphenol-beats-top-line-and-bottom-line-estimates-initiates-q2-outlook?utm_source=businessinsider&utm_medium=referral&feed_item_type=news,negative,0.9291059970855713
361,4/24/2024 2:07:12 PM,"Amphenol Corp. Q1 Income Rises, Beats estimates",RTTNews,/news/stocks/amphenol-corp-q1-income-rises-beats-estimates-1033281450,negative,0.9319841861724854
362,4/24/2024 2:56:12 PM,Amphenol Sees Q2 Adj. EPS In Line Or Above Market; Plans $2 Bln Buyback; Stock Up In Pre-market ,RTTNews,/news/stocks/amphenol-sees-q2-adj-eps-in-line-or-above-market-plans-2-bln-buyback-stock-up-in-pre-market-1033282028,negative,0.944199800491333
363,4/24/2024 4:52:53 PM,"APH Stock Earnings: Amphenol Beats EPS, Beats Revenue for Q1 2024",InvestorPlace,/news/stocks/aph-stock-earnings-amphenol-for-q1-of-2024-1033283619,negative,0.6735044717788696
364,4/25/2024 3:05:21 AM,Amphenol Earnings and Growth Outlook: A Buy Rating from Analyst Mark Delaney,TipRanks,/news/stocks/amphenol-earnings-and-growth-outlook-a-buy-rating-from-analyst-mark-delaney-1033286043,negative,0.5243780612945557
365,4/25/2024 9:50:59 AM,Analysts Offer Insights on Technology Companies: Silicon Laboratories (SLAB) and Amphenol (APH),TipRanks,/news/stocks/analysts-offer-insights-on-technology-companies-silicon-laboratories-slab-and-amphenol-aph-1033287868,positive,0.887575089931488
366,4/25/2024 11:11:46 AM,Truist Financial Sticks to Their Buy Rating for Amphenol (APH),TipRanks,/news/stocks/truist-financial-sticks-to-their-buy-rating-for-amphenol-aph-1033288681,positive,0.7573152184486389
367,4/25/2024 11:50:14 AM,"Analysts Offer Insights on Technology Companies: Silicon Laboratories (SLAB), Amphenol (APH) and Lam Research (LRCX)",TipRanks,/news/stocks/analysts-offer-insights-on-technology-companies-silicon-laboratories-slab-amphenol-aph-and-lam-research-lrcx-1033288973,positive,0.9013712406158447
368,4/28/2024 7:24:54 PM,"With rate cuts pushed out, Goldman looks at quality stocks",Seeking Alpha,https://seekingalpha.com/news/4095236-with-rate-cuts-pushed-out-goldman-looks-at-quality-stocks?utm_source=businessinsider&utm_medium=referral&feed_item_type=news,positive,0.762475848197937
369,4/30/2024 1:26:38 PM,Bank of America Securities Sticks to Their Buy Rating for Amphenol (APH),TipRanks,/news/stocks/bank-of-america-securities-sticks-to-their-buy-rating-for-amphenol-aph-1033308206,positive,0.8661845922470093
370,5/1/2024 6:51:44 AM,"Analysts’ Opinions Are Mixed on These Technology Stocks: Advanced Micro Devices (AMD), Amphenol (APH) and CommVault Systems (CVLT)",TipRanks,/news/stocks/analysts-opinions-are-mixed-on-these-technology-stocks-advanced-micro-devices-amd-amphenol-aph-and-commvault-systems-cvlt-1033312155,neutral,0.7423568964004517
371,5/2/2024 12:38:38 PM,Amphenol declares $0.22 dividend,Seeking Alpha,https://seekingalpha.com/news/4098428-amphenol-corporation-declares-0_22-dividend?utm_source=businessinsider&utm_medium=referral&feed_item_type=news,positive,0.9229658842086792
372,5/17/2024 10:30:40 AM,"Analysts’ Top Technology Picks: Amphenol (APH), MongoDB (MDB)",TipRanks,/news/stocks/analysts-top-technology-picks-amphenol-aph-mongodb-mdb-1033399273,negative,0.6000557541847229
373,5/17/2024 3:00:52 PM,Analyst Expectations For Amphenol's Future,Benzinga,/news/stocks/analyst-expectations-for-amphenol-s-future-1033399115,negative,0.8505930304527283
374,5/20/2024 11:11:07 PM,Amphenol Approves Two-for-one Stock Split ,RTTNews,/news/stocks/amphenol-approves-two-for-one-stock-split-1033404792,positive,0.8947151899337769
375,5/22/2024 12:16:12 PM,Amphenol’s Growth and Investor Appeal Bolstered by CIT Acquisition and Stock Split: Buy Rating Affirmed,TipRanks,/news/stocks/amphenol-s-growth-and-investor-appeal-bolstered-by-cit-acquisition-and-stock-split-buy-rating-affirmed-1033412496,negative,0.8751916885375977
376,5/24/2024 11:20:43 AM,"Analysts Are Bullish on Top Technology Stocks: Intuit (INTU), Paycor HCM (PYCR)",TipRanks,/news/stocks/analysts-are-bullish-on-top-technology-stocks-intuit-intu-paycor-hcm-pycr-1033420324,negative,0.7170923352241516
377,5/28/2024 2:00:00 PM,Tech Up-and-Comers: 3 Under-the-Radar Stocks With 10X Potential,InvestorPlace,/news/stocks/tech-up-and-comers-3-under-the-radar-stocks-with-10x-potential-1033427594,positive,0.6592302918434143
378,5/28/2024 8:59:13 PM,"Amphenol Poised For Growth With AI Server Boom, Rising Copper Content, CIT Acquisition: Analyst",Benzinga,/news/stocks/amphenol-poised-for-growth-with-ai-server-boom-rising-copper-content-cit-acquisition-analyst-1033428453,negative,0.8911322951316833
379,6/5/2024 8:20:15 PM,"Analysts Are Neutral on Top Technology Stocks: Amphenol (APH), WalkMe (WKME)",TipRanks,/news/stocks/analysts-are-neutral-on-top-technology-stocks-amphenol-aph-walkme-wkme-1033455495,positive,0.7347506880760193
380,6/7/2024 1:05:00 PM,Contrarian Cash Cows: 3 Stocks Proving the Analysts Wrong for Huge Gains,InvestorPlace,/news/stocks/contrarian-cash-cows-3-stocks-proving-the-analysts-wrong-for-huge-gains-1033461201,neutral,0.6619048714637756
381,6/7/2024 7:00:58 PM,"Catalyst Watch: Apple's WWDC, Tesla's annual meeting, Fed's dot plot, and GameStop volatility",Seeking Alpha,https://seekingalpha.com/news/4114173-catalyst-watch-apples-wwdc-teslas-shareholder-meeting-fomc-meeting-and-gamestop-volatility?utm_source=businessinsider&utm_medium=referral&feed_item_type=news,positive,0.8829660415649414
382,6/7/2024 9:46:50 PM,Are Computer and Technology Stocks Lagging Silicon Motion Technology This Year?,Benzinga,/news/stocks/are-computer-and-technology-stocks-lagging-silicon-motion-technology-this-year-1033462444,neutral,0.7573598027229309
383,6/18/2024 2:05:22 AM,Amphenol (APH) Receives a Hold from Stifel Nicolaus,TipRanks,/news/stocks/amphenol-aph-receives-a-hold-from-stifel-nicolaus-1033485642,positive,0.7638521790504456
384,6/18/2024 2:30:28 AM,Analysts Offer Insights on Technology Companies: ODDITY Tech Ltd. Class A (ODD) and Amphenol (APH),TipRanks,/news/stocks/analysts-offer-insights-on-technology-companies-oddity-tech-ltd-class-a-odd-and-amphenol-aph-1033485685,positive,0.9210766553878784
385,6/21/2024 4:29:28 PM,3 Stocks The Wall Street Pros Don’t Want You to Know About,InvestorPlace,/news/stocks/3-stocks-the-wall-street-pros-dont-want-you-to-know-about-1033496960,positive,0.8712462186813354
386,7/3/2024 9:48:55 PM,"Sapiens Benefits From a Strong Portfolio, Partner Base",Benzinga,/news/stocks/sapiens-benefits-from-a-strong-portfolio-partner-base-1033527848,negative,0.7842898964881897
387,7/5/2024 6:50:19 PM,Assessing SMART Global Stock Ahead of Its Q3 Earnings,Benzinga,/news/stocks/assessing-smart-global-stock-ahead-of-its-q3-earnings-1033532786,positive,0.9229407906532288
388,7/10/2024 10:36:23 AM,Buy Rating Affirmed with Increased Price Target as Amphenol Expects Earnings Beat and Strong Growth,TipRanks,/news/stocks/buy-rating-affirmed-with-increased-price-target-as-amphenol-expects-earnings-beat-and-strong-growth-1033543398,negative,0.954566240310669
389,7/15/2024 12:15:00 AM,"Analysts say Supreme Court's Chevron ruling may limit action on climate, EVs",Seeking Alpha,https://seekingalpha.com/news/4123989-us-power-use-seen-hitting-record-highs-in-2024-and-2025-eia-says?utm_source=businessinsider&utm_medium=referral&feed_item_type=news,positive,0.5157509446144104
390,7/18/2024 1:18:34 PM,CommScope to sell OWN and DAS business unit to Amphenol Corporation for $2.1B in cash,Seeking Alpha,https://seekingalpha.com/news/4125486-commscope-to-sell-own-and-das-business-unit-to-amphenol-corporation-for-21b-in-cash?utm_source=businessinsider&utm_medium=referral&feed_item_type=news,positive,0.9390936493873596
391,7/18/2024 3:52:52 PM,Amphenol To Buy CommScope's Mobile Network Businesses For $2.1 Bln In Cash ,RTTNews,/news/stocks/amphenol-to-buy-commscope-s-mobile-network-businesses-for-2-1-bln-in-cash-1033568787,positive,0.8951262831687927
392,7/19/2024 8:46:58 AM,Strong Buy Rating for Amphenol on Strategic Acquisitions and Expected Earnings Growth,TipRanks,/news/stocks/strong-buy-rating-for-amphenol-on-strategic-acquisitions-and-expected-earnings-growth-1033572057,negative,0.9484643936157227
393,7/22/2024 11:06:36 AM,Amphenol (APH): New Buy Recommendation for This Technology Giant,TipRanks,/news/stocks/amphenol-aph-new-buy-recommendation-for-this-technology-giant-1033578339,negative,0.7083443999290466
394,7/22/2024 12:20:27 PM,Amphenol (APH): New Buy Recommendation for This Technology Giant,TipRanks,/news/stocks/amphenol-aph-new-buy-recommendation-for-this-technology-giant-1033578601,negative,0.7083443999290466
395,7/22/2024 1:05:16 PM,"New Buy Rating for Amphenol (APH), the Technology Giant",TipRanks,/news/stocks/new-buy-rating-for-amphenol-aph-the-technology-giant-1033578828,negative,0.7724847197532654
396,7/23/2024 2:48:09 PM,Notable earnings before Wednesday's open,Seeking Alpha,https://seekingalpha.com/news/4126834-notable-earnings-before-wednesdays-open?utm_source=businessinsider&utm_medium=referral&feed_item_type=news,negative,0.855887770652771
397,7/23/2024 3:01:13 PM,Amphenol earnings preview: what to expect,Markets Insider Automation,/news/stocks/amphenol-q2-quarterly-earnings-preview-1033582514,positive,0.9236447215080261
398,7/23/2024 4:15:38 PM,Amphenol Q2 2024 Earnings Preview,Seeking Alpha,https://seekingalpha.com/news/4126885-amphenol-q2-2024-earnings-preview?utm_source=businessinsider&utm_medium=referral&feed_item_type=news,positive,0.9244288802146912
399,7/24/2024 12:07:10 PM,"Amphenol Non-GAAP EPS of $0.44 beats by $0.03, revenue of $3.61B beats by $230M",Seeking Alpha,https://seekingalpha.com/news/4127425-amphenol-non-gaap-eps-of-0_44-beats-0_03-revenue-of-3_61b-beats-230m?utm_source=businessinsider&utm_medium=referral&feed_item_type=news,positive,0.650259256362915
400,7/24/2024 2:09:25 PM,"Amphenol Corp. Q2 Profit Increases, Beats Estimates ",RTTNews,/news/stocks/amphenol-corp-q2-profit-increases-beats-estimates-1033588270,negative,0.94257652759552
401,7/24/2024 4:52:56 PM,"APH Stock Earnings: Amphenol Beats EPS, Beats Revenue for Q2 2024",InvestorPlace,/news/stocks/aph-stock-earnings-amphenol-for-q2-of-2024-1033590331,negative,0.6611185073852539
402,7/25/2024 2:25:16 AM,Buy Rating for Amphenol: Strong Q2 Results and Strategic Market Positioning Signal Growth Ahead,TipRanks,/news/stocks/buy-rating-for-amphenol-strong-q2-results-and-strategic-market-positioning-signal-growth-ahead-1033592467,negative,0.9571398496627808
403,7/25/2024 11:21:13 AM,"Analysts Offer Insights on Technology Companies: ASGN (ASGN), Fortive (FTV) and Amphenol (APH)",TipRanks,/news/stocks/analysts-offer-insights-on-technology-companies-asgn-asgn-fortive-ftv-and-amphenol-aph-1033595388,positive,0.9161404371261597
404,7/25/2024 11:25:49 AM,Stifel Nicolaus Reaffirms Their Hold Rating on Amphenol (APH),TipRanks,/news/stocks/stifel-nicolaus-reaffirms-their-hold-rating-on-amphenol-aph-1033595383,positive,0.8069373369216919
405,7/25/2024 12:47:19 PM,Amphenol (APH): New Buy Recommendation for This Technology Giant,TipRanks,/news/stocks/amphenol-aph-new-buy-recommendation-for-this-technology-giant-1033595827,negative,0.7083443999290466
406,7/26/2024 7:11:33 AM,Analysts Offer Insights on Technology Companies: Amphenol (APH) and ServiceNow (NOW),TipRanks,/news/stocks/analysts-offer-insights-on-technology-companies-amphenol-aph-and-servicenow-now-1033599367,positive,0.9046913981437683
407,7/28/2024 1:40:43 AM,Analysts Offer Insights on Technology Companies: ams AG (OtherAUKUF) and Amphenol (APH),TipRanks,/news/stocks/analysts-offer-insights-on-technology-companies-ams-ag-otheraukuf-and-amphenol-aph-1033602221,positive,0.9052062630653381
408,8/1/2024 8:35:29 PM,Amphenol’s Growth and Efficiency Acknowledged Amid Valuation Concerns: Giordano Maintains Hold Rating,TipRanks,/news/stocks/amphenol-s-growth-and-efficiency-acknowledged-amid-valuation-concerns-giordano-maintains-hold-rating-1033629369,negative,0.9375130534172058
409,8/15/2024 9:21:59 PM,Philippe Laffont's Coatue Management ups Nvidia stake by nearly tenfold among top Q2 moves,Seeking Alpha,https://seekingalpha.com/news/4140822-philippe-laffonts-coatue-management-ups-nvidia-stake-by-nearly-tenfold-among-top-q2-moves?utm_source=businessinsider&utm_medium=referral&feed_item_type=news,negative,0.9319825172424316
410,8/23/2024 6:41:21 PM,The 10 most actionable policies if Harris wins this November - Jefferies,Seeking Alpha,https://seekingalpha.com/news/4143477-the-10-most-actionable-policies-if-harris-wins-this-november-jefferies?utm_source=businessinsider&utm_medium=referral&feed_item_type=news,positive,0.8276589512825012
411,8/28/2024 12:18:49 PM,Amphenol (APH): New Buy Recommendation for This Technology Giant,TipRanks,/news/stocks/amphenol-aph-new-buy-recommendation-for-this-technology-giant-1033729652,negative,0.7083443999290466
412,8/30/2024 9:26:05 AM,Is it time to make portfolio changes before the 2024 U.S. election?,Seeking Alpha,https://seekingalpha.com/news/4145383-is-it-time-to-make-portfolio-changes-before-the-2024-us-election?utm_source=businessinsider&utm_medium=referral&feed_item_type=news,positive,0.9284965395927429
413,9/3/2024 7:45:15 PM,Amphenol’s Stock Holds Strong Growth Potential Despite AI Sector Volatility: Analyst Top Pick with $75 Target Price,TipRanks,/news/stocks/amphenol-s-stock-holds-strong-growth-potential-despite-ai-sector-volatility-analyst-top-pick-with-75-target-price-1033745150,negative,0.8840146064758301
414,9/4/2024 11:52:11 AM,"Amphenol AI opportunity at risk, BofA says, downgrades to
 neutral",Seeking Alpha,https://seekingalpha.com/news/4146657-amphenol-ai-opportunity-at-risk-bofa-says-downgrades-toneutral?utm_source=businessinsider&utm_medium=referral&feed_item_type=news,neutral,0.7261673808097839
415,9/15/2024 1:36:00 PM,Least shorted S&P 500 stocks in August,Seeking Alpha,https://seekingalpha.com/news/4149788-least-shorted-sp-500-stocks-in-august?utm_source=businessinsider&utm_medium=referral&feed_item_type=news,positive,0.590275764465332
416,9/16/2024 3:33:40 PM,Amphenol goes ex dividend tomorrow,Seeking Alpha,https://seekingalpha.com/news/4150023-amphenol-goes-ex-dividend-tomorrow?utm_source=businessinsider&utm_medium=referral&feed_item_type=news,positive,0.5401095151901245
417,9/23/2024 11:57:12 AM,"New Buy Rating for Amphenol (APH), the Technology Giant",TipRanks,/news/stocks/new-buy-rating-for-amphenol-aph-the-technology-giant-1033790980,negative,0.7724847197532654
418,9/24/2024 2:00:46 PM,"Tech is the top performing sector through Q3, see what names stick out",Seeking Alpha,https://seekingalpha.com/news/4152678-tech-is-the-top-performing-sector-through-q3-see-what-names-stick-out?utm_source=businessinsider&utm_medium=referral&feed_item_type=news,positive,0.8879268169403076
419,9/27/2024 12:30:54 PM,"With tech the top performing sector in 2024, these names could have more room to run",Seeking Alpha,https://seekingalpha.com/news/4152678-with-tech-the-top-performing-sector-in-2024-these-names-could-have-more-room-to-run?utm_source=businessinsider&utm_medium=referral&feed_item_type=news,negative,0.893844485282898
420,10/9/2024 10:47:09 AM,Balanced Hold Rating on Amphenol Amidst Mixed Sector Performance and Cautious Valuation,TipRanks,/news/stocks/balanced-hold-rating-on-amphenol-amidst-mixed-sector-performance-and-cautious-valuation-1033831861,neutral,0.8528462052345276
421,10/21/2024 10:20:05 AM,Amphenol placed on ‘Positive Catalyst Watch’ at JPMorgan,TipRanks,/news/stocks/amphenol-placed-on-positive-catalyst-watch-at-jpmorgan-1033864586,negative,0.8854506611824036
422,10/21/2024 11:56:42 AM,Amphenol (APH): New Buy Recommendation for This Technology Giant,TipRanks,/news/stocks/amphenol-aph-new-buy-recommendation-for-this-technology-giant-1033865174,negative,0.7083443999290466
423,10/22/2024 3:25:10 PM,Amphenol call volume above normal and directionally bullish,TipRanks,/news/stocks/amphenol-call-volume-above-normal-and-directionally-bullish-1033872931,negative,0.8931965231895447
424,10/22/2024 4:20:06 PM,Amphenol Q3 2024 Earnings Preview,Seeking Alpha,https://seekingalpha.com/news/4190978-amphenol-q3-2024-earnings-preview?utm_source=businessinsider&utm_medium=referral&feed_item_type=news,positive,0.9227525591850281
425,10/22/2024 10:00:06 PM,Here's the major earnings before the open tomorrow,Seeking Alpha,https://seekingalpha.com/news/4190601-heres-the-major-earnings-before-the-open-tomorrow?utm_source=businessinsider&utm_medium=referral&feed_item_type=news,positive,0.9330109357833862
