,datetime,title,source,link,sentiment_class,sentiment_score
312,5/3/2024 10:55:43 AM,"Analysts Conflicted on These Real Estate Names: W. P. Carey Inc. (WPC), Colliers International Group (CIGI) and Camden Property (CPT)",TipRanks,/news/stocks/analysts-conflicted-on-these-real-estate-names-w-p-carey-inc-wpc-colliers-international-group-cigi-and-camden-property-cpt-1033326748,neutral,0.6640056371688843
313,5/3/2024 11:35:58 AM,Wall Street Analysts Are Bullish on Top Real Estate Picks,TipRanks,/news/stocks/wall-street-analysts-are-bullish-on-top-real-estate-picks-1033327358,positive,0.4646916389465332
314,5/3/2024 11:41:47 AM,Scotiabank Sticks to Their Hold Rating for Camden Property (CPT),TipRanks,/news/stocks/scotiabank-sticks-to-their-hold-rating-for-camden-property-cpt-1033327324,positive,0.8804013133049011
315,5/3/2024 11:46:55 AM,"Analysts Are Neutral on These Real Estate Stocks: Diamondrock (DRH), Kimco Realty (KIM)",TipRanks,/news/stocks/analysts-are-neutral-on-these-real-estate-stocks-diamondrock-drh-kimco-realty-kim-1033327454,positive,0.684203028678894
316,5/3/2024 12:09:55 PM,Camden Property (CPT) Receives a Sell from Piper Sandler,TipRanks,/news/stocks/camden-property-cpt-receives-a-sell-from-piper-sandler-1033327519,negative,0.5034347176551819
317,5/4/2024 4:00:34 PM,"Real estate stocks outperform major market averages as rate hikes ruled out, earnings continue to grow",Seeking Alpha,https://seekingalpha.com/news/4100029-real-estate-stocks-outperform-major-market-averages-as-rate-hikes-ruled-out-earnings-continue-to-grow?utm_source=businessinsider&utm_medium=referral&feed_item_type=news,negative,0.939093828201294
318,5/5/2024 8:45:20 PM,Buy Rating Affirmed for Camden Property Trust with Increased Price Target Based on Strategic Acquisitions and Solid Financial Health,TipRanks,/news/stocks/buy-rating-affirmed-for-camden-property-trust-with-increased-price-target-based-on-strategic-acquisitions-and-solid-financial-health-1033329839,negative,0.9525840878486633
319,5/6/2024 10:35:10 AM,Camden Property (CPT) Gets a Buy from RBC Capital,TipRanks,/news/stocks/camden-property-cpt-gets-a-buy-from-rbc-capital-1033333532,positive,0.5873645544052124
320,5/6/2024 1:47:48 PM,Camden Property Trust upgraded to Neutral at Piper on Sunbelt job strength,Seeking Alpha,https://seekingalpha.com/news/4100332-camden-property-trust-upgraded-to-neutral-at-piper-on-sunbelt-job-strength?utm_source=businessinsider&utm_medium=referral&feed_item_type=news,negative,0.9264196753501892
321,5/6/2024 2:45:35 PM,Mid-America Apartment Communities raised to Outperform at Wedbush,Seeking Alpha,https://seekingalpha.com/news/4100381-mid-america-apartment-communities-raised-to-outperform-at-wedbush?utm_source=businessinsider&utm_medium=referral&feed_item_type=news,negative,0.9202998876571655
322,5/11/2024 4:00:40 PM,Real estate stocks continue to outperform broader markets with increased chances of rate cut,Seeking Alpha,https://seekingalpha.com/news/4104905-real-estate-stocks-continue-to-outperform-broader-markets-with-increased-chances-of-rate-cut?utm_source=businessinsider&utm_medium=referral&feed_item_type=news,negative,0.9043664336204529
323,5/15/2024 9:04:04 PM,"Eminence Capital's Q1 moves include adding MNDY, J, exiting SCHW, FROG",Seeking Alpha,https://seekingalpha.com/news/4106996-eminence-capitals-q1-moves-include-adding-mndy-j-exiting-schw-frog?utm_source=businessinsider&utm_medium=referral&feed_item_type=news,positive,0.9194112420082092
324,5/18/2024 4:00:35 PM,Real estate stocks continue to surge as soft inflation reports fuel rate cut hopes,Seeking Alpha,https://seekingalpha.com/news/4108101-real-estate-stocks-continue-to-surge-as-soft-inflation-reports-fuel-rate-cut-hopes?utm_source=businessinsider&utm_medium=referral&feed_item_type=news,negative,0.8221266865730286
325,5/21/2024 6:24:54 PM,Apartment REITs see marginal increase in Q1 occupancy rates,Seeking Alpha,https://seekingalpha.com/news/4108996-apartment-reits-see-marginal-increase-in-q1-occupancy-rates?utm_source=businessinsider&utm_medium=referral&feed_item_type=news,neutral,0.7623062133789062
326,5/25/2024 4:00:52 PM,Real estate stocks fall after 4 weeks of gain as rate cut hopes dampen,Seeking Alpha,https://seekingalpha.com/news/4110470-real-estate-stocks-fall-after-4-weeks-of-gain-as-rate-cut-hopes-dampen?utm_source=businessinsider&utm_medium=referral&feed_item_type=news,neutral,0.9494156837463379
327,5/30/2024 7:01:16 PM,What 13 Analyst Ratings Have To Say About Camden Prop Trust,Benzinga,/news/stocks/what-13-analyst-ratings-have-to-say-about-camden-prop-trust-1033437379,positive,0.9435250759124756
328,5/31/2024 3:04:46 AM,Wells Fargo Keeps Their Sell Rating on Camden Property (CPT),TipRanks,/news/stocks/wells-fargo-keeps-their-sell-rating-on-camden-property-cpt-1033439806,positive,0.9031763672828674
329,6/1/2024 4:00:53 PM,Real estate stocks gain after inflation report even as major market averages lose,Seeking Alpha,https://seekingalpha.com/news/4112128-real-estate-stocks-gain-after-inflation-report-even-as-major-market-averages-lose?utm_source=businessinsider&utm_medium=referral&feed_item_type=news,negative,0.7465499639511108
330,6/13/2024 5:05:41 PM,Short interest in S&P 500 real estate names ticks up to 2.09%,Seeking Alpha,https://seekingalpha.com/news/4115797-sp-500-real-estate-stocks-increase-short-position-by-8-basis-points-at-may-end?utm_source=businessinsider&utm_medium=referral&feed_item_type=news,negative,0.7657768130302429
331,6/14/2024 8:25:09 PM,Camden Property Trust declares $1.03 dividend,Seeking Alpha,https://seekingalpha.com/news/4116409-camden-property-trust-declares-1_03-dividend?utm_source=businessinsider&utm_medium=referral&feed_item_type=news,positive,0.9368292689323425
332,6/17/2024 5:00:46 PM,Breaking Down Camden Prop Trust: 13 Analysts Share Their Views,Benzinga,/news/stocks/breaking-down-camden-prop-trust-13-analysts-share-their-views-1033484370,positive,0.8446601629257202
333,6/18/2024 12:20:31 PM,Analysts Offer Insights on Real Estate Companies: Cellnex Telecom SA (OtherCLNXF) and Camden Property (CPT),TipRanks,/news/stocks/analysts-offer-insights-on-real-estate-companies-cellnex-telecom-sa-otherclnxf-and-camden-property-cpt-1033487870,positive,0.9136594533920288
334,6/21/2024 11:12:11 AM,Mortgage portability: A solution to the housing market's 'lock-in effect'?,Seeking Alpha,https://seekingalpha.com/news/4117865-mortgage-portability-a-solution-to-the-housing-markets-lock-in-effect?utm_source=businessinsider&utm_medium=referral&feed_item_type=news,positive,0.8328313231468201
335,6/22/2024 4:00:23 PM,"Real estate stocks edge down, while major market averages gain marginally",Seeking Alpha,https://seekingalpha.com/news/4118148-real-estate-stocks-edge-down-while-major-market-averages-gain-marginally?utm_source=businessinsider&utm_medium=referral&feed_item_type=news,neutral,0.9715462327003479
336,7/6/2024 4:01:39 PM,Big real estate stocks kick off H2 with loss as state of the sector weighs on sentiment,Seeking Alpha,https://seekingalpha.com/news/4122445-big-real-estate-stocks-kick-off-h2-with-loss-as-state-of-the-sector-weighs-on-sentiment?utm_source=businessinsider&utm_medium=referral&feed_item_type=news,neutral,0.9274460673332214
337,7/11/2024 10:25:14 PM,Buy Rating Affirmed for Camden Property Trust on Strong Financials and Strategic Market Positioning,TipRanks,/news/stocks/buy-rating-affirmed-for-camden-property-trust-on-strong-financials-and-strategic-market-positioning-1033548759,negative,0.9520307779312134
338,7/12/2024 8:09:01 PM,DOJ takes aim at software used by apartment landlords for rent pricing - report (updated),Seeking Alpha,https://seekingalpha.com/news/4124048-doj-takes-aim-at-software-used-by-apartment-landlords-for-rent-pricing-report?utm_source=businessinsider&utm_medium=referral&feed_item_type=news,positive,0.9371086955070496
339,7/13/2024 4:00:00 PM,Real estate stocks post the largest gain among S&P 500 sectors,Seeking Alpha,https://seekingalpha.com/news/4124105-real-estate-stocks-post-the-largest-gain-among-sp-500-sectors?utm_source=businessinsider&utm_medium=referral&feed_item_type=news,negative,0.9182342290878296
340,7/15/2024 12:25:53 PM,Camden Property (CPT) Gets a Hold from Morgan Stanley,TipRanks,/news/stocks/camden-property-cpt-gets-a-hold-from-morgan-stanley-1033556093,positive,0.9075990915298462
341,7/16/2024 2:07:00 PM,Most shorted S&P 500 real estate stocks in June,Seeking Alpha,https://seekingalpha.com/news/4124400-short-interest-in-major-real-estate-stocks-rise-host-hotels-resorts-iron-mountain-in-most-shorted?utm_source=businessinsider&utm_medium=referral&feed_item_type=news,positive,0.8024479746818542
342,7/18/2024 10:00:34 PM,Evaluating Camden Prop Trust: Insights From 13 Financial Analysts,Benzinga,/news/stocks/evaluating-camden-prop-trust-insights-from-13-financial-analysts-1033570081,positive,0.832543134689331
343,7/20/2024 4:00:06 PM,Real estate stocks gain as traders look for alternatives to tech stocks,Seeking Alpha,https://seekingalpha.com/news/4126040-real-estate-stocks-gain-as-traders-look-for-alternatives-to-tech-stocks?utm_source=businessinsider&utm_medium=referral&feed_item_type=news,neutral,0.7128673195838928
344,7/27/2024 4:00:52 PM,Real estate stocks advance as sentiments favor possible rally,Seeking Alpha,https://seekingalpha.com/news/4129240-real-estate-stocks-advance-as-sentiments-favor-possible-rally?utm_source=businessinsider&utm_medium=referral&feed_item_type=news,negative,0.6151928305625916
345,7/31/2024 3:01:13 PM,Camden Property Trust is about to announce earnings — here's what Wall Street expects,Markets Insider Automation,/news/stocks/camden_property_trust-q2-quarterly-earnings-preview-1033618008,positive,0.9299931526184082
346,7/31/2024 9:35:22 PM,Camden Property Trust Q2 2024 Earnings Preview,Seeking Alpha,https://seekingalpha.com/news/4131322-camden-property-trust-q2-2024-earnings-preview?utm_source=businessinsider&utm_medium=referral&feed_item_type=news,positive,0.8581116795539856
347,8/1/2024 8:29:29 PM,"Camden Property Trust FFO of $1.71 beats by $0.04, revenue of $387.15M beats by $1.73M",Seeking Alpha,https://seekingalpha.com/news/4132618-camden-property-trust-ffo-of-1_71-beats-0_04-revenue-of-387_15m-beats-1_73m?utm_source=businessinsider&utm_medium=referral&feed_item_type=news,positive,0.7172711491584778
348,8/1/2024 10:25:22 PM,Camden Property Trust: A Balanced Perspective Amidst Financial Gains and Market Challenges,TipRanks,/news/stocks/camden-property-trust-a-balanced-perspective-amidst-financial-gains-and-market-challenges-1033629403,positive,0.5482137799263
349,8/2/2024 1:03:24 AM,Camden Property Trust Q2 FFO Rises ,RTTNews,/news/stocks/camden-property-trust-q2-ffo-rises-1033629328,positive,0.9425663948059082
350,8/2/2024 8:42:52 AM,Camden Property Trust Q2 FFO Rises ,RTTNews,/news/stocks/camden-property-trust-q2-ffo-rises-1033630344,positive,0.9425663948059082
351,8/2/2024 11:01:20 AM,Camden Property (CPT) Receives a Hold from Piper Sandler,TipRanks,/news/stocks/camden-property-cpt-receives-a-hold-from-piper-sandler-1033632700,positive,0.7659847140312195
352,8/2/2024 11:33:32 AM,"Analysts Offer Insights on Real Estate Companies: Tanger Factory (SKT), Camden Property (CPT) and Park Hotels & Resorts (PK)",TipRanks,/news/stocks/analysts-offer-insights-on-real-estate-companies-tanger-factory-skt-camden-property-cpt-and-park-hotels-resorts-pk-1033632913,positive,0.9265608787536621
353,8/2/2024 11:51:32 AM,Truist Financial Keeps Their Buy Rating on Camden Property (CPT),TipRanks,/news/stocks/truist-financial-keeps-their-buy-rating-on-camden-property-cpt-1033632991,positive,0.888645350933075
354,8/2/2024 12:46:17 PM,Camden Property (CPT) Receives a Buy from Stifel Nicolaus,TipRanks,/news/stocks/camden-property-cpt-receives-a-buy-from-stifel-nicolaus-1033633420,negative,0.5259849429130554
355,8/2/2024 12:55:10 PM,Camden Property (CPT) Receives a Hold from Evercore ISI,TipRanks,/news/stocks/camden-property-cpt-receives-a-hold-from-evercore-isi-1033633345,positive,0.8669725656509399
356,8/2/2024 2:45:01 PM,Camden Property Trust hosts conference call for investors,Markets Insider Automation,/news/stocks/camden_property_trust_conference-1030850243,positive,0.9370947480201721
357,8/3/2024 4:00:34 PM,Real estate stocks advance even as hard landing fears impact major market averages,Seeking Alpha,https://seekingalpha.com/news/4133670-real-estate-stocks-advance-even-as-hard-landing-fears-impact-major-market-averages?utm_source=businessinsider&utm_medium=referral&feed_item_type=news,neutral,0.5803545713424683
358,8/5/2024 6:39:32 AM,Buy Rating Affirmed for Camden Property Trust Amid Strong NOI and Positive Market Trends,TipRanks,/news/stocks/buy-rating-affirmed-for-camden-property-trust-amid-strong-noi-and-positive-market-trends-1033637915,negative,0.9496341943740845
359,8/5/2024 8:18:54 AM,Maintaining Hold on Camden Property Trust Amid Mixed Financial Signals and Market Dynamics,TipRanks,/news/stocks/maintaining-hold-on-camden-property-trust-amid-mixed-financial-signals-and-market-dynamics-1033638413,neutral,0.9340420365333557
360,8/5/2024 10:36:31 AM,RBC Capital Keeps Their Buy Rating on Camden Property (CPT),TipRanks,/news/stocks/rbc-capital-keeps-their-buy-rating-on-camden-property-cpt-1033639368,positive,0.911566436290741
361,8/6/2024 5:06:34 PM,Camden Property Trust: Strong Acquisition Strategy and Financial Resilience Justify Buy Rating,TipRanks,/news/stocks/camden-property-trust-strong-acquisition-strategy-and-financial-resilience-justify-buy-rating-1033647363,negative,0.8925365209579468
362,8/8/2024 11:45:00 AM,3 REITs to Sell Before You Regret It,InvestorPlace,/news/stocks/3-reits-to-sell-before-you-regret-it-1033660207,positive,0.9312732815742493
363,8/10/2024 4:00:33 PM,Real estate stocks close a volatile week roughly flat,Seeking Alpha,https://seekingalpha.com/news/4138385-real-estate-stocks-close-a-volatile-week-roughly-flat?utm_source=businessinsider&utm_medium=referral&feed_item_type=news,neutral,0.9017971158027649
364,8/12/2024 2:13:26 PM,Camden Property Trust up after Bank of America double upgrades on valuation,Seeking Alpha,https://seekingalpha.com/news/4138652-camden-property-trust-up-after-bank-of-america-double-upgrades-on-valuation?utm_source=businessinsider&utm_medium=referral&feed_item_type=news,negative,0.867341160774231
365,8/15/2024 12:26:01 PM,Camden Property (CPT) Gets a Hold from Morgan Stanley,TipRanks,/news/stocks/camden-property-cpt-gets-a-hold-from-morgan-stanley-1033696042,positive,0.9075990915298462
366,8/17/2024 4:00:44 PM,Real estate stocks eke out gains as the sector gears up for changes,Seeking Alpha,https://seekingalpha.com/news/4141252-real-stocks-eke-out-gains-as-the-sector-gears-up-for-changes?utm_source=businessinsider&utm_medium=referral&feed_item_type=news,negative,0.8846331238746643
367,8/23/2024 3:22:02 PM,Justice Department sues apartment rent software firm for antitrust violations (updated),Seeking Alpha,https://seekingalpha.com/news/4143344-justice-department-set-to-file-antitrust-suit-against-apartment-rent-software-firm?utm_source=businessinsider&utm_medium=referral&feed_item_type=news,neutral,0.8812220096588135
368,8/23/2024 7:25:23 PM,Buy Rating Justified: Camden Property Trust’s Promising Valuation and Growth Outlook,TipRanks,/news/stocks/buy-rating-justified-camden-property-trust-s-promising-valuation-and-growth-outlook-1033719273,negative,0.910344123840332
369,8/24/2024 4:00:15 PM,Rate-sensitive real estate stocks outperform broader markets,Seeking Alpha,https://seekingalpha.com/news/4143529-rate-sensitive-real-estate-stocks-outperform-broader-markets?utm_source=businessinsider&utm_medium=referral&feed_item_type=news,neutral,0.6739926934242249
370,8/26/2024 9:36:10 AM,Camden Property (CPT) was upgraded to a Hold Rating at Wells Fargo,TipRanks,/news/stocks/camden-property-cpt-was-upgraded-to-a-hold-rating-at-wells-fargo-1033721835,negative,0.9023092985153198
371,8/26/2024 12:59:45 PM,"Mid-America Apartment, Camden Property, AMH upgraded at Wells Fargo; INVH cut",Seeking Alpha,https://seekingalpha.com/news/4143684-mid-america-apartment-camden-property-amh-upgraded-at-wells-fargo-invh-cut?utm_source=businessinsider&utm_medium=referral&feed_item_type=news,positive,0.5116004347801208
372,8/31/2024 4:00:59 PM,"Real estate stocks surge in August, set to rebound after underperformance",Seeking Alpha,https://seekingalpha.com/news/4145746-real-estate-stocks-surge-in-august-set-to-rebound-after-underperformance?utm_source=businessinsider&utm_medium=referral&feed_item_type=news,negative,0.9052305817604065
373,9/5/2024 8:29:43 PM,Camden Property Trust same-property occupancy rate rises in Q3-to-date,Seeking Alpha,https://seekingalpha.com/news/4147493-camden-property-trust-same-property-occupancy-rate-rises-in-q3-to-date?utm_source=businessinsider&utm_medium=referral&feed_item_type=news,negative,0.8915063738822937
374,9/7/2024 4:00:39 PM,Real estate stocks start one of the worst months for equities on a strong note,Seeking Alpha,https://seekingalpha.com/news/4147827-real-estate-stocks-start-one-of-the-worst-months-for-equities-on-a-strong-note?utm_source=businessinsider&utm_medium=referral&feed_item_type=news,neutral,0.8873625993728638
375,9/9/2024 3:45:13 PM,Camden Property Trust gets downgrade from RBC on peak leasing season,Seeking Alpha,https://seekingalpha.com/news/4148074-camden-property-trust-gets-downgrade-from-rbc-on-peak-leasing-season?utm_source=businessinsider&utm_medium=referral&feed_item_type=news,neutral,0.9572475552558899
376,9/11/2024 9:00:31 AM,Wells Fargo Keeps Their Hold Rating on Camden Property (CPT),TipRanks,/news/stocks/wells-fargo-keeps-their-hold-rating-on-camden-property-cpt-1033763696,positive,0.912320077419281
377,9/16/2024 8:22:21 PM,Camden Property Trust declares $1.03 dividend,Seeking Alpha,https://seekingalpha.com/news/4150100-camden-property-trust-declares-1_03-dividend?utm_source=businessinsider&utm_medium=referral&feed_item_type=news,positive,0.9368292689323425
378,9/26/2024 7:36:10 AM,SA Chart: Which sector will benefit the most from interest rate cuts?,Seeking Alpha,https://seekingalpha.com/news/4153512-sa-chart-which-sector-will-benefit-the-most-from-interest-rate-cuts?utm_source=businessinsider&utm_medium=referral&feed_item_type=news,positive,0.7801177501678467
379,10/5/2024 4:00:35 PM,Real estate stocks end in red amid geopolitical tensions,Seeking Alpha,https://seekingalpha.com/news/4156586-real-estate-stocks-end-in-red-amid-geopolitical-tensions?utm_source=businessinsider&utm_medium=referral&feed_item_type=news,neutral,0.9649845957756042
380,10/10/2024 7:17:22 PM,"A look at real estate stocks after housing inflation moderates, mortgages rise",Seeking Alpha,https://seekingalpha.com/news/4157636-a-look-at-real-estate-stocks-after-housing-inflation-moderates-mortgages-rise?utm_source=businessinsider&utm_medium=referral&feed_item_type=news,positive,0.8989371061325073
381,10/11/2024 8:45:18 AM,Hold Recommendation for Camden Property Trust Amidst Sunbelt Rental Market Pressures and Full Valuation,TipRanks,/news/stocks/hold-recommendation-for-camden-property-trust-amidst-sunbelt-rental-market-pressures-and-full-valuation-1033838301,neutral,0.7397753000259399
382,10/12/2024 4:00:37 PM,REITs drag real estate stocks down,Seeking Alpha,https://seekingalpha.com/news/4158054-reits-drag-real-estate-stocks-down?utm_source=businessinsider&utm_medium=referral&feed_item_type=news,neutral,0.9643407464027405
383,10/26/2024 4:00:13 PM,Real estate stocks down amid not-so-impressive earnings,Seeking Alpha,https://seekingalpha.com/news/4209294-real-estate-stocks-down-amid-not-so-impressive-earnings?utm_source=businessinsider&utm_medium=referral&feed_item_type=news,neutral,0.9609991908073425
384,10/30/2024 9:35:12 PM,Camden Property Trust Q3 2024 Earnings Preview,Seeking Alpha,https://seekingalpha.com/news/4225034-camden-property-trust-q3-2024-earnings-preview?utm_source=businessinsider&utm_medium=referral&feed_item_type=news,positive,0.8479475975036621
385,10/31/2024 2:00:00 PM,Here are the major earnings after the close today,Seeking Alpha,https://seekingalpha.com/news/4223336-here-are-the-major-earnings-after-the-close-today?utm_source=businessinsider&utm_medium=referral&feed_item_type=news,positive,0.9299408793449402
386,10/31/2024 8:17:46 PM,"Camden Property Trust FFO of $1.71 beats by $0.03, revenue of $387.23M misses by $2.19M",Seeking Alpha,https://seekingalpha.com/news/4231521-camden-property-trust-ffo-of-1_71-beats-0_03-revenue-of-387_23m-misses-2_19m?utm_source=businessinsider&utm_medium=referral&feed_item_type=news,positive,0.8286269307136536
387,10/31/2024 8:25:30 PM,"Camden Property sees FY24 core FFO $6.79-$6.83, consensus $6.78",TipRanks,/news/stocks/camden-property-sees-fy24-core-ffo-6-79--6-83-consensus-6-78-1033931823,positive,0.8315345048904419
388,10/31/2024 8:25:55 PM,Camden Property sees Q4 core FFO $1.68-$1.72,TipRanks,/news/stocks/camden-property-sees-q4-core-ffo-1-68--1-72-1033931818,negative,0.6207898855209351
389,10/31/2024 8:27:32 PM,"Camden Property reports Q3 core AFFO $1.48, consensus $1.68",TipRanks,/news/stocks/camden-property-reports-q3-core-affo-1-48-consensus-1-68-1033931805,positive,0.8543276190757751
390,10/31/2024 8:49:26 PM,Camden Property Trust lifts core FFO guidance midpoint after mixed Q3 results,Seeking Alpha,https://seekingalpha.com/news/4231606-camden-property-trust-lifts-core-ffo-guidance-midpoint-after-mixed-q-3-results?utm_source=businessinsider&utm_medium=referral&feed_item_type=news,negative,0.8515499234199524
391,10/31/2024 10:02:30 PM,Camden Property Q3 FFO Declines ,RTTNews,/news/stocks/camden-property-q3-ffo-declines-1033931483,positive,0.7595657706260681
392,10/31/2024 11:35:19 PM,Camden Property’s Hold Rating: Balancing Positive Occupancy Trends and Declining Lease Rates Amid Earnings Headwinds,TipRanks,/news/stocks/camden-property-s-hold-rating-balancing-positive-occupancy-trends-and-declining-lease-rates-amid-earnings-headwinds-1033932114,neutral,0.6440514326095581
393,11/1/2024 11:32:01 AM,"Analysts Offer Insights on Real Estate Companies: Camden Property (CPT), Pebblebrook Hotel (PEB) and Ohmyhome Limited (OMH)",TipRanks,/news/stocks/analysts-offer-insights-on-real-estate-companies-camden-property-cpt-pebblebrook-hotel-peb-and-ohmyhome-limited-omh-1033937151,positive,0.9286704659461975
394,11/1/2024 11:50:50 AM,"Analysts Conflicted on These Real Estate Names: Kimco Realty (KIM), Camden Property (CPT) and Cubesmart (CUBE)",TipRanks,/news/stocks/analysts-conflicted-on-these-real-estate-names-kimco-realty-kim-camden-property-cpt-and-cubesmart-cube-1033937210,neutral,0.5087247490882874
395,11/1/2024 11:56:35 AM,Balanced Outlook for Camden Property Amid Growth Concerns and Impairment Challenges,TipRanks,/news/stocks/balanced-outlook-for-camden-property-amid-growth-concerns-and-impairment-challenges-1033937181,negative,0.9247993230819702
396,11/1/2024 12:05:55 PM,Camden Property: Hold Rating Amid Strategic Hesitations and Moderate Performance,TipRanks,/news/stocks/camden-property-hold-rating-amid-strategic-hesitations-and-moderate-performance-1033937656,neutral,0.8264145255088806
397,11/1/2024 12:10:50 PM,"Analysts’ Opinions Are Mixed on These Real Estate Stocks: Camden Property (CPT), Compass (COMP) and American Homes (AMH)",TipRanks,/news/stocks/analysts-opinions-are-mixed-on-these-real-estate-stocks-camden-property-cpt-compass-comp-and-american-homes-amh-1033937611,neutral,0.7910160422325134
398,11/1/2024 12:38:05 PM,Evercore ISI Reaffirms Their Hold Rating on Camden Property (CPT),TipRanks,/news/stocks/evercore-isi-reaffirms-their-hold-rating-on-camden-property-cpt-1033937838,positive,0.8676608800888062
399,11/2/2024 3:55:45 AM,Camden Property Trust Reports Q3 Earnings and Strategic Updates,TipRanks,/news/stocks/camden-property-trust-reports-q3-earnings-and-strategic-updates-1033939360,positive,0.8766469955444336
400,11/4/2024 7:46:30 AM,Camden Property: Strategic Positioning and Discounted Valuation Support Long-term Buy Rating,TipRanks,/news/stocks/camden-property-strategic-positioning-and-discounted-valuation-support-long-term-buy-rating-1033943102,negative,0.7565699815750122
401,11/4/2024 12:49:39 PM,Camden Property (CPT) Receives a Hold from RBC Capital,TipRanks,/news/stocks/camden-property-cpt-receives-a-hold-from-rbc-capital-1033945313,positive,0.8425047397613525
402,11/4/2024 3:00:46 PM,Camden Property price target lowered to $127 from $131 at RBC Capital,TipRanks,/news/stocks/camden-property-price-target-lowered-to-127-from-131-at-rbc-capital-1033946296,neutral,0.8751975297927856
403,11/4/2024 8:45:12 PM,Camden Property Trust’s Strategic Expansion and Strong Financial Performance Justify Buy Rating,TipRanks,/news/stocks/camden-property-trust-s-strategic-expansion-and-strong-financial-performance-justify-buy-rating-1033947301,negative,0.8931556344032288
404,11/9/2024 5:00:11 PM,"Real estate stocks advance on rate cut, election results not-so-positive",Seeking Alpha,https://seekingalpha.com/news/4269488-real-estate-stocks-advance-on-rate-cut-election-results-prove-negative?utm_source=businessinsider&utm_medium=referral&feed_item_type=news,negative,0.6418121457099915
405,11/11/2024 12:11:43 PM,Camden Property price target raised to $130 from $128 at Piper Sandler,TipRanks,/news/stocks/camden-property-price-target-raised-to-130-from-128-at-piper-sandler-1033992719,negative,0.9456773400306702
406,11/12/2024 6:15:21 PM,Supreme Court turns away appeals on New York's rent control system,Seeking Alpha,https://seekingalpha.com/news/4281170-supreme-court-turns-away-appeals-on-new-yorks-rent-control-system?utm_source=businessinsider&utm_medium=referral&feed_item_type=news,neutral,0.9059540629386902
407,11/12/2024 10:07:51 PM,Camden Property downgraded to Hold from Buy at Stifel,TipRanks,/news/stocks/camden-property-downgraded-to-hold-from-buy-at-stifel-1034003159,neutral,0.4866790175437927
