,datetime,title,source,link,sentiment_class,sentiment_score
0,10/27/2016 11:16:20 PM,BRIEF-Camden Property Trust announces Q3 2016 operating results (CPT),Reuters,http://www.businessinsider.com/r-brief-camden-property-trust-announces-q3-2016-operating-results-2016-10,positive,0.8433548808097839
1,2/7/2017 10:58:39 PM,Camden Property Trust Q4 Profit Drops 2%,RTTNews,/news/stocks/camden-property-trust-q4-profit-drops-2-1001730988,neutral,0.9716137647628784
2,2/7/2017 11:19:44 PM,Camden Property Trust Issues Earnings Guidance - Quick Facts ,RTTNews,/news/stocks/camden-property-trust-issues-earnings-guidance-quick-facts-1001731044,positive,0.9394989013671875
3,3/21/2017 12:45:00 PM,"How These REIT Stocks are Faring? -- Capstead, American Campus, Camden, and EdR",PR Newswire,/news/stocks/how-these-reit-stocks-are-faring-capstead-american-campus-camden-and-edr-1001853475,positive,0.9228196740150452
4,5/4/2017 11:33:24 PM,Camden Property Trust Reveals 10% Decline In Q1 Bottom Line,RTTNews,/news/stocks/camden-property-trust-reveals-10-decline-in-q1-bottom-line-1001981767,neutral,0.9751596450805664
5,5/5/2017 1:00:05 AM,BRIEF-Camden Property Trust qtrly earnings per share $0.39 (CPT),Reuters,http://www.businessinsider.com/r-brief-camden-property-trust-qtrly-earnings-per-share-039-2017-5,positive,0.785297691822052
6,5/12/2017 1:10:00 PM,"Research Reports Coverage on REIT Stocks -- Camden Property Trust, Independence Realty Trust, ARMOUR Residential REIT, and EdR",PR Newswire,/news/stocks/research-reports-coverage-on-reit-stocks-camden-property-trust-independence-realty-trust-armour-residential-reit-and-edr-1002007915,positive,0.9456719756126404
7,5/15/2017 6:40:05 PM,"BRIEF-Camden Property Trust files for potential mixed shelf offfering, size not disclosed (CPT)",Reuters,http://www.businessinsider.com/r-brief-camden-property-trust-files-for-potential-mixed-shelf-offfering-size-not-disclosed-2017-5,positive,0.7664452195167542
8,6/27/2017 1:05:00 PM,"Stock Performance Review on REIT Industry -- AvalonBay Communities, Capstead Mortgage, Camden Property Trust, and EdR",PR Newswire,/news/stocks/stock-performance-review-on-reit-industry-avalonbay-communities-capstead-mortgage-camden-property-trust-and-edr-1002126890,positive,0.9374986886978149
9,7/27/2017 11:25:11 PM,Camden Property Trust Q2 Earnings Decline 1%,RTTNews,/news/stocks/camden-property-trust-q2-earnings-decline-1-1002212695,neutral,0.9707505702972412
10,8/9/2017 12:30:00 PM,"Today's Research Report Coverage on REIT Stocks -- AvalonBay Communities, Capstead Mortgage, Camden Property Trust, and EdR",PR Newswire,/news/stocks/today-s-research-report-coverage-on-reit-stocks-avalonbay-communities-capstead-mortgage-camden-property-trust-and-edr-1002243809,positive,0.9499093890190125
11,8/28/2017 6:12:09 PM,BRIEF-Camden Property Trust provides update on impact from Hurricane Harvey (CPT),Reuters,http://www.businessinsider.com/r-brief-camden-property-trust-provides-update-on-impact-from-hurricane-harvey-2017-8,positive,0.9221943616867065
12,9/5/2017 11:07:15 PM,BRIEF-Camden Property Q3 to incur $2.5-$3 mln in costs due to Hurricane Harvey​ (CPT),Reuters,http://www.businessinsider.com/r-brief-camden-property-q3-to-incur-25-3-mln-in-costs-due-to-hurricane-harvey-2017-9,neutral,0.9640307426452637
13,9/12/2017 6:02:26 AM,Camden Property Trust Prices Public Offering Of 4.75 Mln Shares For $445.3 Mln ,RTTNews,/news/stocks/camden-property-trust-prices-public-offering-of-4-75-mln-shares-for-445-3-mln-1002359946,positive,0.9287174940109253
14,9/18/2017 10:32:07 PM,BRIEF-Camden Property Trust provides update on projected expenses related to Hurricane Irma (CPT),Reuters,http://www.businessinsider.com/r-brief-camden-property-trust-provides-update-on-projected-expenses-related-to-hurricane-irma-2017-9,positive,0.8524045944213867
15,9/26/2017 2:00:00 PM,Veritas Announces 2017 Americas Partner Award Winners,PR Newswire,/news/stocks/veritas-announces-2017-americas-partner-award-winners-510873,positive,0.7679868936538696
16,10/26/2017 10:53:19 PM,EARNINGS SUMMARY: Details of Camden Property Trust Q3 Earnings Report,RTTNews,/news/stocks/earnings-summary-details-of-camden-property-trust-q3-earnings-report-1005747969,positive,0.9204683303833008
17,10/26/2017 11:41:53 PM,Camden Lowers 2017 Earnings Guidance - Quick Facts ,RTTNews,/news/stocks/camden-lowers-2017-earnings-guidance-quick-facts-1005752784,neutral,0.6185050010681152
18,2/1/2018 10:44:28 PM,EARNINGS SUMMARY: Details of Camden Property Trust Q4 Earnings Report,RTTNews,/news/stocks/earnings-summary-details-of-camden-property-trust-q4-earnings-report-1014838181,positive,0.9172120690345764
19,5/3/2018 10:40:41 PM,Camden Property Trust Q1 adjusted earnings of $1.04 per share,RTTNews,/news/stocks/camden-property-trust-q1-adjusted-earnings-of-1-04-per-share-1023305711,positive,0.8798734545707703
20,6/19/2018 2:15:00 PM,IIROC Trading Resumption - BTR; MTO,PR Newswire,/news/stocks/iiroc-trading-resumption-btr;-mto-540069,positive,0.7405948042869568
21,7/31/2018 3:02:53 PM,Here's what Wall Street expects from Camden Property Trust's earnings,Markets Insider Automation,/news/stocks/camden_property_trust-q2-earnings-preview-stock-1027416569,positive,0.9312423467636108
22,10/23/2018 3:02:10 PM,Here's what Wall Street expects from Camden Property Trust's earnings report,Markets Insider Automation,/news/stocks/camden_property_trust-q3-earnings-preview-1027644529,positive,0.8981812000274658
23,1/29/2019 3:02:02 PM,Here's what Wall Street expects from Camden Property Trust's earnings,Markets Insider Automation,/news/stocks/camden_property_trust-stock-quarter-earnings-preview-q4-1027905089,positive,0.9312423467636108
24,1/31/2019 10:25:39 PM,Camden Property Trust Q4 adjusted earnings of $0.99 per share,RTTNews,/news/stocks/camden-property-trust-q4-adjusted-earnings-of-0-99-per-share-1027914718,positive,0.8373983502388
25,4/30/2019 3:02:46 PM,Here's what Wall Street expects from Camden Property Trust's earnings report,Markets Insider Automation,/news/stocks/camden_property_trust-stock-quarter-earnings-preview-q1-1028153713,positive,0.8981812000274658
26,5/8/2019 10:49:00 PM,Camden Property Trust -- Moody's announces completion of a periodic review of ratings of Camden Property Trust,Moodys,/news/bonds/camden-property-trust-moody-s-announces-completion-of-a-periodic-review-of-ratings-of-camden-property-trust-1028183760,positive,0.8734441995620728
27,7/17/2019 7:41:00 PM,Camden Property Trust -- Moody's affirms Camden's senior unsecured rating at A3; stable outlook,Moodys,/news/bonds/camden-property-trust-moody-s-affirms-camden-s-senior-unsecured-rating-at-a3-stable-outlook-1028362057,negative,0.9031665325164795
28,7/23/2019 3:02:02 PM,Camden Property Trust earnings: here's what Wall Street expects,Markets Insider Automation,/news/stocks/camden_property_trust-stock-price-q2-earnings-preview-1028376225,positive,0.9312499165534973
29,9/26/2019 7:15:39 PM,7 Rental REITs to Buy Regardless of a Recession,InvestorPlace,/news/stocks/7-rental-reits-to-buy-regardless-of-a-recession-1028558177,positive,0.8863661289215088
30,10/31/2019 9:23:38 PM,Camden Property Trust Q3 adjusted earnings of $1.09 per share,RTTNews,/news/stocks/camden-property-trust-q3-adjusted-earnings-of-1-09-per-share-1028649837,positive,0.8785614371299744
31,1/29/2020 3:02:11 PM,Camden Property Trust earnings preview: what to expect,Markets Insider Automation,/news/stocks/camden_property_trust-q4-earnings-preview-stock-1028855295,positive,0.8915725946426392
32,1/30/2020 10:41:41 PM,Camden Property Trust Q4 adjusted earnings of $1.04 per share,RTTNews,/news/stocks/camden-property-trust-q4-adjusted-earnings-of-1-04-per-share-1028861612,positive,0.8580856919288635
33,3/10/2020 4:46:28 PM,BTIG steps aside on Camden Property,Seeking Alpha,https://seekingalpha.com/news/3550225-btig-steps-aside-on-camden-property?utm_source=markets.businessinsider.com&utm_medium=referral,positive,0.8766698241233826
34,3/26/2020 10:58:00 PM,Camden Property Trust -- Moody's announces completion of a periodic review of ratings of Camden Property Trust,Moodys,/news/bonds/camden-property-trust-moody-s-announces-completion-of-a-periodic-review-of-ratings-of-camden-property-trust-1029037467,positive,0.8734441995620728
35,3/30/2020 3:07:00 PM,Moody's  - US multifamily REITs’ strong credit metrics to buffer them from effects of Covid-19,Moodys,/news/bonds/moody-s-us-multifamily-reits-strong-credit-metrics-to-buffer-them-from-effects-of-covid-19-1029044754,negative,0.9418562650680542
36,4/4/2020 4:24:15 PM,Portland mayor calling for apartment rent dismissal,Seeking Alpha,https://seekingalpha.com/news/3558436-portland-mayor-calling-for-apartment-rent-dismissal?utm_source=markets.businessinsider.com&utm_medium=referral,positive,0.8048145771026611
37,4/16/2020 8:49:07 PM,Camden Property prices $750M note offering,Seeking Alpha,https://seekingalpha.com/news/3561504-camden-property-prices-750m-note-offering?utm_source=markets.businessinsider.com&utm_medium=referral,positive,0.9084591269493103
38,4/27/2020 1:54:51 PM,May apartment rent strike focuses on legislative relief during pandemic,Seeking Alpha,https://seekingalpha.com/news/3564651-may-apartment-rent-strike-focuses-on-legislative-relief-during-pandemic?utm_source=markets.businessinsider.com&utm_medium=referral,neutral,0.6040648221969604
39,5/7/2020 3:02:03 PM,Camden Property Trust is about to announce earnings — here's what Wall Street expects,Markets Insider Automation,/news/stocks/camden_property_trust-q1-quarterly-earnings-preview-1029177228,positive,0.9299931526184082
40,5/7/2020 10:46:59 PM,Camden Property Trust Q1 adjusted earnings Beat Estimates,RTTNews,/news/stocks/camden-property-trust-q1-adjusted-earnings-beat-estimates-1029180136,negative,0.8431875109672546
41,5/26/2020 5:02:45 PM,Luxury apartment REITs ride out pandemic so far,Seeking Alpha,https://seekingalpha.com/news/3577606-luxury-apartment-reits-ride-out-pandemic-far?utm_source=markets.businessinsider.com&utm_medium=referral,neutral,0.5554012060165405
42,6/16/2020 6:48:28 PM,Want To Buy The Best REITs? Here Are 5 New Picks from LaSalle,InvestorPlace,/news/stocks/confused-about-the-best-reit-stocks-check-out-lasalles-picks-1029314841,positive,0.9182315468788147
43,7/29/2020 3:03:02 PM,Here's what Wall Street expects from Camden Property Trust's earnings,Markets Insider Automation,/news/stocks/camden_property_trust-quarter-earnings-preview-q2-1029445477,positive,0.9312423467636108
44,7/30/2020 10:58:45 PM,Camden Property Trust Q2 adjusted earnings Beat Estimates,RTTNews,/news/stocks/camden-property-trust-q2-adjusted-earnings-beat-estimates-1029453184,negative,0.8226233124732971
45,9/4/2020 11:00:51 PM,"Revisiting models shows concerns seem overblown on residential REITs, JPM says",Seeking Alpha,https://seekingalpha.com/news/3611894-revisiting-models-shows-concerns-seem-overblown-on-residential-reits-jpm-says?utm_source=markets.businessinsider.com&utm_medium=referral,neutral,0.8714131116867065
46,10/20/2020 1:13:58 PM,U.S. Home Prices grow 7.8% through Q3 end; notable companies performance,Seeking Alpha,https://seekingalpha.com/news/3623673-u-s-home-prices-grow-7_8-through-q3-end-notable-companies-performance?utm_source=markets.businessinsider.com&utm_medium=referral,positive,0.566672682762146
47,10/21/2020 9:39:52 PM,Housing demand off the charts right now: RE/MAX September Report,Seeking Alpha,https://seekingalpha.com/news/3624567-housing-demand-off-charts-right-now-re-max-september-report?utm_source=markets.businessinsider.com&utm_medium=referral,neutral,0.9442154169082642
48,10/26/2020 4:48:57 PM,"Gateway REITs may rise on Biden win, Sunbelt REITs on Trump victory: Mizuho",Seeking Alpha,https://seekingalpha.com/news/3625388-gateway-reits-may-rise-on-biden-win-sunbelt-reits-on-trump-victory-mizuho?utm_source=markets.businessinsider.com&utm_medium=referral,positive,0.7017500400543213
49,10/28/2020 3:04:57 PM,Camden Property Trust earnings preview: what Wall Street is expecting,Markets Insider Automation,/news/stocks/camden_property_trust-q3-earnings-preview-1029734682,positive,0.9081886410713196
50,10/28/2020 9:35:24 PM,Camden Property Trust Q3 Earnings Preview,Seeking Alpha,https://seekingalpha.com/news/3627468-camden-property-trust-q3-earnings-preview?utm_source=markets.businessinsider.com&utm_medium=referral,positive,0.7337780594825745
51,10/29/2020 8:57:57 PM,"Camden Property Trust FFO beats by $0.07, beats on revenue",Seeking Alpha,https://seekingalpha.com/news/3628744-camden-property-trust-ffo-beats-0_07-beats-on-revenue?utm_source=markets.businessinsider.com&utm_medium=referral,negative,0.8881232142448425
52,10/29/2020 9:31:59 PM,Camden Property Trust Q3 adjusted earnings Beat Estimates,RTTNews,/news/stocks/camden-property-trust-q3-adjusted-earnings-beat-estimates-1029743806,negative,0.816738486289978
53,10/30/2020 11:02:42 PM,"Mizuho closes door on multifamily REIT season, naming picks",Seeking Alpha,https://seekingalpha.com/news/3629320-mizuho-closes-door-on-multifamily-reit-season-naming-picks?utm_source=markets.businessinsider.com&utm_medium=referral,positive,0.5098670125007629
54,11/10/2020 3:02:43 PM,"Mizuho upgrades Essex Property, making coastal bet on apartment REITs",Seeking Alpha,https://seekingalpha.com/news/3634399-mizuho-upgrades-essex-property-making-coastal-bet-on-apartment-reits?utm_source=markets.businessinsider.com&utm_medium=referral,positive,0.6950259208679199
55,11/22/2020 10:01:00 PM,"REITs outperform broader market in past week, with hotels shining brightest",Seeking Alpha,https://seekingalpha.com/news/3638525-reits-outperform-broader-market-in-past-week-hotels-shining-brightest?utm_source=markets.businessinsider.com&utm_medium=referral,negative,0.8645221590995789
56,12/1/2020 9:21:50 PM,Camden Property Trust declares $0.83 dividend,Seeking Alpha,https://seekingalpha.com/news/3640561-camden-property-trust-declares-0_83-dividend?utm_source=markets.businessinsider.com&utm_medium=referral,positive,0.9381778836250305
57,12/9/2020 7:22:49 PM,"Not-yet-agreed-upon relief plan includes extended eviction moratorium, rental aid",Seeking Alpha,https://seekingalpha.com/news/3643035-not-yet-agreed-upon-relief-plan-includes-extended-eviction-moratorium-rental-aid?utm_source=markets.businessinsider.com&utm_medium=referral,positive,0.9247490167617798
58,12/15/2020 12:30:54 AM,"New year looking up for real estate, as Evercore makes 2021 picks for REIT rotation",Seeking Alpha,https://seekingalpha.com/news/3644267-new-year-looking-up-for-real-estate-evercore-makes-2021-picks-for-reit-rotation?utm_source=markets.businessinsider.com&utm_medium=referral,positive,0.5425774455070496
59,12/16/2020 3:43:15 PM,Freddie apartment investment market index rebounds in Q3,Seeking Alpha,https://seekingalpha.com/news/3644939-freddie-apartment-investment-market-index-rebounds-in-q3?utm_source=markets.businessinsider.com&utm_medium=referral,neutral,0.8600921630859375
60,1/20/2021 6:43:16 PM,Real estate stocks gain as new administration begins,Seeking Alpha,https://seekingalpha.com/news/3652805-real-estate-stocks-gain-as-new-administration-begins?utm_source=markets.businessinsider.com&utm_medium=referral,neutral,0.7042022347450256
61,2/2/2021 3:01:46 PM,Camden Property Trust is about to announce its earnings — here's what to expect,Markets Insider Automation,/news/stocks/camden_property_trust-quarter-earnings-preview-q4-1030033161,positive,0.9365274906158447
62,2/3/2021 10:35:01 PM,Camden Property Trust Q4 Earnings Preview,Seeking Alpha,https://seekingalpha.com/news/3657896-camden-property-trust-q4-earnings-preview?utm_source=markets.businessinsider.com&utm_medium=referral,positive,0.7095667123794556
63,2/3/2021 10:35:29 PM,Notable earnings after Thursday's close,Seeking Alpha,https://seekingalpha.com/news/3657840-notable-earnings-after-thursdays-close?utm_source=markets.businessinsider.com&utm_medium=referral,negative,0.8900269269943237
64,2/4/2021 9:39:31 PM,Camden Property Trust declares $0.83 dividend,Seeking Alpha,https://seekingalpha.com/news/3658766-camden-property-trust-declares-0_83-dividend?utm_source=markets.businessinsider.com&utm_medium=referral,positive,0.9381778836250305
65,2/9/2021 2:10:46 PM,BofA gets bullish on Equity Residential with signs of shift to coastal markets,Seeking Alpha,https://seekingalpha.com/news/3659974-bofa-gets-bullish-on-equity-residential-with-signs-of-shift-to-coastal-markets?utm_source=markets.businessinsider.com&utm_medium=referral,negative,0.8200254440307617
66,2/9/2021 4:09:56 PM,"Benzinga's Top Ratings Upgrades, Downgrades For February 9, 2021",Benzinga,/news/stocks/benzinga-s-top-ratings-upgrades-downgrades-for-february-9-2021-1030061488,neutral,0.6341244578361511
67,2/9/2021 6:54:57 PM,"Camden Property upgraded, Mid-America Apartment cut in recovery shuffle",Seeking Alpha,https://seekingalpha.com/news/3660120-camden-property-upgraded-mid-america-apartment-cut-in-recovery-shuffle?utm_source=markets.businessinsider.com&utm_medium=referral,negative,0.5002896785736084
68,2/16/2021 11:02:17 PM,"Jonathan Litt's Land & Buildings adds Camden Property, exits EPR, Redfin",Seeking Alpha,https://seekingalpha.com/news/3662617-jonathan-litts-land-buildings-adds-camden-property-exits-epr-redfin?utm_source=markets.businessinsider.com&utm_medium=referral,positive,0.9400265216827393
69,2/22/2021 1:16:30 PM,"AvalonBay upgraded, Camden Property cut as KeyBanc sees coastal rebound",Seeking Alpha,https://seekingalpha.com/news/3664284-avalonbay-upgraded-camden-property-cut-as-keybanc-sees-coastal-rebound?utm_source=markets.businessinsider.com&utm_medium=referral,neutral,0.7492942810058594
70,2/22/2021 4:03:37 PM,"Benzinga's Top Ratings Upgrades, Downgrades For February 22, 2021",Benzinga,/news/stocks/benzinga-s-top-ratings-upgrades-downgrades-for-february-22-2021-1030108332,neutral,0.6334108114242554
71,2/26/2021 4:40:00 PM,Camden Property Trust -- Moody's announces completion of a periodic review of ratings of Camden Property Trust,Moodys,/news/bonds/camden-property-trust-moody-s-announces-completion-of-a-periodic-review-of-ratings-of-camden-property-trust-1030130182,positive,0.8734441995620728
72,3/3/2021 4:02:31 PM,"Benzinga's Top Ratings Upgrades, Downgrades For March 3, 2021",Benzinga,/news/stocks/benzinga-s-top-ratings-upgrades-downgrades-for-march-3-2021-1030145958,neutral,0.5482129454612732
73,3/24/2021 12:09:15 PM,"Equity Residential, AvalonBay cut to Sell at Deutsche Bank due to rich valuations",Seeking Alpha,https://seekingalpha.com/news/3675609-equity-residential-avalonbay-cut-to-sell-at-deutsche-bank-due-to-rich-valuations?utm_source=markets.businessinsider.com&utm_medium=referral,neutral,0.9474071264266968
74,3/31/2021 4:03:29 PM,"Benzinga's Top Ratings Upgrades, Downgrades For March 31, 2021",Benzinga,/news/stocks/benzinga-s-top-ratings-upgrades-downgrades-for-march-31-2021-1030264348,neutral,0.5924392938613892
75,4/8/2021 9:14:38 PM,Columbia Property Trust gains as the company initiates strategic review,Seeking Alpha,https://seekingalpha.com/news/3680553-columbia-property-trust-gains-as-the-company-initiates-strategic-review?utm_source=markets.businessinsider.com&utm_medium=referral,negative,0.8889025449752808
76,4/28/2021 9:35:20 PM,Camden Property Trust Q1 Earnings Preview,Seeking Alpha,https://seekingalpha.com/news/3687089-camden-property-trust-q1-earnings-preview?utm_source=markets.businessinsider.com&utm_medium=referral,positive,0.7745137810707092
77,4/29/2021 11:11:12 PM,Camden Property Trust Q1 adjusted earnings Beat Estimates,RTTNews,/news/stocks/camden-property-trust-q1-adjusted-earnings-beat-estimates-1030367115,negative,0.8431875109672546
78,5/10/2021 5:26:20 PM,Stocks That Hit 52-Week Highs On Monday,Benzinga,/news/stocks/stocks-that-hit-52-week-highs-on-monday-1030410156,positive,0.6719298958778381
79,5/20/2021 11:58:15 AM,Regency Centers gets double-upgrade at JPMorgan as REIT focus shift to re-opening,Seeking Alpha,https://seekingalpha.com/news/3698599-regency-centers-gets-double-upgrade-at-jpmorgan-as-reit-focus-shift-to-re-opening?utm_source=markets.businessinsider.com&utm_medium=referral,negative,0.9026515483856201
80,5/20/2021 4:02:03 PM,"Benzinga's Top Ratings Upgrades, Downgrades For May 20, 2021",Benzinga,/news/stocks/benzinga-s-top-ratings-upgrades-downgrades-for-may-20-2021-1030451423,neutral,0.5674558281898499
81,5/26/2021 2:55:10 PM,Analyst Ratings for Camden Prop Trust,Benzinga,/news/stocks/analyst-ratings-for-camden-prop-trust-1030467041,positive,0.9169343709945679
82,6/3/2021 5:22:44 PM,Fannie and Freddie extend multifamily forbearance programs through Sept. 30,Seeking Alpha,https://seekingalpha.com/news/3702996-freddie-mac-multifamily-declares-an-extension-on-its-forbearance-program?utm_source=markets.businessinsider.com&utm_medium=referral,positive,0.6215564608573914
83,6/7/2021 8:32:40 PM,"Camden Property's May rent collection stays steady, new lease rate rises",Seeking Alpha,https://seekingalpha.com/news/3703896-camden-propertys-may-rent-collection-stays-steady-new-lease-rate-rises?utm_source=markets.businessinsider.com&utm_medium=referral,negative,0.6092746257781982
84,6/9/2021 2:39:31 PM,7 Apartment REITs to Buy as Rent Prices Get Set to Surge,InvestorPlace,/news/stocks/7-apartment-reits-to-buy-as-rent-prices-get-set-to-surge-1030508686,positive,0.8157171010971069
85,6/14/2021 11:30:13 AM,"Evercore ISI upgrades Welltower, Pebblebrook Hotel as REIT trends improve",Seeking Alpha,https://seekingalpha.com/news/3705902-evercore-isi-upgrades-welltower-pebblebrook-hotel-as-reit-trends-improve?utm_source=markets.businessinsider.com&utm_medium=referral,negative,0.6165650486946106
86,6/14/2021 4:47:14 PM,"Benzinga's Top Ratings Upgrades, Downgrades For June 14, 2021",Benzinga,/news/stocks/benzinga-s-top-ratings-upgrades-downgrades-for-june-14-2021-1030520349,neutral,0.5871503949165344
87,6/15/2021 4:24:55 PM,"Benzinga's Top Ratings Upgrades, Downgrades For June 15, 2021",Benzinga,/news/stocks/benzinga-s-top-ratings-upgrades-downgrades-for-june-15-2021-1030524604,neutral,0.571738600730896
88,6/27/2021 9:17:00 PM,Commercial real estate in Sunbelt fared best post-pandemic: Newmark repot,Seeking Alpha,https://seekingalpha.com/news/3710304-commercial-real-estate?utm_source=markets.businessinsider.com&utm_medium=referral,negative,0.9466606378555298
89,6/30/2021 8:39:36 AM,A divided Supreme Court keeps eviction moratorium in place,Seeking Alpha,https://seekingalpha.com/news/3711215-a-divided-supreme-court-keeps-eviction-moratorium-in-place?utm_source=markets.businessinsider.com&utm_medium=referral,neutral,0.7781528830528259
90,7/27/2021 3:02:14 PM,What Wall Street expects from Camden Property Trust's earnings,Markets Insider Automation,/news/stocks/camden_property_trust-q2-quarterly-earnings-preview-stock-1030650391,positive,0.9220376014709473
91,7/28/2021 9:35:02 PM,Notable earnings after Thursday's close,Seeking Alpha,https://seekingalpha.com/news/3720530-notable-earnings-after-thursdays-close?utm_source=markets.businessinsider.com&utm_medium=referral,negative,0.8900269269943237
92,7/29/2021 7:48:45 PM,Biden asks Congress to extend eviction moratorium,Seeking Alpha,https://seekingalpha.com/news/3721795-biden-asks-congress-to-extend-eviction-moratorium?utm_source=markets.businessinsider.com&utm_medium=referral,neutral,0.7366254329681396
93,7/29/2021 8:31:34 PM,"Camden Property Trust FFO in-line, beats on revenue",Seeking Alpha,https://seekingalpha.com/news/3721930-camden-property-trust-ffo-in-line-beats-on-revenue?utm_source=markets.businessinsider.com&utm_medium=referral,positive,0.905421793460846
94,7/29/2021 10:34:43 PM,Camden Property Trust Q2 adjusted earnings Beat Estimates,RTTNews,/news/stocks/camden-property-trust-q2-adjusted-earnings-beat-estimates-1030664480,negative,0.8226233124732971
95,7/29/2021 11:29:58 PM,Multifamily REITs chug forward as Mizuho re-ups its favorites,Seeking Alpha,https://seekingalpha.com/news/3722104-multifamily-reits-chug-forward-as-mizuho-re-ups-its-favorites?utm_source=markets.businessinsider.com&utm_medium=referral,negative,0.9136757850646973
96,8/2/2021 9:03:45 AM,What's next for the housing market as foreclosure moratorium expires?,Seeking Alpha,https://seekingalpha.com/news/3722779-whats-next-for-the-housing-market-as-foreclosure-moratorium-expires?utm_source=markets.businessinsider.com&utm_medium=referral,positive,0.7405749559402466
97,8/16/2021 3:10:00 PM,CollPlant Biotechnologies to Present on the Use of Collagen BioInk as a Platform for 3D Bioprinting of Tissues and Organs at the Biomaterials For 3D Printing Webinar,PR Newswire,/news/stocks/collplant-biotechnologies-to-present-on-the-use-of-collagen-bioink-as-a-platform-for-3d-bioprinting-of-tissues-and-organs-at-the-biomaterials-for-3d-printing-webinar-1030734560,positive,0.7932114601135254
98,8/18/2021 4:34:16 PM,7 REITs to Buy if You’re Confident About the Economic Recovery,InvestorPlace,/news/stocks/7-reits-to-buy-if-youre-confident-about-economic-recovery-1030743038,positive,0.8578528165817261
99,8/25/2021 8:22:25 PM,U.S. Treasury seeks to accelerate emergency rental assistance distribution,Seeking Alpha,https://seekingalpha.com/news/3734134-state-and-local-programs-aim-to-accelerate-slack-emergency-rental-assistance?utm_source=markets.businessinsider.com&utm_medium=referral,negative,0.9116377830505371
100,8/27/2021 9:25:14 AM,Supreme Court ends federal moratorium on residential evictions,Seeking Alpha,https://seekingalpha.com/news/3734739-supreme-court-ends-federal-moratorium-on-residential-evictions?utm_source=markets.businessinsider.com&utm_medium=referral,neutral,0.8150188326835632
101,8/27/2021 6:21:11 PM,Apartment REITs gain after federal eviction moratorium ends,Seeking Alpha,https://seekingalpha.com/news/3734959-apartment-reits-gain-after-federal-eviction-moratorium-ends?utm_source=markets.businessinsider.com&utm_medium=referral,neutral,0.7240447402000427
