,datetime,title,source,link,sentiment_class,sentiment_score
208,3/30/2023 4:31:43 PM,Camden Property Trust upgraded to Buy at CFRA after stock dips from 52-week high,Seeking Alpha,https://seekingalpha.com/news/3952791-camden-property-trust-upgraded-to-buy-at-cfra-after-stock-dips-from-52-week-high?utm_source=businessinsider&utm_medium=referral,negative,0.55511474609375
209,4/22/2023 1:46:40 AM,RBC Capital Remains a Buy on Camden Property (CPT),TipRanks,/news/stocks/rbc-capital-remains-a-buy-on-camden-property-cpt-1032250907,positive,0.936255931854248
210,4/26/2023 3:01:13 PM,Here's what Wall Street expects from Camden Property Trust's earnings report,Markets Insider Automation,/news/stocks/camden_property_trust-stock-price-quarter-earnings-preview-q1-1032263762,positive,0.8981812000274658
211,4/26/2023 9:35:19 PM,Notable earnings after Thursday's close,Seeking Alpha,https://seekingalpha.com/news/3960471-notable-earnings-after-thursdays-close?utm_source=businessinsider&utm_medium=referral,negative,0.8900269269943237
212,4/26/2023 9:35:45 PM,Camden Property Trust Q1 2023 Earnings Preview,Seeking Alpha,https://seekingalpha.com/news/3960767-camden-property-trust-q1-2023-earnings-preview?utm_source=businessinsider&utm_medium=referral,positive,0.8498572111129761
213,4/27/2023 8:25:20 PM,"Camden Property Trust FFO of $1.66 misses by $0.01, revenue of $378.16M beats by $0.86M",Seeking Alpha,https://seekingalpha.com/news/3961678-camden-property-trust-ffo-of-1_66-misses-0_01-revenue-of-378_16m-beats-0_86m?utm_source=businessinsider&utm_medium=referral,positive,0.7925582528114319
214,4/27/2023 11:03:41 PM,"Camden Property Trust Q1 Income Retreats, but beats estimates",RTTNews,/news/stocks/camden-property-trust-q1-income-retreats-but-beats-estimates-1032270460,neutral,0.9597516059875488
215,4/28/2023 11:15:23 AM,Piper Sandler Sticks to Its Hold Rating for Camden Property (CPT),TipRanks,/news/stocks/piper-sandler-sticks-to-its-hold-rating-for-camden-property-cpt-1032273393,positive,0.8265538215637207
216,4/28/2023 6:00:29 PM,Expert Ratings for Camden Prop Trust,Benzinga,/news/stocks/expert-ratings-for-camden-prop-trust-1032274505,positive,0.8626548647880554
217,5/2/2023 1:26:02 PM,American Medical Association approves CPT code for psychedelic therapies,Seeking Alpha,https://seekingalpha.com/news/3963357-american-medical-association-approves-cpt-code-psychedelic-therapies?utm_source=businessinsider&utm_medium=referral,positive,0.868584394454956
218,5/2/2023 4:25:25 PM,RBC Capital Reaffirms Their Buy Rating on Camden Property (CPT),TipRanks,/news/stocks/rbc-capital-reaffirms-their-buy-rating-on-camden-property-cpt-1032283451,positive,0.8045116662979126
219,5/15/2023 12:19:14 PM,"Camden Property, Essex Property, Mid-America, UDR downgraded at Wolfe",Seeking Alpha,https://seekingalpha.com/news/3971274-camden-property-essex-property-mid-america-udr-downgraded-at-wolfe?utm_source=businessinsider&utm_medium=referral,neutral,0.5916470289230347
220,5/15/2023 2:29:32 PM,"AvalonBay upgraded, Camden Property cut at BofA as recession fears rise",Seeking Alpha,https://seekingalpha.com/news/3971411-avalonbay-upgraded-camden-property-cut-at-bofa-as-recession-fears-rise?utm_source=businessinsider&utm_medium=referral,neutral,0.9084128141403198
221,5/15/2023 5:50:56 PM,"Why This Analyst Is Upgrading REIT AvalonBay, But Downgrading Camden Property Trust",Benzinga,/news/stocks/why-this-analyst-is-upgrading-reit-avalonbay-but-downgrading-camden-property-trust-1032328072,positive,0.9301041960716248
222,5/19/2023 7:02:02 PM,Analyst Ratings for Camden Prop Trust,Benzinga,/news/stocks/analyst-ratings-for-camden-prop-trust-1032340318,positive,0.9169343709945679
223,5/22/2023 9:47:08 PM,3 Stocks Paul Tudor Jones Predicts Could Skyrocket by Year-End,InvestorPlace,/news/stocks/3-stocks-paul-tudor-jones-predicts-could-skyrocket-by-year-end-1032343779,neutral,0.6123207211494446
224,5/23/2023 12:10:11 PM,"Analysts Offer Insights on Financial Companies: Camden Property (CPT), Regency Centers (REG) and Commerzbank AG (OtherCRZBY)",TipRanks,/news/stocks/analysts-offer-insights-on-financial-companies-camden-property-cpt-regency-centers-reg-and-commerzbank-ag-othercrzby-1032345140,positive,0.923075795173645
225,5/31/2023 9:25:11 AM,Camden Property (CPT) Gets a Buy from Barclays,TipRanks,/news/stocks/camden-property-cpt-gets-a-buy-from-barclays-1032360295,negative,0.5594157576560974
226,6/15/2023 8:37:22 PM,Camden Property Trust declares $1.00 dividend,Seeking Alpha,https://seekingalpha.com/news/3980309-camden-property-trust-declares-1_00-dividend?utm_source=businessinsider&utm_medium=referral,positive,0.9342743158340454
227,6/17/2023 1:45:34 AM,RBC Capital Sticks to Its Buy Rating for Camden Property (CPT),TipRanks,/news/stocks/rbc-capital-sticks-to-its-buy-rating-for-camden-property-cpt-1032395300,positive,0.5707186460494995
228,7/3/2023 10:44:46 PM,Why Camden Property Trust Stock (NYSE:CPT) May be Losing Its Edge,TipRanks,/news/stocks/why-camden-property-trust-stock-nyse-cpt-may-be-losing-its-edge-1032424317,neutral,0.9545692801475525
229,7/18/2023 3:20:31 PM,"Camden Property, AIRC upgraded, IRT downgraded at BMO",Seeking Alpha,https://seekingalpha.com/news/3988426-camden-property-airc-upgraded-irt-downgraded-at-bmo?utm_source=businessinsider&utm_medium=referral,neutral,0.6433641314506531
230,7/18/2023 5:00:54 PM,"Benzinga's Top Ratings Upgrades, Downgrades For July 18, 2023",Benzinga,/news/stocks/benzinga-s-top-ratings-upgrades-downgrades-for-july-18-2023-1032455622,neutral,0.4937437176704407
231,7/18/2023 5:01:06 PM,Analyst Expectations for Camden Prop Trust's Future,Benzinga,/news/stocks/analyst-expectations-for-camden-prop-trust-s-future-1032455620,negative,0.7721746563911438
232,7/18/2023 7:54:12 PM,Analyst Upgrades Camden Property Trust: Anticipating A 'Mean-Revert' And Strong FFO Growth,Benzinga,/news/stocks/analyst-upgrades-camden-property-trust-anticipating-a-mean-revert-and-strong-ffo-growth-1032455996,negative,0.9474534392356873
233,8/2/2023 3:01:13 PM,Here's what Wall Street expects from Camden Property Trust's earnings,Markets Insider Automation,/news/stocks/camden_property_trust-q2-earnings-preview-1032506648,positive,0.9312423467636108
234,8/3/2023 8:40:57 PM,"Camden Property Trust FFO of $1.51, revenue of $385.5M beats by $1.58M",Seeking Alpha,https://seekingalpha.com/news/3997033-camden-property-trust-ffo-of-151-revenue-of-3855m-beats-by-158m?utm_source=businessinsider&utm_medium=referral,positive,0.8010562062263489
235,8/3/2023 11:30:41 PM,Camden Property Trust Q2 Profit Down ,RTTNews,/news/stocks/camden-property-trust-q2-profit-down-1032514630,neutral,0.9480302929878235
236,8/4/2023 8:04:11 AM,"Analysts Offer Insights on NA Companies: Camden Property (CPT), Hyatt Hotels (H) and Physicians Realty (DOC)",TipRanks,/news/stocks/analysts-offer-insights-on-na-companies-camden-property-cpt-hyatt-hotels-h-and-physicians-realty-doc-1032517007,positive,0.9214791655540466
237,8/4/2023 12:01:54 PM,"Analysts’ Opinions Are Mixed on These NA Stocks: Upbound Group (UPBD), Camden Property (CPT) and Wayfair (W)",TipRanks,/news/stocks/analysts-opinions-are-mixed-on-these-na-stocks-upbound-group-upbd-camden-property-cpt-and-wayfair-w-1032517819,neutral,0.8220070004463196
238,8/4/2023 12:10:09 PM,"Analysts’ Opinions Are Mixed on These NA Stocks: Upbound Group (UPBD), Wayfair (W) and Camden Property (CPT)",TipRanks,/news/stocks/analysts-opinions-are-mixed-on-these-na-stocks-upbound-group-upbd-wayfair-w-and-camden-property-cpt-1032517809,neutral,0.8551394939422607
239,8/4/2023 3:02:33 PM,Analysts Offer Insights on NA Companies: Floor & Decor Holdings (FND) and Camden Property (CPT),TipRanks,/news/stocks/analysts-offer-insights-on-na-companies-floor-decor-holdings-fnd-and-camden-property-cpt-1032518662,positive,0.9296211004257202
240,8/8/2023 9:02:20 AM,Analysts Offer Insights on NA Companies: Ventas (VTR) and Camden Property (CPT),TipRanks,/news/stocks/analysts-offer-insights-on-na-companies-ventas-vtr-and-camden-property-cpt-1032527851,positive,0.9037076830863953
241,8/8/2023 9:00:42 PM,What 7 Analyst Ratings Have To Say About Camden Prop Trust,Benzinga,/news/stocks/what-7-analyst-ratings-have-to-say-about-camden-prop-trust-1032530477,positive,0.9436601996421814
242,8/8/2023 9:26:17 PM,Camden Property Trust To See Over 5% Growth In Same-Store Sales In FY23 Amid Strong FFO: Analyst Projects,Benzinga,/news/stocks/camden-property-trust-to-see-over-5-growth-in-same-store-sales-in-fy23-amid-strong-ffo-analyst-projects-1032530523,negative,0.9451720714569092
243,8/9/2023 1:45:49 AM,Camden Property (CPT) Gets a Buy from RBC Capital,TipRanks,/news/stocks/camden-property-cpt-gets-a-buy-from-rbc-capital-1032531274,positive,0.5873645544052124
244,8/30/2023 2:25:13 AM,Camden Property (CPT) Receives a Buy from Truist Financial,TipRanks,/news/stocks/camden-property-cpt-receives-a-buy-from-truist-financial-1032590880,positive,0.6644101738929749
245,8/30/2023 4:02:38 PM,UDR upgraded to Outperform at Scotia on valuation discount vs. peers,Seeking Alpha,https://seekingalpha.com/news/4007565-udr-upgraded-to-outperform-at-scotia-on-valuation-discount-vs-peers?utm_source=businessinsider&utm_medium=referral,negative,0.9441654682159424
246,9/12/2023 9:55:36 AM,Wells Fargo Keeps Their Sell Rating on Camden Property (CPT),TipRanks,/news/stocks/wells-fargo-keeps-their-sell-rating-on-camden-property-cpt-1032622499,positive,0.9031763672828674
247,9/12/2023 6:00:18 PM,Where Camden Prop Trust Stands With Analysts,Benzinga,/news/stocks/where-camden-prop-trust-stands-with-analysts-1032624335,positive,0.8955805897712708
248,9/28/2023 11:44:27 PM,"Buy This, Not That: 2 Dividend Stocks to Own, 1 to Avoid",InvestorPlace,/news/stocks/buy-this-not-that-2-dividend-stocks-to-own-1-to-avoid-1032664704,positive,0.9487336277961731
249,10/2/2023 5:51:33 PM,Office Real Estate Market Teeters On Brink: Experts See $1.5 Trillion Debt Due 2025 As Perfect Storm,Benzinga,/news/etf/office-real-estate-market-teeters-on-brink-experts-see-1-5-trillion-debt-due-2025-as-perfect-storm-1032671192,neutral,0.6291602849960327
250,10/3/2023 5:00:55 PM,"Benzinga's Top Ratings Upgrades, Downgrades For October 3, 2023",Benzinga,/news/stocks/benzinga-s-top-ratings-upgrades-downgrades-for-october-3-2023-1032675243,positive,0.5215083360671997
251,10/25/2023 3:01:13 PM,Camden Property Trust earnings: here's what Wall Street expects,Markets Insider Automation,/news/stocks/camden_property_trust-q3-earnings-preview-1032738815,positive,0.9312499165534973
252,10/26/2023 11:25:42 PM,"Camden Property Q3 Profit Increases, Revenues Miss Street ",RTTNews,/news/stocks/camden-property-q3-profit-increases-revenues-miss-street-1032745724,negative,0.6238048672676086
253,10/27/2023 12:35:55 AM,Resilient Performance and Growth Potential: John Kim’s Buy Rating for Camden Property,TipRanks,/news/stocks/resilient-performance-and-growth-potential-john-kim-s-buy-rating-for-camden-property-1032748610,positive,0.5174511075019836
254,10/27/2023 10:39:09 AM,Piper Sandler Sticks to Its Hold Rating for Camden Property (CPT),TipRanks,/news/stocks/piper-sandler-sticks-to-its-hold-rating-for-camden-property-cpt-1032750036,positive,0.8265538215637207
255,10/27/2023 12:35:31 PM,Scotiabank Sticks to Their Hold Rating for Camden Property (CPT),TipRanks,/news/stocks/scotiabank-sticks-to-their-hold-rating-for-camden-property-cpt-1032750254,positive,0.8804013133049011
256,10/30/2023 2:05:39 AM,Stifel Nicolaus Reaffirms Their Buy Rating on Camden Property (CPT),TipRanks,/news/stocks/stifel-nicolaus-reaffirms-their-buy-rating-on-camden-property-cpt-1032754528,positive,0.8100222945213318
257,10/30/2023 10:28:53 AM,RBC Capital Reaffirms Their Buy Rating on Camden Property (CPT),TipRanks,/news/stocks/rbc-capital-reaffirms-their-buy-rating-on-camden-property-cpt-1032755964,positive,0.8045116662979126
258,10/31/2023 6:40:22 AM,Hold Rating on Camden Property Trust Amid Market Slowdown and Rent Deceleration: An Analysis,TipRanks,/news/stocks/hold-rating-on-camden-property-trust-amid-market-slowdown-and-rent-deceleration-an-analysis-1032760959,positive,0.8286471366882324
259,10/31/2023 7:38:20 PM,"Real Estate REITs Pressured Amid Higher Interest Rate & Supply Woes, But Analyst Upgrades AvalonBay Communities: Here's Why",Benzinga,/news/stocks/real-estate-reits-pressured-amid-higher-interest-rate-supply-woes-but-analyst-upgrades-avalonbay-communities-here-s-why-1032760974,neutral,0.7758883237838745
260,11/7/2023 12:38:16 PM,Wells Fargo Sticks to Its Sell Rating for Camden Property (CPT),TipRanks,/news/stocks/wells-fargo-sticks-to-its-sell-rating-for-camden-property-cpt-1032790125,positive,0.8686910271644592
261,11/17/2023 8:00:40 PM,What 10 Analyst Ratings Have To Say About Camden Prop Trust,Benzinga,/news/stocks/what-10-analyst-ratings-have-to-say-about-camden-prop-trust-1032832538,positive,0.944857120513916
262,12/4/2023 7:23:18 PM,Multifamily REITs Face Pricing Challenges Amid Competitive Pressures: Analyst Adjusts Outlook For CPT And MAA,Benzinga,/news/stocks/multifamily-reits-face-pricing-challenges-amid-competitive-pressures-analyst-adjusts-outlook-for-cpt-and-maa-1032871682,neutral,0.7386434078216553
263,12/11/2023 12:36:16 PM,Wells Fargo Sticks to Their Sell Rating for Camden Property (CPT),TipRanks,/news/stocks/wells-fargo-sticks-to-their-sell-rating-for-camden-property-cpt-1032891231,positive,0.8676604628562927
264,12/11/2023 3:00:13 PM,Expert Ratings for Camden Prop Trust,Benzinga,/news/stocks/expert-ratings-for-camden-prop-trust-1032889615,positive,0.8626548647880554
265,12/16/2023 1:46:46 AM,Camden Property (CPT) Receives a Buy from RBC Capital,TipRanks,/news/stocks/camden-property-cpt-receives-a-buy-from-rbc-capital-1032906517,positive,0.5248066782951355
266,12/20/2023 12:51:04 PM,Analysts Have Conflicting Sentiments on These Real Estate Companies: Douglas Emmett (DEI) and Camden Property (CPT),TipRanks,/news/stocks/analysts-have-conflicting-sentiments-on-these-real-estate-companies-douglas-emmett-dei-and-camden-property-cpt-1032917701,neutral,0.8959250450134277
267,1/8/2024 12:50:53 PM,Analysts Offer Insights on Real Estate Companies: Medical Properties (MPW) and Camden Property (CPT),TipRanks,/news/stocks/analysts-offer-insights-on-real-estate-companies-medical-properties-mpw-and-camden-property-cpt-1032951892,positive,0.9154141545295715
268,1/10/2024 6:00:21 PM,Where Camden Prop Trust Stands With Analysts,Benzinga,/news/stocks/where-camden-prop-trust-stands-with-analysts-1032958178,positive,0.8955805897712708
269,1/19/2024 6:05:50 PM,Home rental REITs advance after Blackstone-Tricon deal,Seeking Alpha,https://seekingalpha.com/news/4056552-home-rental-reits-advance-after-blackstone-tricon-deal?utm_source=businessinsider&utm_medium=referral&feed_item_type=news,negative,0.7011417150497437
270,1/31/2024 3:01:13 PM,Here's what Wall Street expects from Camden Property Trust's earnings,Markets Insider Automation,/news/stocks/camden_property_trust-q4-earnings-preview-1033015124,positive,0.9312423467636108
271,1/31/2024 10:35:17 PM,Notable earnings after Thursday's close,Seeking Alpha,https://seekingalpha.com/news/4060639-notable-earnings-after-thursdays-close?utm_source=businessinsider&utm_medium=referral&feed_item_type=news,negative,0.8900269269943237
272,1/31/2024 10:35:42 PM,Camden Property Trust Q4 2023 Earnings Preview,Seeking Alpha,https://seekingalpha.com/news/4060814-camden-property-trust-q4-2023-earnings-preview?utm_source=businessinsider&utm_medium=referral&feed_item_type=news,positive,0.8532652258872986
273,2/1/2024 9:18:41 PM,"Camden Property Trust FFO of $1.73 in-line, revenue of $387.59M in-line",Seeking Alpha,https://seekingalpha.com/news/4061660-camden-property-trust-ffo-of-1_73-in-line-revenue-of-387_59m-in-line?utm_source=businessinsider&utm_medium=referral&feed_item_type=news,positive,0.9174489974975586
274,2/1/2024 9:31:37 PM,Camden Property Trust increases dividend by ~3% to $1.03,Seeking Alpha,https://seekingalpha.com/news/4061651-camden-property-trust-declares-1_03-dividend?utm_source=businessinsider&utm_medium=referral&feed_item_type=news,negative,0.9454090595245361
275,2/1/2024 11:04:01 PM,Camden Property Trust Q4 Profit Rises ,RTTNews,/news/stocks/camden-property-trust-q4-profit-rises-1033022644,neutral,0.5611937642097473
276,2/2/2024 8:37:19 AM,Camden Property (CPT) Gets a Buy from Barclays,TipRanks,/news/stocks/camden-property-cpt-gets-a-buy-from-barclays-1033024538,negative,0.5594157576560974
277,2/2/2024 12:30:40 PM,"Analysts’ Top Real Estate Picks: Camden Property (CPT), AvalonBay (AVB)",TipRanks,/news/stocks/analysts-top-real-estate-picks-camden-property-cpt-avalonbay-avb-1033025811,positive,0.6333265900611877
278,2/2/2024 1:07:45 PM,Stifel Nicolaus Sticks to Their Buy Rating for Camden Property (CPT),TipRanks,/news/stocks/stifel-nicolaus-sticks-to-their-buy-rating-for-camden-property-cpt-1033025925,positive,0.7978249192237854
279,2/2/2024 1:07:54 PM,Piper Sandler Reaffirms Their Sell Rating on Camden Property (CPT),TipRanks,/news/stocks/piper-sandler-reaffirms-their-sell-rating-on-camden-property-cpt-1033025923,positive,0.8329108357429504
280,2/3/2024 5:00:39 PM,REITs see 3rd straight week of decline amid downturn at broader real estate sector,Seeking Alpha,https://seekingalpha.com/news/4062372-reits-see-3rd-straight-week-of-decline-amid-downturn-at-broader-real-estate-sector?utm_source=businessinsider&utm_medium=referral&feed_item_type=news,neutral,0.9738278985023499
281,2/5/2024 9:21:12 AM,Camden Property’s Resilient Performance and Growth Prospects Support Buy Rating,TipRanks,/news/stocks/camden-property-s-resilient-performance-and-growth-prospects-support-buy-rating-1033029675,negative,0.8912408947944641
282,2/5/2024 1:10:20 PM,Analysts Offer Insights on Real Estate Companies: Camden Property (CPT) and Colliers International Group (CIGI),TipRanks,/news/stocks/analysts-offer-insights-on-real-estate-companies-camden-property-cpt-and-colliers-international-group-cigi-1033031035,positive,0.9221533536911011
283,2/5/2024 5:00:13 PM,8 Analysts Assess Camden Prop Trust: What You Need To Know,Benzinga,/news/stocks/8-analysts-assess-camden-prop-trust-what-you-need-to-know-1033030982,positive,0.9057594537734985
284,2/12/2024 11:40:00 AM,Defying Inflation: 7 Dividend Stocks for a Secure Income Stream,InvestorPlace,/news/stocks/defying-inflation-7-dividend-stocks-for-a-secure-income-stream-1033056514,positive,0.7495954036712646
285,2/20/2024 3:25:16 PM,"AvalonBay upgraded, Camden Property, UDR downgraded at Barclays",Seeking Alpha,https://seekingalpha.com/news/4068920-avalonbay-upgraded-camden-property-udr-downgraded-at-barclays?utm_source=businessinsider&utm_medium=referral&feed_item_type=news,positive,0.5096372961997986
286,2/21/2024 2:15:13 PM,Wall Street's Most Accurate Analysts' Views On 3 Real Estate Stocks With Over 4% Dividend Yields,Benzinga,/news/stocks/wall-street-s-most-accurate-analysts-views-on-3-real-estate-stocks-with-over-4-dividend-yields-1033087536,positive,0.8907866477966309
287,2/22/2024 2:00:44 PM,Peeling Back The Layers: Exploring Camden Prop Trust Through Analyst Insights,Benzinga,/news/stocks/peeling-back-the-layers-exploring-camden-prop-trust-through-analyst-insights-1033092657,positive,0.8508962392807007
288,3/2/2024 5:00:00 PM,"Real estate stocks inch up, XLRE closes 2.12% higher",Seeking Alpha,https://seekingalpha.com/news/4074821-real-estate-stocks-inch-up-xlre-closes-higher?utm_source=businessinsider&utm_medium=referral&feed_item_type=news,negative,0.902215838432312
289,3/11/2024 2:30:53 PM,U.S. asking rents post biggest increase in over a year: Redfin,Seeking Alpha,https://seekingalpha.com/news/4078000-us-asking-rents-post-biggest-increase-in-over-a-year-redfin?utm_source=businessinsider&utm_medium=referral&feed_item_type=news,negative,0.9389985203742981
290,3/11/2024 10:43:48 PM,"Rising Rents Complicates Fed's Disinflation Goal, Offers Tailwind To Residential REIT Stocks",Benzinga,/news/etf/rising-rents-complicates-fed-s-disinflation-goal-offers-tailwind-to-residential-reit-stocks-1033152760,neutral,0.9556766748428345
291,3/12/2024 3:01:02 PM,Critical Insights From Camden Prop Trust Analyst Ratings: What You Need To Know,Benzinga,/news/stocks/critical-insights-from-camden-prop-trust-analyst-ratings-what-you-need-to-know-1033155286,positive,0.9364975094795227
292,3/15/2024 7:03:13 PM,Real estate stocks report drop in short interest,Seeking Alpha,https://seekingalpha.com/news/4080097-real-estate-stocks-report-drop-in-short-interest?utm_source=businessinsider&utm_medium=referral&feed_item_type=news,neutral,0.9667537212371826
293,3/16/2024 4:00:46 PM,"Real estate stocks dip as economic data hamper rate cut hopes, positive news lack",Seeking Alpha,https://seekingalpha.com/news/4080228-real-estate-stocks-dip-as-economic-data-hamper-rate-cut-hopes-positive-news-lack?utm_source=businessinsider&utm_medium=referral&feed_item_type=news,neutral,0.8362149596214294
294,3/26/2024 11:05:38 AM,Camden Property (CPT) Gets a Sell from Piper Sandler,TipRanks,/news/stocks/camden-property-cpt-gets-a-sell-from-piper-sandler-1033197155,negative,0.49354177713394165
295,4/6/2024 4:00:53 PM,Real estate stocks decline as markets price in reduced hopes of near-term rate cut,Seeking Alpha,https://seekingalpha.com/news/4087715-real-estate-stocks-decline-as-markets-price-in-reduced-hopes-of-near-term-rate-cut?utm_source=businessinsider&utm_medium=referral&feed_item_type=news,neutral,0.96022629737854
296,4/8/2024 4:00:07 PM,"Camden Property Trust, Sachem Capital among real estate movers",Seeking Alpha,https://seekingalpha.com/news/4087972-camden-property-trust-sachem-capital-among-real-estate-movers?utm_source=businessinsider&utm_medium=referral&feed_item_type=news,positive,0.9134423732757568
297,4/9/2024 5:24:36 PM,"Camden Property, Mid-America best readthroughs from AIR Communities deal - analyst",Seeking Alpha,https://seekingalpha.com/news/4088328-camden-property-mid-america-best-readthroughs-from-air-communities-deal-analyst?utm_source=businessinsider&utm_medium=referral&feed_item_type=news,positive,0.891110897064209
298,4/9/2024 9:01:22 PM,Critical Insights From Camden Prop Trust Analyst Ratings: What You Need To Know,Benzinga,/news/stocks/critical-insights-from-camden-prop-trust-analyst-ratings-what-you-need-to-know-1033234630,positive,0.9364975094795227
299,4/11/2024 1:50:08 AM,RBC Capital Keeps Their Buy Rating on Camden Property (CPT),TipRanks,/news/stocks/rbc-capital-keeps-their-buy-rating-on-camden-property-cpt-1033239444,positive,0.911566436290741
300,4/11/2024 5:33:00 PM,Real estate gets neutral health score by Seeking Alpha's Quant Rating ahead of Q1 earnings,Seeking Alpha,https://seekingalpha.com/news/4088696-real-estate-gets-neutral-health-score-by-seeking-alphas-quant-rating-ahead-of-q1-earnings?utm_source=businessinsider&utm_medium=referral&feed_item_type=news,positive,0.7378234267234802
301,4/13/2024 4:00:27 PM,Real estate stocks continue to dip as earnings season kicks off,Seeking Alpha,https://seekingalpha.com/news/4089409-real-estate-stocks-continue-to-dip-as-earnings-season-kicks-off?utm_source=businessinsider&utm_medium=referral&feed_item_type=news,neutral,0.9726858139038086
302,4/15/2024 3:39:26 PM,Short interest on S&P 500 real estate stocks advance in March,Seeking Alpha,https://seekingalpha.com/news/4089552-short-interest-on-sp-500-real-estate-stocks-advance-in-march?utm_source=businessinsider&utm_medium=referral&feed_item_type=news,negative,0.3983664810657501
303,4/20/2024 4:00:59 PM,Real estate stocks continue on downward trajectory as market's April pullback intensifies,Seeking Alpha,https://seekingalpha.com/news/4091707-real-estate-stocks-continue-on-downward-trajectory-as-markets-april-pullback-intensifies?utm_source=businessinsider&utm_medium=referral&feed_item_type=news,neutral,0.9682722091674805
304,4/27/2024 4:00:55 PM,"Real estate stocks finish in green as analysts turn positive, earnings surprise to upside",Seeking Alpha,https://seekingalpha.com/news/4095205-real-estate-stocks-finish-in-green-as-analysts-turn-positive-earnings-surprise-to-upside?utm_source=businessinsider&utm_medium=referral&feed_item_type=news,negative,0.855829656124115
305,4/29/2024 6:01:06 PM,Assessing Camden Prop Trust: Insights From 10 Financial Analysts,Benzinga,/news/stocks/assessing-camden-prop-trust-insights-from-10-financial-analysts-1033301438,positive,0.8211802840232849
306,5/1/2024 3:01:13 PM,Camden Property Trust is about to announce its earnings — here's what Wall Street expects,Markets Insider Automation,/news/stocks/camden_property_trust-stock-price-q1-earnings-preview-1033313296,positive,0.9313411116600037
307,5/2/2024 8:17:58 PM,"Camden Property Trust FFO of $1.70 beats by $0.04, revenue of $383.14M misses by $2.63M",Seeking Alpha,https://seekingalpha.com/news/4099119-camden-property-trust-ffo-of-1_70-beats-0_04-revenue-of-383_14m-misses-2_63m?utm_source=businessinsider&utm_medium=referral&feed_item_type=news,positive,0.8495292663574219
308,5/2/2024 11:10:13 PM,Camden Property Trust Q1 FFO Rises ,RTTNews,/news/stocks/camden-property-trust-q1-ffo-rises-1033322604,positive,0.9420679211616516
309,5/2/2024 11:50:17 PM,Analysts Offer Insights on Real Estate Companies: Camden Property (CPT) and Umh (UMH),TipRanks,/news/stocks/analysts-offer-insights-on-real-estate-companies-camden-property-cpt-and-umh-umh-1033322992,positive,0.9267677068710327
310,5/3/2024 12:54:19 AM,"CPT Stock Earnings: Camden Prop Trust Beats EPS, Misses Revenue for Q1 2024",InvestorPlace,/news/stocks/cpt-stock-earnings-camden-prop-trust-for-q1-of-2024-1033322780,negative,0.8578816652297974
311,5/3/2024 10:40:36 AM,Analyst Issues Sell Rating on Camden Property Amid Financial Uncertainty and Market Challenges,TipRanks,/news/stocks/analyst-issues-sell-rating-on-camden-property-amid-financial-uncertainty-and-market-challenges-1033326623,neutral,0.6917587518692017
