,datetime,title,source,link,sentiment_class,sentiment_score
304,8/20/2022 8:00:00 PM,Stable yet sluggish domestic demand could impact dental stocks - Baird,Seeking Alpha,https://seekingalpha.com/news/3875107-stable-yet-sluggish-domestic-demand-could-impact-dental-stocks-baird?utm_source=businessinsider&utm_medium=referral,neutral,0.9148371815681458
305,8/29/2022 2:48:45 PM,Henry Schein acquires Midway Dental Supply; terms undisclosed,Seeking Alpha,https://seekingalpha.com/news/3877466-henry-schein-acquires-midway-dental-supply-terms-undisclosed?utm_source=businessinsider&utm_medium=referral,positive,0.9440751671791077
306,8/29/2022 4:40:03 PM,Henry Schein Acquires Midway Dental Supply; Terms Undisclosed ,RTTNews,/news/stocks/henry-schein-acquires-midway-dental-supply-terms-undisclosed-1031711212,positive,0.9440751671791077
307,9/26/2022 4:01:21 PM,Where Henry Schein Stands With Analysts,Benzinga,/news/stocks/where-henry-schein-stands-with-analysts-1031764893,positive,0.9325302839279175
308,10/26/2022 11:01:43 PM,"Analysts’ Opinions Are Mixed on These Healthcare Stocks: Henry Schein (HSIC), Aileron Therapeutics (ALRN) and eFFECTOR Therapeutics (EFTR)",TipRanks,/news/stocks/analysts-opinions-are-mixed-on-these-healthcare-stocks-henry-schein-hsic-aileron-therapeutics-alrn-and-effector-therapeutics-eftr-1031840348,neutral,0.7489264011383057
309,10/31/2022 3:01:13 PM,Henry Schein earnings preview: what Wall Street is expecting,Markets Insider Automation,/news/stocks/henry_schein-q3-earnings-preview-1031853813,positive,0.9265075922012329
310,10/31/2022 3:21:29 PM,Notable earnings before Tuesday's open,Seeking Alpha,https://seekingalpha.com/news/3897806-notable-earnings-before-tuesdays-open?utm_source=businessinsider&utm_medium=referral,negative,0.8660826683044434
311,10/31/2022 4:13:49 PM,Henry Schein Q3 2022 Earnings Preview,Seeking Alpha,https://seekingalpha.com/news/3897827-henry-schein-q3-2022-earnings-preview?utm_source=businessinsider&utm_medium=referral,positive,0.9013556838035583
312,11/1/2022 10:34:32 AM,"Henry Schein Non-GAAP EPS of $1.15 beats by $0.01, revenue of $3.1B misses by $90M",Seeking Alpha,https://seekingalpha.com/news/3898340-henry-schein-non-gaap-eps-of-1_15-beats-0_01-revenue-of-3_1b-misses-90m?utm_source=businessinsider&utm_medium=referral,positive,0.7399797439575195
313,11/1/2022 12:04:16 PM,"Henry Schein Inc. Q3 Profit Decreases, but beats estimates",RTTNews,/news/stocks/henry-schein-inc-q3-profit-decreases-but-beats-estimates-1031857726,neutral,0.964957594871521
314,11/1/2022 8:27:34 PM,Henry Schein receives subpoena for documents related to former veterinary division,Seeking Alpha,https://seekingalpha.com/news/3899067-henry-schein-receives-subpoena-for-documents-related-to-former-veterinary-division?utm_source=businessinsider&utm_medium=referral,neutral,0.7155939340591431
315,11/2/2022 1:15:16 PM,Barrington Sticks to Its Buy Rating for Henry Schein (HSIC),TipRanks,/news/stocks/barrington-sticks-to-its-buy-rating-for-henry-schein-hsic-1031864236,positive,0.8915518522262573
316,11/4/2022 5:02:52 AM,"Analysts Have Conflicting Sentiments on These Healthcare Companies: Henry Schein (HSIC), Intercept Pharma (ICPT) and Frequency Therapeutics (FREQ)",TipRanks,/news/stocks/analysts-have-conflicting-sentiments-on-these-healthcare-companies-henry-schein-hsic-intercept-pharma-icpt-and-frequency-therapeutics-freq-1031873363,neutral,0.9146627187728882
317,12/16/2022 8:51:12 AM,Henry Schein invests and forms strategic partnership with Biotech Dental,Seeking Alpha,https://seekingalpha.com/news/3917884-henry-schein-invests-and-forms-strategic-partnership-with-biotech-dental?utm_source=businessinsider&utm_medium=referral,positive,0.5755524039268494
318,12/21/2022 4:41:10 PM,Analysts Offer Insights on Healthcare Companies: Henry Schein (HSIC) and Embecta Corporation (EMBC),TipRanks,/news/stocks/analysts-offer-insights-on-healthcare-companies-henry-schein-hsic-and-embecta-corporation-embc-1031985364,positive,0.9146571755409241
319,1/5/2023 12:00:04 PM,Henry Schein unit acquires majority interest in Unitas PPO Solutions,Seeking Alpha,https://seekingalpha.com/news/3922259-henry-schein-unit-acquires-majority-interest-in-unitas-ppo-solutions?utm_source=businessinsider&utm_medium=referral,positive,0.9296872615814209
320,1/13/2023 2:41:58 PM,Cramer On This Stock Down 5% In Last Month: 'It's Very Plain Vanilla',Benzinga,/news/stocks/cramer-on-this-stock-down-5-in-last-month-it-s-very-plain-vanilla-1032017537,neutral,0.9715288877487183
321,2/6/2023 2:15:43 PM,Barrington Keeps Their Buy Rating on Henry Schein (HSIC),TipRanks,/news/stocks/barrington-keeps-their-buy-rating-on-henry-schein-hsic-1032070598,positive,0.9277907609939575
322,2/13/2023 11:43:44 AM,Henry Schein authorizes $400M buyback,Seeking Alpha,https://seekingalpha.com/news/3935102-henry-schein-authorizes-400m-buyback?utm_source=businessinsider&utm_medium=referral,positive,0.8753917813301086
323,2/13/2023 12:58:27 PM,Henry Schein Board Authorizes Share Repurchase ,RTTNews,/news/stocks/henry-schein-board-authorizes-share-repurchase-1032090893,positive,0.9356032013893127
324,2/15/2023 3:01:13 PM,What Wall Street expects from Henry Schein's earnings,Markets Insider Automation,/news/stocks/henry_schein-q4-earnings-preview-stock-1032099051,positive,0.934475302696228
325,2/15/2023 3:25:44 PM,Notable earnings before Thursday's open,Seeking Alpha,https://seekingalpha.com/news/3936389-notable-earnings-before-thursdays-open?utm_source=businessinsider&utm_medium=referral,negative,0.8825733065605164
326,2/15/2023 4:39:50 PM,Henry Schein Q4 2022 Earnings Preview,Seeking Alpha,https://seekingalpha.com/news/3936433-henry-schein-q4-2022-earnings-preview?utm_source=businessinsider&utm_medium=referral,positive,0.9086986780166626
327,2/16/2023 11:34:46 AM,"Henry Schein Non-GAAP EPS of $1.21 misses by $0.01, revenue of $3.4B beats by $30M, Introduces guidance for 2023",Seeking Alpha,https://seekingalpha.com/news/3937031-henry-schein-non-gaap-eps-of-121-misses-by-001-revenue-of-34b-beats-by-30m-introduces-guidance-for-2023?utm_source=businessinsider&utm_medium=referral,positive,0.5270005464553833
328,2/16/2023 12:25:36 PM,Henry Schein issues 2023 EPS guidance that comes in above consensus,Seeking Alpha,https://seekingalpha.com/news/3937095-henry-schein-issues-2023-eps-guidance-that-comes-in-above-consensus?utm_source=businessinsider&utm_medium=referral,positive,0.9331232309341431
329,2/16/2023 1:01:05 PM,"Henry Schein Inc. Q4 Profit Decreases, but beats estimates",RTTNews,/news/stocks/henry-schein-inc-q4-profit-decreases-but-beats-estimates-1032102388,neutral,0.9634637236595154
330,2/16/2023 1:19:27 PM,Henry Schein Guides FY23 EPS Above View; Q4 Adj. EPS Meets Estimates ,RTTNews,/news/stocks/henry-schein-guides-fy23-eps-above-view-q4-adj-eps-meets-estimates-1032102452,positive,0.8690152168273926
331,2/16/2023 5:05:14 PM,Analyst Says Henry Schein 2023 Guidance Encouraging But Still Impacted By Headwinds,Benzinga,/news/stocks/analyst-says-henry-schein-2023-guidance-encouraging-but-still-impacted-by-headwinds-1032103369,negative,0.571518063545227
332,2/17/2023 2:15:08 PM,Barrington Sticks to Its Buy Rating for Henry Schein (HSIC),TipRanks,/news/stocks/barrington-sticks-to-its-buy-rating-for-henry-schein-hsic-1032106254,positive,0.8915518522262573
333,2/20/2023 2:05:07 AM,Stifel Nicolaus Keeps Their Hold Rating on Henry Schein (HSIC),TipRanks,/news/stocks/stifel-nicolaus-keeps-their-hold-rating-on-henry-schein-hsic-1032107655,positive,0.9180945754051208
334,2/20/2023 12:30:51 PM,"Analysts Conflicted on These Healthcare Names: Henry Schein (HSIC), Pacific Biosciences (PACB) and Axsome Therapeutics (AXSM)",TipRanks,/news/stocks/analysts-conflicted-on-these-healthcare-names-henry-schein-hsic-pacific-biosciences-pacb-and-axsome-therapeutics-axsm-1032108896,neutral,0.6850337982177734
335,2/28/2023 11:10:07 AM,"Analysts Conflicted on These Healthcare Names: ACADIA Pharmaceuticals (ACAD), Henry Schein (HSIC) and BeiGene (BGNE)",TipRanks,/news/stocks/analysts-conflicted-on-these-healthcare-names-acadia-pharmaceuticals-acad-henry-schein-hsic-and-beigene-bgne-1032130819,positive,0.6120093464851379
336,2/28/2023 11:25:18 AM,Bank of America Securities Remains a Sell on Henry Schein (HSIC),TipRanks,/news/stocks/bank-of-america-securities-remains-a-sell-on-henry-schein-hsic-1032130885,positive,0.9112511277198792
337,2/28/2023 6:00:50 PM,5 Analysts Have This to Say About Henry Schein,Benzinga,/news/stocks/5-analysts-have-this-to-say-about-henry-schein-1032132519,positive,0.9130606055259705
338,3/1/2023 5:05:10 AM,Robert W. Baird Sticks to Their Hold Rating for Henry Schein (HSIC),TipRanks,/news/stocks/robert-w-baird-sticks-to-their-hold-rating-for-henry-schein-hsic-1032133875,positive,0.8919206261634827
339,5/4/2023 1:24:41 PM,"Henry Schein to acquire S.I.N. Implant System, Brazil",Seeking Alpha,https://seekingalpha.com/news/3965658-henry-schein-to-acquire-sin-implant-system-brazil?utm_source=businessinsider&utm_medium=referral,positive,0.9115943908691406
340,5/8/2023 6:41:52 AM,Henry Schein acquires Regional Health Care Group,Seeking Alpha,https://seekingalpha.com/news/3966829-henry-schein-acquires-regional-health-care-group?utm_source=businessinsider&utm_medium=referral,positive,0.8831229209899902
341,5/8/2023 3:01:13 PM,Henry Schein earnings preview: what Wall Street is expecting,Markets Insider Automation,/news/stocks/henry_schein-q1-earnings-preview-stock-1032302253,positive,0.9265075922012329
342,5/8/2023 3:26:20 PM,Notable earnings before Tuesday's open,Seeking Alpha,https://seekingalpha.com/news/3967129-notable-earnings-before-tuesdays-open?utm_source=businessinsider&utm_medium=referral,negative,0.8660826683044434
343,5/8/2023 4:42:26 PM,Henry Schein Q1 2023 Earnings Preview,Seeking Alpha,https://seekingalpha.com/news/3967225-henry-schein-q1-2023-earnings-preview?utm_source=businessinsider&utm_medium=referral,positive,0.9057670831680298
344,5/9/2023 10:34:22 AM,"Henry Schein Non-GAAP EPS of $1.21 misses by $0.02, revenue of $3.06B misses by $30M",Seeking Alpha,https://seekingalpha.com/news/3967779-henry-schein-non-gaap-eps-of-1_21-misses-0_02-revenue-of-3_06b-misses-30m?utm_source=businessinsider&utm_medium=referral,positive,0.6931322813034058
345,5/9/2023 12:52:44 PM,"Henry Schein Inc. Q1 Profit Decreases, misses estimates",RTTNews,/news/stocks/henry-schein-inc-q1-profit-decreases-misses-estimates-1032306050,neutral,0.9692772626876831
346,5/9/2023 1:06:21 PM,Henry Schein Trims FY23 Adj. EPS Outlook As Q1 Results Miss Estimates ,RTTNews,/news/stocks/henry-schein-trims-fy23-adj-eps-outlook-as-q1-results-miss-estimates-1032306143,neutral,0.953609824180603
347,5/10/2023 9:32:28 AM,"Analysts Have Conflicting Sentiments on These Healthcare Companies: Henry Schein (HSIC), Waters (WAT) and Bright Health Group (BHG)",TipRanks,/news/stocks/analysts-have-conflicting-sentiments-on-these-healthcare-companies-henry-schein-hsic-waters-wat-and-bright-health-group-bhg-1032311469,neutral,0.9249609708786011
348,5/10/2023 10:00:32 PM,The Latest Analyst Ratings for Henry Schein,Benzinga,/news/stocks/the-latest-analyst-ratings-for-henry-schein-1032314072,positive,0.9380548596382141
349,5/11/2023 3:56:02 PM,Henry Schein (HSIC) Receives a Hold from Robert W. Baird,TipRanks,/news/stocks/henry-schein-hsic-receives-a-hold-from-robert-w-baird-1032318784,positive,0.8487425446510315
350,7/9/2023 4:00:00 PM,Goldman Sachs sees rays of hope in underperforming health sector,Seeking Alpha,https://seekingalpha.com/news/3986286-goldman-sachs-sees-hope-underperforming-health-sector?utm_source=businessinsider&utm_medium=referral,negative,0.937191367149353
351,7/13/2023 10:38:12 AM,Henry Schein boosts liquidity by adding $750M credit facility,Seeking Alpha,https://seekingalpha.com/news/3987317-henry-schein-boost-liquidity-by-adding-750m-credit-facility?utm_source=businessinsider&utm_medium=referral,negative,0.9500539898872375
352,8/2/2023 12:23:40 PM,Henry Schein picks up majority stake in Large Practice Sales,Seeking Alpha,https://seekingalpha.com/news/3995126-henry-schein-picks-up-majority-stake-in-large-practice-sales?utm_source=businessinsider&utm_medium=referral,positive,0.9029083251953125
353,8/3/2023 11:52:43 AM,Henry Schein expands its continuum-of-care delivery model with new acquisition,Seeking Alpha,https://seekingalpha.com/news/3996452-henry-schein-expands-its-continuum-of-care-delivery-model-with-new-acquisition?utm_source=businessinsider&utm_medium=referral,negative,0.7336615324020386
354,8/4/2023 2:23:15 PM,Notable earnings before Monday's open,Seeking Alpha,https://seekingalpha.com/news/3997581-notable-earnings-before-mondays-open?utm_source=businessinsider&utm_medium=referral,negative,0.8824691772460938
355,8/4/2023 5:16:25 PM,Henry Schein Q2 2023 Earnings Preview,Seeking Alpha,https://seekingalpha.com/news/3997694-henry-schein-q2-2023-earnings-preview?utm_source=businessinsider&utm_medium=referral,positive,0.9039508700370789
356,8/6/2023 3:01:13 PM,Henry Schein earnings: here's what Wall Street expects,Markets Insider Automation,/news/stocks/henry_schein-stock-price-q2-earnings-preview-1032520223,positive,0.9329826235771179
357,8/7/2023 10:32:26 AM,"Henry Schein Non-GAAP EPS of $1.31 beats by $0.03, revenue of $3.1B misses by $30M",Seeking Alpha,https://seekingalpha.com/news/3998024-henry-schein-non-gaap-eps-of-1_31-beats-0_03-revenue-of-3_1b-misses-30m?utm_source=businessinsider&utm_medium=referral,positive,0.7541942596435547
358,8/7/2023 12:47:12 PM,"Henry Schein Inc. Q2 Profit Decreases, but beats estimates",RTTNews,/news/stocks/henry-schein-inc-q2-profit-decreases-but-beats-estimates-1032523388,neutral,0.9646316766738892
359,8/7/2023 4:34:23 PM,"PayPal Unveils USD-Backed Stablecoin, Trucking Firm Yellow Corp Files For Bankruptcy, FDA Approves First Oral Treatment For Postpartum Depression: Today's Top Stories",Benzinga,/news/stocks/paypal-unveils-usd-backed-stablecoin-trucking-firm-yellow-corp-files-for-bankruptcy-fda-approves-first-oral-treatment-for-postpartum-depression-today-s-top-stories-1032524770,positive,0.8963079452514648
360,8/7/2023 6:01:29 PM,Crude Oil Down Over 1%; Henry Schein Earnings Top Views,Benzinga,/news/stocks/crude-oil-down-over-1-henry-schein-earnings-top-views-1032524959,neutral,0.9585679173469543
361,8/7/2023 8:30:35 PM,Dow Gains 1%; Tabula Rasa HealthCare Shares Spike Higher,Benzinga,/news/stocks/dow-gains-1-tabula-rasa-healthcare-shares-spike-higher-1032525244,negative,0.9297245740890503
362,8/8/2023 1:15:17 AM,Henry Schein (HSIC) Gets a Sell from Bank of America Securities,TipRanks,/news/stocks/henry-schein-hsic-gets-a-sell-from-bank-of-america-securities-1032525824,positive,0.6260051727294922
363,8/8/2023 11:20:37 AM,Analysts Offer Insights on Healthcare Companies: Ocular Therapeutix (OCUL) and Henry Schein (HSIC),TipRanks,/news/stocks/analysts-offer-insights-on-healthcare-companies-ocular-therapeutix-ocul-and-henry-schein-hsic-1032528420,positive,0.9137231707572937
364,8/8/2023 11:56:28 AM,"Market Volatility Falls Sharply, S&P 500 Snaps 4-Session Losing Streak",Benzinga,/news/stocks/market-volatility-falls-sharply-s-p-500-snaps-4-session-losing-streak-1032528022,neutral,0.9518690705299377
365,8/8/2023 1:20:15 PM,Analysts Offer Insights on Healthcare Companies: Enanta Pharmaceuticals (ENTA) and Henry Schein (HSIC),TipRanks,/news/stocks/analysts-offer-insights-on-healthcare-companies-enanta-pharmaceuticals-enta-and-henry-schein-hsic-1032529313,positive,0.9170207977294922
366,9/21/2023 2:40:39 PM,Analysts Offer Insights on Healthcare Companies: Henry Schein (HSIC) and scPharmaceuticals (SCPH),TipRanks,/news/stocks/analysts-offer-insights-on-healthcare-companies-henry-schein-hsic-and-scpharmaceuticals-scph-1032647466,positive,0.9110451936721802
367,10/4/2023 10:55:53 AM,Piper Sandler Reaffirms Their Buy Rating on Henry Schein (HSIC),TipRanks,/news/stocks/piper-sandler-reaffirms-their-buy-rating-on-henry-schein-hsic-1032677333,positive,0.8485403656959534
368,10/12/2023 11:20:25 AM,"Analysts Conflicted on These Healthcare Names: Henry Schein (HSIC), HashiCorp (HCP) and Apellis Pharmaceuticals (APLS)",TipRanks,/news/stocks/analysts-conflicted-on-these-healthcare-names-henry-schein-hsic-hashicorp-hcp-and-apellis-pharmaceuticals-apls-1032700054,neutral,0.7698407173156738
369,11/3/2023 2:07:39 AM,Stifel Nicolaus Sticks to Its Hold Rating for Henry Schein (HSIC),TipRanks,/news/stocks/stifel-nicolaus-sticks-to-its-hold-rating-for-henry-schein-hsic-1032776415,positive,0.8222050666809082
370,11/8/2023 5:42:51 AM,Cybersecurity Attack and Revenue Losses: Influencing Factors for Jeff Johnson’s Hold Rating on Henry Schein (HSIC),TipRanks,/news/stocks/cybersecurity-attack-and-revenue-losses-influencing-factors-for-jeff-johnson-s-hold-rating-on-henry-schein-hsic-1032795889,positive,0.6832361221313477
371,11/10/2023 9:32:09 AM,"Analysts Offer Insights on Healthcare Companies: Korro Bio (KRRO), Henry Schein (HSIC) and Assertio Therapeutics (ASRT)",TipRanks,/news/stocks/analysts-offer-insights-on-healthcare-companies-korro-bio-krro-henry-schein-hsic-and-assertio-therapeutics-asrt-1032808053,positive,0.906409502029419
372,11/10/2023 8:39:29 PM,Henry Schein's Transition From Distributor To Manufacturer Spurs Upgrade - This Analyst Sees Easing Headwinds,Benzinga,/news/stocks/henry-schein-s-transition-from-distributor-to-manufacturer-spurs-upgrade---this-analyst-sees-easing-headwinds-1032807887,negative,0.647081732749939
373,11/12/2023 3:01:13 PM,Here's what Wall Street expects from Henry Schein's earnings,Markets Insider Automation,/news/stocks/henry_schein-quarter-earnings-preview-q3-1032809514,positive,0.9303194880485535
374,11/13/2023 7:07:50 AM,Henry Schein Gears Up For Q3 Print; Here's A Look At Recent Price Target Changes By The Most Accurate Analysts,Benzinga,/news/stocks/henry-schein-gears-up-for-q3-print-here-s-a-look-at-recent-price-target-changes-by-the-most-accurate-analysts-1032811586,positive,0.93495112657547
375,11/13/2023 12:12:16 PM,"Henry Schein, Verve Therapeutics And Other Big Stocks Moving Lower In Monday's Pre-Market Session",Benzinga,/news/stocks/henry-schein-verve-therapeutics-and-other-big-stocks-moving-lower-in-monday-s-pre-market-session-1032812451,neutral,0.9686434268951416
376,11/13/2023 12:40:56 PM,"Henry Schein Inc. Q3 Profit Drops, Inline With Estimates",RTTNews,/news/stocks/henry-schein-inc-q3-profit-drops-inline-with-estimates-1032812548,neutral,0.9735861420631409
377,11/13/2023 1:00:44 PM,Henry Schein Updates 2023 Guidance; Sales To Decline Primarily Due To Cybersecurity Incident ,RTTNews,/news/stocks/henry-schein-updates-2023-guidance-sales-to-decline-primarily-due-to-cybersecurity-incident-1032812626,neutral,0.9716230630874634
378,11/13/2023 5:30:50 PM,"Monday.Com Reports Q3 Beat, Joins Fortrea Holdings, Henry Schein And Other Big Stocks Moving Higher On Monday",Benzinga,/news/stocks/monday-com-reports-q3-beat-joins-fortrea-holdings-henry-schein-and-other-big-stocks-moving-higher-on-monday-1032813987,negative,0.8743466138839722
379,11/13/2023 6:18:22 PM,Why Is Dental Supplier Henry Schein Stock Trading Higher Today?,Benzinga,/news/stocks/why-is-dental-supplier-henry-schein-stock-trading-higher-today-1032814157,positive,0.7922219634056091
380,11/13/2023 7:35:20 PM,"Stocks Pause Ahead Of CPI Report; Commodities, Tesla, Boeing Surge On Rising China Hopes: What's Driving Markets Monday?",Benzinga,/news/etf/stocks-pause-ahead-of-cpi-report-commodities-tesla-boeing-surge-on-rising-china-hopes-what-s-driving-markets-monday-1032814290,positive,0.5582394003868103
381,11/14/2023 8:18:11 AM,Fear Continues To Grip Markets Ahead Of Inflation Data,Benzinga,/news/stocks/fear-continues-to-grip-markets-ahead-of-inflation-data-1032816272,neutral,0.9065284132957458
382,11/14/2023 12:35:27 PM,Piper Sandler Keeps Their Buy Rating on Henry Schein (HSIC),TipRanks,/news/stocks/piper-sandler-keeps-their-buy-rating-on-henry-schein-hsic-1032819825,positive,0.9209296107292175
383,11/14/2023 6:00:44 PM,What 5 Analyst Ratings Have To Say About Henry Schein,Benzinga,/news/stocks/what-5-analyst-ratings-have-to-say-about-henry-schein-1032818926,positive,0.9242782592773438
384,11/14/2023 8:16:34 PM,These Analysts Slash Their Forecasts On Henry Schein After Q3 Results,Benzinga,/news/stocks/these-analysts-slash-their-forecasts-on-henry-schein-after-q3-results-1032819236,neutral,0.9425855278968811
385,11/21/2023 12:50:44 PM,"Analysts Offer Insights on Healthcare Companies: Agilent (A), Henry Schein (HSIC) and Biogen (BIIB)",TipRanks,/news/stocks/analysts-offer-insights-on-healthcare-companies-agilent-a-henry-schein-hsic-and-biogen-biib-1032841047,positive,0.8971436619758606
386,11/30/2023 1:30:17 PM,"Analysts Are Bullish on Top Healthcare Stocks: Henry Schein (HSIC), DocGo (DCGO)",TipRanks,/news/stocks/analysts-are-bullish-on-top-healthcare-stocks-henry-schein-hsic-docgo-dcgo-1032864749,positive,0.7742425799369812
387,12/4/2023 8:16:18 AM,Henry Schein: Zahn Dental To Distribute Myerson's Trusana Premium Denture System ,RTTNews,/news/stocks/henry-schein-zahn-dental-to-distribute-myerson-s-trusana-premium-denture-system-1032869202,positive,0.864768922328949
388,12/6/2023 3:25:29 AM,Goldman Sachs Keeps Their Hold Rating on Henry Schein (HSIC),TipRanks,/news/stocks/goldman-sachs-keeps-their-hold-rating-on-henry-schein-hsic-1032878929,positive,0.9204943776130676
389,12/12/2023 3:00:51 PM,What 8 Analyst Ratings Have To Say About Henry Schein,Benzinga,/news/stocks/what-8-analyst-ratings-have-to-say-about-henry-schein-1032893313,positive,0.9258061051368713
390,12/20/2023 1:55:22 PM,Henry Schein To Acquire TriMed To Enter Orthopedic Extremities Specialty Segment ,RTTNews,/news/stocks/henry-schein-to-acquire-trimed-to-enter-orthopedic-extremities-specialty-segment-1032915762,positive,0.8917509913444519
391,12/21/2023 11:00:45 AM,"Analysts Conflicted on These Healthcare Names: Halozyme (HALO), Immunovant (IMVT) and Henry Schein (HSIC)",TipRanks,/news/stocks/analysts-conflicted-on-these-healthcare-names-halozyme-halo-immunovant-imvt-and-henry-schein-hsic-1032920784,neutral,0.602569580078125
392,12/21/2023 11:50:10 AM,"Analysts Offer Insights on Healthcare Companies: Liquidia Technologies (LQDA), Henry Schein (HSIC) and Palatin Technologies (PTN)",TipRanks,/news/stocks/analysts-offer-insights-on-healthcare-companies-liquidia-technologies-lqda-henry-schein-hsic-and-palatin-technologies-ptn-1032920795,positive,0.9071844220161438
393,2/21/2024 1:02:09 PM,Stifel Nicolaus upgrades Henry Schein (HSIC) to a Buy,TipRanks,/news/stocks/stifel-nicolaus-upgrades-henry-schein-hsic-to-a-buy-1033088854,negative,0.7384827136993408
394,2/26/2024 3:01:13 PM,Here's what Wall Street expects from Henry Schein's earnings,Markets Insider Automation,/news/stocks/henry_schein-q4-quarterly-earnings-preview-stock-1033102589,positive,0.9303194880485535
395,2/26/2024 4:48:58 PM,Henry Schein Q4 2023 Earnings Preview,Seeking Alpha,https://seekingalpha.com/news/4071691-henry-schein-q4-2023-earnings-preview?utm_source=businessinsider&utm_medium=referral&feed_item_type=news,positive,0.9075705409049988
396,2/27/2024 11:05:17 AM,"Henry Schein Non-GAAP EPS of $0.66 misses by $0.04, revenue of $3.02B misses by $20M",Seeking Alpha,https://seekingalpha.com/news/4072085-henry-schein-non-gaap-eps-of-0_66-misses-0_04-revenue-of-3_02b-misses-20m?utm_source=businessinsider&utm_medium=referral&feed_item_type=news,positive,0.5821242332458496
397,2/27/2024 12:38:21 PM,"Henry Schein Inc. Q4 Profit Decreases, misses estimates",RTTNews,/news/stocks/henry-schein-inc-q4-profit-decreases-misses-estimates-1033106744,neutral,0.9694907665252686
398,2/27/2024 12:49:28 PM,"Henry Schein Q4 Profit Misses Estimates, Sees Higher FY24 Results; Stock Down In Pre-market ",RTTNews,/news/stocks/henry-schein-q4-profit-misses-estimates-sees-higher-fy24-results-stock-down-in-pre-market-1033106754,neutral,0.9643632173538208
399,2/27/2024 5:12:34 PM,"Cybersecurity Incident Casts Shadow On Henry Schein's Q4 Performance, Analysts Optimistic On Dental Sector",Benzinga,/news/stocks/cybersecurity-incident-casts-shadow-on-henry-schein-s-q4-performance-analysts-optimistic-on-dental-sector-1033108567,neutral,0.9599786400794983
400,2/28/2024 3:55:42 AM,Goldman Sachs Sticks to Its Hold Rating for Henry Schein (HSIC),TipRanks,/news/stocks/goldman-sachs-sticks-to-its-hold-rating-for-henry-schein-hsic-1033111035,positive,0.8901515007019043
401,2/28/2024 10:49:06 AM,Henry Schein Stock Faces Headwinds: Sell Rating Affirmed Amidst Growth and Revenue Challenges,TipRanks,/news/stocks/henry-schein-stock-faces-headwinds-sell-rating-affirmed-amidst-growth-and-revenue-challenges-1033112767,neutral,0.737829864025116
402,2/28/2024 2:20:09 PM,Wall Street Analysts Are Bullish on Top Healthcare Picks,TipRanks,/news/stocks/wall-street-analysts-are-bullish-on-top-healthcare-picks-1033114355,negative,0.5521676540374756
403,2/28/2024 9:00:34 PM,5 Analysts Assess Henry Schein: What You Need To Know,Benzinga,/news/stocks/5-analysts-assess-henry-schein-what-you-need-to-know-1033114708,positive,0.9289320707321167
404,4/12/2024 7:27:26 PM,Stocks likely to beat and miss their earnings expectations - BofA,Seeking Alpha,https://seekingalpha.com/news/4089349-stocks-likely-to-beat-and-miss-their-earnings-expectations-bofa?utm_source=businessinsider&utm_medium=referral&feed_item_type=news,neutral,0.8038596510887146
405,5/6/2024 2:38:46 PM,Henry Schein Q1 2024 Earnings Preview,Seeking Alpha,https://seekingalpha.com/news/4100370-henry-schein-q1-2024-earnings-preview?utm_source=businessinsider&utm_medium=referral&feed_item_type=news,positive,0.9077332615852356
406,5/6/2024 3:01:13 PM,What Wall Street expects from Henry Schein's earnings,Markets Insider Automation,/news/stocks/henry_schein-stock-price-quarter-earnings-preview-q1-1033332920,positive,0.934475302696228
