,datetime,title,source,link,sentiment_class,sentiment_score
678,11/17/2021 8:46:03 PM,Ignore the Bearish Noise and Invest in Palantir Stock,InvestorPlace,/news/stocks/ignore-the-bearish-noise-and-invest-in-pltr-stock-1030985749,positive,0.9221832752227783
679,11/18/2021 8:15:27 PM,How and Why Investors Should Buy the Dip in Palantir,InvestorPlace,/news/stocks/how-and-why-investors-should-buy-the-dip-in-pltr-stock-1030989560,positive,0.9270661473274231
680,11/18/2021 9:38:23 PM,VOSO Stock Alert: The Wejo SPAC Merger News Investors Are Cheering Today,InvestorPlace,/news/stocks/voso-stock-alert-the-wejo-spac-merger-news-investors-are-cheering-today-1030989813,negative,0.678864061832428
681,11/19/2021 3:37:35 PM,WEJO Stock: 8 Things to Know as Palantir-Backed Wejo Starts Trading Today,InvestorPlace,/news/stocks/wejo-stock-8-things-to-know-as-palantir-backed-wejo-starts-trading-today-1030991912,positive,0.9350941181182861
682,11/19/2021 9:45:55 PM,Wait for Commercial Growth and a Price Drop to Buy Palantir Stock,InvestorPlace,/news/stocks/wait-for-commercial-growth-and-a-price-drop-to-buy-pltr-stock-1030992596,neutral,0.5696049332618713
683,11/22/2021 8:32:24 PM,"ASAN, DOCN, CRWD, PLTR: Why Are Tech Stocks Down Today?",InvestorPlace,/news/stocks/asan-docn-crwd-pltr-why-are-tech-stocks-down-today-1030996106,neutral,0.9437645673751831
684,11/22/2021 9:01:37 PM,PLTR Stock Is Falling Today Amid a Tech Rout. Goldman Still Thinks It’s a Top Bet.,InvestorPlace,/news/stocks/pltr-stock-is-falling-today-amid-a-tech-rout-goldman-still-thinks-its-a-top-bet-1030996176,neutral,0.9697437286376953
685,11/23/2021 4:09:07 AM,"Cathie Wood Continues Profit-Booking In Tesla, Selling Another $210M Shares On Monday — Here Are The Other Key Trades",Benzinga,/news/etf/cathie-wood-continues-profit-booking-in-tesla-selling-another-210m-shares-on-monday-—-here-are-the-other-key-trades-1030996435,positive,0.9342054128646851
686,11/23/2021 3:07:19 PM,3 ARK Stocks to Buy Going into 2022,InvestorPlace,/news/stocks/3-ark-stocks-to-buy-going-into-2022-1030998385,positive,0.900271475315094
687,12/2/2021 1:31:55 PM,Kinder Morgan To Deploy Palantir's Data Integration Software Platform In Its Storage Operations ,RTTNews,/news/stocks/kinder-morgan-to-deploy-palantir-s-data-integration-software-platform-in-its-storage-operations-1031019517,negative,0.5107734203338623
688,12/2/2021 4:09:44 PM,3 Stocks to Buy on Dips for 2022 and Beyond,InvestorPlace,/news/stocks/3-stocks-to-buy-on-dips-for-2022-and-beyond-1031020613,positive,0.5727991461753845
689,12/3/2021 1:05:17 PM,Rivian Automotive Stock Will Have a Long Road Back to Its $180 Highs,InvestorPlace,/news/stocks/rivn-stock-will-have-a-long-road-back-to-its-180-highs-1031022898,positive,0.6906082034111023
690,12/3/2021 5:33:10 PM,7 Top Cybersecurity Stocks to Buy Heading Into Year-End,InvestorPlace,/news/stocks/7-top-cybersecurity-stocks-to-buy-heading-into-year-end-1031023715,positive,0.656146228313446
691,12/3/2021 8:00:27 PM,"Catalyst watch for next week: Rivian ratings pour in, big events for Southwest Airlines, McKesson and CVS Health",Seeking Alpha,https://seekingalpha.com/news/3777035-catalyst-watch-for-next-week-rivian-ratings-pour-in-big-events-for-southwest-airlines-mckesson-and-cvs-health?utm_source=markets.businessinsider.com&utm_medium=referral,positive,0.7913451194763184
692,12/3/2021 9:33:31 PM,"Tech Stocks Alert: Why Are ADBE, MSFT, TSLA, PLTR Down Today?",InvestorPlace,/news/stocks/tech-stocks-alert-why-are-adbe-msft-tsla-pltr-down-today-1031024048,neutral,0.895411491394043
693,12/5/2021 11:46:46 PM,"December SPAC Merger Calendar: Upcoming Votes, Stocks To Watch",Benzinga,/news/stocks/december-spac-merger-calendar-upcoming-votes-stocks-to-watch-1031024684,positive,0.9297987222671509
694,12/6/2021 2:00:47 PM,"Jim Cramer Shares His Thoughts On Novavax, ViacomCBS And More",Benzinga,/news/stocks/jim-cramer-shares-his-thoughts-on-novavax-viacomcbs-and-more-1031025887,positive,0.9360494017601013
695,12/7/2021 1:00:00 PM,Athinia to Accelerate the Use of AI and Big Data to Solve Critical Semiconductor Challenges,PR Newswire,/news/stocks/athinia-to-accelerate-the-use-of-ai-and-big-data-to-solve-critical-semiconductor-challenges-1031028697,negative,0.7608427405357361
696,12/7/2021 2:07:16 PM,"Palantir, Merck partner to tackle chip shortage",Seeking Alpha,https://seekingalpha.com/news/3777753-palantir-merck-partner-to-tackle-chip-shortage?utm_source=markets.businessinsider.com&utm_medium=referral,positive,0.5008350014686584
697,12/7/2021 7:17:20 PM,Palantir Stock Is a Secret Buy You’re Overlooking,InvestorPlace,/news/stocks/palantir-pltr-stock-is-a-secret-buy-youre-overlooking-1031030254,positive,0.9320326447486877
698,12/7/2021 7:20:54 PM,UiPath Needs Time to Reverse the Tide in Its Favor,InvestorPlace,/news/stocks/path-stock-needs-time-to-reverse-the-tide-in-its-favor-1031030253,positive,0.6929696202278137
699,12/7/2021 7:46:15 PM,5 Stocks to Sell Before 2022 Sends Them to the Market Morgue,InvestorPlace,/news/stocks/5-stocks-to-sell-before-2022-sends-them-to-the-market-morgue-1031030276,positive,0.7115064263343811
700,12/7/2021 10:11:18 PM,Palantir Is Forming a Pattern That Bullish Investors Should Love,InvestorPlace,/news/stocks/pltr-stock-forming-pattern-bullish-investors-should-love-1031030575,positive,0.8318697810173035
701,12/9/2021 8:05:55 PM,"Palantir Stock May Be Down, But It’s Definitely Not Out",InvestorPlace,/news/stocks/pltr-stock-may-be-down-but-its-definitely-not-out-1031036932,neutral,0.9558905959129333
702,12/10/2021 7:04:00 PM,This ETF Brings Exposure To Meme Stocks: A Look At The Holdings,Benzinga,/news/etf/this-etf-brings-exposure-to-meme-stocks-a-look-at-the-holdings-1031039478,positive,0.9215803742408752
703,12/10/2021 8:09:39 PM,Palantir Remains an Enigma for Wall Street,InvestorPlace,/news/stocks/palantir-pltr-stock-remains-an-enigma-for-wall-street-1031039637,positive,0.5398441553115845
704,12/13/2021 11:00:59 AM,Cloudflare Stock Still Has Exceptional Growth Ahead If You’re Patient Enough,InvestorPlace,/news/stocks/net-stock-still-has-exceptional-growth-ahead-if-youre-pateint-enough-1031041253,negative,0.8636011481285095
705,12/13/2021 4:13:44 PM,Slowing Growth Could Cause Further Slide for Palantir Stock,InvestorPlace,/news/stocks/pltr-stock-slowing-growth-could-cause-further-slide-1031041964,neutral,0.9705697298049927
706,12/14/2021 6:27:54 PM,"Even At a Relative Discount, No One Wants to Buy Palantir Stock",InvestorPlace,/news/stocks/pltr-stock-even-at-a-relative-discount-no-one-wants-to-buy-palantir-stock-1031044419,positive,0.920464813709259
707,12/14/2021 8:11:48 PM,7 Post-Covid Software Stocks to Snatch at a Steep Discount,InvestorPlace,/news/stocks/7-post-covid-software-stocks-to-snatch-at-a-steep-discount-1031044524,neutral,0.7445548176765442
708,12/15/2021 9:37:42 PM,"Buy DigitalOcean Stock Now, If Your Concern Is 2026",InvestorPlace,/news/stocks/docn-stock-digitalocean-limits-to-the-value-of-growth-1031048592,positive,0.9468080997467041
709,12/16/2021 4:01:09 PM,Why NET Stock Dipped Sharply,InvestorPlace,/news/stocks/why-net-stock-dipped-sharply-1031050977,neutral,0.9275385141372681
710,12/16/2021 9:03:27 PM,What This Crypto Billionaire’s Big Bet on Longevity Means for You,InvestorPlace,/news/stocks/what-this-crypto-billionaires-big-bet-on-longevity-means-for-you-1031051666,positive,0.9129811525344849
711,12/17/2021 6:34:48 PM,Palantir Keeps Falling Despite Fantastic Financials,InvestorPlace,/news/stocks/pltr-stock-is-worth-at-least-30-percent-more-at-23-74-based-on-analysts-average-price-targets-1031054097,neutral,0.9197149872779846
712,12/17/2021 8:00:01 PM,"Catalyst watch for next week: Nike and Micron earnings, SPAC votes and Peloton action",Seeking Alpha,https://seekingalpha.com/news/3781417-catalyst-watch-for-next-week-nike-and-micron-earnings-spac-votes-and-peloton-action?utm_source=markets.businessinsider.com&utm_medium=referral,positive,0.9215481877326965
713,12/20/2021 8:33:23 PM,PLTR Stock Alert: 5 Things to Know About Palantir’s Latest Partnership,InvestorPlace,/news/stocks/pltr-stock-alert-5-things-to-know-about-palantirs-latest-partnership-1031057530,positive,0.943213164806366
714,12/21/2021 8:27:50 PM,Why Wedbush Predicts Nearly 100% Upside For This Auto Data Analytics Firm,Benzinga,/news/stocks/why-wedbush-predicts-nearly-100-upside-for-this-auto-data-analytics-firm-1031060215,positive,0.7441242337226868
715,12/22/2021 11:00:59 AM,Buy Palantir Stock While the Analysts Remain Bearish,InvestorPlace,/news/stocks/buy-pltr-stock-while-the-analysts-remain-bearish-1031061330,positive,0.8463932871818542
716,12/27/2021 11:00:47 AM,The Critics Are Wrong About Bionano Stock,InvestorPlace,/news/stocks/the-critics-are-wrong-about-bngo-stock-1031066670,positive,0.6026648283004761
717,12/28/2021 11:00:15 AM,Palantir Stock Is a Long-Term Value Buy Here for Patient Investor,InvestorPlace,/news/stocks/pltr-stock-is-a-long-term-value-buy-here-for-patient-investor-1031067972,positive,0.870881199836731
718,12/28/2021 4:15:03 PM,"Palantir Stock Is Temporarily Short on Fans, Not Fundamentals",InvestorPlace,/news/stocks/pltr-stock-palantir-temporarily-short-on-fans-not-fundamentals-1031068527,neutral,0.94468092918396
719,12/29/2021 11:00:58 AM,Foundry for Crypto Is a Game Changer for Palantir Stock,InvestorPlace,/news/stocks/foundry-for-crypto-is-a-game-changer-for-pltr-stock-1031069736,positive,0.9342267513275146
720,12/31/2021 4:29:26 PM,Crypto.com Coin: My No. 4 Moonshot Pick for 2022,InvestorPlace,/news/stocks/crypto-com-coin-my-no-4-moonshot-pick-for-2022-1031072421,positive,0.8877297043800354
721,1/2/2022 11:19:00 PM,"Top 10 Most Searched Tickers On Benzinga Pro In 2021: Tesla, Apple, AMC, GameStop And More",Benzinga,/news/stocks/top-10-most-searched-tickers-on-benzinga-pro-in-2021-tesla-apple-amc-gamestop-and-more-1031073243,positive,0.9262474179267883
722,1/4/2022 10:30:47 AM,"Cathie Wood Continues Booking Profit In Tesla As Stock Shoots Up, Loads Up On These 2 Stocks Instead",Benzinga,/news/etf/cathie-wood-continues-booking-profit-in-tesla-as-stock-shoots-up-loads-up-on-these-2-stocks-instead-1031075565,negative,0.9092758297920227
723,1/4/2022 4:25:35 PM,"Palantir Technologies Is Back in the Buy Zone, So Act Fast",InvestorPlace,/news/stocks/pltr-stock-is-back-in-the-buy-zone-so-act-fast-before-missing-out-1031077267,positive,0.7981564998626709
724,1/4/2022 4:33:52 PM,Palantir Will Push Higher Even As Traditional Military Stocks Suffer,InvestorPlace,/news/stocks/palantir-will-push-higher-even-as-traditional-military-stocks-suffer-1031077311,negative,0.9326462149620056
725,1/4/2022 10:22:44 PM,EXCLUSIVE: Wejo Announces New Connected Vehicle Platform With Microsoft,Benzinga,/news/stocks/exclusive-wejo-announces-new-connected-vehicle-platform-with-microsoft-1031077790,positive,0.5082690119743347
726,1/5/2022 12:00:42 PM,Palantir Is Ready To Reawaken After Slumbering Long Enough,InvestorPlace,/news/stocks/pltr-stock-is-ready-to-reawaken-after-slumbering-long-enough-1031078930,negative,0.6474087834358215
727,1/5/2022 12:42:33 PM,Palantir and Hyundai Heavy Industries team up for big data engineering platform,Seeking Alpha,https://seekingalpha.com/news/3785327-palantir-and-hyundai-heavy-industries-team-up-for-big-data-engineering-platform?utm_source=markets.businessinsider.com&utm_medium=referral,negative,0.58668452501297
728,1/5/2022 3:37:13 PM,Why Wejo Shares Are Rising,Benzinga,/news/stocks/why-wejo-shares-are-rising-1031079482,positive,0.8468972444534302
729,1/5/2022 7:42:09 PM,PLTR Stock Fans Should Pay Attention to the Latest Palantir Partnership News,InvestorPlace,/news/stocks/pltr-stock-fans-should-pay-attention-to-the-latest-palantir-partnership-news-1031080166,positive,0.8975468277931213
730,1/5/2022 10:23:32 PM,"4 Top Stock Trades for Thursday: ARKK, 10-Year Rates, Litecoin, PLTR",InvestorPlace,/news/stocks/4-top-stock-trades-for-thursday-arkk-10-year-rates-litecoin-pltr-1031080399,positive,0.933163583278656
731,1/6/2022 8:25:10 PM,3 Stocks to Buy Despite Rate-Hike Jitters,InvestorPlace,/news/stocks/3-stocks-to-buy-despite-rate-hike-jitters-1031082468,negative,0.6494212746620178
732,1/7/2022 4:04:39 AM,Cathie Wood Sells Another $4.9M In Tesla Stock On Thursday — Buys Shares In Palantir And This Chinese E-Commerce Giant,Benzinga,/news/etf/cathie-wood-sells-another-4-9m-in-tesla-stock-on-thursday-—-buys-shares-in-palantir-and-this-chinese-e-commerce-giant-1031082698,positive,0.8476527333259583
733,1/7/2022 7:00:35 PM,"Catalyst watch for next week: Biogen, Five Below, Tritium and Monster Beverage in the spotlight",Seeking Alpha,https://seekingalpha.com/news/3786173-catalyst-watch-for-next-week-biogen-five-below-tritium-and-monster-beverage-in-the-spotlight?utm_source=markets.businessinsider.com&utm_medium=referral,positive,0.9277867674827576
734,1/10/2022 5:15:07 PM,3 Growth Stocks to Sell into Strength,InvestorPlace,/news/stocks/3-growth-stocks-to-sell-into-strength-1031091595,positive,0.8635799884796143
735,1/10/2022 7:23:01 PM,PLTR Stock Alert: Why Did Palantir Just Hit a 52-Week Low?,InvestorPlace,/news/stocks/pltr-stock-alert-why-did-palantir-just-hit-a-52-week-low-1031091859,neutral,0.9067749977111816
736,1/12/2022 11:00:58 AM,Our 7 Top Stock Market Predictions for 2022,InvestorPlace,/news/stocks/our-7-top-stock-market-predictions-for-2022-1031096456,positive,0.9274581074714661
737,1/13/2022 11:14:07 AM,Cathie Wood Sells Another $3M Shares In Tesla On Wednesday — Here's What She Bought Instead,Benzinga,/news/etf/cathie-wood-sells-another-3m-shares-in-tesla-on-wednesday-—-here-s-what-she-bought-instead-1031099487,positive,0.9359630346298218
738,1/13/2022 9:45:46 PM,Investors Should Be Wary of Roblox’s Threats and Weaknesses,InvestorPlace,/news/stocks/rblx-stock-investors-should-be-wary-of-robloxs-threats-and-weaknesses-1031101612,positive,0.8648125529289246
739,1/14/2022 11:00:26 AM,Palantir Stock Is a Buy on the Dip After This Recent Selloff,InvestorPlace,/news/stocks/pltr-stock-is-a-buy-on-the-dip-after-this-recent-selloff-1031102834,negative,0.5316316485404968
740,1/14/2022 4:37:54 PM,Rising Rates Could Put More Pressure on Palantir Stock,InvestorPlace,/news/stocks/pltr-stock-rising-rates-more-pressure-1031103826,neutral,0.9377105832099915
741,1/17/2022 11:00:08 AM,Palantir Technologies Stock Looks Like a Big Test for Contrarian Philosophies Here,InvestorPlace,/news/stocks/pltr-stock-looks-like-a-big-test-for-contrarian-philosophies-here-1031106147,positive,0.7476890683174133
742,1/17/2022 11:00:28 AM,"With Growth Visibility, Palantir Deserves Its Premium Valuation",InvestorPlace,/news/stocks/with-growth-visibility-pltr-stock-deserves-its-premium-valuation-1031106145,negative,0.9156189560890198
743,1/18/2022 11:00:12 AM,Palantir Strikes a Promising Deal With Hyundai,InvestorPlace,/news/stocks/palantir-pltr-stock-strikes-promising-deal-with-hyundai-1031108277,negative,0.9239159226417542
744,1/18/2022 11:23:58 AM,"Palantir Technologies Is a Buy on Weakness, Even If the Current Slide Continues",InvestorPlace,/news/stocks/pltr-stock-is-a-buy-on-weakness-even-if-the-current-slide-continues-1031108297,negative,0.64466392993927
745,1/18/2022 4:36:40 PM,22 Million Reasons to Love Robinhood Stock Again,InvestorPlace,/news/stocks/22-million-reasons-to-love-robinhood-stock-again-1031109840,positive,0.9299205541610718
746,1/18/2022 7:53:36 PM,PLTR Stock Price Predictions: Where Will Palantir Go After Hitting New 52-Week Low?,InvestorPlace,/news/stocks/pltr-stock-price-predictions-where-will-palantir-go-after-hitting-new-52-week-low-1031110273,neutral,0.6821230053901672
747,1/19/2022 1:38:22 PM,Cathie Wood Loads Up In This Crypto Stock As It Crashes 25% On Tuesday — These Are Other Key Trades,Benzinga,/news/etf/cathie-wood-loads-up-in-this-crypto-stock-as-it-crashes-25-on-tuesday-—-these-are-other-key-trades-1031112314,positive,0.8566213250160217
748,1/19/2022 5:34:24 PM,Palantir Stock Is a Bull in Bear’s Clothing,InvestorPlace,/news/stocks/palantir-pltr-stock-is-a-bull-in-bears-clothing-1031113682,positive,0.8610330820083618
749,1/19/2022 9:57:51 PM,Palantir’s Long-Term Bull Case Looks Compelling,InvestorPlace,/news/stocks/pltr-stocks-long-term-bull-case-looks-highly-compelling-at-this-stage-1031114134,positive,0.5158545970916748
750,1/20/2022 4:23:25 PM,BLND Stock: 9 Things to Know About Blend Labs as Shares Get a Big Boost Today,InvestorPlace,/news/stocks/blnd-stock-9-things-to-know-about-blend-labs-as-shares-get-a-big-boost-today-1031116921,positive,0.8210299015045166
751,1/20/2022 9:05:09 PM,Here Is Why Palantir Is Plunging,InvestorPlace,/news/stocks/here-is-why-pltr-stock-is-plunging-1031117543,positive,0.9420335292816162
752,1/21/2022 6:56:29 PM,"Despite Palantir’s Impressive Deals, Its Losses and Valuation Make It Unappetizing",InvestorPlace,/news/stocks/pltr-stock-has-had-some-impressive-deals-but-its-still-a-sell-1031119798,neutral,0.9035834670066833
753,1/24/2022 6:38:32 PM,Palantir Stock Looks Like a Good Long-Term Stock if You Don’t Overthink It,InvestorPlace,/news/stocks/pltr-stock-looks-like-solid-long-term-buy-but-dont-overthink-it-1031123737,negative,0.682153046131134
754,1/24/2022 9:26:22 PM,Palantir Stock Will Be Continually Challenged in the Near Term,InvestorPlace,/news/stocks/pltr-stock-will-be-continually-challenged-in-the-near-term-1031124035,neutral,0.9317163228988647
755,1/24/2022 10:51:10 PM,"4 Top Stock Trades for Tuesday: Bitcoin, AAPL, MSFT, PLTR",InvestorPlace,/news/stocks/4-top-stock-trades-for-tuesday-bitcoin-aapl-msft-pltr-1031124246,positive,0.9278466701507568
756,1/26/2022 12:39:31 PM,Palantir names Philippe Mathieu as President of Palantir EMEA,Seeking Alpha,https://seekingalpha.com/news/3791709-palantir-names-philippe-mathieu-as-president-of-palantir-emea?utm_source=markets.businessinsider.com&utm_medium=referral,positive,0.9527083039283752
757,1/27/2022 11:00:39 AM,Stand Back as the Steep Pullback in Palantir Stock Looks to Get Worse,InvestorPlace,/news/stocks/stand-back-as-the-steep-pullback-in-pltr-stock-looks-to-get-worse-1031134710,neutral,0.7440034747123718
758,1/27/2022 7:09:34 PM,Upstart Stock Looks Poised To Soar After Huge Pullback,InvestorPlace,/news/stocks/upst-stock-looks-poised-to-soar-after-huge-pullback-1031136858,negative,0.9191316962242126
759,1/28/2022 6:15:32 PM,7 Technology Stocks Reporting Earnings the Week of January 31,InvestorPlace,/news/stocks/earnings-reports-to-watch-next-week-1028709625,positive,0.5936208367347717
760,1/31/2022 6:07:19 PM,3 Small-Cap Stocks to Buy That Face Extreme Duress,InvestorPlace,/news/stocks/3-small-cap-stocks-to-buy-that-face-extreme-duress-1031145614,positive,0.5885023474693298
761,2/1/2022 3:02:44 PM,Why Palantir Shares Are Rising Today,Benzinga,/news/stocks/why-palantir-shares-are-rising-today-1031149370,negative,0.6582345366477966
762,2/1/2022 10:27:12 PM,3 Stocks For the “Great Rotation to Quality”,InvestorPlace,/news/stocks/3-stocks-for-the-great-rotation-to-quality-1031152702,positive,0.7763171195983887
763,2/2/2022 7:25:26 AM,Cathie Wood's Ark Is Now Completely Out Of Netflix,Benzinga,/news/etf/cathie-wood-s-ark-is-now-completely-out-of-netflix-1031152586,neutral,0.523646354675293
764,2/3/2022 3:11:50 PM,7 Reddit Stocks That Are Seeing a Surge in WallStreetBets Chatter,InvestorPlace,/news/stocks/7-reddit-stocks-that-are-seeing-a-surge-in-wallstreetbets-chatter-1031159439,negative,0.6489209532737732
765,2/4/2022 3:12:02 PM,Palantir Stock Is Trading Too Cheap After Its Recent Huge Drop,InvestorPlace,/news/stocks/pltr-stock-could-rise-substantially-based-on-its-powerful-free-cash-flow-and-its-cheap-valuation-now-1031162863,neutral,0.9426556825637817
766,2/4/2022 6:50:06 PM,7 Meme Stocks to Avoid as the Phenomenon Fades,InvestorPlace,/news/stocks/7-meme-stocks-to-avoid-as-phenomenon-fades-1031163352,positive,0.9000953435897827
767,2/4/2022 7:53:25 PM,7 Best Quantum Computing Stocks to Buy in 2022,InvestorPlace,/news/stocks/7-best-quantum-computing-stocks-to-buy-in-2022-1031163438,positive,0.8583852052688599
768,2/7/2022 9:18:46 PM,"Thiel exiting Meta Platforms board, will reportedly focus on Trump politics work",Seeking Alpha,https://seekingalpha.com/news/3796917-thiel-exiting-meta-platforms-board-will-reportedly-focus-on-politics-work?utm_source=markets.businessinsider.com&utm_medium=referral,positive,0.94499671459198
769,2/8/2022 7:47:46 PM,Palantir Stock Embodies the Perils of Buying Growth,InvestorPlace,/news/stocks/palantir-pltr-stock-embodies-the-perils-of-buying-growth-1031173151,positive,0.8012974262237549
770,2/9/2022 6:07:47 PM,Cathie Wood Is Buying This Peter Thiel-Backed Psychedelics Stock For Ark Funds,Benzinga,/news/stocks/cathie-wood-is-buying-this-peter-thiel-backed-psychedelics-stock-for-ark-funds-1031178107,positive,0.9476310014724731
771,2/11/2022 7:36:40 PM,Palantir Technologies Stock Is Poised for a Strong Comeback,InvestorPlace,/news/stocks/palantir-technologies-pltr-stock-poised-for-comeback-1031187448,negative,0.9212906956672668
772,2/14/2022 3:12:49 PM,"As the Story About It Changes, Steer Clear of Palantir",InvestorPlace,/news/stocks/pltr-stock-as-story-behind-it-changes-steer-clear-1031191989,positive,0.9185357689857483
773,2/14/2022 4:57:28 PM,"Benzinga's Daily Brief On Trending Tickers For Feb. 14, 2022: GameStop, Nvidia, AMD And More",Benzinga,/news/stocks/benzinga-s-daily-brief-on-trending-tickers-for-feb-14-2022-gamestop-nvidia-amd-and-more-1031192124,positive,0.945315957069397
774,2/14/2022 5:08:09 PM,3 Stocks to Buy Even Into This Volatile Market,InvestorPlace,/news/stocks/3-stocks-to-buy-even-into-this-volatile-market-1031192347,positive,0.4957889914512634
775,2/14/2022 6:06:55 PM,Palantir Technolgies Vs. Digital World Acquisition Corp: Which Is the Better Buy?,InvestorPlace,/news/stocks/palantir-technolgies-pltr-stock-vs-digital-world-acquisition-corp-which-is-the-better-buy-1031192469,positive,0.9012932181358337
776,2/14/2022 7:38:11 PM,PLTR Stock: Why Palantir Is Trending on Reddit’s WallStreetBets Today,InvestorPlace,/news/stocks/pltr-stock-why-palantir-is-trending-on-reddits-wallstreetbets-today-1031192591,positive,0.903732419013977
777,2/14/2022 9:13:47 PM,"Druckenmiller's Duquesne adds Willscot Mobile Mini, exits Nektar Therapeutics",Seeking Alpha,https://seekingalpha.com/news/3799772-druckenmillers-duquesne-adds-willscot-mobile-mini-exits-nektar-therapeutics?utm_source=markets.businessinsider.com&utm_medium=referral,positive,0.7878184914588928
778,2/14/2022 10:18:01 PM,Is PLTR Stock a Buy Right Now? 3 Analysts Weigh In on Palantir Price Predictions.,InvestorPlace,/news/stocks/is-pltr-stock-a-buy-right-now-3-analysts-weigh-in-on-palantir-price-predictions-1031192935,positive,0.7426217198371887
779,2/15/2022 5:49:52 PM,"Benzinga's Daily Brief On Trending Tickers For Feb. 15, 2022: Nvidia, Tesla, Palantir And More",Benzinga,/news/stocks/benzinga-s-daily-brief-on-trending-tickers-for-feb-15-2022-nvidia-tesla-palantir-and-more-1031196798,positive,0.9468868374824524
780,2/15/2022 8:29:30 PM,How Palantir Stock Investors Should Approach Earnings,InvestorPlace,/news/stocks/how-palantir-stock-pltr-stock-investors-approach-earnings-1031197247,positive,0.9377177357673645
781,2/16/2022 3:01:13 PM,Here's what to expect from Palantir's earnings,Markets Insider Automation,/news/stocks/palantir-stock-price-q4-earnings-preview-1031200842,positive,0.9392275214195251
782,2/16/2022 3:46:21 PM,Notable earnings before Thursday's open,Seeking Alpha,https://seekingalpha.com/news/3800778-notable-earnings-before-thursdays-open?utm_source=markets.businessinsider.com&utm_medium=referral,negative,0.8825733065605164
783,2/16/2022 6:37:16 PM,Will Palantir Technologies' Q4 Earnings boost the stock from its 52-week low levels?,Seeking Alpha,https://seekingalpha.com/news/3800877-will-palantir-technologies-q4-earnings-boost-the-stocks-from-its-52-week-low-levels?utm_source=markets.businessinsider.com&utm_medium=referral,negative,0.9315915107727051
784,2/16/2022 9:53:02 PM,Palantir Stock Is a Cautious Buy Ahead of Q4 Earnings,InvestorPlace,/news/stocks/palantir-stock-is-a-cautious-buy-ahead-of-q4-earnings-1031202437,neutral,0.36849141120910645
785,2/17/2022 11:01:13 AM,"Palantir Technologies Non-GAAP EPS of $0.02 misses by $0.02, revenue of $432.8M beats by $14.73M",Seeking Alpha,https://seekingalpha.com/news/3801263-palantir-technologies-non-gaap-eps-of-0_02-misses-0_02-revenue-of-432_8m-beats-14_73m?utm_source=markets.businessinsider.com&utm_medium=referral,positive,0.7012625336647034
786,2/17/2022 12:24:34 PM,Today’s Biggest Pre-Market Stock Movers: 10 Top Gainers and Losers on Thursday,InvestorPlace,/news/stocks/todays-biggest-pre-market-stock-movers-10-top-gainers-and-losers-on-thursday-feb-17-1031204672,neutral,0.48035502433776855
787,2/17/2022 1:37:56 PM,"Telefonaktiebolaget LM Ericsson, Albemarle, Palantir Technologies among premarket losers' pack",Seeking Alpha,https://seekingalpha.com/news/3801412-telefonaktiebolaget-lm-ericsson-albemarle-palantir-technologies-among-premarket-losers-pack?utm_source=markets.businessinsider.com&utm_medium=referral,positive,0.769111156463623
788,2/17/2022 3:26:29 PM,Palantir stock nears 52-week low as Q4 earnings miss expectations,Seeking Alpha,https://seekingalpha.com/news/3801335-palantir-nears-52-week-low-as-q4-earnings-miss-expectations?utm_source=markets.businessinsider.com&utm_medium=referral,neutral,0.9620258808135986
789,2/17/2022 4:01:06 PM,"Benzinga's Daily Brief On Trending Tickers For Feb. 17, 2022: Palantir, Nvidia, GameStop And More",Benzinga,/news/stocks/benzinga-s-daily-brief-on-trending-tickers-for-feb-17-2022-palantir-nvidia-gamestop-and-more-1031205535,positive,0.9440268874168396
790,2/17/2022 4:56:26 PM,Palantir Slips 12% As Quarterly Earnings Miss Street ,RTTNews,/news/stocks/palantir-slips-12-as-quarterly-earnings-miss-street-1031205763,neutral,0.9750951528549194
