,datetime,title,source,link,sentiment_class,sentiment_score
1344,7/28/2023 11:00:31 PM,Analyst Expectations for Palantir Technologies's Future,Benzinga,/news/stocks/analyst-expectations-for-palantir-technologies-s-future-1032491355,negative,0.8484046459197998
1345,7/31/2023 11:00:23 AM,5 AI Stocks Poised for Growth Without Sky-High Risk,InvestorPlace,/news/stocks/5-ai-stocks-poised-for-growth-without-sky-high-risk-1032494899,negative,0.535961389541626
1346,7/31/2023 12:37:42 PM,"PLTR, W and IONQ are among pre market gainers",Seeking Alpha,https://seekingalpha.com/news/3993376-pltr-w-and-ionq-are-among-pre-market-gainers?utm_source=businessinsider&utm_medium=referral,negative,0.7077032327651978
1347,7/31/2023 1:29:34 PM,PLTR Stock Alert: Wedbush Is Betting Big on Palantir,InvestorPlace,/news/stocks/pltr-stock-alert-wedbush-is-betting-big-on-palantir-1032495674,positive,0.8044316172599792
1348,7/31/2023 1:48:33 PM,Why Is SOFI Stock Up 19% Today?,InvestorPlace,/news/stocks/why-is-sofi-stock-up-19-today-1032495673,negative,0.7089107632637024
1349,7/31/2023 2:09:24 PM,Nikola (NKLA) Stock Jumps on New Truck Order,InvestorPlace,/news/stocks/nikola-nkla-stock-jumps-on-new-truck-order-1032496000,negative,0.8529924154281616
1350,7/31/2023 3:54:23 PM,Earnings And Non Farm Payroll Week Has Arrived! Prepare For The Busy Upcoming Week With MandoTrading !,Benzinga,/news/etf/earnings-and-non-farm-payroll-week-has-arrived-prepare-for-the-busy-upcoming-week-with-mandotrading-1032495670,positive,0.832487940788269
1351,7/31/2023 4:28:28 PM,"Palantir pops on heavy volume, leads AI focused stocks higher",Seeking Alpha,https://seekingalpha.com/news/3993497-palantir-pops-on-heavy-volume-leads-ai-focused-stocks-higher?utm_source=businessinsider&utm_medium=referral,negative,0.6909627318382263
1352,7/31/2023 6:13:56 PM,"Symbotic, New Relic, AMC Entertainment And Other Big Stocks Moving Higher On Monday",Benzinga,/news/stocks/symbotic-new-relic-amc-entertainment-and-other-big-stocks-moving-higher-on-monday-1032496334,negative,0.9188404679298401
1353,7/31/2023 7:35:33 PM,"US Stocks Take A Breather, Nasdaq Notches Fifth Straight Month Of Gains: Investors Gear Up For Pivotal Week",Benzinga,/news/etf/us-stocks-take-a-breather-nasdaq-notches-fifth-straight-month-of-gains-investors-gear-up-for-pivotal-week-1032496673,negative,0.8377040028572083
1354,7/31/2023 7:38:37 PM,AI Watch: 3 Tech Stocks That Can Easily Double Your Money,InvestorPlace,/news/stocks/ai-watch-3-tech-stocks-that-can-easily-double-your-money-1032496878,positive,0.8383296132087708
1355,7/31/2023 8:48:29 PM,Palantir Stock Gets a New Street-High Price Target,TipRanks,/news/stocks/palantir-stock-gets-a-new-street-high-price-target-1032497105,negative,0.8562312722206116
1356,7/31/2023 9:30:12 PM,Why Apellis Pharmaceuticals  Shares Are Trading Lower By Around 19%? Here Are Other Stocks Moving In Monday's Session,Benzinga,/news/stocks/why-apellis-pharmaceuticals-shares-are-trading-lower-by-around-19-here-are-other-stocks-moving-in-monday-s-session-1032496852,neutral,0.7436080574989319
1357,7/31/2023 10:00:00 PM,Palantir Selected by Department of Defense to Automate Spectrum Coordination Workflows,PR Newswire,/news/stocks/palantir-selected-by-department-of-defense-to-automate-spectrum-coordination-workflows-1032496899,negative,0.6370171308517456
1358,8/1/2023 1:55:46 PM,PLTR Stock Alert: Palantir Scores New Work With Department of Defense,InvestorPlace,/news/stocks/pltr-stock-alert-palantir-scores-new-work-with-department-of-defense-1032501570,negative,0.8407725691795349
1359,8/1/2023 2:26:25 PM,NKLA Stock Alert: The $16.3 Million Reason Nikola Is Up Today,InvestorPlace,/news/stocks/nkla-stock-alert-the-16-3-million-reason-nikola-is-up-today-1032501626,negative,0.6799205541610718
1360,8/1/2023 2:48:13 PM,OSTK Stock Alert: Overstock Unveils New Bed Bath & Beyond Website,InvestorPlace,/news/stocks/ostk-stock-alert-overstock-unveils-new-bed-bath-beyond-website-1032501690,positive,0.8873975276947021
1361,8/1/2023 3:01:44 PM,"Dear AMSC Stock Fans, Mark Your Calendars for Aug. 9",InvestorPlace,/news/stocks/dear-amsc-stock-fans-mark-your-calendars-for-aug-9-1032501757,positive,0.9422591328620911
1362,8/1/2023 9:45:22 PM,3 Cheap AI Stocks That Smart Investors Will Snap Up Now,InvestorPlace,/news/stocks/3-cheap-ai-stocks-that-smart-investors-will-snap-up-now-1032502821,positive,0.8205777406692505
1363,8/2/2023 10:00:48 AM,PLTR Warning! Wall Street Loves Palantir. Why You Should Guard Your Heart.,InvestorPlace,/news/stocks/pltr-warning-wall-street-loves-palantir-why-you-should-guard-your-heart-1032505841,positive,0.8585159182548523
1364,8/3/2023 11:55:06 AM,Monness Remains a Hold on Palantir Technologies (PLTR),TipRanks,/news/stocks/monness-remains-a-hold-on-palantir-technologies-pltr-1032512309,positive,0.9054828882217407
1365,8/4/2023 12:00:00 AM,WesTrac and Palantir Renew Australian Partnership for Five Years,PR Newswire,/news/stocks/westrac-and-palantir-renew-australian-partnership-for-five-years-1032514705,negative,0.7849355936050415
1366,8/4/2023 10:15:41 AM,"Palantir’s AI Play: Time to Buy, Hold, or Fold PLTR Stock?",InvestorPlace,/news/stocks/palantirs-ai-play-time-to-buy-hold-or-fold-pltr-stock-1032517332,positive,0.9406166076660156
1367,8/4/2023 1:17:03 PM,PLTR Stock Alert: Palantir Renews Partnership With WesTrac,InvestorPlace,/news/stocks/pltr-stock-alert-palantir-renews-partnership-with-westrac-1032518062,negative,0.8365164399147034
1368,8/4/2023 1:31:12 PM,NKLA Stock Alert: What to Know as Nikola CEO Steps Down,InvestorPlace,/news/stocks/nkla-stock-alert-what-to-know-as-nikola-ceo-steps-down-1032518157,positive,0.8167496919631958
1369,8/4/2023 1:45:48 PM,Generac (GNRC) Stock Pops on Analyst Upgrade,InvestorPlace,/news/stocks/generac-gnrc-stock-pops-on-analyst-upgrade-1032518154,positive,0.9256582856178284
1370,8/4/2023 3:07:27 PM,Palantir Stock Is Running Higher on AI FOMO,InvestorPlace,/news/stocks/palantir-stock-is-running-higher-on-ai-fomo-1032518601,negative,0.9465438723564148
1371,8/4/2023 3:10:41 PM,"Palantir Q2 earnings on deck, what to expect",Seeking Alpha,https://seekingalpha.com/news/3997604-palantir-q2-earnings-on-deck-what-to-expect?utm_source=businessinsider&utm_medium=referral,positive,0.9214518070220947
1372,8/4/2023 7:00:42 PM,"Catalyst Watch: Wayfair and Kellogg events, Alibaba earnings and AI hacking test at Def Con",Seeking Alpha,https://seekingalpha.com/news/3997605-catalyst-watch-wayfair-and-kellogg-events-alibaba-earnings-and-ai-hacking-test-at-def-con?utm_source=businessinsider&utm_medium=referral,positive,0.9352651238441467
1373,8/4/2023 8:52:25 PM,"EXCLUSIVE: Top 10 Most-Searched Tickers On Benzinga Pro In July - See Where Tesla, Carvana, Rivian, Nikola And More Rank",Benzinga,/news/stocks/exclusive-top-10-most-searched-tickers-on-benzinga-pro-in-july-see-where-tesla-carvana-rivian-nikola-and-more-rank-1032519078,positive,0.9363840818405151
1374,8/5/2023 3:13:11 PM,Palantir is under the microscope ahead of earnings; Here’s what to expect,TipRanks,/news/stocks/palantir-is-under-the-microscope-ahead-of-earnings-here-s-what-to-expect-1032519671,positive,0.9418506622314453
1375,8/6/2023 3:01:13 PM,Here's what Wall Street expects from Palantir's earnings,Markets Insider Automation,/news/stocks/palantir-stock-quarter-earnings-preview-q2-1032520197,positive,0.9252522587776184
1376,8/7/2023 5:22:26 AM,PLTR Earnings Today: Will Valuation Worries Drag Down Strong Q2?,TipRanks,/news/stocks/pltr-earnings-today-will-valuation-worries-drag-down-strong-q2-1032522463,neutral,0.9289197325706482
1377,8/7/2023 1:12:00 PM,"4 stocks to watch on Monday: Tyson Foods, Lucid Group and more",Seeking Alpha,https://seekingalpha.com/news/3998120-4-stocks-to-watch-on-monday-tyson-foods-lucid-group-and-more?utm_source=businessinsider&utm_medium=referral,positive,0.9237027168273926
1378,8/7/2023 2:02:24 PM,Palantir (PLTR) Stock Is on Watch Ahead of Earnings,InvestorPlace,/news/stocks/palantir-pltr-stock-is-on-watch-ahead-of-earnings-1032524704,positive,0.8921021819114685
1379,8/7/2023 2:12:29 PM,DKNG Stock Alert: Wells Fargo Just Upgraded DraftKings,InvestorPlace,/news/stocks/dkng-stock-alert-wells-fargo-just-upgraded-draftkings-1032524754,positive,0.6165761947631836
1380,8/7/2023 2:33:08 PM,NIO Stock Alert: Citi Raises Price Target to $19.20,InvestorPlace,/news/stocks/nio-stock-alert-citi-raises-price-target-to-19-20-1032524776,negative,0.7321306467056274
1381,8/7/2023 2:49:46 PM,PYPL Stock Alert: 7 Things to Know as PayPal Launches Stablecoin,InvestorPlace,/news/stocks/pypl-stock-alert-7-things-to-know-as-paypal-launches-stablecoin-1032524805,positive,0.9071094393730164
1382,8/7/2023 8:06:06 PM,"Palantir Technologies Non-GAAP EPS of $0.05 in-line, revenue of $533.32M in-line",Seeking Alpha,https://seekingalpha.com/news/3998538-palantir-technologies-non-gaap-eps-of-0_05-in-line-revenue-of-533_32m-in-line?utm_source=businessinsider&utm_medium=referral,positive,0.8713433742523193
1383,8/7/2023 8:33:36 PM,"Palantir rises as Q2 results meet estimates, raises full-year sales forecast",Seeking Alpha,https://seekingalpha.com/news/3998063-palantir-slips-q2-results-meet-estimates-raises-forecast?utm_source=businessinsider&utm_medium=referral,negative,0.947789192199707
1384,8/8/2023 1:15:12 AM,Bank of America Securities Sticks to Their Buy Rating for Palantir Technologies (PLTR),TipRanks,/news/stocks/bank-of-america-securities-sticks-to-their-buy-rating-for-palantir-technologies-pltr-1032525828,positive,0.8677316308021545
1385,8/8/2023 2:05:05 AM,Goldman Sachs Reaffirms Their Hold Rating on Palantir Technologies (PLTR),TipRanks,/news/stocks/goldman-sachs-reaffirms-their-hold-rating-on-palantir-technologies-pltr-1032525851,positive,0.8640760779380798
1386,8/8/2023 7:39:37 AM,'AI Gold Standard' Palantir's Strong Q2 Has Left This Analyst Gushing Over Its AI Platform: 'A Star Is Born',Benzinga,/news/stocks/ai-gold-standard-palantir-s-beat-and-raise-q2-has-left-this-analyst-gushing-over-its-ai-platform-a-star-is-born-1032527198,negative,0.7251975536346436
1387,8/8/2023 9:35:08 AM,Palantir Technologies (PLTR) Gets a Hold from D.A. Davidson,TipRanks,/news/stocks/palantir-technologies-pltr-gets-a-hold-from-d-a-davidson-1032527959,positive,0.9325606822967529
1388,8/8/2023 9:40:05 AM,Analysts Offer Insights on Technology Companies: Palo Alto Networks (PANW) and Palantir Technologies (PLTR),TipRanks,/news/stocks/analysts-offer-insights-on-technology-companies-palo-alto-networks-panw-and-palantir-technologies-pltr-1032527958,positive,0.9129170775413513
1389,8/8/2023 11:07:22 AM,7 Tech Stocks Under $20 to Snap Up Before the Surge,InvestorPlace,/news/stocks/7-tech-stocks-under-20-to-snap-up-before-the-surge-1032528396,negative,0.6321960687637329
1390,8/8/2023 12:01:15 PM,"Analysts Offer Insights on Technology Companies: Datadog (DDOG), Palantir Technologies (PLTR) and Skyworks Solutions (SWKS)",TipRanks,/news/stocks/analysts-offer-insights-on-technology-companies-datadog-ddog-palantir-technologies-pltr-and-skyworks-solutions-swks-1032528670,positive,0.9115936756134033
1391,8/8/2023 1:16:55 PM,PLTR Stock Alert: Palantir Announces $1 Billion Stock Buyback,InvestorPlace,/news/stocks/pltr-stock-alert-palantir-announces-1-billion-stock-buyback-1032529300,positive,0.8250303268432617
1392,8/8/2023 1:18:00 PM,"6 stocks to watch on Tuesday: Datadog, UPS, Disney, Rivian and more",Seeking Alpha,https://seekingalpha.com/news/3999059-6-stocks-to-watch-on-tuesday-datadog-ups-disney-rivian-and-more?utm_source=businessinsider&utm_medium=referral,positive,0.9367232918739319
1393,8/8/2023 1:34:31 PM,Novavax (NVAX) Stock Gets a Boost From Q2 Vaccine Sales,InvestorPlace,/news/stocks/novavax-nvax-stock-gets-a-boost-from-q2-vaccine-sales-1032529354,negative,0.9530781507492065
1394,8/8/2023 1:49:41 PM,Why Are Bank Stocks Down Today?,InvestorPlace,/news/stocks/why-are-bank-stocks-down-today-august-8th-1032529441,neutral,0.9178038835525513
1395,8/8/2023 5:20:41 PM,"Is Palantir Leading An AI Arms Race? One Analyst Says 'A Star Is Born,' Others Disagree",Benzinga,/news/stocks/is-palantir-leading-an-ai-arms-race-one-analyst-says-a-star-is-born-others-disagree-1032530005,positive,0.8209192752838135
1396,8/8/2023 6:33:02 PM,7 Companies Leading the Way in Advanced AI and Robotics,InvestorPlace,/news/stocks/7-companies-leading-the-way-in-advanced-ai-and-robotics-1032530431,positive,0.7753726840019226
1397,8/8/2023 11:02:49 PM,Palantir Technologies (NASDAQ:PLTR): Strong Q2 Results Signal Upside. Forget the Buybacks,TipRanks,/news/stocks/palantir-technologies-nasdaq-pltr-strong-q2-results-signal-upside-forget-the-buybacks-1032531119,negative,0.907560408115387
1398,8/9/2023 5:03:39 AM,Palantir Dip After Q2 Print Doesn't Deter Cathie Wood As Ark Invest Buys $14M In Shares,Benzinga,/news/etf/palantir-post-q2-earnings-share-price-dip-doesn-t-deter-cathie-wood-—-ark-invest-buys-14m-worth-of-shares-1032531358,neutral,0.8679007887840271
1399,8/9/2023 12:21:02 PM,Palantir enters multi-year partnership with Azule Energy,Seeking Alpha,https://seekingalpha.com/news/3999973-palantir-enters-multi-year-partnership-with-azule-energy?utm_source=businessinsider&utm_medium=referral,negative,0.8938263654708862
1400,8/9/2023 12:59:00 PM,Palantir Expands Presence in Industry Entering Multi-Year Partnership with Azule Energy,PR Newswire,/news/stocks/palantir-expands-presence-in-industry-entering-multi-year-partnership-with-azule-energy-1032534352,negative,0.9367453455924988
1401,8/9/2023 4:16:15 PM,PLTR Stock Alert: Palantir Announces Deal With Azule Energy,InvestorPlace,/news/stocks/pltr-stock-alert-palantir-announces-deal-with-azule-energy-1032536057,positive,0.72894287109375
1402,8/9/2023 7:47:23 PM,Seizing the AI Throne: Why Palantir Stock Is Your Best Shot at Scoring Big,InvestorPlace,/news/stocks/seizing-the-ai-throne-why-palantir-stock-is-your-best-shot-at-scoring-big-1032536452,positive,0.9077455997467041
1403,8/9/2023 8:33:51 PM,The 3 Best Machine Learning Stocks to Buy in August,InvestorPlace,/news/stocks/the-3-best-machine-learning-stocks-to-buy-in-august-1032536629,positive,0.854110836982727
1404,8/10/2023 5:12:13 AM,"Cathie Wood Buys Roblox, Palantir Dips — Ark Invest Seizes Buying Opportunities Following Earnings Reports",Benzinga,/news/etf/cathie-wood-buys-roblox-palantir-dips-—-ark-invest-seizes-buying-opportunities-following-earnings-reports-1032537102,positive,0.5510051250457764
1405,8/10/2023 11:00:59 AM,3 Artificial Intelligence Stocks Low on Risk and High on Upside,InvestorPlace,/news/stocks/best-artificial-intelligence-stocks-3-low-risk-high-upside-picks-1032539923,positive,0.5752177238464355
1406,8/10/2023 1:24:22 PM,Cathie Wood Is Doubling Down on Palantir (PLTR) Stock,InvestorPlace,/news/stocks/cathie-wood-is-doubling-down-on-palantir-pltr-stock-1032540602,neutral,0.935766339302063
1407,8/10/2023 1:49:32 PM,What Is Going on With Applied UV (AUVI) Stock Today?,InvestorPlace,/news/stocks/what-is-going-on-with-applied-uv-auvi-stock-today-1032540732,neutral,0.6387491226196289
1408,8/10/2023 2:06:00 PM,RBLX Stock Alert: Roblox Scores Upgrade Despite Weak Q2 Results,InvestorPlace,/news/stocks/rblx-stock-alert-roblox-scores-upgrade-despite-weak-q2-results-1032541061,negative,0.8747477531433105
1409,8/10/2023 3:16:39 PM,"PLTR, DIS: What’s Next for These Buzzing Reddit Stocks?",TipRanks,/news/stocks/pltr-dis-what-s-next-for-these-buzzing-reddit-stocks-1032541372,positive,0.905914306640625
1410,8/11/2023 1:00:37 AM,PLTR vs. SPLK: Why Splunk Stock is More Attractive,TipRanks,/news/stocks/pltr-vs-splk-why-splunk-stock-is-more-attractive-1032542528,positive,0.8336292505264282
1411,8/11/2023 12:18:00 PM,3 Stocks to Buy That the ‘Dumb Money’ Loves,InvestorPlace,/news/stocks/3-stocks-to-buy-that-the-dumb-money-loves-1032546528,positive,0.869377613067627
1412,8/12/2023 1:31:29 PM,Palantir Maintains Its Street-High Price Target,TipRanks,/news/stocks/palantir-maintains-its-street-high-price-target-1032548259,negative,0.5754043459892273
1413,8/13/2023 8:39:16 PM,‘Pullback Will Be Short-Lived’: Daniel Ives Says Buy These 2 AI-Driven Tech Stocks — Including One With 260% Upside,TipRanks,/news/stocks/pullback-will-be-short-lived-daniel-ives-says-buy-these-2-ai-driven-tech-stocks-—-including-one-with-260-upside-1032549079,positive,0.9011831283569336
1414,8/13/2023 9:02:50 PM,3 Growth Stocks to Sell Now and 4 to Buy Instead,InvestorPlace,/news/stocks/3-growth-stocks-to-sell-now-and-4-to-buy-instead-1032549081,positive,0.9213113188743591
1415,8/14/2023 8:21:26 PM,"Stan Druckenmiller's Duquesne adds GE, Builders FirstSource, exits AMD",Seeking Alpha,https://seekingalpha.com/news/4002535-stan-druckenmmillers-duquesne-adds-ge-builders-firstsource-exits-amd?utm_source=businessinsider&utm_medium=referral,positive,0.9257884621620178
1416,8/14/2023 8:41:07 PM,​The 3 Most Undervalued Stocks Under $20 to Buy Now: August 2023,InvestorPlace,/news/stocks/the-3-most-undervalued-stocks-under-20-to-buy-now-august-2023-1032553051,positive,0.8156853914260864
1417,8/15/2023 10:00:40 AM,META Stock Spotlight: The Reality of Meta Platform’s 150% AI-Fueled Surge,InvestorPlace,/news/stocks/meta-stock-spotlight-the-reality-of-meta-platforms-150-ai-fueled-surge-1032554395,positive,0.9055443406105042
1418,8/15/2023 10:10:50 AM,Palantir’s Upside: Should PLTR Stock Investors Double Down Now?,InvestorPlace,/news/stocks/pltr-stock-uptrend-is-likely-to-resume-1032554439,neutral,0.6313448548316956
1419,8/15/2023 7:06:54 PM,"Coatue Management takes new stake in Oracle, exits GameStop, trims Tesla, adds to Amazon",Seeking Alpha,https://seekingalpha.com/news/4003164-coatue-management-takes-new-stake-in-oracle-exits-gamestop-trims-tesla-adds-to-amazon?utm_source=businessinsider&utm_medium=referral,positive,0.9156391620635986
1420,8/15/2023 8:19:35 PM,5 Investors Betting Big on Palantir (PLTR) Stock in Q2,InvestorPlace,/news/stocks/5-investors-betting-big-on-palantir-pltr-stock-in-q2-1032556754,positive,0.5105933547019958
1421,8/15/2023 10:55:08 PM,Palantir Technologies (PLTR): New Sell Recommendation for This Technology Giant,TipRanks,/news/stocks/palantir-technologies-pltr-new-sell-recommendation-for-this-technology-giant-1032556942,negative,0.7268874645233154
1422,8/16/2023 11:57:21 AM,Why Is Novo Integrated Sciences (NVOS) Stock Up 67% Today?,InvestorPlace,/news/stocks/why-is-novo-integrated-sciences-nvos-stock-up-67-today-1032559473,negative,0.7466864585876465
1423,8/16/2023 1:32:07 PM,The 3 Most Undervalued Cathie Wood Stocks to Buy Now: August 2023,InvestorPlace,/news/stocks/the-3-most-undervalued-cathie-wood-stocks-to-buy-now-august-2023-1032559925,positive,0.9006472826004028
1424,8/16/2023 2:00:02 PM,3 Millionaire-Maker Stocks to Buy Before the Opportunity Is Gone,InvestorPlace,/news/stocks/3-millionaire-maker-stocks-to-buy-before-the-opportunity-is-gone-1032560362,positive,0.8911198973655701
1425,8/17/2023 10:00:45 AM,Caution! This Speculative AI Stock Is No Sure Thing.,InvestorPlace,/news/stocks/caution-this-speculative-ai-stock-is-no-sure-thing-1032562595,positive,0.8917339444160461
1426,8/17/2023 10:30:58 AM,7 Very Overvalued AI Stocks to Sell Now,InvestorPlace,/news/stocks/7-very-overvalued-ai-stocks-to-sell-now-1032562677,positive,0.5117453932762146
1427,8/21/2023 11:00:15 PM,3 Great Stocks You Should Buy for Growth Today,InvestorPlace,/news/stocks/3-great-stocks-you-should-buy-for-growth-today-1032571190,positive,0.8374738693237305
1428,8/22/2023 12:45:18 AM,3 Millionaire-Maker Tech Stocks to Hold Through Thick and Thin,InvestorPlace,/news/stocks/3-long-term-tech-stocks-that-could-be-millionaire-makers-1032571235,neutral,0.4667873680591583
1429,8/22/2023 1:08:46 PM,These Are the ONLY 7 AI Stocks to Consider in August 2023,InvestorPlace,/news/stocks/these-are-the-only-7-ai-stocks-to-consider-in-august-2023-1032573142,positive,0.9475488066673279
1430,8/23/2023 3:25:26 AM,7 Stocks to Sell in August Before They Crash and Burn,InvestorPlace,/news/stocks/7-stocks-to-sell-in-august-before-they-crash-and-burn-1032574693,positive,0.7411905527114868
1431,8/23/2023 10:00:12 AM,Sell Alert: 7 Tech Stocks to Dump ASAP,InvestorPlace,/news/stocks/sell-alert-7-tech-stocks-to-dump-asap-1032575719,positive,0.6741394996643066
1432,8/24/2023 10:30:15 AM,Warning! The AI Hype Is Not Enough to Save Palantir Stock,InvestorPlace,/news/stocks/warning-the-ai-hype-is-not-enough-to-save-palantir-stock-1032579238,neutral,0.7286845445632935
1433,8/24/2023 1:18:40 PM,"Nvidia, C3.ai And Other Big Stocks Moving Higher In Thursday's Pre-Market Session",Benzinga,/news/stocks/nvidia-c3-ai-and-other-big-stocks-moving-higher-in-thursday-s-pre-market-session-1032579365,negative,0.9318951368331909
1434,8/24/2023 2:17:40 PM,Nvidia Thrusts Red-Hot Palantir (PLTR) Stock Into the Spotlight Today. Here’s Why.,InvestorPlace,/news/stocks/nvidia-thrusts-red-hot-palantir-pltr-stock-into-the-spotlight-today-heres-why-1032580452,positive,0.7865186333656311
1435,8/24/2023 3:15:27 PM,Nvidia (NVDA) Stock Tops $500 Amid ‘Historical Moment’ for Tech,InvestorPlace,/news/stocks/nvidia-nvda-stock-tops-500-amid-historical-moment-for-tech-1032580550,negative,0.8143517374992371
1436,8/24/2023 7:32:11 PM,These Are the ONLY 3 Tech Stocks to Consider in August 2023,InvestorPlace,/news/stocks/these-are-the-only-3-tech-stocks-to-consider-in-august-2023-1032581041,positive,0.9485853910446167
1437,8/25/2023 1:09:48 PM,These Are the ONLY 3 Machine Learning Stocks to Consider in August 2023,InvestorPlace,/news/stocks/these-are-the-only-3-machine-learning-stocks-to-consider-in-august-2023-1032582703,positive,0.9517042636871338
1438,8/25/2023 7:00:42 PM,3 Millionaire-Maker Machine Learning Stocks to Hold Through Thick and Thin,InvestorPlace,/news/stocks/3-millionaire-maker-machine-learning-stocks-to-hold-through-thick-and-thin-1032583668,negative,0.6631479263305664
1439,8/27/2023 1:00:12 PM,These are the ONLY 3 Growth Stocks to Consider in August 2023,InvestorPlace,/news/stocks/these-are-the-only-3-growth-stocks-to-consider-in-august-2023-1032584187,positive,0.9453586935997009
1440,8/28/2023 11:30:09 AM,5 Stocks Set to Surge on Nvidia’s Blowout Earnings,InvestorPlace,/news/stocks/5-stocks-set-to-surge-on-nvidias-blowout-earnings-1032585631,neutral,0.6216020584106445
1441,8/28/2023 11:31:01 PM,3 AI Stocks With the Potential to Transform Your Financial Future,InvestorPlace,/news/stocks/3-ai-stocks-with-the-potential-to-transform-your-financial-future-1032587279,positive,0.8252856135368347
1442,8/28/2023 11:58:26 PM,Surprise! These 3 Meme Stocks Have Wall Street’s Seal of Approval,InvestorPlace,/news/stocks/surprise-these-3-meme-stocks-have-wall-streets-seal-of-approval-1032587295,positive,0.8523640632629395
1443,8/29/2023 9:20:50 AM,Analysts Offer Insights on Technology Companies: Jabil (JBL) and Palantir Technologies (PLTR),TipRanks,/news/stocks/analysts-offer-insights-on-technology-companies-jabil-jbl-and-palantir-technologies-pltr-1032588255,positive,0.895410418510437
1444,8/31/2023 8:35:08 AM,"New Sell Rating for Palantir Technologies (PLTR), the Technology Giant",TipRanks,/news/stocks/new-sell-rating-for-palantir-technologies-pltr-the-technology-giant-1032595380,negative,0.780167818069458
1445,8/31/2023 10:10:11 AM,Palantir’s Hype Train: Why It’s Time to Pump the Brakes on PLTR Stock,InvestorPlace,/news/stocks/palantirs-hype-train-why-its-time-to-pump-the-brakes-on-pltr-stock-1032595610,positive,0.8716503977775574
1446,8/31/2023 12:16:54 PM,"Five Below, Victoria's Secret And Other Big Stocks Moving Lower In Thursday's Pre-Market Session",Benzinga,/news/stocks/five-below-victoria-s-secret-and-other-big-stocks-moving-lower-in-thursday-s-pre-market-session-1032595652,neutral,0.9610602855682373
1447,8/31/2023 12:47:00 PM,"5 stocks to watch on Thursday: CrowdStrike, Campbell Soup, Broadcom and more",Seeking Alpha,https://seekingalpha.com/news/4007992-5-stocks-to-watch-on-thursday-crowdstrike-campbell-soup-broadcom-and-more?utm_source=businessinsider&utm_medium=referral,positive,0.9293846487998962
1448,8/31/2023 1:19:45 PM,Morgan Stanley Just Issued a Warning on Palantir (PLTR) Stock,InvestorPlace,/news/stocks/morgan-stanley-just-issued-a-warning-on-palantir-pltr-stock-1032596411,neutral,0.6048036813735962
1449,8/31/2023 1:31:37 PM,Why Palantir Stock Is Sliding Over 3% Premarket Today,Benzinga,/news/stocks/why-palantir-stock-is-sliding-over-3-premarket-today-1032595916,neutral,0.9533424377441406
1450,8/31/2023 1:36:01 PM,Shopify (SHOP) Stock Jumps 6% on Amazon Deal,InvestorPlace,/news/stocks/shopify-shop-stock-jumps-6-on-amazon-deal-1032596489,negative,0.903850257396698
1451,8/31/2023 1:52:49 PM,"Why Are Cannabis Stocks TLRY, ACB, CGC, CURLF Up Today?",InvestorPlace,/news/stocks/why-are-cannabis-stocks-tlry-acb-cgc-curlf-up-today-1032596485,positive,0.8699342608451843
1452,8/31/2023 2:03:28 PM,"Biggest stock movers today: Palantir, Shopify, Dollar General, Salesforce, Okta and more",Seeking Alpha,https://seekingalpha.com/news/4007839-biggest-stock-movers-today-salesforce-ubs-group-okta-and-more?utm_source=businessinsider&utm_medium=referral,positive,0.9095920324325562
1453,8/31/2023 2:08:37 PM,"Dear AMC Stock Fans, Mark Your Calendars for Oct. 13",InvestorPlace,/news/stocks/dear-amc-stock-fans-mark-your-calendars-for-oct-13-1032596850,positive,0.935695230960846
1454,8/31/2023 2:45:31 PM,Palantir stock falls ~9% after Morgan Stanley cuts rating,Seeking Alpha,https://seekingalpha.com/news/4007950-palantir-dips-after-morgan-stanley-cuts-rating-to-underweight?utm_source=businessinsider&utm_medium=referral,neutral,0.9620994925498962
1455,8/31/2023 3:15:07 PM,William Blair Sticks to Its Sell Rating for Palantir Technologies (PLTR),TipRanks,/news/stocks/william-blair-sticks-to-its-sell-rating-for-palantir-technologies-pltr-1032597043,positive,0.8411081433296204
