,datetime,title,source,link,sentiment_class,sentiment_score
0,9/20/2019 10:54:09 PM,Exclusive: Palantir to seek at least $26 bln valuation in fundraising - sources,Reuters,http://feeds.reuters.com/~r/reuters/INbusinessNews/~3/Bt978JwVLgs/exclusive-palantir-to-seek-at-least-26-bln-valuation-in-fundraising-sources-idINKBN1W52F1,positive,0.9061062932014465
1,11/18/2019 5:33:33 AM,Peter Thiel's Palantir launches Japanese joint venture with insurer Sompo,Reuters,http://feeds.reuters.com/~r/reuters/companyNews/~3/yPVvDfKQGWA/peter-thiels-palantir-launches-japanese-joint-venture-with-insurer-sompo-idUSL2N27V1O7,positive,0.667940080165863
2,11/18/2019 7:11:35 AM,UPDATE 1-Peter Thiel's Palantir launches Japanese joint venture with insurer Sompo,Reuters,http://feeds.reuters.com/~r/reuters/companyNews/~3/ae9aa366ycI/update-1-peter-thiels-palantir-launches-japanese-joint-venture-with-insurer-sompo-idUSL1N27Y02W,positive,0.5690324306488037
3,11/22/2019 6:00:00 PM,Activist investors to pressure privately held Palantir on human rights,Reuters,http://feeds.reuters.com/~r/reuters/companyNews/~3/L_990Vxjiw8/activist-investors-to-pressure-privately-held-palantir-on-human-rights-idUSL2N27W011,neutral,0.8004884123802185
4,11/26/2019 12:20:15 AM,CORRECTED-Activist investors to pressure privately held Palantir on human rights,Reuters,http://feeds.reuters.com/~r/reuters/companyNews/~3/OK9ji-6-EQg/corrected-activist-investors-to-pressure-privately-held-palantir-on-human-rights-idUSL2N27W011,neutral,0.8256130814552307
5,11/27/2019 2:47:11 PM,REFILE-France seeks own alternative to Palantir data firm in helping fight terrorism,Reuters,http://feeds.reuters.com/~r/reuters/companyNews/~3/BlzOR-uujwM/refile-france-seeks-own-alternative-to-palantir-data-firm-in-helping-fight-terrorism-idUSL8N2873NL,negative,0.8417490124702454
6,6/12/2020 12:51:42 AM,Exclusive: Palantir close to registering for stock market debut - sources,Reuters,http://feeds.reuters.com/~r/reuters/businessNews/~3/jal-fvRA3cc/exclusive-palantir-close-to-registering-for-stock-market-debut-sources-idUSKBN23I3GB,positive,0.9319556355476379
7,6/12/2020 1:15:02 AM,Palantir close to registering for stock market debut: sources,Reuters,http://feeds.reuters.com/~r/reuters/businessNews/~3/S3Ursn4pRIA/palantir-close-to-registering-for-stock-market-debut-sources-idUSKBN23I3GB,positive,0.9277435541152954
8,6/12/2020 2:16:20 AM,UPDATE 2-Palantir close to registering for stock market debut -sources,Reuters,http://feeds.reuters.com/~r/reuters/companyNews/~3/QdYzmR44WQk/update-2-palantir-close-to-registering-for-stock-market-debut-sources-idUSL1N2DO2HC,positive,0.9084139466285706
9,6/12/2020 4:50:48 AM,Palantir close to registering for stock market debut: sources,Reuters,http://feeds.reuters.com/~r/reuters/INbusinessNews/~3/y7i82eABjGg/palantir-close-to-registering-for-stock-market-debut-sources-idINKBN23J08Q,positive,0.9277435541152954
10,9/24/2020 7:32:24 PM,Palantir Technologies IPO: The Investor’s Comprehensive Guide,InvestorPlace,/news/stocks/palantir-stock-pltr-ipo-ultimate-guide-1029621040,positive,0.9141892790794373
11,9/30/2020 7:57:04 PM,Palantir jumps 14% in trading debut after opening at $17 billion valuation,Business Insider,https://www.businessinsider.com/palantir-stock-price-first-day-direct-listing-market-trading-debut-2020-9,negative,0.9076982736587524
12,9/30/2020 10:12:03 PM,"US stocks climb on stimulus hopes, still post first monthly loss since March",Business Insider,https://www.businessinsider.com/stock-market-news-today-indexes-react-stimulus-hope-adp-report-2020-9,neutral,0.9179809093475342
13,10/1/2020 9:01:32 AM,Palantir Stock: Peter Thiel’s Shiny Object Needs Money,InvestorPlace,/news/stocks/palantir-stock-peter-thiels-shiny-object-needs-money-1029639047,positive,0.9163119792938232
14,10/7/2020 11:40:48 AM,Insider Selling of Palantir Technologies Stock Provides a Golden Buying Opportunity,InvestorPlace,/news/stocks/pltr-stock-a-golden-buying-opportunity-1029656636,negative,0.7676369547843933
15,10/7/2020 3:28:04 PM,Q3 2020: An unbeaten quarter for IPO activity,Seeking Alpha,https://seekingalpha.com/news/3620516-q3-2020-unbeaten-quarter-for-ipo-activity?utm_source=markets.businessinsider.com&utm_medium=referral,positive,0.9300640821456909
16,10/9/2020 6:24:18 PM,7 AI Stocks With More Hype Than Bite,InvestorPlace,/news/stocks/7-ai-stocks-with-more-hype-than-bite-1029666913,positive,0.7221667766571045
17,10/12/2020 4:09:52 PM,"Prime Lightworks Stock: Yes, You Can Invest In a Space Startup",InvestorPlace,/news/stocks/prime-lightworks-stock-yes-you-can-invest-in-a-space-startup-1029670812,positive,0.8795185685157776
18,10/12/2020 6:39:50 PM,Roblox IPO: 6 Big Things for Roblox Stock Investors to Know,InvestorPlace,/news/stocks/roblox-ipo-6-big-things-for-roblox-stock-investors-to-know-1029671350,positive,0.93581223487854
19,10/16/2020 5:17:23 PM,"Palantir Is An Interesting Company, But There Is Little Reason To Own It",InvestorPlace,/news/stocks/pltr-stock-is-interesting-but-little-reason-to-own-it-1029689514,positive,0.9405010342597961
20,10/19/2020 4:58:18 PM,Palantir Hasn’t Earned Investors’ Trust Yet,InvestorPlace,/news/stocks/palantir-stock-hasnt-earned-investors-trust-yet-1029694938,negative,0.6729023456573486
21,10/19/2020 5:16:33 PM,Big Data Doesn’t Exempt Palantir Technologies From Big Problems,InvestorPlace,/news/stocks/big-data-no-exemption-for-palantir-technologies-pltr-stock-1029694936,positive,0.8895105123519897
22,10/21/2020 4:04:24 PM,Put a Cool-Sounding Palantir Stock on Ice For Now,InvestorPlace,/news/stocks/put-a-cool-sounding-palantir-stock-on-ice-for-now-1029706112,positive,0.7172035574913025
23,10/22/2020 1:18:11 PM,Palantir providing U.S. government with coronavirus tracking software,Seeking Alpha,https://seekingalpha.com/news/3624827-palantir-providing-u-s-government-coronavirus-tracking-software?utm_source=markets.businessinsider.com&utm_medium=referral,positive,0.8467026948928833
24,10/22/2020 3:28:28 PM,Wait for a Pullback in Palantir Stock,InvestorPlace,/news/stocks/all-bets-off-pltr-stock-1029711646,neutral,0.6433009505271912
25,10/26/2020 12:43:29 PM,Palantir quiet period ends with mix of bullish and sideline starts,Seeking Alpha,https://seekingalpha.com/news/3625692-palantir-quiet-period-ends-mix-of-bullish-and-sideline-starts?utm_source=markets.businessinsider.com&utm_medium=referral,positive,0.8733291029930115
26,10/27/2020 3:09:19 PM,"Palantir will surge 31% as Wall Street realizes potential for breakneck profit growth, Morgan Stanley says",Business Insider,https://www.businessinsider.com/palantir-stock-price-target-lifted-rapid-growth-potential-tech-analyst-2020-10,negative,0.9479342103004456
27,10/27/2020 8:34:02 PM,MoneyLine Podcast: Something Big Just Happened in the Healthcare Industry,InvestorPlace,/news/stocks/moneyline-podcast-something-big-just-happened-in-healthcare-genetic-testing-1029729498,positive,0.8206198215484619
28,10/28/2020 3:57:04 PM,"With the Election Looming, Palantir Stock Looks Too Risky",InvestorPlace,/news/stocks/with-the-election-looming-palantir-stock-looks-too-risky-1029735995,neutral,0.6835007667541504
29,10/28/2020 6:20:22 PM,Palantir Technologies Could Be Your Top-Secret Big Data Holding,InvestorPlace,/news/stocks/pltr-stock-could-be-your-top-secret-big-data-holding-1029736498,positive,0.9274079203605652
30,10/29/2020 12:10:39 PM,Palantir Stock Is a Great Data Play Even Without Its Government Ties,InvestorPlace,/news/stocks/pltr-stock-data-play-even-government-ties-1029741059,positive,0.6024957895278931
31,10/29/2020 4:46:15 PM,Why Palantir May Be a Solid Covid-19 Play,InvestorPlace,/news/stocks/why-palantir-may-be-a-solid-covid-19-play-1029742932,positive,0.7000253200531006
32,10/30/2020 7:02:21 PM,Pick Your Entry Into Palantir Stock With Confidence,InvestorPlace,/news/stocks/pick-your-entry-into-palantir-stock-with-confidence-1029747772,positive,0.9451382756233215
33,10/30/2020 7:30:23 PM,Seeking Alpha Catalyst Watch,Seeking Alpha,https://seekingalpha.com/news/3629204-seeking-alpha-catalyst-watch?utm_source=markets.businessinsider.com&utm_medium=referral,positive,0.8980498313903809
34,11/2/2020 6:40:49 PM,Palantir Stock Is a Contrarian Play That’s Ready to Run Higher,InvestorPlace,/news/stocks/palantir-pltr-stock-is-a-contrarian-play-thats-ready-to-run-higher-1029755013,positive,0.8590439558029175
35,11/3/2020 1:01:40 PM,Is Palantir Technologies the Best Tech Bet Around $10?,InvestorPlace,/news/stocks/is-palantir-pltr-stock-best-tech-bet-for-10-1029758585,positive,0.8497024178504944
36,11/3/2020 3:10:26 PM,7 Big Data Stocks That Are Bound to Grow Your Portfolio,InvestorPlace,/news/stocks/7-big-data-stocks-that-are-bound-to-grow-your-portfolio-1029759218,negative,0.63841313123703
37,11/3/2020 7:03:22 PM,Palantir software considered for U.K. contact tracing program - FT,Seeking Alpha,https://seekingalpha.com/news/3630666-palantir-software-considered-for-u-k-contact-tracing-program-ft?utm_source=markets.businessinsider.com&utm_medium=referral,positive,0.9331471920013428
38,11/5/2020 3:09:41 PM,Investors Should Let the Palantir Dust Settle Before Choosing a Side,InvestorPlace,/news/stocks/pltr-stock-investors-should-let-dust-settle-before-choosing-side-1029771189,positive,0.9169480800628662
39,11/6/2020 8:29:02 PM,Palantir +19% on potential Biden victory; Hedgeye adds to Best Idea Short list,Seeking Alpha,https://seekingalpha.com/news/3633300-palantirplus-19-on-potential-biden-victory-hedgeye-adds-to-best-idea-short-list?utm_source=markets.businessinsider.com&utm_medium=referral,negative,0.8620746731758118
40,11/6/2020 8:30:45 PM,Seeking Alpha Catalyst Watch,Seeking Alpha,https://seekingalpha.com/news/3633287-seeking-alpha-catalyst-watch?utm_source=markets.businessinsider.com&utm_medium=referral,positive,0.8980498313903809
41,11/9/2020 6:52:11 PM,"Despite Ethical Issues, Palantir Is a Can’t-Miss Opportunity",InvestorPlace,/news/stocks/despite-ethical-issues-pltr-stock-is-a-cant-miss-opportunity-1029783005,positive,0.5794498324394226
42,11/10/2020 2:37:00 PM,Palantir stock continues to rally heading toward first post-IPO earnings,Seeking Alpha,https://seekingalpha.com/news/3634381-palantir-stock-continues-to-rally-heading-toward-first-post-ipo-earnings?utm_source=markets.businessinsider.com&utm_medium=referral,negative,0.9487525224685669
43,11/10/2020 2:37:00 PM,Palantir stock continues to rally heading toward first post-IPO earnings - preview,Seeking Alpha,https://seekingalpha.com/news/3634381-palantir-stock-continues-to-rally-heading-toward-first-post-ipo-earnings-preview?utm_source=markets.businessinsider.com&utm_medium=referral,negative,0.9518848657608032
44,11/11/2020 11:40:32 AM,Telos sets terms to offer 12.35M shares in IPO,Seeking Alpha,https://seekingalpha.com/news/3634831-telos-sets-terms-to-offer-12_35m-shares-in-ipo?utm_source=markets.businessinsider.com&utm_medium=referral,positive,0.9207273721694946
45,11/11/2020 9:32:20 PM,Know Why You’re Buying (Or Not Buying) Palantir Technologies,InvestorPlace,/news/stocks/know-why-you-are-buying-or-not-buying-pltr-stock-1029793916,positive,0.9241772294044495
46,11/11/2020 10:35:43 PM,Palantir Technologies Q3 2020 Earnings Preview,Seeking Alpha,https://seekingalpha.com/news/3635026-palantir-technologies-q3-2020-earnings-preview?utm_source=markets.businessinsider.com&utm_medium=referral,positive,0.6220353245735168
47,11/11/2020 10:35:46 PM,Notable earnings after Thursday's close,Seeking Alpha,https://seekingalpha.com/news/3635045-notable-earnings-after-thursdays-close?utm_source=markets.businessinsider.com&utm_medium=referral,negative,0.8900269269943237
48,11/12/2020 11:53:19 AM,Big-Data Firm Palantir Holds Promise,InvestorPlace,/news/stocks/pltr-stock-plantir-big-data-firm-holds-promise-1029796404,positive,0.8560786843299866
49,11/12/2020 9:14:13 PM,"Palantir Technologies EPS misses by $0.77, beats on revenue",Seeking Alpha,https://seekingalpha.com/news/3635730-palantir-technologies-eps-misses-0_77-beats-on-revenue?utm_source=markets.businessinsider.com&utm_medium=referral,negative,0.7395766377449036
50,11/13/2020 1:47:52 PM,Palantir downgraded at Morgan Stanley on valuation concerns despite 'solid' earnings,Seeking Alpha,https://seekingalpha.com/news/3636132-palantir-downgraded-morgan-stanley-on-valuation-concerns-despite-solid-earnings?utm_source=markets.businessinsider.com&utm_medium=referral,neutral,0.9606691598892212
51,11/14/2020 12:41:36 AM,"Soros exits Bank of America, JPMorgan; adds Palantir, Disney and Axalta",Seeking Alpha,https://seekingalpha.com/news/3636367-soros-exits-bank-of-america-jpmorgan-adds-palantir-disney-and-axalta?utm_source=markets.businessinsider.com&utm_medium=referral,positive,0.9123778343200684
52,11/16/2020 11:01:41 AM,"After a Post-Election Rally, Tread Carefully With Palantir Stock",InvestorPlace,/news/stocks/post-election-rally-tread-carefully-pltr-stock-1029805258,positive,0.8522462844848633
53,11/17/2020 1:20:16 PM,There’s Nothing Clandestine About Palantir Technologies’ Rich Premium,InvestorPlace,/news/stocks/pltr-stock-is-expensive-needs-new-customers-to-validate-valuations-1029811913,positive,0.8872666954994202
54,11/17/2020 7:41:40 PM,Palantir surges after Steve Cohen's Point72 discloses 30M share stake,Seeking Alpha,https://seekingalpha.com/news/3637235-palantir-surges-after-steve-cohens-point72-discloses-30m-share-stake?utm_source=markets.businessinsider.com&utm_medium=referral,negative,0.8607423305511475
55,11/18/2020 11:31:46 AM,3 Ways to Trade Palantir and Its Red-Hot Momentum,InvestorPlace,/news/stocks/3-ways-to-trade-palantir-pltr-stock-and-its-red-hot-momentum-1029815714,positive,0.8207898139953613
56,11/18/2020 12:31:35 PM,Palantir’s Strong Growth Will Accelerate in 2021,InvestorPlace,/news/stocks/pltr-stock-strong-growth-accelerate-2021-1029815712,negative,0.9429510831832886
57,11/18/2020 6:43:03 PM,DoorDash IPO:  What You Need To Know,InvestorPlace,/news/stocks/doordash-ipo-what-you-need-to-know-1029817727,positive,0.93906569480896
58,11/18/2020 9:59:12 PM,Palantir shares climb after announcing new U.S. Army contract,Seeking Alpha,https://seekingalpha.com/news/3637731-palantir-shares-climb-after-announcing-new-u-s-army-contract?utm_source=markets.businessinsider.com&utm_medium=referral,negative,0.6101264357566833
59,11/19/2020 4:28:18 PM,Cybersecurity software company Telos pops 29% on trading debut,Seeking Alpha,https://seekingalpha.com/news/3638008-cybersecurity-software-company-telos-pops-29-on-trading-debut?utm_source=markets.businessinsider.com&utm_medium=referral,negative,0.7325190305709839
60,11/23/2020 10:19:30 PM,"4 Top Stock Trades for Tuesday: PLUG, OXY, PLL, PLTR",InvestorPlace,/news/stocks/4-top-stock-trades-for-tuesday-plug-oxy-pll-pltr-1029831705,positive,0.9072148203849792
61,11/24/2020 1:42:09 PM,"Palantir Should Be Free Cash Flow Positive Soon, Pushing PLTR Stock Higher",InvestorPlace,/news/stocks/pltr-stock-will-move-higher-as-free-cash-flow-turns-positive-as-sales-rise-1029834848,negative,0.9550759792327881
62,11/24/2020 5:51:52 PM,Raised Guidance Points to More Upside for Palantir Technologies,InvestorPlace,/news/stocks/raised-guidance-points-to-more-upside-for-pltr-stock-1029835777,negative,0.9468739032745361
63,11/25/2020 4:59:47 PM,PLTR Stock: Why Secretive Palantir Is Climbing Today,InvestorPlace,/news/stocks/pltr-stock-why-secretive-palantir-is-climbing-today-1029839537,negative,0.7592447400093079
64,11/27/2020 2:16:52 PM,SuRo stock rises 5.4% after clarifying Palantir stake; sees mid-December dividend,Seeking Alpha,https://seekingalpha.com/news/3639684-suro-stock-rises-5_4-after-clarifying-palantir-stake-sees-mid-december-dividend?utm_source=markets.businessinsider.com&utm_medium=referral,negative,0.7900277376174927
65,11/27/2020 3:47:56 PM,"Palantir (PLTR), Snowflake (SNOW) stocks lead recent software IPOs higher on options spike, upcoming catalysts",Seeking Alpha,https://seekingalpha.com/news/3639706-palantir-pltr-snowflake-snow-stocks-lead-recent-software-ipos-higher-on-options-spike?utm_source=markets.businessinsider.com&utm_medium=referral,negative,0.9074391722679138
66,11/27/2020 4:02:40 PM,Palantir stock forecast at $20/share for 2020 by short-seller Citron,Seeking Alpha,https://seekingalpha.com/news/3639711-palantir-stock-forecast-20-share-for-2020-short-seller-citron?utm_source=markets.businessinsider.com&utm_medium=referral,positive,0.8709499835968018
67,11/27/2020 5:21:13 PM,"'No longer a stock but a full casino': Palantir will lose one-third of its value by year-end after surging more than 300% since going public, short-seller Citron Research says",Business Insider,https://www.businessinsider.com/palantir-stock-price-target-short-selling-position-citron-research-pltr-2020-11,neutral,0.9684103727340698
68,11/30/2020 6:40:09 PM,Why Bears Must Not Bet Against Palantir,InvestorPlace,/news/stocks/why-bears-must-not-bet-against-pltr-stock-1029850268,positive,0.9108096361160278
69,11/30/2020 8:33:02 PM,"Appian stock gained 200% in the past month, making APPN one of tech's top gainers",Seeking Alpha,https://seekingalpha.com/news/3640088-appian-stock-gained-200-in-past-month-making-appn-one-of-techs-top-gainers?utm_source=markets.businessinsider.com&utm_medium=referral,negative,0.9488406181335449
70,12/1/2020 4:55:29 PM,7 Machine Learning Stocks for a Smarter Future,InvestorPlace,/news/stocks/7-machine-learning-stocks-for-a-smarter-future-1029854817,positive,0.8628712296485901
71,12/1/2020 7:43:04 PM,PSTH Stock: 13 Things to Know About Bill Ackman’s Pershing Square SPAC,InvestorPlace,/news/stocks/psth-stock-13-things-to-know-about-bill-ackmans-pershing-square-spac-1029855114,positive,0.942063570022583
72,12/2/2020 10:01:51 AM,Senate Control Could Determine Where Palantir Stock Heads Next,InvestorPlace,/news/stocks/senate-control-could-determine-palantir-stock-direction-1029856681,positive,0.9479826092720032
73,12/2/2020 10:11:35 AM,"Visa Exists in a Payments World No Longer Ruled by Banks, Only Fintechs",InvestorPlace,/news/stocks/visa-stock-no-more-banks-only-fintechs-1029856680,positive,0.939596951007843
74,12/2/2020 1:31:54 PM,Palantir slides 10% after Morgan Stanley warns on negative risk-reward profile,Seeking Alpha,https://seekingalpha.com/news/3640781-palantir-slides-10-after-morgan-stanley-warns-on-negative-risk-reward-profile?utm_source=markets.businessinsider.com&utm_medium=referral,neutral,0.9629611968994141
75,12/2/2020 1:50:27 PM,"NIO Limited, Palantir Technologies leads premarket losers' pack",Seeking Alpha,https://seekingalpha.com/news/3640796-nio-limited-palantir-technologies-leads-premarket-losers-pack?utm_source=markets.businessinsider.com&utm_medium=referral,positive,0.890845775604248
76,12/2/2020 2:34:47 PM,PLTR Stock: Red-Hot Palantir Shares Slip on Analyst Call,InvestorPlace,/news/stocks/pltr-stock-red-hot-palantir-shares-slip-on-analyst-call-1029858299,neutral,0.9595540761947632
77,12/3/2020 1:24:55 PM,"Far From Being Overdone, Palantir Stock Is Set to Run",InvestorPlace,/news/stocks/far-from-being-overdone-palantir-stock-is-set-to-run-1029862270,negative,0.8014047741889954
78,12/7/2020 1:30:26 PM,"It’s Crazy That Palantir Stock Is On Track for Annual Gains of 1,386%",InvestorPlace,/news/stocks/its-crazy-that-palantir-stock-is-on-track-for-annual-gains-of-1386-1029869818,negative,0.9323914051055908
79,12/7/2020 4:04:44 PM,PLTR Stock: Why Palantir Shares Are Surging 12% Today,InvestorPlace,/news/stocks/pltr-stock-why-palantir-shares-are-surging-12-today-1029870285,negative,0.6200057864189148
80,12/7/2020 4:14:28 PM,Palantir stock jumps +12% on report of new FDA contract,Seeking Alpha,https://seekingalpha.com/news/3642146-palantir-stock-jumpsplus-12-on-report-of-new-fda-contract?utm_source=markets.businessinsider.com&utm_medium=referral,negative,0.7578945755958557
81,12/7/2020 5:36:08 PM,Palantir Stock Surges on FDA Contract Victory,InvestorPlace,/news/stocks/palantir-stock-surges-on-fda-contract-victory-1029870672,negative,0.5245416164398193
82,12/7/2020 7:35:44 PM,The 5 Best Stocks for Trading Options,InvestorPlace,/news/stocks/the-5-best-stocks-for-trading-options-right-now-1029870924,positive,0.9272337555885315
83,12/9/2020 7:51:09 PM,Palantir Is Even More Enticing After the Recent Sell-Off,InvestorPlace,/news/stocks/palantir-is-even-more-enticing-after-the-recent-sell-off-1029879065,negative,0.8859015703201294
84,12/9/2020 8:44:00 PM,Robinhood IPO: When Does Robinhood Go Public? What Will Robinhood Stock Be Worth?,InvestorPlace,/news/stocks/robinhood-ipo-when-does-robinhood-go-public-what-will-robinhood-stock-be-worth-1029879060,positive,0.9462369084358215
85,12/10/2020 1:04:42 PM,Will Robotics Specialist Knightscope Be the Next Palantir?,InvestorPlace,/news/stocks/pltr-stock-will-robotics-specialist-knightscope-be-the-next-palantir-1029881217,positive,0.9225667715072632
86,12/10/2020 7:15:36 PM,Buy Palantir Stock As It Defies Its Critics Yet Again,InvestorPlace,/news/stocks/buy-palantir-stock-as-it-defies-its-critics-yet-again-1029883313,negative,0.6259844303131104
87,12/11/2020 11:01:55 AM,The Recent Hot Run in Palantir Stock Could Cool in 2021,InvestorPlace,/news/stocks/hot-run-palantir-stock-cool-2021-1029884827,negative,0.8952370882034302
88,12/11/2020 4:22:23 PM,Palantir Stock Is One to Own For the Long Haul,InvestorPlace,/news/stocks/palantir-stock-is-one-to-own-for-the-long-haul-1029886086,positive,0.8900007605552673
89,12/11/2020 7:20:59 PM,"Palantir Likely to Be Hurt by Competition, Political Issues",InvestorPlace,/news/stocks/palantir-stock-likely-to-be-hurt-by-competition-political-issues-1029886586,neutral,0.9581395983695984
90,12/14/2020 5:30:11 PM,7 ‘Trendy’ Growth Stocks That Could Make You Exponentially Richer,InvestorPlace,/news/stocks/7-trendy-growth-stocks-that-could-make-you-exponentially-richer-1029891269,positive,0.7875980734825134
91,12/15/2020 12:58:18 PM,Palantir’s Strategy Is Savvy in the Face of Political Headwinds,InvestorPlace,/news/stocks/palantir-stock-strategy-savvy-political-headwinds-1029893508,positive,0.678152859210968
92,12/15/2020 3:04:13 PM,BTWN Stock: Bridgetown Holdings Soars on Tokopedia SPAC Merger News,InvestorPlace,/news/stocks/btwn-stock-bridgetown-holdings-soars-on-tokopedia-spac-merger-news-1029894549,positive,0.7394720315933228
93,12/15/2020 9:14:18 PM,How To Trade The Triangle Pattern On The Palantir Stock Chart,InvestorPlace,/news/stocks/how-to-trade-the-triangle-pattern-on-the-palantir-stock-chart-1029896100,positive,0.9437076449394226
94,12/15/2020 9:27:48 PM,The 8 Best Long-Term Stocks with Plenty of Potential,InvestorPlace,/news/stocks/the-8-best-long-term-stocks-with-plenty-of-potential-1029896098,negative,0.5733261704444885
95,12/16/2020 2:57:44 PM,It’s Time to Study Palantir and Nio: My Best and Worst Picks in 2020,InvestorPlace,/news/stocks/studying-palantir-and-nio-stock-my-best-and-worst-picks-1029898917,positive,0.8994829654693604
96,12/16/2020 4:02:55 PM,"Bet on the Jockey, If Not the Horse, with Pershing Square",InvestorPlace,/news/stocks/bet-on-the-jockey-if-not-the-horse-with-pershing-square-stock-1029899503,positive,0.9366114735603333
97,12/16/2020 4:33:11 PM,7 Big Data Stocks That Are Feeding Our Information Addiction,InvestorPlace,/news/stocks/7-big-data-stocks-that-are-feeding-our-information-addiction-1029899500,positive,0.9330371022224426
98,12/16/2020 8:57:00 PM,3 Key Reasons to Avoid Palantir,InvestorPlace,/news/stocks/3-key-reasons-to-avoid-palantir-stock-1029900151,positive,0.9316138625144958
99,12/17/2020 5:19:54 PM,3 Stocks to Buy Now for the Best Themes of 2021 and Beyond,InvestorPlace,/news/stocks/3-stocks-to-buy-now-for-the-best-themes-of-2021-and-beyond-1029904010,positive,0.8764346241950989
100,12/17/2020 10:08:10 PM,"The Pullback in Palantir Is Entirely Justified, But Invites Buyers",InvestorPlace,/news/stocks/pullback-in-palantir-stock-entirely-justified-but-invites-buyers-1029904585,negative,0.6517481207847595
101,12/18/2020 1:52:21 PM,"Palantir stock drops 4% after Credit Suisse turns bearish on the ""valuation disconnected from fundamentals""",Seeking Alpha,https://seekingalpha.com/news/3645711-palantir-stock-drops-4-after-credit-suisse-turns-bearish-on-valuation-disconnected-from?utm_source=markets.businessinsider.com&utm_medium=referral,neutral,0.9667453765869141
102,12/18/2020 4:05:59 PM,Don’t Let a Change In Washington Change Your Opinion on Palantir Stock,InvestorPlace,/news/stocks/palantir-stock-offers-solid-financials-realistic-growth-1029907364,positive,0.8571215271949768
103,12/18/2020 4:10:30 PM,"Benzinga's Top Upgrades, Downgrades For December 18, 2020",Benzinga,/news/stocks/benzinga-s-top-upgrades-downgrades-for-december-18-2020-1029909506,neutral,0.5821494460105896
104,12/21/2020 2:42:35 PM,3 Stocks to Buy for the Long Term OR the Short Term,InvestorPlace,/news/stocks/3-stocks-to-buy-for-the-long-term-or-the-short-term-1029910976,positive,0.9431121349334717
105,12/21/2020 3:12:56 PM,Palantir receives $114M one-year option for U.S. Army's Vantage program,Seeking Alpha,https://seekingalpha.com/news/3646199-palantir-receives-114m-one-year-option-for-u-s-armys-vantage-program?utm_source=markets.businessinsider.com&utm_medium=referral,negative,0.8531244397163391
106,12/21/2020 7:52:10 PM,9 Strong-Performing Stocks To Sell Before The End of The Year,InvestorPlace,/news/stocks/9-strong-performing-stocks-to-sell-before-the-end-of-the-year-1029912004,negative,0.8061348795890808
107,12/21/2020 8:51:51 PM,PLTR Stock: Palantir Shares Climb on Big Contract News,InvestorPlace,/news/stocks/pltr-stock-palantir-shares-climb-on-big-contract-news-1029911997,negative,0.9345789551734924
108,12/22/2020 12:05:34 PM,Palantir’s Free Cash Flow Next Year Will Be a Major Catalyst for PLTR Stock,InvestorPlace,/news/stocks/pltr-stock-is-worth-between-19-and-36-as-investors-see-free-cash-flow-1029913678,negative,0.8750486373901367
