,datetime,title,source,link,sentiment_class,sentiment_score
105,7/20/2022 9:35:28 PM,W.R. Berkley Q2 2022 Earnings Preview,Seeking Alpha,https://seekingalpha.com/news/3858656-w-r-berkley-q2-2022-earnings-preview?utm_source=businessinsider&utm_medium=referral,positive,0.8960503935813904
106,7/20/2022 9:35:35 PM,Notable earnings after Thursday's close,Seeking Alpha,https://seekingalpha.com/news/3858594-notable-earnings-after-thursdays-close?utm_source=businessinsider&utm_medium=referral,negative,0.8900269269943237
107,7/21/2022 8:16:01 PM,W.R. Berkley sets record with Q2 net premiums written of $2.6B beats expectations by $280M,Seeking Alpha,https://seekingalpha.com/news/3859334-wr-berkley-sets-record-with-q2-net-premiums-written-of-26b-beats-expectations-by-280m?utm_source=businessinsider&utm_medium=referral,negative,0.9090798497200012
108,7/21/2022 10:15:24 PM,"W. R. Berkley Corporation Q2 Profit Decreases, but beats estimates",RTTNews,/news/stocks/w-r-berkley-corporation-q2-profit-decreases-but-beats-estimates-1031605901,neutral,0.9669486284255981
109,8/3/2022 4:38:05 PM,"Benzinga's Top Ratings Upgrades, Downgrades For August 3, 2022",Benzinga,/news/stocks/benzinga-s-top-ratings-upgrades-downgrades-for-august-3-2022-1031646200,positive,0.5270115733146667
110,8/19/2022 5:01:24 PM,Expert Ratings for WR Berkley,Benzinga,/news/stocks/expert-ratings-for-wr-berkley-1031695645,positive,0.8351260423660278
111,9/7/2022 12:32:44 AM,What 4 Analyst Ratings Have To Say About WR Berkley,Benzinga,/news/stocks/what-4-analyst-ratings-have-to-say-about-wr-berkley-1031727578,positive,0.9252711534500122
112,9/14/2022 8:21:01 PM,W. R. Berkley Corporation declares $0.10 dividend,Seeking Alpha,https://seekingalpha.com/news/3882834-w-r-berkley-corporation-declares-0_10-dividend?utm_source=businessinsider&utm_medium=referral,positive,0.8856512904167175
113,10/5/2022 12:15:30 PM,"Use short-term rallies to boost high-momentum stock exposure, Wells Fargo says",Seeking Alpha,https://seekingalpha.com/news/3888434-use-short-term-rallies-to-bost-high-momentum-stock-exposure?utm_source=businessinsider&utm_medium=referral,negative,0.7352736592292786
114,10/12/2022 12:46:09 PM,Wells Fargo Sticks to Its Buy Rating for W. R. Berkley Corporation (WRB),TipRanks,/news/stocks/wells-fargo-sticks-to-its-buy-rating-for-w-r-berkley-corporation-wrb-1031799579,positive,0.8468838334083557
115,10/12/2022 2:24:21 PM,W. R. Berkley To Rally 25%? Here Are 5 Other Price Target Changes For Wednesday,Benzinga,/news/stocks/w-r-berkley-to-rally-25-here-are-5-other-price-target-changes-for-wednesday-1031799470,positive,0.9079136252403259
116,10/12/2022 9:11:27 PM,Expert Ratings for WR Berkley,Benzinga,/news/stocks/expert-ratings-for-wr-berkley-1031800749,positive,0.8351260423660278
117,10/21/2022 9:35:29 PM,W.R. Berkley Q3 2022 Earnings Preview,Seeking Alpha,https://seekingalpha.com/news/3893774-w-r-berkley-q3-2022-earnings-preview?utm_source=businessinsider&utm_medium=referral,positive,0.891191840171814
118,10/23/2022 3:01:13 PM,W R Berkley earnings: here's what Wall Street expects,Markets Insider Automation,/news/stocks/w_r_berkley-stock-quarter-earnings-preview-q3-1031826144,positive,0.9312017560005188
119,10/23/2022 9:35:00 PM,Notable earnings after Monday's close,Seeking Alpha,https://seekingalpha.com/news/3893898-notable-earnings-after-mondays-close?utm_source=businessinsider&utm_medium=referral,negative,0.8940557837486267
120,10/24/2022 8:13:06 PM,"W.R. Berkley Non-GAAP EPS of $1.01 beats by $0.16, revenue of $2.72B beats by $280M",Seeking Alpha,https://seekingalpha.com/news/3894356-w-r-berkley-non-gaap-eps-of-1_01-beats-0_16-revenue-of-2_72b-beats-280m?utm_source=businessinsider&utm_medium=referral,positive,0.6781597137451172
121,10/24/2022 10:18:10 PM,"W. R. Berkley Corporation Q3 Profit Decreases, but beats estimates",RTTNews,/news/stocks/w-r-berkley-corporation-q3-profit-decreases-but-beats-estimates-1031829796,neutral,0.9672265648841858
122,10/25/2022 3:28:56 PM,5 Analysts Have This to Say About WR Berkley,Benzinga,/news/stocks/5-analysts-have-this-to-say-about-wr-berkley-1031833175,positive,0.9006373286247253
123,10/25/2022 5:40:18 PM,W. R. Berkley stock dips despite Q3 beat,Seeking Alpha,https://seekingalpha.com/news/3894961-w-r-berkley-stock-dips-despite-q3-beat?utm_source=businessinsider&utm_medium=referral,neutral,0.9569499492645264
124,10/26/2022 9:25:46 PM,W. R. Berkley Corporation (WRB) Receives a Buy from Wells Fargo,TipRanks,/news/stocks/w-r-berkley-corporation-wrb-receives-a-buy-from-wells-fargo-1031840204,negative,0.5993878245353699
125,10/27/2022 3:35:57 PM,W. R. Berkley Corp. Launches New Business Berkley E&S Solutions ,RTTNews,/news/stocks/w-r-berkley-corp-launches-new-business-berkley-e-s-solutions-1031843940,positive,0.9096701741218567
126,11/11/2022 6:11:11 PM,"Benzinga's Top Ratings Upgrades, Downgrades For November 11, 2022",Benzinga,/news/stocks/benzinga-s-top-ratings-upgrades-downgrades-for-november-11-2022-1031905229,neutral,0.5089666843414307
127,11/11/2022 9:56:31 PM,What 5 Analyst Ratings Have To Say About WR Berkley,Benzinga,/news/stocks/what-5-analyst-ratings-have-to-say-about-wr-berkley-1031905605,positive,0.9279683828353882
128,11/22/2022 4:35:58 PM,W. R. Berkley Corporation (WRB) Gets a Hold from Morgan Stanley,TipRanks,/news/stocks/w-r-berkley-corporation-wrb-gets-a-hold-from-morgan-stanley-1031931980,positive,0.8954399824142456
129,12/9/2022 9:21:07 PM,W.R. Berkley declares $0.10 dividend,Seeking Alpha,https://seekingalpha.com/news/3915853-w-r-berkley-corporation-declares-0_10-dividend?utm_source=businessinsider&utm_medium=referral,positive,0.8742721676826477
130,12/12/2022 4:20:22 PM,"Kinsale, Palomar rated Hold as Jefferies starts coverage of P&C insurers",Seeking Alpha,https://seekingalpha.com/news/3916180-kinsale-palomar-rated-hold-as-jefferies-starts-coverage-of-pc-insurers?utm_source=businessinsider&utm_medium=referral,negative,0.6226375699043274
131,1/3/2023 2:08:36 PM,W.R. Berkley declares $0.50 special dividend,Seeking Alpha,https://seekingalpha.com/news/3921540-w-r-berkley-corporation-declares-0_50-dividend?utm_source=businessinsider&utm_medium=referral,positive,0.9287858605384827
132,1/9/2023 4:55:37 PM,"Prudential, MetLife and Hartford Financial downgraded at Goldman Sachs",Seeking Alpha,https://seekingalpha.com/news/3923051-prudential-metlife-hartford-financial-downgraded-at-goldman?utm_source=businessinsider&utm_medium=referral,neutral,0.912764310836792
133,1/10/2023 1:37:08 PM,"Travelers, Aon upgraded, Hartford Financial downgraded at Evercore",Seeking Alpha,https://seekingalpha.com/news/3923307-travelers-aon-upgraded-hartford-financial-downgraded-at-evercore?utm_source=businessinsider&utm_medium=referral,neutral,0.7874165773391724
134,1/13/2023 1:57:05 AM,W. R. Berkley Corporation (WRB) Receives a Rating Update from a Top Analyst,TipRanks,/news/stocks/w-r-berkley-corporation-wrb-receives-a-rating-update-from-a-top-analyst-1032016255,positive,0.6760261058807373
135,1/20/2023 2:00:56 PM,Analyst Expectations for WR Berkley's Future,Benzinga,/news/stocks/analyst-expectations-for-wr-berkley-s-future-1032030757,negative,0.80670565366745
136,1/20/2023 4:00:43 PM,"Benzinga's Top Ratings Upgrades, Downgrades For January 20, 2023",Benzinga,/news/stocks/benzinga-s-top-ratings-upgrades-downgrades-for-january-20-2023-1032031061,neutral,0.5302141308784485
137,1/21/2023 9:33:00 PM,BMO Capital analyst gets selective in insurance stock picks,Seeking Alpha,https://seekingalpha.com/news/3926513-bmo-capital-analyst-gets-selective-in-insurance-stock-picks?utm_source=businessinsider&utm_medium=referral,positive,0.5525955557823181
138,1/25/2023 3:01:13 PM,W R Berkley earnings: here's what Wall Street expects,Markets Insider Automation,/news/stocks/w_r_berkley-stock-price-quarter-earnings-preview-q4-1032040402,positive,0.9312017560005188
139,1/25/2023 10:35:02 PM,W.R. Berkley Q4 2022 Earnings Preview,Seeking Alpha,https://seekingalpha.com/news/3927923-w-r-berkley-q4-2022-earnings-preview?utm_source=businessinsider&utm_medium=referral,positive,0.897551417350769
140,1/25/2023 10:35:10 PM,Notable earnings after Thursday's close,Seeking Alpha,https://seekingalpha.com/news/3927792-notable-earnings-after-thursdays-close?utm_source=businessinsider&utm_medium=referral,negative,0.8900269269943237
141,1/26/2023 9:11:23 PM,"W.R. Berkley Non-GAAP EPS of $1.16 beats by $0.07, revenue of $2.43B misses by $80M",Seeking Alpha,https://seekingalpha.com/news/3928659-w-r-berkley-non-gaap-eps-of-1_16-beats-0_07-revenue-of-2_43b-misses-80m?utm_source=businessinsider&utm_medium=referral,positive,0.7535298466682434
142,1/26/2023 9:59:32 PM,"W. R. Berkley Q4 earnings beat on robust net premiums written, ROE, NII",Seeking Alpha,https://seekingalpha.com/news/3928751-w-r-berkley-q4-earnings-beat-on-robust-net-premiums-written-roe-nii?utm_source=businessinsider&utm_medium=referral,negative,0.7298579812049866
143,1/26/2023 10:17:27 PM,"W. R. Berkley Corporation Q4 Profit Increases, beats estimates",RTTNews,/news/stocks/w-r-berkley-corporation-q4-profit-increases-beats-estimates-1032045008,negative,0.9212595224380493
144,1/27/2023 4:45:12 AM,Wells Fargo Keeps Their Buy Rating on W. R. Berkley Corporation (WRB),TipRanks,/news/stocks/wells-fargo-keeps-their-buy-rating-on-w-r-berkley-corporation-wrb-1032045421,positive,0.919550359249115
145,1/31/2023 1:50:39 AM,"Analysts Offer Insights on Financial Companies: Ameriprise Financial (AMP), W. R. Berkley Corporation (WRB) and Western Union (WU)",TipRanks,/news/stocks/analysts-offer-insights-on-financial-companies-ameriprise-financial-amp-w-r-berkley-corporation-wrb-and-western-union-wu-1032052162,positive,0.9351444840431213
146,2/24/2023 9:31:08 PM,W.R. Berkley declares $0.10 dividend,Seeking Alpha,https://seekingalpha.com/news/3940864-w-r-berkley-corporation-declares-0_10-dividend?utm_source=businessinsider&utm_medium=referral,positive,0.8742721676826477
147,3/7/2023 11:32:29 AM,Sector reshuffle gives Financials more growth power; here are Goldman's top names,Seeking Alpha,https://seekingalpha.com/news/3944624-sector-reshuffle-givess-financials-more-growth-power-here-are-goldmans-top-names?utm_source=businessinsider&utm_medium=referral,positive,0.9353049397468567
148,3/8/2023 11:41:29 AM,Sleep-at-night stocks for those hedging or risk averse,Seeking Alpha,https://seekingalpha.com/news/3945026-sleep-at-night-stocks-for-those-hedging-or-risk-averse?utm_source=businessinsider&utm_medium=referral,positive,0.7829471826553345
149,3/9/2023 12:54:11 PM,Stocks most susceptible to a stronger Wealth Effect - BofA,Seeking Alpha,https://seekingalpha.com/news/3944986-stocks-most-susceptible-to-a-stronger-wealth-effect?utm_source=businessinsider&utm_medium=referral,positive,0.8354145288467407
150,3/15/2023 12:09:34 PM,"3 Stocks to Buy Today, 3/15/2023, According to Top Analysts",TipRanks,/news/stocks/3-stocks-to-buy-today-3-15-2023-according-to-top-analysts-1032169207,positive,0.9036581516265869
151,3/15/2023 4:00:42 PM,"Benzinga's Top Ratings Upgrades, Downgrades For March 15, 2023",Benzinga,/news/stocks/benzinga-s-top-ratings-upgrades-downgrades-for-march-15-2023-1032170001,neutral,0.4989768862724304
152,4/13/2023 7:01:20 PM,5 Analysts Have This to Say About WR Berkley,Benzinga,/news/stocks/5-analysts-have-this-to-say-about-wr-berkley-1032230969,positive,0.9006373286247253
153,4/18/2023 8:25:26 PM,KBW Keeps Their Buy Rating on W. R. Berkley Corporation (WRB),TipRanks,/news/stocks/kbw-keeps-their-buy-rating-on-w-r-berkley-corporation-wrb-1032241064,positive,0.9199207425117493
154,4/19/2023 3:01:13 PM,What Wall Street expects from W R Berkley's earnings,Markets Insider Automation,/news/stocks/w_r_berkley-q1-earnings-preview-1032243506,positive,0.9283031821250916
155,4/19/2023 9:35:13 PM,W.R. Berkley Q1 2023 Earnings Preview,Seeking Alpha,https://seekingalpha.com/news/3957823-w-r-berkley-q1-2023-earnings-preview?utm_source=businessinsider&utm_medium=referral,positive,0.88870769739151
156,4/19/2023 9:35:37 PM,Notable earnings after Thursday's close,Seeking Alpha,https://seekingalpha.com/news/3957776-notable-earnings-after-thursdays-close?utm_source=businessinsider&utm_medium=referral,negative,0.8900269269943237
157,4/20/2023 8:17:28 PM,"W.R. Berkley GAAP EPS of $1.06 misses by $0.21, revenue of $2.89B beats by $360M",Seeking Alpha,https://seekingalpha.com/news/3958440-w-r-berkley-gaap-eps-of-1_06-misses-0_21-revenue-of-2_89b-beats-360m?utm_source=businessinsider&utm_medium=referral,positive,0.5997308492660522
158,4/20/2023 8:46:16 PM,W.R. Berkley Q1 earnings weaker than expected on higher combined ratio,Seeking Alpha,https://seekingalpha.com/news/3958459-wr-berkley-q1-earnings-weaker-than-expected-on-higher-combined-ratio?utm_source=businessinsider&utm_medium=referral,neutral,0.9725200533866882
159,4/20/2023 10:22:10 PM,"W. R. Berkley Corporation Q1 Profit Decreases, misses estimates",RTTNews,/news/stocks/w-r-berkley-corporation-q1-profit-decreases-misses-estimates-1032248136,neutral,0.9724869132041931
160,4/21/2023 12:25:12 AM,W. R. Berkley Corporation (WRB) Gets a Buy from Wells Fargo,TipRanks,/news/stocks/w-r-berkley-corporation-wrb-gets-a-buy-from-wells-fargo-1032248326,negative,0.6086131930351257
161,4/21/2023 9:25:19 AM,Bank of America Securities Keeps Their Buy Rating on W. R. Berkley Corporation (WRB),TipRanks,/news/stocks/bank-of-america-securities-keeps-their-buy-rating-on-w-r-berkley-corporation-wrb-1032249286,positive,0.9196682572364807
162,4/21/2023 4:01:34 PM,"Bit Digital among financials gainers, W. R. Berkley in losers",Seeking Alpha,https://seekingalpha.com/news/3958748-bit-digital-among-financials-gainers-w-r-berkley-in-losers?utm_source=businessinsider&utm_medium=referral,positive,0.5021026730537415
163,4/21/2023 4:58:01 PM,"W. R. Berkley, Autoliv, Glacier Bancorp And Other Big Stocks Moving Lower On Friday",Benzinga,/news/stocks/w-r-berkley-autoliv-glacier-bancorp-and-other-big-stocks-moving-lower-on-friday-1032250258,neutral,0.9641066193580627
164,4/21/2023 6:40:46 PM,Why SAP Shares Are Trading Higher By Around 6%? Here Are Other Stocks Moving In Friday's Mid-Day Session,Benzinga,/news/stocks/why-sap-shares-are-trading-higher-by-around-6-here-are-other-stocks-moving-in-friday-s-mid-day-session-1032250542,positive,0.8932568430900574
165,4/28/2023 10:55:34 AM,"5 Best Financial Stocks to Invest in Now, According to Analysts – April 2023",TipRanks,/news/stocks/5-best-financial-stocks-to-invest-in-now-according-to-analysts-–-april-2023-1032273187,positive,0.743321418762207
166,6/1/2023 9:54:18 PM,W. R. Berkley sells Breckenridge's property and casualty insurance unit,Seeking Alpha,https://seekingalpha.com/news/3976895-w-r-berkley-sells-breckenridges-property-and-casualty-insurance-unit?utm_source=businessinsider&utm_medium=referral,positive,0.9421476125717163
167,6/14/2023 8:22:24 PM,W.R. Berkley raises quarterly dividend by 10% to $0.11/share,Seeking Alpha,https://seekingalpha.com/news/3979947-w-r-berkley-corporation-declares-0_11-dividend?utm_source=businessinsider&utm_medium=referral,negative,0.9139091968536377
168,6/14/2023 10:42:49 PM,"W. R. Berkley Raises Dividend, Stock Buyback Plan ",RTTNews,/news/stocks/w-r-berkley-raises-dividend-stock-buyback-plan-1032390100,positive,0.8114630579948425
169,6/16/2023 11:10:50 AM,"Dividend Roundup: Southwest Airlines, Philip Morris, Microsoft, Target, and more",Seeking Alpha,https://seekingalpha.com/news/3980282-dividend-roundup-southwest-airlines-phillip-morris-microsoft-target-and-more?utm_source=businessinsider&utm_medium=referral,positive,0.9456132650375366
170,6/26/2023 12:55:14 PM,BMO Capital Sticks to Their Hold Rating for W. R. Berkley Corporation (WRB),TipRanks,/news/stocks/bmo-capital-sticks-to-their-hold-rating-for-w-r-berkley-corporation-wrb-1032409650,positive,0.7883225679397583
171,6/29/2023 9:02:34 AM,Goldman adds 39 new stocks to its Sharpe Ratio basket with megacaps absent,Seeking Alpha,https://seekingalpha.com/news/3983745-goldman-adds-39-new-stocks-to-its-sharpe-ratio-basket?utm_source=businessinsider&utm_medium=referral,positive,0.5409156084060669
172,7/11/2023 1:46:47 AM,RBC Capital Sticks to Their Buy Rating for W. R. Berkley Corporation (WRB),TipRanks,/news/stocks/rbc-capital-sticks-to-their-buy-rating-for-w-r-berkley-corporation-wrb-1032436091,negative,0.5161746144294739
173,7/15/2023 1:47:53 AM,RBC Capital Remains a Buy on W. R. Berkley Corporation (WRB),TipRanks,/news/stocks/rbc-capital-remains-a-buy-on-w-r-berkley-corporation-wrb-1032448542,positive,0.9482516646385193
174,7/17/2023 9:00:33 PM,The Latest Analyst Ratings for WR Berkley,Benzinga,/news/stocks/the-latest-analyst-ratings-for-wr-berkley-1032452424,positive,0.9383799433708191
175,7/19/2023 2:25:14 AM,W. R. Berkley Corporation (WRB) Receives a Buy from Truist Financial,TipRanks,/news/stocks/w-r-berkley-corporation-wrb-receives-a-buy-from-truist-financial-1032456549,positive,0.6953204870223999
176,7/19/2023 9:35:19 PM,W.R. Berkley Q2 2023 Earnings Preview,Seeking Alpha,https://seekingalpha.com/news/3988832-w-r-berkley-q2-2023-earnings-preview?utm_source=businessinsider&utm_medium=referral,positive,0.8900957703590393
177,7/19/2023 9:35:59 PM,Notable earnings after Thursday's close,Seeking Alpha,https://seekingalpha.com/news/3988761-notable-earnings-after-thursdays-close?utm_source=businessinsider&utm_medium=referral,negative,0.8900269269943237
178,7/20/2023 8:14:59 PM,"W.R. Berkley Non-GAAP EPS of $1.14 beats by $0.06, Net premiums written of $2.81B beats by $240M",Seeking Alpha,https://seekingalpha.com/news/3989399-wr-berkley-non-gaap-eps-of-114-beats-by-006-net-premiums-written-of-281b-beats-by-240m?utm_source=businessinsider&utm_medium=referral,positive,0.4534393548965454
179,7/20/2023 8:40:26 PM,W. R. Berkley Q2 earnings rise past expectations as combined ratio slips,Seeking Alpha,https://seekingalpha.com/news/3989420-w-r-berkley-q2-earnings-rise-past-expectations-as-combined-ratio-slips?utm_source=businessinsider&utm_medium=referral,negative,0.9462901949882507
180,7/20/2023 10:18:16 PM,"W. R. Berkley Corporation Q2 Profit Increases, beats estimates",RTTNews,/news/stocks/w-r-berkley-corporation-q2-profit-increases-beats-estimates-1032463879,negative,0.9220373034477234
181,7/21/2023 12:45:07 AM,Wells Fargo Sticks to Its Buy Rating for W. R. Berkley Corporation (WRB),TipRanks,/news/stocks/wells-fargo-sticks-to-its-buy-rating-for-w-r-berkley-corporation-wrb-1032464123,positive,0.8468838334083557
182,7/21/2023 10:12:17 AM,"Analysts Are Bullish on These Financial Stocks: Synovus (SNV), W. R. Berkley Corporation (WRB)",TipRanks,/news/stocks/analysts-are-bullish-on-these-financial-stocks-synovus-snv-w-r-berkley-corporation-wrb-1032465399,positive,0.8072999119758606
183,7/21/2023 11:05:15 AM,BMO Capital Reaffirms Their Hold Rating on W. R. Berkley Corporation (WRB),TipRanks,/news/stocks/bmo-capital-reaffirms-their-hold-rating-on-w-r-berkley-corporation-wrb-1032465564,positive,0.844343364238739
184,8/3/2023 11:40:27 AM,"Goldman in, Microsoft out of BofA Alpha Surprise Portfolio",Seeking Alpha,https://seekingalpha.com/news/3996317-goldman-in-microsoft-out-of-bofa-alpha-surprise-portfolio?utm_source=businessinsider&utm_medium=referral,positive,0.6860989332199097
185,9/13/2023 8:36:58 PM,"W.R. Berkley declares quarterly dividend of $0.11, $0.50 special dividend",Seeking Alpha,https://seekingalpha.com/news/4011549-w-r-berkley-corporation-declares-0_50-dividend?utm_source=businessinsider&utm_medium=referral&feed_item_type=news,positive,0.8944244384765625
186,9/20/2023 4:20:36 PM,Top 4 Financial Stocks That May Fall Off A Cliff,Benzinga,/news/stocks/top-4-financial-stocks-that-may-fall-off-a-cliff-1032644071,neutral,0.9475619792938232
187,10/19/2023 2:25:40 AM,Truist Financial Remains a Buy on W. R. Berkley Corporation (WRB),TipRanks,/news/stocks/truist-financial-remains-a-buy-on-w-r-berkley-corporation-wrb-1032718682,positive,0.936819851398468
188,10/22/2023 3:01:13 PM,W R Berkley earnings preview: what to expect,Markets Insider Automation,/news/stocks/w_r_berkley-stock-q3-earnings-preview-1032726056,positive,0.8982245326042175
189,10/23/2023 10:17:29 PM,"W. R. Berkley Corporation Q3 Profit Increases, beats estimates",RTTNews,/news/stocks/w-r-berkley-corporation-q3-profit-increases-beats-estimates-1032730191,negative,0.9177053570747375
190,10/23/2023 11:55:23 PM,Elyse Greenspan Recommends ‘Buy’ Rating for W.R. Berkley Corporation Following Strong Q3 Earnings and Premiums Growth,TipRanks,/news/stocks/elyse-greenspan-recommends-buy-rating-for-w-r-berkley-corporation-following-strong-q3-earnings-and-premiums-growth-1032733006,negative,0.9413278102874756
191,10/24/2023 9:16:33 AM,Outperforming Projections: W.R. Berkley’s Robust Growth and Profitability Drive Buy Rating,TipRanks,/news/stocks/outperforming-projections-w-r-berkley-s-robust-growth-and-profitability-drive-buy-rating-1032735225,negative,0.9356452822685242
192,10/24/2023 10:40:38 AM,"Analysts Offer Insights on Financial Companies: W. R. Berkley Corporation (WRB), Apollomics (APLM) and Northwest Bancshares (NWBI)",TipRanks,/news/stocks/analysts-offer-insights-on-financial-companies-w-r-berkley-corporation-wrb-apollomics-aplm-and-northwest-bancshares-nwbi-1032735266,positive,0.9360685348510742
193,10/26/2023 2:25:33 AM,Truist Financial Reaffirms Their Buy Rating on W. R. Berkley Corporation (WRB),TipRanks,/news/stocks/truist-financial-reaffirms-their-buy-rating-on-w-r-berkley-corporation-wrb-1032744689,positive,0.782139003276825
194,12/18/2023 12:28:55 PM,W. R. Berkley Corporation (WRB) Gets a Buy from Wells Fargo,TipRanks,/news/stocks/w-r-berkley-corporation-wrb-gets-a-buy-from-wells-fargo-1032910618,negative,0.6086131930351257
195,1/8/2024 12:31:01 PM,"Analysts Offer Insights on Financial Companies: Applied Digital Corporation (APLD), W. R. Berkley Corporation (WRB) and Coinbase Global (COIN)",TipRanks,/news/stocks/analysts-offer-insights-on-financial-companies-applied-digital-corporation-apld-w-r-berkley-corporation-wrb-and-coinbase-global-coin-1032951880,positive,0.9319683313369751
196,1/9/2024 10:22:29 AM,W. R. Berkley Corporation (WRB) was downgraded to a Hold Rating at Evercore ISI,TipRanks,/news/stocks/w-r-berkley-corporation-wrb-was-downgraded-to-a-hold-rating-at-evercore-isi-1032955174,neutral,0.6955515146255493
197,1/9/2024 2:06:08 PM,United Airlines To Rally Over 30%? Here Are 10 Top Analyst Forecasts For Tuesday,Benzinga,/news/stocks/united-airlines-to-rally-over-30-here-are-10-top-analyst-forecasts-for-tuesday-1032953526,positive,0.9100989699363708
198,1/11/2024 12:28:19 PM,W. R. Berkley Corporation (WRB) Gets a Buy from Wells Fargo,TipRanks,/news/stocks/w-r-berkley-corporation-wrb-gets-a-buy-from-wells-fargo-1032961298,negative,0.6086131930351257
199,1/23/2024 3:01:13 PM,Here's what to expect from W R Berkley's earnings report,Markets Insider Automation,/news/stocks/w_r_berkley-q4-earnings-preview-stock-1032987913,positive,0.9352832436561584
200,1/23/2024 10:35:20 PM,W.R. Berkley Q4 2023 Earnings Preview,Seeking Alpha,https://seekingalpha.com/news/4057488-w-r-berkley-q4-2023-earnings-preview?utm_source=businessinsider&utm_medium=referral&feed_item_type=news,positive,0.8936692476272583
201,1/23/2024 10:35:36 PM,Notable earnings after Wednesday's close,Seeking Alpha,https://seekingalpha.com/news/4057383-notable-earnings-after-wednesdays-close?utm_source=businessinsider&utm_medium=referral&feed_item_type=news,negative,0.8919203281402588
202,1/24/2024 9:13:14 PM,"W.R. Berkley Non-GAAP EPS of $1.45 beats by $0.08, revenue of $3.22B beats by $520M",Seeking Alpha,https://seekingalpha.com/news/4058140-w-r-berkley-non-gaap-eps-of-1_45-beats-0_08-revenue-of-3_22b-beats-520m?utm_source=businessinsider&utm_medium=referral&feed_item_type=news,positive,0.6760860085487366
203,1/24/2024 10:22:24 PM,"W. R. Berkley Corporation Q4 Profit Increases, beats estimates",RTTNews,/news/stocks/w-r-berkley-corporation-q4-profit-increases-beats-estimates-1032994136,negative,0.9212595224380493
204,1/25/2024 1:25:27 AM,Strong Performance and Growth Prospects Justify Buy Rating for W. R. Berkley Corporation,TipRanks,/news/stocks/strong-performance-and-growth-prospects-justify-buy-rating-for-w-r-berkley-corporation-1032994509,negative,0.8302828073501587
205,1/25/2024 6:45:44 AM,W. R. Berkley Corporation (WRB) Gets a Hold from KBW,TipRanks,/news/stocks/w-r-berkley-corporation-wrb-gets-a-hold-from-kbw-1032995925,positive,0.9013360738754272
206,1/25/2024 12:27:28 PM,RBC Capital Reaffirms Their Hold Rating on W. R. Berkley Corporation (WRB),TipRanks,/news/stocks/rbc-capital-reaffirms-their-hold-rating-on-w-r-berkley-corporation-wrb-1032997586,positive,0.8435314893722534
207,1/25/2024 12:38:53 PM,W. R. Berkley Corporation: Solid Performance Tempered by Moderated Market Dynamics – A Hold Recommendation,TipRanks,/news/stocks/w-r-berkley-corporation-solid-performance-tempered-by-moderated-market-dynamics-–-a-hold-recommendation-1032997657,negative,0.9509515762329102
208,1/25/2024 7:27:05 PM,"Alaska Air Posts Upbeat Earnings, Joins Xerox, United Rentals And Other Big Stocks Moving Higher On Thursday",Benzinga,/news/stocks/alaska-air-posts-upbeat-earnings-joins-xerox-united-rentals-and-other-big-stocks-moving-higher-on-thursday-1032998214,negative,0.9402493834495544
209,1/25/2024 7:49:46 PM,"How EVs, High-Tech Vehicles Are Fueling Surge In Insurance Stocks",Benzinga,/news/etf/how-evs-high-tech-vehicles-are-fueling-surge-in-insurance-stocks-1032998228,positive,0.7295450568199158
210,1/25/2024 8:52:08 PM,W. R. Berkley Analysts Increase Their Forecasts After Strong Q4 Earnings,Benzinga,/news/stocks/w-r-berkley-analysts-increase-their-forecasts-after-strong-q4-earnings-1032998332,negative,0.8635421395301819
