datetime,title,source,link,sentiment_class,sentiment_score
4/7/2021 8:57:04 PM,"Flexible schedules, shared desks, burnout support: Here's how advertising giants like WPP and Omnicom are planning for the future of work",Premium,/news/stocks/wpp-omnicom-mdc-others-discuss-plans-to-return-to-office-2021-4,neutral,0.9342193603515625
4/12/2021 10:15:00 PM,Interpublic Schedules First Quarter 2021 Earnings Release,GlobeNewswire,/news/stocks/interpublic-schedules-first-quarter-2021-earnings-release-1030295467,neutral,0.8876550197601318
4/14/2021 9:39:02 PM,"How a quiet, behind-the-scenes fixer became CEO of the fourth-biggest advertising company - and how he plans to keep its momentum going",Premium,/news/stocks/ipg-ceo-philippe-krakowsky-on-plans-to-grow-ad-giant-2021-4,neutral,0.9117796421051025
4/16/2021 1:33:02 PM,"Burnout is taking a toll on advertising employees' mental health, and it's causing some to quit",Premium,/news/stocks/advertising-employees-are-facing-burnout-and-some-are-quitting-2021-4,negative,0.9627659916877747
4/16/2021 11:20:44 PM,Imperial and SOQUEM Close the Transaction to Exchange Quebec Base Metal and Gold Property Interests,GlobeNewswire,/news/stocks/imperial-and-soquem-close-the-transaction-to-exchange-quebec-base-metal-and-gold-property-interests-1030313902,neutral,0.8925697803497314
4/20/2021 2:00:03 PM,Omnicom is trying to cash in on healthcare advertising with a new data tool for clients like Pfizer and Merck,Premium,/news/stocks/omnicom-is-launching-omni-health-to-cater-to-healthcare-marketers-2021-4,positive,0.7404500842094421
4/21/2021 6:15:14 PM,Perks that 8 ad agencies are giving exhausted employees to fight burnout,Premium,/news/stocks/advertising-agencies-detail-efforts-to-prevent-staff-burnout-2021-4,neutral,0.7836734652519226
4/22/2021 2:36:13 PM,Interpublic Group dips 3.4% as BMO backs off decade of cheerleading,Seeking Alpha,https://seekingalpha.com/news/3684631-interpublic-group-dips-34-as-bmo-backs-off-decade-of-cheerleading?utm_source=markets.businessinsider.com&utm_medium=referral,negative,0.9697782397270203
4/22/2021 4:02:37 PM,"Benzinga's Top Ratings Upgrades, Downgrades For April 22, 2021",Benzinga,/news/stocks/benzinga-s-top-ratings-upgrades-downgrades-for-april-22-2021-1030333966,negative,0.5816802382469177
4/23/2021 2:18:16 PM,"Must-know advertising hires, exits, and promotions at companies like TBWA, NBCUniversal, and Clubhouse",Premium,/news/stocks/most-important-ad-and-marketing-hires-and-promotions-2021-4,neutral,0.9010868668556213
4/26/2021 3:02:04 PM,Interpublic Group of Cos is about to announce its earnings — here's what Wall Street expects,Markets Insider Automation,/news/stocks/interpublic_group_of_cos-stock-quarter-earnings-preview-q1-1030345498,neutral,0.9329299926757812
4/27/2021 4:20:38 PM,Notable earnings before Wednesday's open,Seeking Alpha,https://seekingalpha.com/news/3686206-notable-earnings-wednesdays-open?utm_source=markets.businessinsider.com&utm_medium=referral,positive,0.855887770652771
4/27/2021 5:01:00 PM,"Interpublic Group of Companies, Inc. (The) -- Moody's affirms Interpublic Group's senior unsecured ratings at Baa2 and revises the outlook to stable",Moodys,/news/bonds/interpublic-group-of-companies-inc-the-moody-s-affirms-interpublic-group-s-senior-unsecured-ratings-at-baa2-and-revises-the-outlook-to-stable-1030353010,positive,0.7343410849571228
4/27/2021 5:11:58 PM,Interpublic Group of Companies Q1 2021 Earnings Preview,Seeking Alpha,https://seekingalpha.com/news/3686259-interpublic-group-of-companies-q1-2021-earnings-preview?utm_source=markets.businessinsider.com&utm_medium=referral,neutral,0.8275572061538696
4/28/2021 11:27:07 AM,"Interpublic Group of Companies EPS beats by $0.31, beats on revenue",Seeking Alpha,https://seekingalpha.com/news/3686768-interpublic-group-of-companies-eps-beats-0_31-beats-on-revenue?utm_source=markets.businessinsider.com&utm_medium=referral,neutral,0.5781539082527161
4/28/2021 1:00:00 PM,Interpublic Announces First Quarter 2021 Results,GlobeNewswire,/news/stocks/interpublic-announces-first-quarter-2021-results-1030357256,neutral,0.8859147429466248
4/28/2021 2:30:00 PM,"Imperial Mining Intersects Strong Scandium and Rare Earth Grades over 92.5 m at Crater Lake, Quebec",GlobeNewswire,/news/stocks/imperial-mining-intersects-strong-scandium-and-rare-earth-grades-over-92-5-m-at-crater-lake-quebec-1030357975,positive,0.9263218641281128
4/28/2021 3:28:51 PM,Interpublic Group Of Companies Q1 Profit Tops Estimates ,RTTNews,/news/stocks/interpublic-group-of-companies-q1-profit-tops-estimates-1030358636,negative,0.5446963310241699
4/30/2021 2:15:02 PM,16 top IPG execs who are powering the advertising giant's health- and data-focused strategy,Premium,/news/stocks/top-executives-leading-advertising-giant-ipg-2021-4,neutral,0.9048508405685425
4/30/2021 2:18:01 PM,21 advertising execs who are finding new ways to target people in a privacy-centric world,Premium,/news/stocks/brand-and-agency-execs-leading-the-charge-on-data-privacy-2021-4,neutral,0.853293240070343
5/3/2021 12:21:07 AM,MGM deal throws other Hollywood giants in the spotlight,Business Insider,https://www.businessinsider.com/insiders-top-advertising-and-media-stories-for-may-28-2021-5,negative,0.7542207837104797
5/4/2021 12:45:02 AM,JetBlue hired a new ad agency as it looks to rebrand itself in the pandemic,Premium,/news/stocks/jetblue-picks-new-ad-agency-after-11-years-ipg-omnicom-2021-5,neutral,0.6200481653213501
5/5/2021 5:00:00 PM,Imperial Announces Changes to its Board of Directors,GlobeNewswire,/news/stocks/imperial-announces-changes-to-its-board-of-directors-1030391666,neutral,0.8691188097000122
5/10/2021 5:26:20 PM,Stocks That Hit 52-Week Highs On Monday,Benzinga,/news/stocks/stocks-that-hit-52-week-highs-on-monday-1030410156,neutral,0.6719298958778381
5/13/2021 3:15:02 PM,IPG's CMO consultancy is creating a new division geared at helping marketers boost their own brands,Premium,/news/stocks/ipgs-consultancy-black-glass-is-creating-new-division-aimed-at-cmos-2021-5,neutral,0.5704202651977539
5/18/2021 2:30:00 PM,Imperial Mining and Eck Industries Execute a Letter of Intent for Collaborative Scandium Material R&D,GlobeNewswire,/news/stocks/imperial-mining-and-eck-industries-execute-a-letter-of-intent-for-collaborative-scandium-material-r-d-1030441162,positive,0.718859076499939
5/19/2021 10:15:00 PM,"Interpublic Group to Present at the J.P. Morgan Global Technology, Media & Communications Conference",GlobeNewswire,/news/stocks/interpublic-group-to-present-at-the-j-p-morgan-global-technology-media-communications-conference-1030448359,neutral,0.9250871539115906
5/24/2021 2:54:02 PM,"From WPP to Omnicom, these ad agencies hard hit by the pandemic are aggressively hiring again for hundreds of roles",Premium,/news/stocks/ad-giants-like-wpp-and-omnicom-are-hiring-again-2021-5,neutral,0.7253632545471191
5/25/2021 7:00:03 AM,IPG is using a new tool to help advertisers avoid misinformation and says it's already increasing click-through rates 143%,Premium,/news/stocks/ipg-using-newsguard-tool-to-make-programmatic-advertising-more-efficient-2021-5,positive,0.920577347278595
5/27/2021 2:30:00 PM,Imperial Mining Crater Lake Drilling Returns Wide Scandium and Rare Earth Intersections: Driving to Deliver 43-101 Resource Estimate by June,GlobeNewswire,/news/stocks/imperial-mining-crater-lake-drilling-returns-wide-scandium-and-rare-earth-intersections-driving-to-deliver-43-101-resource-estimate-by-june-1030471271,neutral,0.6871834397315979
5/27/2021 8:37:47 PM,Interpublic Group of Companies declares $0.27 dividend,Seeking Alpha,https://seekingalpha.com/news/3700999-interpublic-group-of-companies-declares-0_27-dividend?utm_source=markets.businessinsider.com&utm_medium=referral,neutral,0.9014075994491577
5/27/2021 10:30:00 PM,Interpublic Declares Common Stock Dividend,GlobeNewswire,/news/stocks/interpublic-declares-common-stock-dividend-1030473283,neutral,0.939891517162323
6/1/2021 8:39:01 PM,"T.J. Maxx is searching for a new advertising agency, ending a 12-year relationship with WPP's Grey",Premium,/news/stocks/tj-maxx-ends-advertising-partnership-with-wpps-grey-2021-6,neutral,0.8378747701644897
6/2/2021 1:00:00 PM,Interpublic Group to Present at the Barclays Future of Media Conference,GlobeNewswire,/news/stocks/interpublic-group-to-present-at-the-barclays-future-of-media-conference-1030486433,neutral,0.941862940788269
6/3/2021 10:15:00 PM,"Interpublic Group to Present at the 1st Annual Evercore ISI Technology, Media, and Telecom Conference",GlobeNewswire,/news/stocks/interpublic-group-to-present-at-the-1st-annual-evercore-isi-technology-media-and-telecom-conference-1030493110,neutral,0.8523486852645874
6/9/2021 1:00:00 PM,IPG Launches Motor City Marketing and Communications Fellowship Program,GlobeNewswire,/news/stocks/ipg-launches-motor-city-marketing-and-communications-fellowship-program-1030506880,neutral,0.7650741338729858
6/9/2021 2:30:00 PM,"U.S. Nears Halfway Mark On Road To Recovery For Live Experiences, Reports New Index From Jack Morton",PR Newswire,/news/stocks/u-s-nears-halfway-mark-on-road-to-recovery-for-live-experiences-reports-new-index-from-jack-morton-1030507523,positive,0.7102735638618469
6/9/2021 2:30:00 PM,Imperial Mining Develops High-Recovery Extraction Process for Scandium and Rare Earth Elements for Crater Lake Mineralization,GlobeNewswire,/news/stocks/imperial-mining-develops-high-recovery-extraction-process-for-scandium-and-rare-earth-elements-for-crater-lake-mineralization-1030507511,neutral,0.829382598400116
6/9/2021 4:00:00 PM,IPG Announces Climate Action Plan as Part of an Integrated ESG Program,GlobeNewswire,/news/stocks/ipg-announces-climate-action-plan-as-part-of-an-integrated-esg-program-1030508016,neutral,0.8449975252151489
6/9/2021 9:03:02 PM,"A top advertising DEI expert shares the specific steps she takes to get agencies to improve their culture, starting with interviewing and onboarding",Premium,/news/stocks/dei-expert-lauren-tucker-shares-top-advice-for-ad-agencies-2021-6,neutral,0.8508943915367126
6/10/2021 4:30:00 PM,Weber Shandwick Chief Growth Officer Susan Howe Named President,PR Newswire,/news/stocks/weber-shandwick-chief-growth-officer-susan-howe-named-president-1030512533,neutral,0.9086186289787292
6/10/2021 6:05:00 PM,McCann Worldgroup Promotes Laura Simpson To President Of McCann Worldgroup Truth Central And Global Chief Intelligence Officer,PR Newswire,/news/stocks/mccann-worldgroup-promotes-laura-simpson-to-president-of-mccann-worldgroup-truth-central-and-global-chief-intelligence-officer-1030512891,neutral,0.8802409172058105
6/13/2021 3:00:03 PM,"Advertising giant IPG predicts how much ad sales will grow in 2021, and which companies will benefit most",Premium,/news/stocks/ipg-magna-forecasts-record-growth-for-the-ad-industry-2021-6,positive,0.8469631671905518
6/14/2021 2:06:03 PM,Inside the strategies a top ad agency used to dramatically increase diversity in its leadership,Premium,/news/stocks/ipg-ad-agency-rga-shares-tips-for-improving-diversity-2021-6,neutral,0.5446546077728271
6/15/2021 12:30:00 PM,Two-Thirds of People Don't Believe They Will Have The Transportation Flexibility to Meet Future Needs,PR Newswire,/news/stocks/two-thirds-of-people-don-t-believe-they-will-have-the-transportation-flexibility-to-meet-future-needs-1030522771,neutral,0.7143569588661194
6/21/2021 11:09:08 PM,Ad giant IPG created a new division to take on rivals WPP and Omnicom for healthcare dollars,Premium,/news/stocks/advertising-company-ipg-to-create-new-healthcare-marketing-division-2021-6,neutral,0.6951888203620911
6/23/2021 2:30:00 PM,Imperial Mining Receives Final Crater Lake Drill Results: Data Sent to Engineers for 43-101 Resource Estimation on TG Zone,GlobeNewswire,/news/stocks/imperial-mining-receives-final-crater-lake-drill-results-data-sent-to-engineers-for-43-101-resource-estimation-on-tg-zone-1030546929,neutral,0.9340325593948364
6/23/2021 6:00:00 PM,IPG Names Heide Gardner Global Culture Officer,GlobeNewswire,/news/stocks/ipg-names-heide-gardner-global-culture-officer-1030548103,neutral,0.9423235058784485
6/24/2021 5:00:00 PM,IPG Names Mat Baxter CEO of Huge,GlobeNewswire,/news/stocks/ipg-names-mat-baxter-ceo-of-huge-1030551978,neutral,0.9346286654472351
6/24/2021 9:40:00 PM,Commonwealth//McCann Recognized by General Motors as a 2020 Supplier of the Year Winner Once Again,PR Newswire,/news/stocks/commonwealth-mccann-recognized-by-general-motors-as-a-2020-supplier-of-the-year-winner-once-again-1030552767,positive,0.9419657588005066
6/25/2021 12:00:02 PM,Why big brands like Mercedes-Benz are spending way more on reaching baby boomers over Gen Z,Premium,/news/stocks/marketers-are-renewing-advertising-efforts-on-baby-boomers-2021-6,neutral,0.8769136071205139
6/30/2021 3:30:06 PM,"The advertising world has long lagged in diversity, but some agencies are trying to change that",Business Insider,https://www.businessinsider.com/advertising-lagged-in-diversity-but-some-agencies-are-changing-that-2021-6,neutral,0.6418293118476868
6/30/2021 9:03:02 PM,"Ad agencies are starting to call staff back to the office, and it could threaten their efforts to hire",Premium,/news/stocks/some-ad-agencies-are-planning-strict-return-to-office-policies-2021-6,negative,0.9528866410255432
7/1/2021 2:41:00 PM,Weber Shandwick & Clients Earn 36 Lions across 14 Categories at 2021 Cannes Lions International Festival of Creativity,PR Newswire,/news/stocks/weber-shandwick-clients-earn-36-lions-across-14-categories-at-2021-cannes-lions-international-festival-of-creativity-1030571532,neutral,0.4829618036746979
7/1/2021 3:00:00 PM,Interpublic Launches IPG Health,GlobeNewswire,/news/stocks/interpublic-launches-ipg-health-1030571638,neutral,0.9373486042022705
7/7/2021 5:00:00 PM,"IPG Launches Performance Art, a Data-Led Creative/CRM Agency",GlobeNewswire,/news/stocks/ipg-launches-performance-art-a-data-led-creative-crm-agency-1030586538,neutral,0.8796795010566711
7/7/2021 10:15:00 PM,Interpublic Schedules Second Quarter 2021 Earnings Release,GlobeNewswire,/news/stocks/interpublic-schedules-second-quarter-2021-earnings-release-1030587502,neutral,0.8672540783882141
7/8/2021 4:00:00 PM,McCann Worldgroup Launches Sustainability Department,PR Newswire,/news/stocks/mccann-worldgroup-launches-sustainability-department-1030590202,neutral,0.9095672965049744
7/13/2021 7:33:04 PM,"The 18 top execs at Weber Shandwick who are working on its biggest initiatives, helping the firm go beyond just public relations",Premium,/news/stocks/most-powerful-executives-at-pr-firm-weber-shandwick-2021-7,positive,0.6866589784622192
7/15/2021 2:33:02 PM,"Top ad industry salaries, revealed: How much the top companies including WPP and Wieden + Kennedy pay for jobs in analytics, brand management, and more",Premium,/news/stocks/salaries-biggest-ad-holding-companies-omnicom-wpp-ipg-publicis-dentsu-2020-8,neutral,0.9053598642349243
7/15/2021 2:45:02 PM,"Public relations companies are in a talent war, and they're dangling new perks to hire and retain as many employees as possible",Premium,/news/stocks/public-relations-firms-dangle-new-perks-in-talent-war-2021-7,neutral,0.5947815775871277
7/19/2021 3:01:28 PM,Here's what Wall Street expects from Interpublic Group of Cos's earnings,Markets Insider Automation,/news/stocks/interpublic_group_of_cos-stock-price-q2-earnings-preview-1030620271,neutral,0.9280763864517212
7/19/2021 5:47:00 PM,S4 Capital LUX Finance S.a r.l. -- Moody's assigns first-time Ba3 CFR to S4 Capital; outlook stable,Moodys,/news/bonds/s4-capital-lux-finance-s-a-r-l-moody-s-assigns-first-time-ba3-cfr-to-s4-capital-outlook-stable-1030621153,positive,0.5756298899650574
7/19/2021 5:53:00 PM,S4 Capital LUX Finance S.a r.l. -- Moody's assigns first-time Ba3 CFR to S4 Capital; outlook stable,Moodys,/news/bonds/s4-capital-lux-finance-s-a-r-l-moody-s-assigns-first-time-ba3-cfr-to-s4-capital-outlook-stable-1030621189,positive,0.5756298899650574
7/20/2021 1:15:26 PM,Notable earnings before Wednesday's open,Seeking Alpha,https://seekingalpha.com/news/3716864-notable-earnings-before-wednesdays-open?utm_source=markets.businessinsider.com&utm_medium=referral,positive,0.855887770652771
7/20/2021 2:00:00 PM,Imperial Mining to Webcast Live at VirtualInvestorConferences.com on July 29th,PR Newswire,/news/stocks/imperial-mining-to-webcast-live-at-virtualinvestorconferences-com-on-july-29th-1030624751,neutral,0.9492440223693848
7/20/2021 10:31:02 PM,"Ad execs are swapping swanky clubs for beer gardens to get client face time, and shared 10 go-to spots",Premium,/news/stocks/advertisers-name-their-go-to-spots-to-meet-clients-2021-7,neutral,0.9374306201934814
7/21/2021 11:04:02 AM,"Interpublic Group of Companies EPS beats by $0.27, beats on revenue",Seeking Alpha,https://seekingalpha.com/news/3717263-interpublic-group-of-companies-eps-beats-0_27-beats-on-revenue?utm_source=markets.businessinsider.com&utm_medium=referral,neutral,0.4881380796432495
7/21/2021 1:00:00 PM,Interpublic Announces Second Quarter and First Half 2021 Results,GlobeNewswire,/news/stocks/interpublic-announces-second-quarter-and-first-half-2021-results-1030629675,neutral,0.8711451888084412
7/21/2021 1:10:37 PM,Interpublic Group Of Companies Inc. Q2 adjusted earnings Beat Estimates,RTTNews,/news/stocks/interpublic-group-of-companies-inc-q2-adjusted-earnings-beat-estimates-1030629788,positive,0.7993694543838501
7/21/2021 2:02:24 PM,Interpublic Q2 Results Top Estimates - Quick Facts ,RTTNews,/news/stocks/interpublic-q2-results-top-estimates-quick-facts-1030629973,neutral,0.9051221609115601
7/21/2021 6:01:24 PM,38 Stocks Moving In Wednesday's Mid-Day Session,Benzinga,/news/stocks/38-stocks-moving-in-wednesday-s-mid-day-session-1030631371,neutral,0.49908971786499023
7/21/2021 6:27:53 PM,Midday Market Update: What Are the Top Performing Stocks Today?,InvestorPlace,/news/stocks/midday-market-update-what-are-the-top-performing-stocks-today-1030631783,neutral,0.7994041442871094
7/22/2021 11:01:46 AM,61 Biggest Movers From Yesterday,Benzinga,/news/stocks/61-biggest-movers-from-yesterday-1030633901,neutral,0.8035083413124084
7/22/2021 1:45:17 PM,10 Biggest Price Target Changes For Thursday,Benzinga,/news/stocks/10-biggest-price-target-changes-for-thursday-1030634637,neutral,0.7969076037406921
7/22/2021 4:10:57 PM,"Benzinga's Top Ratings Upgrades, Downgrades For July 22, 2021",Benzinga,/news/stocks/benzinga-s-top-ratings-upgrades-downgrades-for-july-22-2021-1030635589,negative,0.5673149228096008
7/26/2021 11:14:02 AM,Interpublic Group of Companies declares $0.27 dividend,Seeking Alpha,https://seekingalpha.com/news/3718888-interpublic-group-of-companies-inc-declares-0_27-dividend?utm_source=markets.businessinsider.com&utm_medium=referral,neutral,0.9014075994491577
7/26/2021 1:00:00 PM,Interpublic Declares Common Stock Dividend,GlobeNewswire,/news/stocks/interpublic-declares-common-stock-dividend-1030644130,neutral,0.939891517162323
7/27/2021 2:58:02 PM,Sir Martin Sorrell has been on a buying spree to build a digital challenger to ad giant WPP - these 13 top execs will be key to carrying out his strategy,Premium,/news/stocks/most-powerful-executives-at-martin-sorrells-s4-capital-advertising-firm-2021-7,neutral,0.5717527866363525
7/27/2021 7:55:35 PM,The CEO of ad giant IPG's Mediabrands explains why he's giving employees a week off this summer,Premium,/news/stocks/ipg-mediabrands-ceo-is-closing-us-offices-for-a-week-this-summer-2021-7,negative,0.852939784526825
7/27/2021 8:06:35 PM,How much top advertising agencies pay employees in the US,Business Insider,https://www.businessinsider.com/how-much-top-advertising-agencies-pay-salaries-wpp-omnicom-publicis-2021-7,neutral,0.8973714709281921
7/28/2021 10:44:00 PM,Weber Shandwick & United Minds Release Playbook for Navigating Return to Office as Next Phase of Pandemic Yields New Complexities,PR Newswire,/news/stocks/weber-shandwick-united-minds-release-playbook-for-navigating-return-to-office-as-next-phase-of-pandemic-yields-new-complexities-1030658610,neutral,0.8022973537445068
7/29/2021 5:31:00 PM,"MRM Boosts Commerce Practice Leadership, Appoints Ed Kim As EVP Of Total Commerce Experiences",PR Newswire,/news/stocks/mrm-boosts-commerce-practice-leadership-appoints-ed-kim-as-evp-of-total-commerce-experiences-1030663483,positive,0.6041693091392517
7/29/2021 8:25:00 PM,McCann Worldgroup Advances Three In Top Leadership Posts,PR Newswire,/news/stocks/mccann-worldgroup-advances-three-in-top-leadership-posts-1030664009,neutral,0.5916529297828674
8/3/2021 3:30:00 PM,58% of Global Executives Say Home Country is a Critical Stakeholder on Par with Customers and Shareholders,PR Newswire,/news/stocks/58-of-global-executives-say-home-country-is-a-critical-stakeholder-on-par-with-customers-and-shareholders-1030683925,positive,0.8020045757293701
8/3/2021 5:32:00 PM,MRM Named Midsize Agency Of The Year At Association Of National Advertisers B2 Awards,PR Newswire,/news/stocks/mrm-named-midsize-agency-of-the-year-at-association-of-national-advertisers-b2-awards-1030684592,positive,0.8464005589485168
8/3/2021 10:49:00 PM,MRM Named MediaPost Digital Automotive Agency Of The Year,PR Newswire,/news/stocks/mrm-named-mediapost-digital-automotive-agency-of-the-year-1030685728,positive,0.7997897863388062
8/5/2021 12:14:00 AM,MRM Named By Fast Company As One Of The 100 Best Places To Work For Innovators,PR Newswire,/news/stocks/mrm-named-by-fast-company-as-one-of-the-100-best-places-to-work-for-innovators-1030691844,positive,0.8583600521087646
8/5/2021 1:00:04 PM,"M&A in the ad industry surged in the first half of 2022, despite economic uncertainty. These 11 behind-the-scenes players from companies like Deloitte and Havas are driving the spree",Premium,/news/stocks/top-execs-leading-ad-industry-mergers-aquisitions-2021-8,positive,0.7545635104179382
8/6/2021 9:44:00 PM,H&R Block Selects Carmichael Lynch as Lead Brand Agency,PR Newswire,/news/stocks/h-r-block-selects-carmichael-lynch-as-lead-brand-agency-1030702485,neutral,0.8963895440101624
8/10/2021 10:30:19 AM,"Stop Thinking About Facebook as a Tech Stock, Because It’s Not",InvestorPlace,/news/stocks/stop-thinking-about-facebook-as-a-tech-stock-because-its-not-1030712522,neutral,0.933742880821228
8/17/2021 7:05:00 PM,GSK NEXT Launches The Re/Wire Health Studio With R/GA Ventures To Explore And Scale New Everyday Health Solutions,PR Newswire,/news/stocks/gsk-next-launches-the-re-wire-health-studio-with-r-ga-ventures-to-explore-and-scale-new-everyday-health-solutions-1030739492,neutral,0.801419198513031
8/18/2021 2:30:00 PM,Imperial Mining Mobilizes Exploration Crews to Commence Crater Lake Scandium-Rare-Earth Program,GlobeNewswire,/news/stocks/imperial-mining-mobilizes-exploration-crews-to-commence-crater-lake-scandium-rare-earth-program-1030741906,neutral,0.8621363043785095
8/25/2021 12:27:03 PM,7 of the Best Dividend Stocks to Buy for September,InvestorPlace,/news/stocks/7-of-the-best-dividend-stocks-to-buy-for-september-1030757606,neutral,0.7608606815338135
8/27/2021 12:00:07 PM,13 experts companies like Nike and T-Mobile rely on to solve their longstanding diversity problems,Premium,/news/stocks/13-top-dei-consultants-and-experts-helping-advertisers-with-diversity-2021-8,neutral,0.8759509325027466
9/2/2021 1:21:00 AM,"Interpublic Group of Companies, Inc. (The) -- Moody's announces completion of a periodic review of ratings of Interpublic Group of Companies, Inc. (The)",Moodys,/news/bonds/interpublic-group-of-companies-inc-the-moody-s-announces-completion-of-a-periodic-review-of-ratings-of-interpublic-group-of-companies-inc-the-1030774775,neutral,0.8395095467567444
9/8/2021 4:41:03 PM,13 top execs leading Sir Martin Sorrell's S4 Capital as it builds a digital challenger to advertising giant WPP,Premium,/news/stocks/most-powerful-executives-at-martin-sorrells-s4-capital-advertising-firm-2021-7,positive,0.5120272636413574
9/14/2021 1:58:35 AM,"Imperial Mining Announces Closing of a $819,000 Private Placement of Units",GlobeNewswire,/news/stocks/imperial-mining-announces-closing-of-a-819-000-private-placement-of-units-1030796910,neutral,0.8590389490127563
9/16/2021 2:30:00 PM,"Imperial Mining Announces Closing of a $527,500 Private Placement of Units",GlobeNewswire,/news/stocks/imperial-mining-announces-closing-of-a-527-500-private-placement-of-units-1030804518,neutral,0.8754462003707886
9/17/2021 10:30:00 PM,Interpublic Group to Present at the Goldman Sachs 30th Annual Communacopia Conference,GlobeNewswire,/news/stocks/interpublic-group-to-present-at-the-goldman-sachs-30th-annual-communacopia-conference-1030808009,neutral,0.9365482926368713
9/23/2021 1:14:44 PM,"Roku gains 3% as Guggenheim upgrades, company expands Canada ad business",Seeking Alpha,https://seekingalpha.com/news/3743472-roku-gains-3-as-guggenheim-upgrades-company-expands-canada-ad-business?utm_source=markets.businessinsider.com&utm_medium=referral,positive,0.947064220905304
9/23/2021 2:00:00 PM,Imperial Mining Receives Highly Encouraging NI 43-101 Resource Estimate for the TG Scandium-Rare-Earth Zone: Remains Open to Further Expansion,GlobeNewswire,/news/stocks/imperial-mining-receives-highly-encouraging-ni-43-101-resource-estimate-for-the-tg-scandium-rare-earth-zone-remains-open-to-further-expansion-1030818648,positive,0.8734573721885681
9/23/2021 4:00:00 PM,Weber Shandwick Launches Media Security Center to Address Emerging Information Threats,PR Newswire,/news/stocks/weber-shandwick-launches-media-security-center-to-address-emerging-information-threats-1030819257,neutral,0.8295387625694275
9/27/2021 1:30:36 PM,"The latest news about the public relations industry, from pay and hiring to growth areas",Business Insider,https://www.businessinsider.com/latest-news-on-public-relations-business-growth-hiring-compensation-2020-11,neutral,0.9201974272727966
