datetime,title,source,link,sentiment_class,sentiment_score
6/12/2018 12:04:00 AM,GODIVA Gears Up For Bold Business Growth By Appointing McCann And Hill+Knowlton Strategies As Global Agency Partners,PR Newswire,/news/stocks/godiva-gears-up-for-bold-business-growth-by-appointing-mccann-and-hill-knowlton-strategies-as-global-agency-partners-1026847899,positive,0.8204315304756165
6/12/2018 12:16:00 AM,GODIVA Gears Up For Bold Business Growth By Appointing McCann And Hill+Knowlton Strategies As Global Agency Partners,PR Newswire,/news/stocks/godiva-gears-up-for-bold-business-growth-by-appointing-mccann-and-hill-knowlton-strategies-as-global-agency-partners-1026848100,positive,0.8204315304756165
6/13/2018 3:25:00 PM,"93 Percent of Americans Agree the U.S. Has a Civility Problem, Yet 92 Percent of Employed Americans Report Their Workplace is Civil",PR Newswire,/news/stocks/93-percent-of-americans-agree-the-u-s-has-a-civility-problem-yet-92-percent-of-employed-americans-report-their-workplace-is-civil-1026929602,negative,0.9263033866882324
6/19/2018 6:40:00 AM,"FCB Health Named ""Healthcare Network of the Year"" at 2018 Cannes Lions Health Festival",PR Newswire,/news/stocks/fcb-health-named-healthcare-network-of-the-year-at-2018-cannes-lions-health-festival-1027186773,positive,0.7627123594284058
6/19/2018 7:16:00 PM,The National Center for Learning Disabilities Selects Carmichael Lynch Relate To Lead Public Relations Efforts,PR Newswire,/news/stocks/the-national-center-for-learning-disabilities-selects-carmichael-lynch-relate-to-lead-public-relations-efforts-1027209572,neutral,0.8786046504974365
6/27/2018 2:30:00 PM,"Imperial Mining Updates on Phase I Metallurgical Test Results for the Crater Lake Scandium Project, Quebec",GlobeNewswire,/news/stocks/imperial-mining-updates-on-phase-i-metallurgical-test-results-for-the-crater-lake-scandium-project-quebec-1027322391,neutral,0.9212555885314941
7/3/2018 2:41:19 AM,Acxiom To Sell Acxiom Marketing Solutions To Interpublic Group For $2.3 Bln ,RTTNews,/news/stocks/acxiom-to-sell-acxiom-marketing-solutions-to-interpublic-group-for-2-3-bln-1027336711,neutral,0.9290407299995422
7/3/2018 2:51:07 AM,"Ad holding company IPG plans to buy Acxiom's data-marketing division for $2.3 billion (IPG, ACXM)",Business Insider,http://www.businessinsider.com/ad-agency-ipg-to-pay-23-billion-for-acxioms-data-marketing-division-2018-7,neutral,0.9028878211975098
7/3/2018 8:30:00 PM,"Interpublic Group of Companies, Inc. (The) -- Moody's places IPG's ratings on review for downgrade following announcement to acquire Acxiom's Marketing Solutions business",Moodys,/news/bonds/interpublic-group-of-companies-inc-the-moody-s-places-ipg-s-ratings-on-review-for-downgrade-following-announcement-to-acquire-acxiom-s-marketing-solutions-business-1027339836,negative,0.8542753458023071
7/22/2018 3:01:31 PM,Here's what Wall Street expects from Interpublic Group of Cos's earnings report,Markets Insider Automation,/news/stocks/interpublic_group_of_cos-stock-price-quarter-earnings-preview-q2-1027387762,neutral,0.9006606936454773
7/24/2018 3:54:58 PM,Interpublic Group Q2 Profit Increases ,RTTNews,/news/stocks/interpublic-group-q2-profit-increases-1027394835,negative,0.585120677947998
7/30/2018 2:30:00 PM,Imperial Mining Announces Closing of First Tranche of Private Placement with Quebec Institutional Funds,GlobeNewswire,/news/stocks/imperial-mining-announces-closing-of-first-tranche-of-private-placement-with-quebec-institutional-funds-1027412344,neutral,0.7552807927131653
8/8/2018 2:30:00 PM,"Imperial Mining Commences Exploration on its Opawica Gold Project, Northwestern Quebec",GlobeNewswire,/news/stocks/imperial-mining-commences-exploration-on-its-opawica-gold-project-northwestern-quebec-1027442469,neutral,0.9167034029960632
8/15/2018 2:30:00 PM,"Imperial Mining Crews Mobilize to Evaluate High-Grade Scandium Targets, Crater Lake Project, Northeastern Quebec",GlobeNewswire,/news/stocks/imperial-mining-crews-mobilize-to-evaluate-high-grade-scandium-targets-crater-lake-project-northeastern-quebec-1027460793,neutral,0.884591817855835
9/17/2018 4:01:00 PM,"Interpublic Group of Companies, Inc. (The) -- Moody's confirms IPG's Baa2 senior unsecured and Prime-2 short-term ratings; outlook now stable",Moodys,/news/bonds/interpublic-group-of-companies-inc-the-moody-s-confirms-ipg-s-baa2-senior-unsecured-and-prime-2-short-term-ratings-outlook-now-stable-1027540133,positive,0.9171797037124634
9/18/2018 3:53:00 PM,"Interpublic Group of Companies, Inc. (The) -- Moody's rates IPG's new senior unsecured notes Baa2; outlook stable",Moodys,/news/bonds/interpublic-group-of-companies-inc-the-moody-s-rates-ipg-s-new-senior-unsecured-notes-baa2-outlook-stable-1027544145,positive,0.7893100380897522
10/11/2018 3:00:00 PM,Imperial Mining Announces Closing of Second Tranche of Private Placement,GlobeNewswire,/news/stocks/imperial-mining-announces-closing-of-second-tranche-of-private-placement-1027609042,neutral,0.6681941151618958
10/17/2018 3:01:26 PM,Here's what Wall Street expects from Interpublic Group of Cos's earnings report,Markets Insider Automation,/news/stocks/interpublic_group_of_cos-stock-quarter-earnings-preview-q3-1027625548,neutral,0.9006606936454773
10/30/2018 1:30:00 PM,"Imperial Mining Samples up to 2,506 g/t Scandium Oxide From its Crater Lake Project, Northeastern Quebec",GlobeNewswire,/news/stocks/imperial-mining-samples-up-to-2-506-g-t-scandium-oxide-from-its-crater-lake-project-northeastern-quebec-1027670869,neutral,0.5984635949134827
11/7/2018 1:13:00 AM,Publicis Groupe S.A. -- Moody's affirms Publicis' Baa2 ratings; outlook stable,Moodys,/news/bonds/publicis-groupe-s-a-moody-s-affirms-publicis-baa2-ratings-outlook-stable-1027699110,positive,0.8374426960945129
11/7/2018 2:30:00 PM,"Imperial Mining Geophysics Confirms Westward Continuation of the Central Gold Zone Structure, Opawica Project, Northwestern Québec",GlobeNewswire,/news/stocks/imperial-mining-geophysics-confirms-westward-continuation-of-the-central-gold-zone-structure-opawica-project-northwestern-québec-1027702077,neutral,0.8675553798675537
11/8/2018 9:39:00 AM,Publicis Groupe S.A. -- Moody's affirms Publicis' Baa2 ratings; outlook stable,Moodys,/news/bonds/publicis-groupe-s-a-moody-s-affirms-publicis-baa2-ratings-outlook-stable-1027705657,positive,0.8374426960945129
11/9/2018 10:15:00 PM,"Interpublic Group to Present at the 2018 RBC Capital Markets Technology, Internet, Media and Telecommunications Conference",GlobeNewswire,/news/stocks/interpublic-group-to-present-at-the-2018-rbc-capital-markets-technology-internet-media-and-telecommunications-conference-1027712843,neutral,0.9336490631103516
11/13/2018 3:00:00 PM,Imperial Mining Ramps up Scandium Strategic Marketing Activities at the European Union and in Germany,GlobeNewswire,/news/stocks/imperial-mining-ramps-up-scandium-strategic-marketing-activities-at-the-european-union-and-in-germany-1027720934,neutral,0.5490034222602844
11/13/2018 10:15:00 PM,Interpublic Declares Common Stock Dividend,GlobeNewswire,/news/stocks/interpublic-declares-common-stock-dividend-1027722776,neutral,0.939891517162323
11/23/2018 10:00:00 PM,Imperial Mining Announces Final Closing of Private Placement,GlobeNewswire,/news/stocks/imperial-mining-announces-final-closing-of-private-placement-1027752365,neutral,0.8998702168464661
12/7/2018 3:30:00 PM,"IPG to Host National Day of Understanding Focused on Issues of  Race, Ethnicity and Inclusion",GlobeNewswire,/news/stocks/ipg-to-host-national-day-of-understanding-focused-on-issues-of-race-ethnicity-and-inclusion-1027790672,neutral,0.839237630367279
12/20/2018 10:43:22 PM,Imperial Mining Announces First Tranche Closing of Private Placement,GlobeNewswire,/news/stocks/imperial-mining-announces-first-tranche-closing-of-private-placement-1027827084,neutral,0.8969516158103943
1/4/2019 10:46:32 PM,Interpublic Group to Present at the Citi 2019 Global TMT West Conference,GlobeNewswire,/news/stocks/interpublic-group-to-present-at-the-citi-2019-global-tmt-west-conference-1027845300,neutral,0.9246954917907715
1/16/2019 4:20:16 PM,"Imperial Mining and SOQUEM Commence $1.0 million Diamond Drilling Program at the Carheil Copper-Zinc Project, Quebec",GlobeNewswire,/news/stocks/imperial-mining-and-soquem-commence-1-0-million-diamond-drilling-program-at-the-carheil-copper-zinc-project-quebec-1027873509,positive,0.5728073716163635
1/17/2019 10:15:00 PM,Interpublic Schedules Fourth Quarter and Full Year 2018 Earnings Release,GlobeNewswire,/news/stocks/interpublic-schedules-fourth-quarter-and-full-year-2018-earnings-release-1027877948,neutral,0.9264703392982483
2/5/2019 3:30:00 PM,"Imperial Mining to Present on the Crater Lake Scandium Project in Stuttgart, Germany and PDAC 2019",GlobeNewswire,/news/stocks/imperial-mining-to-present-on-the-crater-lake-scandium-project-in-stuttgart-germany-and-pdac-2019-1027925983,neutral,0.9132184386253357
2/11/2019 3:02:34 PM,Interpublic Group of Cos is about to announce earnings — here's what Wall Street expects,Markets Insider Automation,/news/stocks/interpublic_group_of_cos-stock-price-quarter-earnings-preview-q4-1027941104,neutral,0.9312020540237427
2/13/2019 1:00:00 PM,Interpublic Announces Full Year and Fourth Quarter 2018 Results,GlobeNewswire,/news/stocks/interpublic-announces-full-year-and-fourth-quarter-2018-results-1027948825,neutral,0.9143620729446411
2/13/2019 1:15:00 PM,Interpublic Increases Common Stock Dividend by 12%,GlobeNewswire,/news/stocks/interpublic-increases-common-stock-dividend-by-12-1027948980,positive,0.8890756964683533
2/13/2019 1:26:40 PM,Interpublic Group Of Companies Inc. Q4 adjusted earnings Beat Estimates,RTTNews,/news/stocks/interpublic-group-of-companies-inc-q4-adjusted-earnings-beat-estimates-1027948963,positive,0.8336459398269653
2/13/2019 1:46:49 PM,Interpublic Group Declares 12% Higher Quarterly Dividend - Quick Facts ,RTTNews,/news/stocks/interpublic-group-declares-12-higher-quarterly-dividend-quick-facts-1027949052,positive,0.9465287327766418
2/21/2019 11:00:00 PM,"Interpublic Group to Present at the 2019 Morgan Stanley Technology, Media & Telecom Conference",GlobeNewswire,/news/stocks/interpublic-group-to-present-at-the-2019-morgan-stanley-technology-media-telecom-conference-1027973880,neutral,0.9223425984382629
3/4/2019 2:30:00 PM,"Imperial Mining Commences Crater Lake Scandium Project Drilling Program, Northeastern Québec",GlobeNewswire,/news/stocks/imperial-mining-commences-crater-lake-scandium-project-drilling-program-northeastern-québec-1028001077,neutral,0.9158691763877869
3/7/2019 11:00:00 PM,"Interpublic Group to Present at the Deutsche Bank 27th Annual Media, Internet & Telecom Conference",GlobeNewswire,/news/stocks/interpublic-group-to-present-at-the-deutsche-bank-27th-annual-media-internet-telecom-conference-1028014043,neutral,0.924933135509491
3/14/2019 6:29:00 PM,WPP Finance Deutschland GmbH -- Moody's affirms WPP's Baa2 ratings; outlook remains negative,Moodys,/news/bonds/wpp-finance-deutschland-gmbh-moody-s-affirms-wpp-s-baa2-ratings-outlook-remains-negative-1028031811,neutral,0.5407571792602539
3/14/2019 6:36:00 PM,WPP Plc -- Moody's affirms WPP's Baa2 ratings; outlook remains negative,Moodys,/news/bonds/wpp-plc-moody-s-affirms-wpp-s-baa2-ratings-outlook-remains-negative-1028031818,neutral,0.5866459608078003
3/28/2019 2:14:37 PM,Interpublic Receives Perfect Score on 2019 HRC Corporate Equality Index,GlobeNewswire,/news/stocks/interpublic-receives-perfect-score-on-2019-hrc-corporate-equality-index-1028067079,positive,0.938024640083313
4/3/2019 10:30:00 PM,Interpublic Schedules First Quarter 2019 Earnings Release,GlobeNewswire,/news/stocks/interpublic-schedules-first-quarter-2019-earnings-release-1028084039,neutral,0.8764005303382874
4/4/2019 4:42:29 PM,Interpublic Named a Top Company to Work for by LinkedIn,GlobeNewswire,/news/stocks/interpublic-named-a-top-company-to-work-for-by-linkedin-1028086823,positive,0.5268555879592896
4/4/2019 6:00:00 PM,IPG Merges Two Award-Winning Brand and Technology PR Agencies,GlobeNewswire,/news/stocks/ipg-merges-two-award-winning-brand-and-technology-pr-agencies-1028087041,neutral,0.5634382367134094
4/16/2019 6:29:36 PM,IPG Agency Brands and People Dominate the Ad Age A-List Awards,GlobeNewswire,/news/stocks/ipg-agency-brands-and-people-dominate-the-ad-age-a-list-awards-1028115797,neutral,0.9471240043640137
4/24/2019 3:02:35 PM,What Wall Street expects from Interpublic Group of Cos's earnings,Markets Insider Automation,/news/stocks/interpublic_group_of_cos-quarter-earnings-preview-q1-1028134502,neutral,0.9265358448028564
4/26/2019 1:00:00 PM,Interpublic Announces First Quarter 2019 Results,GlobeNewswire,/news/stocks/interpublic-announces-first-quarter-2019-results-1028142388,neutral,0.9029552936553955
4/26/2019 1:30:15 PM,Interpublic Group Q1 Results Beat View; Affirms FY19 Outlook - Quick Facts ,RTTNews,/news/stocks/interpublic-group-q1-results-beat-view-affirms-fy19-outlook-quick-facts-1028142494,positive,0.48957183957099915
5/10/2019 10:15:00 PM,"Interpublic Group to Present at the 47th Annual J.P. Morgan Global Technology, Media & Communications Conference",GlobeNewswire,/news/stocks/interpublic-group-to-present-at-the-47th-annual-j-p-morgan-global-technology-media-communications-conference-1028191232,neutral,0.8949487805366516
5/21/2019 7:57:44 PM,IPG Names Pete Stein Global CEO of Huge,GlobeNewswire,/news/stocks/ipg-names-pete-stein-global-ceo-of-huge-1028219250,neutral,0.9377872347831726
5/22/2019 2:30:00 PM,Initial 2019 Crater Lake Drilling Results Indicate Encouraging Scandium and Rare Earth Grades Over Significant Widths,GlobeNewswire,/news/stocks/initial-2019-crater-lake-drilling-results-indicate-encouraging-scandium-and-rare-earth-grades-over-significant-widths-1028221739,positive,0.9516386389732361
5/23/2019 10:15:00 PM,Interpublic Declares Common Stock Dividend,GlobeNewswire,/news/stocks/interpublic-declares-common-stock-dividend-1028227437,neutral,0.939891517162323
5/31/2019 8:14:48 PM,IPG Named the Most Creatively Effective Holding Company at U.S. Effie Awards,GlobeNewswire,/news/stocks/ipg-named-the-most-creatively-effective-holding-company-at-u-s-effie-awards-1028245843,positive,0.9158526062965393
5/31/2019 10:15:00 PM,Interpublic Group to Present at the Credit Suisse 21st Annual Communications Conference,GlobeNewswire,/news/stocks/interpublic-group-to-present-at-the-credit-suisse-21st-annual-communications-conference-1028246036,neutral,0.9354391694068909
6/10/2019 4:28:24 PM,IPG Named to S&P 500 ESG and S&P Global 1200 ESG,GlobeNewswire,/news/stocks/ipg-named-to-s-p-500-esg-and-s-p-global-1200-esg-1028266944,neutral,0.9147378206253052
6/11/2019 10:15:00 PM,Interpublic Group Announces CFO Transition,GlobeNewswire,/news/stocks/interpublic-group-announces-cfo-transition-1028271488,neutral,0.8252193331718445
6/18/2019 2:30:00 PM,Imperial Intersects 113.9 m and 95.5 m of Strong Scandium and Rare Earth Mineralization at Crater Lake,GlobeNewswire,/news/stocks/imperial-intersects-113-9-m-and-95-5-m-of-strong-scandium-and-rare-earth-mineralization-at-crater-lake-1028287616,positive,0.8046389222145081
6/19/2019 12:09:54 PM,IPG Hosts Ninth Annual Global Breakfast at Cannes Festival of Creativity,GlobeNewswire,/news/stocks/ipg-hosts-ninth-annual-global-breakfast-at-cannes-festival-of-creativity-1028290768,neutral,0.9188584685325623
6/26/2019 4:11:23 PM,"IPG Outperforms the Industry, Winning 11 Grand Prix at the Cannes Lions International Festival of Creativity",GlobeNewswire,/news/stocks/ipg-outperforms-the-industry-winning-11-grand-prix-at-the-cannes-lions-international-festival-of-creativity-1028310485,positive,0.941652238368988
7/8/2019 10:15:00 PM,Interpublic Schedules Second Quarter 2019 Earnings Release,GlobeNewswire,/news/stocks/interpublic-schedules-second-quarter-2019-earnings-release-1028336340,neutral,0.8575966954231262
7/9/2019 1:05:35 PM,"3 Big Stock Charts for Tuesday: Eli Lilly, SYSCO and Interpublic Group",InvestorPlace,/news/stocks/3-big-stock-charts-for-tuesday-eli-lilly-sysco-and-interpublic-group-1028340756,neutral,0.9173672795295715
7/17/2019 8:05:00 PM,Interpublic Names Andy Polansky Chairman & CEO of Constituency Management Group (CMG),GlobeNewswire,/news/stocks/interpublic-names-andy-polansky-chairman-ceo-of-constituency-management-group-cmg-1028362074,neutral,0.9462352395057678
7/21/2019 3:01:26 PM,Here's what to expect from Interpublic Group of Cos's earnings report,Markets Insider Automation,/news/stocks/interpublic_group_of_cos-stock-q2-earnings-preview-1028369653,neutral,0.9264686107635498
7/23/2019 1:00:00 PM,Interpublic Announces Second Quarter and First Half 2019 Results,GlobeNewswire,/news/stocks/interpublic-announces-second-quarter-and-first-half-2019-results-1028375407,neutral,0.899847149848938
7/23/2019 1:23:30 PM,Interpublic Group Of Companies Inc. Q2 adjusted earnings Beat Estimates,RTTNews,/news/stocks/interpublic-group-of-companies-inc-q2-adjusted-earnings-beat-estimates-1028375538,positive,0.7993694543838501
7/23/2019 2:30:00 PM,"Imperial Mobilizes Crews to Resume Exploration on the Opawica Gold Project, Quebec",GlobeNewswire,/news/stocks/imperial-mobilizes-crews-to-resume-exploration-on-the-opawica-gold-project-quebec-1028375943,positive,0.7868555784225464
7/30/2019 2:30:00 PM,Imperial Mining Provides Update on Development Plans for the Crater Lake Scandium Project,GlobeNewswire,/news/stocks/imperial-mining-provides-update-on-development-plans-for-the-crater-lake-scandium-project-1028398368,neutral,0.9368150234222412
8/1/2019 4:00:00 PM,IPG’s 2019 Inclusion Awards Reflect Focus on Results,GlobeNewswire,/news/stocks/ipg-s-2019-inclusion-awards-reflect-focus-on-results-1028408722,neutral,0.7979793548583984
8/14/2019 10:15:00 PM,Interpublic Declares Common Stock Dividend,GlobeNewswire,/news/stocks/interpublic-declares-common-stock-dividend-1028447415,neutral,0.939891517162323
9/9/2019 2:00:00 PM,Interpublic Group Announces Series of Executive Changes,GlobeNewswire,/news/stocks/interpublic-group-announces-series-of-executive-changes-1028508555,neutral,0.5539507269859314
9/10/2019 10:39:08 PM,"Amazon's new ad measurement tool, Comcast Ventures pitches for DTC brands, and The 3% Movement targets tech companies",Business Insider,https://www.businessinsider.com/what-you-need-to-know-in-advertising-and-media-2019-9,neutral,0.9064355492591858
9/11/2019 2:30:00 PM,Imperial Mining Announces Closing of $1.11 Million Private Placement,GlobeNewswire,/news/stocks/imperial-mining-announces-closing-of-1-11-million-private-placement-1028516186,neutral,0.8795483708381653
9/12/2019 10:15:00 PM,Interpublic Group to Present at the Goldman Sachs 28th Annual Communacopia Conference,GlobeNewswire,/news/stocks/interpublic-group-to-present-at-the-goldman-sachs-28th-annual-communacopia-conference-1028521664,neutral,0.9338343739509583
9/19/2019 2:30:00 PM,Imperial Retains CHF Capital Markets to Provide Investor Relations Services,GlobeNewswire,/news/stocks/imperial-retains-chf-capital-markets-to-provide-investor-relations-services-1028537577,neutral,0.8949868679046631
9/23/2019 10:15:00 PM,IPG Named to FTSE4Good Index,GlobeNewswire,/news/stocks/ipg-named-to-ftse4good-index-1028546106,neutral,0.9030318856239319
10/1/2019 2:30:00 PM,Imperial Engages M.Plan International To Carry Out Phase 2 Crater Lake Scandium Metallurgical Test Work,GlobeNewswire,/news/stocks/imperial-engages-m-plan-international-to-carry-out-phase-2-crater-lake-scandium-metallurgical-test-work-1028566851,neutral,0.9205055236816406
10/2/2019 10:00:00 PM,Deutsch NA CEO Mike Sheldon to Depart After 22 Year Tenure at Agency,GlobeNewswire,/news/stocks/deutsch-na-ceo-mike-sheldon-to-depart-after-22-year-tenure-at-agency-1028572369,negative,0.5942439436912537
10/4/2019 10:15:00 PM,Interpublic Schedules Third Quarter 2019 Earnings Release,GlobeNewswire,/news/stocks/interpublic-schedules-third-quarter-2019-earnings-release-1028578004,neutral,0.8563501238822937
10/7/2019 4:04:59 PM," IPG Launches Kinesso, a Marketing Intelligence Engine Powered by Acxiom®",GlobeNewswire,/news/stocks/ipg-launches-kinesso-a-marketing-intelligence-engine-powered-by-acxiom-1028580497,neutral,0.8648228049278259
10/9/2019 2:30:00 PM,"Imperial Mining Commences Detailed Geophysical Surveys, Reports on Summer Work at Opawica Gold Property, Quebec",GlobeNewswire,/news/stocks/imperial-mining-commences-detailed-geophysical-surveys-reports-on-summer-work-at-opawica-gold-property-quebec-1028586810,neutral,0.9353734850883484
10/10/2019 11:13:25 AM,"3 Big Stock Charts for Thursday: Boston Scientific, AES and IPG",InvestorPlace,/news/stocks/3-big-stock-charts-for-thursday-boston-scientific-aes-and-ipg-1028592289,neutral,0.9292068481445312
10/15/2019 5:00:00 PM,Linda Sanford Joins Interpublic Board of Directors,GlobeNewswire,/news/stocks/linda-sanford-joins-interpublic-board-of-directors-1028600427,neutral,0.8748725652694702
10/22/2019 6:30:00 AM,"Interpublic Group of Cos., Inc. to Host Earnings Call",Accesswire,/news/stocks/interpublic-group-of-cos-inc-to-host-earnings-call-1028618571,neutral,0.9457472562789917
10/22/2019 1:00:05 PM,Interpublic Announces Third Quarter and First Nine Months 2019 Results,GlobeNewswire,/news/stocks/interpublic-announces-third-quarter-and-first-nine-months-2019-results-1028618150,neutral,0.932102382183075
11/11/2019 9:33:00 PM,"Interpublic Group of Companies, Inc. (The) -- Moody's announces completion of a periodic review of ratings of The Interpublic Group of Companies, Inc.",Moodys,/news/bonds/interpublic-group-of-companies-inc-the-moody-s-announces-completion-of-a-periodic-review-of-ratings-of-the-interpublic-group-of-companies-inc-1028678280,neutral,0.8466035723686218
11/19/2019 10:15:00 PM,Interpublic Declares Common Stock Dividend,GlobeNewswire,/news/stocks/interpublic-declares-common-stock-dividend-1028701991,neutral,0.939891517162323
11/22/2019 8:17:25 PM,IPG Team Selected as Global Marketing Agency for LATAM Airlines,GlobeNewswire,/news/stocks/ipg-team-selected-as-global-marketing-agency-for-latam-airlines-1028712296,neutral,0.6865671277046204
12/5/2019 10:15:00 PM,Interpublic Group to Present at the UBS Global TMT Conference,GlobeNewswire,/news/stocks/interpublic-group-to-present-at-the-ubs-global-tmt-conference-1028742555,neutral,0.9425432085990906
12/6/2019 3:45:47 PM,IPG Ranked One of the Best Managed Companies in 2019,GlobeNewswire,/news/stocks/ipg-ranked-one-of-the-best-managed-companies-in-2019-1028744330,positive,0.8866134285926819
12/13/2019 6:15:08 PM,IPG Sponsors New Study on Being Black in Corporate America,GlobeNewswire,/news/stocks/ipg-sponsors-new-study-on-being-black-in-corporate-america-1028762957,neutral,0.8385258316993713
1/2/2020 10:15:00 PM,Interpublic Group to Present at the Citi 2020 Global TMT West Conference,GlobeNewswire,/news/stocks/interpublic-group-to-present-at-the-citi-2020-global-tmt-west-conference-1028792239,neutral,0.9210016131401062
1/7/2020 2:30:00 PM,"Imperial Mining Completes Project Planning for a Winter 2020 Diamond Drilling Program, Opawica Gold Property, Quebec",GlobeNewswire,/news/stocks/imperial-mining-completes-project-planning-for-a-winter-2020-diamond-drilling-program-opawica-gold-property-quebec-1028799376,neutral,0.8210098147392273
1/13/2020 10:15:00 PM,Interpublic Schedules Fourth Quarter and Full Year 2019 Earnings Release,GlobeNewswire,/news/stocks/interpublic-schedules-fourth-quarter-and-full-year-2019-earnings-release-1028813978,neutral,0.9116911292076111
1/14/2020 2:30:00 PM,"Imperial Mining and SOQUEM Commence $1 million Geophysical and Diamond Drilling Program at the Carheil Copper-Zinc Project, Quebec",GlobeNewswire,/news/stocks/imperial-mining-and-soquem-commence-1-million-geophysical-and-diamond-drilling-program-at-the-carheil-copper-zinc-project-quebec-1028815862,positive,0.5691462755203247
1/21/2020 5:12:33 PM,IPG Receives Two ESG Honors,GlobeNewswire,/news/stocks/ipg-receives-two-esg-honors-1028833061,neutral,0.9495795965194702
1/22/2020 10:00:00 PM,IPG Women Lead Honorees at the Campaign US Female Frontier Awards,GlobeNewswire,/news/stocks/ipg-women-lead-honorees-at-the-campaign-us-female-frontier-awards-1028837347,neutral,0.8453642725944519
1/30/2020 8:00:28 PM,IPG Agencies and People Sweep the Campaign U.S. Agency of the Year Awards,GlobeNewswire,/news/stocks/ipg-agencies-and-people-sweep-the-campaign-u-s-agency-of-the-year-awards-1028861199,neutral,0.8545553088188171
2/11/2020 3:02:13 PM,Here's what Wall Street expects from Interpublic Group of Cos's earnings report,Markets Insider Automation,/news/stocks/interpublic_group_of_cos-q4-earnings-preview-1028893509,neutral,0.9006606936454773
2/12/2020 1:00:00 PM,IPG Announces Full Year and Fourth Quarter 2019 Results,GlobeNewswire,/news/stocks/ipg-announces-full-year-and-fourth-quarter-2019-results-1028897710,neutral,0.9073988795280457
2/12/2020 1:15:00 PM,Interpublic Increases Common Stock Dividend for Eighth Consecutive Year,GlobeNewswire,/news/stocks/interpublic-increases-common-stock-dividend-for-eighth-consecutive-year-1028897900,positive,0.8125442266464233
2/12/2020 1:31:22 PM,Interpublic Group Of Companies Inc. Q4 adjusted earnings Beat Estimates,RTTNews,/news/stocks/interpublic-group-of-companies-inc-q4-adjusted-earnings-beat-estimates-1028897903,positive,0.8336459398269653
2/12/2020 1:44:05 PM,Interpublic Group Of Companies Hikes Quarterly Dividend By 9% - Quick Facts ,RTTNews,/news/stocks/interpublic-group-of-companies-hikes-quarterly-dividend-by-9-quick-facts-1028897940,negative,0.49689632654190063
2/27/2020 10:15:00 PM,"Interpublic Group to Present at the 2020 Morgan Stanley Technology, Media and Telecom Conference",GlobeNewswire,/news/stocks/interpublic-group-to-present-at-the-2020-morgan-stanley-technology-media-and-telecom-conference-1028947809,neutral,0.9152254462242126
