datetime,title,source,link,sentiment_class,sentiment_score
7/12/2022 6:00:00 PM,"Not Surprised, Not Delighted: Only a Third of Customers are Happy with their Brand Relationships",PR Newswire,/news/stocks/not-surprised-not-delighted-only-a-third-of-customers-are-happy-with-their-brand-relationships-1031581937,positive,0.5802944302558899
7/19/2022 2:00:00 PM,"REI Path Ahead Ventures launches Navigate accelerator program, announces inaugural cohort",PR Newswire,/news/stocks/rei-path-ahead-ventures-launches-navigate-accelerator-program-announces-inaugural-cohort-1031596898,neutral,0.7890225648880005
7/20/2022 11:32:36 AM,Today’s Biggest Pre-Market Stock Movers: 10 Top Gainers and Losers on Wednesday,InvestorPlace,/news/stocks/todays-biggest-pre-market-stock-movers-10-top-gainers-and-losers-on-wednesday-july-20-1031600631,negative,0.5243479013442993
7/20/2022 3:01:13 PM,What Wall Street expects from Interpublic Group of Cos's earnings,Markets Insider Automation,/news/stocks/interpublic_group_of_cos-stock-quarter-earnings-preview-q2-1031601124,neutral,0.9265358448028564
7/20/2022 3:08:39 PM,Notable earnings before Thursday's open,Seeking Alpha,https://seekingalpha.com/news/3858592-notable-earnings-before-thursdays-open?utm_source=businessinsider&utm_medium=referral,positive,0.8825733065605164
7/21/2022 11:08:16 AM,"Interpublic Group of Companies Non-GAAP EPS of $0.63 beats by $0.05, revenue of $2.38B beats by $50M",Seeking Alpha,https://seekingalpha.com/news/3858969-interpublic-group-of-companies-non-gaap-eps-of-0_63-beats-0_05-revenue-of-2_38b-beats-50m?utm_source=businessinsider&utm_medium=referral,neutral,0.5358499884605408
7/21/2022 1:00:00 PM,Interpublic Announces Second Quarter and First Half 2022 Results,GlobeNewswire,/news/stocks/interpublic-announces-second-quarter-and-first-half-2022-results-1031604185,neutral,0.9248889684677124
7/21/2022 1:37:52 PM,"Interpublic Group Of Companies Inc. Q2 Profit Decreases, but beats estimates",RTTNews,/news/stocks/interpublic-group-of-companies-inc-q2-profit-decreases-but-beats-estimates-1031604322,negative,0.9669044613838196
7/21/2022 1:46:51 PM,Interpublic Group Of Companies Inc. Reports Retreat In Q2 Profit,RTTNews,/news/stocks/interpublic-group-of-companies-inc-reports-retreat-in-q2-profit-1031604353,negative,0.9615834951400757
7/21/2022 3:00:00 PM,  Key Leaders Elevated to CEO Roles at McCann Worldgroup and IPG Mediabrands,GlobeNewswire,/news/stocks/key-leaders-elevated-to-ceo-roles-at-mccann-worldgroup-and-ipg-mediabrands-1031604850,neutral,0.9025884866714478
7/28/2022 10:30:00 PM,Interpublic Declares Common Stock Dividend,GlobeNewswire,/news/stocks/interpublic-declares-common-stock-dividend-1031627396,neutral,0.939891517162323
7/29/2022 12:55:11 AM,Imperial Mining Files Preliminary Economic Assessment Technical Report for The Crater Lake Project On SEDAR,GlobeNewswire,/news/stocks/imperial-mining-files-preliminary-economic-assessment-technical-report-for-the-crater-lake-project-on-sedar-1031627782,neutral,0.9152888059616089
8/10/2022 4:41:04 PM,Imperial Mining Announces Grant of Options,GlobeNewswire,/news/stocks/imperial-mining-announces-grant-of-options-1031671337,neutral,0.8887171149253845
8/29/2022 5:23:11 PM,Imperial Mining Announces its Intent to Extend the Expiry Date of Warrants,GlobeNewswire,/news/stocks/imperial-mining-announces-its-intent-to-extend-the-expiry-date-of-warrants-1031711352,neutral,0.9094095230102539
8/30/2022 5:17:03 PM,Interpublic Group of Companies goes ex-dividend tomorrow,Seeking Alpha,https://seekingalpha.com/news/3877956-interpublic-group-of-companies-goes-ex-dividend-tomorrow?utm_source=businessinsider&utm_medium=referral,neutral,0.5622990727424622
9/7/2022 8:33:00 PM,"Billie Jean King Enterprises, Elysian Park Ventures, the Los Angeles Dodgers, and R/GA Ventures Introduce the First Cohort of the Trailblazer Venture Studio, the World's First Studio Focused on Wo...",PR Newswire,/news/stocks/billie-jean-king-enterprises-elysian-park-ventures-the-los-angeles-dodgers-and-r-ga-ventures-introduce-the-first-cohort-of-the-trailblazer-venture-studio-the-world-s-first-studio-focused-on-wo-1031730232,neutral,0.8202129602432251
9/9/2022 10:30:00 PM,Interpublic Group to Present at the Goldman Sachs Communacopia + Technology Conference,GlobeNewswire,/news/stocks/interpublic-group-to-present-at-the-goldman-sachs-communacopia-technology-conference-1031735486,neutral,0.92389976978302
9/29/2022 3:00:00 PM,JACK MORTON APPOINTS FIRST GLOBAL CO-PRESIDENTS AS CEO TRANSITIONS TO CHAIRMAN,PR Newswire,/news/stocks/jack-morton-appoints-first-global-co-presidents-as-ceo-transitions-to-chairman-1031772968,neutral,0.9316497445106506
10/3/2022 12:58:11 PM,Interpublic Group acquires RafterOne,Seeking Alpha,https://seekingalpha.com/news/3887915-interpublic-group-acquires-rafterone?utm_source=businessinsider&utm_medium=referral,neutral,0.9419533610343933
10/3/2022 2:30:00 PM,IPG Acquires Premier Salesforce Solution Provider RafterOne,GlobeNewswire,/news/stocks/ipg-acquires-premier-salesforce-solution-provider-rafterone-1031778714,neutral,0.7646579146385193
10/10/2022 10:30:00 PM,Interpublic Schedules Third Quarter 2022 Earnings Release,GlobeNewswire,/news/stocks/interpublic-schedules-third-quarter-2022-earnings-release-1031794101,neutral,0.9034079313278198
10/12/2022 12:00:00 PM,"UConn, R/GA Ventures, CTNext to Launch Venture Studio Addressing Climate Change",PR Newswire,/news/stocks/uconn-r-ga-ventures-ctnext-to-launch-venture-studio-addressing-climate-change-1031798826,neutral,0.8087720274925232
10/13/2022 10:51:00 PM,Brands aren't hiring new ad agencies as they ready for a recession,Premium,/news/stocks/brands-arent-hiring-new-ad-agencies-as-they-ready-for-a-recession-2022-10,neutral,0.7848514914512634
10/20/2022 2:30:00 PM,"Early Crater Lake Drill Results Return Better Than Expected Grades and Intersection Lengths – 79.7 meters at 311 g/t Scandium Oxide, 0.326% Rare Earths Oxides and Yttrium",GlobeNewswire,/news/stocks/early-crater-lake-drill-results-return-better-than-expected-grades-and-intersection-lengths-79-7-meters-at-311-g-t-scandium-oxide-0-326-rare-earths-oxides-and-yttrium-1031821049,positive,0.9477644562721252
10/20/2022 3:14:02 PM,Notable earnings before Friday's open,Seeking Alpha,https://seekingalpha.com/news/3893258-notable-earnings-before-fridays-open?utm_source=businessinsider&utm_medium=referral,positive,0.8830810189247131
10/20/2022 5:28:18 PM,Interpublic Group of Companies Q3 2022 Earnings Preview,Seeking Alpha,https://seekingalpha.com/news/3893320-interpublic-group-of-companies-q3-2022-earnings-preview?utm_source=businessinsider&utm_medium=referral,neutral,0.8775845766067505
10/21/2022 11:02:47 AM,"Interpublic Group of Companies Non-GAAP EPS of $0.63 beats by $0.04, revenue of $2.3B beats by $20M",Seeking Alpha,https://seekingalpha.com/news/3893606-interpublic-group-of-companies-non-gaap-eps-of-0_63-beats-0_04-revenue-of-2_3b-beats-20m?utm_source=businessinsider&utm_medium=referral,neutral,0.5228869318962097
10/21/2022 1:00:00 PM,Interpublic Announces Third Quarter and First Nine Months 2022 Results,GlobeNewswire,/news/stocks/interpublic-announces-third-quarter-and-first-nine-months-2022-results-1031824034,neutral,0.9356294870376587
10/21/2022 1:25:56 PM,"Interpublic Group Q3 Results Up, Beat Estimates ",RTTNews,/news/stocks/interpublic-group-q3-results-up-beat-estimates-1031824103,positive,0.9454911947250366
10/25/2022 12:30:52 PM,Analysts Offer Insights on Services Companies: Casella Waste (CWST) and Interpublic Group of Companies (IPG),TipRanks,/news/stocks/analysts-offer-insights-on-services-companies-casella-waste-cwst-and-interpublic-group-of-companies-ipg-1031832662,neutral,0.9212623834609985
10/31/2022 8:34:36 PM,Interpublic Group declares $0.29 dividend,Seeking Alpha,https://seekingalpha.com/news/3898127-interpublic-group-declares-029-dividend?utm_source=businessinsider&utm_medium=referral,neutral,0.9056587219238281
10/31/2022 9:30:00 PM,Interpublic Declares Common Stock Dividend,GlobeNewswire,/news/stocks/interpublic-declares-common-stock-dividend-1031855155,neutral,0.939891517162323
11/14/2022 2:00:00 PM,Momentum Worldwide Announces New Global CEO,GlobeNewswire,/news/stocks/momentum-worldwide-announces-new-global-ceo-1031909956,neutral,0.8741284608840942
11/14/2022 10:30:00 PM,"Interpublic Group to Present at the Morgan Stanley European Technology, Media & Telecom Conference 2022",GlobeNewswire,/news/stocks/interpublic-group-to-present-at-the-morgan-stanley-european-technology-media-telecom-conference-2022-1031911732,neutral,0.9245025515556335
11/17/2022 1:30:00 PM,"Interpublic Elevates Kristen Cavallo to Global CEO, MullenLowe Group",GlobeNewswire,/news/stocks/interpublic-elevates-kristen-cavallo-to-global-ceo-mullenlowe-group-1031921880,neutral,0.8693760633468628
11/17/2022 2:30:00 PM,"Imperial Mining Intersects 308 g/t Sc2O3 over 98.6 m, Including 322 g/t over 52.8 m at Crater Lake, Quebec",GlobeNewswire,/news/stocks/imperial-mining-intersects-308-g-t-sc2o3-over-98-6-m-including-322-g-t-over-52-8-m-at-crater-lake-quebec-1031922164,neutral,0.7413567304611206
12/1/2022 4:53:00 PM,"The Weber Shandwick Collective Launches Business & Society Futures to Advise Clients Across Business Strategy, Stakeholder Expectations and Societal Impact",PR Newswire,/news/stocks/the-weber-shandwick-collective-launches-business-society-futures-to-advise-clients-across-business-strategy-stakeholder-expectations-and-societal-impact-1031948297,neutral,0.891622006893158
12/19/2022 4:26:04 PM,Morgan Stanley Sticks to Their Hold Rating for Interpublic Group of Companies (IPG),TipRanks,/news/stocks/morgan-stanley-sticks-to-their-hold-rating-for-interpublic-group-of-companies-ipg-1031980531,neutral,0.8555946946144104
1/5/2023 2:09:16 PM,Meta Platforms To Rally 34%? Here Are 10 Other Analyst Forecasts For Thursday,Benzinga,/news/stocks/meta-platforms-to-rally-34-here-are-10-other-analyst-forecasts-for-thursday-1032002017,neutral,0.9081125259399414
1/5/2023 4:01:20 PM,"Benzinga's Top Ratings Upgrades, Downgrades For January 5, 2023",Benzinga,/news/stocks/benzinga-s-top-ratings-upgrades-downgrades-for-january-5-2023-1032002380,negative,0.5128071308135986
2/6/2023 4:25:26 PM,Morgan Stanley Sticks to Their Hold Rating for Interpublic Group of Companies (IPG),TipRanks,/news/stocks/morgan-stanley-sticks-to-their-hold-rating-for-interpublic-group-of-companies-ipg-1032070886,neutral,0.8555946946144104
2/8/2023 3:01:13 PM,Interpublic Group of Cos is about to announce its earnings — here's what to expect,Markets Insider Automation,/news/stocks/interpublic_group_of_cos-q4-earnings-preview-stock-1032078663,neutral,0.9402806162834167
2/8/2023 3:17:16 PM,Notable earnings before Thursday's open,Seeking Alpha,https://seekingalpha.com/news/3933579-notable-earnings-before-thursdays-open?utm_source=businessinsider&utm_medium=referral,positive,0.8825733065605164
2/8/2023 6:48:32 PM,Interpublic Group of Companies Q4 2022 Earnings Preview,Seeking Alpha,https://seekingalpha.com/news/3933727-interpublic-group-of-companies-q4-2022-earnings-preview?utm_source=businessinsider&utm_medium=referral,neutral,0.897526741027832
2/9/2023 12:09:40 PM,"Interpublic Group of Companies Non-GAAP EPS of $1.02 beats by $0.01, revenue of $2.55B in-line",Seeking Alpha,https://seekingalpha.com/news/3934138-interpublic-group-of-companies-non-gaap-eps-of-1_02-beats-0_01-revenue-of-2_55b-in-line?utm_source=businessinsider&utm_medium=referral,neutral,0.6292721629142761
2/9/2023 12:20:29 PM,"Interpublic Group of Companies raises dividend by ~7% to $0.31/share, approves new $350M repurchase program",Seeking Alpha,https://seekingalpha.com/news/3934141-interpublic-group-of-companies-inc-declares-0_31-dividend?utm_source=businessinsider&utm_medium=referral,positive,0.930658221244812
2/9/2023 1:32:59 PM,Interpublic Q4 Adj. EPS Tops Estimates; Boosts Dividend 7% ,RTTNews,/news/stocks/interpublic-q4-adj-eps-tops-estimates-boosts-dividend-7-1032082732,positive,0.9430763721466064
2/10/2023 12:10:39 PM,Analysts Offer Insights on Services Companies: Interpublic Group of Companies (IPG) and Hilton Worldwide Holdings (HLT),TipRanks,/news/stocks/analysts-offer-insights-on-services-companies-interpublic-group-of-companies-ipg-and-hilton-worldwide-holdings-hlt-1032086114,neutral,0.926612377166748
2/10/2023 4:00:48 PM,"Benzinga's Top Ratings Upgrades, Downgrades For February 10, 2023",Benzinga,/news/stocks/benzinga-s-top-ratings-upgrades-downgrades-for-february-10-2023-1032086625,negative,0.5272051692008972
2/13/2023 1:20:04 AM,Analysts Offer Insights on Services Companies: WEX (WEX) and Interpublic Group of Companies (IPG),TipRanks,/news/stocks/analysts-offer-insights-on-services-companies-wex-wex-and-interpublic-group-of-companies-ipg-1032088298,neutral,0.9259538650512695
2/14/2023 1:30:09 PM,Lattice Semiconductor To Rally 33%? Here Are 10 Other Analyst Forecasts For Tuesday,Benzinga,/news/stocks/lattice-semiconductor-to-rally-33-here-are-10-other-analyst-forecasts-for-tuesday-1032094511,neutral,0.9092327952384949
3/3/2023 2:26:05 PM,Wall Street's Most Accurate Analysts Say Buy These 3 Tech And Telecom Stocks With Over 3% Dividend Yields,Benzinga,/news/stocks/wall-street-s-most-accurate-analysts-say-buy-these-3-tech-and-telecom-stocks-with-over-3-dividend-yields-1032143747,positive,0.5828295946121216
3/8/2023 7:30:00 PM,STEPHEN MACIAS NAMED INCLUSIVE DIVERSITY LEAD FOR OCTAGON SPORTS & ENTERTAINMENT NETWORK,PR Newswire,/news/stocks/stephen-macias-named-inclusive-diversity-lead-for-octagon-sports-entertainment-network-1032154622,neutral,0.8954461216926575
3/20/2023 8:17:37 PM,Check Out 3 High-Yielding Dividend Stocks In Tech And Telecom Sector From Wall Street's Most Accurate Analysts,Benzinga,/news/stocks/check-out-3-high-yielding-dividend-stocks-in-tech-and-telecom-sector-from-wall-street-s-most-accurate-analysts-1032180115,neutral,0.6800728440284729
3/29/2023 2:05:43 PM,Expert Ratings for Interpublic Gr of Cos,Benzinga,/news/stocks/expert-ratings-for-interpublic-gr-of-cos-1032200194,neutral,0.818600594997406
3/29/2023 5:00:39 PM,"Benzinga's Top Ratings Upgrades, Downgrades For March 29, 2023",Benzinga,/news/stocks/benzinga-s-top-ratings-upgrades-downgrades-for-march-29-2023-1032200913,negative,0.4950524866580963
3/30/2023 6:45:28 AM,Positive Report for Interpublic Group of Companies (IPG) from Bank of America Securities,TipRanks,/news/stocks/positive-report-for-interpublic-group-of-companies-ipg-from-bank-of-america-securities-1032202453,positive,0.861275315284729
3/30/2023 1:38:17 PM,Philip Morris To Rally Over 22%? Here Are 10 Other Analyst Forecasts For Thursday,Benzinga,/news/stocks/philip-morris-to-rally-over-22-here-are-10-other-analyst-forecasts-for-thursday-1032203247,neutral,0.9119259715080261
3/30/2023 5:00:39 PM,"Benzinga's Top Ratings Upgrades, Downgrades For March 30, 2023",Benzinga,/news/stocks/benzinga-s-top-ratings-upgrades-downgrades-for-march-30-2023-1032204123,negative,0.48770466446876526
4/4/2023 3:09:22 PM,Check Out 3 Tech And Telecom Stocks With Over 3% Dividend Yields From Wall Street's Most Accurate Analysts,Benzinga,/news/stocks/check-out-3-tech-and-telecom-stocks-with-over-3-dividend-yields-from-wall-street-s-most-accurate-analysts-1032213898,neutral,0.7743417024612427
4/17/2023 7:44:00 PM,Moms of The Biggest Gamers Infiltrate Their Children's Livestreams to Surprise Them and Kickstart Conversations about Gut Health,PR Newswire,/news/stocks/moms-of-the-biggest-gamers-infiltrate-their-children-s-livestreams-to-surprise-them-and-kickstart-conversations-about-gut-health-1032237268,neutral,0.9158368110656738
4/26/2023 3:01:13 PM,Interpublic Group of Cos is about to announce its earnings — here's what Wall Street expects,Markets Insider Automation,/news/stocks/interpublic_group_of_cos-q1-earnings-preview-stock-1032263489,neutral,0.9329299926757812
4/26/2023 3:07:35 PM,Notable earnings before Thursday's open,Seeking Alpha,https://seekingalpha.com/news/3960517-notable-earnings-before-thursdays-open?utm_source=businessinsider&utm_medium=referral,positive,0.8825733065605164
4/26/2023 4:50:01 PM,Interpublic Group of Companies Q1 2023 Earnings Preview,Seeking Alpha,https://seekingalpha.com/news/3960608-interpublic-group-of-companies-q1-2023-earnings-preview?utm_source=businessinsider&utm_medium=referral,neutral,0.8796242475509644
4/27/2023 11:53:01 AM,"Interpublic Group of Companies Non-GAAP EPS of $0.38 beats by $0.04, revenue of $2.52B beats by $330M",Seeking Alpha,https://seekingalpha.com/news/3961267-interpublic-group-of-companies-non-gaap-eps-of-0_38-beats-0_04-revenue-of-2_52b-beats-330m?utm_source=businessinsider&utm_medium=referral,neutral,0.5149115324020386
4/27/2023 2:13:59 PM,Interpublic Q1 Results Top Estimates ,RTTNews,/news/stocks/interpublic-q1-results-top-estimates-1032268470,neutral,0.8817293047904968
4/28/2023 8:35:18 AM,Barclays Issues a Hold Rating on Interpublic Group of Companies (IPG),TipRanks,/news/stocks/barclays-issues-a-hold-rating-on-interpublic-group-of-companies-ipg-1032272722,neutral,0.9001466631889343
4/28/2023 10:35:13 AM,Wells Fargo Sticks to Their Buy Rating for Interpublic Group of Companies (IPG),TipRanks,/news/stocks/wells-fargo-sticks-to-their-buy-rating-for-interpublic-group-of-companies-ipg-1032273128,neutral,0.834317684173584
4/28/2023 7:00:14 PM,Barclays Maintains Equal-Weight Rating for Interpublic Gr of Cos: Here's What You Need To Know,Benzinga,/news/stocks/barclays-maintains-equal-weight-rating-for-interpublic-gr-of-cos-here-s-what-you-need-to-know-1032274676,neutral,0.9270567297935486
4/28/2023 7:57:00 PM,The CEOs of the world's biggest advertising companies just outlined how AI is about to transform their businesses,Premium,/news/stocks/how-ai-transform-advertising-agencies-2023-4,neutral,0.8748764991760254
4/28/2023 10:00:30 PM,What 7 Analyst Ratings Have To Say About Interpublic Gr of Cos,Benzinga,/news/stocks/what-7-analyst-ratings-have-to-say-about-interpublic-gr-of-cos-1032274907,neutral,0.9444247484207153
5/2/2023 7:42:00 PM,"BROTHERS IBRAHIMA AND ABDOULAYE BARRY, IN PARTNERSHIP WITH MICROSOFT, LAUNCH THE NEWEST EVOLUTION OF THE ADLaM ALPHABET: A LANGUAGE AT RISK OF DISAPPEARING",PR Newswire,/news/stocks/brothers-ibrahima-and-abdoulaye-barry-in-partnership-with-microsoft-launch-the-newest-evolution-of-the-adlam-alphabet-a-language-at-risk-of-disappearing-1032283643,neutral,0.7362008690834045
5/17/2023 3:04:58 PM,Wall Street's Most Accurate Analysts Say Hold These 3 Tech And Telecom Stocks Delivering High-Dividend Yields,Benzinga,/news/stocks/wall-street-s-most-accurate-analysts-say-hold-these-3-tech-and-telecom-stocks-delivering-high-dividend-yields-1032334991,positive,0.5143100619316101
5/18/2023 6:50:00 PM,"United Minds Expands Its Global Management Consultancy with a New C-Suite Advisory, Myriant, Focused on Business Resiliency & Stakeholder Management",PR Newswire,/news/stocks/united-minds-expands-its-global-management-consultancy-with-a-new-c-suite-advisory-myriant-focused-on-business-resiliency-stakeholder-management-1032338133,positive,0.7785516381263733
5/25/2023 8:46:06 PM,Interpublic Group of Companies declares $0.31 dividend,Seeking Alpha,https://seekingalpha.com/news/3975241-interpublic-group-of-companies-inc-declares-0_31-dividend?utm_source=businessinsider&utm_medium=referral,neutral,0.8692347407341003
6/16/2023 2:04:49 PM,Check Out 3 Tech And Telecom Stocks With Over 3% Dividend Yields From Wall Street's Most Accurate Analysts,Benzinga,/news/stocks/check-out-3-tech-and-telecom-stocks-with-over-3-dividend-yields-from-wall-street-s-most-accurate-analysts-1032394250,neutral,0.7743417024612427
6/21/2023 4:18:00 PM,Myriant Enters into Strategic Collaboration with S&P Global Market Intelligence for Capital Markets Insights Offering,PR Newswire,/news/stocks/myriant-enters-into-strategic-collaboration-with-s-p-global-market-intelligence-for-capital-markets-insights-offering-1032402154,positive,0.7195876240730286
6/26/2023 7:31:00 PM,MCCANN WORLDGROUP SHINES AT 2023 CANNES LIONS INTERNATIONAL FESTIVAL OF CREATIVITY,PR Newswire,/news/stocks/mccann-worldgroup-shines-at-2023-cannes-lions-international-festival-of-creativity-1032410506,neutral,0.5041056871414185
6/28/2023 10:18:50 AM,TipRanks All-Star Analyst – Who is the Best on DIS Stock?,TipRanks,/news/stocks/tipranks-all-star-analyst-–-who-is-the-best-on-dis-stock-1032414495,neutral,0.9132938981056213
7/2/2023 11:15:11 PM,Interpublic Group of Companies (IPG) Gets a Buy from Bank of America Securities,TipRanks,/news/stocks/interpublic-group-of-companies-ipg-gets-a-buy-from-bank-of-america-securities-1032422305,neutral,0.6481637358665466
7/3/2023 2:24:09 PM,Wells Fargo To Rally Around 20%? Here Are 10 Other Analyst Forecasts For Monday,Benzinga,/news/stocks/wells-fargo-to-rally-around-20-here-are-10-other-analyst-forecasts-for-monday-1032423397,neutral,0.9123637676239014
7/5/2023 1:25:16 AM,Interpublic Group of Companies (IPG) Gets a Hold from Barclays,TipRanks,/news/stocks/interpublic-group-of-companies-ipg-gets-a-hold-from-barclays-1032426114,neutral,0.8672911524772644
7/5/2023 1:35:23 PM,Wall Street's Most Accurate Analysts Say Buy These 3 Tech And Telecom Stocks With Over 3% Dividend Yields,Benzinga,/news/stocks/wall-street-s-most-accurate-analysts-say-buy-these-3-tech-and-telecom-stocks-with-over-3-dividend-yields-1032427165,positive,0.5828295946121216
7/19/2023 5:54:01 PM,"Ad giant IPG's data arm Kinesso has gone through an executive exodus, and the unit faces an uncertain future",Premium,/news/stocks/interpublic-group-shakes-up-its-kinesso-data-and-technology-arm-2023-7,negative,0.9466327428817749
7/20/2023 3:01:13 PM,Interpublic Group of Cos is about to announce earnings — here's what Wall Street expects,Markets Insider Automation,/news/stocks/interpublic_group_of_cos-stock-quarter-earnings-preview-q2-1032462517,neutral,0.9312020540237427
7/20/2023 3:04:39 PM,Notable earnings before Friday's open,Seeking Alpha,https://seekingalpha.com/news/3989240-notable-earnings-before-fridays-open?utm_source=businessinsider&utm_medium=referral,positive,0.8830810189247131
7/20/2023 3:07:15 PM,Check Out 3 High-Yielding Dividend Stocks In Tech And Telecom Sector From Wall Street's Most Accurate Analysts,Benzinga,/news/stocks/check-out-3-high-yielding-dividend-stocks-in-tech-and-telecom-sector-from-wall-street-s-most-accurate-analysts-1032462632,neutral,0.6800728440284729
7/20/2023 5:50:19 PM,Interpublic Group of Companies Q2 2023 Earnings Preview,Seeking Alpha,https://seekingalpha.com/news/3989305-interpublic-group-of-companies-q2-2023-earnings-preview?utm_source=businessinsider&utm_medium=referral,neutral,0.875229001045227
7/21/2023 11:06:46 AM,Interpublic Group of Companies reports mixed Q2 earnings; updates FY23 organic growth outlook,Seeking Alpha,https://seekingalpha.com/news/3989557-interpublic-group-of-companies-reports-mixed-q2-earnings-updates-fy23-organic-growth-outlook?utm_source=businessinsider&utm_medium=referral,negative,0.9226729869842529
7/21/2023 12:20:49 PM,"BSGM, PRCH and UP among pre-market losers",Seeking Alpha,https://seekingalpha.com/news/3989583-bsgm-prch-and-up-among-pre-market-losers?utm_source=businessinsider&utm_medium=referral,positive,0.7816472053527832
7/21/2023 12:45:56 PM,"Biggest stock movers today: Digital World Acquisition, Sirius XM, Interpublic Group and more",Seeking Alpha,https://seekingalpha.com/news/3989503-biggest-stock-movers-today-digital-world-acquisition-intuitive-surgical-and-more?utm_source=businessinsider&utm_medium=referral,neutral,0.921801745891571
7/21/2023 1:33:01 PM,Interpublic Group Q2 Profit Increases ,RTTNews,/news/stocks/interpublic-group-q2-profit-increases-1032465643,negative,0.585120677947998
7/21/2023 4:54:29 PM,Interpublic Group slides on results; ad giants lead market decliners,Seeking Alpha,https://seekingalpha.com/news/3989737-interpublic-group-slides-on-results-ad-giants-lead-market-decliners?utm_source=businessinsider&utm_medium=referral,negative,0.9693158864974976
7/21/2023 6:01:05 PM,Crude Oil Rises Over 1%; Schlumberger Posts Downbeat Sales,Benzinga,/news/stocks/crude-oil-rises-over-1-schlumberger-posts-downbeat-sales-1032466524,negative,0.5771849155426025
7/21/2023 7:00:49 PM,Why Metropolitan Bank Holding Shares Are Trading Lower By 9%? Here Are Other Stocks Moving In Friday's Mid-Day Session,Benzinga,/news/stocks/why-metropolitan-bank-holding-shares-are-trading-lower-by-9-here-are-other-stocks-moving-in-friday-s-mid-day-session-1032466642,negative,0.7491542100906372
7/21/2023 8:44:12 PM,Gold Edges Lower; AutoNation Earnings Top Expectations,Benzinga,/news/stocks/gold-edges-lower-autonation-earnings-top-expectations-1032466778,negative,0.48932209610939026
7/24/2023 2:01:04 PM,Expert Ratings for Interpublic Gr of Cos,Benzinga,/news/stocks/expert-ratings-for-interpublic-gr-of-cos-1032469878,neutral,0.818600594997406
7/24/2023 5:00:51 PM,"Benzinga's Top Ratings Upgrades, Downgrades For July 24, 2023",Benzinga,/news/stocks/benzinga-s-top-ratings-upgrades-downgrades-for-july-24-2023-1032470837,neutral,0.49198997020721436
7/26/2023 1:15:25 AM,Interpublic Group of Companies (IPG) Gets a Hold from Barclays,TipRanks,/news/stocks/interpublic-group-of-companies-ipg-gets-a-hold-from-barclays-1032476434,neutral,0.8672911524772644
8/1/2023 6:23:40 AM,Interpublic Group of Companies declares $0.31 dividend,Seeking Alpha,https://seekingalpha.com/news/3993757-interpublic-group-of-companies-inc-declares-0_31-dividend?utm_source=businessinsider&utm_medium=referral,neutral,0.8692347407341003
8/3/2023 1:43:24 PM,Wall Street's Most Accurate Analysts Say Buy These 3 Tech And Telecom Stocks Delivering High-Dividend Yields,Benzinga,/news/stocks/wall-street-s-most-accurate-analysts-say-buy-these-3-tech-and-telecom-stocks-delivering-high-dividend-yields-1032512264,positive,0.8211254477500916
