,datetime,title,source,link,sentiment_class,sentiment_score
111,4/20/2022 5:40:24 PM,Iqvia price target lowered at BofA on forex concerns,Seeking Alpha,https://seekingalpha.com/news/3824871-iqv-stock-gains-even-after-price-target-lowered-by-bofa-on-forex-concerns?utm_source=markets.businessinsider.com&utm_medium=referral,negative,0.7277171015739441
112,4/23/2022 8:00:00 PM,COVID therapies and vaccines propel rise in spending on medicines in 2021,Seeking Alpha,https://seekingalpha.com/news/3825965-covid-therapies-and-vaccines-propel-rise-in-spending-on-medicines-in-2021?utm_source=markets.businessinsider.com&utm_medium=referral,positive,0.9413689970970154
113,4/25/2022 1:53:49 PM,10 Biggest Price Target Changes For Monday,Benzinga,/news/stocks/10-biggest-price-target-changes-for-monday-1031379838,neutral,0.7998326420783997
114,4/25/2022 4:07:25 PM,"Benzinga's Top Ratings Upgrades, Downgrades For April 25, 2022",Benzinga,/news/stocks/benzinga-s-top-ratings-upgrades-downgrades-for-april-25-2022-1031380608,neutral,0.5321391224861145
115,4/25/2022 5:07:39 PM,Syneos Health hits a 52-week low after Jefferies downgrade,Seeking Alpha,https://seekingalpha.com/news/3826294-synh-stock-hits-52-week-low-after-jefferies-downgrade?utm_source=markets.businessinsider.com&utm_medium=referral,negative,0.9631615281105042
116,4/25/2022 5:23:34 PM,"Wells Fargo downgrades Thermo Fisher to underweight on ""expensive"" valuation",Seeking Alpha,https://seekingalpha.com/news/3826315-thermo-fisher-downgraded-to-underweight-on-valuation-at-wells-fargo?utm_source=markets.businessinsider.com&utm_medium=referral,negative,0.9538577198982239
117,4/25/2022 9:03:36 PM,Analyst Ratings for IQVIA Hldgs,Benzinga,/news/stocks/analyst-ratings-for-iqvia-hldgs-1031381315,neutral,0.913325309753418
118,4/26/2022 2:51:26 PM,Notable earnings before Wednesday's open,Seeking Alpha,https://seekingalpha.com/news/3826832-notable-earnings-before-wednesdays-open?utm_source=markets.businessinsider.com&utm_medium=referral,positive,0.855887770652771
119,4/26/2022 3:01:13 PM,Here's what Wall Street expects from IQVIA's earnings report,Markets Insider Automation,/news/stocks/iqvia-stock-price-q1-earnings-preview-1031384924,neutral,0.9204581379890442
120,4/26/2022 3:46:23 PM,Medpace drags rivals after unchanged 2022 guidance,Seeking Alpha,https://seekingalpha.com/news/3826871-medpace-drags-rivals-after-unchanged-2022-guidance?utm_source=markets.businessinsider.com&utm_medium=referral,negative,0.9190753102302551
121,4/26/2022 5:53:20 PM,IQVIA Q1 2022 Earnings Preview,Seeking Alpha,https://seekingalpha.com/news/3827032-iqvia-q1-2022-earnings-preview?utm_source=markets.businessinsider.com&utm_medium=referral,neutral,0.8808496594429016
122,4/27/2022 11:03:38 AM,"IQVIA Non-GAAP EPS of $2.47 beats by $0.05, revenue of $3.57B beats by $30M",Seeking Alpha,https://seekingalpha.com/news/3827441-iqvia-non-gaap-eps-of-2_47-beats-0_05-revenue-of-3_57b-beats-30m?utm_source=markets.businessinsider.com&utm_medium=referral,neutral,0.7824888229370117
123,4/27/2022 1:43:58 PM,IQVIA Updates 2022 Revenue Guidance ,RTTNews,/news/stocks/iqvia-updates-2022-revenue-guidance-1031390599,neutral,0.9204128980636597
124,4/27/2022 2:26:05 PM,"IQVIA Holdings Inc. Q1 Profit Increases, beats estimates",RTTNews,/news/stocks/iqvia-holdings-inc-q1-profit-increases-beats-estimates-1031390935,positive,0.9380467534065247
125,4/29/2022 3:03:09 PM,Iqvia upgraded at Piper; says end market concerns are overblown,Seeking Alpha,https://seekingalpha.com/news/3829498-iqv-stock-up-on-piper-sandler-upgrade?utm_source=markets.businessinsider.com&utm_medium=referral,positive,0.8993313908576965
126,4/29/2022 4:03:33 PM,"Benzinga's Top Ratings Upgrades, Downgrades For April 29, 2022",Benzinga,/news/stocks/benzinga-s-top-ratings-upgrades-downgrades-for-april-29-2022-1031402884,neutral,0.5348135828971863
127,5/24/2022 11:08:58 AM,Amphastar announces FDA approval of generic for Astellas’ Lexiscan,Seeking Alpha,https://seekingalpha.com/news/3842107-amph-stock-in-focus-after-fda-approval-of-generic-for-astellas-lexiscan?utm_source=markets.businessinsider.com&utm_medium=referral,positive,0.6459357738494873
128,5/24/2022 2:53:45 PM,"CROs ICON, IQVIA, and Syneos Health initiated at buy at Guggenheim",Seeking Alpha,https://seekingalpha.com/news/3842270-contract-research-organization-icon-iqvia-and-syneos-health-initiated-at-buy-at-guggenheim?utm_source=markets.businessinsider.com&utm_medium=referral,neutral,0.9090341329574585
129,5/24/2022 3:02:21 PM,Where IQVIA Hldgs Stands With Analysts,Benzinga,/news/stocks/where-iqvia-hldgs-stands-with-analysts-1031485116,neutral,0.8945249319076538
130,5/24/2022 4:04:33 PM,"Benzinga's Top Ratings Upgrades, Downgrades For May 24, 2022",Benzinga,/news/stocks/benzinga-s-top-ratings-upgrades-downgrades-for-may-24-2022-1031485498,neutral,0.5132132768630981
131,6/16/2022 12:39:01 PM,Walgreens launches clinical trial business,Seeking Alpha,https://seekingalpha.com/news/3849214-walgreens-launches-clinical-trial-business?utm_source=businessinsider&utm_medium=referral,neutral,0.8805609345436096
132,6/27/2022 10:15:06 AM,7 Biotech Stocks With Key Catalysts Coming in July,InvestorPlace,/news/stocks/7-biotech-stocks-with-key-catalysts-coming-in-july-1031551243,positive,0.5154509544372559
133,7/5/2022 6:16:38 PM,3 Biotech Stocks to Sell Now,InvestorPlace,/news/stocks/biotech-stocks-to-sell-1031568378,neutral,0.9156689643859863
134,7/13/2022 4:11:00 PM,What 5 Analyst Ratings Have To Say About IQVIA Hldgs,Benzinga,/news/stocks/what-5-analyst-ratings-have-to-say-about-iqvia-hldgs-1031584863,neutral,0.9437292218208313
135,7/15/2022 4:18:29 PM,"Benzinga's Top Ratings Upgrades, Downgrades For July 15, 2022",Benzinga,/news/stocks/benzinga-s-top-ratings-upgrades-downgrades-for-july-15-2022-1031590571,neutral,0.5333226919174194
136,7/20/2022 3:01:13 PM,What Wall Street expects from IQVIA's earnings,Markets Insider Automation,/news/stocks/iqvia-stock-price-q2-earnings-preview-1031601088,neutral,0.9339121580123901
137,7/20/2022 3:08:39 PM,Notable earnings before Thursday's open,Seeking Alpha,https://seekingalpha.com/news/3858592-notable-earnings-before-thursdays-open?utm_source=businessinsider&utm_medium=referral,positive,0.882573127746582
138,7/21/2022 11:07:44 AM,"IQVIA Non-GAAP EPS of $2.44 beats by $0.06, revenue of $3.54B beats by $50M, raises FY22 guidance",Seeking Alpha,https://seekingalpha.com/news/3858968-iqvia-non-gaap-eps-of-244-beats-by-006-revenue-of-354b-beats-by-50m-raises-fy22-guidance?utm_source=businessinsider&utm_medium=referral,positive,0.8955742120742798
139,7/21/2022 1:19:21 PM,"IQVIA Holdings Inc. Q2 Profit Increases, beats estimates",RTTNews,/news/stocks/iqvia-holdings-inc-q2-profit-increases-beats-estimates-1031604254,positive,0.9397760033607483
140,7/21/2022 1:42:33 PM,IQVIA Holdings Adjusts FY22 Outlook To Reflect FX Impact - Update ,RTTNews,/news/stocks/iqvia-holdings-adjusts-fy22-outlook-to-reflect-fx-impact-update-1031604343,neutral,0.5995475649833679
141,7/22/2022 8:56:08 AM,"DGX Boosts FY22 Outlook, NURO On Watch, PSTV To Present ReSPECT-GBM Data In Sep. ",RTTNews,/news/stocks/dgx-boosts-fy22-outlook-nuro-on-watch-pstv-to-present-respect-gbm-data-in-sep-1031606893,positive,0.7740458250045776
142,7/22/2022 10:30:54 AM,7 Growth Stocks to Buy on the Dip,InvestorPlace,/news/stocks/growth-stocks-to-buy-on-the-dip-1031607316,neutral,0.8326893448829651
143,7/23/2022 6:55:04 PM,UBS lists top conviction stock ideas for its favorite sectors,Seeking Alpha,https://seekingalpha.com/news/3859827-ubs-lists-top-conviction-stock-ideas-for-its-favorite-sectors?utm_source=businessinsider&utm_medium=referral,neutral,0.9275354146957397
144,7/31/2022 6:57:28 PM,UBS reveals its highest conviction stock picks for the rest of 2022,Seeking Alpha,https://seekingalpha.com/news/3863507-ubs-reveals-its-highest-conviction-stock-picks-for-the-rest-of-2022?utm_source=businessinsider&utm_medium=referral,positive,0.8287615180015564
145,8/11/2022 9:36:27 AM,"GSK, Iqvia launch Vaccine Track platform to highlight vaccine trends publicly in US",Seeking Alpha,https://seekingalpha.com/news/3871307-gsk-iqvia-launch-vaccine-track-platform-to-highlight-vaccine-trends-publicly-in-us?utm_source=businessinsider&utm_medium=referral,neutral,0.7957825660705566
146,8/15/2022 9:37:55 PM,"Dan Loeb's Third Point takes new stakes in Colgate, Antero, exits S&P Global",Seeking Alpha,https://seekingalpha.com/news/3873302-dan-loebs-third-point-takes-new-stakes-in-colgate-antero-exits-sp-global?utm_source=businessinsider&utm_medium=referral,neutral,0.9197775721549988
147,8/25/2022 3:53:48 PM,"Bio-Rad, IQVIA, Bio-Techne among top picks at Credit Suisse",Seeking Alpha,https://seekingalpha.com/news/3876720-rad-stock-tech-stock-iqv-stock-gain-as-credit-suisse-names-top-picks?utm_source=businessinsider&utm_medium=referral,positive,0.5390982627868652
148,8/25/2022 4:33:31 PM,5 Analysts Have This to Say About IQVIA Hldgs,Benzinga,/news/stocks/5-analysts-have-this-to-say-about-iqvia-hldgs-1031706292,neutral,0.9263160824775696
149,8/25/2022 4:34:39 PM,"Benzinga's Top Ratings Upgrades, Downgrades For August 25, 2022",Benzinga,/news/stocks/benzinga-s-top-ratings-upgrades-downgrades-for-august-25-2022-1031706291,neutral,0.5189014077186584
150,8/25/2022 6:04:11 PM,What 5 Analyst Ratings Have To Say About IQVIA Hldgs,Benzinga,/news/stocks/what-5-analyst-ratings-have-to-say-about-iqvia-hldgs-1031706517,neutral,0.9437292218208313
151,9/12/2022 7:08:43 PM,6 Analysts Have This to Say About IQVIA Hldgs,Benzinga,/news/stocks/6-analysts-have-this-to-say-about-iqvia-hldgs-1031738032,neutral,0.9258694648742676
152,9/12/2022 9:09:37 PM,Expert Ratings for IQVIA Hldgs,Benzinga,/news/stocks/expert-ratings-for-iqvia-hldgs-1031738178,neutral,0.8439694046974182
153,10/6/2022 1:34:50 PM,Tesla To $370? Plus HC Wainwright Slashes PT On This Stock By 67%,Benzinga,/news/stocks/tesla-to-370-plus-hc-wainwright-slashes-pt-on-this-stock-by-67-1031787024,neutral,0.6047030091285706
154,10/25/2022 3:01:13 PM,Here's what Wall Street expects from IQVIA's earnings,Markets Insider Automation,/news/stocks/iqvia-stock-price-quarter-earnings-preview-q3-1031832876,neutral,0.9345874190330505
155,10/25/2022 3:10:05 PM,Notable earnings before Wednesday's open,Seeking Alpha,https://seekingalpha.com/news/3894799-notable-earnings-before-wednesdays-open?utm_source=businessinsider&utm_medium=referral,positive,0.855887770652771
156,10/25/2022 4:50:54 PM,IQVIA Q3 2022 Earnings Preview,Seeking Alpha,https://seekingalpha.com/news/3894922-iqvia-q3-2022-earnings-preview?utm_source=businessinsider&utm_medium=referral,neutral,0.8728036284446716
157,10/26/2022 11:11:09 AM,"IQVIA Non-GAAP EPS of $2.48 beats by $0.10, revenue of $3.56B beats by $20M",Seeking Alpha,https://seekingalpha.com/news/3895364-iqvia-non-gaap-eps-of-2_48-beats-0_10-revenue-of-3_56b-beats-20m?utm_source=businessinsider&utm_medium=referral,neutral,0.7831940054893494
158,10/26/2022 1:30:27 PM,"IQVIA Holdings Inc. Q3 Profit Increases, beats estimates",RTTNews,/news/stocks/iqvia-holdings-inc-q3-profit-increases-beats-estimates-1031837531,positive,0.938687264919281
159,10/27/2022 12:40:34 PM,"Analysts Offer Insights on Healthcare Companies: Align Tech (ALGN), Thermo Fisher (TMO) and IQVIA Holdings (IQV)",TipRanks,/news/stocks/analysts-offer-insights-on-healthcare-companies-align-tech-algn-thermo-fisher-tmo-and-iqvia-holdings-iqv-1031843383,neutral,0.9117166996002197
160,10/27/2022 4:00:49 PM,5 Analysts Have This to Say About IQVIA Hldgs,Benzinga,/news/stocks/5-analysts-have-this-to-say-about-iqvia-hldgs-1031844081,neutral,0.9263160824775696
161,10/27/2022 4:22:15 PM,General Electric To Rally Around 14%? Here Are 5 Other Price Target Changes For Thursday,Benzinga,/news/stocks/general-electric-to-rally-around-14-here-are-5-other-price-target-changes-for-thursday-1031844164,neutral,0.9275838136672974
162,10/28/2022 2:11:50 AM,"Analysts Have Conflicting Sentiments on These Healthcare Companies: Thermo Fisher (TMO), IQVIA Holdings (IQV) and Editas Medicine (EDIT)",TipRanks,/news/stocks/analysts-have-conflicting-sentiments-on-these-healthcare-companies-thermo-fisher-tmo-iqvia-holdings-iqv-and-editas-medicine-edit-1031845751,negative,0.9150317907333374
163,10/31/2022 4:25:29 AM,SVB Securities Remains a Buy on IQVIA Holdings (IQV),TipRanks,/news/stocks/svb-securities-remains-a-buy-on-iqvia-holdings-iqv-1031850975,neutral,0.9524787664413452
164,10/31/2022 4:25:57 AM,Mizuho Securities Remains a Buy on IQVIA Holdings (IQV),TipRanks,/news/stocks/mizuho-securities-remains-a-buy-on-iqvia-holdings-iqv-1031850966,neutral,0.9500922560691833
165,11/14/2022 12:10:54 PM,"Analysts Offer Insights on Healthcare Companies: IQVIA Holdings (IQV), TG Therapeutics (TGTX) and Gossamer Bio (GOSS)",TipRanks,/news/stocks/analysts-offer-insights-on-healthcare-companies-iqvia-holdings-iqv-tg-therapeutics-tgtx-and-gossamer-bio-goss-1031909694,neutral,0.917746901512146
166,11/17/2022 1:02:19 PM,Analyst Ratings for IQVIA Hldgs,Benzinga,/news/stocks/analyst-ratings-for-iqvia-hldgs-1031921731,neutral,0.913325309753418
167,11/17/2022 1:12:09 PM,Target To Rally 29%? Plus This Analyst Predicts $245 For IQVIA Holdings,Benzinga,/news/stocks/target-to-rally-29-plus-this-analyst-predicts-245-for-iqvia-holdings-1031921803,positive,0.8852123618125916
168,11/17/2022 2:01:27 PM,Where IQVIA Hldgs Stands With Analysts,Benzinga,/news/stocks/where-iqvia-hldgs-stands-with-analysts-1031921988,neutral,0.8945249319076538
169,11/17/2022 4:13:37 PM,"Benzinga's Top Ratings Upgrades, Downgrades For November 17, 2022",Benzinga,/news/stocks/benzinga-s-top-ratings-upgrades-downgrades-for-november-17-2022-1031922777,negative,0.4982072114944458
170,12/1/2022 5:38:36 AM,"MRNA, BIIB, or IQV: Which Biotech Stock Earns the Street’s “Strong Buy” Rating?",TipRanks,/news/stocks/mrna-biib-or-iqv-which-biotech-stock-earns-the-street-s-strong-buy-rating-1031946927,neutral,0.8603473901748657
171,12/6/2022 1:04:59 PM,Expert Ratings for IQVIA Hldgs,Benzinga,/news/stocks/expert-ratings-for-iqvia-hldgs-1031955048,neutral,0.8439694046974182
172,12/6/2022 4:05:04 PM,"Benzinga's Top Ratings Upgrades, Downgrades For December 6, 2022",Benzinga,/news/stocks/benzinga-s-top-ratings-upgrades-downgrades-for-december-6-2022-1031955691,neutral,0.5029000043869019
173,12/7/2022 3:00:54 PM,"Analysts Are Bullish on These Healthcare Stocks: Celldex (CLDX), IQVIA Holdings (IQV)",TipRanks,/news/stocks/analysts-are-bullish-on-these-healthcare-stocks-celldex-cldx-iqvia-holdings-iqv-1031958406,neutral,0.6506408452987671
174,1/13/2023 5:00:23 PM,Analyst Ratings for IQVIA Hldgs,Benzinga,/news/stocks/analyst-ratings-for-iqvia-hldgs-1032017917,neutral,0.913325309753418
175,1/16/2023 1:15:10 AM,Barclays Remains a Buy on IQVIA Holdings (IQV),TipRanks,/news/stocks/barclays-remains-a-buy-on-iqvia-holdings-iqv-1032018972,neutral,0.9434985518455505
176,1/17/2023 12:25:25 PM,Barclays Remains a Buy on IQVIA Holdings (IQV),TipRanks,/news/stocks/barclays-remains-a-buy-on-iqvia-holdings-iqv-1032022512,neutral,0.9434985518455505
177,1/17/2023 1:52:24 PM,World Wrestling Entertainment To Rally Around 12%? Here Are 10 Other Analyst Forecasts For Tuesday,Benzinga,/news/stocks/world-wrestling-entertainment-to-rally-around-12-here-are-10-other-analyst-forecasts-for-tuesday-1032022318,neutral,0.909263551235199
178,1/22/2023 5:00:19 PM,Global drug spending to reach $1.9T by 2027 – IQVIA,Seeking Alpha,https://seekingalpha.com/news/3926554-global-drug-spending-reach-usd-two-trillion-2027-iqvia?utm_source=businessinsider&utm_medium=referral,positive,0.8150347471237183
179,1/27/2023 12:39:46 PM,Mizuho picks its top stocks for 2023,Seeking Alpha,https://seekingalpha.com/news/3928578-mizuho-picks-its-top-stocks-for-2023?utm_source=businessinsider&utm_medium=referral,neutral,0.925223171710968
180,1/31/2023 2:56:08 PM,IQVIA and Alibaba Cloud to deliver commercial & clinical solutions in China,Seeking Alpha,https://seekingalpha.com/news/3929878-iqvia-and-alibaba-cloud-to-deliver-commercial-clinical-solutions-in-china?utm_source=businessinsider&utm_medium=referral,neutral,0.8180637359619141
181,2/9/2023 3:01:13 PM,Here's what Wall Street expects from IQVIA's earnings report,Markets Insider Automation,/news/stocks/iqvia-q4-quarterly-earnings-preview-stock-1032083148,neutral,0.9204581379890442
182,2/9/2023 4:59:48 PM,IQVIA Q4 2022 Earnings Preview,Seeking Alpha,https://seekingalpha.com/news/3934336-iqvia-q4-2022-earnings-preview?utm_source=businessinsider&utm_medium=referral,neutral,0.8869616389274597
183,2/10/2023 12:10:23 PM,"IQVIA Non-GAAP EPS of $2.78 beats by $0.02, revenue of $3.74B beats by $30M",Seeking Alpha,https://seekingalpha.com/news/3934724-iqvia-non-gaap-eps-of-2_78-beats-0_02-revenue-of-3_74b-beats-30m?utm_source=businessinsider&utm_medium=referral,neutral,0.7397876381874084
184,2/10/2023 1:05:56 PM,"IQVIA Holdings Inc. Q4 Profit Decreases, but beats estimates",RTTNews,/news/stocks/iqvia-holdings-inc-q4-profit-decreases-but-beats-estimates-1032086096,negative,0.9628974199295044
185,2/10/2023 1:31:55 PM,IQVIA Issues 2023 Guidance ,RTTNews,/news/stocks/iqvia-issues-2023-guidance-1032086218,neutral,0.9438905119895935
186,2/10/2023 7:25:41 PM,IQVIA down despite quarterly beats on soft 2023 guidance,Seeking Alpha,https://seekingalpha.com/news/3934931-iqvia-down-despite-quarterly-beats-on-soft-2023-guidance?utm_source=businessinsider&utm_medium=referral,negative,0.9675937294960022
187,2/13/2023 11:40:05 AM,"Analysts Offer Insights on Healthcare Companies: Eli Lilly & Co (LLY), IQVIA Holdings (IQV) and Viatris (VTRS)",TipRanks,/news/stocks/analysts-offer-insights-on-healthcare-companies-eli-lilly-co-lly-iqvia-holdings-iqv-and-viatris-vtrs-1032090836,neutral,0.9209754467010498
188,2/13/2023 12:20:08 PM,"Analysts Are Bullish on Top Healthcare Stocks: Roivant Sciences (ROIV), IQVIA Holdings (IQV)",TipRanks,/news/stocks/analysts-are-bullish-on-top-healthcare-stocks-roivant-sciences-roiv-iqvia-holdings-iqv-1032090978,positive,0.5650309920310974
189,2/13/2023 12:35:19 PM,Cowen & Co. Sticks to Their Buy Rating for IQVIA Holdings (IQV),TipRanks,/news/stocks/cowen-co-sticks-to-their-buy-rating-for-iqvia-holdings-iqv-1032091010,neutral,0.8661049008369446
190,2/13/2023 1:10:23 PM,"Analysts Offer Insights on Healthcare Companies: IQVIA Holdings (IQV), Globus Medical (GMED) and Bicycle Therapeutics (BCYC)",TipRanks,/news/stocks/analysts-offer-insights-on-healthcare-companies-iqvia-holdings-iqv-globus-medical-gmed-and-bicycle-therapeutics-bcyc-1032091108,neutral,0.9064225554466248
191,2/13/2023 5:00:40 PM,Where IQVIA Hldgs Stands With Analysts,Benzinga,/news/stocks/where-iqvia-hldgs-stands-with-analysts-1032091714,neutral,0.8945249319076538
192,2/15/2023 5:05:15 AM,SVB Securities Remains a Buy on IQVIA Holdings (IQV),TipRanks,/news/stocks/svb-securities-remains-a-buy-on-iqvia-holdings-iqv-1032096536,neutral,0.9524787664413452
193,2/15/2023 5:05:31 AM,Robert W. Baird Keeps Their Buy Rating on IQVIA Holdings (IQV),TipRanks,/news/stocks/robert-w-baird-keeps-their-buy-rating-on-iqvia-holdings-iqv-1032096528,neutral,0.9241736531257629
194,2/15/2023 5:13:24 AM,"Analysts Conflicted on These Healthcare Names: IQVIA Holdings (IQV), Reata Pharmaceuticals (RETA) and Roivant Sciences (ROIV)",TipRanks,/news/stocks/analysts-conflicted-on-these-healthcare-names-iqvia-holdings-iqv-reata-pharmaceuticals-reta-and-roivant-sciences-roiv-1032096683,negative,0.7048760056495667
195,2/15/2023 7:11:38 PM,7 Hot Healthcare Stocks With the Potential to Outperform,InvestorPlace,/news/stocks/7-hot-healthcare-stocks-with-the-potential-to-outperform-1032103825,positive,0.9004145860671997
196,2/27/2023 2:01:54 PM,MannKind To Rally Around 30%? Here Are 10 Other Analyst Forecasts For Monday,Benzinga,/news/stocks/mannkind-to-rally-around-30-here-are-10-other-analyst-forecasts-for-monday-1032127583,neutral,0.9095764756202698
197,3/17/2023 2:01:29 PM,What 6 Analyst Ratings Have To Say About IQVIA Hldgs,Benzinga,/news/stocks/what-6-analyst-ratings-have-to-say-about-iqvia-hldgs-1032175766,neutral,0.9454026818275452
198,3/17/2023 3:01:39 PM,"IQVIA, a new buy at Truist on differentiated contract research organization business",Seeking Alpha,https://seekingalpha.com/news/3948558-iqvia-a-new-buy-at-truist-on-differentiated-contract-research-organization-business?utm_source=businessinsider&utm_medium=referral,neutral,0.8511984944343567
199,3/17/2023 4:00:49 PM,"Benzinga's Top Ratings Upgrades, Downgrades For March 17, 2023",Benzinga,/news/stocks/benzinga-s-top-ratings-upgrades-downgrades-for-march-17-2023-1032176100,negative,0.5074595212936401
200,3/28/2023 5:21:30 AM,"VRTX, BIIB, or IQV: Which Biotech Stock Could Deliver the Highest Return?",TipRanks,/news/stocks/vrtx-biib-or-iqv-which-biotech-stock-could-deliver-the-highest-return-1032195771,neutral,0.9018274545669556
201,4/4/2023 7:00:41 PM,The Latest Analyst Ratings for IQVIA Hldgs,Benzinga,/news/stocks/the-latest-analyst-ratings-for-iqvia-hldgs-1032214650,neutral,0.935731053352356
202,4/11/2023 8:30:18 PM,Quant Ratings Updated on 70 Stocks,InvestorPlace,/news/stocks/20230411-quant-ratings-1032225430,neutral,0.9237064719200134
203,4/26/2023 3:01:13 PM,What Wall Street expects from IQVIA's earnings,Markets Insider Automation,/news/stocks/iqvia-quarter-earnings-preview-q1-1032263694,neutral,0.9339121580123901
204,4/26/2023 3:07:35 PM,Notable earnings before Thursday's open,Seeking Alpha,https://seekingalpha.com/news/3960517-notable-earnings-before-thursdays-open?utm_source=businessinsider&utm_medium=referral,positive,0.882573127746582
205,4/26/2023 4:13:10 PM,IQVIA Q1 2023 Earnings Preview,Seeking Alpha,https://seekingalpha.com/news/3960559-iqvia-q1-2023-earnings-preview?utm_source=businessinsider&utm_medium=referral,neutral,0.8717512488365173
206,4/27/2023 11:10:21 AM,"IQVIA Non-GAAP EPS of $2.45 beats by $0.04, revenue of $3.65B beats by $40M",Seeking Alpha,https://seekingalpha.com/news/3961213-iqvia-non-gaap-eps-of-2_45-beats-0_04-revenue-of-3_65b-beats-40m?utm_source=businessinsider&utm_medium=referral,neutral,0.7682318091392517
207,4/27/2023 1:59:10 PM,"IQVIA Holdings Inc. Q1 Profit Decreases, but beats estimates",RTTNews,/news/stocks/iqvia-holdings-inc-q1-profit-decreases-but-beats-estimates-1032268373,negative,0.9640533328056335
208,4/27/2023 6:33:00 PM,"Iqvia, Icon lag contract research rivals after Q1 earnings",Seeking Alpha,https://seekingalpha.com/news/3961571-iqvia-stock-icon-stock-lag-contract-research-space-despite-q1-beats?utm_source=businessinsider&utm_medium=referral,negative,0.7426398992538452
209,4/28/2023 8:25:52 AM,Barclays Keeps Their Buy Rating on IQVIA Holdings (IQV),TipRanks,/news/stocks/barclays-keeps-their-buy-rating-on-iqvia-holdings-iqv-1032272671,neutral,0.9224793314933777
210,4/28/2023 4:02:10 PM,Expert Ratings for IQVIA Hldgs,Benzinga,/news/stocks/expert-ratings-for-iqvia-hldgs-1032274106,neutral,0.8439694046974182
211,4/28/2023 4:40:25 PM,"Analysts Offer Insights on Healthcare Companies: Baxter International (BAX), IQVIA Holdings (IQV) and Abcam (ABCM)",TipRanks,/news/stocks/analysts-offer-insights-on-healthcare-companies-baxter-international-bax-iqvia-holdings-iqv-and-abcam-abcm-1032274624,neutral,0.9226043224334717
212,5/1/2023 12:30:35 PM,Wall Street Analysts Are Bullish on Top Healthcare Picks,TipRanks,/news/stocks/wall-street-analysts-are-bullish-on-top-healthcare-picks-1032277994,positive,0.552167534828186
213,5/1/2023 3:02:33 PM,"Analysts Are Bullish on Top Healthcare Stocks: Pliant Therapeutics (PLRX), IQVIA Holdings (IQV)",TipRanks,/news/stocks/analysts-are-bullish-on-top-healthcare-stocks-pliant-therapeutics-plrx-iqvia-holdings-iqv-1032278661,positive,0.6448881030082703
214,5/1/2023 5:20:36 PM,Analysts Offer Insights on Healthcare Companies: Resmed (RMD) and IQVIA Holdings (IQV),TipRanks,/news/stocks/analysts-offer-insights-on-healthcare-companies-resmed-rmd-and-iqvia-holdings-iqv-1032278995,neutral,0.9168568849563599
215,5/2/2023 7:43:45 PM,FDA to broaden access to decentralized clinical trials,Seeking Alpha,https://seekingalpha.com/news/3963828-fda-to-broaden-access-decentralized-clinical-trials?utm_source=businessinsider&utm_medium=referral,positive,0.7559641599655151
216,5/2/2023 8:31:20 PM,Quant Ratings Updated on 122 Stocks,InvestorPlace,/news/stocks/20230502-quant-ratings-1032284093,neutral,0.9266848564147949
217,5/7/2023 4:00:27 PM,Spending on weight loss drugs to rise 378% in 2023 – 2027: report,Seeking Alpha,https://seekingalpha.com/news/3966814-spending-weight-loss-drugs-wegovy-mounjaro-2023-2027?utm_source=businessinsider&utm_medium=referral,positive,0.9277637600898743
218,5/9/2023 7:23:46 PM,IQVIA under FTC investigation over digital ads acquisition - Politico,Seeking Alpha,https://seekingalpha.com/news/3968382-iqvia-under-ftc-investigation-digital-ads-acquisition?utm_source=businessinsider&utm_medium=referral,negative,0.7036442756652832
219,5/15/2023 11:15:14 AM,ANI Pharma gains as FDA clears generics for Celontin and Fosamax,Seeking Alpha,https://seekingalpha.com/news/3971216-ani-pharma-stock-gains-on-fda-nod-for-celontin-and-fosamax-generics?utm_source=businessinsider&utm_medium=referral,positive,0.9229908585548401
220,5/15/2023 10:03:22 PM,"Druckenmiller's Duquesne adds Microsoft, IQVIA, exits Cenovus Energy, Lennar",Seeking Alpha,https://seekingalpha.com/news/3971810-druckenmillers-duquesne-adds-microsoft-iqvia-exits-cenovus-energy-lennar?utm_source=businessinsider&utm_medium=referral,neutral,0.9470711350440979
221,5/18/2023 2:56:47 PM,IQVIA To Raise $1 Bln Through Notes Offering ,RTTNews,/news/stocks/iqvia-to-raise-1-bln-through-notes-offering-1032337494,neutral,0.6460955739021301
