datetime,title,source,link,sentiment_class,sentiment_score
7/28/2021 2:00:00 PM,Marriott International Launches Enhanced Human Trafficking Awareness Training,PR Newswire,/news/stocks/marriott-international-launches-enhanced-human-trafficking-awareness-training-1030656178,positive,0.8065478205680847
7/29/2021 6:29:00 PM,Hilton Worldwide leads hotel sector higher with broad-based earnings topper,Seeking Alpha,https://seekingalpha.com/news/3721763-hilton-worldwide-leads-hotel-sector-higher-with-broad-based-earnings-topper?utm_source=markets.businessinsider.com&utm_medium=referral,positive,0.9388535618782043
8/1/2021 3:01:51 PM,Marriott earnings: here's what to expect,Markets Insider Automation,/news/stocks/marriott-stock-price-q2-earnings-preview-1030671637,neutral,0.9367507100105286
8/2/2021 5:00:00 AM,St. Regis Hotels and Resorts Makes Glamorous Debut in China's Coastal City of Qingdao,PR Newswire,/news/stocks/st-regis-hotels-and-resorts-makes-glamorous-debut-in-china-s-coastal-city-of-qingdao-1030672023,positive,0.6174063086509705
8/2/2021 2:02:49 PM,Notable earnings before Tuesday's open,Seeking Alpha,https://seekingalpha.com/news/3722982-notable-earnings-before-tuesdays-open?utm_source=markets.businessinsider.com&utm_medium=referral,positive,0.8660826683044434
8/3/2021 11:06:56 AM,"Marriott EPS beats by $0.33, misses on revenue, RevPAR increased 262.6%",Seeking Alpha,https://seekingalpha.com/news/3723694-marriott-eps-beats-0_33-misses-on-revenue?utm_source=markets.businessinsider.com&utm_medium=referral,positive,0.9494766592979431
8/3/2021 1:00:00 PM,Marriott International Reports Second Quarter 2021 Results,PR Newswire,/news/stocks/marriott-international-reports-second-quarter-2021-results-1030682380,neutral,0.7717054486274719
8/3/2021 1:04:40 PM,Marriott International Inc. Q2 adjusted earnings Beat Estimates,RTTNews,/news/stocks/marriott-international-inc-q2-adjusted-earnings-beat-estimates-1030682235,positive,0.7995014190673828
8/4/2021 6:19:28 PM,Travel stocks slump again after several conference and convention cancellations,Seeking Alpha,https://seekingalpha.com/news/3725229-travel-stocks-slump-again-after-several-conference-and-convention-cancellations?utm_source=markets.businessinsider.com&utm_medium=referral,negative,0.9735435247421265
8/19/2021 9:40:02 PM,"MRKR, MRIN, LITE and ROST among after hours movers",Seeking Alpha,https://seekingalpha.com/news/3732553-mrkr-mrin-lite-and-rost-among-after-hours-movers?utm_source=markets.businessinsider.com&utm_medium=referral,neutral,0.9427591562271118
8/24/2021 3:37:26 PM,"Hotel and leisure stocks rally on optimism over full vaccine approval, decelerating Delta",Seeking Alpha,https://seekingalpha.com/news/3733606-hotel-and-leisure-stock-rally-on-optimism-over-full-vaccine-approval-decelerating-delta?utm_source=markets.businessinsider.com&utm_medium=referral,negative,0.9372261762619019
8/25/2021 4:00:00 PM,"Check In, Ring Free W Hotels Reveals Highly Anticipated Debut Of W Philadelphia",PR Newswire,/news/stocks/check-in-ring-free-w-hotels-reveals-highly-anticipated-debut-of-w-philadelphia-1030758093,positive,0.5489787459373474
8/25/2021 4:00:00 PM,"The Ritz-Carlton Orlando, Grande Lakes Announces Exclusive Partnership With Corsa HQ To Offer Exotic Luxury Car Rentals",PR Newswire,/news/stocks/the-ritz-carlton-orlando-grande-lakes-announces-exclusive-partnership-with-corsa-hq-to-offer-exotic-luxury-car-rentals-1030758090,positive,0.8844316005706787
9/1/2021 10:15:00 PM,Marriott International CEO To Speak At Bank Of America Securities Gaming And Lodging Conference September 9; Remarks To Be Webcast,PR Newswire,/news/stocks/marriott-international-ceo-to-speak-at-bank-of-america-securities-gaming-and-lodging-conference-september-9-remarks-to-be-webcast-1030774398,neutral,0.9406219720840454
9/2/2021 9:35:22 PM,"MDB, IVAC, JOAN and MAR among after hours movers",Seeking Alpha,https://seekingalpha.com/news/3737058-mdb-ivac-joan-and-mar-among-after-hours-movers?utm_source=markets.businessinsider.com&utm_medium=referral,neutral,0.945875883102417
9/8/2021 2:37:00 PM,Marriott International Announces Debt Tender Offer,PR Newswire,/news/stocks/marriott-international-announces-debt-tender-offer-1030787123,neutral,0.8405077457427979
9/8/2021 10:15:00 PM,"Marriott International CFO To Speak At J.P. Morgan Gaming, Lodging, Restaurant & Leisure Management Access Forum September 14; Remarks To Be Webcast",PR Newswire,/news/stocks/marriott-international-cfo-to-speak-at-j-p-morgan-gaming-lodging-restaurant-leisure-management-access-forum-september-14-remarks-to-be-webcast-1030788362,neutral,0.9397963285446167
9/17/2021 7:00:20 PM,"Catalyst watch for next week: FedEx and Nike report, FOMC watch, IPO blitz",Seeking Alpha,https://seekingalpha.com/news/3740930-catalyst-watch-for-next-week-fedex-and-nike-report-fomc-watch-ipo-blitz?utm_source=markets.businessinsider.com&utm_medium=referral,neutral,0.9421775341033936
9/20/2021 5:00:00 PM,Marriott International Signs Agreement With Progetto Majestic S.r.l. To Debut The First W Hotel In Tuscany,PR Newswire,/news/stocks/marriott-international-signs-agreement-with-progetto-majestic-s-r-l-to-debut-the-first-w-hotel-in-tuscany-1030810438,positive,0.9172601103782654
9/22/2021 2:00:00 PM,Marriott International Announces Early Results and Increase in Maximum Principal Amount of its Debt Tender Offer,PR Newswire,/news/stocks/marriott-international-announces-early-results-and-increase-in-maximum-principal-amount-of-its-debt-tender-offer-1030815741,positive,0.9359924793243408
9/22/2021 4:15:00 PM,Marriott International Announces Ambition To Go Net-Zero,PR Newswire,/news/stocks/marriott-international-announces-ambition-to-go-net-zero-1030816348,neutral,0.771088719367981
9/22/2021 8:07:00 PM,Marriott International Announces Pricing of its Debt Tender Offer,PR Newswire,/news/stocks/marriott-international-announces-pricing-of-its-debt-tender-offer-1030816982,neutral,0.9020413160324097
10/1/2021 3:01:18 PM,"Merck relief rally sweeps over restaurant, hotel and travel sectors",Seeking Alpha,https://seekingalpha.com/news/3747037-merck-relief-rally-sweeps-over-restaurant-hotel-and-travel-sectors?utm_source=markets.businessinsider.com&utm_medium=referral,neutral,0.6188445687294006
10/6/2021 4:03:47 PM,"Benzinga's Top Ratings Upgrades, Downgrades For October 6, 2021",Benzinga,/news/stocks/benzinga-s-top-ratings-upgrades-downgrades-for-october-6-2021-1030847662,negative,0.5653195381164551
10/6/2021 4:30:00 PM,W Hotels Unveils W Nashville,PR Newswire,/news/stocks/w-hotels-unveils-w-nashville-1030847728,neutral,0.9025318026542664
10/7/2021 1:01:51 PM,7 Great Travel Stocks to Buy for Q4,InvestorPlace,/news/stocks/7-great-travel-stocks-to-buy-for-q4-1030850426,neutral,0.8913599252700806
10/7/2021 5:00:00 PM,Marriott International And Rakuten Announce Strategic Collaboration To Enhance Travel Experience,PR Newswire,/news/stocks/marriott-international-and-rakuten-announce-strategic-collaboration-to-enhance-travel-experience-1030850917,positive,0.9217268824577332
10/12/2021 3:00:00 PM,Marriott International and Howard University to Address Racial Equity in the Hospitality Industry,PR Newswire,/news/stocks/marriott-international-and-howard-university-to-address-racial-equity-in-the-hospitality-industry-1030859243,neutral,0.6398073434829712
10/12/2021 5:00:00 PM,St. Regis Hotels & Resorts Plans To Double Its Global Resort Portfolio Over The Next Five Years By Debuting In The World's Most Glamorous Destinations,PR Newswire,/news/stocks/st-regis-hotels-resorts-plans-to-double-its-global-resort-portfolio-over-the-next-five-years-by-debuting-in-the-world-s-most-glamorous-destinations-1030859749,positive,0.9132201075553894
10/15/2021 10:30:00 PM,Marriott International Announces Release Date For Third Quarter 2021 Earnings,PR Newswire,/news/stocks/marriott-international-announces-release-date-for-third-quarter-2021-earnings-1030870439,neutral,0.932563066482544
10/18/2021 3:00:00 PM,Marriott International Announces David Rodriguez to Retire as Global Chief Human Resources Officer,PR Newswire,/news/stocks/marriott-international-announces-david-rodriguez-to-retire-as-global-chief-human-resources-officer-1030873862,neutral,0.6943928003311157
10/19/2021 12:58:49 PM,A Peek Into The Markets: US Stock Futures Gain Ahead Of Earnings Reports,Benzinga,/news/stocks/a-peek-into-the-markets-us-stock-futures-gain-ahead-of-earnings-reports-1030876820,positive,0.8861258029937744
10/19/2021 4:02:23 PM,"Benzinga's Top Ratings Upgrades, Downgrades For October 19, 2021",Benzinga,/news/stocks/benzinga-s-top-ratings-upgrades-downgrades-for-october-19-2021-1030877920,negative,0.6003243923187256
10/24/2021 9:03:00 PM,Hedge funds outperform broader equity markets in September as value rebounds,Seeking Alpha,https://seekingalpha.com/news/3756749-hedge-funds-outperform-broader-equity-markets-in-september-as-value-rebounds?utm_source=markets.businessinsider.com&utm_medium=referral,positive,0.7856513857841492
10/28/2021 3:00:00 PM,"The Ritz-Carlton Debuts In Mexico City, Shining A New Light On This Center Of Commerce And Culture",PR Newswire,/news/stocks/the-ritz-carlton-debuts-in-mexico-city-shining-a-new-light-on-this-center-of-commerce-and-culture-1030910589,neutral,0.5415918827056885
11/2/2021 3:01:13 PM,Marriott earnings preview: what Wall Street is expecting,Markets Insider Automation,/news/stocks/marriott-stock-price-q3-earnings-preview-1030926912,neutral,0.9138761162757874
11/2/2021 3:20:21 PM,Notable earnings before Wednesday's open,Seeking Alpha,https://seekingalpha.com/news/3762968-notable-earnings-before-wednesdays-open?utm_source=markets.businessinsider.com&utm_medium=referral,positive,0.855887770652771
11/2/2021 3:56:14 PM,Marriott Q3 2021 Earnings Preview,Seeking Alpha,https://seekingalpha.com/news/3763012-marriott-q3-2021-earnings-preview?utm_source=markets.businessinsider.com&utm_medium=referral,neutral,0.44928714632987976
11/3/2021 11:03:58 AM,"Marriott EPS in-line, beats on revenue",Seeking Alpha,https://seekingalpha.com/news/3763712-marriott-eps-in-line-beats-on-revenue?utm_source=markets.businessinsider.com&utm_medium=referral,neutral,0.893427312374115
11/3/2021 12:00:00 PM,Marriott International Reports Third Quarter 2021 Results,PR Newswire,/news/stocks/marriott-international-reports-third-quarter-2021-results-1030931306,neutral,0.8118675947189331
11/3/2021 12:08:24 PM,Marriott International Inc. Q3 adjusted earnings Beat Estimates,RTTNews,/news/stocks/marriott-international-inc-q3-adjusted-earnings-beat-estimates-1030931282,positive,0.8197329640388489
11/4/2021 9:44:21 PM,What 5 Analyst Ratings Have To Say About Marriott Intl,Benzinga,/news/stocks/what-5-analyst-ratings-have-to-say-about-marriott-intl-1030939280,neutral,0.9408089518547058
11/5/2021 4:34:56 PM,Top Five Tech Stocks for 2022,InvestorPlace,/news/stocks/top-five-tech-stocks-for-2022-1030943296,neutral,0.9281807541847229
11/8/2021 3:29:42 PM,Marriott International gains as analysts stay confident on strong year ahead,Seeking Alpha,https://seekingalpha.com/news/3766833-marriott-international-gains-as-analysts-stay-confident-on-strong-year-ahead?utm_source=markets.businessinsider.com&utm_medium=referral,positive,0.8873589634895325
11/9/2021 2:30:00 PM,The Ritz-Carlton Yacht Collection Joins Marriott Bonvoy,PR Newswire,/news/stocks/the-ritz-carlton-yacht-collection-joins-marriott-bonvoy-1030953804,neutral,0.9116693735122681
11/15/2021 4:01:00 PM,JW Marriott Orlando Bonnet Creek Resort & Spa Unveils New Family Suites With Lofted Beds and Kid-Friendly Elements Designed to Create Family Moments,PR Newswire,/news/stocks/jw-marriott-orlando-bonnet-creek-resort-spa-unveils-new-family-suites-with-lofted-beds-and-kid-friendly-elements-designed-to-create-family-moments-1030976889,positive,0.5752543807029724
11/22/2021 10:15:00 PM,Marriott International CEO To Speak At Morgan Stanley Virtual Global Consumer & Retail Conference December 1; Remarks To Be Webcast,PR Newswire,/news/stocks/marriott-international-ceo-to-speak-at-morgan-stanley-virtual-global-consumer-retail-conference-december-1-remarks-to-be-webcast-1030996180,neutral,0.9404094219207764
11/24/2021 8:15:00 PM,All Marriott branded hotels in Ottawa and Gatineau are providing free rooms to support CHEO!,GlobeNewswire,/news/stocks/all-marriott-branded-hotels-in-ottawa-and-gatineau-are-providing-free-rooms-to-support-cheo-1031002132,neutral,0.6958662867546082
11/29/2021 3:04:00 PM,Travel and leisure stocks recover as Omicron anxiety fades,Seeking Alpha,https://seekingalpha.com/news/3774912-travel-and-leisure-stocks-recover-as-omicron-anxiety-fades?utm_source=markets.businessinsider.com&utm_medium=referral,negative,0.7447600960731506
11/29/2021 5:41:52 PM,7 Travel Stocks to Pack in Your Portfolio Ahead of Holiday Trips,InvestorPlace,/news/stocks/7-travel-stocks-to-pack-in-your-portfolio-ahead-of-holiday-trips-1031009723,neutral,0.9279501438140869
11/29/2021 6:26:42 PM,13 Gaming And Lodging Stocks To Buy On The Omicron Dip,Benzinga,/news/stocks/13-gaming-and-lodging-stocks-to-buy-on-the-omicron-dip-1031009703,neutral,0.8874058723449707
12/1/2021 10:05:02 AM,Omicron sets stage for U.S. to tighten travel testing requirements,Seeking Alpha,https://seekingalpha.com/news/3775670-omicron-prompts-us-to-tighten-testing-requirements-for-international-travel?utm_source=markets.businessinsider.com&utm_medium=referral,positive,0.6392790079116821
12/2/2021 6:05:39 PM,Travel stocks rebound as analysts tell investors to 'buy the dip',Seeking Alpha,https://seekingalpha.com/news/3776565-travel-stocks-rebound-as-analysts-tell-investors-to-buy-the-dip?utm_source=markets.businessinsider.com&utm_medium=referral,negative,0.7192659974098206
12/2/2021 8:13:31 PM,"Hotel Stocks: Why MAR, H, HLT, WH, CHH and IHG Are Booking Gains Today",InvestorPlace,/news/stocks/hotel-stocks-why-mar-h-hlt-wh-chh-and-ihg-are-booking-gains-today-1031021258,positive,0.9334781169891357
12/3/2021 5:24:50 PM,Market Recap: Why Are Stocks Down This Week?,InvestorPlace,/news/stocks/market-recap-why-are-stocks-down-this-week-1031023679,negative,0.9336690902709961
12/6/2021 9:47:46 PM,"Boeing, travel related stocks soar as omicron fears fade",Seeking Alpha,https://seekingalpha.com/news/3777586-boeing-travel-related-stocks-soar-as-omicron-fears-fade?utm_source=markets.businessinsider.com&utm_medium=referral,negative,0.8995238542556763
12/9/2021 3:00:00 PM,Marriott International Expects To Debut More Than 30 Luxury Hotels Across The Globe In 2022,PR Newswire,/news/stocks/marriott-international-expects-to-debut-more-than-30-luxury-hotels-across-the-globe-in-2022-1031035771,positive,0.7284687757492065
12/14/2021 4:30:00 PM,The Luxury Collection Announces New Global Explorer Caroline de Maigret,PR Newswire,/news/stocks/the-luxury-collection-announces-new-global-explorer-caroline-de-maigret-1031046435,neutral,0.9156208634376526
12/14/2021 5:05:06 PM,"Hyatt Hotels Trading At 'Unjustified' Discount, Set To Grow More Than Peers: Analyst",Benzinga,/news/stocks/hyatt-hotels-trading-at-unjustified-discount-set-to-grow-more-than-peers-analyst-1031044144,positive,0.7262445092201233
12/20/2021 12:33:06 PM,Travel stocks slump as Omicron worries cut into recovery timeline,Seeking Alpha,https://seekingalpha.com/news/3781569-travel-stocks-slump-as-omicron-worries-cut-into-recovery-timeline?utm_source=markets.businessinsider.com&utm_medium=referral,negative,0.9649784564971924
12/20/2021 3:03:00 PM,"THE LUXURY COLLECTION DEBUTS IN AUSTRALIA WITH THE OPENING OF THE TASMAN, A LUXURY COLLECTION HOTEL, HOBART",PR Newswire,/news/stocks/the-luxury-collection-debuts-in-australia-with-the-opening-of-the-tasman-a-luxury-collection-hotel-hobart-1031056435,neutral,0.6611528396606445
12/20/2021 4:48:52 PM,Monday Market News: Why Are Stocks Down Today?,InvestorPlace,/news/stocks/monday-market-news-why-are-stocks-down-today-1031057016,negative,0.9332581758499146
12/20/2021 8:10:39 PM,7 Re-Opening Stocks to Buy If Omicron Proves Mild,InvestorPlace,/news/stocks/7-re-opening-stocks-to-buy-if-omicron-proves-mild-1031057498,neutral,0.8135661482810974
12/23/2021 11:47:06 AM,BitNile Holdings' subsidiary buys a portfolio of Marriott and Hilton hotels for $69 million,Seeking Alpha,https://seekingalpha.com/news/3782934-bitnile-holdings-subsidiary-buys-a-portfolio-of-marriott-and-hilton-hotels-for-69-million?utm_source=markets.businessinsider.com&utm_medium=referral,neutral,0.8989084362983704
1/6/2022 9:57:19 PM,Apple’s Milestone Is Paving the Way for an Explosion of Wealth for Smaller Tech Companies,InvestorPlace,/news/stocks/apples-milestone-is-paving-the-way-for-an-explosion-of-wealth-for-smaller-tech-companies-1031082589,positive,0.8899950385093689
1/11/2022 9:33:24 PM,7 Travel and Tourism Stocks to Reserve Now for a Rebound in 2022,InvestorPlace,/news/stocks/7-travel-and-tourism-stocks-to-reserve-now-for-a-rebound-in-2022-bkng-rcl-mar-aal-abnb-expe-ba-1031095285,positive,0.8976965546607971
1/20/2022 1:24:00 PM,Marriott International Provides an Update on Development Progress in 2021 and Overview of Key Trends Currently Shaping Hospitality Development,PR Newswire,/news/stocks/marriott-international-provides-an-update-on-development-progress-in-2021-and-overview-of-key-trends-currently-shaping-hospitality-development-1031115679,neutral,0.8767700791358948
1/20/2022 3:34:00 PM,"THE RITZ-CARLTON, DALLAS DEBUTS MULTIMILLION DOLLAR SPA RENOVATION",PR Newswire,/news/stocks/the-ritz-carlton-dallas-debuts-multimillion-dollar-spa-renovation-1031116395,neutral,0.9094650149345398
1/20/2022 7:52:55 PM,Marriott International gains after hotel development update,Seeking Alpha,https://seekingalpha.com/news/3789991-marriott-international-gains-after-hotel-development-update?utm_source=markets.businessinsider.com&utm_medium=referral,positive,0.9327695369720459
1/20/2022 8:57:00 PM,AC HOTELS BY MARRIOT® CHARLOTTE BALLANTYNE LOCATION NOW OPEN,PR Newswire,/news/stocks/ac-hotels-by-marriot-charlotte-ballantyne-location-now-open-1031117397,neutral,0.9433597922325134
1/21/2022 10:15:00 PM,MARRIOTT INTERNATIONAL ANNOUNCES RELEASE DATE FOR FOURTH QUARTER 2021 EARNINGS,PR Newswire,/news/stocks/marriott-international-announces-release-date-for-fourth-quarter-2021-earnings-1031119934,neutral,0.9317960143089294
1/28/2022 6:15:32 PM,7 Technology Stocks Reporting Earnings the Week of January 31,InvestorPlace,/news/stocks/earnings-reports-to-watch-next-week-1028709625,neutral,0.5936209559440613
2/10/2022 3:16:22 PM,Inflation is soaring - watch these stocks for positive pricing impact,Seeking Alpha,https://seekingalpha.com/news/3798642-inflation-is-soaring-watch-these-stocks-for-positive-pricing-impact?utm_source=markets.businessinsider.com&utm_medium=referral,neutral,0.7026445269584656
2/10/2022 7:16:44 PM,Inflation 2022: 20 Stocks to Watch as Companies Hike Consumer Prices,InvestorPlace,/news/stocks/inflation-2022-20-stocks-to-watch-as-companies-hike-consumer-prices-1031183376,neutral,0.7633285522460938
2/14/2022 1:59:38 PM,Markets Eye Producer Price Index This Week,Benzinga,/news/stocks/markets-eye-producer-price-index-this-week-1031191349,neutral,0.8568657040596008
2/14/2022 2:30:00 PM,Marriott International Board of Directors Announces Board Leadership Transition and New Director,PR Newswire,/news/stocks/marriott-international-board-of-directors-announces-board-leadership-transition-and-new-director-1031191463,neutral,0.9151471853256226
2/14/2022 2:47:26 PM,"Marriott Board Elects David Marriott To Succeed J.W. Marriott, Jr. As Chairman Of Board ",RTTNews,/news/stocks/marriott-board-elects-david-marriott-to-succeed-j-w-marriott-jr-as-chairman-of-board-1031191541,neutral,0.9137009382247925
2/14/2022 3:01:13 PM,Marriott is about to announce earnings — here's what Wall Street expects,Markets Insider Automation,/news/stocks/marriott-q4-earnings-preview-1031191696,neutral,0.9333184957504272
2/14/2022 3:10:46 PM,Notable earnings before Tuesday's open,Seeking Alpha,https://seekingalpha.com/news/3799589-notable-earnings-before-tuesdays-open?utm_source=markets.businessinsider.com&utm_medium=referral,positive,0.8660826683044434
2/14/2022 5:00:00 PM,THE LUXURY COLLECTION DEBUTS IN DOMINICAN REPUBLIC'S NORTHERN COAST,PR Newswire,/news/stocks/the-luxury-collection-debuts-in-dominican-republic-s-northern-coast-1031192111,neutral,0.8864068388938904
2/14/2022 5:56:51 PM,Marriott Q4 2021 Earnings Preview,Seeking Alpha,https://seekingalpha.com/news/3799708-marriott-q4-2021-earnings-preview?utm_source=markets.businessinsider.com&utm_medium=referral,neutral,0.5025836229324341
2/15/2022 11:15:02 AM,A Peek Into The Markets: US Stock Futures Surge Amid Signs Of Easing Russia-Ukraine Tensions,Benzinga,/news/stocks/a-peek-into-the-markets-us-stock-futures-surge-amid-signs-of-easing-russia-ukraine-tensions-1031194735,positive,0.8001672625541687
2/15/2022 12:04:04 PM,"Marriott Non-GAAP EPS of $1.30 beats by $0.30, revenue of $4.45B beats by $420M",Seeking Alpha,https://seekingalpha.com/news/3799967-marriott-non-gaap-eps-of-1_30-beats-0_30-revenue-of-4_45b-beats-420m?utm_source=markets.businessinsider.com&utm_medium=referral,neutral,0.6450771689414978
2/15/2022 12:50:20 PM,Marriott International rallies after travelers waved off Omicron anxiety in Q4,Seeking Alpha,https://seekingalpha.com/news/3800011-marriott-international-rallies-after-travelers-waved-off-omicron-anxiety-in-q4?utm_source=markets.businessinsider.com&utm_medium=referral,negative,0.5460469722747803
2/15/2022 1:00:00 PM,MARRIOTT INTERNATIONAL REPORTS FOURTH QUARTER 2021 RESULTS,PR Newswire,/news/stocks/marriott-international-reports-fourth-quarter-2021-results-1031195071,neutral,0.7528883218765259
2/15/2022 1:04:46 PM,Marriott International Inc. Q4 Earnings Summary,RTTNews,/news/stocks/marriott-international-inc-q4-earnings-summary-1031195142,neutral,0.6794701218605042
2/16/2022 2:15:00 PM,Carrier to Collaborate with Marriott International to Shape Hotels of the Future,PR Newswire,/news/stocks/carrier-to-collaborate-with-marriott-international-to-shape-hotels-of-the-future-1031200509,positive,0.5124703645706177
2/17/2022 6:39:20 PM,"Airbnb Looks Like a Buy, Could Double Its Bookings in 2022",InvestorPlace,/news/stocks/airbnb-looks-like-a-buy-could-double-its-bookings-in-2022-1031206176,positive,0.9260357618331909
2/23/2022 4:45:24 PM,4 Travel Stocks To Buy in March as the Pandemic Fades,InvestorPlace,/news/stocks/4-travel-stocks-to-buy-in-march-as-the-pandemic-fades-1031222352,neutral,0.6646468043327332
2/24/2022 3:16:05 PM,Consumer stocks: Travel and leisure names are reeling but Under Armour and Kroger are holding up,Seeking Alpha,https://seekingalpha.com/news/3805218-consumer-stocks-travel-and-leisure-names-are-reeling-but-under-armour-and-kroger-are-holding-up?utm_source=markets.businessinsider.com&utm_medium=referral,negative,0.7291571497917175
2/24/2022 7:10:49 PM,7 Red-Hot Growth Stocks That Could Be Headed to the Moon ,InvestorPlace,/news/stocks/7-red-hot-growth-stocks-that-could-be-headed-to-the-moon-1031228353,neutral,0.7431973218917847
2/24/2022 10:15:00 PM,"MARRIOTT INTERNATIONAL CEO TO SPEAK AT J.P. MORGAN GAMING, LODGING, RESTAURANT & LEISURE MANAGEMENT ACCESS FORUM MARCH 7; REMARKS TO BE WEBCAST",PR Newswire,/news/stocks/marriott-international-ceo-to-speak-at-j-p-morgan-gaming-lodging-restaurant-leisure-management-access-forum-march-7-remarks-to-be-webcast-1031228742,neutral,0.9370627403259277
3/1/2022 11:00:11 AM,The 5 Best ETFs to Buy for March 2022,InvestorPlace,/news/stocks/the-5-best-etfs-to-buy-for-march-2022-1031242139,neutral,0.9145509600639343
3/1/2022 3:00:00 PM,"MARRIOTT INTERNATIONAL DEBUTS ITS 8,000th PROPERTY WITH THE NEWLY OPENED MARRIOTT BETHESDA DOWNTOWN AT MARRIOTT HQ",PR Newswire,/news/stocks/marriott-international-debuts-its-8-000th-property-with-the-newly-opened-marriott-bethesda-downtown-at-marriott-hq-1031243155,neutral,0.6661351323127747
3/2/2022 3:00:00 PM,Marriott Bonvoy® and NCAA® Kick Off Spring Travel with Unrivaled Experiences at March Madness® Destinations,PR Newswire,/news/stocks/marriott-bonvoy-and-ncaa-kick-off-spring-travel-with-unrivaled-experiences-at-march-madness-destinations-1031247913,neutral,0.5904438495635986
3/2/2022 7:25:29 PM,7 Top Growth Stocks to Carry You Through 2022,InvestorPlace,/news/stocks/7-top-growth-stocks-to-carry-you-through-2022-1031248913,neutral,0.6402541399002075
3/4/2022 3:39:00 PM,SHOWTIME® AND THE RITZ-CARLTON TRANSFORM PRESIDENTIAL SUITES TO THE FIRST LADY SUITES AHEAD OF NEW SERIES DEBUT,PR Newswire,/news/stocks/showtime-and-the-ritz-carlton-transform-presidential-suites-to-the-first-lady-suites-ahead-of-new-series-debut-1031255510,neutral,0.9326802492141724
3/8/2022 5:40:48 PM,Travel and leisure stocks bounce back from oil and war fears,Seeking Alpha,https://seekingalpha.com/news/3810730-travel-and-leisure-stocks-bounce-back-from-oil-and-war-fears?utm_source=markets.businessinsider.com&utm_medium=referral,positive,0.7401708960533142
3/10/2022 7:48:48 PM,Consumers Call for Boycotts of Companies Not Leaving Russia. List of 9 Staying Put.,InvestorPlace,/news/stocks/consumers-call-for-boycotts-of-companies-not-leaving-russia-list-of-9-staying-put-1031263421,negative,0.8671033382415771
3/22/2022 4:00:00 PM,MARRIOTT INTERNATIONAL SIGNS AGREEMENT WITH BARAKA LODGES LTD. TO OPEN FIRST LUXURY SAFARI LODGE IN AFRICA,PR Newswire,/news/stocks/marriott-international-signs-agreement-with-baraka-lodges-ltd-to-open-first-luxury-safari-lodge-in-africa-1031298854,positive,0.9358322024345398
3/25/2022 10:07:42 PM,3 Travel Stocks to Buy Ahead of Spring Break 2022,InvestorPlace,/news/stocks/3-travel-stocks-to-buy-ahead-of-spring-break-2022-1031309290,neutral,0.8976797461509705
3/28/2022 10:00:48 PM,The 10 Entertainment Stocks to Buy for 2022 and Beyond,InvestorPlace,/news/stocks/the-10-entertainment-stocks-to-buy-for-2022-and-beyond-1031313307,neutral,0.9097188711166382
