datetime,title,source,link,sentiment_class,sentiment_score
3/7/2019 4:39:01 PM,"UPDATE 1-Marriott CEO apologies for data breach, vows improvements",Reuters,http://feeds.reuters.com/~r/reuters/companyNews/~3/YdCbSBZvDNQ/update-1-marriott-ceo-apologies-for-data-breach-vows-improvements-idUSL1N20U0PZ,negative,0.6840395331382751
3/7/2019 5:01:24 PM,"UPDATE 2-Marriott CEO apologizes for data breach, vows improvements",Reuters,http://feeds.reuters.com/~r/reuters/companyNews/~3/dkkPIouFXZ4/update-2-marriott-ceo-apologizes-for-data-breach-vows-improvements-idUSL1N20U0PZ,negative,0.894191563129425
3/7/2019 5:03:23 PM,"Marriott CEO apologizes for data breach, vows improvements",Reuters,http://feeds.reuters.com/~r/reuters/INbusinessNews/~3/9DTRukps4Cw/marriott-ceo-apologizes-for-data-breach-vows-improvements-idINKCN1QO1WX,negative,0.7729489803314209
3/7/2019 5:09:15 PM,"Marriott CEO apologizes for data breach, vows improvements",Reuters,http://feeds.reuters.com/~r/reuters/businessNews/~3/j3C1MPH5Crw/marriott-ceo-apologizes-for-data-breach-vows-improvements-idUSKCN1QO217,negative,0.7729489803314209
3/7/2019 6:54:53 PM,"UPDATE 3-Marriott CEO apologizes for data breach, unsure if China responsible",Reuters,http://feeds.reuters.com/~r/reuters/companyNews/~3/obyTqJiRz0g/update-3-marriott-ceo-apologizes-for-data-breach-unsure-if-china-responsible-idUSL1N20U0PZ,negative,0.917061448097229
3/7/2019 7:05:31 PM,"Marriott CEO apologizes for data breach, unsure if China responsible",Reuters,http://feeds.reuters.com/~r/reuters/businessNews/~3/XBKqiGlR7vI/marriott-ceo-apologizes-for-data-breach-unsure-if-china-responsible-idUSKCN1QO217,negative,0.7662088871002197
3/15/2019 3:56:47 PM,Marriott evaluates investor Jonathan Litt's nomination for board seat,Reuters,http://feeds.reuters.com/~r/reuters/businessNews/~3/cLllGId-hOM/marriott-evaluates-investor-jonathan-litts-nomination-for-board-seat-idUSKCN1QW23N,neutral,0.9201922416687012
3/15/2019 4:20:37 PM,UPDATE 1-Marriott evaluates investor Jonathan Litt's nomination for board seat,Reuters,http://feeds.reuters.com/~r/reuters/companyNews/~3/Gf_WRiz96KA/update-1-marriott-evaluates-investor-jonathan-litts-nomination-for-board-seat-idUSL3N2123ZP,neutral,0.9100257158279419
3/18/2019 11:14:53 AM,Marriott forecasts full-year profit of $7.65-$8.50 per share by 2021,Reuters,http://feeds.reuters.com/~r/reuters/companyNews/~3/H8RljMVtDTc/marriott-forecasts-full-year-profit-of-7-65-8-50-per-share-by-2021-idUSL3N2152RO,neutral,0.8733971118927002
3/18/2019 11:16:36 AM,"Marriott Announces Three-Year Growth Plan; Plans To Open More Than 1,700 Hotels ",RTTNews,/news/stocks/marriott-announces-three-year-growth-plan-plans-to-open-more-than-1-700-hotels-1028037135,positive,0.7910458445549011
3/18/2019 11:36:35 AM,UPDATE 1-Marriott forecasts full-year profit of $7.65-$8.50 per share by 2021,Reuters,http://feeds.reuters.com/~r/reuters/companyNews/~3/B8eurjaza6Q/update-1-marriott-forecasts-full-year-profit-of-7-65-8-50-per-share-by-2021-idUSL3N2152SL,neutral,0.7981014251708984
3/18/2019 11:45:49 AM,Marriott forecasts full-year profit of $7.65-$8.50 per share by 2021,Reuters,http://feeds.reuters.com/~r/reuters/INbusinessNews/~3/ONRBZJrpVa4/marriott-forecasts-full-year-profit-of-7-65-8-50-per-share-by-2021-idINKCN1QZ11W,neutral,0.8733971118927002
3/18/2019 12:33:53 PM,"UPDATE 2-Marriott to open 1,700 hotels, return $11 bln to shareholders by 2021",Reuters,http://feeds.reuters.com/~r/reuters/companyNews/~3/zFoUe8lmgSQ/update-2-marriott-to-open-1700-hotels-return-11-bln-to-shareholders-by-2021-idUSL3N2152SL,neutral,0.8275898694992065
3/18/2019 12:34:56 PM,"Marriott to open 1,700 hotels, return $11 billion to shareholders by 2021",Reuters,http://feeds.reuters.com/~r/reuters/INbusinessNews/~3/sAIbj2sd9hg/marriott-to-open-1700-hotels-return-11-billion-to-shareholders-by-2021-idINKCN1QZ11W,neutral,0.831465482711792
3/18/2019 12:35:08 PM,"Marriott to open 1,700 hotels, return $11 billion to shareholders by 2021",Reuters,http://feeds.reuters.com/~r/reuters/businessNews/~3/jbiEVA-Ey_A/marriott-to-open-1700-hotels-return-11-billion-to-shareholders-by-2021-idUSKCN1QZ0ZS,neutral,0.831465482711792
3/18/2019 3:03:37 PM,"Marriott Plans To Open More Than 1,700 Hotels Over The Next Three ",RTTNews,/news/stocks/marriott-plans-to-open-more-than-1-700-hotels-over-the-next-three-1028038301,neutral,0.733787477016449
3/18/2019 5:28:19 PM,"UPDATE 3-Marriott to open 1,700 hotels, return $11 bln to shareholders by 2021",Reuters,http://feeds.reuters.com/~r/reuters/companyNews/~3/hy6EUKfLXSI/update-3-marriott-to-open-1700-hotels-return-11-bln-to-shareholders-by-2021-idUSL3N2152SL,neutral,0.8213132619857788
3/18/2019 7:14:00 PM,Times Square Hotel Trust -- Moody's affirms the CTL rating of Times Square Hotel Trust,Moodys,/news/bonds/times-square-hotel-trust-moody-s-affirms-the-ctl-rating-of-times-square-hotel-trust-1028039067,neutral,0.8497167825698853
3/18/2019 7:18:00 PM,Times Square Hotel Trust 8.528% Mortgage and Lease Amortizing Certificates -- Moody's affirms the CTL rating of Times Square Hotel Trust,Moodys,/news/bonds/times-square-hotel-trust-8-528-mortgage-and-lease-amortizing-certificates-moody-s-affirms-the-ctl-rating-of-times-square-hotel-trust-1028039074,neutral,0.8343833088874817
4/4/2019 3:16:42 PM,Marriott Announces Its Expansion Plans In Asia-Pacific - Quick Facts ,RTTNews,/news/stocks/marriott-announces-its-expansion-plans-in-asia-pacific-quick-facts-1028086459,neutral,0.8276128768920898
4/8/2019 4:40:49 PM,Marriott International  To Add 19 Properties In Middle East And Africa Region ,RTTNews,/news/stocks/marriott-international-to-add-19-properties-in-middle-east-and-africa-region-1028093347,positive,0.5168389678001404
4/11/2019 3:03:08 PM,Marriott says variety of brands is a strength not weakness,Reuters,http://feeds.reuters.com/~r/reuters/companyNews/~3/bI-LX7QJY0M/marriott-says-variety-of-brands-is-a-strength-not-weakness-idUSL3N21T1R9,neutral,0.8686873316764832
4/11/2019 3:37:01 PM,Marriott says variety of brands is a strength not weakness,Reuters,http://feeds.reuters.com/~r/reuters/INbusinessNews/~3/EGZ3DXEdCUQ/marriott-says-variety-of-brands-is-a-strength-not-weakness-idINKCN1RN1TA,neutral,0.8686873316764832
4/11/2019 4:25:58 PM,REFILE-Marriott says variety of brands is a strength not weakness,Reuters,http://feeds.reuters.com/~r/reuters/companyNews/~3/yGjCpRtvX0E/refile-marriott-says-variety-of-brands-is-a-strength-not-weakness-idUSL3N21T1R9,neutral,0.8348027467727661
5/3/2019 1:07:57 PM,Marriott CEO diagnosed with stage 2 pancreatic cancer,Reuters,http://feeds.reuters.com/~r/reuters/companyNews/~3/5V43KK6jqyM/marriott-ceo-diagnosed-with-stage-2-pancreatic-cancer-idUSL3N22F1QO,neutral,0.49874863028526306
5/3/2019 1:29:38 PM,UPDATE 1-Marriott says Sorenson to remain CEO while being treated for pancreatic cancer,Reuters,http://feeds.reuters.com/~r/reuters/companyNews/~3/BnRbVW6d9JM/update-1-marriott-says-sorenson-to-remain-ceo-while-being-treated-for-pancreatic-cancer-idUSL3N22F1QU,neutral,0.8764925003051758
5/8/2019 3:03:37 PM,Marriott earnings: here's what to expect,Markets Insider Automation,/news/stocks/marriott-stock-price-q1-earnings-preview-1028181865,neutral,0.9367507100105286
5/10/2019 12:24:26 PM,Marriott quarterly profit beats on higher room rates,Reuters,http://feeds.reuters.com/~r/reuters/companyNews/~3/LUPIPrYmwno/marriott-quarterly-profit-beats-on-higher-room-rates-idUSL3N22M34D,positive,0.8518773317337036
5/10/2019 12:25:00 PM,Marriott International Inc. Q1 adjusted earnings Beat Estimates,RTTNews,/news/stocks/marriott-international-inc-q1-adjusted-earnings-beat-estimates-1028189506,positive,0.8192822337150574
5/10/2019 12:48:24 PM,UPDATE 1-Marriott quarterly profit beats on lower tax rate,Reuters,http://feeds.reuters.com/~r/reuters/companyNews/~3/uEJejiqmNc4/update-1-marriott-quarterly-profit-beats-on-lower-tax-rate-idUSL3N22M34K,positive,0.8036205172538757
5/10/2019 12:57:11 PM,Marriott International Boosts FY19 Earnings Outlook - Quick Facts ,RTTNews,/news/stocks/marriott-international-boosts-fy19-earnings-outlook-quick-facts-1028189602,positive,0.9146736860275269
5/10/2019 2:21:22 PM,"UPDATE 2-Marriott profit beats on lower tax bill, higher room prices",Reuters,http://feeds.reuters.com/~r/reuters/companyNews/~3/020AYqKTUO0/update-2-marriott-profit-beats-on-lower-tax-bill-higher-room-prices-idUSL3N22M34K,positive,0.8830617666244507
6/3/2019 11:48:00 PM,Hospitality Properties Trust -- Moody's reviews Hospitality Properties Trust for downgrade on acquisition announcement,Moodys,/news/bonds/hospitality-properties-trust-moody-s-reviews-hospitality-properties-trust-for-downgrade-on-acquisition-announcement-1028250399,negative,0.802111804485321
6/10/2019 3:51:00 PM,Morgan Stanley BAML Tr 2013-C9 -- Moody's affirms sixteen classes of MSBAM 2013-C9,Moodys,/news/bonds/morgan-stanley-baml-tr-2013-c9-moody-s-affirms-sixteen-classes-of-msbam-2013-c9-1028266766,neutral,0.8693381547927856
6/10/2019 4:08:00 PM,Morgan Stanley Bank of America Merrill Lynch Trust 2013-C9 -- Moody's affirms sixteen classes of MSBAM 2013-C9,Moodys,/news/bonds/morgan-stanley-bank-of-america-merrill-lynch-trust-2013-c9-moody-s-affirms-sixteen-classes-of-msbam-2013-c9-1028266889,neutral,0.8650909662246704
6/11/2019 11:40:00 AM,Morgan Stanley Bank of America Merrill Lynch Trust 2013-C9 -- Moody's affirms sixteen classes of MSBAM 2013-C9,Moodys,/news/bonds/morgan-stanley-bank-of-america-merrill-lynch-trust-2013-c9-moody-s-affirms-sixteen-classes-of-msbam-2013-c9-1028268928,neutral,0.8650909662246704
6/27/2019 3:13:47 PM,Marriott Int'l To Spend $500 Mln With Women-Owned Businesses In 2019 ,RTTNews,/news/stocks/marriott-int-l-to-spend-500-mln-with-women-owned-businesses-in-2019-1028313916,neutral,0.7960058450698853
7/3/2019 11:50:17 AM,A Dominant Cloud Infrastructure Makes Alibaba Stock Seem Invincible,InvestorPlace,/news/stocks/infrastructure-alibaba-stock-invincible-1028329314,neutral,0.6713064908981323
7/9/2019 2:54:13 PM,ICO Plans To Fine Marriott On Database Security Incident; Marriott To Contest ,RTTNews,/news/stocks/ico-plans-to-fine-marriott-on-database-security-incident-marriott-to-contest-1028338499,negative,0.9368002414703369
7/9/2019 3:28:06 PM,UK watchdog proposes to fine Marriott $124 mln for data breach,Reuters,http://feeds.reuters.com/~r/reuters/companyNews/~3/UBvoUBqOygM/uk-watchdog-proposes-to-fine-marriott-124-mln-for-data-breach-idUSL4N24A2MG,negative,0.9356478452682495
7/9/2019 3:32:52 PM,UK watchdog proposes to fine Marriott $124 million for data breach,Reuters,http://feeds.reuters.com/~r/reuters/INbusinessNews/~3/GIJMx5bhKh0/uk-watchdog-proposes-to-fine-marriott-124-million-for-data-breach-idINKCN1U41IX,negative,0.9298065900802612
7/9/2019 6:45:35 PM,"Washington, D.C. attorney general sues Marriott for 'deceptive' resort fees",Reuters,http://feeds.reuters.com/~r/reuters/companyNews/~3/CqFW8fIhqQE/washington-d-c-attorney-general-sues-marriott-for-deceptive-resort-fees-idUSL2N24A0OK,negative,0.9551177024841309
7/9/2019 8:00:01 PM,"UPDATE 1-Washington, D.C. attorney general sues Marriott for deceptive resort fees",Reuters,http://feeds.reuters.com/~r/reuters/companyNews/~3/lFXfkatH-PE/update-1-washington-d-c-attorney-general-sues-marriott-for-deceptive-resort-fees-idUSL2N24A0U1,negative,0.9404017329216003
7/9/2019 9:23:05 PM,UPDATE 2-Marriott sued by District of Columbia over resort fees,Reuters,http://feeds.reuters.com/~r/reuters/companyNews/~3/kbGRIHIQp5o/update-2-marriott-sued-by-district-of-columbia-over-resort-fees-idUSL2N24A0U1,negative,0.9525086283683777
7/10/2019 3:49:07 AM,D.C. Attorney General Sues Marriott Over Resort Fees ,RTTNews,/news/stocks/d-c-attorney-general-sues-marriott-over-resort-fees-1028340426,negative,0.9553927183151245
7/10/2019 6:19:03 PM,The Proposed Marriott Fine for Starwood Data Breach Is Massive,InvestorPlace,/news/stocks/starwood-data-breach-marriott-fine-1028344457,negative,0.5266643166542053
7/11/2019 12:16:19 AM,DC AG Sues Marriott For Charging Deceptive Fees And Misleading Customers ,RTTNews,/news/stocks/dc-ag-sues-marriott-for-charging-deceptive-fees-and-misleading-customers-1028344136,negative,0.9446020126342773
8/4/2019 3:01:57 PM,What Wall Street expects from Marriott's earnings,Markets Insider Automation,/news/stocks/marriott-q2-quarterly-earnings-preview-stock-1028414550,neutral,0.9255053400993347
8/5/2019 10:37:48 PM,Marriott reports 2% drop in quarterly revenue,Reuters,http://feeds.reuters.com/~r/reuters/companyNews/~3/rsm2kSCF3-M/marriott-reports-2-drop-in-quarterly-revenue-idUSL4N2514N9,negative,0.9755487442016602
8/5/2019 10:40:15 PM,Marriott International Inc. Q2 adjusted earnings Inline With Estimates,RTTNews,/news/stocks/marriott-international-inc-q2-adjusted-earnings-inline-with-estimates-1028418837,neutral,0.6450685262680054
8/5/2019 11:10:22 PM,Marriott Announces All-inclusive Resort Platform - Quick Facts ,RTTNews,/news/stocks/marriott-announces-all-inclusive-resort-platform-quick-facts-1028418910,neutral,0.8281749486923218
8/5/2019 11:10:46 PM,"UPDATE 1-Marriott cuts full-year forecast for key revenue measure, shares fall",Reuters,http://feeds.reuters.com/~r/reuters/companyNews/~3/ionFYnWsvDc/update-1-marriott-cuts-full-year-forecast-for-key-revenue-measure-shares-fall-idUSL4N2514OH,negative,0.9568211436271667
8/6/2019 8:55:00 PM,"Host Hotels & Resorts, L.P. -- Moody's announces completion of a periodic review of ratings of Host Hotels & Resorts, L.P.",Moodys,/news/bonds/host-hotels-resorts-l-p-moody-s-announces-completion-of-a-periodic-review-of-ratings-of-host-hotels-resorts-l-p-1028423470,neutral,0.8432081937789917
8/7/2019 4:02:46 PM,6 Big Growth ETFs to Buy For the Second Half of 2019,InvestorPlace,/news/stocks/6-big-growth-etfs-to-buy-for-the-second-half-of-2019-1028429004,neutral,0.7851018905639648
8/19/2019 7:38:00 PM,Ashford Hospitality Trust 2018-KEYS -- Moody's affirms seven CMBS classes of AHT 2018-KEYS,Moodys,/news/bonds/ashford-hospitality-trust-2018-keys-moody-s-affirms-seven-cmbs-classes-of-aht-2018-keys-1028456832,neutral,0.843548059463501
8/28/2019 1:30:20 PM,Marriott Announces Global Program To Prevent Shower Toiletry Bottles ,RTTNews,/news/stocks/marriott-announces-global-program-to-prevent-shower-toiletry-bottles-1028480267,positive,0.5379124283790588
8/28/2019 5:39:25 PM,Marriott Plastics Ban: Mini Shampoo Bottles to Join Plastic Straws on the ‘Not Welcome’ List,InvestorPlace,/news/stocks/marriott-plastics-ban-expanding-to-shampoo-bottles-1028482679,neutral,0.638973593711853
8/29/2019 2:25:51 PM,Marriott To Eliminate Single-use Toiletry Bottles By 2020 ,RTTNews,/news/stocks/marriott-to-eliminate-single-use-toiletry-bottles-by-2020-1028484302,neutral,0.806465744972229
9/24/2019 5:47:31 PM,Be Your Own Landlord With These 3 Monthly Paying REITs,InvestorPlace,/news/stocks/be-your-own-landlord-with-these-3-monthly-paying-reits-1028550792,neutral,0.9479923248291016
9/25/2019 10:12:48 AM,Indian owner of Marriott-operated hotels files for IPO,Reuters,http://feeds.reuters.com/~r/reuters/companyNews/~3/BkstbiYJ5k4/indian-owner-of-marriott-operated-hotels-files-for-ipo-idUSL3N26G1XC,neutral,0.8810184001922607
9/25/2019 10:54:50 AM,Indian owner of Marriott-operated hotels files for IPO,Reuters,http://feeds.reuters.com/~r/reuters/INbusinessNews/~3/ibrF5Ab8H_A/indian-owner-of-marriott-operated-hotels-files-for-ipo-idINKBN1WA0TW,neutral,0.8810184001922607
9/30/2019 6:14:00 PM,"Starwood Hotels & Resorts Worldwide Inc. -- Moody's announces completion of a periodic review of ratings of Marriott International, Inc.",Moodys,/news/bonds/starwood-hotels-resorts-worldwide-inc-moody-s-announces-completion-of-a-periodic-review-of-ratings-of-marriott-international-inc-1028564162,neutral,0.8038541078567505
9/30/2019 6:29:00 PM,COMM 2015-CCRE25 Mortgage Trust -- Moody's affirms seven classes of COMM 2015-CCRE25,Moodys,/news/bonds/comm-2015-ccre25-mortgage-trust-moody-s-affirms-seven-classes-of-comm-2015-ccre25-1028564198,neutral,0.9090205430984497
9/30/2019 6:40:00 PM,COMM 2015-CCRE25 Mortgage Trust -- Moody's affirms seven classes of COMM 2015-CCRE25,Moodys,/news/bonds/comm-2015-ccre25-mortgage-trust-moody-s-affirms-seven-classes-of-comm-2015-ccre25-1028564226,neutral,0.9090205430984497
9/30/2019 7:06:00 PM,"Moody's -  US lodging and cruise industry outlook revised to stable from positive on slowing RevPAR, net yield growth",Moodys,/news/bonds/moody-s-us-lodging-and-cruise-industry-outlook-revised-to-stable-from-positive-on-slowing-revpar-net-yield-growth-1028564287,negative,0.5014690160751343
10/11/2019 3:05:00 PM,BANK 2017-BNK5 -- Moody's affirms eight classes of BANK 2017-BNK5,Moodys,/news/bonds/bank-2017-bnk5-moody-s-affirms-eight-classes-of-bank-2017-bnk5-1028593543,neutral,0.8857851624488831
10/11/2019 3:09:00 PM,BANK 2017-BNK5 -- Moody's affirms eight classes of BANK 2017-BNK5,Moodys,/news/bonds/bank-2017-bnk5-moody-s-affirms-eight-classes-of-bank-2017-bnk5-1028593556,neutral,0.8857851624488831
10/11/2019 3:12:00 PM,BANK 2017-BNK5 -- Moody's affirms eight classes of BANK 2017-BNK5,Moodys,/news/bonds/bank-2017-bnk5-moody-s-affirms-eight-classes-of-bank-2017-bnk5-1028593555,neutral,0.8857851624488831
10/18/2019 8:53:13 AM,Marriott To Buy Elegant Hotels In $130.1 Mln Deal ,RTTNews,/news/stocks/marriott-to-buy-elegant-hotels-in-130-1-mln-deal-1028609979,neutral,0.8650591969490051
11/4/2019 9:57:15 PM,"Marriott Earnings: MAR Stock Drops 2% on Q3 EPS Miss, Weak Outlook",InvestorPlace,/news/stocks/marriott-earnings-hit-mar-stock-1028657439,negative,0.9725512862205505
11/4/2019 10:35:17 PM,Marriott International Inc. Q3 adjusted earnings Miss Estimates,RTTNews,/news/stocks/marriott-international-inc-q3-adjusted-earnings-miss-estimates-1028657230,negative,0.9426724910736084
11/8/2019 11:09:00 PM,UBS Commercial Mortgage Trust 2017-C2 -- Moody's affirms six classes of UBS 2017-C2,Moodys,/news/bonds/ubs-commercial-mortgage-trust-2017-c2-moody-s-affirms-six-classes-of-ubs-2017-c2-1028674795,neutral,0.8923882246017456
12/10/2019 3:34:00 AM,Morgan Stanley BofA Merrill Lynch Tr 2014-C18 -- Moody's upgrades one and affirms six classes of MSBAM 2014-C18,Moodys,/news/bonds/morgan-stanley-bofa-merrill-lynch-tr-2014-c18-moody-s-upgrades-one-and-affirms-six-classes-of-msbam-2014-c18-1028749210,neutral,0.7758511304855347
12/10/2019 3:43:00 AM,Morgan Stanley Bank of America Merrill Lynch Trust 2014-C18 -- Moody's upgrades one and affirms six classes of MSBAM 2014-C18,Moodys,/news/bonds/morgan-stanley-bank-of-america-merrill-lynch-trust-2014-c18-moody-s-upgrades-one-and-affirms-six-classes-of-msbam-2014-c18-1028749214,neutral,0.7845830321311951
12/23/2019 5:47:00 PM,Moody's affirms eight classes of WFCM 2017-C38,Moodys,/news/bonds/moody-s-affirms-eight-classes-of-wfcm-2017-c38-1028782729,neutral,0.8976528644561768
12/23/2019 5:51:00 PM,Wells Fargo Commercial Mortgage Trust 2017-C38 -- Moody's affirms eight classes of WFCM 2017-C38,Moodys,/news/bonds/wells-fargo-commercial-mortgage-trust-2017-c38-moody-s-affirms-eight-classes-of-wfcm-2017-c38-1028782728,neutral,0.8596545457839966
1/2/2020 8:10:42 AM,Marriott Faces $300K Discrimination Lawsuit ,RTTNews,/news/stocks/marriott-faces-300k-discrimination-lawsuit-1028790694,negative,0.9568519592285156
1/22/2020 6:07:03 PM,3 Travel Stocks to Sell Now Before It’s Too Late,InvestorPlace,/news/stocks/3-travel-stocks-sell-now-ccl-wynn-mar-1028837162,neutral,0.9058157205581665
2/24/2020 3:58:56 PM,Travel sector sees wave of selling pressure,Seeking Alpha,https://seekingalpha.com/news/3544832-travel-sector-sees-wave-of-selling-pressure?utm_source=markets.businessinsider.com&utm_medium=referral,negative,0.7733771204948425
2/25/2020 3:01:47 PM,Marriott earnings: here's what to expect,Markets Insider Automation,/news/stocks/marriott-stock-q4-earnings-preview-1028936260,neutral,0.9367507100105286
2/25/2020 10:35:28 PM,Marriott Q4 2019 Earnings Preview,Seeking Alpha,https://seekingalpha.com/news/3545370-marriott-q4-2019-earnings-preview?utm_source=markets.businessinsider.com&utm_medium=referral,neutral,0.6315202116966248
2/25/2020 10:35:42 PM,Notable earnings after Wednesday's close,Seeking Alpha,https://seekingalpha.com/news/3545292-notable-earnings-after-wednesdays-close?utm_source=markets.businessinsider.com&utm_medium=referral,positive,0.8919200301170349
2/26/2020 10:35:39 PM,Marriott International Inc. Q4 adjusted earnings Beat Estimates,RTTNews,/news/stocks/marriott-international-inc-q4-adjusted-earnings-beat-estimates-1028943158,positive,0.8514392971992493
2/26/2020 10:39:55 PM,Marriott quarterly profit falls 12%,Reuters,http://feeds.reuters.com/~r/reuters/companyNews/~3/KOOysEF4g4o/marriott-quarterly-profit-falls-12-idUSL3N2AQ4P3,negative,0.9711315631866455
2/27/2020 2:12:33 PM,Nomura sees value in Marriott despite coronavirus overhang,Seeking Alpha,https://seekingalpha.com/news/3546516-nomura-sees-value-in-marriott-despite-coronavirus-overhang?utm_source=markets.businessinsider.com&utm_medium=referral,positive,0.6617596745491028
3/3/2020 4:57:29 PM,Jefferies expects negative earnings revisions in hotel sector,Seeking Alpha,https://seekingalpha.com/news/3548112-jefferies-expects-negative-earnings-revisions-in-hotel-sector?utm_source=markets.businessinsider.com&utm_medium=referral,negative,0.9715486764907837
3/6/2020 2:17:38 PM,"CY, VALE among premarket losers",Seeking Alpha,https://seekingalpha.com/news/3549397-cy-vale-among-premarket-losers?utm_source=markets.businessinsider.com&utm_medium=referral,neutral,0.8231397271156311
3/9/2020 2:16:24 PM,Raymond James dives into hotel sector disruption,Seeking Alpha,https://seekingalpha.com/news/3549757-raymond-james-dives-hotel-sector-disruption?utm_source=markets.businessinsider.com&utm_medium=referral,neutral,0.7400776743888855
3/12/2020 2:55:41 PM,UBS talks lodging amid seismic disruption,Seeking Alpha,https://seekingalpha.com/news/3551093-ubs-talks-lodging-amid-seismic-disruption?utm_source=markets.businessinsider.com&utm_medium=referral,negative,0.811465859413147
3/12/2020 8:30:05 PM,Stock Market Today: Trading Halted; Bear Market in Record Time,InvestorPlace,/news/stocks/stock-market-today-trading-halted-bear-market-in-record-time-1028991839,negative,0.9550850987434387
3/17/2020 5:09:42 PM,Marriott to furlough tens of thousands of employees - WSJ,Reuters,http://feeds.reuters.com/~r/reuters/companyNews/~3/l-Vm43X28ZM/marriott-to-furlough-tens-of-thousands-of-employees-wsj-idUSL4N2BA4IO,negative,0.6364932656288147
3/17/2020 5:37:25 PM,UPDATE 1-Marriott starts furloughing tens of thousands of employees - WSJ,Reuters,http://feeds.reuters.com/~r/reuters/companyNews/~3/vnKgbtEd3Ao/update-1-marriott-starts-furloughing-tens-of-thousands-of-employees-wsj-idUSL4N2BA4IT,neutral,0.7573798894882202
3/18/2020 7:30:44 AM,Hotel industry next to make bailout case,Seeking Alpha,https://seekingalpha.com/news/3552771-hotel-industry-next-to-make-bailout-case?utm_source=markets.businessinsider.com&utm_medium=referral,neutral,0.8848630785942078
3/18/2020 5:20:30 PM,Hotel stocks pummeled as uncertainty weighs,Seeking Alpha,https://seekingalpha.com/news/3553026-hotel-stocks-pummeled-uncertainty-weighs?utm_source=markets.businessinsider.com&utm_medium=referral,negative,0.8671680092811584
3/18/2020 9:09:37 PM,Marriott looks to preserve cash ahead of brutal stretch,Seeking Alpha,https://seekingalpha.com/news/3553158-marriott-looks-to-preserve-cash-ahead-of-brutal-stretch?utm_source=markets.businessinsider.com&utm_medium=referral,positive,0.5743979811668396
3/18/2020 10:02:23 PM,Marriott withdraws 2020 outlook,Reuters,http://feeds.reuters.com/~r/reuters/companyNews/~3/LTVfOYPYF44/marriott-withdraws-2020-outlook-idUSL4N2BB55Z,negative,0.6219640970230103
3/18/2020 10:22:17 PM,UPDATE 1-Marriott withdraws 2020 outlook as cancellations mount due to coronavirus,Reuters,http://feeds.reuters.com/~r/reuters/companyNews/~3/LjhQUgJiGb8/update-1-marriott-withdraws-2020-outlook-as-cancellations-mount-due-to-coronavirus-idUSL4N2BB57A,negative,0.9651910066604614
3/18/2020 10:27:38 PM,Marriott withdraws 2020 outlook as cancellations mount due to coronavirus,Reuters,http://feeds.reuters.com/~r/reuters/businessNews/~3/gwR9RrXufL8/marriott-withdraws-2020-outlook-as-cancellations-mount-due-to-coronavirus-idUSKBN2153VN,negative,0.9647625088691711
3/19/2020 11:42:52 AM,Trade of the Day: Marriott Stock Finds Long-Term Technical Support,InvestorPlace,/news/stocks/trade-of-the-day-marriott-stock-finds-long-term-technical-support-1029012967,positive,0.9433902502059937
3/19/2020 12:46:16 PM,Nomura indicates Hilton isn't going to zero,Seeking Alpha,https://seekingalpha.com/news/3553331-nomura-indicates-hilton-isnt-going-to-zero?utm_source=markets.businessinsider.com&utm_medium=referral,neutral,0.830589234828949
3/20/2020 1:14:29 PM,Covid-19 worse than GFC and 9/11 combined - Marriott CEO,Seeking Alpha,https://seekingalpha.com/news/3553765-covidminus-19-worse-gfc-and-9-11-combined-marriott-ceo?utm_source=markets.businessinsider.com&utm_medium=referral,negative,0.9549697637557983
3/23/2020 2:09:02 AM,"""What's wrong with America"" - Ashford's Bennett on the hotel industry collapse",Seeking Alpha,https://seekingalpha.com/news/3554059-wrong-america-ashfords-bennett-on-hotel-industry-collapse?utm_source=markets.businessinsider.com&utm_medium=referral,neutral,0.5885242223739624
3/24/2020 1:24:00 AM,"Starwood Hotels & Resorts Worldwide Inc. -- Moody's downgrades Marriott's senior unsecured rating to Baa3, ratings are on review for downgrade",Moodys,/news/bonds/starwood-hotels-resorts-worldwide-inc-moody-s-downgrades-marriott-s-senior-unsecured-rating-to-baa3-ratings-are-on-review-for-downgrade-1029024805,negative,0.746784508228302
3/25/2020 2:35:48 PM,Travel stocks continue to bounce off lows,Seeking Alpha,https://seekingalpha.com/news/3555084-travel-stocks-continue-to-bounce-off-lows?utm_source=markets.businessinsider.com&utm_medium=referral,negative,0.9249589443206787
