datetime,title,source,link,sentiment_class,sentiment_score
4/30/2024 8:16:19 PM,"Republic Services Non-GAAP EPS of $1.45 beats by $0.10, revenue of $3.86B misses by $30M",Seeking Alpha,https://seekingalpha.com/news/4096778-republic-services-non-gaap-eps-of-1_45-beats-0_10-revenue-of-3_86b-misses-30m?utm_source=businessinsider&utm_medium=referral&feed_item_type=news,neutral,0.8213972449302673
4/30/2024 10:26:49 PM,"Republic Services Q1 Profit Increases, beats estimates",RTTNews,/news/stocks/republic-services-q1-profit-increases-beats-estimates-1033308793,positive,0.9370647072792053
5/1/2024 12:55:09 AM,"RSG Stock Earnings: Republic Servs Beats EPS, Misses Revenue for Q1 2024",InvestorPlace,/news/stocks/rsg-stock-earnings-republic-servs-for-q1-of-2024-1033309243,neutral,0.9184607863426208
5/1/2024 9:56:20 AM,Buy Rating on Republic Services Amid Strong Operating Leverage and Margin Improvement,TipRanks,/news/stocks/buy-rating-on-republic-services-amid-strong-operating-leverage-and-margin-improvement-1033312945,positive,0.9555492401123047
5/1/2024 10:39:30 AM,Republic Services (RSG) Receives a Hold from RBC Capital,TipRanks,/news/stocks/republic-services-rsg-receives-a-hold-from-rbc-capital-1033313595,neutral,0.8480179309844971
5/1/2024 11:16:19 AM,Truist Financial Sticks to Their Hold Rating for Republic Services (RSG),TipRanks,/news/stocks/truist-financial-sticks-to-their-hold-rating-for-republic-services-rsg-1033314135,neutral,0.5752765536308289
5/1/2024 12:56:18 PM,Scotiabank Sticks to Their Hold Rating for Republic Services (RSG),TipRanks,/news/stocks/scotiabank-sticks-to-their-hold-rating-for-republic-services-rsg-1033314496,neutral,0.8071472644805908
5/2/2024 6:46:03 AM,Maintaining Hold on Republic Services Amid Solid Performance and Valuation Concerns,TipRanks,/news/stocks/maintaining-hold-on-republic-services-amid-solid-performance-and-valuation-concerns-1033318559,positive,0.6906469464302063
5/2/2024 1:55:52 PM,CIBC Reaffirms Their Hold Rating on Republic Services (RSG),TipRanks,/news/stocks/cibc-reaffirms-their-hold-rating-on-republic-services-rsg-1033321727,neutral,0.7743569612503052
5/7/2024 10:40:00 AM,3 Unstoppable Dividend Stocks Built to Withstand a Recession,InvestorPlace,/news/stocks/3-unstoppable-dividend-stocks-built-to-withstand-a-recession-1033338407,positive,0.7281281352043152
5/7/2024 12:16:01 PM,Stifel Nicolaus Sticks to Its Buy Rating for Republic Services (RSG),TipRanks,/news/stocks/stifel-nicolaus-sticks-to-its-buy-rating-for-republic-services-rsg-1033340839,neutral,0.6091164946556091
5/21/2024 12:10:43 PM,Analysts Conflicted on These Industrial Goods Names: Siemens Energy (OtherSMEGF) and Republic Services (RSG),TipRanks,/news/stocks/analysts-conflicted-on-these-industrial-goods-names-siemens-energy-othersmegf-and-republic-services-rsg-1033408142,neutral,0.7829316258430481
6/20/2024 2:05:27 AM,Republic Services (RSG) Gets a Buy from Stifel Nicolaus,TipRanks,/news/stocks/republic-services-rsg-gets-a-buy-from-stifel-nicolaus-1033491542,neutral,0.5822434425354004
6/24/2024 10:44:00 AM,Maximize Gains: Sell These 7 Overvalued Stocks Before They Slide,InvestorPlace,/news/stocks/maximize-gains-sell-these-7-overvalued-stocks-before-they-slide-1033499427,neutral,0.897895336151123
7/11/2024 10:16:25 AM,"Buy Rating Affirmed for Republic Services on Valuation, Margin Expansion, and Strategic Acquisitions",TipRanks,/news/stocks/buy-rating-affirmed-for-republic-services-on-valuation-margin-expansion-and-strategic-acquisitions-1033547180,positive,0.8184469938278198
7/11/2024 5:04:15 PM,"Republic Services Has A 'Wide Pipeline Of Accretive Tuck-In Opportunities,' Says Bullish Analyst",Benzinga,/news/stocks/republic-services-has-a-wide-pipeline-of-accretive-tuck-in-opportunities-says-bullish-analyst-1033547821,positive,0.9231454730033875
7/11/2024 8:51:45 PM,Republic Services Stock Gains 32% in a Year: Here's Why,Benzinga,/news/stocks/republic-services-stock-gains-32-in-a-year-here-s-why-1033548387,neutral,0.5750295519828796
7/11/2024 11:00:56 PM,5 Analysts Assess Republic Servs: What You Need To Know,Benzinga,/news/stocks/5-analysts-assess-republic-servs-what-you-need-to-know-1033548651,neutral,0.9336483478546143
7/12/2024 8:09:13 PM,Equifax to Report Q2 Earnings: What's in the Offing?,Benzinga,/news/stocks/equifax-to-report-q2-earnings-what-s-in-the-offing-1033551429,neutral,0.5017549991607666
7/18/2024 12:16:43 PM,Republic Services (RSG) Receives a Hold from Deutsche Numis,TipRanks,/news/stocks/republic-services-rsg-receives-a-hold-from-deutsche-numis-1033569455,neutral,0.8790481686592102
7/20/2024 10:50:00 AM,3 Sleeper Stocks to Buy in July Before They Ascend to New Heights ,InvestorPlace,/news/stocks/3-sleeper-stocks-to-buy-in-july-before-they-ascend-to-new-heights-1033573748,neutral,0.8851405382156372
7/23/2024 3:01:13 PM,Republic Services earnings preview: what to expect,Markets Insider Automation,/news/stocks/republic_services-stock-price-q2-earnings-preview-1033582393,neutral,0.9016915559768677
7/23/2024 9:35:33 PM,Republic Services Q2 2024 Earnings Preview,Seeking Alpha,https://seekingalpha.com/news/4126998-republic-services-q2-2024-earnings-preview?utm_source=businessinsider&utm_medium=referral&feed_item_type=news,neutral,0.9207744598388672
7/23/2024 9:35:48 PM,Notable earnings after Wednesday's close,Seeking Alpha,https://seekingalpha.com/news/4126771-notable-earnings-after-wednesdays-close?utm_source=businessinsider&utm_medium=referral&feed_item_type=news,positive,0.8919200301170349
7/24/2024 2:45:00 PM,Republic Services hosts conference call for investors,Markets Insider Automation,/news/stocks/republic_services_conference-1030101862,neutral,0.9434596300125122
7/24/2024 7:13:32 PM,"US Stocks Tumble, Magnificent 7 Wipe Out $570 Billion As Mega-Tech Earnings Disappoint, VIX Spikes: What's Driving Markets Wednesday?",Benzinga,/news/stocks/us-stocks-tumble-magnificent-7-wipe-out-570-billion-as-mega-tech-earnings-disappoint-vix-spikes-what-s-driving-markets-wednesday-1033590385,negative,0.9039115905761719
7/24/2024 8:20:55 PM,"Republic Services Non-GAAP EPS of $1.61 beats by $0.08, revenue of $4.05B beats by $20M",Seeking Alpha,https://seekingalpha.com/news/4127873-republic-services-non-gaap-eps-of-1_61-beats-0_08-revenue-of-4_05b-beats-20m?utm_source=businessinsider&utm_medium=referral&feed_item_type=news,neutral,0.6533392667770386
7/24/2024 9:15:01 PM,Republic Services raises quarterly dividend by 8.4% to  $0.58/share,Seeking Alpha,https://seekingalpha.com/news/4127862-republic-services-inc-declares-0_58-dividend?utm_source=businessinsider&utm_medium=referral&feed_item_type=news,positive,0.9126825928688049
7/24/2024 10:21:41 PM,"Republic Services Q2 Profit Increases, Beats Estimates ",RTTNews,/news/stocks/republic-services-q2-profit-increases-beats-estimates-1033590787,positive,0.9400482773780823
7/25/2024 12:56:22 AM,"RSG Stock Earnings: Republic Servs Beats EPS, Beats Revenue for Q2 2024",InvestorPlace,/news/stocks/rsg-stock-earnings-republic-servs-for-q2-of-2024-1033591242,neutral,0.7151433229446411
7/25/2024 10:43:41 AM,Analysts’ Opinions Are Mixed on These Industrial Goods Stocks: FTAI Aviation (FTAI) and Republic Services (RSG),TipRanks,/news/stocks/analysts-opinions-are-mixed-on-these-industrial-goods-stocks-ftai-aviation-ftai-and-republic-services-rsg-1033595008,negative,0.8207123279571533
7/25/2024 11:16:59 AM,Republic Services (RSG) Receives a Rating Update from a Top Analyst,TipRanks,/news/stocks/republic-services-rsg-receives-a-rating-update-from-a-top-analyst-1033595398,neutral,0.8520949482917786
7/25/2024 11:34:35 AM,"Analysts Are Bullish on Top Industrial Goods Stocks: Valmont (VMI), MSA Safety (MSA)",TipRanks,/news/stocks/analysts-are-bullish-on-top-industrial-goods-stocks-valmont-vmi-msa-safety-msa-1033595484,positive,0.5895965695381165
7/25/2024 11:36:34 AM,Oppenheimer Remains a Buy on Republic Services (RSG),TipRanks,/news/stocks/oppenheimer-remains-a-buy-on-republic-services-rsg-1033595468,neutral,0.9444299340248108
7/25/2024 12:48:59 PM,Morgan Stanley Remains a Hold on Republic Services (RSG),TipRanks,/news/stocks/morgan-stanley-remains-a-hold-on-republic-services-rsg-1033595809,neutral,0.7166541814804077
7/25/2024 2:35:09 PM,CIBC Reaffirms Their Hold Rating on Republic Services (RSG),TipRanks,/news/stocks/cibc-reaffirms-their-hold-rating-on-republic-services-rsg-1033596173,neutral,0.7743569612503052
7/25/2024 6:47:58 PM,7 Recession-Resistant Stocks to Put Your Mind at Ease,InvestorPlace,/news/stocks/7-recession-resistant-stocks-to-put-your-mind-at-ease-1033596306,neutral,0.7943472266197205
7/29/2024 12:20:15 PM,J.P. Morgan Sticks to Its Hold Rating for Republic Services (RSG),TipRanks,/news/stocks/j-p-morgan-sticks-to-its-hold-rating-for-republic-services-rsg-1033607171,positive,0.5811999440193176
7/30/2024 10:28:23 AM,Deutsche Bank  Keeps Their Hold Rating on Republic Services (RSG),TipRanks,/news/stocks/deutsche-bank-keeps-their-hold-rating-on-republic-services-rsg-1033612345,neutral,0.9214751720428467
8/5/2024 9:45:53 AM,Hold Rating on Republic Services Amidst Industry Challenges and Conservative Margin Outlook,TipRanks,/news/stocks/hold-rating-on-republic-services-amidst-industry-challenges-and-conservative-margin-outlook-1033638757,negative,0.7372381091117859
8/10/2024 3:00:00 PM,3 Long-Term Stocks on Track to Double (or More) by 2032,InvestorPlace,/news/stocks/3-long-term-stocks-on-track-to-double-or-more-by-2032-1033671392,positive,0.9412264227867126
8/15/2024 11:00:00 AM,7 Recession-Resistant Stocks to Hold Onto for Dear Life in 2024,InvestorPlace,/news/stocks/7-recession-resistant-stocks-to-hold-onto-for-dear-life-in-2024-1033694445,neutral,0.4759461581707001
9/9/2024 3:22:48 PM,GFL expected to start sale of environmental-services unit this week - report,Seeking Alpha,https://seekingalpha.com/news/4148061-gfl-expected-to-start-sale-of-environmental-services-unit-this-week-report?utm_source=businessinsider&utm_medium=referral&feed_item_type=news,neutral,0.9449712634086609
9/10/2024 7:21:12 PM,UBS updates its ‘election watch’ stocks to match new winning probabilities,Seeking Alpha,https://seekingalpha.com/news/4148454-ubs-updates-its-election-watch-stocks-to-match-new-winning-probabilities?utm_source=businessinsider&utm_medium=referral&feed_item_type=news,neutral,0.6845296025276184
9/13/2024 6:16:44 AM,Neutral Outlook on Republic Services Amidst Solid Market Standing and Financial Prudence,TipRanks,/news/stocks/neutral-outlook-on-republic-services-amidst-solid-market-standing-and-financial-prudence-1033769551,positive,0.8946003913879395
10/11/2024 7:00:23 PM,"Catalyst Watch: Netflix earnings, Lenovo tech event, Paris Motor Show, and eyes on oil",Seeking Alpha,https://seekingalpha.com/news/4157956-catalyst-watch-netflix-earnings-lenovo-tech-event-paris-motor-show-and-eyes-on-oil?utm_source=businessinsider&utm_medium=referral&feed_item_type=news,neutral,0.9386246800422668
10/22/2024 1:48:41 AM,RBC Capital Sticks to Their Hold Rating for Republic Services (RSG),TipRanks,/news/stocks/rbc-capital-sticks-to-their-hold-rating-for-republic-services-rsg-1033867520,neutral,0.8016284704208374
10/28/2024 9:35:28 PM,Republic Services Q3 2024 Earnings Preview,Seeking Alpha,https://seekingalpha.com/news/4214458-republic-services-q3-2024-earnings-preview?utm_source=businessinsider&utm_medium=referral&feed_item_type=news,neutral,0.9179603457450867
10/29/2024 2:00:00 PM,Here are the major earnings after the close today,Seeking Alpha,https://seekingalpha.com/news/4213699-here-are-the-major-earnings-after-the-close-today?utm_source=businessinsider&utm_medium=referral&feed_item_type=news,neutral,0.9299408793449402
10/29/2024 8:13:24 PM,"Republic Services Non-GAAP EPS of $1.81 beats by $0.20, revenue of $4.07B misses by $50M",Seeking Alpha,https://seekingalpha.com/news/4220835-republic-services-non-gaap-eps-of-1_81-beats-0_20-revenue-of-4_07b-misses-50m?utm_source=businessinsider&utm_medium=referral&feed_item_type=news,neutral,0.7945737242698669
10/29/2024 9:25:37 PM,"Republic Services Q3 Profit Increases, Beats Estimates ",RTTNews,/news/stocks/republic-services-q3-profit-increases-beats-estimates-1033911736,positive,0.9346418976783752
10/30/2024 9:08:18 AM,Republic Services Reports Strong Q3 2024 Earnings,TipRanks,/news/stocks/republic-services-reports-strong-q3-2024-earnings-1033916903,positive,0.9477924704551697
10/30/2024 10:12:28 AM,Analysts Offer Insights on Industrial Goods Companies: Mirion Technologies (MIR) and Republic Services (RSG),TipRanks,/news/stocks/analysts-offer-insights-on-industrial-goods-companies-mirion-technologies-mir-and-republic-services-rsg-1033917444,neutral,0.9043991565704346
10/30/2024 10:40:25 AM,Republic Services (RSG) Gets a Hold from RBC Capital,TipRanks,/news/stocks/republic-services-rsg-gets-a-hold-from-rbc-capital-1033917776,neutral,0.85030198097229
10/30/2024 11:09:30 AM,Truist Financial Sticks to Their Buy Rating for Republic Services (RSG),TipRanks,/news/stocks/truist-financial-sticks-to-their-buy-rating-for-republic-services-rsg-1033918105,positive,0.5167415738105774
10/30/2024 11:18:17 AM,Republic Services Maintains Hold Rating Amid Mixed Performance and Conservative Outlook,TipRanks,/news/stocks/republic-services-maintains-hold-rating-amid-mixed-performance-and-conservative-outlook-1033918251,negative,0.7413085103034973
10/30/2024 11:49:56 AM,Republic Services (RSG) Receives a Hold from Scotiabank,TipRanks,/news/stocks/republic-services-rsg-receives-a-hold-from-scotiabank-1033918556,neutral,0.8390668034553528
10/30/2024 11:52:12 AM,Republic Services (RSG) Receives a Buy from Oppenheimer,TipRanks,/news/stocks/republic-services-rsg-receives-a-buy-from-oppenheimer-1033918513,neutral,0.6915724873542786
10/30/2024 12:37:16 PM,Republic Services price target raised to $220 from $219 at Oppenheimer,TipRanks,/news/stocks/republic-services-price-target-raised-to-220-from-219-at-oppenheimer-1033919287,positive,0.9416494369506836
10/30/2024 12:37:42 PM,Republic Services: Hold Rating Maintained Amid Conservative Near-Term Outlook and Strong Long-Term Prospects,TipRanks,/news/stocks/republic-services-hold-rating-maintained-amid-conservative-near-term-outlook-and-strong-long-term-prospects-1033919282,positive,0.9526429772377014
10/30/2024 1:36:19 PM,Republic Services price target raised to $244 from $220 at Truist,TipRanks,/news/stocks/republic-services-price-target-raised-to-244-from-220-at-truist-1033919741,positive,0.9440656900405884
10/30/2024 1:48:18 PM,Bank of America Securities Sticks to Its Buy Rating for Republic Services (RSG),TipRanks,/news/stocks/bank-of-america-securities-sticks-to-its-buy-rating-for-republic-services-rsg-1033919842,neutral,0.8562864661216736
10/30/2024 2:01:29 PM,Republic Services declares $0.58 dividend,Seeking Alpha,https://seekingalpha.com/news/4223335-republic-services-declares-058-dividend?utm_source=businessinsider&utm_medium=referral&feed_item_type=news,neutral,0.9394620656967163
10/30/2024 3:20:20 PM,Republic Services price target raised to $217 from $208 at CIBC,TipRanks,/news/stocks/republic-services-price-target-raised-to-217-from-208-at-cibc-1033920257,positive,0.9408205151557922
10/31/2024 2:13:06 AM,Stifel Nicolaus Remains a Buy on Republic Services (RSG),TipRanks,/news/stocks/stifel-nicolaus-remains-a-buy-on-republic-services-rsg-1033922492,neutral,0.9455991983413696
10/31/2024 9:45:14 AM,Mixed Financial Outlook Warrants Hold Rating for Republic Services Amid Revenue Challenges and Cost Management Efforts,TipRanks,/news/stocks/mixed-financial-outlook-warrants-hold-rating-for-republic-services-amid-revenue-challenges-and-cost-management-efforts-1033927962,negative,0.9534832239151001
10/31/2024 11:31:37 AM,Republic Services price target raised to $220 from $200 at TD Cowen,TipRanks,/news/stocks/republic-services-price-target-raised-to-220-from-200-at-td-cowen-1033929018,positive,0.9409939050674438
12/4/2024 3:10:26 PM,Republic Services price target raised to $227 from $217 at CIBC,TipRanks,/news/stocks/republic-services-price-target-raised-to-227-from-217-at-cibc-1034098391,positive,0.9403597712516785
12/6/2024 6:27:31 AM,Republic Services (RSG) was upgraded to a Buy Rating at BMO Capital,TipRanks,/news/stocks/republic-services-rsg-was-upgraded-to-a-buy-rating-at-bmo-capital-1034106771,positive,0.828174352645874
12/9/2024 2:36:28 PM,"Ameresco, Republic Services JV achieves commercial operation at Illinois plant",TipRanks,/news/stocks/ameresco-republic-services-jv-achieves-commercial-operation-at-illinois-plant-1034115414,positive,0.9117789268493652
12/10/2024 12:10:42 PM,Republic Services upgraded to Buy from Hold at Deutsche Bank,TipRanks,/news/stocks/republic-services-upgraded-to-buy-from-hold-at-deutsche-bank-1034119662,positive,0.5415789484977722
12/12/2024 1:58:15 PM,Morgan Stanley Sticks to Their Hold Rating for Republic Services (RSG),TipRanks,/news/stocks/morgan-stanley-sticks-to-their-hold-rating-for-republic-services-rsg-1034131418,neutral,0.7758030891418457
12/12/2024 2:45:20 PM,Republic Services price target raised to $220 from $217 at Morgan Stanley,TipRanks,/news/stocks/republic-services-price-target-raised-to-220-from-217-at-morgan-stanley-1034131637,positive,0.9383425712585449
12/16/2024 2:16:11 PM,Republic Services (RSG) Gets a Buy from Bank of America Securities,TipRanks,/news/stocks/republic-services-rsg-gets-a-buy-from-bank-of-america-securities-1034142100,neutral,0.7117660045623779
1/6/2025 11:30:35 AM,Republic Services upgraded to Outperform from Sector Perform at RBC Capital,TipRanks,/news/stocks/republic-services-upgraded-to-outperform-from-sector-perform-at-rbc-capital-1034194795,positive,0.9419951438903809
1/23/2025 2:01:11 PM,Republic Services price target raised to $244 from $235 at Jefferies,TipRanks,/news/stocks/republic-services-price-target-raised-to-244-from-235-at-jefferies-1034261314,positive,0.9409577250480652
1/24/2025 1:20:24 PM,Morgan Stanley Keeps Their Hold Rating on Republic Services (RSG),TipRanks,/news/stocks/morgan-stanley-keeps-their-hold-rating-on-republic-services-rsg-1034266976,neutral,0.9144870638847351
1/27/2025 1:16:46 PM,Republic Services (RSG) Receives a Buy from Bank of America Securities,TipRanks,/news/stocks/republic-services-rsg-receives-a-buy-from-bank-of-america-securities-1034272904,neutral,0.7547109723091125
1/29/2025 2:09:28 AM,RBC Capital Remains a Buy on Republic Services (RSG),TipRanks,/news/stocks/rbc-capital-remains-a-buy-on-republic-services-rsg-1034279936,neutral,0.9416104555130005
