datetime,title,source,link,sentiment_class,sentiment_score
12/17/2021 4:17:57 PM,"Benzinga's Top Ratings Upgrades, Downgrades For December 17, 2021",Benzinga,/news/stocks/benzinga-s-top-ratings-upgrades-downgrades-for-december-17-2021-1031053650,negative,0.5951844453811646
12/30/2021 3:00:06 PM,Judge rules Energy Transfer must pay $410M in failed Williams merger,Seeking Alpha,https://seekingalpha.com/news/3784107-judge-rules-energy-transfer-must-pay-410m-in-failed-williams-merger?utm_source=markets.businessinsider.com&utm_medium=referral,negative,0.6629254221916199
12/31/2021 2:28:12 PM,Methane cloud spotted from space came from Williams pipeline - Bloomberg,Seeking Alpha,https://seekingalpha.com/news/3784367-methane-cloud-spotted-from-space-came-from-williams-pipeline-bloomberg?utm_source=markets.businessinsider.com&utm_medium=referral,neutral,0.9205082058906555
1/6/2022 2:11:55 PM,Williams delivers record natural gas volumes via Transco,Seeking Alpha,https://seekingalpha.com/news/3785830-williams-delivers-record-natural-gas-volumes-via-transco?utm_source=markets.businessinsider.com&utm_medium=referral,positive,0.8068088889122009
1/11/2022 9:27:37 PM,Oil And Gas Stocks Expected To Remain Strong: 5 Top Midstream Energy Stock Picks For 2022,Benzinga,/news/stocks/oil-and-gas-stocks-expected-to-remain-strong-5-top-midstream-energy-stock-picks-for-2022-1031095131,positive,0.7372485399246216
1/18/2022 8:28:09 PM,What 5 Analyst Ratings Have To Say About Williams Companies,Benzinga,/news/stocks/what-5-analyst-ratings-have-to-say-about-williams-companies-1031110228,neutral,0.9341970086097717
2/1/2022 9:30:48 PM,Oil and gas names surge again; sector up 23% YTD vs. S&P loss,Seeking Alpha,https://seekingalpha.com/news/3794535-oil-and-gas-names-surge-again-sector-up-23-ytd-vs-sp-loss?utm_source=markets.businessinsider.com&utm_medium=referral,positive,0.9425316452980042
2/7/2022 8:54:57 AM,Williams raises quarterly dividend by ~4% to $0.425,Seeking Alpha,https://seekingalpha.com/news/3796342-williams-raises-quarterly-dividend-by-4-to-0425?utm_source=markets.businessinsider.com&utm_medium=referral,positive,0.9115055799484253
2/15/2022 4:01:45 PM,What 4 Analyst Ratings Have To Say About Williams Companies,Benzinga,/news/stocks/what-4-analyst-ratings-have-to-say-about-williams-companies-1031196409,neutral,0.9315681457519531
2/17/2022 5:07:46 PM,Bernstein calls for big beat from Cheniere at Q4,Seeking Alpha,https://seekingalpha.com/news/3801552-bernstein-calls-for-big-beat-from-cheniere-at-q4?utm_source=markets.businessinsider.com&utm_medium=referral,positive,0.5974175930023193
2/20/2022 2:30:27 AM,"FERC sets rules that could hamper new natural gas pipelines, industry says",Seeking Alpha,https://seekingalpha.com/news/3802213-ferc-sets-rules-that-could-hamper-new-natural-gas-pipelines-industry-says?utm_source=markets.businessinsider.com&utm_medium=referral,negative,0.9096361398696899
2/20/2022 3:01:13 PM,Williams Companies earnings: here's what Wall Street expects,Markets Insider Automation,/news/stocks/williams_companies-q4-quarterly-earnings-preview-1031210594,neutral,0.9282956719398499
2/22/2022 5:15:43 AM,"Williams Cos. Q4 Profit Increases, beats estimates",RTTNews,/news/stocks/williams-cos-q4-profit-increases-beats-estimates-1031213517,positive,0.9408806562423706
2/22/2022 7:19:54 AM,"Williams Non-GAAP EPS of $1.36, revenue of $10.63B",Seeking Alpha,https://seekingalpha.com/news/3802252-williams-non-gaap-eps-of-136-revenue-of-1063b?utm_source=markets.businessinsider.com&utm_medium=referral,neutral,0.9313542246818542
2/23/2022 12:53:08 AM,Williams views Haynesville shale as major growth driver - S&P Global,Seeking Alpha,https://seekingalpha.com/news/3803047-williams-views-haynesville-shale-as-major-growth-driver-sp-global?utm_source=markets.businessinsider.com&utm_medium=referral,neutral,0.5649097561836243
3/1/2022 6:32:32 PM,Expert Ratings For Williams Companies,Benzinga,/news/stocks/expert-ratings-for-williams-companies-1031244101,neutral,0.907343864440918
3/2/2022 5:55:07 PM,Oil and gas stocks surge as U.S. crude hits $112/bbl,Seeking Alpha,https://seekingalpha.com/news/3808589-oil-and-gas-stocks-surge-as-us-crude-hits-112bbl?utm_source=markets.businessinsider.com&utm_medium=referral,positive,0.8497018218040466
3/14/2022 1:15:33 PM,Williams to buy Trace Midstream's Haynesville pipe system in $950M deal,Seeking Alpha,https://seekingalpha.com/news/3813090-williams-to-buy-trace-mindstreams-haynesville-pipe-system-in-950m-deal?utm_source=markets.businessinsider.com&utm_medium=referral,neutral,0.880640983581543
3/17/2022 2:30:14 PM,Expert Ratings For Williams Companies,Benzinga,/news/stocks/expert-ratings-for-williams-companies-1031288895,neutral,0.907343864440918
3/24/2022 11:05:37 PM,Energy regulator to delay climate impact guidelines on new gas projects,Seeking Alpha,https://seekingalpha.com/news/3817295-energy-regulator-to-delay-climate-impact-guidelines-on-new-gas-projects?utm_source=markets.businessinsider.com&utm_medium=referral,negative,0.5441355109214783
3/31/2022 2:35:00 PM,"SATLANTIS, LLC, ANNOUNCES STRATEGIC INVESTMENT",PR Newswire,/news/stocks/satlantis-llc-announces-strategic-investment-1031322400,neutral,0.9024935364723206
4/19/2022 6:27:54 PM,"Cheniere in collaboration to quantify, monitor, report, verify GHG emissions",Seeking Alpha,https://seekingalpha.com/news/3824428-cheniere-in-collaboration-to-quantify-monitor-report-verify-ghg-emissions?utm_source=markets.businessinsider.com&utm_medium=referral,neutral,0.8876310586929321
4/19/2022 9:01:58 PM,"6 S&P 500 Dividend Stocks To Buy With 4% Yields: AT&T, IBM And More",Benzinga,/news/stocks/6-s-p-500-dividend-stocks-to-buy-with-4-yields-at-t-ibm-and-more-1031365169,neutral,0.9267259836196899
4/20/2022 7:03:53 PM,What 7 Analyst Ratings Have To Say About Williams Companies,Benzinga,/news/stocks/what-7-analyst-ratings-have-to-say-about-williams-companies-1031369009,neutral,0.9359333515167236
4/26/2022 3:30:11 PM,Williams declares $0.425 dividend,Seeking Alpha,https://seekingalpha.com/news/3826842-williams-companies-inc-declares-0_425-dividend?utm_source=markets.businessinsider.com&utm_medium=referral,neutral,0.9414190053939819
5/1/2022 3:01:13 PM,Williams Companies is about to announce its earnings — here's what to expect,Markets Insider Automation,/news/stocks/williams_companies-q1-earnings-preview-1031404907,neutral,0.939372718334198
5/1/2022 9:35:00 PM,Williams Q1 2022 Earnings Preview,Seeking Alpha,https://seekingalpha.com/news/3829595-williams-q1-2022-earnings-preview?utm_source=markets.businessinsider.com&utm_medium=referral,neutral,0.8852636814117432
5/1/2022 9:35:12 PM,Notable earnings after Monday's close,Seeking Alpha,https://seekingalpha.com/news/3829775-notable-earnings-after-mondays-close?utm_source=markets.businessinsider.com&utm_medium=referral,positive,0.8940556645393372
5/2/2022 10:41:51 AM,"5 Stocks To Watch For May 2, 2022",Benzinga,/news/stocks/5-stocks-to-watch-for-may-2-2022-1031407666,neutral,0.9217450618743896
5/2/2022 12:29:19 PM,A Peek Into The Markets: US Stock Futures Higher Following Friday's Sell-Off,Benzinga,/news/stocks/a-peek-into-the-markets-us-stock-futures-higher-following-friday-s-sell-off-1031407899,positive,0.9365687966346741
5/2/2022 8:17:07 PM,"Williams Non-GAAP EPS of $0.41 beats by $0.07, revenue of $2.52B in-line",Seeking Alpha,https://seekingalpha.com/news/3830449-williams-non-gaap-eps-of-0_41-beats-0_07-revenue-of-2_52b-in-line?utm_source=markets.businessinsider.com&utm_medium=referral,neutral,0.7068332433700562
5/2/2022 10:23:33 PM,"Williams Cos. Q1 Profit Decreases, but beats estimates",RTTNews,/news/stocks/williams-cos-q1-profit-decreases-but-beats-estimates-1031410347,negative,0.9654474854469299
5/11/2022 12:05:26 AM,"More gas pipelines would help both consumers and environment, Williams CEO says",Seeking Alpha,https://seekingalpha.com/news/3836551-more-gas-pipelines-would-help-both-environment-and-economy-williams-ceo-says?utm_source=markets.businessinsider.com&utm_medium=referral,positive,0.7872430086135864
5/17/2022 10:40:22 AM,7 Oil Stocks to Buy With Safe Dividends,InvestorPlace,/news/stocks/7-oil-stocks-to-buy-with-safe-dividends-xom-cvx-bp-enb-su-vlo-wmb-1031467819,neutral,0.9152156114578247
5/18/2022 11:10:11 AM,7 No-Brainer Oil Stocks to Buy Now,InvestorPlace,/news/stocks/7-no-brainer-oil-stocks-to-buy-now-1031471684,neutral,0.8903979063034058
5/20/2022 3:04:59 PM,Where Williams Companies Stands With Analysts,Benzinga,/news/stocks/where-williams-companies-stands-with-analysts-1031478681,neutral,0.944877564907074
5/23/2022 11:49:01 PM,"7 Dividend Stocks To Buy That Analysts Love: AT&T, Best Buy And More",Benzinga,/news/stocks/7-dividend-stocks-to-buy-that-analysts-love-at-t-best-buy-and-more-1031483161,neutral,0.937341034412384
5/24/2022 11:29:47 AM,Today’s Biggest Pre-Market Stock Movers: 10 Top Gainers and Losers on Tuesday,InvestorPlace,/news/stocks/todays-biggest-pre-market-stock-movers-10-top-gainers-and-losers-on-may-24-1031484506,negative,0.508424699306488
6/14/2022 1:57:38 PM,Wells Fargo unveils its recession stock portfolio,Seeking Alpha,https://seekingalpha.com/news/3848418-wells-fargo-unveils-its-recession-stock-portfolio?utm_source=businessinsider&utm_medium=referral,neutral,0.9255277514457703
6/19/2022 7:22:30 PM,Goldman touts stable stocks for this market; here is their rebalanced portfolio,Seeking Alpha,https://seekingalpha.com/news/3849808-goldman-touts-stable-stocks-for-this-market-here-is-their-rebalanced-portfolio?utm_source=businessinsider&utm_medium=referral,neutral,0.90793377161026
6/21/2022 4:08:16 PM,Bears are attacking leaders; MKM says these energy stocks are at risk,Seeking Alpha,https://seekingalpha.com/news/3850142-bears-are-attacking-leaders-mkm-says-these-energy-stocks-are-at-risk?utm_source=businessinsider&utm_medium=referral,negative,0.6957982778549194
6/21/2022 5:34:19 PM,4 Energy Stocks With Dividends to Add to Your Buy List,InvestorPlace,/news/stocks/4-energy-stocks-with-dividends-to-add-to-your-buy-list-1031541248,neutral,0.9284436106681824
6/28/2022 7:53:16 PM,"Crude oil, energy stocks led by Hess surge as Saudi, UAE flag capacity limits",Seeking Alpha,https://seekingalpha.com/news/3852607-crude-oil-energy-stocks-surge-again-as-saudi-uae-flag-capacity-limits?utm_source=businessinsider&utm_medium=referral,positive,0.8862461447715759
6/29/2022 11:46:32 AM,Williams to move forward on Louisiana Energy Gateway project,Seeking Alpha,https://seekingalpha.com/news/3852770-williams-to-move-forward-on-louisiana-energy-gateway-project?utm_source=businessinsider&utm_medium=referral,neutral,0.8506052494049072
7/11/2022 3:29:42 PM,Goldman screens stocks most and least vulnerable to recession margin pressure,Seeking Alpha,https://seekingalpha.com/news/3855643-goldman-screens-stocks-most-ane-least-vulnerable-to-recession-margin-pressure?utm_source=businessinsider&utm_medium=referral,negative,0.8081637024879456
7/13/2022 10:07:16 PM,7 Dangerous Dividend Stocks to Sell Now,InvestorPlace,/news/stocks/dividend-stocks-to-sell-1031585871,neutral,0.9269225001335144
7/15/2022 2:33:09 PM,Cramer Likes This Stock With 5% Yield,Benzinga,/news/stocks/cramer-likes-this-stock-with-5-yield-1031590179,neutral,0.8247426152229309
7/20/2022 4:45:52 PM,DT Midstream upgraded at Barclays on strong Haynesville outlook,Seeking Alpha,https://seekingalpha.com/news/3858633-dt-midstream-upgraded-at-barclays-on-strong-haynesville-outlook?utm_source=businessinsider&utm_medium=referral,positive,0.930962085723877
7/25/2022 11:00:21 AM,7 Best Energy Stocks to Buy Now,InvestorPlace,/news/stocks/best-energy-stocks-1031520284,neutral,0.9031289219856262
7/26/2022 4:18:38 PM,Williams declares $0.425 dividend,Seeking Alpha,https://seekingalpha.com/news/3860600-williams-companies-inc-declares-0_425-dividend?utm_source=businessinsider&utm_medium=referral,neutral,0.9414190053939819
7/31/2022 3:01:13 PM,Williams Companies earnings: here's what Wall Street expects,Markets Insider Automation,/news/stocks/williams_companies-stock-price-q2-earnings-preview-1031631729,neutral,0.9282956719398499
7/31/2022 9:35:00 PM,Williams Q2 2022 Earnings Preview,Seeking Alpha,https://seekingalpha.com/news/3863384-williams-q2-2022-earnings-preview?utm_source=businessinsider&utm_medium=referral,neutral,0.8868942856788635
7/31/2022 9:35:52 PM,Notable earnings after Monday's close,Seeking Alpha,https://seekingalpha.com/news/3863506-notable-earnings-after-mondays-close?utm_source=businessinsider&utm_medium=referral,positive,0.8940556645393372
8/1/2022 8:19:46 PM,"Williams Non-GAAP EPS of $0.40 beats by $0.03, revenue of $2.49B beats by $50M",Seeking Alpha,https://seekingalpha.com/news/3864181-williams-non-gaap-eps-of-0_40-beats-0_03-revenue-of-2_49b-beats-50m?utm_source=businessinsider&utm_medium=referral,neutral,0.7878659963607788
8/1/2022 10:31:24 PM,"Williams Cos. Q2 Profit Increases, beats estimates",RTTNews,/news/stocks/williams-cos-q2-profit-increases-beats-estimates-1031636860,positive,0.9450384974479675
8/3/2022 6:12:31 PM,Expert Ratings for Williams Companies,Benzinga,/news/stocks/expert-ratings-for-williams-companies-1031646514,neutral,0.907343864440918
8/3/2022 9:48:45 PM,Williams raises $1.75B through debt offering,Seeking Alpha,https://seekingalpha.com/news/3866710-williams-raises-175b-through-debt-offering?utm_source=businessinsider&utm_medium=referral,positive,0.5380170345306396
8/8/2022 1:42:27 PM,"Williams, PennEnergy sign deal to market certified low-emission natural gas",Seeking Alpha,https://seekingalpha.com/news/3868804-williams-pennenergy-sign-deal-to-market-certified-low-emission-natural-gas?utm_source=businessinsider&utm_medium=referral,positive,0.8857157826423645
9/7/2022 2:00:00 PM,Energy Leaders Invest $60 Million to Transform America's Heartland into Hub for Energy Technology Startups,PR Newswire,/news/stocks/energy-leaders-invest-60-million-to-transform-america-s-heartland-into-hub-for-energy-technology-startups-1031728868,positive,0.695448100566864
9/8/2022 11:49:08 AM,Williams buys NorTex Midstream assets in $423M deal,Seeking Alpha,https://seekingalpha.com/news/3881162-williams-buys-nortex-midstream-assets?utm_source=businessinsider&utm_medium=referral,neutral,0.9299569725990295
9/8/2022 1:46:02 PM,"Williams Buys Natural Gas Pipeline, Storage Assets In Dallas-Fort Worth Metroplex ",RTTNews,/news/stocks/williams-buys-natural-gas-pipeline-storage-assets-in-dallas-fort-worth-metroplex-1031731689,neutral,0.9118478298187256
9/8/2022 3:29:00 PM,Tailwater Capital Announces Sale of NorTex Midstream Partners to Williams,PR Newswire,/news/stocks/tailwater-capital-announces-sale-of-nortex-midstream-partners-to-williams-1031732266,neutral,0.9433814287185669
9/8/2022 4:15:28 PM,"Benzinga's Top Ratings Upgrades, Downgrades For September 8, 2022",Benzinga,/news/stocks/benzinga-s-top-ratings-upgrades-downgrades-for-september-8-2022-1031732515,neutral,0.5457445979118347
9/8/2022 4:30:27 PM,Williams Cos. downgraded to Sell at Goldman Sachs on slower earnings growth,Seeking Alpha,https://seekingalpha.com/news/3881311-williams-cos-downgraded-to-sell-at-goldman-sachs-on-slower-earnings-growth?utm_source=businessinsider&utm_medium=referral,negative,0.9519810676574707
9/8/2022 8:02:46 PM,What 5 Analyst Ratings Have To Say About Williams Companies,Benzinga,/news/stocks/what-5-analyst-ratings-have-to-say-about-williams-companies-1031733101,neutral,0.9341970086097717
9/8/2022 11:18:05 PM,Charles Schwab Says High-Yield Dividend Stocks Are the Best Play Right Now; Here Are 2 Names That Analysts Like,TipRanks,/news/stocks/charles-schwab-says-high-yield-dividend-stocks-are-the-best-play-right-now-here-are-2-names-that-analysts-like-1031733533,neutral,0.9311394095420837
9/15/2022 3:27:12 PM,3 Oil Stocks to Sell as Crude Prices Plunge,InvestorPlace,/news/stocks/3-oil-stocks-to-sell-as-crude-prices-plunge-1031746271,neutral,0.38512101769447327
9/21/2022 8:35:06 PM,7 Oil Stocks to Buy on the Dip or You’ll Be Kicking Yourself Later,InvestorPlace,/news/stocks/7-oil-stocks-to-buy-on-the-dip-or-you-kick-yourself-later-1031757772,neutral,0.6440357565879822
9/29/2022 5:09:50 PM,Williams Reaffirms FY Earnings Guidance ,RTTNews,/news/stocks/williams-reaffirms-fy-earnings-guidance-1031773497,neutral,0.8027797341346741
10/18/2022 9:39:39 PM,"Williams, Daroga Power to partner on clean hydrogen commercialization",Seeking Alpha,https://seekingalpha.com/news/3892473-williams-daroga-power-to-partner-on-clean-hydrogen-commercialization?utm_source=businessinsider&utm_medium=referral,positive,0.5939852595329285
10/19/2022 5:22:09 PM,What 6 Analyst Ratings Have To Say About Williams Companies,Benzinga,/news/stocks/what-6-analyst-ratings-have-to-say-about-williams-companies-1031818106,neutral,0.9372046589851379
10/24/2022 5:45:55 PM,"This Wall Street Analyst Sees An Upside For Cheniere, Natural Gas Players: Here's Why",Benzinga,/news/stocks/this-wall-street-analyst-sees-an-upside-for-cheniere-natural-gas-players-here-s-why-1031829209,neutral,0.6788516640663147
10/25/2022 5:40:38 PM,Williams declares $0.425 dividend,Seeking Alpha,https://seekingalpha.com/news/3894957-williams-companies-inc-declares-0_425-dividend?utm_source=businessinsider&utm_medium=referral,neutral,0.9414190053939819
10/30/2022 3:01:13 PM,Here's what Wall Street expects from Williams Companies's earnings,Markets Insider Automation,/news/stocks/williams_companies-stock-price-q3-earnings-preview-1031850516,neutral,0.94053053855896
10/30/2022 9:35:00 PM,Notable earnings after Monday's close,Seeking Alpha,https://seekingalpha.com/news/3897553-notable-earnings-after-mondays-close?utm_source=businessinsider&utm_medium=referral,positive,0.8940556645393372
10/30/2022 9:35:00 PM,Williams Q3 Earnings Preview,Seeking Alpha,https://seekingalpha.com/news/3897404-williams-q3-earnings-preview?utm_source=businessinsider&utm_medium=referral,neutral,0.8469542860984802
10/31/2022 8:17:57 PM,"Williams Non-GAAP EPS of $0.48 beats by $0.05, revenue of $3.02B beats by $150M",Seeking Alpha,https://seekingalpha.com/news/3898108-williams-non-gaap-eps-of-0_48-beats-0_05-revenue-of-3_02b-beats-150m?utm_source=businessinsider&utm_medium=referral,neutral,0.7888791561126709
10/31/2022 8:56:43 PM,Williams sees full-year EBITDA near high end of guidance after strong Q3,Seeking Alpha,https://seekingalpha.com/news/3898157-williams-sees-full-year-ebitda-near-high-end-of-guidance-after-strong-q3?utm_source=businessinsider&utm_medium=referral,positive,0.9456372261047363
10/31/2022 9:42:27 PM,"Williams Cos. Q3 Profit Increases, beats estimates",RTTNews,/news/stocks/williams-cos-q3-profit-increases-beats-estimates-1031855212,positive,0.9412848353385925
11/3/2022 3:27:27 PM,Sempra set to build new Port Arthur LNG export plant - WSJ,Seeking Alpha,https://seekingalpha.com/news/3901090-sempra-set-to-build-new-port-arthur-lng-export-plant-wsj?utm_source=businessinsider&utm_medium=referral,neutral,0.6733742356300354
11/4/2022 5:15:33 AM,Mizuho Securities Reaffirms Their Buy Rating on Williams Co (WMB),TipRanks,/news/stocks/mizuho-securities-reaffirms-their-buy-rating-on-williams-co-wmb-1031873410,neutral,0.7727184295654297
11/5/2022 1:46:51 AM,RBC Capital Reaffirms Their Buy Rating on Williams Co (WMB),TipRanks,/news/stocks/rbc-capital-reaffirms-their-buy-rating-on-williams-co-wmb-1031877329,neutral,0.8301578164100647
11/14/2022 10:38:45 PM,"Soros Fund Management takes new positions in Sierra Wireless, Booking, Agree Realty",Seeking Alpha,https://seekingalpha.com/news/3907552-soros-fund-management-takes-new-positions-in-sierra-wireless-booking-agree-realty?utm_source=businessinsider&utm_medium=referral,neutral,0.9376700520515442
11/15/2022 10:30:00 PM,"Sempra Infrastructure and Williams Announce Preliminary Agreements for LNG Offtake, Gas Supply, and Associated Pipeline Projects",PR Newswire,/news/stocks/sempra-infrastructure-and-williams-announce-preliminary-agreements-for-lng-offtake-gas-supply-and-associated-pipeline-projects-1031916510,positive,0.7084720134735107
11/16/2022 6:21:35 PM,"Williams, Sempra to launch Haynesville gas pipeline development plan",Seeking Alpha,https://seekingalpha.com/news/3908834-williams-sempra-to-launch-haynesville-gas-pipeline-development-plan?utm_source=businessinsider&utm_medium=referral,neutral,0.8778331875801086
12/1/2022 2:31:26 PM,Jim Cramer Says This Stock Is Dynamite: 'I Do Not Want You To Do A Thing Other Than Ride It',Benzinga,/news/stocks/jim-cramer-says-this-stock-is-dynamite-i-do-not-want-you-to-do-a-thing-other-than-ride-it-1031947723,neutral,0.859128475189209
12/3/2022 1:15:25 AM,Credit Suisse Sticks to Their Buy Rating for Williams Co (WMB),TipRanks,/news/stocks/credit-suisse-sticks-to-their-buy-rating-for-williams-co-wmb-1031951299,positive,0.5599071979522705
12/8/2022 1:50:50 PM,Williams Cos Executes Agreements With Coterra Energy And Dominion Energy ,RTTNews,/news/stocks/williams-cos-executes-agreements-with-coterra-energy-and-dominion-energy-1031960236,positive,0.8546520471572876
12/8/2022 8:57:48 PM,Williams begins pacts for full-value chain certified low emission next-gen gas,Seeking Alpha,https://seekingalpha.com/news/3915471-williams-begins-pacts-for-full-value-chain-certified-low-emission-next-gen-gas?utm_source=businessinsider&utm_medium=referral,positive,0.8085148334503174
12/15/2022 2:00:00 PM,Southwest Gas Simplifies Corporate Structure to Maximize Stockholder Value,PR Newswire,/news/stocks/southwest-gas-simplifies-corporate-structure-to-maximize-stockholder-value-1031974489,neutral,0.5668085813522339
12/15/2022 2:22:10 PM,"Southwest disposes MountainWest Pipelines for $1.5B, announces Centuri spin-off",Seeking Alpha,https://seekingalpha.com/news/3917578-southwest-disposes-mountainwest-pipelines-for-15b-announces-centuri-spin-off?utm_source=businessinsider&utm_medium=referral,neutral,0.9351258277893066
12/15/2022 2:22:17 PM,Williams To Acquire MountainWest Pipelines From Southwest Gas In $1.5 Bln Deal ,RTTNews,/news/stocks/williams-to-acquire-mountainwest-pipelines-from-southwest-gas-in-1-5-bln-deal-1031974593,neutral,0.8694092035293579
12/16/2022 2:36:28 PM,"Oneok upgraded, Williams downgraded as Wells Fargo adjusts midstream ratings",Seeking Alpha,https://seekingalpha.com/news/3918032-oneok-upgraded-williams-downgraded-as-wells-fargo-adjusts-midstream-ratings?utm_source=businessinsider&utm_medium=referral,negative,0.6730771660804749
12/16/2022 4:01:20 PM,"Benzinga's Top Ratings Upgrades, Downgrades For December 16, 2022",Benzinga,/news/stocks/benzinga-s-top-ratings-upgrades-downgrades-for-december-16-2022-1031977557,negative,0.4917415976524353
12/16/2022 8:31:04 PM,KMI vs. WMB: Which High-Yielding Natural Gas Stock is Better?,TipRanks,/news/stocks/kmi-vs-wmb-which-high-yielding-natural-gas-stock-is-better-1031978182,neutral,0.749148428440094
1/9/2023 4:25:29 PM,Morgan Stanley Keeps Their Hold Rating on Williams Co (WMB),TipRanks,/news/stocks/morgan-stanley-keeps-their-hold-rating-on-williams-co-wmb-1032007606,neutral,0.9098024368286133
1/18/2023 4:01:00 PM,"Benzinga's Top Ratings Upgrades, Downgrades For January 18, 2023",Benzinga,/news/stocks/benzinga-s-top-ratings-upgrades-downgrades-for-january-18-2023-1032025872,negative,0.5707111954689026
1/18/2023 8:57:53 PM,Williams slides after Citi downgrade; Magellan Midstream raised,Seeking Alpha,https://seekingalpha.com/news/3925593-williams-slides-after-citi-downgrade-magellan-midstream-raised?utm_source=businessinsider&utm_medium=referral,negative,0.9307432174682617
1/18/2023 10:00:56 PM,Analyst Ratings for Williams Companies,Benzinga,/news/stocks/analyst-ratings-for-williams-companies-1032026669,neutral,0.9304590225219727
1/20/2023 1:46:04 PM,3 Must-Sell Stocks if the Ukraine War Ends,InvestorPlace,/news/stocks/3-must-sell-stocks-if-the-ukraine-war-ends-1032030878,neutral,0.5986863374710083
1/27/2023 2:13:44 PM,These 3 Energy Stocks With Over 5% Dividend Yields Are Recommended By Benzinga's Most Accurate Analysts,Benzinga,/news/stocks/these-3-energy-stocks-with-over-5-dividend-yields-are-recommended-by-benzinga-s-most-accurate-analysts-1032046701,neutral,0.7247171401977539
2/14/2023 9:34:18 PM,"Williams closes deal for MountainWest natgas transmission, storage business",Seeking Alpha,https://seekingalpha.com/news/3936026-williams-closes-deal-for-mountainwest-natgas-transmission-storage-business?utm_source=businessinsider&utm_medium=referral,neutral,0.9112843871116638
2/14/2023 10:15:00 PM,Southwest Gas Holdings Announces Closing of Sale of MountainWest to Williams,PR Newswire,/news/stocks/southwest-gas-holdings-announces-closing-of-sale-of-mountainwest-to-williams-1032095986,neutral,0.934351921081543
2/17/2023 2:24:13 PM,Williams wins natural gas gathering deals for Chevron's Haynesville assets,Seeking Alpha,https://seekingalpha.com/news/3937715-williams-wins-natural-gas-gathering-deals-for-chevrons-haynesville-assets?utm_source=businessinsider&utm_medium=referral,positive,0.5083338618278503
2/17/2023 8:00:02 PM,"Catalyst watch: Spotlight on retail earnings, Lucid Group, Silvergate Capital and Radware",Seeking Alpha,https://seekingalpha.com/news/3937806-catalyst-watch-spotlight-on-retail-earnings-lucid-group-silvergate-capital-and-radware?utm_source=businessinsider&utm_medium=referral,neutral,0.9245150089263916
2/19/2023 3:01:13 PM,Here's what to expect from Williams Companies's earnings,Markets Insider Automation,/news/stocks/williams_companies-quarter-earnings-preview-q4-1032107476,neutral,0.9444857835769653
2/19/2023 10:35:54 PM,Notable earnings after Monday's close,Seeking Alpha,https://seekingalpha.com/news/3937888-notable-earnings-after-mondays-close?utm_source=businessinsider&utm_medium=referral,positive,0.8940556645393372
