datetime,title,source,link,sentiment_class,sentiment_score
3/4/2024 8:03:00 AM,"Analysts Offer Insights on Energy Companies: US Silica Holdings (SLCA), Cactus (WHD) and Williams Co (WMB)",TipRanks,/news/stocks/analysts-offer-insights-on-energy-companies-us-silica-holdings-slca-cactus-whd-and-williams-co-wmb-1033127804,neutral,0.9351177215576172
3/6/2024 11:33:12 AM,Bernstein Sticks to Their Hold Rating for Williams Co (WMB),TipRanks,/news/stocks/bernstein-sticks-to-their-hold-rating-for-williams-co-wmb-1033137864,neutral,0.8725272417068481
3/14/2024 9:45:23 PM,Williams Co: Hold Rating Maintained Amid Adjusted EBITDA and FCF Forecasts,TipRanks,/news/stocks/williams-co-hold-rating-maintained-amid-adjusted-ebitda-and-fcf-forecasts-1033166010,positive,0.800826370716095
3/15/2024 9:06:10 PM,Short interest on energy stocks up in February; COP remains least shorted,Seeking Alpha,https://seekingalpha.com/news/4080183-short-interest-on-energy-stocks-up-in-february-cop-remains-least-shorted?utm_source=businessinsider&utm_medium=referral&feed_item_type=news,positive,0.8496416211128235
3/19/2024 6:45:47 AM,Bernstein Keeps Their Hold Rating on Williams Co (WMB),TipRanks,/news/stocks/bernstein-keeps-their-hold-rating-on-williams-co-wmb-1033175493,neutral,0.9062147736549377
3/19/2024 7:47:17 PM,"Williams considered bid for Tellurian before passing, executive says",Seeking Alpha,https://seekingalpha.com/news/4081293-williams-considered-bid-for-tellurian-before-passing-executive-says?utm_source=businessinsider&utm_medium=referral&feed_item_type=news,neutral,0.9330523610115051
3/20/2024 11:20:48 AM,"Analysts Offer Insights on Energy Companies: APA (APA), Williams Co (WMB) and Kinetik (KNTK)",TipRanks,/news/stocks/analysts-offer-insights-on-energy-companies-apa-apa-williams-co-wmb-and-kinetik-kntk-1033180841,neutral,0.9313245415687561
3/20/2024 7:33:26 PM,"Williams delays disputed Louisiana gas pipeline, CEO Armstrong says",Seeking Alpha,https://seekingalpha.com/news/4081758-williams-delays-louisiana-gas-pipeline-in-dispute-ceo-armstrong-says?utm_source=businessinsider&utm_medium=referral&feed_item_type=news,negative,0.770327091217041
3/25/2024 12:25:08 PM,Truist Financial Remains a Hold on Williams Co (WMB),TipRanks,/news/stocks/truist-financial-remains-a-hold-on-williams-co-wmb-1033193936,neutral,0.6383652091026306
3/25/2024 6:24:31 PM,"Kinder Morgan cut at Truist, seeing limited near-term shareholder return growth",Seeking Alpha,https://seekingalpha.com/news/4083416-kinder-morgan-cut-at-truist-seeing-limited-near-term-shareholder-return-growth?utm_source=businessinsider&utm_medium=referral&feed_item_type=news,negative,0.8917540311813354
3/26/2024 10:00:00 AM,7 Energy Stocks to Scoop Up as Natural Gas Prices Hit Rock Bottom,InvestorPlace,/news/stocks/7-energy-stocks-to-scoop-up-as-natural-gas-prices-hit-rock-bottom-1033196050,positive,0.7300072312355042
3/27/2024 6:07:21 PM,"Russian cuts to crude output may bring $100 oil, J.P. Morgan says",Seeking Alpha,https://seekingalpha.com/news/4084584-russian-cuts-to-crude-output-may-bring-100-oil-jp-morgan-says?utm_source=businessinsider&utm_medium=referral&feed_item_type=news,positive,0.7654986381530762
4/1/2024 5:05:50 PM,Oil prices supported by stronger demand in Europe: Goldman Sachs,Seeking Alpha,https://seekingalpha.com/news/4085857-oil-prices-supported-by-stronger-demand-in-europe-goldman-sachs?utm_source=businessinsider&utm_medium=referral&feed_item_type=news,positive,0.9131054878234863
4/1/2024 8:25:52 PM,Mexico said to cut some oil exports as global supplies tighten,Seeking Alpha,https://seekingalpha.com/news/4085983-mexico-said-to-cut-some-oil-exports-as-global-supplies-tighten?utm_source=businessinsider&utm_medium=referral&feed_item_type=news,negative,0.963789701461792
4/3/2024 10:50:29 PM,"Crude oil pushes higher on global tensions, signs of strong U.S. gasoline demand",Seeking Alpha,https://seekingalpha.com/news/4087076-crude-oil-pushes-higher-on-global-tensions-signs-of-strong-us-gasoline-demand?utm_source=businessinsider&utm_medium=referral&feed_item_type=news,positive,0.9170665740966797
4/8/2024 10:06:53 AM,Bernstein Reaffirms Their Hold Rating on Williams Co (WMB),TipRanks,/news/stocks/bernstein-reaffirms-their-hold-rating-on-williams-co-wmb-1033229744,neutral,0.8867765069007874
4/8/2024 8:28:33 PM,Energy Transfer files for FERC review in pipeline dispute with Williams,Seeking Alpha,https://seekingalpha.com/news/4088039-energy-transfer-files-for-ferc-review-in-pipeline-dispute-with-williams?utm_source=businessinsider&utm_medium=referral&feed_item_type=news,negative,0.7309707999229431
4/8/2024 11:36:16 PM,Buy Rating Affirmed for Williams Companies Inc. on Financial Resilience and Growth Potential,TipRanks,/news/stocks/buy-rating-affirmed-for-williams-companies-inc-on-financial-resilience-and-growth-potential-1033231371,positive,0.911270022392273
4/9/2024 11:05:17 PM,Hold Rating on Williams Co. Amid Short-Term Headwinds and Long-Term Market Potential,TipRanks,/news/stocks/hold-rating-on-williams-co-amid-short-term-headwinds-and-long-term-market-potential-1033234996,negative,0.9510142803192139
4/11/2024 7:05:44 AM,Barclays Keeps Their Hold Rating on Williams Co (WMB),TipRanks,/news/stocks/barclays-keeps-their-hold-rating-on-williams-co-wmb-1033240300,neutral,0.9212510585784912
4/12/2024 5:50:34 AM,Analysts Have Conflicting Sentiments on These Energy Companies: Williams Co (WMB) and Conocophillips (COP),TipRanks,/news/stocks/analysts-have-conflicting-sentiments-on-these-energy-companies-williams-co-wmb-and-conocophillips-cop-1033243521,negative,0.8954371809959412
4/15/2024 4:11:02 PM,"Short interest on energy stocks up in March; APA and EQT most shorted, COP least shorted",Seeking Alpha,https://seekingalpha.com/news/4089685-short-interest-on-energy-stocks-up-in-march-apa-and-eqt-most-shorted-cop-least-shorted?utm_source=businessinsider&utm_medium=referral&feed_item_type=news,positive,0.873924732208252
4/17/2024 9:07:36 AM,"Analysts’ Opinions Are Mixed on These Energy Stocks: Williams Co (WMB), TotalEnergies SE (GB:TTE) and Magnolia Oil & Gas (MGY)",TipRanks,/news/stocks/analysts-opinions-are-mixed-on-these-energy-stocks-williams-co-wmb-totalenergies-se-gb-tte-and-magnolia-oil-gas-mgy-1033257622,negative,0.811078667640686
4/18/2024 8:35:43 AM,Sell Rating on Williams Co Due to Overvaluation and Financial Forecast Concerns,TipRanks,/news/stocks/sell-rating-on-williams-co-due-to-overvaluation-and-financial-forecast-concerns-1033261636,negative,0.9512550234794617
4/18/2024 7:23:31 PM,"Williams downgraded, Western Midstream raised at Mizuho in pipeline rating switch",Seeking Alpha,https://seekingalpha.com/news/4091218-williams-downgraded-western-midstream-raised-at-mizuho-in-pipeline-rating-switch?utm_source=businessinsider&utm_medium=referral&feed_item_type=news,negative,0.8520737290382385
4/23/2024 1:52:18 AM,Williams Co (WMB) Receives a Buy from RBC Capital,TipRanks,/news/stocks/williams-co-wmb-receives-a-buy-from-rbc-capital-1033273817,neutral,0.5587306022644043
4/24/2024 3:51:47 PM,Dividend Investing: Only 14 S&P stocks have a 3% yield and have climbed over 10% YTD,Seeking Alpha,https://seekingalpha.com/news/4093152-dividend-investing-only-14-sp-stocks-have-a-3-yield-and-returned-over-10-ytd?utm_source=businessinsider&utm_medium=referral&feed_item_type=news,positive,0.5636342763900757
4/30/2024 3:25:58 PM,Williams declares $0.475 dividend,Seeking Alpha,https://seekingalpha.com/news/4096425-williams-companies-inc-declares-0_475-dividend?utm_source=businessinsider&utm_medium=referral&feed_item_type=news,neutral,0.9461792707443237
5/5/2024 12:00:00 PM,"Earnings week ahead: Disney, Palantir, Shopify, Uber, Plug Power and more",Seeking Alpha,https://seekingalpha.com/news/4099576-earnings-week-ahead-disney-palantir-realty-income-shopify-uber-plug-power-and-more?utm_source=businessinsider&utm_medium=referral&feed_item_type=news,neutral,0.9203617572784424
5/5/2024 3:01:13 PM,Williams Companies earnings preview: what to expect,Markets Insider Automation,/news/stocks/williams_companies-q1-quarterly-earnings-preview-stock-1033329449,neutral,0.9045466184616089
5/5/2024 9:35:00 PM,Williams Q1 2024 Earnings Preview,Seeking Alpha,https://seekingalpha.com/news/4099810-williams-q1-2024-earnings-preview?utm_source=businessinsider&utm_medium=referral&feed_item_type=news,neutral,0.8826690912246704
5/5/2024 9:35:41 PM,Notable earnings after Monday's close,Seeking Alpha,https://seekingalpha.com/news/4100038-notable-earnings-after-mondays-close?utm_source=businessinsider&utm_medium=referral&feed_item_type=news,positive,0.8940556645393372
5/6/2024 7:33:04 PM,"Stocks On Track For Third Green Session, Palantir Ignites Rally In Chipmakers, Commodities Rebound: What's Driving Markets Monday?",Benzinga,/news/stocks/stocks-on-track-for-third-green-session-palantir-ignites-rally-in-chipmakers-commodities-rebound-what-s-driving-markets-monday-1033334843,neutral,0.665195107460022
5/6/2024 8:18:41 PM,"Williams Non-GAAP EPS of $0.59 beats by $0.10, revenue of $2.77B beats by $80M",Seeking Alpha,https://seekingalpha.com/news/4100724-williams-non-gaap-eps-of-0_59-beats-0_10-revenue-of-2_77b-beats-80m?utm_source=businessinsider&utm_medium=referral&feed_item_type=news,neutral,0.7212931513786316
5/6/2024 10:29:41 PM,"Williams Cos. Q1 Profit Decreases, but beats estimates",RTTNews,/news/stocks/williams-cos-q1-profit-decreases-but-beats-estimates-1033335214,negative,0.9654474854469299
5/7/2024 12:53:28 AM,"WMB Stock Earnings: Williams Companies Beats EPS, Beats Revenue for Q1 2024",InvestorPlace,/news/stocks/wmb-stock-earnings-williams-companies-for-q1-of-2024-1033335715,neutral,0.5026916265487671
5/7/2024 12:10:07 PM,Scotiabank Remains a Hold on Williams Co (WMB),TipRanks,/news/stocks/scotiabank-remains-a-hold-on-williams-co-wmb-1033340674,neutral,0.8287967443466187
5/7/2024 12:12:29 PM,"Analysts Offer Insights on Energy Companies: Crescent Energy Company Class A (CRGY), Williams Co (WMB) and Freehold Royalties (OtherFRHLF)",TipRanks,/news/stocks/analysts-offer-insights-on-energy-companies-crescent-energy-company-class-a-crgy-williams-co-wmb-and-freehold-royalties-otherfrhlf-1033340646,neutral,0.9385364651679993
5/7/2024 4:57:06 PM,"Williams expects win in pipeline dispute with Energy Transfer, execs say",Seeking Alpha,https://seekingalpha.com/news/4101551-williams-expects-win-in-pipeline-dispute-with-energy-transfer-execs-say?utm_source=businessinsider&utm_medium=referral&feed_item_type=news,positive,0.6661342978477478
5/8/2024 9:33:25 AM,Analysts Offer Insights on Energy Companies: Williams Co (WMB) and BP (BP),TipRanks,/news/stocks/analysts-offer-insights-on-energy-companies-williams-co-wmb-and-bp-bp-1033347050,neutral,0.9309325218200684
5/8/2024 3:30:49 PM,Analysts Have Conflicting Sentiments on These Energy Companies: NuVista Energy (OtherNUVSF) and Williams Co (WMB),TipRanks,/news/stocks/analysts-have-conflicting-sentiments-on-these-energy-companies-nuvista-energy-othernuvsf-and-williams-co-wmb-1033349827,negative,0.9328758120536804
5/9/2024 2:11:21 AM,"Analysts Are Bullish on These Energy Stocks: Cactus (WHD), Williams Co (WMB)",TipRanks,/news/stocks/analysts-are-bullish-on-these-energy-stocks-cactus-whd-williams-co-wmb-1033354158,neutral,0.81090247631073
5/10/2024 6:02:02 AM,"Analysts Offer Insights on Energy Companies: Williams Co (WMB), California Resources Corp (CRC) and Chord Energy (CHRD)",TipRanks,/news/stocks/analysts-offer-insights-on-energy-companies-williams-co-wmb-california-resources-corp-crc-and-chord-energy-chrd-1033362106,neutral,0.9400274753570557
5/10/2024 8:25:36 AM,Hold Rating on Williams Co Amid Market Challenges and Growth Potential,TipRanks,/news/stocks/hold-rating-on-williams-co-amid-market-challenges-and-growth-potential-1033362520,negative,0.43868499994277954
5/10/2024 9:20:08 AM,"Analysts Offer Insights on Energy Companies: Excelerate Energy, Inc. Class A (EE), Williams Co (WMB) and Teekay Tankers (TNK)",TipRanks,/news/stocks/analysts-offer-insights-on-energy-companies-excelerate-energy-inc-class-a-ee-williams-co-wmb-and-teekay-tankers-tnk-1033362766,neutral,0.9321386218070984
5/14/2024 7:00:02 PM,19 Stocks and ETFs to benefit from the electrification theme and future energy technologies - BofA,Seeking Alpha,https://seekingalpha.com/news/4105948-19-stocks-and-etfs-to-benefit-from-the-electrification-theme-and-future-energy-technologies-bofa?utm_source=businessinsider&utm_medium=referral&feed_item_type=news,neutral,0.7697482109069824
5/31/2024 10:00:00 AM,7 Oil Stocks to Watch as Middle East Politics Take Center Stage,InvestorPlace,/news/stocks/7-oil-stocks-to-watch-as-middle-east-politics-take-center-stage-1033440555,neutral,0.8707942962646484
6/4/2024 6:01:00 PM,Expert Ratings For Williams Companies,Benzinga,/news/stocks/expert-ratings-for-williams-companies-1033450567,neutral,0.907343864440918
6/4/2024 7:27:45 PM,"Kinder Morgan, Williams edge higher as Wells Fargo raises to Overweight",Seeking Alpha,https://seekingalpha.com/news/4112827-kinder-morgan-williams-edge-higher-as-wells-fargo-raises-to-overweight?utm_source=businessinsider&utm_medium=referral&feed_item_type=news,positive,0.8886982798576355
6/5/2024 6:52:07 PM,Williams wins favorable court ruling in Energy Transfer litigation - Bloomberg,Seeking Alpha,https://seekingalpha.com/news/4113311-williams-wins-favorable-court-ruling-in-energy-transfer-litigation-bloomberg?utm_source=businessinsider&utm_medium=referral&feed_item_type=news,positive,0.8662633299827576
6/7/2024 12:05:55 PM,3 Energy Stocks to Buy Now on a Nvidia-Driven Surge,InvestorPlace,/news/stocks/3-energy-stocks-to-buy-now-on-a-nvidia-driven-surge-1033460955,neutral,0.8219437003135681
6/8/2024 12:40:54 PM,Analysts Have Conflicting Sentiments on These Energy Companies: NGL Energy Partners (NGL) and Williams Co (WMB),TipRanks,/news/stocks/analysts-have-conflicting-sentiments-on-these-energy-companies-ngl-energy-partners-ngl-and-williams-co-wmb-1033462872,negative,0.9386505484580994
6/10/2024 9:29:00 PM,Wells Fargo Pounds the Table on These 2 Energy Stocks,TipRanks,/news/stocks/wells-fargo-pounds-the-table-on-these-2-energy-stocks-1033467207,neutral,0.9201438426971436
6/14/2024 1:45:00 PM,"EQT, APA, OXY most shorted S&P 500 energy stocks in May",Seeking Alpha,https://seekingalpha.com/news/4115778-top-shorted-sp-500-energy-stocks-at-may-end?utm_source=businessinsider&utm_medium=referral&feed_item_type=news,neutral,0.9058980941772461
6/18/2024 11:25:14 AM,Williams Co (WMB) Receives a Hold from Truist Financial,TipRanks,/news/stocks/williams-co-wmb-receives-a-hold-from-truist-financial-1033487684,neutral,0.8544744253158569
6/20/2024 5:02:39 PM,Williams raised to Buy at Argus on bullish view of natural gas prices,Seeking Alpha,https://seekingalpha.com/news/4117592-williams-raised-to-buy-at-argus-on-bullish-view-of-natural-gas-prices?utm_source=businessinsider&utm_medium=referral&feed_item_type=news,positive,0.8699369430541992
6/20/2024 6:01:13 PM,The Analyst Verdict: Williams Companies In The Eyes Of 11 Experts,Benzinga,/news/stocks/the-analyst-verdict-williams-companies-in-the-eyes-of-11-experts-1033493742,neutral,0.7953732013702393
6/21/2024 5:40:34 PM,Top 10 S&P 500 stocks with at least a 4% dividend yield,Seeking Alpha,https://seekingalpha.com/news/4118009-top-10-sp-500-stocks-with-at-least-a-4-dividend-yield?utm_source=businessinsider&utm_medium=referral&feed_item_type=news,neutral,0.8792364001274109
6/27/2024 9:46:30 AM,Williams Co: A Buy Rating Amidst Seasonal Impacts with a Long-Term Positive Outlook,TipRanks,/news/stocks/williams-co-a-buy-rating-amidst-seasonal-impacts-with-a-long-term-positive-outlook-1033511307,neutral,0.5231659412384033
6/30/2024 5:39:00 PM,"Energy is the second worst performer amongst S&P 500 sectors in Q2; APA, SLB, and HAL among losers YTD",Seeking Alpha,https://seekingalpha.com/news/4120514-energy-is-second-worst-performer-amongst-s-and-p-500-sectors-in-q2-apa-slb-and-hal-among?utm_source=businessinsider&utm_medium=referral&feed_item_type=news,negative,0.9683529138565063
7/1/2024 12:10:57 PM,"Analysts Offer Insights on Energy Companies: EOG Resources (EOG), Range Resources (RRC) and Williams Co (WMB)",TipRanks,/news/stocks/analysts-offer-insights-on-energy-companies-eog-resources-eog-range-resources-rrc-and-williams-co-wmb-1033520383,neutral,0.9282315969467163
7/3/2024 5:05:11 PM,Court rules Williams project OK to cross path of Energy Transfer pipeline,Seeking Alpha,https://seekingalpha.com/news/4122158-court-rules-williams-project-ok-to-cross-path-of-energy-transfer-pipeline?utm_source=businessinsider&utm_medium=referral&feed_item_type=news,neutral,0.846786379814148
7/5/2024 5:46:38 PM,Williams Wins Court Case for Louisiana Energy Project,Benzinga,/news/stocks/williams-wins-court-case-for-louisiana-energy-project-1033532639,neutral,0.5666884183883667
7/10/2024 6:46:37 PM,"Western Midstream cut to Hold, Williams maintained Buy at Stifel",Seeking Alpha,https://seekingalpha.com/news/4123400-western-midstream-cut-to-hold-williams-maintained-buy-at-stifel?utm_source=businessinsider&utm_medium=referral&feed_item_type=news,positive,0.5023411512374878
7/10/2024 10:03:53 PM,BP Faces $3B Hit in 2Q24 Amid Refining Challenges & Low Demand,Benzinga,/news/stocks/bp-faces-3b-hit-in-2q24-amid-refining-challenges-low-demand-1033544727,negative,0.9644613265991211
7/11/2024 2:05:14 AM,Stifel Nicolaus Remains a Buy on Williams Co (WMB),TipRanks,/news/stocks/stifel-nicolaus-remains-a-buy-on-williams-co-wmb-1033545724,neutral,0.9457905292510986
7/11/2024 8:22:27 PM,Enbridge Faces DOJ Pressure for Pipeline Crack Repairs,Benzinga,/news/stocks/enbridge-faces-doj-pressure-for-pipeline-crack-repairs-1033548359,negative,0.9559229016304016
7/12/2024 8:19:36 AM,Williams Co (WMB) Gets a Hold from Barclays,TipRanks,/news/stocks/williams-co-wmb-gets-a-hold-from-barclays-1033550057,neutral,0.8433900475502014
7/12/2024 8:01:16 PM,A Glimpse Into The Expert Outlook On Williams Companies Through 9 Analysts,Benzinga,/news/stocks/a-glimpse-into-the-expert-outlook-on-williams-companies-through-9-analysts-1033551408,neutral,0.8881136178970337
7/16/2024 6:00:00 PM,7 High-Yield Dividend Stocks Beating Inflation,InvestorPlace,/news/stocks/7-high-yield-dividend-stocks-beating-inflation-1033560590,positive,0.7957503795623779
7/22/2024 3:35:23 PM,Williams set to resume building Louisiana Energy Gateway gas project,Seeking Alpha,https://seekingalpha.com/news/4126335-williams-set-to-resume-building-louisiana-energy-gateway-gas-project?utm_source=businessinsider&utm_medium=referral&feed_item_type=news,neutral,0.9232375025749207
7/24/2024 8:18:53 PM,7 Trustworthy Dividend Stocks to Steadily Build Your Portfolio,InvestorPlace,/news/stocks/7-trustworthy-dividend-stocks-to-steadily-build-your-portfolio-1033590875,positive,0.7986804842948914
7/30/2024 3:34:13 PM,Williams declares $0.475 dividend,Seeking Alpha,https://seekingalpha.com/news/4130226-williams-declares-0475-dividend?utm_source=businessinsider&utm_medium=referral&feed_item_type=news,neutral,0.9461792707443237
7/30/2024 7:23:18 PM,Williams downgraded to Neutral at Seaport Global after YTD run-up,Seeking Alpha,https://seekingalpha.com/news/4130508-williams-downgraded-to-neutral-at-seaport-global-after-ytd-run-up?utm_source=businessinsider&utm_medium=referral&feed_item_type=news,negative,0.8294776082038879
7/30/2024 8:27:06 PM,Court vacates FERC certificate for Williams' new $1B REA natural gas project,Seeking Alpha,https://seekingalpha.com/news/4130594-court-vacates-ferc-certificate-for-williams-new-1b-rea-natural-gas-project?utm_source=businessinsider&utm_medium=referral&feed_item_type=news,neutral,0.8741554617881775
8/2/2024 7:00:00 PM,"Catalyst Watch: Disney earnings, Costco sales update, MicroStrategy split, and eyes on AI patents",Seeking Alpha,https://seekingalpha.com/news/4132451-catalyst-watch-disney-earnings-costco-sales-update-microstrategy-split-and-eyes-on-ai-patents?utm_source=businessinsider&utm_medium=referral&feed_item_type=news,neutral,0.6060431599617004
8/4/2024 12:00:00 PM,"Earnings week ahead: Disney, Duke Energy, Palantir, Shopify, Uber and more",Seeking Alpha,https://seekingalpha.com/news/4133349-earnings-week-ahead-disney-duke-energy-palantir-shopify-uber-plug-power-nikola-and-more?utm_source=businessinsider&utm_medium=referral&feed_item_type=news,neutral,0.9215457439422607
8/4/2024 3:01:13 PM,Here's what Wall Street expects from Williams Companies's earnings,Markets Insider Automation,/news/stocks/williams_companies-q2-quarterly-earnings-preview-1033634940,neutral,0.94053053855896
8/4/2024 9:35:00 PM,Williams Q2 2024 Earnings Preview,Seeking Alpha,https://seekingalpha.com/news/4133556-williams-q2-2024-earnings-preview?utm_source=businessinsider&utm_medium=referral&feed_item_type=news,neutral,0.8831729292869568
8/4/2024 9:35:27 PM,Notable earnings after Monday's close,Seeking Alpha,https://seekingalpha.com/news/4133692-notable-earnings-after-mondays-close?utm_source=businessinsider&utm_medium=referral&feed_item_type=news,positive,0.8940556645393372
8/5/2024 4:20:49 PM,Best volatility ranking stocks with low moves and straddle premiums vs. history - BofA,Seeking Alpha,https://seekingalpha.com/news/4134163-best-volatility-ranking-stocks-with-low-moves-and-straddle-premiums-vs-history-bofa?utm_source=businessinsider&utm_medium=referral&feed_item_type=news,neutral,0.822754979133606
8/5/2024 8:18:28 PM,"Williams Non-GAAP EPS of $0.43 beats by $0.06, revenue of $2.34B misses by $120M",Seeking Alpha,https://seekingalpha.com/news/4134398-williams-non-gaap-eps-of-0_43-beats-0_06-revenue-of-2_34b-misses-120m?utm_source=businessinsider&utm_medium=referral&feed_item_type=news,neutral,0.7231758236885071
8/5/2024 10:38:58 PM,"Williams Cos. Q2 Profit Decreases, But Beats Estimates ",RTTNews,/news/stocks/williams-cos-q2-profit-decreases-but-beats-estimates-1033641075,negative,0.965111255645752
8/6/2024 12:54:46 AM,"WMB Stock Earnings: Williams Companies Beats EPS, Misses Revenue for Q2 2024",InvestorPlace,/news/stocks/wmb-stock-earnings-williams-companies-for-q2-of-2024-1033641363,positive,0.41529831290245056
8/6/2024 11:36:55 AM,Hold Rating on Williams Companies Inc.: Balancing Strategic Acquisitions and Mixed Segment Performance,TipRanks,/news/stocks/hold-rating-on-williams-companies-inc-balancing-strategic-acquisitions-and-mixed-segment-performance-1033646164,positive,0.6659209728240967
8/6/2024 12:45:19 PM,Williams Co (WMB) Gets a Hold from Seaport Global,TipRanks,/news/stocks/williams-co-wmb-gets-a-hold-from-seaport-global-1033646578,neutral,0.8743371963500977
8/6/2024 1:09:31 PM,Scotiabank Reaffirms Their Hold Rating on Williams Co (WMB),TipRanks,/news/stocks/scotiabank-reaffirms-their-hold-rating-on-williams-co-wmb-1033646755,neutral,0.8267374634742737
8/6/2024 6:32:27 PM,Williams rises on Q2 earnings beat as demand grows at 'unprecedented' pace,Seeking Alpha,https://seekingalpha.com/news/4135253-williams-rises-on-q2-earnings-beat-as-demand-grows-at-unprecedented-pace?utm_source=businessinsider&utm_medium=referral&feed_item_type=news,positive,0.918515145778656
8/7/2024 1:56:04 PM,CIBC Reaffirms Their Hold Rating on Williams Co (WMB),TipRanks,/news/stocks/cibc-reaffirms-their-hold-rating-on-williams-co-wmb-1033654922,neutral,0.8610444068908691
8/7/2024 11:55:20 PM,Maintaining Hold on Williams Co Amidst Modest Earnings Beat and Growth Prospects with Caution on Near-Term Risks,TipRanks,/news/stocks/maintaining-hold-on-williams-co-amidst-modest-earnings-beat-and-growth-prospects-with-caution-on-near-term-risks-1033656113,neutral,0.5198706388473511
8/9/2024 3:13:05 PM,74 S&P 500 stocks that can beat the cash yield - BofA,Seeking Alpha,https://seekingalpha.com/news/4138195-74-sp-500-stocks-that-can-beat-the-cash-yield-bofa?utm_source=businessinsider&utm_medium=referral&feed_item_type=news,neutral,0.6393485069274902
8/19/2024 1:09:11 PM,Williams Co (WMB) Receives a Hold from Morgan Stanley,TipRanks,/news/stocks/williams-co-wmb-receives-a-hold-from-morgan-stanley-1033704950,neutral,0.8661606311798096
8/23/2024 10:36:39 AM,Williams Co (WMB) Receives a Rating Update from a Top Analyst,TipRanks,/news/stocks/williams-co-wmb-receives-a-rating-update-from-a-top-analyst-1033718155,neutral,0.8689324855804443
9/4/2024 1:37:12 PM,Targa Resources rebuffed interest from Williams in recent months - Bloomberg,Seeking Alpha,https://seekingalpha.com/news/4146779-targa-resources-rebuffed-interest-from-williams-in-recent-months-bloomberg?utm_source=businessinsider&utm_medium=referral&feed_item_type=news,negative,0.781080424785614
9/4/2024 8:33:11 PM,"Williams to add dozen U.S. natural gas projects through 2027, CEO says",Seeking Alpha,https://seekingalpha.com/news/4147059-williams-to-add-dozen-us-natural-gas-projects-through-2027-ceo-says?utm_source=businessinsider&utm_medium=referral&feed_item_type=news,positive,0.7182375192642212
9/17/2024 12:36:03 PM,Stifel Nicolaus Sticks to Their Buy Rating for Williams Co (WMB),TipRanks,/news/stocks/stifel-nicolaus-sticks-to-their-buy-rating-for-williams-co-wmb-1033778067,neutral,0.772355318069458
10/1/2024 3:17:15 PM,Permian gas begins flowing through Matterhorn pipeline - Bloomberg,Seeking Alpha,https://seekingalpha.com/news/4155053-permian-gas-begins-flowing-through-matterhorn-pipeline-bloomberg?utm_source=businessinsider&utm_medium=referral&feed_item_type=news,neutral,0.8317789435386658
10/2/2024 8:18:14 AM,Barclays Sticks to Its Hold Rating for Williams Co (WMB),TipRanks,/news/stocks/barclays-sticks-to-its-hold-rating-for-williams-co-wmb-1033814598,neutral,0.873196542263031
10/2/2024 2:28:00 PM,S&P 500 Energy ends Q3 on negative note as crude prices fall,Seeking Alpha,https://seekingalpha.com/news/4155317-energy?utm_source=businessinsider&utm_medium=referral&feed_item_type=news,negative,0.9742621779441833
