Unnamed: 0,datetime,title,source,link
353.0,2/13/2024 2:44:39 PM,Cadence Design Systems Analysts Raise Their Forecasts After Q4 Results,Benzinga,/news/stocks/cadence-design-systems-analysts-raise-their-forecasts-after-q4-results-1033061019
354.0,2/13/2024 7:13:37 PM,Why IPG Photonics Shares Are Trading Lower By Around 11%? Here Are Other Stocks Moving In Tuesday's Mid-Day Session,Benzinga,/news/stocks/why-ipg-photonics-shares-are-trading-lower-by-around-11-here-are-other-stocks-moving-in-tuesday-s-mid-day-session-1033062620
355.0,2/14/2024 2:14:14 AM,"AVGO, CDNS, NOW: Which Strong-Buy-Rated Tech Stock Is Best?",TipRanks,/news/stocks/avgo-cdns-now-which-strong-buy-rated-tech-stock-is-best-1033063767
356.0,2/14/2024 12:31:02 PM,Analysts Offer Insights on Technology Companies: Cadence Design (CDNS) and Leidos Holdings (LDOS),TipRanks,/news/stocks/analysts-offer-insights-on-technology-companies-cadence-design-cdns-and-leidos-holdings-ldos-1033067408
357.0,2/14/2024 4:00:52 PM,Cadence Design Sys Stock: A Deep Dive Into Analyst Perspectives (8 Ratings),Benzinga,/news/stocks/cadence-design-sys-stock-a-deep-dive-into-analyst-perspectives-8-ratings-1033067228
358.0,2/14/2024 6:00:28 PM,Exit Now! 7 Nasdaq Stocks to Sell in February 2024.,InvestorPlace,/news/stocks/exit-now-7-nasdaq-stocks-to-sell-in-february-2024-1033067903
359.0,2/23/2024 9:28:31 PM,"Intel Foundry Day Takeaway: Revenue Scale Is 'Several Years' Away, Analysts Say",Benzinga,/news/stocks/intel-foundry-day-takeaway-revenue-scale-is-several-years-away-analysts-say-1033098933
360.0,3/5/2024 12:07:08 PM,"Jim Cramer Picks These 4 Stocks As Better AI Investments Alongside Nvidia, Skips Super Micro Computer",Benzinga,/news/stocks/jim-cramer-picks-these-4-stocks-as-better-ai-investments-alongside-nvidia-skips-super-micro-computer-1033132171
361.0,3/5/2024 4:17:02 PM,Cadence bolsters structural analysis capabilities through BETA CAE deal for $1.24B,Seeking Alpha,https://seekingalpha.com/news/4076054-cadence-bolsters-structural-analysis-capabilities-through-beta-cae-deal-for-124b?utm_source=businessinsider&utm_medium=referral&feed_item_type=news
362.0,3/5/2024 4:44:54 PM,Cadence To Acquire BETA CAE For $1.24 Bln ,RTTNews,/news/stocks/cadence-to-acquire-beta-cae-for-1-24-bln-1033133767
363.0,3/5/2024 8:15:33 PM,Buy Rating Affirmed: Cadence Design’s Growth Prospects Strengthened by Strategic Acquisition,TipRanks,/news/stocks/buy-rating-affirmed-cadence-design-s-growth-prospects-strengthened-by-strategic-acquisition-1033135032
364.0,3/6/2024 11:11:27 AM,"Analysts Offer Insights on Technology Companies: Cadence Design (CDNS), MongoDB (MDB) and Broadcom (AVGO)",TipRanks,/news/stocks/analysts-offer-insights-on-technology-companies-cadence-design-cdns-mongodb-mdb-and-broadcom-avgo-1033137679
365.0,3/6/2024 12:40:48 PM,"Analysts Are Bullish on Top Technology Stocks: HashiCorp (HCP), Cadence Design (CDNS)",TipRanks,/news/stocks/analysts-are-bullish-on-top-technology-stocks-hashicorp-hcp-cadence-design-cdns-1033138444
366.0,3/6/2024 1:00:50 PM,The Latest Analyst Ratings For Cadence Design Sys,Benzinga,/news/stocks/the-latest-analyst-ratings-for-cadence-design-sys-1033137024
367.0,3/6/2024 10:18:45 PM,"Nvidia Tops in Popularity Among S&P 500 Semiconductor Stocks, Analyst Sees Room for Growth",Benzinga,/news/stocks/nvidia-tops-in-popularity-among-s-p-500-semiconductor-stocks-analyst-sees-room-for-growth-1033139465
368.0,3/7/2024 5:03:21 AM,Wall Street Analysts Are Bullish on Top Technology Picks,TipRanks,/news/stocks/wall-street-analysts-are-bullish-on-top-technology-picks-1033140833
369.0,3/8/2024 8:37:09 PM,3 AI Stocks That Nvidia Should Buy Next,InvestorPlace,/news/stocks/3-ai-stocks-that-nvidia-should-buy-next-1033147633
370.0,3/14/2024 2:29:05 AM,"DELL, CDNS, INTU: Which AI-Exposed Tech Stock Is Best?",TipRanks,/news/stocks/dell-cdns-intu-which-ai-exposed-tech-stock-is-best-1033162122
371.0,3/18/2024 8:49:49 PM,"Nvidia GTC 2024: Tech giant shows off new GB200 GPU, accelerated computing, more",Seeking Alpha,https://seekingalpha.com/news/4080570-nvidia-gtc-2024-tech-giant-shows-off-blackwell-gpu-more?utm_source=businessinsider&utm_medium=referral&feed_item_type=news
372.0,3/18/2024 10:05:51 PM,"Nvidia GTC 2024: Tech giant shows off new GB200 GPU, accelerated computing, more",Seeking Alpha,https://seekingalpha.com/news/4080570-nvidia-gtc-2024-tech-giant-shows-off-tk?utm_source=businessinsider&utm_medium=referral&feed_item_type=news
373.0,3/19/2024 2:53:44 PM,How Nvidia GTC 2024 Can Supercharge NVDA Stock,InvestorPlace,/news/stocks/how-nvidia-gtc-2024-can-supercharge-nvda-stock-1033177337
374.0,3/25/2024 5:52:51 PM,3 Wide-Moat Stocks That Could Triple By 2030,InvestorPlace,/news/stocks/3-wide-moat-stocks-that-could-triple-by-2030-1033194344
375.0,3/25/2024 7:00:00 PM,3 AI Stocks to Buy for the Next Bull Run: March 2024,InvestorPlace,/news/stocks/3-ai-stocks-to-buy-for-the-next-bull-run-march-2024-1033194513
376.0,3/25/2024 7:00:00 PM,3 AI Stocks to Buy Following the 2024 Nvidia GTC Conference,InvestorPlace,/news/stocks/3-ai-stocks-to-buy-following-the-2024-nvidia-gtc-conference-1033194512
377.0,4/2/2024 10:31:00 AM,Scorching Hot: 3 Nasdaq AI Stocks to Buy Now,InvestorPlace,/news/stocks/scorching-hot-3-nasdaq-ai-stocks-to-buy-now-1033214154
378.0,4/4/2024 9:10:13 AM,"Analysts Offer Insights on Technology Companies: Block (SQ), Cadence Design (CDNS) and Zeta Global Holdings Corp (ZETA)",TipRanks,/news/stocks/analysts-offer-insights-on-technology-companies-block-sq-cadence-design-cdns-and-zeta-global-holdings-corp-zeta-1033222197
379.0,4/4/2024 2:01:17 PM,Evaluating Cadence Design Sys: Insights From 10 Financial Analysts,Benzinga,/news/stocks/evaluating-cadence-design-sys-insights-from-10-financial-analysts-1033222115
380.0,4/15/2024 6:45:18 AM,"New Buy Rating for Cadence Design (CDNS), the Technology Giant",TipRanks,/news/stocks/new-buy-rating-for-cadence-design-cdns-the-technology-giant-1033248519
381.0,4/15/2024 2:39:52 PM,Cisco To Rally Around 24%? Here Are 10 Top Analyst Forecasts For Monday,Benzinga,/news/stocks/cisco-to-rally-around-24-here-are-10-top-analyst-forecasts-for-monday-1033249172
382.0,4/15/2024 11:40:27 PM,Analysts Offer Insights on Technology Companies: ON Semiconductor (ON) and Cadence Design (CDNS),TipRanks,/news/stocks/analysts-offer-insights-on-technology-companies-on-semiconductor-on-and-cadence-design-cdns-1033251097
383.0,4/18/2024 2:46:43 PM,Tesla To $123? Here Are 10 Top Analyst Forecasts For Thursday,Benzinga,/news/stocks/tesla-to-123-here-are-10-top-analyst-forecasts-for-thursday-1033262028
384.0,4/18/2024 7:45:25 PM,Bentley Systems valuation may hurt takeout premium - analyst,Seeking Alpha,https://seekingalpha.com/news/4091223-bentley-systems-valuation-may-hurt-takeout-premium-analyst?utm_source=businessinsider&utm_medium=referral&feed_item_type=news
385.0,4/18/2024 7:59:39 PM,Bentley Systems jumps amid report of takeover interest (update),Seeking Alpha,https://seekingalpha.com/news/4091111-bentley-systems-jumps-amid-report-of-takeover-interest?utm_source=businessinsider&utm_medium=referral&feed_item_type=news
386.0,4/19/2024 10:20:11 AM,Analysts Offer Insights on Technology Companies: Cadence Design (CDNS) and MetaWorks Platforms (OtherMWRK),TipRanks,/news/stocks/analysts-offer-insights-on-technology-companies-cadence-design-cdns-and-metaworks-platforms-othermwrk-1033266133
387.0,4/19/2024 10:55:00 AM,Schneider Electric confirms discussions with Bentley Systems (update),Seeking Alpha,https://seekingalpha.com/news/4091333-schneider-electric-in-discussions-to-take-control-of-bentley-systems-wsj?utm_source=businessinsider&utm_medium=referral&feed_item_type=news
388.0,4/21/2024 3:01:13 PM,Here's what Wall Street expects from Cadence Design Systems's earnings report,Markets Insider Automation,/news/stocks/cadence_design_systems-q1-quarterly-earnings-preview-1033268250
389.0,4/21/2024 9:35:00 PM,Cadence Design Systems Q1 2024 Earnings Preview,Seeking Alpha,https://seekingalpha.com/news/4091560-cadence-design-systems-q1-2024-earnings-preview?utm_source=businessinsider&utm_medium=referral&feed_item_type=news
390.0,4/21/2024 9:35:17 PM,Notable earnings after Monday's close,Seeking Alpha,https://seekingalpha.com/news/4091716-notable-earnings-after-mondays-close?utm_source=businessinsider&utm_medium=referral&feed_item_type=news
391.0,4/22/2024 8:05:19 PM,"Cadence Design Systems Non-GAAP EPS of $1.17 beats by $0.04, revenue of $1.01B misses by $10M",Seeking Alpha,https://seekingalpha.com/news/4092153-cadence-design-systems-non-gaap-eps-of-1_17-beats-0_04-revenue-of-1_01b-misses-10m?utm_source=businessinsider&utm_medium=referral&feed_item_type=news
392.0,4/22/2024 8:39:12 PM,Cadence Design Systems plunges as Q2 outlook falls short,Seeking Alpha,https://seekingalpha.com/news/4092205-cadence-design-systems-plunges-as-q2-outlook-falls-short?utm_source=businessinsider&utm_medium=referral&feed_item_type=news
393.0,4/22/2024 9:00:45 PM,Expert Ratings For Cadence Design Sys,Benzinga,/news/stocks/expert-ratings-for-cadence-design-sys-1033272526
394.0,4/22/2024 10:09:17 PM,"Cadence Design Systems Q1 Profit Increases, beats estimates",RTTNews,/news/stocks/cadence-design-systems-q1-profit-increases-beats-estimates-1033272649
395.0,4/23/2024 12:54:24 AM,"CDNS Stock Earnings: Cadence Design Sys Beats EPS, Beats Revenue for Q1 2024",InvestorPlace,/news/stocks/cdns-stock-earnings-cadence-design-sys-for-q1-of-2024-1033272991
396.0,4/23/2024 7:10:52 AM,Analysts Offer Insights on Technology Companies: Adyen (OtherADYYF) and Cadence Design (CDNS),TipRanks,/news/stocks/analysts-offer-insights-on-technology-companies-adyen-otheradyyf-and-cadence-design-cdns-1033275236
397.0,4/23/2024 9:27:39 AM,Strong Growth and Positive Long-Term Outlook Justify Buy Rating for Cadence Design Systems,TipRanks,/news/stocks/strong-growth-and-positive-long-term-outlook-justify-buy-rating-for-cadence-design-systems-1033275791
398.0,4/23/2024 10:03:15 AM,"Analysts Have Conflicting Sentiments on These Technology Companies: Tyler Technologies (TYL), Cadence Design (CDNS) and Apple (AAPL)",TipRanks,/news/stocks/analysts-have-conflicting-sentiments-on-these-technology-companies-tyler-technologies-tyl-cadence-design-cdns-and-apple-aapl-1033276257
399.0,4/23/2024 10:15:33 AM,Maintaining Buy on Cadence Design: A Temporary Setback Offset by Strong 2024 Outlook and Upcoming Hardware Launch,TipRanks,/news/stocks/maintaining-buy-on-cadence-design-a-temporary-setback-offset-by-strong-2024-outlook-and-upcoming-hardware-launch-1033276323
400.0,4/23/2024 12:17:15 PM,"AFRM, BILI and GOEV among pre-market losers",Seeking Alpha,https://seekingalpha.com/news/4092404-afrm-bili-and-goev-among-pre-market-losers?utm_source=businessinsider&utm_medium=referral&feed_item_type=news
401.0,4/23/2024 12:40:34 PM,"Analysts Are Bullish on These Technology Stocks: Lam Research (LRCX), Cadence Design (CDNS)",TipRanks,/news/stocks/analysts-are-bullish-on-these-technology-stocks-lam-research-lrcx-cadence-design-cdns-1033277153
402.0,4/24/2024 6:25:51 AM,Buy Rating on Cadence Design: Strong H2 Revenue Growth and Innovative Product Line Justify Positive Outlook,TipRanks,/news/stocks/buy-rating-on-cadence-design-strong-h2-revenue-growth-and-innovative-product-line-justify-positive-outlook-1033280703
403.0,4/25/2024 12:00:00 PM,3 Tech Stocks to Sell Now Before the Next Market Downturn Hits,InvestorPlace,/news/stocks/3-tech-stocks-to-sell-now-before-the-next-market-downturn-hits-1033287628
404.0,4/28/2024 7:24:54 PM,"With rate cuts pushed out, Goldman looks at quality stocks",Seeking Alpha,https://seekingalpha.com/news/4095236-with-rate-cuts-pushed-out-goldman-looks-at-quality-stocks?utm_source=businessinsider&utm_medium=referral&feed_item_type=news
405.0,5/3/2024 11:30:00 AM,Stock Market Crash Warning: Don’t Get Caught Holding These 3 Tech Stocks,InvestorPlace,/news/stocks/stock-market-crash-warning-dont-get-caught-holding-these-3-tech-stocks-1033326170
406.0,5/8/2024 4:50:22 AM,Analysts’ Opinions Are Mixed on These Technology Stocks: Cadence Design (CDNS) and Qualys (QLYS),TipRanks,/news/stocks/analysts-opinions-are-mixed-on-these-technology-stocks-cadence-design-cdns-and-qualys-qlys-1033345508
407.0,5/15/2024 10:00:00 AM,Retire Before 50: 7 Must-Own Stocks for Accelerated Wealth Building,InvestorPlace,/news/stocks/retire-before-50-7-must-own-stocks-for-accelerated-wealth-building-1033383328
408.0,5/17/2024 10:11:58 AM,Wall Street Analysts Are Bullish on Top Technology Picks,TipRanks,/news/stocks/wall-street-analysts-are-bullish-on-top-technology-picks-1033399162
409.0,5/17/2024 2:00:29 PM,Analyst Ratings For Cadence Design Sys,Benzinga,/news/stocks/analyst-ratings-for-cadence-design-sys-1033398851
410.0,5/30/2024 10:17:34 AM,Cadence Design’s Growth and Profitability: A Buy Rating Amid AI Expansion and Market Share Opportunities,TipRanks,/news/stocks/cadence-design-s-growth-and-profitability-a-buy-rating-amid-ai-expansion-and-market-share-opportunities-1033436181
411.0,5/31/2024 3:16:34 AM,"SONY, UBER, CDNS: Which Strong-Buy-Rated Tech Stock Is Best?",TipRanks,/news/stocks/sony-uber-cdns-which-strong-buy-rated-tech-stock-is-best-1033439856
412.0,6/3/2024 11:07:20 AM,Cadence Design (CDNS): New Buy Recommendation for This Technology Giant,TipRanks,/news/stocks/cadence-design-cdns-new-buy-recommendation-for-this-technology-giant-1033446287
413.0,6/3/2024 8:57:49 PM,Silvaco Analysts Recommend The Stock As Unique Small-Cap Opportunity In Semiconductor Design,Benzinga,/news/stocks/silvaco-analysts-recommend-the-stock-as-unique-small-cap-opportunity-in-semiconductor-design-1033447094
414.0,6/4/2024 2:20:50 PM,"Broadcom, Marvell Capitalize On Generative AI Demand With Custom ASIC Solutions",Benzinga,/news/stocks/broadcom-marvell-capitalize-on-generative-ai-demand-with-custom-asic-solutions-1033449187
415.0,6/5/2024 9:44:20 PM,Cadence Acquires Switzerland-Based BETA CAE for $1.24B,Benzinga,/news/stocks/cadence-acquires-switzerland-based-beta-cae-for-1-24b-1033455189
416.0,6/12/2024 10:15:00 AM,The 3 Best Climate Change Stocks to Buy in June 2024,InvestorPlace,/news/stocks/the-3-best-climate-change-stocks-to-buy-in-june-2024-1033471993
417.0,6/18/2024 11:00:00 AM,3 Low-Debt Stocks Delivering High Returns,InvestorPlace,/news/stocks/3-low-debt-stocks-delivering-high-returns-1033486613
418.0,6/20/2024 6:06:10 PM,7 Stocks to Buy if You Think We’ll See Nasdaq 20K in 2024,InvestorPlace,/news/stocks/7-stocks-to-buy-if-you-think-well-see-nasdaq-20k-in-2024-1033494065
419.0,6/27/2024 2:01:40 PM,Demystifying Cadence Design Sys: Insights From 12 Analyst Reviews,Benzinga,/news/stocks/demystifying-cadence-design-sys-insights-from-12-analyst-reviews-1033511056
420.0,7/9/2024 9:58:54 PM,Micron Up 53% YTD: Is It Too Late to Buy the Stock Now?,Benzinga,/news/stocks/micron-up-53-ytd-is-it-too-late-to-buy-the-stock-now-1033540957
421.0,7/10/2024 7:39:32 PM,3 Momentum Stocks That Could Still Have More Room to Run,InvestorPlace,/news/stocks/3-momentum-stocks-that-could-still-have-more-room-to-run-1033544699
422.0,7/16/2024 7:50:11 PM,"Cadence Design Systems, Inc. is Attracting Investor Attention: Here is What You Should Know",Benzinga,/news/stocks/cadence-design-systems-inc-is-attracting-investor-attention-here-is-what-you-should-know-1033560556
423.0,7/19/2024 12:16:55 PM,Cadence Design (CDNS): New Buy Recommendation for This Technology Giant,TipRanks,/news/stocks/cadence-design-cdns-new-buy-recommendation-for-this-technology-giant-1033573055
424.0,7/21/2024 3:01:13 PM,Cadence Design Systems earnings preview: what Wall Street is expecting,Markets Insider Automation,/news/stocks/cadence_design_systems-stock-price-quarter-earnings-preview-q2-1033574350
425.0,7/21/2024 9:35:00 PM,Cadence Design Systems Q2 2024 Earnings Preview,Seeking Alpha,https://seekingalpha.com/news/4125940-cadence-design-systems-q2-2024-earnings-preview?utm_source=businessinsider&utm_medium=referral&feed_item_type=news
426.0,7/21/2024 9:35:01 PM,Notable earnings after Monday's close,Seeking Alpha,https://seekingalpha.com/news/4126045-notable-earnings-after-mondays-close?utm_source=businessinsider&utm_medium=referral&feed_item_type=news
427.0,7/22/2024 7:36:59 PM,"US Stocks Rebound As Tech Surges, CrowdStrike Continues Selloff, Oil Hits 1-Month Lows: What's Driving Markets Monday?",Benzinga,/news/etf/us-stocks-rebound-as-tech-surges-crowdstrike-continues-selloff-oil-hits-1-month-lows-what-s-driving-markets-monday-1033579047
428.0,7/22/2024 8:03:17 PM,"Cadence Design Systems Non-GAAP EPS of $1.28 beats by $0.05, revenue of $1.06B beats by $20M",Seeking Alpha,https://seekingalpha.com/news/4126456-cadence-design-systems-non-gaap-eps-of-1_28-beats-0_05-revenue-of-1_06b-beats-20m?utm_source=businessinsider&utm_medium=referral&feed_item_type=news
429.0,7/22/2024 9:29:03 PM,"Earnings Summary: Cadence Design Systems beats Q2 estimates; sets pace for current quarter, FY",Seeking Alpha,https://seekingalpha.com/news/4126554-earnings-summary-cadence-design-systems-beats-q2-estimates-sets-pace-for-current-quarter-fy?utm_source=businessinsider&utm_medium=referral&feed_item_type=news
430.0,7/22/2024 10:38:39 PM,"Cadence Design Systems Q2 Profit Increases, Beats Estimates ",RTTNews,/news/stocks/cadence-design-systems-q2-profit-increases-beats-estimates-1033579391
431.0,7/23/2024 7:26:33 AM,"New Buy Rating for Cadence Design (CDNS), the Technology Giant",TipRanks,/news/stocks/new-buy-rating-for-cadence-design-cdns-the-technology-giant-1033581734
432.0,7/23/2024 10:16:15 AM,Vivek Arya Reiterates Buy Rating on Cadence Design with a $350 Price Objective Amidst Strong Growth and Robust Backlog,TipRanks,/news/stocks/vivek-arya-reiterates-buy-rating-on-cadence-design-with-a-350-price-objective-amidst-strong-growth-and-robust-backlog-1033582709
433.0,7/23/2024 10:20:51 AM,"Analysts’ Opinions Are Mixed on These Technology Stocks: First Solar (FSLR), Cadence Design (CDNS) and Check Point (CHKP)",TipRanks,/news/stocks/analysts-opinions-are-mixed-on-these-technology-stocks-first-solar-fslr-cadence-design-cdns-and-check-point-chkp-1033582692
434.0,7/23/2024 10:40:47 AM,Piper Sandler Keeps Their Hold Rating on Cadence Design (CDNS),TipRanks,/news/stocks/piper-sandler-keeps-their-hold-rating-on-cadence-design-cdns-1033582763
435.0,7/23/2024 11:56:28 AM,Stifel Nicolaus Sticks to Their Buy Rating for Cadence Design (CDNS),TipRanks,/news/stocks/stifel-nicolaus-sticks-to-their-buy-rating-for-cadence-design-cdns-1033583355
436.0,7/23/2024 3:01:13 PM,What 7 Analyst Ratings Have To Say About Cadence Design Sys,Benzinga,/news/stocks/what-7-analyst-ratings-have-to-say-about-cadence-design-sys-1033582564
437.0,7/24/2024 8:10:39 AM,Bullish Outlook: Cadence Design Poised for Growth with Strong Performance and Strategic Acquisitions,TipRanks,/news/stocks/bullish-outlook-cadence-design-poised-for-growth-with-strong-performance-and-strategic-acquisitions-1033587884
438.0,7/24/2024 8:11:06 AM,Analysts Offer Insights on Technology Companies: Temenos (OtherTMNSF) and Cadence Design (CDNS),TipRanks,/news/stocks/analysts-offer-insights-on-technology-companies-temenos-othertmnsf-and-cadence-design-cdns-1033587881
439.0,8/12/2024 2:22:08 PM,"Semiconductors could start recovering in October, BofA says",Seeking Alpha,https://seekingalpha.com/news/4138653-semiconductors-could-start-recovering-in-october-bofa-says?utm_source=businessinsider&utm_medium=referral&feed_item_type=news
440.0,8/14/2024 2:14:19 AM,Cadence Design Systems Stock (NASDAQ:CDNS): Should You Buy the Dip?,TipRanks,/news/stocks/cadence-design-systems-stock-nasdaq-cdns-should-you-buy-the-dip-1033686432
441.0,8/14/2024 2:04:27 PM,"CDNS, DDOG, FSLR: Which Strong Buy-Rated Tech Stock’s a Better Buy?",TipRanks,/news/stocks/cdns-ddog-fslr-which-strong-buy-rated-tech-stock-s-a-better-buy-1033689529
442.0,8/16/2024 10:24:35 AM,Cadence Design Poised for Growth Amid Market Opportunities and Intel’s Challenges: Arya’s Buy Rating with $350 Price Objective,TipRanks,/news/stocks/cadence-design-poised-for-growth-amid-market-opportunities-and-intel-s-challenges-arya-s-buy-rating-with-350-price-objective-1033700353
443.0,10/10/2024 1:10:15 PM,"Analysts’ Top Technology Picks: Cadence Design (CDNS), Dynatrace (DT)",TipRanks,/news/stocks/analysts-top-technology-picks-cadence-design-cdns-dynatrace-dt-1033836469
444.0,10/18/2024 9:55:51 AM,"There’s an Opportunity Brewing in These 2 Chip Software Stocks, Says Berenberg",TipRanks,/news/stocks/there-s-an-opportunity-brewing-in-these-2-chip-software-stocks-says-berenberg-1033858927
445.0,10/18/2024 5:34:17 PM,"Cadence Design, Synopsys being 'left out' from chip winners: Baird",Seeking Alpha,https://seekingalpha.com/news/4176163-cadence-design-synopsys-being-left-out-from-chip-winners-baird?utm_source=businessinsider&utm_medium=referral&feed_item_type=news
446.0,10/21/2024 6:57:15 AM,"New Buy Rating for Cadence Design (CDNS), the Technology Giant",TipRanks,/news/stocks/new-buy-rating-for-cadence-design-cdns-the-technology-giant-1033863655
447.0,10/21/2024 8:25:16 PM,Cadence Design initiated with an Outperform at Mizuho,TipRanks,/news/stocks/cadence-design-initiated-with-an-outperform-at-mizuho-1033866721
448.0,10/22/2024 3:10:12 PM,"Altair Engineering exploring sale after acquisition interest, Reuters says",TipRanks,/news/stocks/altair-engineering-exploring-sale-after-acquisition-interest-reuters-says-1033872894
449.0,10/22/2024 3:20:27 PM,Altair Engineering jumps on report it's exploring sale after takeover interest,Seeking Alpha,https://seekingalpha.com/news/4190650-altair-engineering-jumps-on-report-its-exploring-sale-after-takeover-interest?utm_source=businessinsider&utm_medium=referral&feed_item_type=news
450.0,10/22/2024 5:15:18 PM,Oppenheimer says investors will gravitate to Cadence as likely Altair acquirer,TipRanks,/news/stocks/oppenheimer-says-investors-will-gravitate-to-cadence-as-likely-altair-acquirer-1033873251
451.0,10/22/2024 5:25:29 PM,Oppenheimer says investors will gravitate to Cadence as likely Altair acquirer,TipRanks,/news/stocks/oppenheimer-says-investors-will-gravitate-to-cadence-as-likely-altair-acquirer-1033873240
452.0,10/23/2024 5:29:56 PM,Cadence Design bid for Altair makes 'less sense' after recent deals: Baird,Seeking Alpha,https://seekingalpha.com/news/4196600-cadence-design-bid-for-altair-makes-less-sense-after-recent-deals-baird?utm_source=businessinsider&utm_medium=referral&feed_item_type=news
453.0,10/23/2024 7:15:43 PM,Altair Engineering jumps on report Siemens in talks to acquire,Seeking Alpha,https://seekingalpha.com/news/4196866-altair-engineering-jumps-on-report-siemens-in-talks-to-acquire?utm_source=businessinsider&utm_medium=referral&feed_item_type=news
454.0,10/26/2024 3:46:27 PM,Cadence Design’s Resilient Growth: Buy Rating Backed by Diversified Portfolio and Strong Valuation Amid Market Challenges,TipRanks,/news/stocks/cadence-design-s-resilient-growth-buy-rating-backed-by-diversified-portfolio-and-strong-valuation-amid-market-challenges-1033896029
455.0,10/27/2024 10:55:11 AM,Cadence Design price target lowered to $280 from $350 at Morgan Stanley,TipRanks,/news/stocks/cadence-design-price-target-lowered-to-280-from-350-at-morgan-stanley-1033896605
456.0,10/28/2024 4:39:20 AM,Cadence Design Systems Q3 2024 Earnings Preview,Seeking Alpha,https://seekingalpha.com/news/4212348-cadence-design-systems-q3-2024-earnings-preview?utm_source=businessinsider&utm_medium=referral&feed_item_type=news
457.0,10/28/2024 2:00:00 PM,Here are the major earnings after the close today,Seeking Alpha,https://seekingalpha.com/news/4210156-here-are-the-major-earnings-after-the-close-today?utm_source=businessinsider&utm_medium=referral&feed_item_type=news
458.0,10/28/2024 5:50:17 PM,Cadence Design options imply 5.7% move in share price post-earnings,TipRanks,/news/stocks/cadence-design-options-imply-5-7-move-in-share-price-post-earnings-1033904001
459.0,10/28/2024 5:55:19 PM,Notable companies reporting after market close,TipRanks,/news/stocks/notable-companies-reporting-after-market-close-1033903999
460.0,10/28/2024 8:03:20 PM,"Cadence Design Systems Non-GAAP EPS of $1.64 beats by $0.20, revenue of $1.25B beats by $70M",Seeking Alpha,https://seekingalpha.com/news/4215633-cadence-design-systems-non-gaap-eps-of-1_64-beats-0_20-revenue-of-1_25b-beats-70m?utm_source=businessinsider&utm_medium=referral&feed_item_type=news
461.0,10/28/2024 8:59:45 PM,Earnings Snapshot: Cadence Design tops Q3 consensus; says on track to deliver strong H2,Seeking Alpha,https://seekingalpha.com/news/4216020-earnings-snapshot-cadence-design-tops-q3-consensus-says-on-track-to-deliver-strong-h2?utm_source=businessinsider&utm_medium=referral&feed_item_type=news
462.0,10/28/2024 9:11:27 PM,"Cadence Design Systems Q3 Profit Decreases, But Beats Estimates ",RTTNews,/news/stocks/cadence-design-systems-q3-profit-decreases-but-beats-estimates-1033903803
463.0,10/28/2024 10:45:15 PM,Closing Bell Movers: VF Corp. surges after quarterly results,TipRanks,/news/stocks/closing-bell-movers-vf-corp-surges-after-quarterly-results-1033904591
464.0,10/29/2024 6:49:09 AM,Cadence Design (CDNS) Gets a Buy from KeyBanc,TipRanks,/news/stocks/cadence-design-cdns-gets-a-buy-from-keybanc-1033907654
465.0,10/29/2024 9:56:56 AM,"Cadence Design: Fairly Valued Amid Strong Growth and Competitive Pressures, Hold Rating Maintained",TipRanks,/news/stocks/cadence-design-fairly-valued-amid-strong-growth-and-competitive-pressures-hold-rating-maintained-1033908834
466.0,10/29/2024 10:38:00 AM,Cadence Design (CDNS): New Buy Recommendation for This Technology Giant,TipRanks,/news/stocks/cadence-design-cdns-new-buy-recommendation-for-this-technology-giant-1033909291
467.0,10/29/2024 10:47:33 AM,Cadence Design Systems: Strong Performance and Promising Outlook with Investment Opportunity,TipRanks,/news/stocks/cadence-design-systems-strong-performance-and-promising-outlook-with-investment-opportunity-1033909410
