Unnamed: 0,datetime,title,source,link
233.0,9/29/2022 4:06:56 PM,"Benzinga's Top Ratings Upgrades, Downgrades For September 29, 2022",Benzinga,/news/stocks/benzinga-s-top-ratings-upgrades-downgrades-for-september-29-2022-1031773338
234.0,9/29/2022 5:07:04 PM,Expert Ratings for Cadence Design Sys,Benzinga,/news/stocks/expert-ratings-for-cadence-design-sys-1031773511
235.0,9/29/2022 6:03:09 PM,Where Cadence Design Sys Stands With Analysts,Benzinga,/news/stocks/where-cadence-design-sys-stands-with-analysts-1031773638
236.0,9/29/2022 7:07:00 PM,Analyst Ratings for Cadence Design Sys,Benzinga,/news/stocks/analyst-ratings-for-cadence-design-sys-1031773817
237.0,9/29/2022 9:52:08 PM,What 5 Analyst Ratings Have To Say About Cadence Design Sys,Benzinga,/news/stocks/what-5-analyst-ratings-have-to-say-about-cadence-design-sys-1031774030
238.0,9/29/2022 11:10:04 PM,5 Analysts Have This to Say About Cadence Design Sys,Benzinga,/news/stocks/5-analysts-have-this-to-say-about-cadence-design-sys-1031774197
239.0,10/21/2022 9:35:28 PM,Cadence Design Systems Q3 2022 Earnings Preview,Seeking Alpha,https://seekingalpha.com/news/3893791-cadence-design-systems-q3-2022-earnings-preview?utm_source=businessinsider&utm_medium=referral
240.0,10/23/2022 3:01:13 PM,Cadence Design Systems earnings preview: what to expect,Markets Insider Automation,/news/stocks/cadence_design_systems-q3-quarterly-earnings-preview-stock-1031826185
241.0,10/23/2022 9:35:00 PM,Notable earnings after Monday's close,Seeking Alpha,https://seekingalpha.com/news/3893898-notable-earnings-after-mondays-close?utm_source=businessinsider&utm_medium=referral
242.0,10/24/2022 6:35:08 PM,4 Analysts Have This to Say About Cadence Design Sys,Benzinga,/news/stocks/4-analysts-have-this-to-say-about-cadence-design-sys-1031829372
243.0,10/24/2022 8:06:48 PM,"Cadence Design Systems Non-GAAP EPS of $1.06 beats by $0.10, revenue of $902.55M beats by $33.7M",Seeking Alpha,https://seekingalpha.com/news/3894345-cadence-design-systems-non-gaap-eps-of-1_06-beats-0_10-revenue-of-902_55m-beats-33_7m?utm_source=businessinsider&utm_medium=referral
244.0,10/24/2022 10:11:11 PM,"Cadence Design Systems Q3 Profit Increases, beats estimates",RTTNews,/news/stocks/cadence-design-systems-q3-profit-increases-beats-estimates-1031829787
245.0,10/24/2022 10:18:07 PM,Cadence Design Systems Lifts FY22 Outlook ,RTTNews,/news/stocks/cadence-design-systems-lifts-fy22-outlook-1031829797
246.0,10/25/2022 6:45:36 PM,"Cadence Analysts See It Scoring Driven By Autos, Autonomous Driving, 5G, AI/ML Despite China Restrictions",Benzinga,/news/stocks/cadence-analysts-see-it-scoring-driven-by-autos-autonomous-driving-5g-ai-ml-despite-china-restrictions-1031833892
247.0,10/31/2022 10:35:11 AM,Needham Sticks to Their Buy Rating for Cadence Design (CDNS),TipRanks,/news/stocks/needham-sticks-to-their-buy-rating-for-cadence-design-cdns-1031852990
248.0,11/21/2022 5:44:39 PM,Director Lip-Bu Tan Is Betting Big on Intel (INTC) Stock,InvestorPlace,/news/stocks/director-lip-bu-tan-is-betting-big-on-intel-intc-stock-1031929350
249.0,12/16/2022 4:01:20 PM,"Benzinga's Top Ratings Upgrades, Downgrades For December 16, 2022",Benzinga,/news/stocks/benzinga-s-top-ratings-upgrades-downgrades-for-december-16-2022-1031977557
250.0,1/13/2023 10:58:33 PM,"SGMO, CDNS and HOLX are among after hour movers",Seeking Alpha,https://seekingalpha.com/news/3924654-sgmo-cdns-and-holx-are-among-after-hour-movers?utm_source=businessinsider&utm_medium=referral
251.0,1/17/2023 4:01:25 PM,"Benzinga's Top Ratings Upgrades, Downgrades For January 17, 2023",Benzinga,/news/stocks/benzinga-s-top-ratings-upgrades-downgrades-for-january-17-2023-1032022889
252.0,1/31/2023 4:16:57 PM,Cadence Design gets mild lift as Deutsche Bank reiterates buy rating,Seeking Alpha,https://seekingalpha.com/news/3929925-cadence-design-gets-mild-lift-as-deutsche-bank-reiterates-buy-rating?utm_source=businessinsider&utm_medium=referral
253.0,2/10/2023 7:30:55 PM,"Catalyst watch: Inflation reads, Roblox and DoorDash in the spotlight",Seeking Alpha,https://seekingalpha.com/news/3934884-catalyst-watch-inflation-reads-roblox-and-doordash-in-the-spotlight?utm_source=businessinsider&utm_medium=referral
254.0,2/12/2023 3:01:13 PM,Here's what Wall Street expects from Cadence Design Systems's earnings report,Markets Insider Automation,/news/stocks/cadence_design_systems-q4-earnings-preview-1032087994
255.0,2/12/2023 10:35:00 PM,Cadence Design Systems Q4 2022 Earnings Preview,Seeking Alpha,https://seekingalpha.com/news/3934897-cadence-design-systems-q4-2022-earnings-preview?utm_source=businessinsider&utm_medium=referral
256.0,2/12/2023 10:35:26 PM,Notable earnings after Monday's close,Seeking Alpha,https://seekingalpha.com/news/3935029-notable-earnings-after-mondays-close?utm_source=businessinsider&utm_medium=referral
257.0,2/13/2023 9:09:40 PM,"Cadence Design Systems Non-GAAP EPS of $0.96 beats by $0.04, revenue of $899.88M beats by $15.65M",Seeking Alpha,https://seekingalpha.com/news/3935423-cadence-design-systems-non-gaap-eps-of-0_96-beats-0_04-revenue-of-899_88m-beats-15_65m?utm_source=businessinsider&utm_medium=referral
258.0,2/13/2023 10:28:57 PM,"Cadence Design Systems Q4 Profit Increases, beats estimates",RTTNews,/news/stocks/cadence-design-systems-q4-profit-increases-beats-estimates-1032092331
259.0,2/14/2023 4:05:04 AM,Cadence Design (CDNS): New Buy Recommendation for This Technology Giant,TipRanks,/news/stocks/cadence-design-cdns-new-buy-recommendation-for-this-technology-giant-1032092589
260.0,2/14/2023 10:40:16 AM,"Analysts Offer Insights on Technology Companies: Cadence Design (CDNS), Teradata (TDC) and Arista Networks (ANET)",TipRanks,/news/stocks/analysts-offer-insights-on-technology-companies-cadence-design-cdns-teradata-tdc-and-arista-networks-anet-1032094130
261.0,2/14/2023 12:15:30 PM,"New Buy Rating for Cadence Design (CDNS), the Technology Giant",TipRanks,/news/stocks/new-buy-rating-for-cadence-design-cdns-the-technology-giant-1032094482
262.0,2/14/2023 1:30:09 PM,Lattice Semiconductor To Rally 33%? Here Are 10 Other Analyst Forecasts For Tuesday,Benzinga,/news/stocks/lattice-semiconductor-to-rally-33-here-are-10-other-analyst-forecasts-for-tuesday-1032094511
263.0,2/14/2023 6:06:43 PM,Cadence Design Systems stock surges ~6% after Q4 results beat estimates,Seeking Alpha,https://seekingalpha.com/news/3935874-cadence-design-systems-stock-surges-6-after-q4-results-beat-estimates?utm_source=businessinsider&utm_medium=referral
264.0,2/14/2023 6:37:42 PM,Cadence Analyst Sees Meaningful Upside In Stock As EDA Customers Increase R&D Spend,Benzinga,/news/stocks/cadence-analyst-sees-meaningful-upside-in-stock-as-eda-customers-increase-r-d-spend-1032095662
265.0,2/24/2023 1:55:07 AM,Cadence Design (CDNS): New Buy Recommendation for This Technology Giant,TipRanks,/news/stocks/cadence-design-cdns-new-buy-recommendation-for-this-technology-giant-1032121542
266.0,3/1/2023 2:35:18 AM,Cadence Design (CDNS) Receives a Rating Update from a Top Analyst,TipRanks,/news/stocks/cadence-design-cdns-receives-a-rating-update-from-a-top-analyst-1032133676
267.0,4/11/2023 4:25:16 PM,Wells Fargo Sticks to Its Buy Rating for Cadence Design (CDNS),TipRanks,/news/stocks/wells-fargo-sticks-to-its-buy-rating-for-cadence-design-cdns-1032225083
268.0,4/11/2023 11:01:50 PM,Where Cadence Design Sys Stands With Analysts,Benzinga,/news/stocks/where-cadence-design-sys-stands-with-analysts-1032225470
269.0,4/21/2023 12:02:47 PM,"Analysts Conflicted on These Technology Names: Cadence Design (CDNS), Lockheed Martin (LMT) and Mobileye Global, Inc. Class A (MBLY)",TipRanks,/news/stocks/analysts-conflicted-on-these-technology-names-cadence-design-cdns-lockheed-martin-lmt-and-mobileye-global-inc-class-a-mbly-1032249757
270.0,4/23/2023 9:35:00 PM,Cadence Design Systems Q1 2023 Earnings Preview,Seeking Alpha,https://seekingalpha.com/news/3958843-cadence-design-systems-q1-2023-earnings-preview?utm_source=businessinsider&utm_medium=referral
271.0,4/23/2023 9:35:03 PM,Notable earnings after Monday's close,Seeking Alpha,https://seekingalpha.com/news/3958873-notable-earnings-after-mondays-close?utm_source=businessinsider&utm_medium=referral
272.0,4/24/2023 8:10:57 PM,"Cadence Design Systems Non-GAAP EPS of $1.29 beats by $0.04, revenue of $1.02B beats by $10M",Seeking Alpha,https://seekingalpha.com/news/3959356-cadence-design-systems-non-gaap-eps-of-1_29-beats-0_04-revenue-of-1_02b-beats-10m?utm_source=businessinsider&utm_medium=referral
273.0,4/24/2023 10:43:20 PM,"Cadence Design Systems Q1 Profit Increases, beats estimates",RTTNews,/news/stocks/cadence-design-systems-q1-profit-increases-beats-estimates-1032255542
274.0,4/25/2023 10:15:07 AM,Cadence Design (CDNS) Receives a Buy from Bank of America Securities,TipRanks,/news/stocks/cadence-design-cdns-receives-a-buy-from-bank-of-america-securities-1032257639
275.0,4/25/2023 1:33:06 PM,Cadence Design Systems Gets Price Target Bumps By Analysts Following Q1 Results,Benzinga,/news/stocks/cadence-design-systems-gets-price-target-bumps-by-analysts-following-q1-results-1032257919
276.0,4/25/2023 7:18:52 PM,Buy the Dip: Analysts Eye Cadence's Pullback as Golden Opportunity After Q1 Beat,Benzinga,/news/stocks/buy-the-dip-analysts-eye-cadence-s-pullback-as-golden-opportunity-after-q1-beat-1032259555
277.0,4/25/2023 8:55:49 PM,7 Growth Stocks With Huge Return Potential for Long-Term Investors,InvestorPlace,/news/stocks/7-growth-stocks-with-huge-return-potential-for-long-term-investors-1032259975
278.0,4/28/2023 1:55:07 AM,Cadence Design (CDNS): New Buy Recommendation for This Technology Giant,TipRanks,/news/stocks/cadence-design-cdns-new-buy-recommendation-for-this-technology-giant-1032270724
279.0,5/18/2023 6:00:03 PM,Synopsys jumps 8% as Baird sees it at 'beginning of decade of impact',Seeking Alpha,https://seekingalpha.com/news/3973164-synopsys-jumps-baird-sees-beginning-of-decade-of-impact?utm_source=businessinsider&utm_medium=referral
280.0,5/22/2023 7:21:56 PM,Betting On AI? The 12 Stocks That Should Be On Your Radar,Benzinga,/news/stocks/betting-on-ai-the-12-stocks-that-should-be-on-your-radar-1032343374
281.0,5/26/2023 2:04:00 AM,This Tiny AI ETF Could Be a Hidden Gem,TipRanks,/news/stocks/this-tiny-ai-etf-could-be-a-hidden-gem-1032336224
282.0,5/26/2023 1:18:10 PM,Stocks facing most buy and sell pressure into Russell rebalancing,Seeking Alpha,https://seekingalpha.com/news/3974582-stocks-facing-most-buy-and-sell-pressure-into-russell-rebalancing?utm_source=businessinsider&utm_medium=referral
283.0,6/5/2023 12:35:09 PM,Wells Fargo Keeps Their Buy Rating on Cadence Design (CDNS),TipRanks,/news/stocks/wells-fargo-keeps-their-buy-rating-on-cadence-design-cdns-1032370281
284.0,6/5/2023 5:02:29 PM,6 Analysts Have This to Say About Cadence Design Sys,Benzinga,/news/stocks/6-analysts-have-this-to-say-about-cadence-design-sys-1032370764
285.0,6/16/2023 6:23:52 PM,2 Under-the-Radar AI ETFs to Watch,TipRanks,/news/stocks/2-under-the-radar-ai-etfs-to-watch-1032395051
286.0,7/3/2023 3:24:56 PM,Goldman Sachs Reveals Winning Portfolio: 'Rule of 10' Unlocks S&P 500's Future Top Performers,Benzinga,/news/stocks/goldman-sachs-reveals-winning-portfolio-rule-of-10-unlocks-s-p-500-s-future-top-performers-1032423564
287.0,7/4/2023 5:00:00 PM,"Paycom, Chipotle highlight Goldman's Rule of 10 stock screens",Seeking Alpha,https://seekingalpha.com/news/3985021-goldman-sachs-rule-of-10-stock-picks?utm_source=businessinsider&utm_medium=referral
288.0,7/6/2023 11:05:09 AM,Cadence Design (CDNS): New Buy Recommendation for This Technology Giant,TipRanks,/news/stocks/cadence-design-cdns-new-buy-recommendation-for-this-technology-giant-1032429739
289.0,7/18/2023 9:00:41 PM,What 7 Analyst Ratings Have To Say About Cadence Design Sys,Benzinga,/news/stocks/what-7-analyst-ratings-have-to-say-about-cadence-design-sys-1032456105
290.0,7/18/2023 10:00:27 PM,"BofA Analyst Cuts Price Target for AMD, Re-rates Semiconductor Companies, Expects Long-Term Stock Momentum For Sector",Benzinga,/news/stocks/bofa-analyst-cuts-price-target-for-amd-re-rates-semiconductor-companies-expects-long-term-stock-momentum-for-sector-1032456162
291.0,7/20/2023 1:48:11 PM,NVIDIA To Rally Over 28%? Here Are 10 Other Analyst Forecasts For Thursday,Benzinga,/news/stocks/nvidia-to-rally-over-28-here-are-10-other-analyst-forecasts-for-thursday-1032462232
292.0,7/20/2023 5:00:43 PM,"Benzinga's Top Ratings Upgrades, Downgrades For July 20, 2023",Benzinga,/news/stocks/benzinga-s-top-ratings-upgrades-downgrades-for-july-20-2023-1032463247
293.0,7/21/2023 2:31:00 PM,McDonald's To Rally Over 11%? Here Are 10 Other Analyst Forecasts For Friday,Benzinga,/news/stocks/mcdonald-s-to-rally-over-11-here-are-10-other-analyst-forecasts-for-friday-1032465776
294.0,7/21/2023 8:38:08 PM,Rambus' Strategic Resource Redirection To Drive Performance Despite Minor Revenue Impact: Analyst,Benzinga,/news/stocks/rambus-strategic-resource-redirection-to-drive-performance-despite-minor-revenue-impact-analyst-1032466782
295.0,7/23/2023 3:01:13 PM,Cadence Design Systems is about to announce its earnings — here's what Wall Street expects,Markets Insider Automation,/news/stocks/cadence_design_systems-q2-quarterly-earnings-preview-1032467624
296.0,7/23/2023 9:35:00 PM,Cadence Design Systems Q2 2023 Earnings Preview,Seeking Alpha,https://seekingalpha.com/news/3989702-cadence-design-systems-q2-2023-earnings-preview?utm_source=businessinsider&utm_medium=referral
297.0,7/23/2023 9:35:13 PM,Notable earnings after Monday's close,Seeking Alpha,https://seekingalpha.com/news/3989881-notable-earnings-after-mondays-close?utm_source=businessinsider&utm_medium=referral
298.0,7/24/2023 8:08:47 PM,"Cadence Design Systems Non-GAAP EPS of $1.22 beats by $0.03, revenue of $976.58M in-line",Seeking Alpha,https://seekingalpha.com/news/3990285-cadence-design-systems-non-gaap-eps-of-1_22-beats-0_03-revenue-of-976_58m-in-line?utm_source=businessinsider&utm_medium=referral
299.0,7/24/2023 10:11:03 PM,"Cadence Design Systems Q2 Profit Increases, beats estimates",RTTNews,/news/stocks/cadence-design-systems-q2-profit-increases-beats-estimates-1032471484
300.0,7/25/2023 10:11:34 AM,"Analysts Offer Insights on Technology Companies: Uber Technologies (UBER), Cadence Design (CDNS) and Toast Inc (TOST)",TipRanks,/news/stocks/analysts-offer-insights-on-technology-companies-uber-technologies-uber-cadence-design-cdns-and-toast-inc-tost-1032473714
301.0,7/25/2023 1:51:04 PM,Lululemon Athletica To Rally Around 12%? Here Are 10 Other Analyst Forecasts For Tuesday,Benzinga,/news/stocks/lululemon-athletica-to-rally-around-12-here-are-10-other-analyst-forecasts-for-tuesday-1032474034
302.0,7/25/2023 3:05:14 PM,Cadence Design Systems slips on weaker-than-expected Q3 guidance,Seeking Alpha,https://seekingalpha.com/news/3990609-cadence-design-systems-slips-on-weaker-than-expected-q3-guidance?utm_source=businessinsider&utm_medium=referral
303.0,7/27/2023 1:55:06 AM,Cadence Design (CDNS): New Buy Recommendation for This Technology Giant,TipRanks,/news/stocks/cadence-design-cdns-new-buy-recommendation-for-this-technology-giant-1032481822
304.0,7/27/2023 12:15:35 PM,J.P. Morgan Keeps Their Hold Rating on Cadence Design (CDNS),TipRanks,/news/stocks/j-p-morgan-keeps-their-hold-rating-on-cadence-design-cdns-1032484400
305.0,8/1/2023 10:20:39 AM,3 ‘Strong Buy’ AI Stocks You Should Be Loading Up On Now,InvestorPlace,/news/stocks/3-strong-buy-ai-stocks-you-should-be-loading-up-on-now-1032499902
306.0,8/14/2023 6:10:36 AM,TipRanks ‘Perfect 10’ List: Looking for Tech Stocks? These 3 Attain the Highest Smart Score,TipRanks,/news/stocks/tipranks-perfect-10-list-looking-for-tech-stocks-these-3-attain-the-highest-smart-score-1032549941
307.0,8/16/2023 4:42:18 PM,5 Blue-Chip Stocks AI Thinks Will Double Your Money by 2027,InvestorPlace,/news/stocks/5-blue-chip-stocks-ai-thinks-will-double-your-money-by-2027-1032560778
308.0,8/25/2023 2:00:40 PM,What 10 Analyst Ratings Have To Say About Cadence Design Sys,Benzinga,/news/stocks/what-10-analyst-ratings-have-to-say-about-cadence-design-sys-1032582497
309.0,9/12/2023 4:32:57 PM,"DraftKings Apologizes For 9/11 'Never Forget' Parlay Promotion, Apple Set For Selling 'Made In India' iPhone 15 on Launch Day, MGM Resorts Faces Ongoing Cyber Incident: Today's Top Stories",Benzinga,/news/stocks/draftkings-apologizes-for-9-11-never-forget-parlay-promotion-apple-set-for-selling-made-in-india-iphone-15-on-launch-day-mgm-resorts-faces-ongoing-cyber-incident-today-s-top-stories-1032624052
310.0,9/14/2023 2:00:24 PM,What 10 Analyst Ratings Have To Say About Cadence Design Sys,Benzinga,/news/stocks/what-10-analyst-ratings-have-to-say-about-cadence-design-sys-1032630153
311.0,9/14/2023 2:07:09 PM,Marathon Oil To Rally Around 70%? Here Are 10 Other Analyst Forecasts For Thursday,Benzinga,/news/stocks/marathon-oil-to-rally-around-70-here-are-10-other-analyst-forecasts-for-thursday-1032630218
312.0,9/20/2023 1:42:28 PM,Cadence To Acquire Intrinsix From CEVA For Undisclosed Sum ,RTTNews,/news/stocks/cadence-to-acquire-intrinsix-from-ceva-for-undisclosed-sum-1032643104
313.0,10/16/2023 10:35:02 AM,"Analysts Offer Insights on Technology Companies: Cadence Design (CDNS), Klaviyo, Inc. Class A (KVYO) and Trade Desk (TTD)",TipRanks,/news/stocks/analysts-offer-insights-on-technology-companies-cadence-design-cdns-klaviyo-inc-class-a-kvyo-and-trade-desk-ttd-1032707846
314.0,10/19/2023 2:00:50 PM,Analyst Expectations for Cadence Design Sys's Future,Benzinga,/news/stocks/analyst-expectations-for-cadence-design-sys-s-future-1032720547
315.0,10/22/2023 3:01:13 PM,Here's what Wall Street expects from Cadence Design Systems's earnings,Markets Insider Automation,/news/stocks/cadence_design_systems-q3-quarterly-earnings-preview-1032726022
316.0,10/23/2023 10:13:06 PM,"Cadence Design Systems Q3 Profit Increases, beats estimates",RTTNews,/news/stocks/cadence-design-systems-q3-profit-increases-beats-estimates-1032730185
317.0,10/24/2023 9:56:14 AM,Robust Financial Health and Growth Potential Justify a ‘Buy’ Rating for Cadence Design Systems: An Analyst’s Perspective,TipRanks,/news/stocks/robust-financial-health-and-growth-potential-justify-a-buy-rating-for-cadence-design-systems-an-analyst-s-perspective-1032735241
318.0,10/24/2023 10:02:57 AM,Wall Street Analysts Are Bullish on Top Technology Picks,TipRanks,/news/stocks/wall-street-analysts-are-bullish-on-top-technology-picks-1032735313
319.0,10/24/2023 11:30:56 AM,2 AI Chip Stocks to Outperform Nvidia (NVDA),InvestorPlace,/news/stocks/two-ai-chip-stocks-outperform-nvidia-nvda-1032732795
320.0,10/24/2023 12:03:42 PM,"TrueBlue, Barclays And Other Big Stocks Moving Lower In Tuesday's Pre-Market Session",Benzinga,/news/stocks/trueblue-barclays-and-other-big-stocks-moving-lower-in-tuesday-s-pre-market-session-1032732426
321.0,10/24/2023 12:21:11 PM,"Analysts Offer Insights on Technology Companies: Rivian Automotive (RIVN), Nokia (NOK) and Cadence Design (CDNS)",TipRanks,/news/stocks/analysts-offer-insights-on-technology-companies-rivian-automotive-rivn-nokia-nok-and-cadence-design-cdns-1032735381
322.0,10/25/2023 12:06:07 AM,"ASML, TSM, CDNS: Missed the Chip Stock Rip? Analysts Still Love These 3 Stocks",TipRanks,/news/stocks/asml-tsm-cdns-missed-the-chip-stock-rip-analysts-still-love-these-3-stocks-1032738401
323.0,10/25/2023 4:54:44 PM,Pfizer To Expand Access To Cadence Products And Programming Toolkits For Advanced Molecular Design ,RTTNews,/news/stocks/pfizer-to-expand-access-to-cadence-products-and-programming-toolkits-for-advanced-molecular-design-1032739577
324.0,10/30/2023 8:24:45 PM,5 Top-Tier AI Stocks for Dependable Returns in 2024,InvestorPlace,/news/stocks/5-top-tier-ai-stocks-for-dependable-returns-in-2024-1032755750
325.0,11/7/2023 4:51:51 PM,3 Dependable AI Stocks to Buy for 2024,InvestorPlace,/news/stocks/3-dependable-ai-stocks-to-buy-for-2024-1032789077
326.0,11/10/2023 10:00:13 PM,What 7 Analyst Ratings Have To Say About Cadence Design Sys,Benzinga,/news/stocks/what-7-analyst-ratings-have-to-say-about-cadence-design-sys-1032807956
327.0,11/30/2023 10:40:10 AM,"Analysts’ Top Technology Picks: KLA (KLAC), Confluent (CFLT)",TipRanks,/news/stocks/analysts-top-technology-picks-kla-klac-confluent-cflt-1032864529
328.0,12/6/2023 9:46:26 PM,Luke Lango Sees Growth Ahead for These Potential Trillion-Dollar AI Stocks,InvestorPlace,/news/stocks/luke-lango-sees-growth-ahead-for-these-potential-trillion-dollar-ai-stocks-1032879832
329.0,12/20/2023 12:09:19 AM,3 Key Stocks to Capitalize on Rising Resource Scarcity,InvestorPlace,/news/stocks/3-key-stocks-to-capitalize-on-rising-resource-scarcity-1032914317
330.0,12/26/2023 10:16:06 PM,The 3 Best Software Stocks to Buy for 2024,InvestorPlace,/news/stocks/the-3-best-software-stocks-to-buy-for-2024-1032926459
331.0,1/3/2024 12:57:18 PM,Cadence Design (CDNS) Receives a Buy from Wells Fargo,TipRanks,/news/stocks/cadence-design-cdns-receives-a-buy-from-wells-fargo-1032941605
332.0,1/3/2024 6:53:42 PM,"3 Stocks to Buy for the $100,000 Portfolio: 2024 Edition",InvestorPlace,/news/stocks/3-stocks-to-buy-for-the-100000-portfolio-2024-edition-1032941023
333.0,1/8/2024 4:05:42 PM,Cadence Acquires Invecas ,RTTNews,/news/stocks/cadence-acquires-invecas-1032950920
334.0,1/15/2024 11:00:00 PM,7 A-Rated Software Stocks to Buy in January,InvestorPlace,/news/stocks/?p=2615893-1032968469
335.0,1/17/2024 5:20:21 PM,7 A-Rated Software Stocks to Buy in January,InvestorPlace,/news/stocks/7-a-rated-software-stocks-to-buy-in-january-1032974863
336.0,1/23/2024 9:06:32 PM,4 Stocks to Buy for the Coming AI Wars,InvestorPlace,/news/stocks/4-stocks-to-buy-for-the-coming-ai-wars-1032989387
337.0,2/5/2024 8:10:23 AM,"Analysts’ Opinions Are Mixed on These Technology Stocks: Roper Technologies (ROP), Cadence Design (CDNS) and Rapid7 (RPD)",TipRanks,/news/stocks/analysts-opinions-are-mixed-on-these-technology-stocks-roper-technologies-rop-cadence-design-cdns-and-rapid7-rpd-1033029409
338.0,2/10/2024 10:35:58 PM,Notable earnings after Monday's close,Seeking Alpha,https://seekingalpha.com/news/4065328-notable-earnings-after-mondays-close?utm_source=businessinsider&utm_medium=referral&feed_item_type=news
339.0,2/11/2024 3:01:13 PM,Cadence Design Systems earnings preview: what Wall Street is expecting,Markets Insider Automation,/news/stocks/cadence_design_systems-stock-quarter-earnings-preview-q4-1033053417
340.0,2/11/2024 10:35:00 PM,Cadence Design Systems Q4 2023 Earnings Preview,Seeking Alpha,https://seekingalpha.com/news/4065187-cadence-design-systems-q4-2023-earnings-preview?utm_source=businessinsider&utm_medium=referral&feed_item_type=news
341.0,2/12/2024 7:50:55 PM,"Wall Street Extends Record Highs Ahead Of Key Inflation Report, Bitcoin Hits $50,000, NVIDIA Surpasses Amazon: What's Driving Markets Monday?",Benzinga,/news/stocks/wall-street-extends-record-highs-ahead-of-key-inflation-report-bitcoin-hits-50-000-nvidia-surpasses-amazon-what-s-driving-markets-monday-1033058301
342.0,2/12/2024 9:04:19 PM,"Cadence Design Systems Non-GAAP EPS of $1.38 beats by $0.05, revenue of $1.07B beats by $10M",Seeking Alpha,https://seekingalpha.com/news/4065738-cadence-design-systems-non-gaap-eps-of-1_38-beats-0_05-revenue-of-1_07b-beats-10m?utm_source=businessinsider&utm_medium=referral&feed_item_type=news
343.0,2/12/2024 9:57:21 PM,"CDNS, TRIP and SWAV are among after hour movers",Seeking Alpha,https://seekingalpha.com/news/4065796-cdns-trip-and-swav-are-among-after-hour-movers?utm_source=businessinsider&utm_medium=referral&feed_item_type=news
344.0,2/12/2024 10:08:51 PM,"Cadence Design Systems Q4 Profit Increases, beats estimates",RTTNews,/news/stocks/cadence-design-systems-q4-profit-increases-beats-estimates-1033058494
345.0,2/13/2024 12:26:00 AM,Cadence stock -7% after hours on soft current quarter guidance as hardware sales normalize,Seeking Alpha,https://seekingalpha.com/news/4065839-cadence-stock-7-after-hours-on-soft-current-quarter-guidance-as-hardware-sales-normalize?utm_source=businessinsider&utm_medium=referral&feed_item_type=news
346.0,2/13/2024 10:33:22 AM,Optimistic Buy Rating for Cadence Design Amidst Robust Growth and AI Advancements,TipRanks,/news/stocks/optimistic-buy-rating-for-cadence-design-amidst-robust-growth-and-ai-advancements-1033060993
347.0,2/13/2024 10:42:40 AM,"New Buy Rating for Cadence Design (CDNS), the Technology Giant",TipRanks,/news/stocks/new-buy-rating-for-cadence-design-cdns-the-technology-giant-1033061093
348.0,2/13/2024 11:29:10 AM,"Arista Networks Reports Q4 Results, Joins Teradata, Lattice Semiconductor And Other Big Stocks Moving Lower In Tuesday's Pre-Market Session",Benzinga,/news/stocks/arista-networks-reports-q4-results-joins-teradata-lattice-semiconductor-and-other-big-stocks-moving-lower-in-tuesday-s-pre-market-session-1033060259
349.0,2/13/2024 12:15:33 PM,"Strong Fundamentals and High Conviction: A Buy Rating for Cadence Design Systems, Inc.",TipRanks,/news/stocks/strong-fundamentals-and-high-conviction-a-buy-rating-for-cadence-design-systems-inc-1033062023
350.0,2/13/2024 12:20:29 PM,"Analysts Offer Insights on Technology Companies: Teradata (TDC), Cadence Design (CDNS) and Kenvue, Inc. (KVUE)",TipRanks,/news/stocks/analysts-offer-insights-on-technology-companies-teradata-tdc-cadence-design-cdns-and-kenvue-inc-kvue-1033062013
351.0,2/13/2024 2:08:24 PM,ZoomInfo Technologies To Rally Around 50%? Here Are 10 Top Analyst Forecasts For Tuesday,Benzinga,/news/stocks/zoominfo-technologies-to-rally-around-50-here-are-10-top-analyst-forecasts-for-tuesday-1033060818
352.0,2/13/2024 2:21:51 PM,Cadence falls after Rosenblatt cuts rating following lower Q1 outlook,Seeking Alpha,https://seekingalpha.com/news/4066045-cadence-falls-after-rosenblatt-cuts-rating-following-lower-q1-outlook?utm_source=businessinsider&utm_medium=referral&feed_item_type=news
