Unnamed: 0,datetime,title,source,link
616.0,6/19/2023 8:30:00 AM,DuPont Showcases High-Performance Solutions for Next-Generation Aerospace Technologies at 54th International Paris Air Show,PR Newswire,/news/stocks/dupont-showcases-high-performance-solutions-for-next-generation-aerospace-technologies-at-54th-international-paris-air-show-1032396194
617.0,6/20/2023 3:00:00 PM,DuPont and JetCool Announce Collaboration in Thermal Management for High-Power Electronics,PR Newswire,/news/stocks/dupont-and-jetcool-announce-collaboration-in-thermal-management-for-high-power-electronics-1032399011
618.0,6/27/2023 10:57:31 AM,DuPont declares $0.36 dividend,Seeking Alpha,https://seekingalpha.com/news/3983066-dupont-de-nemours-inc-declares-0_36-dividend?utm_source=businessinsider&utm_medium=referral
619.0,6/27/2023 12:55:00 PM,DuPont Announces Regular Quarterly Dividend on Common Stock,PR Newswire,/news/stocks/dupont-announces-regular-quarterly-dividend-on-common-stock-1032411817
620.0,7/5/2023 8:00:46 PM,Analyst Ratings for DuPont de Nemours,Benzinga,/news/stocks/analyst-ratings-for-dupont-de-nemours-1032428326
621.0,7/11/2023 8:45:30 AM,DuPont de Nemours (DD) Receives a Hold from Barclays,TipRanks,/news/stocks/dupont-de-nemours-dd-receives-a-hold-from-barclays-1032437042
622.0,7/12/2023 3:00:00 PM,DuPont Launches First Nanofiltration Membrane Elements for High Productivity Lithium-Brine Purification,PR Newswire,/news/stocks/dupont-launches-first-nanofiltration-membrane-elements-for-high-productivity-lithium-brine-purification-1032441145
623.0,7/18/2023 10:15:00 PM,DuPont Schedules Second Quarter 2023 Earnings Conference Call,PR Newswire,/news/stocks/dupont-schedules-second-quarter-2023-earnings-conference-call-1032456215
624.0,7/21/2023 1:46:07 AM,DuPont de Nemours (DD): New Buy Recommendation for This Basic Materials Giant,TipRanks,/news/stocks/dupont-de-nemours-dd-new-buy-recommendation-for-this-basic-materials-giant-1032464214
625.0,8/1/2023 3:13:37 PM,Notable earnings before Wednesday's open,Seeking Alpha,https://seekingalpha.com/news/3994233-notable-earnings-before-wednesdays-open?utm_source=businessinsider&utm_medium=referral
626.0,8/1/2023 7:00:47 PM,"DuPont Q2 earnings on deck, what to expect",Seeking Alpha,https://seekingalpha.com/news/3994536-dupont-q2-earnings-on-deck-what-to-expect?utm_source=businessinsider&utm_medium=referral
627.0,8/1/2023 10:15:00 PM,DuPont Completes Acquisition of Spectrum Plastics Group,PR Newswire,/news/stocks/dupont-completes-acquisition-of-spectrum-plastics-group-1032502469
628.0,8/2/2023 10:04:00 AM,DuPont beats Q2 top and bottom line estimates; initiates Q3 and raises FY23 outlook,Seeking Alpha,https://seekingalpha.com/news/3994947-dupont-beats-q2-top-and-bottom-line-estimates-initiates-q3-and-raises-fy23-outlook?utm_source=businessinsider&utm_medium=referral
629.0,8/2/2023 12:00:00 PM,DuPont Reports Second Quarter 2023 Results,PR Newswire,/news/stocks/dupont-reports-second-quarter-2023-results-1032505813
630.0,8/2/2023 12:06:32 PM,EI DuPont De Nemours & Co. Q2 Earnings Summary,RTTNews,/news/stocks/ei-dupont-de-nemours-co-q2-earnings-summary-1032505839
631.0,8/2/2023 12:24:50 PM,"DuPont Issues Q3 Outlook, Cuts FY23 View - Update ",RTTNews,/news/stocks/dupont-issues-q3-outlook-cuts-fy23-view-update-1032505909
632.0,8/3/2023 1:46:21 AM,"New Buy Rating for DuPont de Nemours (DD), the Basic Materials Giant",TipRanks,/news/stocks/new-buy-rating-for-dupont-de-nemours-dd-the-basic-materials-giant-1032509205
633.0,8/3/2023 9:35:52 AM,Barclays Sticks to Their Hold Rating for DuPont de Nemours (DD),TipRanks,/news/stocks/barclays-sticks-to-their-hold-rating-for-dupont-de-nemours-dd-1032511595
634.0,8/3/2023 10:35:22 AM,"New Buy Rating for DuPont de Nemours (DD), the Basic Materials Giant",TipRanks,/news/stocks/new-buy-rating-for-dupont-de-nemours-dd-the-basic-materials-giant-1032511888
635.0,8/3/2023 11:41:01 AM,"Analysts Offer Insights on Materials Companies: Royal Gold (RGLD), DuPont de Nemours (DD) and Mosaic Co (MOS)",TipRanks,/news/stocks/analysts-offer-insights-on-materials-companies-royal-gold-rgld-dupont-de-nemours-dd-and-mosaic-co-mos-1032512222
636.0,8/3/2023 3:00:00 PM,Matt Urfali of DuPont™ Tedlar® Named to SPE Foundation Board,PR Newswire,/news/stocks/matt-urfali-of-dupont-tedlar-named-to-spe-foundation-board-1032512761
637.0,8/8/2023 2:10:12 PM,"DuPont’s Delrin-making unit said to get bids from Lone Star Funds, Platinum Equity",Seeking Alpha,https://seekingalpha.com/news/3999091-lone-star-platinum-said-to-be-among-bidders-for-duponts-delrin?utm_source=businessinsider&utm_medium=referral
638.0,8/9/2023 3:00:00 PM,DuPont™ FilmTec™ Prime RO Wins Energy and Sustainability Award from American Institute of Chemical Engineers,PR Newswire,/news/stocks/dupont-filmtec-prime-ro-wins-energy-and-sustainability-award-from-american-institute-of-chemical-engineers-1032535151
639.0,8/16/2023 1:45:35 AM,DuPont de Nemours (DD): New Buy Recommendation for This Basic Materials Giant,TipRanks,/news/stocks/dupont-de-nemours-dd-new-buy-recommendation-for-this-basic-materials-giant-1032557066
640.0,8/16/2023 10:29:19 AM,'New world order' backfires on China and Russia amid economic disruption,Seeking Alpha,https://seekingalpha.com/news/4003346-new-world-order-backfires-on-china-and-russia-amid-economic-disruption?utm_source=businessinsider&utm_medium=referral
641.0,8/20/2023 11:32:24 PM,DuPont near deal to sell resins unit for $1.8B - report,Seeking Alpha,https://seekingalpha.com/news/4004528-dupont-near-deal-to-sell-resins-unit-for-18b-report?utm_source=businessinsider&utm_medium=referral
642.0,8/21/2023 4:07:12 AM,DuPont In Advanced Talks To Sell Delrin Unit To Private Equity Firm For About $1.8 Bln : Report ,RTTNews,/news/stocks/dupont-in-advanced-talks-to-sell-delrin-unit-to-private-equity-firm-for-about-1-8-bln-report-1032568211
643.0,8/21/2023 11:11:35 AM,DuPont to sell 80% ownership in Delrin business to TJC,Seeking Alpha,https://seekingalpha.com/news/4004608-dupont-to-sell-80-ownership-in-delrin-business-to-tjc?utm_source=businessinsider&utm_medium=referral
644.0,8/21/2023 1:00:00 PM,DuPont Announces Agreement to Divest ~80% Ownership in Delrin® Business to TJC,PR Newswire,/news/stocks/dupont-announces-agreement-to-divest-80-ownership-in-delrin-business-to-tjc-1032569294
645.0,8/21/2023 2:06:23 PM,DuPont To Divest Around 80% Ownership In Delrin To TJC ,RTTNews,/news/stocks/dupont-to-divest-around-80-ownership-in-delrin-to-tjc-1032569538
646.0,8/22/2023 10:05:50 AM,DuPont de Nemours (DD) Receives a Hold from Barclays,TipRanks,/news/stocks/dupont-de-nemours-dd-receives-a-hold-from-barclays-1032572384
647.0,8/23/2023 8:15:16 AM,Mizuho Securities Remains a Buy on DuPont de Nemours (DD),TipRanks,/news/stocks/mizuho-securities-remains-a-buy-on-dupont-de-nemours-dd-1032575474
648.0,8/23/2023 3:00:00 PM,DuPont Wins Four R&D100 Awards,PR Newswire,/news/stocks/dupont-wins-four-r-d100-awards-1032576419
649.0,9/3/2023 7:00:07 PM,3 Up-and-Coming Hydrogen Stocks to Put on Your Must-Buy List,InvestorPlace,/news/stocks/3-up-and-coming-hydrogen-stocks-to-put-on-your-must-buy-list-1032601368
650.0,9/5/2023 3:00:00 PM,DuPont Announces Strategic Collaboration with YMT to Enhance Riston® Dry Film Photoresist Distribution and Service in Korea,PR Newswire,/news/stocks/dupont-announces-strategic-collaboration-with-ymt-to-enhance-riston-dry-film-photoresist-distribution-and-service-in-korea-1032605357
651.0,9/5/2023 3:48:56 PM,DuPont To Collaborate With YMT To Enhance Service In Korea ,RTTNews,/news/stocks/dupont-to-collaborate-with-ymt-to-enhance-service-in-korea-1032605589
652.0,9/6/2023 10:15:00 PM,DuPont Completes $3.25 Billion Accelerated Share Repurchase Transaction; Launches New $2 Billion Accelerated Share Repurchase Transaction,PR Newswire,/news/stocks/dupont-completes-3-25-billion-accelerated-share-repurchase-transaction-launches-new-2-billion-accelerated-share-repurchase-transaction-1032610663
653.0,9/7/2023 3:00:00 PM,DuPont Names Recipients of 2023 Lavoisier Medal and Pedersen Award,PR Newswire,/news/stocks/dupont-names-recipients-of-2023-lavoisier-medal-and-pedersen-award-1032612903
654.0,9/12/2023 6:50:57 PM,3 Overpaid CEOs Raking In Far More Than They Are Worth,InvestorPlace,/news/stocks/3-overpaid-ceos-raking-in-far-more-than-they-are-worth-1032624680
655.0,9/13/2023 3:00:00 PM,Delrin® Introduces Breakthrough New Resin for High-performance Plastic Gears,PR Newswire,/news/stocks/delrin-introduces-breakthrough-new-resin-for-high-performance-plastic-gears-1032626978
656.0,9/14/2023 3:00:00 PM,"DuPont™ Tedlar® to be featured on ""Inside the Blueprint"" Series",PR Newswire,/news/stocks/dupont-tedlar-to-be-featured-on-inside-the-blueprint-series-1032630440
657.0,9/26/2023 3:00:00 PM,DuPont Introduces First Ion Exchange Resin for Green Hydrogen Production,PR Newswire,/news/stocks/dupont-introduces-first-ion-exchange-resin-for-green-hydrogen-production-1032655962
658.0,9/27/2023 9:00:00 AM,DuPont Opens New Adhesives Manufacturing Facility,PR Newswire,/news/stocks/dupont-opens-new-adhesives-manufacturing-facility-1032658074
659.0,9/27/2023 9:50:25 AM,DuPont Opens New Adhesives Production Facility In China ,RTTNews,/news/stocks/dupont-opens-new-adhesives-production-facility-in-china-1032658205
660.0,9/28/2023 3:00:00 PM,DuPont Leaders to Discuss Sustainability and Innovation in Semiconductor Materials at Strategic Materials Conference,PR Newswire,/news/stocks/dupont-leaders-to-discuss-sustainability-and-innovation-in-semiconductor-materials-at-strategic-materials-conference-1032662978
661.0,10/4/2023 7:00:41 PM,Analyst Expectations for DuPont de Nemours's Future,Benzinga,/news/stocks/analyst-expectations-for-dupont-de-nemours-s-future-1032679023
662.0,10/9/2023 12:16:24 PM,"New Buy Rating for DuPont de Nemours (DD), the Basic Materials Giant",TipRanks,/news/stocks/new-buy-rating-for-dupont-de-nemours-dd-the-basic-materials-giant-1032688632
663.0,10/10/2023 3:00:00 PM,Carlsberg Wins Global Industrial Water Reuse Award Using DuPont Technology,PR Newswire,/news/stocks/carlsberg-wins-global-industrial-water-reuse-award-using-dupont-technology-1032692328
664.0,10/17/2023 12:20:28 PM,"New Buy Rating for DuPont de Nemours (DD), the Basic Materials Giant",TipRanks,/news/stocks/new-buy-rating-for-dupont-de-nemours-dd-the-basic-materials-giant-1032712269
665.0,10/17/2023 2:00:00 PM,"U. S. Steel and DuPont Launch COASTALUME™ Product, North America's First GALVALUME® Solution Engineered and Warrantied for Coastal Environments",PR Newswire,/news/stocks/u-s-steel-and-dupont-launch-coastalume-product-north-america-s-first-galvalume-solution-engineered-and-warrantied-for-coastal-environments-1032712130
666.0,10/17/2023 3:00:00 PM,"DuPont introduces higher-adhesion, low-cyclics silicone soft skin adhesive",PR Newswire,/news/stocks/dupont-introduces-higher-adhesion-low-cyclics-silicone-soft-skin-adhesive-1032712518
667.0,10/17/2023 10:15:00 PM,DuPont Announces Regular Quarterly Dividend on Common Stock,PR Newswire,/news/stocks/dupont-announces-regular-quarterly-dividend-on-common-stock-1032714090
668.0,10/19/2023 2:00:00 PM,DuPont Achieves 69 Percent Reduction in Carbon Emissions at its Healthcare Industries Materials Site,PR Newswire,/news/stocks/dupont-achieves-69-percent-reduction-in-carbon-emissions-at-its-healthcare-industries-materials-site-1032720524
669.0,10/19/2023 3:00:00 PM,DuPont Schedules Third Quarter 2023 Earnings Conference Call,PR Newswire,/news/stocks/dupont-schedules-third-quarter-2023-earnings-conference-call-1032720854
670.0,10/25/2023 4:21:00 PM,DuPont Showcases Industry-Leading Innovations in Advanced Circuit Materials and Solutions at TPCA Show 2023 in Taipei,PR Newswire,/news/stocks/dupont-showcases-industry-leading-innovations-in-advanced-circuit-materials-and-solutions-at-tpca-show-2023-in-taipei-1032739481
671.0,10/26/2023 3:00:00 PM,DuPont Introduces Conductive Tape for Use as Dry Electrode in Biosignal Monitoring,PR Newswire,/news/stocks/dupont-introduces-conductive-tape-for-use-as-dry-electrode-in-biosignal-monitoring-1032743968
672.0,10/31/2023 3:01:13 PM,Here's what Wall Street expects from DuPont de Nemours's earnings report,Markets Insider Automation,/news/stocks/dupont-q3-earnings-preview-stock-1032759627
673.0,11/1/2023 11:00:00 AM,DuPont to Complete Sale of ~80% Ownership in Delrin® Business to TJC,PR Newswire,/news/stocks/dupont-to-complete-sale-of-80-ownership-in-delrin-business-to-tjc-1032764244
674.0,11/1/2023 11:01:00 AM,DuPont Reports Third Quarter 2023 Results,PR Newswire,/news/stocks/dupont-reports-third-quarter-2023-results-1032764249
675.0,11/1/2023 11:06:28 AM,EI DuPont De Nemours & Co. Bottom Line Retreats In Q3,RTTNews,/news/stocks/ei-dupont-de-nemours-co-bottom-line-retreats-in-q3-1032764269
676.0,11/1/2023 11:19:17 AM,"DuPont Cuts FY23 Earnings, Revenue View - Update ",RTTNews,/news/stocks/dupont-cuts-fy23-earnings-revenue-view-update-1032764291
677.0,11/1/2023 11:31:42 AM,DuPont To Complete Sale Of 80.1% Stake In Delrin Business To TJC ,RTTNews,/news/stocks/dupont-to-complete-sale-of-80-1-stake-in-delrin-business-to-tjc-1032764323
678.0,11/1/2023 6:23:26 PM,"Stocks Edge Higher Ahead Of Federal Reserve Decision, Bonds Surge After Softer Treasury Refunding Plan: What's Driving Markets Wednesday?",Benzinga,/news/etf/stocks-edge-higher-ahead-of-federal-reserve-decision-bonds-surge-after-softer-treasury-refunding-plan-what-s-driving-markets-wednesday-1032766768
679.0,11/2/2023 7:40:20 AM,Analysts Conflicted on These Materials Names: DuPont de Nemours (DD) and Materion (MTRN),TipRanks,/news/stocks/analysts-conflicted-on-these-materials-names-dupont-de-nemours-dd-and-materion-mtrn-1032772040
680.0,11/2/2023 2:00:00 PM,DuPont Collaborates with STMicroelectronics (ST) to Develop New Smart Wearable Device Concept for Monitoring Biosignals,PR Newswire,/news/stocks/dupont-collaborates-with-stmicroelectronics-st-to-develop-new-smart-wearable-device-concept-for-monitoring-biosignals-1032770337
681.0,11/3/2023 1:25:44 AM,Barclays Remains a Hold on DuPont de Nemours (DD),TipRanks,/news/stocks/barclays-remains-a-hold-on-dupont-de-nemours-dd-1032776253
682.0,11/3/2023 2:00:43 PM,Analyst Expectations for DuPont de Nemours's Future,Benzinga,/news/stocks/analyst-expectations-for-dupont-de-nemours-s-future-1032776181
683.0,11/6/2023 3:00:00 PM,DuPont Opens New Kalrez® Production Site in Delaware,PR Newswire,/news/stocks/dupont-opens-new-kalrez-production-site-in-delaware-1032782269
684.0,11/9/2023 3:00:00 PM,DuPont™ Tyvek® Luxembourg Facility Achieves ISCC PLUS Certification,PR Newswire,/news/stocks/dupont-tyvek-luxembourg-facility-achieves-iscc-plus-certification-1032800917
685.0,11/16/2023 3:00:00 PM,DuPont™ FilmTec™ Fortilife™ NF1000 Membrane Now Available Globally,PR Newswire,/news/stocks/dupont-filmtec-fortilife-nf1000-membrane-now-available-globally-1032827679
686.0,11/17/2023 1:46:21 AM,DuPont de Nemours (DD): New Buy Recommendation for This Basic Materials Giant,TipRanks,/news/stocks/dupont-de-nemours-dd-new-buy-recommendation-for-this-basic-materials-giant-1032831267
687.0,11/29/2023 1:00:00 PM,"DuPont, Chemours, and Corteva Reach Natural Resource Restoration Agreement with the State of Ohio",PR Newswire,/news/stocks/dupont-chemours-and-corteva-reach-natural-resource-restoration-agreement-with-the-state-of-ohio-1032857987
688.0,11/29/2023 1:43:03 PM,"DuPont, Chemours, Corteva To Pay $110 Mln To Ohio As Natural Resource Restoration Deal Settles ",RTTNews,/news/stocks/dupont-chemours-corteva-to-pay-110-mln-to-ohio-as-natural-resource-restoration-deal-settles-1032858160
689.0,11/30/2023 3:00:00 PM,DuPont Achieves Major Decarbonization Milestone Through Full Conversion to Low-GWP Styrofoam™ Brand XPS Insulation,PR Newswire,/news/stocks/dupont-achieves-major-decarbonization-milestone-through-full-conversion-to-low-gwp-styrofoam-brand-xps-insulation-1032862597
690.0,12/6/2023 3:00:00 PM,DuPont Earns Perfect Score in Human Rights Campaign Foundation's 2023-2024 Corporate Equality Index,PR Newswire,/news/stocks/dupont-earns-perfect-score-in-human-rights-campaign-foundation-s-2023-2024-corporate-equality-index-1032878233
691.0,12/7/2023 3:00:00 PM,DuPont Launches Printed Tedlar® PVF Solutions and PVF Coating at Taipei Building Show,PR Newswire,/news/stocks/dupont-launches-printed-tedlar-pvf-solutions-and-pvf-coating-at-taipei-building-show-1032882024
692.0,12/13/2023 9:47:52 AM,"New Buy Rating for DuPont de Nemours (DD), the Basic Materials Giant",TipRanks,/news/stocks/new-buy-rating-for-dupont-de-nemours-dd-the-basic-materials-giant-1032898813
693.0,12/19/2023 3:00:00 PM,DuPont Recognized as Best ESG Partner by Samsung Electronics,PR Newswire,/news/stocks/dupont-recognized-as-best-esg-partner-by-samsung-electronics-1032912503
694.0,12/22/2023 1:46:27 AM,DuPont de Nemours (DD) Receives a Buy from RBC Capital,TipRanks,/news/stocks/dupont-de-nemours-dd-receives-a-buy-from-rbc-capital-1032922264
695.0,1/8/2024 9:59:52 PM,7 Blue-Chip Stocks to Snap Up at Can’t-Miss Prices,InvestorPlace,/news/stocks/7-blue-chip-stocks-to-snap-up-at-cant-miss-prices-1032951709
696.0,1/8/2024 10:41:08 PM,7 Overlooked Small-Cap Stocks to Keep On Your Radar,InvestorPlace,/news/stocks/7-overlooked-small-cap-stocks-to-keep-on-your-radar-1032951748
697.0,1/9/2024 10:00:00 AM,"If You Can Only Buy One Hydrogen Stock in January, It Better Be One of These 3 Names",InvestorPlace,/news/stocks/if-you-can-only-buy-one-hydrogen-stock-in-january-it-better-be-one-of-these-3-names-1032952937
698.0,1/16/2024 7:53:41 PM,"BofA Analyst's Chemical Blend: Rating Change Saga, Reassesses Agricultural Market Dynamics",Benzinga,/news/stocks/bofa-analyst-s-chemical-blend-rating-change-saga-reassesses-agricultural-market-dynamics-1032971657
699.0,1/16/2024 9:46:19 PM,"Contaminant Litigation Risks May Affect DuPont Valuation, Analyst Downgrades Stock",Benzinga,/news/stocks/contaminant-litigation-risks-may-affect-dupont-valuation-analyst-downgrades-stock-1032971805
700.0,1/24/2024 1:25:29 PM,"DuPont Projects Sequential Sales, Earnings Decline In Q1; Stock Tumbles ",RTTNews,/news/stocks/dupont-projects-sequential-sales-earnings-decline-in-q1-stock-tumbles-1032991921
701.0,1/24/2024 1:40:30 PM,"HWH, BFRG and NXTP among pre-market losers",Seeking Alpha,https://seekingalpha.com/news/4057824-hwh-bfrg-and-nxtp-among-pre-market-losers?utm_source=businessinsider&utm_medium=referral&feed_item_type=news
702.0,1/24/2024 3:13:36 PM,"Biggest stock movers today: Freeport-McMoRan, Netflix, SAP SE, and more",Seeking Alpha,https://seekingalpha.com/news/4057695-biggest-stock-movers-today-netflix-sap-se-and-more?utm_source=businessinsider&utm_medium=referral&feed_item_type=news
703.0,1/24/2024 3:43:32 PM,Dow Jumps 100 Points; Netflix Reports Strong Q4 Sales,Benzinga,/news/stocks/dow-jumps-100-points-netflix-reports-strong-q4-sales-1032992650
704.0,1/24/2024 3:58:44 PM,DuPont De Nemours Shares Fall On Bleak Outlook ,RTTNews,/news/stocks/dupont-de-nemours-shares-fall-on-bleak-outlook-1032992729
705.0,1/24/2024 6:04:48 PM,Crude Oil Rises Over 1%; DuPont Shares Plunge,Benzinga,/news/stocks/crude-oil-rises-over-1-dupont-shares-plunge-1032993519
706.0,1/24/2024 7:05:28 PM,Why BlackBerry Shares Are Trading Lower By Over 17%? Here Are Other Stocks Moving In Wednesday's Mid-Day Session,Benzinga,/news/stocks/why-blackberry-shares-are-trading-lower-by-over-17-here-are-other-stocks-moving-in-wednesday-s-mid-day-session-1032993740
707.0,1/24/2024 8:38:32 PM,"Stock Market Extends Record Highs, S&P 500 Hits 4,900 On Tech Rally, Microsoft's $3 Trillion Mark: What's Driving Markets Wednesday?",Benzinga,/news/stocks/stock-market-extends-record-highs-s-p-500-hits-4-900-on-tech-rally-microsoft-s-3-trillion-mark-what-s-driving-markets-wednesday-1032993924
708.0,1/24/2024 9:46:29 PM,Dow Edges Lower; US Composite PMI Rises In January,Benzinga,/news/stocks/dow-edges-lower-us-composite-pmi-rises-in-january-1032994007
709.0,1/25/2024 2:26:19 AM,Hold Rating on DuPont de Nemours Amidst Earnings Shortfall and Uncertain Recovery,TipRanks,/news/stocks/hold-rating-on-dupont-de-nemours-amidst-earnings-shortfall-and-uncertain-recovery-1032994847
710.0,1/25/2024 10:34:38 AM,Analysts’ Opinions Are Mixed on These Materials Stocks: Avantor (AVTR) and DuPont de Nemours (DD),TipRanks,/news/stocks/analysts-opinions-are-mixed-on-these-materials-stocks-avantor-avtr-and-dupont-de-nemours-dd-1032996735
711.0,1/25/2024 4:01:28 PM,DuPont de Nemours Stock: A Deep Dive Into Analyst Perspectives (7 Ratings),Benzinga,/news/stocks/dupont-de-nemours-stock-a-deep-dive-into-analyst-perspectives-7-ratings-1032997472
712.0,1/29/2024 6:15:49 PM,Tesla among top 10 most oversold stocks on Wall Street,Seeking Alpha,https://seekingalpha.com/news/4059613-tesla-is-in-the-top-10-most-oversold-stocks-on-wall-street?utm_source=businessinsider&utm_medium=referral&feed_item_type=news
713.0,1/31/2024 1:07:02 PM,Top 5 Materials Stocks That Are Set To Fly In Q1,Benzinga,/news/stocks/top-5-materials-stocks-that-are-set-to-fly-in-q1-1033014545
714.0,2/2/2024 3:15:19 PM,Companies with profit warnings after negative earnings season - JPM,Seeking Alpha,https://seekingalpha.com/news/4062201-companies-with-profit-warnings-after-negative-earnings-season-jpm?utm_source=businessinsider&utm_medium=referral&feed_item_type=news
715.0,2/4/2024 1:45:00 PM,"Earnings week ahead: Alibaba, PepsiCo, Disney, Palantir, McDonalds, Ford and more",Seeking Alpha,https://seekingalpha.com/news/4062246-earnings-week-ahead-alibaba-pepsico-disney-palantir-mcdonalds-philip-morris-ford-and-more?utm_source=businessinsider&utm_medium=referral&feed_item_type=news
716.0,2/5/2024 3:01:13 PM,DuPont de Nemours earnings: here's what Wall Street expects,Markets Insider Automation,/news/stocks/dupont-q4-quarterly-earnings-preview-stock-1033030176
717.0,2/5/2024 4:04:02 PM,Notable earnings before Tuesday's open,Seeking Alpha,https://seekingalpha.com/news/4062654-notable-earnings-before-tuesdays-open?utm_source=businessinsider&utm_medium=referral&feed_item_type=news
718.0,2/5/2024 5:28:12 PM,DuPont Q4 2023 Earnings Preview: What to expect,Seeking Alpha,https://seekingalpha.com/news/4062696-dupont-q4-2023-earnings-preview-what-to-expect?utm_source=businessinsider&utm_medium=referral&feed_item_type=news
719.0,2/6/2024 11:06:42 AM,"DuPont Non-GAAP EPS of $0.87 beats by $0.03, revenue of $2.9B misses by $10M",Seeking Alpha,https://seekingalpha.com/news/4062992-dupont-non-gaap-eps-of-0_87-beats-0_03-revenue-of-2_9b-misses-10m?utm_source=businessinsider&utm_medium=referral&feed_item_type=news
720.0,2/6/2024 11:08:30 AM,DuPont lifts dividend by ~6% to $0.38/share; initiates $1B stock buyback plan,Seeking Alpha,https://seekingalpha.com/news/4062990-dupont-lifts-dividend-by-6-to-038share?utm_source=businessinsider&utm_medium=referral&feed_item_type=news
721.0,2/6/2024 12:51:43 PM,"DuPont Slips To Loss In Q4 On Goodwill Impairment, To Buy Back $1 Bln Shares ",RTTNews,/news/stocks/dupont-slips-to-loss-in-q4-on-goodwill-impairment-to-buy-back-1-bln-shares-1033034279
722.0,2/7/2024 9:02:54 AM,"DuPont Boosts Dividend, Initiates $1B Share Buyback",TipRanks,/news/stocks/dupont-boosts-dividend-initiates-1b-share-buyback-1033040062
723.0,2/7/2024 10:26:57 AM,DuPont de Nemours: Hold Rating Affirmed Amidst Cautious 2024 Outlook and Share Repurchase Programs,TipRanks,/news/stocks/dupont-de-nemours-hold-rating-affirmed-amidst-cautious-2024-outlook-and-share-repurchase-programs-1033040632
724.0,2/7/2024 11:41:22 AM,"Analysts’ Opinions Are Mixed on These Materials Stocks: DuPont de Nemours (DD), Nufarm Limited (OtherNUFMF) and Cleveland-Cliffs (CLF)",TipRanks,/news/stocks/analysts-opinions-are-mixed-on-these-materials-stocks-dupont-de-nemours-dd-nufarm-limited-othernufmf-and-cleveland-cliffs-clf-1033041232
725.0,2/7/2024 12:21:24 PM,Analysts Offer Insights on Materials Companies: DuPont de Nemours (DD) and FMC (FMC),TipRanks,/news/stocks/analysts-offer-insights-on-materials-companies-dupont-de-nemours-dd-and-fmc-fmc-1033041726
726.0,2/7/2024 6:00:37 PM,Mizuho Maintains Buy Rating for DuPont de Nemours: Here's What You Need To Know,Benzinga,/news/stocks/mizuho-maintains-buy-rating-for-dupont-de-nemours-here-s-what-you-need-to-know-1033042234
727.0,2/12/2024 1:15:12 AM,DuPont de Nemours (DD) Gets a Hold from Barclays,TipRanks,/news/stocks/dupont-de-nemours-dd-gets-a-hold-from-barclays-1033053764
728.0,2/12/2024 12:11:55 PM,"Analysts Offer Insights on Materials Companies: Interfor (OtherIFSPF), Ganfeng Lithium Co (OtherGNENF) and DuPont de Nemours (DD)",TipRanks,/news/stocks/analysts-offer-insights-on-materials-companies-interfor-otherifspf-ganfeng-lithium-co-othergnenf-and-dupont-de-nemours-dd-1033057641
729.0,2/12/2024 7:00:58 PM,Evaluating DuPont de Nemours: Insights From 8 Financial Analysts,Benzinga,/news/stocks/evaluating-dupont-de-nemours-insights-from-8-financial-analysts-1033058201
730.0,2/14/2024 11:00:17 PM,"Larry Robbins' Glenview Capital takes in Marvell, cuts stake in Intel and exits Microsoft",Seeking Alpha,https://seekingalpha.com/news/4067280-larry-robbins-glenview-capital-takes-in-marvell-cuts-stake-in-intel-and-exits-microsoft?utm_source=businessinsider&utm_medium=referral&feed_item_type=news
731.0,2/22/2024 10:06:57 AM,Barclays Keeps Their Hold Rating on DuPont de Nemours (DD),TipRanks,/news/stocks/barclays-keeps-their-hold-rating-on-dupont-de-nemours-dd-1033092780
732.0,3/1/2024 7:02:06 PM,Analyst Ratings For DuPont de Nemours,Benzinga,/news/stocks/analyst-ratings-for-dupont-de-nemours-1033124854
733.0,3/2/2024 1:45:23 AM,DuPont de Nemours (DD): New Buy Recommendation for This Basic Materials Giant,TipRanks,/news/stocks/dupont-de-nemours-dd-new-buy-recommendation-for-this-basic-materials-giant-1033125564
