Unnamed: 0,datetime,title,source,link
497.0,10/18/2022 12:47:14 PM,DuPont de Nemours (DD) Receives a Buy from Wells Fargo,TipRanks,/news/stocks/dupont-de-nemours-dd-receives-a-buy-from-wells-fargo-1031813388
498.0,10/18/2022 8:03:39 PM,Expert Ratings for DuPont de Nemours,Benzinga,/news/stocks/expert-ratings-for-dupont-de-nemours-1031814602
499.0,10/19/2022 8:12:58 PM,DuPont declares $0.33 dividend,Seeking Alpha,https://seekingalpha.com/news/3892830-dupont-de-nemours-inc-declares-0_33-dividend?utm_source=businessinsider&utm_medium=referral
500.0,10/19/2022 10:05:00 PM,DuPont Announces Regular Quarterly Dividend on Common Stock,PR Newswire,/news/stocks/dupont-announces-regular-quarterly-dividend-on-common-stock-1031818746
501.0,10/20/2022 1:52:48 AM,"Analysts Offer Insights on Materials Companies: Royal Gold (RGLD), DuPont de Nemours (DD) and Canfor (OtherCFPZF)",TipRanks,/news/stocks/analysts-offer-insights-on-materials-companies-royal-gold-rgld-dupont-de-nemours-dd-and-canfor-othercfpzf-1031819153
502.0,10/20/2022 10:00:00 PM,DuPont Schedules Third Quarter 2022 Earnings Conference Call,PR Newswire,/news/stocks/dupont-schedules-third-quarter-2022-earnings-conference-call-1031822457
503.0,10/26/2022 5:43:09 PM,Dupont's deal for Rogers expected to go past Nov. 1 deadline - report,Seeking Alpha,https://seekingalpha.com/news/3895738-duponts-deal-for-rogers-expected-to-go-past-nov-1-deadline-report?utm_source=businessinsider&utm_medium=referral
504.0,10/28/2022 6:30:28 PM,"Catalyst watch: FOMC jitters, Starbucks and Pfizer earnings, Boeing and AMD events",Seeking Alpha,https://seekingalpha.com/news/3897337-catalyst-watch-fomc-jitters-starbucks-and-pfizer-earnings-boeing-and-amd-events?utm_source=businessinsider&utm_medium=referral
505.0,11/1/2022 2:13:00 PM,DuPont Completes M&M Divestiture to Celanese,PR Newswire,/news/stocks/dupont-completes-m-m-divestiture-to-celanese-1031858557
506.0,11/1/2022 3:00:00 PM,DuPont Joins Semiconductor Climate Consortium as a Founding Member,PR Newswire,/news/stocks/dupont-joins-semiconductor-climate-consortium-as-a-founding-member-1031859078
507.0,11/1/2022 9:15:14 PM,Rogers plunges 40% after Dupont announces it's terminating acquisition,Seeking Alpha,https://seekingalpha.com/news/3899192-rogers-plunges-22-after-dupont-announces-its-terminating-acquisition?utm_source=businessinsider&utm_medium=referral
508.0,11/1/2022 10:09:00 PM,DuPont Announces Termination of Intended Rogers Acquisition,PR Newswire,/news/stocks/dupont-announces-termination-of-intended-rogers-acquisition-1031860449
509.0,11/2/2022 12:22:40 PM,Rogers Corp. sinks 41% after Dupont terminates $5.2 billion acquisition,Seeking Alpha,https://seekingalpha.com/news/3899543-rogers-corp-sinks-41-after-dupont-terminates-52-billion-acquisition?utm_source=businessinsider&utm_medium=referral
510.0,11/2/2022 1:45:20 PM,"New Buy Rating for DuPont de Nemours (DD), the Basic Materials Giant",TipRanks,/news/stocks/new-buy-rating-for-dupont-de-nemours-dd-the-basic-materials-giant-1031864363
511.0,11/2/2022 4:34:07 PM,Why Is Rogers Corporation (ROG) Stock Down 44% Today?,InvestorPlace,/news/stocks/why-is-rogers-corporation-rog-stock-down-44-today-1031865415
512.0,11/2/2022 7:28:56 PM,Tower Semiconductor drops amid Dupont's termination of Rogers deal,Seeking Alpha,https://seekingalpha.com/news/3900125-tower-semiconductor-drops-amid-duponts-termination-of-rogers-deal?utm_source=businessinsider&utm_medium=referral
513.0,11/3/2022 4:54:47 PM,Rogers Corp. shares tumble another 14% after confirming Dupont deal terminated,Seeking Alpha,https://seekingalpha.com/news/3901151-rogers-corp-shares-tumble-another-14-after-confirming-dupont-deal-terminated?utm_source=businessinsider&utm_medium=referral
514.0,11/4/2022 5:30:43 PM,"Catalyst watch: CPI downtick, election ripples, Disney and Rivian earnings, Roblox conference call",Seeking Alpha,https://seekingalpha.com/news/3902134-catalyst-watch-cpi-downtick-election-ripples-disney-and-rivian-earnings-roblox-conference-call?utm_source=businessinsider&utm_medium=referral
515.0,11/4/2022 6:03:08 PM,"Earnings week ahead: Disney, Lyft, Rivian, Palantir and more",Seeking Alpha,https://seekingalpha.com/news/3902104-earnings-week-ahead-disney-lyft-rivian-palantir-and-more?utm_source=businessinsider&utm_medium=referral
516.0,11/6/2022 2:00:31 PM,"M&A investors have tough, unexpected week with Rogers deal termination, Albertsons dividend",Seeking Alpha,https://seekingalpha.com/news/3902379-ma-investors-have-tough-unexpected-week-with-rogers-deal-termination-albertsons-dividend?utm_source=businessinsider&utm_medium=referral
517.0,11/7/2022 3:01:13 PM,Here's what Wall Street expects from DuPont de Nemours's earnings report,Markets Insider Automation,/news/stocks/dupont-q3-earnings-preview-stock-1031881703
518.0,11/7/2022 4:03:42 PM,Notable earnings before Tuesday's open,Seeking Alpha,https://seekingalpha.com/news/3902648-notable-earnings-before-tuesdays-open?utm_source=businessinsider&utm_medium=referral
519.0,11/7/2022 7:13:47 PM,"DuPont Q3 Earnings Preview: material strength yet to be seen, no pun intended",Seeking Alpha,https://seekingalpha.com/news/3902646-dupont-q3-earnings-preview-material-strength-yet-to-be-seen-no-pun-intended?utm_source=businessinsider&utm_medium=referral
520.0,11/8/2022 11:01:55 AM,"DuPont Non-GAAP EPS of $0.82 beats by $0.03, revenue of $3.3B beats by $100M, announces $5B buyback",Seeking Alpha,https://seekingalpha.com/news/3903319-dupont-non-gaap-eps-of-082-beats-by-003-revenue-of-33b-beats-by-100m-announces-5b-buyback?utm_source=businessinsider&utm_medium=referral
521.0,11/8/2022 12:00:00 PM,DuPont Reports Third Quarter 2022 Results,PR Newswire,/news/stocks/dupont-reports-third-quarter-2022-results-1031885794
522.0,11/8/2022 12:08:39 PM,EI DuPont De Nemours & Co. Announces Decline In Q3 Bottom Line,RTTNews,/news/stocks/ei-dupont-de-nemours-co-announces-decline-in-q3-bottom-line-1031885826
523.0,11/8/2022 12:20:43 PM,DuPont Board Approves $5.0 Bln Share Repurchase - Quick Facts ,RTTNews,/news/stocks/dupont-board-approves-5-0-bln-share-repurchase-quick-facts-1031885872
524.0,11/8/2022 4:53:33 PM,"DuPont's Q3 beat shows toughness in difficult markets, shares rally",Seeking Alpha,https://seekingalpha.com/news/3903666-duponts-q3-beat-shows-toughness-in-difficult-markets-shares-rally?utm_source=businessinsider&utm_medium=referral
525.0,11/9/2022 8:53:42 AM,"DuPont, Expeditors International, Planet Fitness And Other Big Gainers From Tuesday",Benzinga,/news/stocks/dupont-expeditors-international-planet-fitness-and-other-big-gainers-from-tuesday-1031890837
526.0,11/22/2022 3:00:00 PM,DuPont to Participate at the Credit Suisse Global Industrials Conference,PR Newswire,/news/stocks/dupont-to-participate-at-the-credit-suisse-global-industrials-conference-1031931372
527.0,11/22/2022 7:25:40 PM,Why Is Petrobras (PBR) Stock Down Today?,InvestorPlace,/news/stocks/why-is-petrobras-pbr-stock-down-today-1031932240
528.0,12/24/2022 1:46:00 AM,"New Buy Rating for DuPont de Nemours (DD), the Basic Materials Giant",TipRanks,/news/stocks/new-buy-rating-for-dupont-de-nemours-dd-the-basic-materials-giant-1031989739
529.0,12/25/2022 2:00:00 PM,"SPACs, Activision, VMware, iRobot among M&A bets for 2023 - investor",Seeking Alpha,https://seekingalpha.com/news/3919666-westchester?utm_source=businessinsider&utm_medium=referral
530.0,12/25/2022 2:37:36 PM,"SPACs, Activision, VMware, iRobot among M&A bets for 2023 - investor",Seeking Alpha,https://seekingalpha.com/news/3920635-spacs-activision-vmware-irobot-among-ma-bets-for-2023-investor?utm_source=businessinsider&utm_medium=referral
531.0,12/29/2022 3:40:56 PM,MMAT Stock Alert: What to Watch at CES 2023,InvestorPlace,/news/stocks/mmat-stock-alert-what-to-watch-at-ces-2023-1031993836
532.0,1/4/2023 5:11:18 PM,The 7 Best Fertilizer Stocks to Buy for 2023,InvestorPlace,/news/stocks/the-7-best-fertilizer-stocks-to-buy-for-2023-1032000473
533.0,1/12/2023 2:00:54 PM,What 7 Analyst Ratings Have To Say About DuPont de Nemours,Benzinga,/news/stocks/what-7-analyst-ratings-have-to-say-about-dupont-de-nemours-1032014806
534.0,1/13/2023 1:19:29 PM,7 Dividend-Paying Large-Cap Stocks to Buy in January,InvestorPlace,/news/stocks/7-dividend-paying-large-cap-stocks-to-buy-in-january-1032017485
535.0,1/14/2023 2:00:54 PM,Quant Ratings Updated on 98 Stocks,InvestorPlace,/news/stocks/20230114-quant-ratings-1032018539
536.0,1/17/2023 4:01:25 PM,"Benzinga's Top Ratings Upgrades, Downgrades For January 17, 2023",Benzinga,/news/stocks/benzinga-s-top-ratings-upgrades-downgrades-for-january-17-2023-1032022889
537.0,1/19/2023 2:00:00 PM,DuPont Schedules Fourth Quarter 2022 Earnings Conference Call,PR Newswire,/news/stocks/dupont-schedules-fourth-quarter-2022-earnings-conference-call-1032028255
538.0,1/23/2023 10:47:07 AM,Goldman tips stocks poised to best benefit from China's reopening,Seeking Alpha,https://seekingalpha.com/news/3926560-goldman-tips-stocks-poised-to-best-benefit-from-chinas-reopening?utm_source=businessinsider&utm_medium=referral
539.0,1/26/2023 2:55:08 PM,BMO Capital Keeps Their Buy Rating on DuPont de Nemours (DD),TipRanks,/news/stocks/bmo-capital-keeps-their-buy-rating-on-dupont-de-nemours-dd-1032044158
540.0,1/28/2023 1:45:26 AM,RBC Capital Sticks to Its Buy Rating for DuPont de Nemours (DD),TipRanks,/news/stocks/rbc-capital-sticks-to-its-buy-rating-for-dupont-de-nemours-dd-1032047808
541.0,2/1/2023 4:00:00 PM,DuPont Honored as a Top Corporation for Women's Business Enterprises,PR Newswire,/news/stocks/dupont-honored-as-a-top-corporation-for-women-s-business-enterprises-1032059427
542.0,2/3/2023 7:30:12 PM,"Catalyst watch: Google talks AI, Nordstrom drama and Canada Goose event",Seeking Alpha,https://seekingalpha.com/news/3931946-catalyst-watch-google-talks-ai-nordstrom-drama-and-canada-goose-event?utm_source=businessinsider&utm_medium=referral
543.0,2/5/2023 1:02:21 AM,Activist investor Starboard said to build stake in Rogers Corp. - report,Seeking Alpha,https://seekingalpha.com/news/3932098-activist-investor-starboard-said-to-build-stake-in-rogers-corp-report?utm_source=businessinsider&utm_medium=referral
544.0,2/6/2023 3:01:13 PM,DuPont de Nemours is about to announce its earnings — here's what Wall Street expects,Markets Insider Automation,/news/stocks/dupont-q4-earnings-preview-1032070466
545.0,2/6/2023 3:09:32 PM,Notable earnings before Tuesday's open,Seeking Alpha,https://seekingalpha.com/news/3932331-notable-earnings-before-tuesdays-open?utm_source=businessinsider&utm_medium=referral
546.0,2/6/2023 10:15:43 PM,"DuPont Q4 earnings on deck, what to expect",Seeking Alpha,https://seekingalpha.com/news/3932619-dupont-q4-earnings-on-deck-what-to-expect?utm_source=businessinsider&utm_medium=referral
547.0,2/7/2023 11:05:17 AM,DuPont reports Q4 earnings beat; initiates Q1 and FY23 guidance,Seeking Alpha,https://seekingalpha.com/news/3932705-dupont-reports-q4-earnings-beat-initiates-q1-and-fy23-guidance?utm_source=businessinsider&utm_medium=referral
548.0,2/7/2023 12:00:00 PM,DuPont Reports Fourth Quarter and Full Year 2022 Results,PR Newswire,/news/stocks/dupont-reports-fourth-quarter-and-full-year-2022-results-1032073343
549.0,2/7/2023 12:05:52 PM,EI DuPont De Nemours & Co. Q4 Income Falls,RTTNews,/news/stocks/ei-dupont-de-nemours-co-q4-income-falls-1032073365
550.0,2/7/2023 12:30:18 PM,DuPont slides on soft guidance; sees lower H1 volumes in semiconductors,Seeking Alpha,https://seekingalpha.com/news/3932763-dupont-slides-on-soft-guidance-sees-lower-h1-volumes-in-semiconductors?utm_source=businessinsider&utm_medium=referral
551.0,2/7/2023 1:30:56 PM,DuPont Q4 Results Miss Estimates; Boosts Dividend 9% ,RTTNews,/news/stocks/dupont-q4-results-miss-estimates-boosts-dividend-9-1032073673
552.0,2/7/2023 4:08:06 PM,DuPont raises dividend by 9% to $0.36,Seeking Alpha,https://seekingalpha.com/news/3932877-dupont-raises-dividend-by-9-to-036?utm_source=businessinsider&utm_medium=referral
553.0,2/8/2023 2:35:09 PM,BMO Capital Sticks to Its Buy Rating for DuPont de Nemours (DD),TipRanks,/news/stocks/bmo-capital-sticks-to-its-buy-rating-for-dupont-de-nemours-dd-1032079005
554.0,2/8/2023 4:27:15 PM,DuPont de Nemours (DD): New Buy Recommendation for This Basic Materials Giant,TipRanks,/news/stocks/dupont-de-nemours-dd-new-buy-recommendation-for-this-basic-materials-giant-1032079341
555.0,2/8/2023 4:30:47 PM,"Analysts Offer Insights on Materials Companies: FMC (FMC), Valvoline (VVV) and DuPont de Nemours (DD)",TipRanks,/news/stocks/analysts-offer-insights-on-materials-companies-fmc-fmc-valvoline-vvv-and-dupont-de-nemours-dd-1032079486
556.0,2/8/2023 6:04:00 PM,Analyst Expectations for DuPont de Nemours's Future,Benzinga,/news/stocks/analyst-expectations-for-dupont-de-nemours-s-future-1032079570
557.0,2/8/2023 6:53:10 PM,AIG ticks higher as Dan Loeb's Third Point reports stake,Seeking Alpha,https://seekingalpha.com/news/3933728-aig-ticks-higher-as-dan-loebs-third-point-reports-stake?utm_source=businessinsider&utm_medium=referral
558.0,2/9/2023 12:10:42 PM,"Analysts Conflicted on These Materials Names: LyondellBasell (LYB), DuPont de Nemours (DD) and Amcor (AMCR)",TipRanks,/news/stocks/analysts-conflicted-on-these-materials-names-lyondellbasell-lyb-dupont-de-nemours-dd-and-amcor-amcr-1032082617
559.0,2/9/2023 4:31:21 PM,Analysts’ Opinions Are Mixed on These Materials Stocks: Pilgrim’s Pride (PPC) and DuPont de Nemours (DD),TipRanks,/news/stocks/analysts-opinions-are-mixed-on-these-materials-stocks-pilgrim-s-pride-ppc-and-dupont-de-nemours-dd-1032083720
560.0,2/11/2023 7:16:32 PM,Materials Sector Weekly Round-up: Corteva tops list; IFF drops to bottom,Seeking Alpha,https://seekingalpha.com/news/3935027-materials-sector-weekly-round-up-corteva-tops-list-iff-drops-to-bottom?utm_source=businessinsider&utm_medium=referral
561.0,2/15/2023 10:15:00 PM,DuPont to Participate at the Barclays Industrial Select Conference,PR Newswire,/news/stocks/dupont-to-participate-at-the-barclays-industrial-select-conference-1032100248
562.0,2/17/2023 8:00:02 PM,"Catalyst watch: Spotlight on retail earnings, Lucid Group, Silvergate Capital and Radware",Seeking Alpha,https://seekingalpha.com/news/3937806-catalyst-watch-spotlight-on-retail-earnings-lucid-group-silvergate-capital-and-radware?utm_source=businessinsider&utm_medium=referral
563.0,2/17/2023 9:46:59 PM,3 Overlooked Industrial Stocks Worth Your Attention,InvestorPlace,/news/stocks/3-overlooked-industrial-stocks-worth-your-attention-1032107039
564.0,3/6/2023 9:17:18 PM,7 Blue-Chip Stocks to Buy for Quality-Focused Investors,InvestorPlace,/news/stocks/7-blue-chip-stocks-to-buy-for-quality-focused-investors-1032148445
565.0,4/3/2023 2:00:00 PM,Corian® Design Announces 2023 Color Launch,PR Newswire,/news/stocks/corian-design-announces-2023-color-launch-1032210489
566.0,4/10/2023 4:25:13 PM,Barclays Remains a Hold on DuPont de Nemours (DD),TipRanks,/news/stocks/barclays-remains-a-hold-on-dupont-de-nemours-dd-1032222412
567.0,4/10/2023 9:00:33 PM,10 Analysts Have This to Say About DuPont de Nemours,Benzinga,/news/stocks/10-analysts-have-this-to-say-about-dupont-de-nemours-1032222560
568.0,4/13/2023 1:45:37 AM,"New Buy Rating for DuPont de Nemours (DD), the Basic Materials Giant",TipRanks,/news/stocks/new-buy-rating-for-dupont-de-nemours-dd-the-basic-materials-giant-1032228614
569.0,4/13/2023 3:00:00 PM,DuPont™ Liveo™ Healthcare Solutions introduces new developments in low-cyclic silicone elastomer blends and silicone resin blends for topical applications,PR Newswire,/news/stocks/dupont-liveo-healthcare-solutions-introduces-new-developments-in-low-cyclic-silicone-elastomer-blends-and-silicone-resin-blends-for-topical-applications-1032230220
570.0,4/14/2023 2:00:00 PM,"DuPont Announces Kevlar® EXO™, a Groundbreaking Next-Generation Aramid Fiber",PR Newswire,/news/stocks/dupont-announces-kevlar-exo-a-groundbreaking-next-generation-aramid-fiber-1032232650
571.0,4/18/2023 10:15:00 PM,DuPont Schedules First Quarter 2023 Earnings Conference Call,PR Newswire,/news/stocks/dupont-schedules-first-quarter-2023-earnings-conference-call-1032241035
572.0,4/19/2023 8:26:08 PM,DuPont declares $0.36 dividend,Seeking Alpha,https://seekingalpha.com/news/3957941-dupont-de-nemours-inc-declares-0_36-dividend?utm_source=businessinsider&utm_medium=referral
573.0,4/19/2023 10:15:00 PM,DuPont Announces Regular Quarterly Dividend on Common Stock,PR Newswire,/news/stocks/dupont-announces-regular-quarterly-dividend-on-common-stock-1032244648
574.0,4/19/2023 11:32:55 PM,7 Low-PE Ratio Blue-Chip Stocks Offering Both Quality and Value,InvestorPlace,/news/stocks/7-low-pe-ratio-blue-chip-stocks-offering-both-quality-and-value-1032244868
575.0,4/20/2023 2:21:34 PM,DuPont says Appaloosa Run Wind Energy Center is operational in Texas,Seeking Alpha,https://seekingalpha.com/news/3958288-dupont-says-appaloosa-run-wind-energy-center-is-operational-in-texas?utm_source=businessinsider&utm_medium=referral
576.0,4/20/2023 3:00:00 PM,DuPont to Source Renewable Energy Through Wind Energy Center in Texas,PR Newswire,/news/stocks/dupont-to-source-renewable-energy-through-wind-energy-center-in-texas-1032247000
577.0,4/21/2023 3:00:00 PM,DuPont Wins Three 2023 Edison Awards™,PR Newswire,/news/stocks/dupont-wins-three-2023-edison-awards-1032249950
578.0,4/24/2023 3:03:00 PM,DuPont Strengthens Science-based Climate Goals and Receives Target Validation from SBTi,PR Newswire,/news/stocks/dupont-strengthens-science-based-climate-goals-and-receives-target-validation-from-sbti-1032254326
579.0,4/28/2023 5:30:26 PM,"Earnings Week Ahead: Apple, Ford, Starbucks, Anheuser Busch, and more",Seeking Alpha,https://seekingalpha.com/news/3962032-earnings-week-ahead-apple-ford-starbucks-anheuser-busch-and-more?utm_source=businessinsider&utm_medium=referral
580.0,5/1/2023 2:00:00 PM,DuPont Publishes 2023 Sustainability Report,PR Newswire,/news/stocks/dupont-publishes-2023-sustainability-report-1032277857
581.0,5/1/2023 3:01:13 PM,DuPont de Nemours earnings: here's what Wall Street expects,Markets Insider Automation,/news/stocks/dupont-quarter-earnings-preview-q1-1032278141
582.0,5/1/2023 4:56:08 PM,Can DuPont Q1 results maintain earnings beat run?,Seeking Alpha,https://seekingalpha.com/news/3962730-can-dupont-q1-results-maintain-earnings-beat-run?utm_source=businessinsider&utm_medium=referral
583.0,5/2/2023 10:05:58 AM,DuPont beats Q1 top and bottom line estimates; initiates Q2 and updates FY23 outlook,Seeking Alpha,https://seekingalpha.com/news/3963157-dupont-beats-q1-top-and-bottom-line-estimates-initiates-q2-and-updates-fy23-outlook?utm_source=businessinsider&utm_medium=referral
584.0,5/2/2023 10:22:56 AM,DuPont to buy Spectrum Plastics in $1.75B deal,Seeking Alpha,https://seekingalpha.com/news/3963163-dupont-to-buy-spectrum-plastics-in-175b-deal?utm_source=businessinsider&utm_medium=referral
585.0,5/2/2023 12:00:00 PM,DuPont to Acquire Spectrum Plastics Group from AEA Investors,PR Newswire,/news/stocks/dupont-to-acquire-spectrum-plastics-group-from-aea-investors-1032281422
586.0,5/2/2023 12:01:00 PM,DuPont Reports First Quarter 2023 Results,PR Newswire,/news/stocks/dupont-reports-first-quarter-2023-results-1032281432
587.0,5/2/2023 12:07:54 PM,EI DuPont De Nemours & Co. Reports Fall In Q1 Income,RTTNews,/news/stocks/ei-dupont-de-nemours-co-reports-fall-in-q1-income-1032281454
588.0,5/2/2023 12:33:30 PM,"DuPont Q1 Profit Down, Cuts FY23 View; To Buy Spectrum Plastics; Stock Down In Premarket ",RTTNews,/news/stocks/dupont-q1-profit-down-cuts-fy23-view-to-buy-spectrum-plastics-stock-down-in-premarket-1032281518
589.0,5/2/2023 5:17:32 PM,"Hot Stocks: NXPI, TAP, MSTR rise on earnings; DELL soar on upgrade; DD, ANET, BP fall on earnings; BB gain",Seeking Alpha,https://seekingalpha.com/news/3963587-hot-stocks-nxpi-tap-mstr-rise-on-earnings-dell-soar-on-upgrade-dd-anet-bp-fall-on-earnings-bb-gain?utm_source=businessinsider&utm_medium=referral
590.0,5/3/2023 8:25:05 AM,Barclays Sticks to Their Hold Rating for DuPont de Nemours (DD),TipRanks,/news/stocks/barclays-sticks-to-their-hold-rating-for-dupont-de-nemours-dd-1032286500
591.0,5/3/2023 11:20:08 AM,"Analysts Are Bullish on These Materials Stocks: CF Holdings (CF), OceanaGold (OCANF)",TipRanks,/news/stocks/analysts-are-bullish-on-these-materials-stocks-cf-holdings-cf-oceanagold-ocanf-1032287095
592.0,5/4/2023 4:25:39 PM,Morgan Stanley Remains a Hold on DuPont de Nemours (DD),TipRanks,/news/stocks/morgan-stanley-remains-a-hold-on-dupont-de-nemours-dd-1032293656
593.0,5/15/2023 1:53:47 PM,Salesforce To Rally Over 21%? Here Are 10 Other Analyst Forecasts For Monday,Benzinga,/news/stocks/salesforce-to-rally-over-21-here-are-10-other-analyst-forecasts-for-monday-1032327150
594.0,5/15/2023 3:00:00 PM,DuPont Water Solutions Named 2023 Water Technology Company of the Year,PR Newswire,/news/stocks/dupont-water-solutions-named-2023-water-technology-company-of-the-year-1032327482
595.0,5/15/2023 4:02:13 PM,9 Analysts Have This to Say About DuPont de Nemours,Benzinga,/news/stocks/9-analysts-have-this-to-say-about-dupont-de-nemours-1032327758
596.0,5/15/2023 4:15:19 PM,"Hot Stocks: DD rise on upgrade; GOOG, SOFI fall on downgrade; SRPT and SHAK gain",Seeking Alpha,https://seekingalpha.com/news/3971481-hot-stocks-dd-rise-on-upgrade-goog-sofi-fall-on-downgrade-srpt-and-shak-gain?utm_source=businessinsider&utm_medium=referral
597.0,5/15/2023 5:00:25 PM,"Benzinga's Top Ratings Upgrades, Downgrades For May 15, 2023",Benzinga,/news/stocks/benzinga-s-top-ratings-upgrades-downgrades-for-may-15-2023-1032327919
598.0,5/15/2023 9:50:48 PM,"Daniel Loeb's Third Point amasses new stakes in Alphabet, Micron, AMD, Alibaba",Seeking Alpha,https://seekingalpha.com/news/3971801-daniel-loebs-third-point-amasses-new-stakes-in-alphabet-micron-amd-alibaba?utm_source=businessinsider&utm_medium=referral
599.0,5/17/2023 3:00:00 PM,DuPont Earns Great Place to Work Certification™,PR Newswire,/news/stocks/dupont-earns-great-place-to-work-certification-1032334973
600.0,5/18/2023 3:00:00 PM,DuPont Wins Edie Award for Sustainability Benefits of Closed Circuit Reverse Osmosis Technology,PR Newswire,/news/stocks/dupont-wins-edie-award-for-sustainability-benefits-of-closed-circuit-reverse-osmosis-technology-1032337540
601.0,5/23/2023 8:00:00 AM,DuPont™ Kapton® MT+ based Slot Liner Solution Improves Thermal Management and Efficiency in High-Voltage E-Motors,PR Newswire,/news/stocks/dupont-kapton-mt-based-slot-liner-solution-improves-thermal-management-and-efficiency-in-high-voltage-e-motors-1032344308
602.0,5/23/2023 3:00:00 PM,DuPont Wallcovering by Wallquest Inc. Generates Buzz at Hospitality & Design Expo in Las Vegas,PR Newswire,/news/stocks/dupont-wallcovering-by-wallquest-inc-generates-buzz-at-hospitality-design-expo-in-las-vegas-1032345437
603.0,5/24/2023 3:00:00 PM,DuPont to Launch Tedlar® Frontsheet Solution at 2023 SNEC PV Power Expo,PR Newswire,/news/stocks/dupont-to-launch-tedlar-frontsheet-solution-at-2023-snec-pv-power-expo-1032348564
604.0,5/25/2023 3:00:00 PM,DuPont STEM Career Catalyst Program Achieves Milestone in Education Partnership,PR Newswire,/news/stocks/dupont-stem-career-catalyst-program-achieves-milestone-in-education-partnership-1032351708
605.0,5/30/2023 3:00:00 PM,DuPont Introduces SOLDERON™ BP TS 7000 Chemistry as Newest Addition to the Tin-Silver Plating Bath Family,PR Newswire,/news/stocks/dupont-introduces-solderon-bp-ts-7000-chemistry-as-newest-addition-to-the-tin-silver-plating-bath-family-1032358343
606.0,5/31/2023 4:00:00 PM,DuPont Performance Building Solutions & Corian® Design Highlight 41% Reduction in GHG Emissions,PR Newswire,/news/stocks/dupont-performance-building-solutions-corian-design-highlight-41-reduction-in-ghg-emissions-1032361265
607.0,5/31/2023 4:00:00 PM,DuPont Unveils Cutting-Edge Sealing Solutions for Oil & Gas Industry at CIPPE 2023,PR Newswire,/news/stocks/dupont-unveils-cutting-edge-sealing-solutions-for-oil-gas-industry-at-cippe-2023-1032361264
608.0,6/2/2023 1:17:53 PM,"Chemours, DuPont, And Corteva Settle With US Water Systems For $1.185 Billion ",RTTNews,/news/stocks/chemours-dupont-and-corteva-settle-with-us-water-systems-for-1-185-billion-1032366965
609.0,6/2/2023 1:37:43 PM,"Trian Fund co-founder Ed Garden set to exit firm, to leave Janus Henderson board",Seeking Alpha,https://seekingalpha.com/news/3977110-trian-fund-co-founder-ed-garden-set-to-exit-firm-to-leave-janus-henderson-board?utm_source=businessinsider&utm_medium=referral
610.0,6/2/2023 4:11:46 PM,"Hot Stocks: ZS rises on earnings; S down on analyst downgrade; DD, CC, CTVA and TSLA gain",Seeking Alpha,https://seekingalpha.com/news/3977176-hot-stocks-zs-rises-on-earnings-s-down-on-analyst-downgrade-dd-cc-ctva-and-tsla-gain?utm_source=businessinsider&utm_medium=referral
611.0,6/2/2023 7:15:06 PM,"New Buy Rating for DuPont de Nemours (DD), the Basic Materials Giant",TipRanks,/news/stocks/new-buy-rating-for-dupont-de-nemours-dd-the-basic-materials-giant-1032368183
612.0,6/6/2023 4:00:00 PM,DuPont Introduces Novel Metallization and Finishing Solutions at SUR/FIN Show,PR Newswire,/news/stocks/dupont-introduces-novel-metallization-and-finishing-solutions-at-sur-fin-show-1032373285
613.0,6/8/2023 3:00:00 PM,DuPont Performance Building Solutions Receives 2023 American Chemistry Council (ACC) Sustainability Leadership Award,PR Newswire,/news/stocks/dupont-performance-building-solutions-receives-2023-american-chemistry-council-acc-sustainability-leadership-award-1032378471
614.0,6/14/2023 4:01:44 PM,Analyst Expectations for DuPont de Nemours's Future,Benzinga,/news/stocks/analyst-expectations-for-dupont-de-nemours-s-future-1032389251
615.0,6/14/2023 5:01:58 PM,"Benzinga's Top Ratings Upgrades, Downgrades For June 14, 2023",Benzinga,/news/stocks/benzinga-s-top-ratings-upgrades-downgrades-for-june-14-2023-1032389437
