Unnamed: 0,datetime,title,source,link
238.0,11/1/2023 8:40:05 PM,"Analysts Are Bullish on These Technology Stocks: Sportradar Group AG (SRAD), Zebra Tech (ZBRA)",TipRanks,/news/stocks/analysts-are-bullish-on-these-technology-stocks-sportradar-group-ag-srad-zebra-tech-zbra-1032769083
239.0,11/2/2023 5:50:33 AM,"Analysts Offer Insights on Technology Companies: Check Point (CHKP), SoFi Technologies (SOFI) and Zebra Tech (ZBRA)",TipRanks,/news/stocks/analysts-offer-insights-on-technology-companies-check-point-chkp-sofi-technologies-sofi-and-zebra-tech-zbra-1032771808
240.0,11/22/2023 1:42:35 PM,Tech’s Best Kept Secrets: 7 Under-the-Radar Stocks to Watch,InvestorPlace,/news/stocks/techs-best-kept-secrets-7-under-the-radar-stocks-to-watch-1032842770
241.0,11/30/2023 1:39:46 PM,Robotics Stocks: Bot is Man’s Best Friend,TipRanks,/news/stocks/robotics-stocks-bot-is-man-s-best-friend-1032864748
242.0,12/8/2023 10:50:35 AM,Analysts Offer Insights on Technology Companies: Zebra Tech (ZBRA) and DocuSign (DOCU),TipRanks,/news/stocks/analysts-offer-insights-on-technology-companies-zebra-tech-zbra-and-docusign-docu-1032886949
243.0,12/14/2023 11:00:00 AM,3 AI and Robotics Stocks Reshaping the Future of Tech,InvestorPlace,/news/stocks/3-ai-and-robotics-stocks-reshaping-the-future-of-tech-1032900417
244.0,12/21/2023 2:14:14 AM,Rate Cut Riches: 3 Stocks to Buy Now for Massive Gains Post-Interest Drop,InvestorPlace,/news/stocks/rate-cut-riches-3-stocks-to-buy-now-for-massive-gains-post-interest-drop-1032917768
245.0,12/28/2023 4:31:26 PM,The 5G Future: 3 Stocks Leading the Next Communication Revolution,InvestorPlace,/news/stocks/the-5g-future-3-stocks-leading-the-next-communication-revolution-1032930657
246.0,1/4/2024 6:47:25 PM,3 Stealth AI Stocks to Ride 2024’s Biggest Trend to Riches,InvestorPlace,/news/stocks/3-stealth-ai-stocks-to-ride-2024s-biggest-trend-to-riches-1032944255
247.0,1/12/2024 11:30:27 AM,"Analysts Offer Insights on Technology Companies: Zebra Tech (ZBRA), Marvell (MRVL) and Cognizant (CTSH)",TipRanks,/news/stocks/analysts-offer-insights-on-technology-companies-zebra-tech-zbra-marvell-mrvl-and-cognizant-ctsh-1032963935
248.0,1/20/2024 2:00:00 PM,Stocks most at risk if the Fed reasserts higher-for-longer - JPM,Seeking Alpha,https://seekingalpha.com/news/4056500-stocks-most-at-risk-if-the-fed-reasserts-higher-for-longer-jpm?utm_source=businessinsider&utm_medium=referral&feed_item_type=news
249.0,1/22/2024 8:50:19 PM,"Analysts Offer Insights on Technology Companies: Freshworks (FRSH), Zebra Tech (ZBRA) and Beam Global (BEEM)",TipRanks,/news/stocks/analysts-offer-insights-on-technology-companies-freshworks-frsh-zebra-tech-zbra-and-beam-global-beem-1032987229
250.0,2/1/2024 1:44:58 AM,3 Robotics Stocks With 250% Growth Potential by 2025,InvestorPlace,/news/stocks/3-robotics-stocks-with-250-growth-potential-by-2025-1033017425
251.0,2/13/2024 11:40:13 AM,"Analysts’ Top Technology Picks: Lattice Semiconductor (LSCC), Nvidia (NVDA)",TipRanks,/news/stocks/analysts-top-technology-picks-lattice-semiconductor-lscc-nvidia-nvda-1033061541
252.0,2/14/2024 3:01:13 PM,Here's what Wall Street expects from Zebra Technologies's earnings,Markets Insider Automation,/news/stocks/zebra_technologies-quarter-earnings-preview-q4-1033066575
253.0,2/14/2024 3:51:47 PM,Zebra Technologies Q4 2023 Earnings Preview,Seeking Alpha,https://seekingalpha.com/news/4066845-zebra-technologies-q4-2023-earnings-preview?utm_source=businessinsider&utm_medium=referral&feed_item_type=news
254.0,2/15/2024 11:32:12 AM,"Zebra Technologies Non-GAAP EPS of $1.71 beats by $0.07, revenue of $1B in-line",Seeking Alpha,https://seekingalpha.com/news/4067461-zebra-technologies-non-gaap-eps-of-1_71-beats-0_07-revenue-of-1b-in-line?utm_source=businessinsider&utm_medium=referral&feed_item_type=news
255.0,2/15/2024 1:23:49 PM,"Zebra Technologies Corporation Q4 Profit Decreases, but beats estimates",RTTNews,/news/stocks/zebra-technologies-corporation-q4-profit-decreases-but-beats-estimates-1033071285
256.0,2/15/2024 2:28:41 PM,Zebra Technologies Guides Q1 Well Above View As Q4 Results Top Estimates ,RTTNews,/news/stocks/zebra-technologies-guides-q1-well-above-view-as-q4-results-top-estimates-1033071563
257.0,2/15/2024 4:23:42 PM,"Reliance Steel & Aluminum Posts Upbeat Earnings, Joins JFrog, AppLovin, Shake Shack And Other Big Stocks Moving Higher On Thursday",Benzinga,/news/stocks/reliance-steel-aluminum-posts-upbeat-earnings-joins-jfrog-applovin-shake-shack-and-other-big-stocks-moving-higher-on-thursday-1033072525
258.0,2/15/2024 7:20:19 PM,Why Herbalife Shares Are Trading Lower By Around 36%? Here Are Other Stocks Moving In Thursday's Mid-Day Session,Benzinga,/news/stocks/why-herbalife-shares-are-trading-lower-by-around-36-here-are-other-stocks-moving-in-thursday-s-mid-day-session-1033073196
259.0,2/15/2024 8:12:45 PM,"S&P Reclaims 5,000 As Disappointing Retail Sales Put Fed Cuts Back On Track, Small Caps Shine: What's Driving Markets Thursday?",Benzinga,/news/stocks/s-p-reclaims-5-000-as-disappointing-retail-sales-put-fed-cuts-back-on-track-small-caps-shine-what-s-driving-markets-thursday-1033073272
260.0,2/16/2024 3:30:17 AM,Analysts Offer Insights on Technology Companies: Zebra Tech (ZBRA) and Globant SA (GLOB),TipRanks,/news/stocks/analysts-offer-insights-on-technology-companies-zebra-tech-zbra-and-globant-sa-glob-1033074567
261.0,2/16/2024 8:36:35 AM,KeyBanc Sticks to Their Hold Rating for Zebra Tech (ZBRA),TipRanks,/news/stocks/keybanc-sticks-to-their-hold-rating-for-zebra-tech-zbra-1033075457
262.0,2/16/2024 4:23:02 PM,The 3 Best Robotics Stocks to Buy in February 2024,InvestorPlace,/news/stocks/the-3-best-robotics-stocks-to-buy-in-february-2024-1033076842
263.0,3/14/2024 11:40:54 AM,"Analysts Offer Insights on Technology Companies: Zebra Tech (ZBRA), Wix (WIX) and Trimble (TRMB)",TipRanks,/news/stocks/analysts-offer-insights-on-technology-companies-zebra-tech-zbra-wix-wix-and-trimble-trmb-1033164428
264.0,3/25/2024 10:00:00 AM,Wall Street’s Favorite Robotics Stocks? 3 Names That Could Make You Filthy Rich,InvestorPlace,/news/stocks/wall-streets-favorite-robotics-stocks-3-names-that-could-make-you-filthy-rich-1033192425
265.0,4/2/2024 7:42:52 AM,"Analysts Offer Insights on Technology Companies: Taiwan Semiconductor Manufacturing (TSM), Autodesk (ADSK) and Zebra Tech (ZBRA)",TipRanks,/news/stocks/analysts-offer-insights-on-technology-companies-taiwan-semiconductor-manufacturing-tsm-autodesk-adsk-and-zebra-tech-zbra-1033214267
266.0,4/2/2024 4:42:20 PM,3 Retail Stocks Taking a Surpringly Big Hit From Self-Checkout Theft,InvestorPlace,/news/stocks/3-retail-stocks-taking-a-surpringly-big-hit-from-self-checkout-theft-1033216251
267.0,4/16/2024 4:54:14 PM,Ground Floor Investing: 3 Stocks to Snag Before At-Home Robots Go Mainstream,InvestorPlace,/news/stocks/ground-floor-investing-3-stocks-to-snag-before-at-home-robots-go-mainstream-1033254578
268.0,4/23/2024 4:57:00 PM,3 Robotics Stocks to Buy Now: Q2 Edition,InvestorPlace,/news/stocks/3-robotics-stocks-to-buy-now-q2-edition-1033270512
269.0,4/29/2024 3:01:13 PM,Here's what Wall Street expects from Zebra Technologies's earnings,Markets Insider Automation,/news/stocks/zebra_technologies-stock-price-q1-earnings-preview-1033300230
270.0,4/29/2024 4:49:35 PM,Zebra Technologies Q1 2024 Earnings Preview,Seeking Alpha,https://seekingalpha.com/news/4095696-zebra-technologies-q1-2024-earnings-preview?utm_source=businessinsider&utm_medium=referral&feed_item_type=news
271.0,4/30/2024 10:36:08 AM,Zebra Technologies beats top-line and bottom-line estimates; initiates Q2 and raises FY24 outlook,Seeking Alpha,https://seekingalpha.com/news/4096054-zebra-technologies-beats-top-line-and-bottom-line-estimates-initiates-q2-and-raises-fy24-outlook?utm_source=businessinsider&utm_medium=referral&feed_item_type=news
272.0,4/30/2024 12:47:22 PM,"Zebra Technologies Corporation Q1 Profit Decreases, but beats estimates",RTTNews,/news/stocks/zebra-technologies-corporation-q1-profit-decreases-but-beats-estimates-1033305282
273.0,4/30/2024 2:53:22 PM,"ZBRA Stock Earnings: Zebra Technologies Beats EPS, Beats Revenue for Q1 2024",InvestorPlace,/news/stocks/zbra-stock-earnings-zebra-technologies-for-q1-of-2024-1033307495
274.0,5/1/2024 6:46:11 AM,Zebra Tech (ZBRA) Gets a Hold from KeyBanc,TipRanks,/news/stocks/zebra-tech-zbra-gets-a-hold-from-keybanc-1033312159
275.0,5/1/2024 7:51:53 AM,"Analysts Conflicted on These Technology Names: Advanced Micro Devices (AMD), Zebra Tech (ZBRA) and Super Micro Computer (SMCI)",TipRanks,/news/stocks/analysts-conflicted-on-these-technology-names-advanced-micro-devices-amd-zebra-tech-zbra-and-super-micro-computer-smci-1033312335
276.0,5/1/2024 10:17:16 AM,Analysts’ Opinions Are Mixed on These Technology Stocks: Skyworks Solutions (SWKS) and Zebra Tech (ZBRA),TipRanks,/news/stocks/analysts-opinions-are-mixed-on-these-technology-stocks-skyworks-solutions-swks-and-zebra-tech-zbra-1033313522
277.0,5/1/2024 11:21:16 AM,"Analysts Offer Insights on Technology Companies: Five9 (FIVN), Zebra Tech (ZBRA) and Leidos Holdings (LDOS)",TipRanks,/news/stocks/analysts-offer-insights-on-technology-companies-five9-fivn-zebra-tech-zbra-and-leidos-holdings-ldos-1033314120
278.0,5/1/2024 9:00:30 PM,Peeling Back The Layers: Exploring Zebra Technologies Through Analyst Insights,Benzinga,/news/stocks/peeling-back-the-layers-exploring-zebra-technologies-through-analyst-insights-1033315163
279.0,5/4/2024 2:00:00 PM,Shhh! 3 Secret Robotics Stocks Flying Below Wall Street’s Radar,InvestorPlace,/news/stocks/shhh-3-secret-robotics-stocks-flying-below-wall-streets-radar-1033328785
280.0,5/10/2024 8:26:09 PM,The 3 Best Robotics Stocks to Buy in May 2024,InvestorPlace,/news/stocks/the-3-best-robotics-stocks-to-buy-in-may-2024-1033364881
281.0,5/15/2024 10:25:16 AM,Zebra Tech Sell Rating: Caution Amid Competitive Challenges and Economic Uncertainty,TipRanks,/news/stocks/zebra-tech-sell-rating-caution-amid-competitive-challenges-and-economic-uncertainty-1033384450
282.0,5/16/2024 11:20:23 AM,Analysts Offer Insights on Technology Companies: Zebra Tech (ZBRA) and Uber Technologies (UBER),TipRanks,/news/stocks/analysts-offer-insights-on-technology-companies-zebra-tech-zbra-and-uber-technologies-uber-1033393711
283.0,5/16/2024 11:36:30 AM,Truist Financial Reaffirms Their Hold Rating on Zebra Tech (ZBRA),TipRanks,/news/stocks/truist-financial-reaffirms-their-hold-rating-on-zebra-tech-zbra-1033393834
284.0,5/23/2024 9:41:48 PM,Zebra Prices $500M Senior Notes in Private Offering,Benzinga,/news/stocks/zebra-prices-500m-senior-notes-in-private-offering-1033417334
285.0,6/5/2024 5:01:46 PM,7 Robotics & Automation Stocks to Own Before They Transform Industries,InvestorPlace,/news/stocks/7-robotics-automation-stocks-to-own-before-they-transform-industries-1033454934
286.0,6/7/2024 9:44:02 PM,Is AZZ Stock Outpacing Its Industrial Products Peers This Year?,Benzinga,/news/stocks/is-azz-stock-outpacing-its-industrial-products-peers-this-year-1033462434
287.0,6/11/2024 7:03:12 PM,"SiteOne Landscape Buys Cohen & Cohen, Expands in Canada",Benzinga,/news/stocks/siteone-landscape-buys-cohen-cohen-expands-in-canada-1033470099
288.0,6/13/2024 5:00:44 PM,10 Analysts Have This To Say About Zebra Technologies,Benzinga,/news/stocks/10-analysts-have-this-to-say-about-zebra-technologies-1033476874
289.0,6/14/2024 5:56:13 PM,The 7 Best Robotics Stocks to Buy in June 2024,InvestorPlace,/news/stocks/the-7-best-robotics-stocks-to-buy-in-june-2024-1033480878
290.0,6/29/2024 10:58:00 AM,3 Riveting Robotics Stocks to Rely On for Rich Returns,InvestorPlace,/news/stocks/3-riveting-robotics-stocks-to-rely-on-for-rich-returns-1033516838
291.0,7/15/2024 10:00:00 AM,3 Robotics Stocks to Buy as Musk Teases Tesla Bot,InvestorPlace,/news/stocks/3-robotics-stocks-to-buy-as-musk-teases-tesla-bot-1033554707
292.0,7/29/2024 10:49:02 AM,Balancing Growth and Risks: Hold Rating on Zebra Tech Amidst Operational and Market Uncertainties,TipRanks,/news/stocks/balancing-growth-and-risks-hold-rating-on-zebra-tech-amidst-operational-and-market-uncertainties-1033606493
293.0,7/29/2024 3:01:13 PM,Zebra Technologies earnings: here's what Wall Street expects,Markets Insider Automation,/news/stocks/zebra_technologies-stock-price-q2-earnings-preview-1033606152
294.0,7/29/2024 3:04:21 PM,Notable earnings before Tuesday's open,Seeking Alpha,https://seekingalpha.com/news/4129508-notable-earnings-before-tuesdays-open?utm_source=businessinsider&utm_medium=referral&feed_item_type=news
295.0,7/29/2024 5:09:29 PM,Zebra Technologies Q2 2024 Earnings Preview,Seeking Alpha,https://seekingalpha.com/news/4129610-zebra-technologies-q2-2024-earnings-preview?utm_source=businessinsider&utm_medium=referral&feed_item_type=news
296.0,7/30/2024 10:32:57 AM,"Zebra Technologies Non-GAAP EPS of $3.18 beats by $0.37, revenue of $1.22B beats by $40M",Seeking Alpha,https://seekingalpha.com/news/4129950-zebra-technologies-non-gaap-eps-of-3_18-beats-0_37-revenue-of-1_22b-beats-40m?utm_source=businessinsider&utm_medium=referral&feed_item_type=news
297.0,7/30/2024 1:07:59 PM,Zebra Technologies Q2 Results Beat Estimates; Ups Annual Outlook Above View ,RTTNews,/news/stocks/zebra-technologies-q2-results-beat-estimates-ups-annual-outlook-above-view-1033611109
298.0,7/30/2024 2:45:00 PM,Zebra Techn. hosts conference call for investors,Markets Insider Automation,/news/stocks/zebra_technologies_conference-1033240909
299.0,7/30/2024 2:53:30 PM,"Zebra Technologies Rises In Pre-market On Better-than-expected Q2 Results, Raised Outlook ",RTTNews,/news/stocks/zebra-technologies-rises-in-pre-market-on-better-than-expected-q2-results-raised-outlook-1033611671
300.0,7/30/2024 2:53:41 PM,"ZBRA Stock Earnings: Zebra Technologies Beats EPS, Beats Revenue for Q2 2024",InvestorPlace,/news/stocks/zbra-stock-earnings-zebra-technologies-for-q2-of-2024-1033613044
301.0,7/31/2024 7:06:19 AM,Zebra Tech (ZBRA) Receives a Hold from KeyBanc,TipRanks,/news/stocks/zebra-tech-zbra-receives-a-hold-from-keybanc-1033616994
302.0,7/31/2024 10:28:42 AM,Buy Rating Affirmed for Zebra Tech Amidst Strong Revenue Acceleration and Positive Financial Outlook,TipRanks,/news/stocks/buy-rating-affirmed-for-zebra-tech-amidst-strong-revenue-acceleration-and-positive-financial-outlook-1033618580
303.0,7/31/2024 11:05:29 AM,Buy Rating Affirmed: Zebra Tech’s Strong Q2 Performance and Positive Outlook Drive Analyst Confidence,TipRanks,/news/stocks/buy-rating-affirmed-zebra-tech-s-strong-q2-performance-and-positive-outlook-drive-analyst-confidence-1033619081
304.0,7/31/2024 11:37:21 AM,Zebra Tech (ZBRA) Receives a Hold from Truist Financial,TipRanks,/news/stocks/zebra-tech-zbra-receives-a-hold-from-truist-financial-1033619231
305.0,7/31/2024 12:29:58 PM,Morgan Stanley Sticks to Their Sell Rating for Zebra Tech (ZBRA),TipRanks,/news/stocks/morgan-stanley-sticks-to-their-sell-rating-for-zebra-tech-zbra-1033619581
306.0,8/14/2024 8:30:00 PM,3 Robotics Stocks to Sell in August Before They Crash & Burn,InvestorPlace,/news/stocks/3-robotics-stocks-to-sell-in-august-before-they-crash-burn-1033690023
307.0,9/4/2024 11:36:01 AM,Zebra Tech (ZBRA) Gets a Buy from TD Cowen,TipRanks,/news/stocks/zebra-tech-zbra-gets-a-buy-from-td-cowen-1033748016
308.0,9/29/2024 4:28:46 PM,Stocks with the highest consensus of expected ROE growth - Goldman Sachs,Seeking Alpha,https://seekingalpha.com/news/4154349-stocks-with-the-highest-consensus-of-expected-roe-growth-goldman-sachs-says?utm_source=businessinsider&utm_medium=referral&feed_item_type=news
309.0,10/25/2024 10:27:47 AM,Cautious Outlook for Zebra Technologies Amid Overvaluation and Slow Recovery Prospects,TipRanks,/news/stocks/cautious-outlook-for-zebra-technologies-amid-overvaluation-and-slow-recovery-prospects-1033892899
310.0,10/28/2024 5:39:08 PM,Zebra Technologies Q3 2024 Earnings Preview,Seeking Alpha,https://seekingalpha.com/news/4214954-zebra-technologies-q3-2024-earnings-preview?utm_source=businessinsider&utm_medium=referral&feed_item_type=news
311.0,10/28/2024 10:00:33 PM,Here's the major earnings before the open tomorrow,Seeking Alpha,https://seekingalpha.com/news/4215158-heres-the-major-earnings-before-the-open-tomorrow?utm_source=businessinsider&utm_medium=referral&feed_item_type=news
312.0,10/29/2024 10:33:37 AM,"Zebra Technologies beats Q3 estimates, raises outlook",Seeking Alpha,https://seekingalpha.com/news/4217335-zebra-technologies-beats-q3-estimates-raises-outlook?utm_source=businessinsider&utm_medium=referral&feed_item_type=news
313.0,10/29/2024 10:42:11 AM,"Zebra Technologies sees Q4 non-GAAP EPS $3.80-$4.00, consensus $3.54",TipRanks,/news/stocks/zebra-technologies-sees-q4-non-gaap-eps-3-80--4-00-consensus-3-54-1033909220
314.0,10/29/2024 12:27:09 PM,Zebra Technologies Corporation Q3 Earnings Summary ,RTTNews,/news/stocks/zebra-technologies-corporation-q3-earnings-summary-1033908290
315.0,10/29/2024 11:55:10 PM,Optimistic Outlook: Buy Rating Backed by Strong FY2025 Projections and Potential COVID Demand Revival,TipRanks,/news/stocks/optimistic-outlook-buy-rating-backed-by-strong-fy2025-projections-and-potential-covid-demand-revival-1033912741
316.0,10/30/2024 9:20:03 AM,Zebra Technologies Reports Strong Q3 2024 Growth,TipRanks,/news/stocks/zebra-technologies-reports-strong-q3-2024-growth-1033917056
317.0,10/30/2024 10:06:20 AM,Cautious ‘Sell’ Rating on Zebra Technologies Amidst Recovery and Valuation Concerns,TipRanks,/news/stocks/cautious-sell-rating-on-zebra-technologies-amidst-recovery-and-valuation-concerns-1033917526
318.0,10/30/2024 10:37:06 AM,Zebra Technologies: Strong Q3 Performance and Positive Outlook Reaffirms Buy Rating,TipRanks,/news/stocks/zebra-technologies-strong-q3-performance-and-positive-outlook-reaffirms-buy-rating-1033917829
319.0,10/30/2024 11:08:07 AM,Zebra Technologies price target raised to $415 from $380 at Baird,TipRanks,/news/stocks/zebra-technologies-price-target-raised-to-415-from-380-at-baird-1033918125
320.0,10/30/2024 11:09:20 AM,Truist Financial Sticks to Their Hold Rating for Zebra Tech (ZBRA),TipRanks,/news/stocks/truist-financial-sticks-to-their-hold-rating-for-zebra-tech-zbra-1033918108
321.0,10/30/2024 11:38:50 AM,Zebra Technologies price target raised to $425 from $380 at TD Cowen,TipRanks,/news/stocks/zebra-technologies-price-target-raised-to-425-from-380-at-td-cowen-1033918382
322.0,10/30/2024 1:20:13 PM,Zebra Technologies price target raised to $305 from $290 at Morgan Stanley,TipRanks,/news/stocks/zebra-technologies-price-target-raised-to-305-from-290-at-morgan-stanley-1033919638
323.0,10/31/2024 6:02:03 AM,Zebra Technologies’ Financial Vulnerability: The Critical Need for IT System Stability,TipRanks,/news/stocks/zebra-technologies-financial-vulnerability-the-critical-need-for-it-system-stability-1033926090
324.0,10/31/2024 8:50:04 AM,Zebra Tech (ZBRA) Gets a Hold from Barclays,TipRanks,/news/stocks/zebra-tech-zbra-gets-a-hold-from-barclays-1033927380
325.0,10/31/2024 8:50:52 AM,Analysts Offer Insights on Technology Companies: nCino (NCNO) and Zebra Tech (ZBRA),TipRanks,/news/stocks/analysts-offer-insights-on-technology-companies-ncino-ncno-and-zebra-tech-zbra-1033927362
326.0,10/31/2024 11:35:23 AM,Zebra Technologies price target raised to $407 from $347 at Barclays,TipRanks,/news/stocks/zebra-technologies-price-target-raised-to-407-from-347-at-barclays-1033928986
327.0,12/2/2024 10:05:31 AM,Cautious Optimism for Zebra Technologies Amid Improved Demand Trends and Mitigated Risks,TipRanks,/news/stocks/cautious-optimism-for-zebra-technologies-amid-improved-demand-trends-and-mitigated-risks-1034085675
328.0,12/2/2024 10:10:28 AM,Zebra Technologies upgraded to Equal Weight from Underweight at Morgan Stanley,TipRanks,/news/stocks/zebra-technologies-upgraded-to-equal-weight-from-underweight-at-morgan-stanley-1034085667
,12/17/2024 1:25:56 PM,Zebra Technologies price target raised to $427 from $400 at Morgan Stanley,TipRanks,/news/stocks/zebra-technologies-price-target-raised-to-427-from-400-at-morgan-stanley-1034146884
,12/17/2024 1:37:38 PM,Morgan Stanley Remains a Hold on Zebra Tech (ZBRA),TipRanks,/news/stocks/morgan-stanley-remains-a-hold-on-zebra-tech-zbra-1034147001
,12/19/2024 2:11:52 PM,Zebra Technologies price target raised to $408 from $383 at Truist,TipRanks,/news/stocks/zebra-technologies-price-target-raised-to-408-from-383-at-truist-1034157614
,12/30/2024 1:06:37 PM,Zebra Technologies to acquire Photoneo for undisclosed amount,Seeking Alpha,https://seekingalpha.com/news/4391383-zebra-technologies-to-acquire-photoneo-for-undisclosed-amount?utm_source=businessinsider&utm_medium=referral&feed_item_type=news
,12/30/2024 1:10:14 PM,Zebra to acquire 3D machine firm Photoneo with ‘cash on hand’ in accretive deal,TipRanks,/news/stocks/zebra-to-acquire-3d-machine-firm-photoneo-with-cash-on-hand-in-accretive-deal-1034180233
,12/30/2024 3:08:21 PM,Zebra Technologies To Buy Photoneo For Undisclosed Sum ,RTTNews,/news/stocks/zebra-technologies-to-buy-photoneo-for-undisclosed-sum-1034179488
,12/31/2024 8:18:44 AM,Zebra To Acquire Photoneo; Aims To Expand 3D Machine Vision Solutions ,RTTNews,/news/stocks/zebra-to-acquire-photoneo-aims-to-expand-3d-machine-vision-solutions-1034181494
,1/14/2025 12:45:22 PM,Zebra Technologies initiated with a Neutral at Citi,TipRanks,/news/stocks/zebra-technologies-initiated-with-a-neutral-at-citi-1034226399
,1/14/2025 1:00:39 PM,"Analysts Offer Insights on Technology Companies: ServiceTitan, Inc. Class A (TTAN), Zebra Tech (ZBRA) and Uber Technologies (UBER)",TipRanks,/news/stocks/analysts-offer-insights-on-technology-companies-servicetitan-inc-class-a-ttan-zebra-tech-zbra-and-uber-technologies-uber-1034226491
,1/14/2025 2:41:10 PM,"Visa upgraded, MasterCard downgraded: Wall Street’s top analyst calls",TipRanks,/news/stocks/visa-upgraded-mastercard-downgraded-wall-street-s-top-analyst-calls-1034226965
,1/15/2025 11:20:14 AM,"Analysts’ Opinions Are Mixed on These Technology Stocks: Shoals Technologies Group (SHLS), Verint Systems (VRNT) and Zebra Tech (ZBRA)",TipRanks,/news/stocks/analysts-opinions-are-mixed-on-these-technology-stocks-shoals-technologies-group-shls-verint-systems-vrnt-and-zebra-tech-zbra-1034230555
,1/16/2025 12:16:20 PM,Zebra Tech (ZBRA): New Buy Recommendation for This Technology Giant,TipRanks,/news/stocks/zebra-tech-zbra-new-buy-recommendation-for-this-technology-giant-1034236261
,1/16/2025 1:27:02 PM,Zebra Technologies price target raised to $409 from $408 at Truist,TipRanks,/news/stocks/zebra-technologies-price-target-raised-to-409-from-408-at-truist-1034236711
,1/21/2025 5:45:00 PM,Top Seeking Alpha Quant picks in Technology ahead of Q4 earnings,Seeking Alpha,https://seekingalpha.com/news/4396470-top-seeking-alpha-quant-picks-in-technology-ahead-of-q4-earnings?utm_source=businessinsider&utm_medium=referral&feed_item_type=news
