Unnamed: 0,datetime,title,source,link
916.0,10/20/2022 12:11:40 PM,"Dow Inc. Q3 Profit Decreases, but beats estimates",RTTNews,/news/stocks/dow-inc-q3-profit-decreases-but-beats-estimates-1031820412
917.0,10/20/2022 12:58:22 PM,Dow ticks lower as Q3 operating income lowest in six quarters,Seeking Alpha,https://seekingalpha.com/news/3893169-dow-ticks-lower-as-q3-operating-income-lowest-in-six-quarters?utm_source=businessinsider&utm_medium=referral
918.0,10/21/2022 3:37:45 PM,Analyst Ratings for Dow,Benzinga,/news/stocks/analyst-ratings-for-dow-1031824535
919.0,10/21/2022 10:11:31 PM,Dow surges 748 points as US stocks rally on hopes of less aggressive Fed rate hikes,Business Insider,/news/stocks/stock-market-news-rally-rate-hike-slow-fed-inflation-dow-2022-10
920.0,10/28/2022 8:04:00 PM,"Dow, S&P, Nasdaq climb more than 2% following Apple earnings",Seeking Alpha,https://seekingalpha.com/news/3897466-dow-sp-nasdaq-climb-more-than-2-following-apple-earnings?utm_source=businessinsider&utm_medium=referral
921.0,11/1/2022 8:00:00 PM,Diego Donoso to retire from Dow; Karen S. Carter named president of Dow Packaging & Specialty Plastics,PR Newswire,/news/stocks/diego-donoso-to-retire-from-dow-karen-s-carter-named-president-of-dow-packaging-specialty-plastics-1031859923
922.0,11/9/2022 3:00:00 PM,Five Dow leaders achieve top honors on OUTstanding's 2022 leading LGBT+ professionals lists,PR Newswire,/news/stocks/five-dow-leaders-achieve-top-honors-on-outstanding-s-2022-leading-lgbt-professionals-lists-1031892546
923.0,11/15/2022 3:00:00 PM,WM and Dow Rollout First Major Residential Plastic Film Recycling Program in the U.S.,PR Newswire,/news/stocks/wm-and-dow-rollout-first-major-residential-plastic-film-recycling-program-in-the-u-s-1031915165
924.0,11/18/2022 12:26:04 AM,3 Dow Stocks to Sell Right Now… and 1 to Buy,InvestorPlace,/news/stocks/3-dow-stocks-to-sell-right-now-and-1-to-buy-1031925690
925.0,11/22/2022 11:59:07 PM,3 Undervalued Dow Stocks to Buy Before Wall Street Catches On,InvestorPlace,/news/stocks/undervalued-dow-stocks-1031585407
926.0,11/30/2022 10:12:00 PM,"Stolen checks, fraudulent activity: three major trade association PACs fell victim to theft in what's become a political epidemic",Business Insider,https://www.businessinsider.com/theft-fraud-trade-association-pacs-stolen-money-thieves-2022-11
927.0,12/6/2022 5:50:30 PM,SPAC Ares Acquisition to merge with nuclear reactor maker X Energy,Seeking Alpha,https://seekingalpha.com/news/3914442-spac-ares-acquisition-to-merge-with-nuclear-reactor-maker-x-energy?utm_source=businessinsider&utm_medium=referral
928.0,12/16/2022 1:22:00 PM,"Dow futures sink over 300 points, as investors dial back hopes for the Fed to switch course on rate hikes",Business Insider,/news/stocks/stock-market-news-dow-sink-nasdaq-fed-rate-hikes-hopes-2022-12
929.0,12/24/2022 1:46:35 AM,Dow Inc (DOW) Receives a Hold from RBC Capital,TipRanks,/news/stocks/dow-inc-dow-receives-a-hold-from-rbc-capital-1031989723
930.0,1/4/2023 5:45:00 PM,"The full list of major US companies slashing staff this year, from Hasbro to Amazon",Business Insider,https://www.businessinsider.com/layoffs-sweeping-the-us-these-are-the-companies-making-cuts-2023
931.0,1/10/2023 3:47:00 PM,Dow named one of America's most JUST Companies for the fourth year by JUST Capital,PR Newswire,/news/stocks/dow-named-one-of-america-s-most-just-companies-for-the-fourth-year-by-just-capital-1032009818
932.0,1/11/2023 1:00:28 PM,The Latest Analyst Ratings for Dow,Benzinga,/news/stocks/the-latest-analyst-ratings-for-dow-1032012023
933.0,1/11/2023 4:01:02 PM,"Benzinga's Top Ratings Upgrades, Downgrades For January 11, 2023",Benzinga,/news/stocks/benzinga-s-top-ratings-upgrades-downgrades-for-january-11-2023-1032012637
934.0,1/11/2023 4:25:47 PM,Dow Inc (DOW) Receives a Hold from UBS,TipRanks,/news/stocks/dow-inc-dow-receives-a-hold-from-ubs-1032012908
935.0,1/12/2023 2:51:39 PM,Netflix To Rally Around 18%? Here Are 10 Other Analyst Forecasts For Thursday,Benzinga,/news/stocks/netflix-to-rally-around-18-here-are-10-other-analyst-forecasts-for-thursday-1032014972
936.0,1/13/2023 1:19:29 PM,7 Dividend-Paying Large-Cap Stocks to Buy in January,InvestorPlace,/news/stocks/7-dividend-paying-large-cap-stocks-to-buy-in-january-1032017485
937.0,1/17/2023 4:01:25 PM,"Benzinga's Top Ratings Upgrades, Downgrades For January 17, 2023",Benzinga,/news/stocks/benzinga-s-top-ratings-upgrades-downgrades-for-january-17-2023-1032022889
938.0,1/20/2023 3:01:31 PM,Jim Cramer On This Stock Up 2% Over 6 Months: 'You've Got A Real Winner There',Benzinga,/news/stocks/jim-cramer-on-this-stock-up-2-over-6-months-you-ve-got-a-real-winner-there-1032030915
939.0,1/20/2023 5:16:36 PM,"Earnings week ahead: Tesla, Microsoft, AT&T and more",Seeking Alpha,https://seekingalpha.com/news/3926380-earnings-week-ahead-tesla-microsoft-att-and-more?utm_source=businessinsider&utm_medium=referral
940.0,1/20/2023 7:30:11 PM,"Catalyst watch: Tesla reverberations, Intel earnings, Rocket Lab launch and Macau stocks on holiday",Seeking Alpha,https://seekingalpha.com/news/3926434-catalyst-watch-tesla-reverberations-intel-earnings-rocket-lab-launch-and-macau-stocks-on-holiday?utm_source=businessinsider&utm_medium=referral
941.0,1/24/2023 2:00:00 PM,Univar Solutions Announces New Distribution Relationship for Dow's Key Acrylic Emulsion Polymers in the United Kingdom and Ireland,PR Newswire,/news/stocks/univar-solutions-announces-new-distribution-relationship-for-dow-s-key-acrylic-emulsion-polymers-in-the-united-kingdom-and-ireland-1032036668
942.0,1/25/2023 3:01:13 PM,Dow is about to announce its earnings — here's what to expect,Markets Insider Automation,/news/stocks/dow-stock-price-quarter-earnings-preview-q4-1032040468
943.0,1/25/2023 3:07:59 PM,Notable earnings before Thursday's open,Seeking Alpha,https://seekingalpha.com/news/3927808-notable-earnings-before-thursdays-open?utm_source=businessinsider&utm_medium=referral
944.0,1/25/2023 8:50:14 PM,"Dow Q4 earnings preview: Tough road ahead but everyone is ""holding"" on",Seeking Alpha,https://seekingalpha.com/news/3928000-dow-q4-earnings-preview-tough-road-ahead-but-everyone-is-holding-on?utm_source=businessinsider&utm_medium=referral
945.0,1/26/2023 1:45:52 AM,RBC Capital Remains a Hold on Dow Inc (DOW),TipRanks,/news/stocks/rbc-capital-remains-a-hold-on-dow-inc-dow-1032042039
946.0,1/26/2023 11:01:28 AM,"Dow Non-GAAP EPS of $0.46 misses by $0.11, revenue of $11.86B misses by $190M",Seeking Alpha,https://seekingalpha.com/news/3928239-dow-non-gaap-eps-of-0_46-misses-0_11-revenue-of-11_86b-misses-190m?utm_source=businessinsider&utm_medium=referral
947.0,1/26/2023 12:00:00 PM,Dow reports fourth quarter 2022 results,PR Newswire,/news/stocks/dow-reports-fourth-quarter-2022-results-1032043186
948.0,1/26/2023 12:03:00 PM,Dow outlines targeted actions to deliver $1B in cost savings in 2023,PR Newswire,/news/stocks/dow-outlines-targeted-actions-to-deliver-1b-in-cost-savings-in-2023-1032043203
949.0,1/26/2023 12:06:01 PM,"Dow Inc. Q4 Profit Decreases, misses estimates",RTTNews,/news/stocks/dow-inc-q4-profit-decreases-misses-estimates-1032043220
950.0,1/26/2023 12:17:42 PM,"Dow To Cut 2,000 Jobs, Sees $1 Bln In Cost Savings In FY23; Backs FY30 View ",RTTNews,/news/stocks/dow-to-cut-2-000-jobs-sees-1-bln-in-cost-savings-in-fy23-backs-fy30-view-1032043268
951.0,1/26/2023 1:05:12 PM,Alembic Global Sticks to Their Hold Rating for Dow Inc (DOW),TipRanks,/news/stocks/alembic-global-sticks-to-their-hold-rating-for-dow-inc-dow-1032043681
952.0,1/26/2023 7:00:02 PM,Dow Layoffs 2023: What to Know About the Latest DOW Job Cuts,InvestorPlace,/news/stocks/dow-layoffs-2023-what-to-know-about-the-latest-dow-job-cuts-1032044792
953.0,1/27/2023 2:45:47 PM,Nokia To Rally Around 47%? Here Are 10 Other Analyst Forecasts For Friday,Benzinga,/news/stocks/nokia-to-rally-around-47-here-are-10-other-analyst-forecasts-for-friday-1032046781
954.0,1/30/2023 10:05:22 AM,Dow Inc (DOW) Gets a Hold from Bank of America Securities,TipRanks,/news/stocks/dow-inc-dow-gets-a-hold-from-bank-of-america-securities-1032050305
955.0,1/30/2023 10:01:07 PM,Where Dow Stands With Analysts,Benzinga,/news/stocks/where-dow-stands-with-analysts-1032051901
956.0,2/2/2023 7:35:34 PM,The 7 Most Undervalued Dow Stocks to Buy in February 2023,InvestorPlace,/news/stocks/the-7-most-undervalued-dow-stocks-to-buy-in-february-2023-1032064008
957.0,2/7/2023 5:34:32 PM,Want To Copy 'Master Trader' Nancy Pelosi's Investments? There's An ETF For That. Here Are The Holdings,Benzinga,/news/stocks/want-to-copy-master-trader-nancy-pelosi-s-investments-there-s-an-etf-for-that-here-are-the-holdings-1032074762
958.0,2/9/2023 9:49:36 PM,Dow declares $0.70 dividend,Seeking Alpha,https://seekingalpha.com/news/3934497-dow-inc-declares-0_70-dividend?utm_source=businessinsider&utm_medium=referral
959.0,2/9/2023 10:15:00 PM,Dow declares quarterly dividend of 70 cents per share,PR Newswire,/news/stocks/dow-declares-quarterly-dividend-of-70-cents-per-share-1032084338
960.0,2/14/2023 1:50:36 AM,Analysts Offer Insights on Materials Companies: Dow Inc (DOW) and Sylvamo Corp (SLVM),TipRanks,/news/stocks/analysts-offer-insights-on-materials-companies-dow-inc-dow-and-sylvamo-corp-slvm-1032092542
961.0,2/17/2023 9:46:59 PM,3 Overlooked Industrial Stocks Worth Your Attention,InvestorPlace,/news/stocks/3-overlooked-industrial-stocks-worth-your-attention-1032107039
962.0,2/28/2023 3:01:04 PM,Wall Street's Most Accurate Analysts Say Hold These 3 Materials Stocks With Over 3% Dividend Yields,Benzinga,/news/stocks/wall-street-s-most-accurate-analysts-say-hold-these-3-materials-stocks-with-over-3-dividend-yields-1032131779
963.0,3/1/2023 6:13:01 PM,"Dow, X-energy to jointly build U.S. SMR nuclear demonstration plant",Seeking Alpha,https://seekingalpha.com/news/3942809-dow-x-energy-to-jointly-build-us-smr-nuclear-demonstration-plant?utm_source=businessinsider&utm_medium=referral
964.0,3/3/2023 9:53:30 PM,"Reporters hid tracking devices in shoes that were supposed to be recycled, and they ended up at a market in Indonesia instead",Business Insider,https://www.businessinsider.com/recycling-shoes-sneakers-waste-landfill-trackers-dow-2023-3
965.0,3/10/2023 3:00:00 PM,Dow to participate in J.P. Morgan 2023 Industrials Conference,PR Newswire,/news/stocks/dow-to-participate-in-j-p-morgan-2023-industrials-conference-1032160041
966.0,3/15/2023 12:30:01 PM,Dow dives over 600 points as Credit Suisse selloff injects fresh unease into markets,Business Insider,/news/stocks/stock-market-today-dow-spx-credit-suisse-plunge-rattles-calm-2023-3
967.0,3/15/2023 2:37:00 PM,Dow tumbles nearly 500 points as Credit Suisse stokes fears of bank failure contagion,Business Insider,/news/stocks/stock-market-news-today-silicon-valley-bank-credit-suisse-crisis-2023-3
968.0,3/15/2023 5:49:20 PM,7 Dividend Stocks for a Reliable Stream of Income,InvestorPlace,/news/stocks/7-dividend-stocks-for-a-reliable-stream-of-income-1032173811
969.0,3/15/2023 9:09:00 PM,US stocks trade mixed as Credit Suisse troubles stoke fears of a banking crisis,Business Insider,/news/stocks/stock-market-news-today-us-banking-crisis-credit-suisse-svb-2023-3
970.0,3/16/2023 11:22:30 AM,"Credit Suisse shares jump over 25% after a $54 billion SNB loan eases jitters, US stock futures stabilize",Business Insider,/news/stocks/stock-market-today-credit-suisse-shares-snb-loan-bank-crisis-2023-3
971.0,3/17/2023 11:24:13 AM,Top 5 Materials Stocks That Are Set To Fly,Benzinga,/news/stocks/top-5-materials-stocks-that-are-set-to-fly-1032175234
972.0,3/17/2023 12:42:00 PM,Credit Suisse shares slide 10% as the shine of its rescue package wears off,Business Insider,/news/stocks/credit-suisse-stock-price-bank-crisis-rescue-svb-credit-rating-2023-3
973.0,3/20/2023 2:08:30 PM,Credit Suisse shares tumble 60% as its UBS rescue deal fails to calm bank-crisis jitters,Business Insider,/news/stocks/credit-suisse-stock-price-ubs-deal-bank-crisis-rescue-2023-3
974.0,3/20/2023 4:00:38 PM,"Benzinga's Top Ratings Upgrades, Downgrades For March 20, 2023",Benzinga,/news/stocks/benzinga-s-top-ratings-upgrades-downgrades-for-march-20-2023-1032179409
975.0,3/31/2023 3:37:31 PM,US stocks climb on cooler inflation data as the S&P 500 heads for a winning quarter,Business Insider,/news/stocks/stock-market-news-today-economy-winning-quarter-fed-rate-hikes-2023-3
976.0,4/6/2023 3:41:01 PM,US stocks slip as investors assess health of the economy ahead of key jobs report,Business Insider,/news/stocks/stock-market-news-today-jobs-data-economy-labor-market-2023-4
977.0,4/10/2023 4:00:49 PM,15 Analysts Have This to Say About Dow,Benzinga,/news/stocks/15-analysts-have-this-to-say-about-dow-1032222187
978.0,4/11/2023 7:00:37 PM,Keybanc Maintains Underweight Rating for Dow: Here's What You Need To Know,Benzinga,/news/stocks/keybanc-maintains-underweight-rating-for-dow-here-s-what-you-need-to-know-1032225149
979.0,4/12/2023 2:06:29 PM,Microsoft To Rally Over 11%? Here Are 10 Other Analyst Forecasts For Wednesday,Benzinga,/news/stocks/microsoft-to-rally-over-11-here-are-10-other-analyst-forecasts-for-wednesday-1032227167
980.0,4/12/2023 5:00:53 PM,"Benzinga's Top Ratings Upgrades, Downgrades For April 12, 2023",Benzinga,/news/stocks/benzinga-s-top-ratings-upgrades-downgrades-for-april-12-2023-1032227793
981.0,4/13/2023 3:39:39 PM,US stocks climb as fresh signs point to cooling inflation and a softer labor market,Business Insider,/news/stocks/stock-market-news-today-ppi-cooling-inflation-data-jobless-claims-2023-4
982.0,4/13/2023 4:15:00 PM,Dow announces results from 2023 Annual Stockholder Meeting,PR Newswire,/news/stocks/dow-announces-results-from-2023-annual-stockholder-meeting-1032230526
983.0,4/16/2023 6:52:57 PM,7 Dividend Stocks to Buy That Are Backed by Strong Cash Flows,InvestorPlace,/news/stocks/7-dividend-stocks-to-buy-that-are-backed-by-strong-cash-flows-1032234643
984.0,4/21/2023 5:30:41 PM,"Earnings Week Ahead: Amazon, Meta Platforms, Alphabet, Coca-Cola, Boeing, and more",Seeking Alpha,https://seekingalpha.com/news/3958718-earnings-week-ahead-amazon-meta-platforms-alphabet-coca-cola-boeing-and-more?utm_source=businessinsider&utm_medium=referral
985.0,4/24/2023 2:24:40 PM,Notable earnings before Tuesday's open,Seeking Alpha,https://seekingalpha.com/news/3959106-notable-earnings-before-tuesdays-open?utm_source=businessinsider&utm_medium=referral
986.0,4/24/2023 3:01:13 PM,Here's what to expect from Dow's earnings,Markets Insider Automation,/news/stocks/dow-q1-earnings-preview-stock-1032254198
987.0,4/24/2023 4:08:03 PM,Dow Q1 2023 Earnings Preview,Seeking Alpha,https://seekingalpha.com/news/3959143-dow-q1-2023-earnings-preview?utm_source=businessinsider&utm_medium=referral
988.0,4/25/2023 10:03:13 AM,Dow beats Q1 top and bottom line estimates,Seeking Alpha,https://seekingalpha.com/news/3959536-dow-beats-q1-top-and-bottom-line-estimates?utm_source=businessinsider&utm_medium=referral
989.0,4/25/2023 12:00:00 PM,Dow reports first quarter 2023 results,PR Newswire,/news/stocks/dow-reports-first-quarter-2023-results-1032257528
990.0,4/25/2023 12:10:00 PM,Dow selects Linde as clean hydrogen and nitrogen partner for its proposed net-zero carbon emissions ethylene and derivatives complex in Canada,PR Newswire,/news/stocks/dow-selects-linde-as-clean-hydrogen-and-nitrogen-partner-for-its-proposed-net-zero-carbon-emissions-ethylene-and-derivatives-complex-in-canada-1032257557
991.0,4/25/2023 12:12:31 PM,Dow Inc. Q1 Earnings Summary,RTTNews,/news/stocks/dow-inc-q1-earnings-summary-1032257589
992.0,4/25/2023 12:20:42 PM,"Analysts Offer Insights on Materials Companies: Codexis (CDXS), ChampionX (CHX) and Dow Inc (DOW)",TipRanks,/news/stocks/analysts-offer-insights-on-materials-companies-codexis-cdxs-championx-chx-and-dow-inc-dow-1032258175
993.0,4/26/2023 9:10:08 AM,"Analysts Conflicted on These Materials Names: Archer Daniels Midland (ADM), First Quantum Minerals (OtherFQVLF) and Dow Inc (DOW)",TipRanks,/news/stocks/analysts-conflicted-on-these-materials-names-archer-daniels-midland-adm-first-quantum-minerals-otherfqvlf-and-dow-inc-dow-1032262474
994.0,4/26/2023 10:25:21 AM,Morgan Stanley Sticks to Their Hold Rating for Dow Inc (DOW),TipRanks,/news/stocks/morgan-stanley-sticks-to-their-hold-rating-for-dow-inc-dow-1032262698
995.0,4/26/2023 12:04:53 PM,"Analysts Conflicted on These Materials Names: O-I Glass (OI), Sherwin-Williams Company (SHW) and Dow Inc (DOW)",TipRanks,/news/stocks/analysts-conflicted-on-these-materials-names-o-i-glass-oi-sherwin-williams-company-shw-and-dow-inc-dow-1032263231
996.0,4/26/2023 12:31:15 PM,Analysts Conflicted on These Materials Names: Crown Holdings (CCK) and Dow Inc (DOW),TipRanks,/news/stocks/analysts-conflicted-on-these-materials-names-crown-holdings-cck-and-dow-inc-dow-1032263391
997.0,4/26/2023 12:40:43 PM,Analysts Conflicted on These Materials Names: Crown Holdings (CCK) and Dow Inc (DOW),TipRanks,/news/stocks/analysts-conflicted-on-these-materials-names-crown-holdings-cck-and-dow-inc-dow-1032263370
998.0,4/26/2023 7:00:19 PM,RBC Capital Maintains Sector Perform Rating for Dow: Here's What You Need To Know,Benzinga,/news/stocks/rbc-capital-maintains-sector-perform-rating-for-dow-here-s-what-you-need-to-know-1032264707
999.0,4/27/2023 11:05:44 AM,BMO Capital Remains a Hold on Dow Inc (DOW),TipRanks,/news/stocks/bmo-capital-remains-a-hold-on-dow-inc-dow-1032268114
1000.0,4/27/2023 8:00:46 PM,12 Analysts Have This to Say About Dow,Benzinga,/news/stocks/12-analysts-have-this-to-say-about-dow-1032270023
1001.0,4/28/2023 11:20:47 AM,Analysts Offer Insights on Materials Companies: Wacker Chemie AG (OtherWKCMF) and Dow Inc (DOW),TipRanks,/news/stocks/analysts-offer-insights-on-materials-companies-wacker-chemie-ag-otherwkcmf-and-dow-inc-dow-1032273341
1002.0,5/11/2023 12:00:00 PM,"Dow's Seadrift, Texas location selected for X-energy advanced SMR nuclear project to deliver safe, reliable, zero carbon emissions power and steam production",PR Newswire,/news/stocks/dow-s-seadrift-texas-location-selected-for-x-energy-advanced-smr-nuclear-project-to-deliver-safe-reliable-zero-carbon-emissions-power-and-steam-production-1032317033
1003.0,5/22/2023 3:00:00 PM,Dow to participate in the Bernstein 39th Annual Strategic Decisions Conference,PR Newswire,/news/stocks/dow-to-participate-in-the-bernstein-39th-annual-strategic-decisions-conference-1032342688
1004.0,5/25/2023 2:00:00 PM,Dow and New Energy Blue announce collaboration to develop renewable plastic materials from corn residue,PR Newswire,/news/stocks/dow-and-new-energy-blue-announce-collaboration-to-develop-renewable-plastic-materials-from-corn-residue-1032351402
1005.0,5/25/2023 4:19:09 PM,3 Dogs of the Dow for High-Yield Investors,InvestorPlace,/news/stocks/3-dogs-of-the-dow-for-high-yield-investors-1032352414
1006.0,5/26/2023 5:50:01 PM,Dow goes ex-dividend on Tuesday,Seeking Alpha,https://seekingalpha.com/news/3975521-dow-goes-ex-dividend-on-tuesday?utm_source=businessinsider&utm_medium=referral
1007.0,6/8/2023 10:50:55 PM,3 Dividend-Paying Large-Cap Stocks to Buy in June,InvestorPlace,/news/stocks/3-dividend-paying-large-cap-stocks-to-buy-in-june-1032379557
1008.0,6/9/2023 4:25:31 PM,RBC Capital Sticks to Its Hold Rating for Dow Inc (DOW),TipRanks,/news/stocks/rbc-capital-sticks-to-its-hold-rating-for-dow-inc-dow-1032381309
1009.0,6/9/2023 8:00:33 PM,Expert Ratings for Dow,Benzinga,/news/stocks/expert-ratings-for-dow-1032381444
1010.0,6/13/2023 1:26:22 PM,These 3 Materials Stocks Delivering High-Dividend Yields Are Recommended By Wall Street's Most Accurate Analysts,Benzinga,/news/stocks/these-3-materials-stocks-delivering-high-dividend-yields-are-recommended-by-wall-street-s-most-accurate-analysts-1032385743
1011.0,6/14/2023 5:01:58 PM,"Benzinga's Top Ratings Upgrades, Downgrades For June 14, 2023",Benzinga,/news/stocks/benzinga-s-top-ratings-upgrades-downgrades-for-june-14-2023-1032389437
1012.0,6/14/2023 10:33:44 PM,Investing in Hydrogen: 7 Top Stocks Poised for Millionaire Status,InvestorPlace,/news/stocks/investing-in-hydrogen-7-top-stocks-poised-for-millionaire-status-1032390171
1013.0,6/19/2023 4:00:00 PM,"Dow publishes 2022 INtersections Progress Report, outlining commitments and actions to create long-term value growth and a more sustainable future",PR Newswire,/news/stocks/dow-publishes-2022-intersections-progress-report-outlining-commitments-and-actions-to-create-long-term-value-growth-and-a-more-sustainable-future-1032397016
1014.0,6/22/2023 5:02:27 PM,"Benzinga's Top Ratings Upgrades, Downgrades For June 22, 2023",Benzinga,/news/stocks/benzinga-s-top-ratings-upgrades-downgrades-for-june-22-2023-1032405014
1015.0,6/22/2023 5:53:06 PM,Chemical Stocks Drop After Bank of America Downgrades - Here's Why,Benzinga,/news/stocks/chemical-stocks-drop-after-bank-of-america-downgrades---here-s-why-1032405135
1016.0,6/26/2023 3:42:02 PM,"Billionaire investor Ron Baron says inflation will propel major stock gains in the coming decades, though everything will be 'twice as expensive'",Business Insider,/news/stocks/ron-baron-stock-market-outlook-inflation-prices-us-economy-fed-2023-6
1017.0,6/28/2023 10:49:41 AM,Citi screens for most crowded short stocks with new model,Seeking Alpha,https://seekingalpha.com/news/3983369-citi-screens-for-most-crowded-short-stock-with-new-model?utm_source=businessinsider&utm_medium=referral
1018.0,7/5/2023 10:06:03 PM,US stocks slide as Fed minutes show more rate hikes may be on the way,Business Insider,/news/stocks/stock-market-news-today-fed-minutes-rate-hikes-index-investors-2023-7
1019.0,7/11/2023 9:35:16 AM,Barclays Keeps Their Hold Rating on Dow Inc (DOW),TipRanks,/news/stocks/barclays-keeps-their-hold-rating-on-dow-inc-dow-1032437135
1020.0,7/12/2023 11:00:28 PM,10 Analysts Have This to Say About Dow,Benzinga,/news/stocks/10-analysts-have-this-to-say-about-dow-1032442494
1021.0,7/17/2023 2:26:37 PM,These 3 Materials Stocks Delivering High-Dividend Yields Are Recommended By Wall Street's Most Accurate Analysts,Benzinga,/news/stocks/these-3-materials-stocks-delivering-high-dividend-yields-are-recommended-by-wall-street-s-most-accurate-analysts-1032451186
1022.0,7/20/2023 4:21:01 AM,"Analysts Are Neutral on Top Materials Stocks: Mosaic Co (MOS), Dow Inc (DOW)",TipRanks,/news/stocks/analysts-are-neutral-on-top-materials-stocks-mosaic-co-mos-dow-inc-dow-1032460926
1023.0,7/21/2023 1:46:22 AM,RBC Capital Remains a Hold on Dow Inc (DOW),TipRanks,/news/stocks/rbc-capital-remains-a-hold-on-dow-inc-dow-1032464209
1024.0,7/21/2023 3:54:01 PM,US stocks rise with Dow heading for 10-day streak of gains as traders sift through earnings,Business Insider,/news/stocks/stock-market-news-today-indexes-economy-finance-investors-fed-rates-2023-7
1025.0,7/21/2023 10:06:01 PM,US stocks trade mixed as Dow caps off its longest winning streak since 2017,Business Insider,/news/stocks/stock-market-news-today-dow-winning-streak-finance-banks-earnings-2023-7
1026.0,7/24/2023 2:30:00 PM,Dow Q2 Earnings Preview,Seeking Alpha,https://seekingalpha.com/news/3989708-dow-q2-earnings-preview?utm_source=businessinsider&utm_medium=referral
1027.0,7/24/2023 3:01:13 PM,Here's what to expect from Dow's earnings,Markets Insider Automation,/news/stocks/dow-q2-quarterly-earnings-preview-stock-1032470168
1028.0,7/24/2023 3:02:24 PM,Notable earnings before Tuesday's open,Seeking Alpha,https://seekingalpha.com/news/3990102-notable-earnings-before-tuesdays-open?utm_source=businessinsider&utm_medium=referral
1029.0,7/24/2023 10:12:02 PM,"Dow notches 11th straight win as traders look to big tech earnings, Fed meeting",Business Insider,/news/stocks/stock-market-news-today-dow-11th-straight-win-tech-earnings-2023-7
1030.0,7/25/2023 10:03:56 AM,"Dow Non-GAAP EPS of $0.75 beats by $0.04, revenue of $11.4B beats by $140M",Seeking Alpha,https://seekingalpha.com/news/3990431-dow-non-gaap-eps-of-075-beats-by-004-revenue-of-114b-beats-by-140m?utm_source=businessinsider&utm_medium=referral
1031.0,7/25/2023 12:00:00 PM,Dow reports second quarter 2023 results,PR Newswire,/news/stocks/dow-reports-second-quarter-2023-results-1032473614
1032.0,7/25/2023 12:03:56 PM,"Dow Inc. Q2 Profit Decreases, but beats estimates",RTTNews,/news/stocks/dow-inc-q2-profit-decreases-but-beats-estimates-1032473635
1033.0,7/25/2023 12:15:32 PM,Alembic Global Reaffirms Their Hold Rating on Dow Inc (DOW),TipRanks,/news/stocks/alembic-global-reaffirms-their-hold-rating-on-dow-inc-dow-1032474210
1034.0,7/26/2023 7:40:06 AM,Analysts Offer Insights on Materials Companies: Dow Inc (DOW) and First Quantum Minerals (OtherFQVLF),TipRanks,/news/stocks/analysts-offer-insights-on-materials-companies-dow-inc-dow-and-first-quantum-minerals-otherfqvlf-1032478214
1035.0,7/26/2023 10:40:53 AM,Analysts Conflicted on These Materials Names: Corning (GLW) and Dow Inc (DOW),TipRanks,/news/stocks/analysts-conflicted-on-these-materials-names-corning-glw-and-dow-inc-dow-1032478911
1036.0,7/26/2023 11:05:19 AM,BMO Capital Remains a Hold on Dow Inc (DOW),TipRanks,/news/stocks/bmo-capital-remains-a-hold-on-dow-inc-dow-1032479074
1037.0,7/27/2023 12:20:21 AM,"Analysts Have Conflicting Sentiments on These Materials Companies: Dow Inc (DOW), Rio Tinto Limited (OtherRTNTF) and Corning (GLW)",TipRanks,/news/stocks/analysts-have-conflicting-sentiments-on-these-materials-companies-dow-inc-dow-rio-tinto-limited-otherrtntf-and-corning-glw-1032481768
1038.0,7/27/2023 4:15:06 AM,Dow Inc (DOW): New Buy Recommendation for This Basic Materials Giant,TipRanks,/news/stocks/dow-inc-dow-new-buy-recommendation-for-this-basic-materials-giant-1032482146
1039.0,7/27/2023 4:15:06 AM,RBC Capital Keeps Their Hold Rating on Dow Inc (DOW),TipRanks,/news/stocks/rbc-capital-keeps-their-hold-rating-on-dow-inc-dow-1032482145
1040.0,7/28/2023 10:10:01 PM,Dow and S&P 500 finish 3rd straight winning week as more data shows inflation is cooling,Business Insider,/news/stocks/stock-market-news-today-dow-sp500-winning-week-inflation-fed-2023-7
