Unnamed: 0,datetime,title,source,link
470.0,8/22/2023 5:06:37 PM,U.S. lifts restrictions on 27 Chinese companies ahead of Commerce Secretary trip,Seeking Alpha,https://seekingalpha.com/news/4005237-us-lifts-restrictions-on-27-chinese-companies-ahead-of-commerce-secretary-trip?utm_source=businessinsider&utm_medium=referral
471.0,8/22/2023 6:24:23 PM,Emerson raised to Overweight at J.P. Morgan ahead of positive relative revision cycle,Seeking Alpha,https://seekingalpha.com/news/4005271-emerson-raised-to-overweight-at-jp-morgan-ahead-of-positive-relative-revision-cycle?utm_source=businessinsider&utm_medium=referral
472.0,8/24/2023 2:08:12 PM,National Instruments gains on report it received China approval for Emerson deal,Seeking Alpha,https://seekingalpha.com/news/4006014-national-instruments-gains-on-report-it-received-china-approval-fror-emerson-deal?utm_source=businessinsider&utm_medium=referral
473.0,8/25/2023 1:54:25 AM,3 Millionaire-Maker Robotics Stocks to Hold Through Thick and Thin,InvestorPlace,/news/stocks/3-millionaire-maker-robotics-stocks-to-hold-through-thick-and-thin-1032581349
474.0,8/28/2023 1:15:15 PM,Wells Fargo Sticks to Its Buy Rating for Emerson Electric Company (EMR),TipRanks,/news/stocks/wells-fargo-sticks-to-its-buy-rating-for-emerson-electric-company-emr-1032586082
475.0,8/28/2023 3:00:58 PM,Analyst Ratings for Emerson Electric,Benzinga,/news/stocks/analyst-ratings-for-emerson-electric-1032585950
476.0,8/28/2023 5:00:49 PM,"Benzinga's Top Ratings Upgrades, Downgrades For August 28, 2023",Benzinga,/news/stocks/benzinga-s-top-ratings-upgrades-downgrades-for-august-28-2023-1032586678
477.0,9/1/2023 11:28:39 AM,Emerson Electric's $8.2B acquisition of National Instruments approved by EU,Seeking Alpha,https://seekingalpha.com/news/4008287-emerson-electrics-acquisition-of-national-instruments-approved-by-eu?utm_source=businessinsider&utm_medium=referral
478.0,9/5/2023 11:15:18 AM,Emerson Electric's $8B purchase of National Instruments approved in China,Seeking Alpha,https://seekingalpha.com/news/4008971-emerson-electrics-8b-purchase-of-national-instruments-approved-in-china?utm_source=businessinsider&utm_medium=referral
479.0,9/6/2023 1:05:21 PM,The 3 Best Retirement Stocks to Buy Now: September 2023,InvestorPlace,/news/stocks/the-3-best-retirement-stocks-to-buy-now-september-2023-1032609225
480.0,9/10/2023 6:05:21 PM,Oppenheimer Keeps Their Buy Rating on Emerson Electric Company (EMR),TipRanks,/news/stocks/oppenheimer-keeps-their-buy-rating-on-emerson-electric-company-emr-1032618286
481.0,9/11/2023 10:35:58 AM,Wells Fargo Sticks to Its Buy Rating for Emerson Electric Company (EMR),TipRanks,/news/stocks/wells-fargo-sticks-to-its-buy-rating-for-emerson-electric-company-emr-1032619524
482.0,9/15/2023 5:00:48 PM,"Benzinga's Top Ratings Upgrades, Downgrades For September 15, 2023",Benzinga,/news/stocks/benzinga-s-top-ratings-upgrades-downgrades-for-september-15-2023-1032634298
483.0,9/18/2023 9:55:36 AM,Wells Fargo Sticks to Their Buy Rating for Emerson Electric Company (EMR),TipRanks,/news/stocks/wells-fargo-sticks-to-their-buy-rating-for-emerson-electric-company-emr-1032636250
484.0,9/24/2023 9:29:42 PM,7 Value Stocks That Should Be on Every Investor’s Radar This Fall,InvestorPlace,/news/stocks/the-7-best-value-stocks-for-investors-to-buy-this-fall-1032651296
485.0,9/25/2023 9:58:39 AM,Wells Fargo Keeps Their Buy Rating on Emerson Electric Company (EMR),TipRanks,/news/stocks/wells-fargo-keeps-their-buy-rating-on-emerson-electric-company-emr-1032652341
486.0,9/27/2023 4:12:23 PM,Emerson Ventures Invests In First Resonance To Support Growth & Development Of ION Factory OS ,RTTNews,/news/stocks/emerson-ventures-invests-in-first-resonance-to-support-growth-development-of-ion-factory-os-1032660051
487.0,9/28/2023 1:00:00 PM,"Otis Appoints Tracy Embree President, Otis Americas and Enrique Miñarro Viseras as President, Otis Europe, Middle East and Africa",PR Newswire,/news/stocks/otis-appoints-tracy-embree-president-otis-americas-and-enrique-miñarro-viseras-as-president-otis-europe-middle-east-and-africa-1032662386
488.0,10/2/2023 8:47:05 AM,Wells Fargo Sticks to Their Buy Rating for Emerson Electric Company (EMR),TipRanks,/news/stocks/wells-fargo-sticks-to-their-buy-rating-for-emerson-electric-company-emr-1032669531
489.0,10/3/2023 2:07:50 PM,NVIDIA To Rally Over 67%? Here Are 10 Other Analyst Forecasts For Tuesday,Benzinga,/news/stocks/nvidia-to-rally-over-67-here-are-10-other-analyst-forecasts-for-tuesday-1032674241
490.0,10/3/2023 3:00:25 PM,Expert Ratings for Emerson Electric,Benzinga,/news/stocks/expert-ratings-for-emerson-electric-1032674457
491.0,10/3/2023 5:00:55 PM,"Benzinga's Top Ratings Upgrades, Downgrades For October 3, 2023",Benzinga,/news/stocks/benzinga-s-top-ratings-upgrades-downgrades-for-october-3-2023-1032675243
492.0,10/5/2023 11:21:36 AM,Emerson Electric Company (EMR) Receives a Rating Update from a Top Analyst,TipRanks,/news/stocks/emerson-electric-company-emr-receives-a-rating-update-from-a-top-analyst-1032680976
493.0,10/9/2023 5:25:26 AM,Hold Rating on Emerson Electric Company: Promise and Challenges in Process Automation Market,TipRanks,/news/stocks/hold-rating-on-emerson-electric-company-promise-and-challenges-in-process-automation-market-1032687325
494.0,10/9/2023 10:39:21 AM,Wells Fargo Releases a Buy Rating on Emerson Electric Company (EMR),TipRanks,/news/stocks/wells-fargo-releases-a-buy-rating-on-emerson-electric-company-emr-1032688245
495.0,10/9/2023 12:16:02 PM,Emerson Electric Company (EMR) Receives a Buy from J.P. Morgan,TipRanks,/news/stocks/emerson-electric-company-emr-receives-a-buy-from-j-p-morgan-1032688636
496.0,10/10/2023 1:48:00 AM,Hyatt Hotels Set to Join S&P MidCap 400,PR Newswire,/news/stocks/hyatt-hotels-set-to-join-s-p-midcap-400-1032690141
497.0,10/10/2023 10:55:57 AM,The Pros Got It Wrong: 7 Stocks to Buy Despite Recent Downgrades,InvestorPlace,/news/stocks/the-pros-got-it-wrong-7-stocks-to-buy-despite-recent-downgrades-1032691747
498.0,10/16/2023 9:56:20 AM,Emerson Electric’s Acquisition of National Instruments: A Promising Financial Boost and Buy Rating Reaffirmation,TipRanks,/news/stocks/emerson-electric-s-acquisition-of-national-instruments-a-promising-financial-boost-and-buy-rating-reaffirmation-1032707648
499.0,10/16/2023 10:08:35 AM,Wells Fargo Sticks to Their Buy Rating for Emerson Electric Company (EMR),TipRanks,/news/stocks/wells-fargo-sticks-to-their-buy-rating-for-emerson-electric-company-emr-1032707710
500.0,10/24/2023 12:02:32 PM,Top 3 Dividend Kings to Secure Your Portfolio’s Long-Term Success,InvestorPlace,/news/stocks/top-3-dividend-kings-to-secure-your-portfolios-long-term-success-1032732993
501.0,10/26/2023 11:28:47 AM,7 Dividend Stock Picks to Protect Your Portfolio From a Dark Winter,InvestorPlace,/news/stocks/7-dividend-stock-picks-to-protect-your-portfolio-from-a-dark-winter-1032743469
502.0,11/6/2023 10:31:01 AM,"Analysts Have Conflicting Sentiments on These Industrial Goods Companies: Schneider National (SNDR), Emerson Electric Company (EMR) and KBR (KBR)",TipRanks,/news/stocks/analysts-have-conflicting-sentiments-on-these-industrial-goods-companies-schneider-national-sndr-emerson-electric-company-emr-and-kbr-kbr-1032783980
503.0,11/6/2023 3:01:14 PM,Here's what Wall Street expects from Emerson Electric's earnings report,Markets Insider Automation,/news/stocks/emerson_electric-stock-q4-earnings-preview-1032782099
504.0,11/6/2023 8:48:54 PM,3 Dividend Kings to Buy for Royal Returns,InvestorPlace,/news/stocks/3-dividend-kings-to-buy-for-royal-returns-1032783665
505.0,11/7/2023 1:06:30 PM,Emerson Electric Co. Announces Rise In Q4 Bottom Line,RTTNews,/news/stocks/emerson-electric-co-announces-rise-in-q4-bottom-line-1032787078
506.0,11/7/2023 8:48:45 PM,"US Stocks Eye Longest Winning Streak In 2 Years, Oil Tumbles: What's Driving Markets Tuesday?",Benzinga,/news/etf/us-stocks-eye-longest-winning-streak-in-2-years-oil-tumbles-what-s-driving-markets-tuesday-1032789501
507.0,11/8/2023 8:41:06 AM,Analysts Have Conflicting Sentiments on These Industrial Goods Companies: Kaman (KAMN) and Emerson Electric Company (EMR),TipRanks,/news/stocks/analysts-have-conflicting-sentiments-on-these-industrial-goods-companies-kaman-kamn-and-emerson-electric-company-emr-1032796354
508.0,11/8/2023 10:12:46 AM,Analysts’ Opinions Are Mixed on These Industrial Goods Stocks: Expeditors International (EXPD) and Emerson Electric Company (EMR),TipRanks,/news/stocks/analysts-opinions-are-mixed-on-these-industrial-goods-stocks-expeditors-international-expd-and-emerson-electric-company-emr-1032796736
509.0,11/8/2023 11:11:17 AM,Analysts Offer Insights on Industrial Goods Companies: Air Products and Chemicals (APD) and Emerson Electric Company (EMR),TipRanks,/news/stocks/analysts-offer-insights-on-industrial-goods-companies-air-products-and-chemicals-apd-and-emerson-electric-company-emr-1032796891
510.0,11/8/2023 12:59:44 PM,Loop Capital Markets Sticks to Their Buy Rating for Emerson Electric Company (EMR),TipRanks,/news/stocks/loop-capital-markets-sticks-to-their-buy-rating-for-emerson-electric-company-emr-1032797140
511.0,11/9/2023 5:03:48 PM,"Analysts Offer Insights on Industrial Goods Companies: Spartan Delta (OtherDALXF), Rockwell Automation (ROK) and Emerson Electric Company (EMR)",TipRanks,/news/stocks/analysts-offer-insights-on-industrial-goods-companies-spartan-delta-otherdalxf-rockwell-automation-rok-and-emerson-electric-company-emr-1032803296
512.0,11/10/2023 11:31:57 AM,Analysts Offer Insights on Industrial Goods Companies: Spirit AeroSystems (SPR) and Emerson Electric Company (EMR),TipRanks,/news/stocks/analysts-offer-insights-on-industrial-goods-companies-spirit-aerosystems-spr-and-emerson-electric-company-emr-1032808162
513.0,11/10/2023 5:00:39 PM,Expert Ratings for Emerson Electric,Benzinga,/news/stocks/expert-ratings-for-emerson-electric-1032807518
514.0,11/13/2023 1:15:29 AM,Emerson Electric Company’s Potential Value and Stability: A Comprehensive Analysis of the NATI Acquisition and Future Projections,TipRanks,/news/stocks/emerson-electric-company-s-potential-value-and-stability-a-comprehensive-analysis-of-the-nati-acquisition-and-future-projections-1032812928
515.0,11/13/2023 12:17:31 PM,Wells Fargo Sticks to Their Buy Rating for Emerson Electric Company (EMR),TipRanks,/news/stocks/wells-fargo-sticks-to-their-buy-rating-for-emerson-electric-company-emr-1032814906
516.0,11/15/2023 12:16:40 AM,3 Standout Dividend Stocks to Finance Your Golden Years,InvestorPlace,/news/stocks/3-standout-dividend-stocks-to-finance-your-golden-years-1032819773
517.0,11/20/2023 2:06:59 PM,Six Flags Entertainment To Rally Around 35%? Here Are 10 Top Analyst Forecasts For Monday,Benzinga,/news/stocks/six-flags-entertainment-to-rally-around-35-here-are-10-top-analyst-forecasts-for-monday-1032835397
518.0,11/20/2023 3:37:39 PM,Emerson Electric Announces Strategic Investment In Frugal Technologies ,RTTNews,/news/stocks/emerson-electric-announces-strategic-investment-in-frugal-technologies-1032835765
519.0,11/27/2023 9:57:59 AM,Wells Fargo Reaffirms Their Buy Rating on Emerson Electric Company (EMR),TipRanks,/news/stocks/wells-fargo-reaffirms-their-buy-rating-on-emerson-electric-company-emr-1032852675
520.0,11/30/2023 1:27:36 PM,Follow the Leaders: 7 Stocks With Strong Insider Confidence,InvestorPlace,/news/stocks/follow-the-leaders-7-stocks-with-strong-insider-confidence-1032862457
521.0,12/4/2023 3:17:53 PM,Wells Fargo Keeps Their Buy Rating on Emerson Electric Company (EMR),TipRanks,/news/stocks/wells-fargo-keeps-their-buy-rating-on-emerson-electric-company-emr-1032872377
522.0,12/11/2023 10:40:06 AM,Wells Fargo Remains a Buy on Emerson Electric Company (EMR),TipRanks,/news/stocks/wells-fargo-remains-a-buy-on-emerson-electric-company-emr-1032891074
523.0,12/15/2023 6:18:01 PM,3 Dividend Stock Cash Machines That Will Pay You Forever,InvestorPlace,/news/stocks/3-dividend-stock-cash-machines-that-will-pay-you-forever-1032905794
524.0,12/18/2023 8:46:53 PM,7 Undervalued Dividend Stocks to Buy for a Bargain,InvestorPlace,/news/stocks/7-undervalued-dividend-stocks-to-buy-for-a-bargain-1032910291
525.0,12/19/2023 12:26:07 PM,Wells Fargo Remains a Buy on Emerson Electric Company (EMR),TipRanks,/news/stocks/wells-fargo-remains-a-buy-on-emerson-electric-company-emr-1032914342
526.0,12/19/2023 4:01:25 PM,A Glimpse Into The Expert Outlook On Emerson Electric Through 7 Analysts,Benzinga,/news/stocks/a-glimpse-into-the-expert-outlook-on-emerson-electric-through-7-analysts-1032913108
527.0,1/3/2024 10:28:04 AM,Wells Fargo Reaffirms Their Buy Rating on Emerson Electric Company (EMR),TipRanks,/news/stocks/wells-fargo-reaffirms-their-buy-rating-on-emerson-electric-company-emr-1032941354
528.0,1/4/2024 5:00:19 PM,Forecasting The Future: 6 Analyst Projections For Emerson Electric,Benzinga,/news/stocks/forecasting-the-future-6-analyst-projections-for-emerson-electric-1032943853
529.0,1/8/2024 12:17:44 PM,Wells Fargo Sticks to Their Buy Rating for Emerson Electric Company (EMR),TipRanks,/news/stocks/wells-fargo-sticks-to-their-buy-rating-for-emerson-electric-company-emr-1032951846
530.0,1/19/2024 4:05:17 PM,"Stable Payouts, Increasing Performance: Preformed Line Products Supports Investors with Growing Earnings",Benzinga,/news/stocks/stable-payouts-increasing-performance-preformed-line-products-supports-investors-with-growing-earnings-1032980472
531.0,1/22/2024 5:39:30 PM,7 Dividend Aristocrats With Ever-Rising Payouts,InvestorPlace,/news/stocks/7-dividend-aristocrats-with-ever-rising-payouts-1032986955
532.0,2/4/2024 1:45:00 PM,"Earnings week ahead: Alibaba, PepsiCo, Disney, Palantir, McDonalds, Ford and more",Seeking Alpha,https://seekingalpha.com/news/4062246-earnings-week-ahead-alibaba-pepsico-disney-palantir-mcdonalds-philip-morris-ford-and-more?utm_source=businessinsider&utm_medium=referral&feed_item_type=news
533.0,2/6/2024 4:00:55 PM,What to expect from Emerson Electric's Q1 earnings?,Seeking Alpha,https://seekingalpha.com/news/4063191-what-to-expect-from-emerson-electric-q1-earnings?utm_source=businessinsider&utm_medium=referral&feed_item_type=news
534.0,2/7/2024 12:00:15 PM,"Emerson Electric Non-GAAP EPS of $1.22 beats by $0.18, revenue of $4.12B beats by $210M",Seeking Alpha,https://seekingalpha.com/news/4063695-emerson-electric-non-gaap-eps-of-1_22-beats-0_18-revenue-of-4_12b-beats-210m?utm_source=businessinsider&utm_medium=referral&feed_item_type=news
535.0,2/7/2024 12:04:16 PM,Emerson Electric declares $0.525 dividend,Seeking Alpha,https://seekingalpha.com/news/4063691-emerson-electric-co-declares-0_525-dividend?utm_source=businessinsider&utm_medium=referral&feed_item_type=news
536.0,2/7/2024 1:01:25 PM,"Emerson Electric Co. Q1 Profit Decreases, but beats estimates",RTTNews,/news/stocks/emerson-electric-co-q1-profit-decreases-but-beats-estimates-1033040001
537.0,2/7/2024 1:19:01 PM,"Emerson Electric Boosts FY24 Adj. EPS, Sales Growth Outlook; Declares Dividend - Update ",RTTNews,/news/stocks/emerson-electric-boosts-fy24-adj-eps-sales-growth-outlook-declares-dividend-update-1033040089
538.0,2/7/2024 5:38:09 PM,"Chipotle Posts Upbeat Earnings, Joins Cirrus Logic, Emerson Electric, Carlyle Group And Other Big Stocks Moving Higher On Wednesday",Benzinga,/news/stocks/chipotle-posts-upbeat-earnings-joins-cirrus-logic-emerson-electric-carlyle-group-and-other-big-stocks-moving-higher-on-wednesday-1033042136
539.0,2/7/2024 7:02:47 PM,Why Container Store Group Shares Are Trading Lower By Around 23%? Here Are Other Stocks Moving In Wednesday's Mid-Day Session,Benzinga,/news/stocks/why-container-store-group-shares-are-trading-lower-by-around-23-here-are-other-stocks-moving-in-wednesday-s-mid-day-session-1033042440
540.0,2/7/2024 7:40:43 PM,"S&P 500 Flirts With 5,000 As Magnificent 7 Tops $13 Trillion, NYCB Sinks: What's Driving Markets Wednesday?",Benzinga,/news/stocks/s-p-500-flirts-with-5-000-as-magnificent-7-tops-13-trillion-nycb-sinks-what-s-driving-markets-wednesday-1033042553
541.0,2/8/2024 10:30:36 AM,Analysts Offer Insights on Industrial Goods Companies: XPO (XPO) and Emerson Electric Company (EMR),TipRanks,/news/stocks/analysts-offer-insights-on-industrial-goods-companies-xpo-xpo-and-emerson-electric-company-emr-1033046421
542.0,2/8/2024 10:46:19 AM,Emerson Electric Exceeds Expectations: Strong Buy on Solid Financials and Growth Momentum,TipRanks,/news/stocks/emerson-electric-exceeds-expectations-strong-buy-on-solid-financials-and-growth-momentum-1033046478
543.0,2/8/2024 11:27:46 AM,Barclays Remains a Hold on Emerson Electric Company (EMR),TipRanks,/news/stocks/barclays-remains-a-hold-on-emerson-electric-company-emr-1033046732
544.0,2/8/2024 12:48:19 PM,Emerson Electric Company (EMR) Gets a Buy from Oppenheimer,TipRanks,/news/stocks/emerson-electric-company-emr-gets-a-buy-from-oppenheimer-1033047443
545.0,2/8/2024 12:51:34 PM,"Analysts Offer Insights on Industrial Goods Companies: Regal Rexnord (RRX), Emerson Electric Company (EMR) and Siemens Energy (OtherSMEGF)",TipRanks,/news/stocks/analysts-offer-insights-on-industrial-goods-companies-regal-rexnord-rrx-emerson-electric-company-emr-and-siemens-energy-othersmegf-1033047426
546.0,2/8/2024 1:00:23 PM,Forecasting The Future: 4 Analyst Projections For Emerson Electric,Benzinga,/news/stocks/forecasting-the-future-4-analyst-projections-for-emerson-electric-1033045688
547.0,2/8/2024 3:19:45 PM,Disney To Rally Over 26%? Here Are 10 Top Analyst Forecasts For Thursday,Benzinga,/news/stocks/disney-to-rally-over-26-here-are-10-top-analyst-forecasts-for-thursday-1033046720
548.0,2/10/2024 9:27:43 AM,Emerson Electric Approves 2024 Equity Incentive Plan,TipRanks,/news/stocks/emerson-electric-approves-2024-equity-incentive-plan-1033052763
549.0,2/10/2024 9:27:58 AM,"Emerson Electric Shareholders Elect Directors, Approve Incentives",TipRanks,/news/stocks/emerson-electric-shareholders-elect-directors-approve-incentives-1033052870
550.0,2/12/2024 11:47:12 AM,Wells Fargo Keeps Their Buy Rating on Emerson Electric Company (EMR),TipRanks,/news/stocks/wells-fargo-keeps-their-buy-rating-on-emerson-electric-company-emr-1033057270
551.0,2/25/2024 4:34:00 PM,"3 Robotics Stocks to Turn $10,000 Into $1 Million: February 2024",InvestorPlace,/news/stocks/3-robotics-stocks-to-turn-10000-into-1-million-february-2024-1033099925
552.0,2/26/2024 11:31:37 AM,Wells Fargo Reaffirms Their Buy Rating on Emerson Electric Company (EMR),TipRanks,/news/stocks/wells-fargo-reaffirms-their-buy-rating-on-emerson-electric-company-emr-1033102854
553.0,2/27/2024 9:20:05 AM,Analysts Offer Insights on Industrial Goods Companies: Emerson Electric Company (EMR) and EasyJet (OtherEJTTF),TipRanks,/news/stocks/analysts-offer-insights-on-industrial-goods-companies-emerson-electric-company-emr-and-easyjet-otherejttf-1033106959
554.0,2/27/2024 6:28:59 PM,Get Paid While You Wait: 7 Dividend Aristocrats to Buy Now,InvestorPlace,/news/stocks/get-paid-while-you-wait-7-dividend-aristocrats-to-buy-now-1033109061
555.0,3/4/2024 10:27:27 AM,Emerson Electric Company (EMR) Receives a Buy from Wells Fargo,TipRanks,/news/stocks/emerson-electric-company-emr-receives-a-buy-from-wells-fargo-1033128319
556.0,3/4/2024 10:51:03 AM,"Analysts Offer Insights on Industrial Goods Companies: Chart Industries (GTLS), Emerson Electric Company (EMR) and MasTec (MTZ)",TipRanks,/news/stocks/analysts-offer-insights-on-industrial-goods-companies-chart-industries-gtls-emerson-electric-company-emr-and-mastec-mtz-1033128471
557.0,3/4/2024 11:25:00 AM,Secure Your Future: 7 Dividend Kings with Solid Growth Potential,InvestorPlace,/news/stocks/7-dividend-kings-that-offer-more-than-just-a-pretty-dividend-1033127903
558.0,3/4/2024 3:00:54 PM,The Latest Analyst Ratings For Emerson Electric,Benzinga,/news/stocks/the-latest-analyst-ratings-for-emerson-electric-1033128569
559.0,3/6/2024 2:00:40 PM,Emerson Electric To Rally More Than 19%? Here Are 10 Top Analyst Forecasts For Wednesday,Benzinga,/news/stocks/emerson-electric-to-rally-more-than-19-here-are-10-top-analyst-forecasts-for-wednesday-1033137252
560.0,3/11/2024 9:27:15 AM,Wells Fargo Reaffirms Their Buy Rating on Emerson Electric Company (EMR),TipRanks,/news/stocks/wells-fargo-reaffirms-their-buy-rating-on-emerson-electric-company-emr-1033150592
561.0,3/14/2024 9:40:39 AM,Analysts Offer Insights on Industrial Goods Companies: Rocket Lab USA (RKLB) and Emerson Electric Company (EMR),TipRanks,/news/stocks/analysts-offer-insights-on-industrial-goods-companies-rocket-lab-usa-rklb-and-emerson-electric-company-emr-1033163789
562.0,3/14/2024 12:10:00 PM,Dividend Aristocrats 2024: The Crème de la Crème of Income Investing,InvestorPlace,/news/stocks/dividend-aristocrats-2024-the-creme-de-la-creme-of-income-investing-1033163670
563.0,3/18/2024 9:17:04 AM,Wells Fargo Sticks to Their Buy Rating for Emerson Electric Company (EMR),TipRanks,/news/stocks/wells-fargo-sticks-to-their-buy-rating-for-emerson-electric-company-emr-1033172136
564.0,3/21/2024 4:01:10 PM,Analyst Expectations For Emerson Electric's Future,Benzinga,/news/stocks/analyst-expectations-for-emerson-electric-s-future-1033185558
565.0,3/25/2024 9:47:23 AM,Emerson Electric Company (EMR) Gets a Buy from Wells Fargo,TipRanks,/news/stocks/emerson-electric-company-emr-gets-a-buy-from-wells-fargo-1033193049
566.0,4/2/2024 7:36:44 AM,Barclays Keeps Their Hold Rating on Emerson Electric Company (EMR),TipRanks,/news/stocks/barclays-keeps-their-hold-rating-on-emerson-electric-company-emr-1033214209
567.0,4/3/2024 6:24:14 PM,The Dividend King’s Court: 7 Stocks to Buy for Ultimate Peace of Mind,InvestorPlace,/news/stocks/the-dividend-kings-court-7-stocks-to-buy-for-ultimate-peace-of-mind-1033220201
568.0,4/5/2024 10:18:59 PM,"Gold Shines Above $2,300, Ends Another Week At Record High: Mining Stocks Rally To 11-Month Peak",Benzinga,/news/etf/gold-shines-above-2-300-ends-another-week-at-record-high-mining-stocks-rally-to-11-month-peak-1033226942
569.0,4/8/2024 10:19:01 AM,Wells Fargo Keeps Their Buy Rating on Emerson Electric Company (EMR),TipRanks,/news/stocks/wells-fargo-keeps-their-buy-rating-on-emerson-electric-company-emr-1033229805
570.0,4/9/2024 3:10:29 PM,"Jim Cramer Was Upset At This Hostile Takeover, But 'They Fixed The Situation. Stock's Been A Horse'",Benzinga,/news/stocks/jim-cramer-was-upset-at-this-hostile-takeover-but-they-fixed-the-situation-stock-s-been-a-horse-1033233438
571.0,4/9/2024 5:53:27 PM,Cream of the Crop: The 3 Highest-Rated Dividend Aristocrats to Buy in April,InvestorPlace,/news/stocks/cream-of-the-crop-the-3-highest-rated-dividend-aristocrats-to-buy-in-april-1033234558
572.0,4/15/2024 10:18:22 AM,Wells Fargo Reaffirms Their Buy Rating on Emerson Electric Company (EMR),TipRanks,/news/stocks/wells-fargo-reaffirms-their-buy-rating-on-emerson-electric-company-emr-1033249414
573.0,4/22/2024 10:37:59 AM,Wells Fargo Sticks to Their Buy Rating for Emerson Electric Company (EMR),TipRanks,/news/stocks/wells-fargo-sticks-to-their-buy-rating-for-emerson-electric-company-emr-1033271229
574.0,5/5/2024 12:00:00 PM,"Earnings week ahead: Disney, Palantir, Shopify, Uber, Plug Power and more",Seeking Alpha,https://seekingalpha.com/news/4099576-earnings-week-ahead-disney-palantir-realty-income-shopify-uber-plug-power-and-more?utm_source=businessinsider&utm_medium=referral&feed_item_type=news
575.0,5/7/2024 3:01:13 PM,Emerson Electric is about to announce its earnings — here's what to expect,Markets Insider Automation,/news/stocks/emerson_electric-stock-price-quarter-earnings-preview-q2-1033339383
576.0,5/7/2024 3:17:58 PM,Emerson Electric Q2 2024 Earnings Preview,Seeking Alpha,https://seekingalpha.com/news/4101262-emerson-electric-q1-2024-earnings-preview?utm_source=businessinsider&utm_medium=referral&feed_item_type=news
577.0,5/8/2024 10:58:12 AM,Emerson Electric beats top-line and bottom-line estimates; updates FY24 outlook,Seeking Alpha,https://seekingalpha.com/news/4102251-emerson-electric-beats-top-line-and-bottom-line-estimates-updates-fy24-outlook?utm_source=businessinsider&utm_medium=referral&feed_item_type=news
578.0,5/8/2024 12:47:18 PM,Emerson Electric declares $0.525 dividend,Seeking Alpha,https://seekingalpha.com/news/4102249-emerson-electric-co-declares-0_525-dividend?utm_source=businessinsider&utm_medium=referral&feed_item_type=news
579.0,5/8/2024 1:03:08 PM,"Emerson Electric Co. Q2 Profit Decreases, but beats estimates",RTTNews,/news/stocks/emerson-electric-co-q2-profit-decreases-but-beats-estimates-1033346391
580.0,5/8/2024 1:15:15 PM,Emerson Electric Boosts FY24 Outlook; Declares Dividend - Update ,RTTNews,/news/stocks/emerson-electric-boosts-fy24-outlook-declares-dividend-update-1033346504
581.0,5/8/2024 3:57:59 PM,"EMR Stock Earnings: Emerson Electric Beats EPS, Beats Revenue for Q2 2024",InvestorPlace,/news/stocks/emr-stock-earnings-emerson-electric-for-q2-of-2024-1033349286
582.0,5/8/2024 7:26:22 PM,"Stocks Falter As Fed Signals Need For Higher-For-Longer Rates; Uber Crashes, Energy Sector Loses Ground: What's Driving Wednesday's Market?",Benzinga,/news/stocks/stocks-falter-as-fed-signals-need-for-higher-for-longer-rates-uber-crashes-energy-sector-loses-ground-what-s-driving-wednesday-s-market-1033349663
583.0,5/9/2024 7:27:48 AM,KeyBanc Reaffirms Their Buy Rating on Emerson Electric Company (EMR),TipRanks,/news/stocks/keybanc-reaffirms-their-buy-rating-on-emerson-electric-company-emr-1033355024
584.0,5/9/2024 7:29:39 AM,Barclays Reaffirms Their Hold Rating on Emerson Electric Company (EMR),TipRanks,/news/stocks/barclays-reaffirms-their-hold-rating-on-emerson-electric-company-emr-1033355131
585.0,5/9/2024 9:32:27 AM,"Analysts Offer Insights on Industrial Goods Companies: Emerson Electric Company (EMR), Montrose Environmental Group (MEG) and Louisiana-Pacific (LPX)",TipRanks,/news/stocks/analysts-offer-insights-on-industrial-goods-companies-emerson-electric-company-emr-montrose-environmental-group-meg-and-louisiana-pacific-lpx-1033355788
