Unnamed: 0,datetime,title,source,link
229.0,8/23/2018 10:16:21 PM,General Mills changing Nature Valley labels after lawsuit's pesticide claim,Reuters,http://feeds.reuters.com/~r/reuters/INbusinessNews/~3/C1P8XL1uTwI/general-mills-changing-nature-valley-labels-after-lawsuits-pesticide-claim-idINKCN1L82EH
230.0,8/23/2018 11:25:37 PM,UPDATE 1-General Mills changing Nature Valley labels after lawsuit's pesticide claim,Reuters,http://feeds.reuters.com/~r/reuters/companyNews/~3/SaPfCHAtgPs/update-1-general-mills-changing-nature-valley-labels-after-lawsuits-pesticide-claim-idUSL2N1VE1K1
231.0,9/5/2018 2:11:17 PM,General Mills Reiterates FY19 Outlook - Quick Facts ,RTTNews,/news/stocks/general-mills-reiterates-fy19-outlook-quick-facts-1027509581
232.0,9/17/2018 3:01:16 PM,Here's what Wall Street expects from General Mills's earnings,Markets Insider Automation,/news/stocks/general_mills-stock-quarter-earnings-preview-q1-1027539743
233.0,9/18/2018 1:08:01 PM,General Mills Q1 adjusted earnings of $0.71 per share,RTTNews,/news/stocks/general-mills-q1-adjusted-earnings-of-0-71-per-share-1027542966
234.0,9/18/2018 1:08:27 PM,General Mills quarterly profit drops 3 pct,Reuters,http://feeds.reuters.com/~r/reuters/companyNews/~3/zJk1OJ4uhNs/general-mills-quarterly-profit-drops-3-pct-idUSL3N1W449I
235.0,9/18/2018 2:15:43 PM,"General Mills Q1 Profit Declines, Revenues Miss Estimates; Stock Down ",RTTNews,/news/stocks/general-mills-q1-profit-declines-revenues-miss-estimates-stock-down-1027543442
236.0,10/17/2018 11:41:00 PM,"Matterhorn Merger Sub, LLC -- Moody's places Matterhorn now known as H-Food Holdings (Hearthside) rating on review for downgrade",Moodys,/news/bonds/matterhorn-merger-sub-llc-moody-s-places-matterhorn-now-known-as-h-food-holdings-hearthside-rating-on-review-for-downgrade-1027627337
237.0,12/18/2018 3:01:17 PM,General Mills earnings: here's what Wall Street expects,Markets Insider Automation,/news/stocks/general_mills-stock-quarter-earnings-preview-q2-1027817725
238.0,12/19/2018 1:04:14 PM,General Mills Q2 adjusted earnings Beat Estimates,RTTNews,/news/stocks/general-mills-q2-adjusted-earnings-beat-estimates-1027821157
239.0,12/19/2018 1:11:25 PM,General Mills Reiterates FY19 Outlook - Quick Facts ,RTTNews,/news/stocks/general-mills-reiterates-fy19-outlook-quick-facts-1027821156
240.0,12/19/2018 1:11:56 PM,General Mills quarterly sales rise 5 percent,Reuters,http://feeds.reuters.com/~r/reuters/companyNews/~3/V-9nqD5Uy9k/general-mills-quarterly-sales-rise-5-percent-idUSL3N1YO3J4
241.0,12/19/2018 1:29:15 PM,"UPDATE 1-General Mills reports quarterly profit above estimates, shares rise",Reuters,http://feeds.reuters.com/~r/reuters/companyNews/~3/ALF1l0oZfW0/update-1-general-mills-reports-quarterly-profit-above-estimates-shares-rise-idUSL3N1YO3K8
242.0,12/19/2018 1:33:17 PM,"General Mills reports quarterly profit above estimates, shares rise",Reuters,http://feeds.reuters.com/~r/reuters/businessNews/~3/T0cKAkqW-hM/general-mills-reports-quarterly-profit-above-estimates-shares-rise-idUSKBN1OI1DK
243.0,12/19/2018 2:36:12 PM,"UPDATE 2-General Mills posts quarterly profit above estimates, shares rise",Reuters,http://feeds.reuters.com/~r/reuters/companyNews/~3/k1nas-4kBhQ/update-2-general-mills-posts-quarterly-profit-above-estimates-shares-rise-idUSL3N1YO3K8
244.0,12/19/2018 2:42:43 PM,"General Mills posts quarterly profit above estimates, shares rise",Reuters,http://feeds.reuters.com/~r/reuters/businessNews/~3/CY7YYdzEOFc/general-mills-posts-quarterly-profit-above-estimates-shares-rise-idUSKBN1OI1DK
245.0,12/19/2018 5:28:54 PM,"UPDATE 3-General Mills 2nd-qtr profit jumps on tighter costs,  price hikes",Reuters,http://feeds.reuters.com/~r/reuters/companyNews/~3/mnCnCvUdYjs/update-3-general-mills-2nd-qtr-profit-jumps-on-tighter-costs-price-hikes-idUSL3N1YO3K8
246.0,12/19/2018 5:33:07 PM,"General Mills second-quarter profit jumps on tighter costs, price hikes",Reuters,http://feeds.reuters.com/~r/reuters/businessNews/~3/HGdY0sBC5Fk/general-mills-second-quarter-profit-jumps-on-tighter-costs-price-hikes-idUSKBN1OI1DK
247.0,12/19/2018 9:48:16 PM,General Mills Holding On To Strong Gain In Late-Day Trading ,RTTNews,/news/stocks/general-mills-holding-on-to-strong-gain-in-late-day-trading-1027823086
248.0,1/24/2019 5:36:32 AM,"ADXS Cervical Cancer Trial Put On Hold, GIS Recalls Flour, NCNA, URGN Slump ",RTTNews,/news/stocks/adxs-cervical-cancer-trial-put-on-hold-gis-recalls-flour-ncna-urgn-slump-1027891539
249.0,1/24/2019 5:57:08 PM,General Mills is recalling Gold Medal flour that may have been contaminated with salmonella (GIS),Business Insider,https://www.businessinsider.com/gold-medal-flour-recall-general-mills-salmonella-concerns-2019-1
250.0,1/25/2019 9:31:17 PM,General Mills Recall Gold Medal Flour Due To Salmonella ,RTTNews,/news/stocks/general-mills-recall-gold-medal-flour-due-to-salmonella-1027897573
251.0,2/19/2019 12:58:30 PM,General Mills Reaffirms FY19 Outlook - Quick Facts ,RTTNews,/news/stocks/general-mills-reaffirms-fy19-outlook-quick-facts-1027963148
252.0,3/19/2019 3:01:30 PM,General Mills is about to announce earnings — here's what Wall Street expects,Markets Insider Automation,/news/stocks/general_mills-stock-q3-earnings-preview-1028042026
253.0,3/20/2019 12:07:57 PM,General Mills Q3 adjusted earnings Beat Estimates,RTTNews,/news/stocks/general-mills-q3-adjusted-earnings-beat-estimates-1028044758
254.0,3/20/2019 12:10:31 PM,"General Mills quarterly sales rise, lifts full-year profit forecast",Reuters,http://feeds.reuters.com/~r/reuters/companyNews/~3/IRH3EpVofEs/general-mills-quarterly-sales-rise-lifts-full-year-profit-forecast-idUSL3N2172ON
255.0,3/20/2019 12:16:40 PM,General Mills Now Expects FY19 Adj. EPS To Exceed Initial Targets - Quick Facts ,RTTNews,/news/stocks/general-mills-now-expects-fy19-adj-eps-to-exceed-initial-targets-quick-facts-1028044802
256.0,3/20/2019 12:37:25 PM,"General Mills lifts profit view on cost cuts, price hikes; shares rise 6 percent",Reuters,http://feeds.reuters.com/~r/reuters/businessNews/~3/A6TcCFYWwW8/general-mills-lifts-profit-view-on-cost-cuts-price-hikes-shares-rise-6-percent-idUSKCN1R118A
257.0,3/20/2019 2:01:33 PM,"Price hikes drive General Mills profit beat, forecast raise; shares jump",Reuters,http://feeds.reuters.com/~r/reuters/businessNews/~3/MNezMcUKpc8/price-hikes-drive-general-mills-profit-beat-forecast-raise-shares-jump-idUSKCN1R118A
258.0,3/20/2019 4:16:47 PM,"Price hikes drive General Mills profit beat, forecast raise",Reuters,http://feeds.reuters.com/~r/reuters/businessNews/~3/mXyA2jcsneQ/price-hikes-drive-general-mills-profit-beat-forecast-raise-idUSKCN1R118A
259.0,5/9/2019 10:09:00 PM,"General Mills Canada, Inc. -- Moody's announces completion of a periodic review of ratings of General Mills, Inc.",Moodys,/news/bonds/general-mills-canada-inc-moody-s-announces-completion-of-a-periodic-review-of-ratings-of-general-mills-inc-1028187997
260.0,5/17/2019 3:14:05 PM,General Mills Meets DOE's Energy Efficiency Goal Four Years Ahead Of Schedule ,RTTNews,/news/stocks/general-mills-meets-doe-s-energy-efficiency-goal-four-years-ahead-of-schedule-1028211087
261.0,6/5/2019 12:32:43 PM,"3 Big Stock Charts for Wednesday: eBay, General Mills and Intel",InvestorPlace,/news/stocks/3-big-stock-charts-for-wednesday-ebay-general-mills-and-intel-1028258514
262.0,6/12/2019 7:08:45 PM,Cereal Study 2019: Monsanto’s Weed Killer Roundup Still in Cheerios,InvestorPlace,/news/stocks/cereal-study-1028275492
263.0,6/24/2019 3:01:17 PM,General Mills is about to announce earnings — here's what Wall Street expects,Markets Insider Automation,/news/stocks/general_mills-stock-q4-earnings-preview-1028301923
264.0,6/24/2019 4:18:59 PM,10 Best S&P 500 Stocks to Buy For the Rest of 2019,InvestorPlace,/news/stocks/10-best-sp-500-stocks-to-buy-for-the-rest-of-2019-1028303875
265.0,6/26/2019 1:09:08 PM,General Mills misses quarterly sales estimates,Reuters,http://feeds.reuters.com/~r/reuters/companyNews/~3/seI6KGXHrzw/general-mills-misses-quarterly-sales-estimates-idUSL4N23X2QN
266.0,6/26/2019 1:11:34 PM,General Mills Q4 adjusted earnings Beat Estimates,RTTNews,/news/stocks/general-mills-q4-adjusted-earnings-beat-estimates-1028309118
267.0,6/26/2019 1:23:38 PM,General Mills Outlines FY20 Targets - Quick Facts ,RTTNews,/news/stocks/general-mills-outlines-fy20-targets-quick-facts-1028309162
268.0,6/26/2019 3:09:35 PM,"General Mills quarterly sales hit by lower snacks demand, shares fall",Reuters,http://feeds.reuters.com/~r/reuters/businessNews/~3/XaRd64qgWQA/general-mills-quarterly-sales-hit-by-lower-snacks-demand-shares-fall-idUSKCN1TR1HD
269.0,6/26/2019 4:00:52 PM,General Mills Earnings: GIS Stock Slides on Q4 Results,InvestorPlace,/news/stocks/general-mills-earnings-drop-gis-stock-1028312009
270.0,6/26/2019 5:50:50 PM,"General Mills sales hit by low demand for Nature Valley, Fiber One bars",Reuters,http://feeds.reuters.com/~r/reuters/businessNews/~3/n6kYmm5FzhA/general-mills-sales-hit-by-low-demand-for-nature-valley-fiber-one-bars-idUSKCN1TR1HD
271.0,6/26/2019 6:09:05 PM,Cheerios maker General Mills shares sink after sales miss the mark (GIS),Business Insider,https://markets.businessinsider.com/news/stocks/general-mills-stock-reaction-to-q4-earnings-revenue-falls-short-2019-6-1028310859
272.0,8/12/2019 12:40:02 PM,7 S&P 500 Dividend Stocks to Buy With Yields of at Least  3%,InvestorPlace,/news/stocks/7-sp-500-dividend-stocks-to-buy-at-least-yielding-3-1028262333
273.0,8/20/2019 1:57:49 PM,Why Apple Stock May Be Peaking Again,InvestorPlace,/news/stocks/apple-stock-aapl-stock-peaking-1028461480
274.0,8/20/2019 2:41:19 PM,General Mills: Kofi Bruce To Succeed Don Mulligan As CFO - Quick Facts ,RTTNews,/news/stocks/general-mills-kofi-bruce-to-succeed-don-mulligan-as-cfo-quick-facts-1028459354
275.0,8/29/2019 7:50:26 PM,5 All-Weather ETFs to Buy for Turbulent Markets,InvestorPlace,/news/stocks/5-all-weather-etfs-to-buy-for-turbulent-markets-1028486380
276.0,9/17/2019 10:03:39 AM,General Mills Recalls Gold Medal Flour For E. Coli Concerns ,RTTNews,/news/stocks/general-mills-recalls-gold-medal-flour-for-e-coli-concerns-1028529150
277.0,9/17/2019 3:01:17 PM,General Mills earnings preview: what Wall Street is expecting,Markets Insider Automation,/news/stocks/general_mills-q1-earnings-preview-1028530339
278.0,9/18/2019 1:05:57 PM,General Mills Q1 adjusted earnings Beat Estimates,RTTNews,/news/stocks/general-mills-q1-adjusted-earnings-beat-estimates-1028533468
279.0,9/18/2019 1:07:32 PM,General Mills misses quarterly sales estimate,Reuters,http://feeds.reuters.com/~r/reuters/companyNews/~3/9daPmIqY8zo/general-mills-misses-quarterly-sales-estimate-idUSL3N2692ML
280.0,9/18/2019 1:28:25 PM,"General Mills Q1 Profit Tops Estimates, Organic Sales Down 1% - Quick Facts ",RTTNews,/news/stocks/general-mills-q1-profit-tops-estimates-organic-sales-down-1-quick-facts-1028533556
281.0,9/18/2019 1:31:27 PM,"UPDATE 1-General Mills misses quarterly sales estimate, shares fall",Reuters,http://feeds.reuters.com/~r/reuters/companyNews/~3/5njkKF0yevU/update-1-general-mills-misses-quarterly-sales-estimate-shares-fall-idUSL3N2692N4
282.0,9/18/2019 4:51:21 PM,"UPDATE 2-Weak snacks demand, international challenges hit General Mills sales",Reuters,http://feeds.reuters.com/~r/reuters/companyNews/~3/fHnpht98i2s/update-2-weak-snacks-demand-international-challenges-hit-general-mills-sales-idUSL3N2692N4
283.0,9/18/2019 6:13:53 PM,Gold Medal Flour Recall 2019: 5-Pound Bags May Contain E. Coli,InvestorPlace,/news/stocks/gold-medal-flour-recall-2019-details-1028536154
284.0,9/18/2019 8:36:07 PM,Stock Market Today: Federal Reserve Cuts Rates; Roku Tumbles,InvestorPlace,/news/stocks/stock-market-today-federal-reserve-cuts-rates-roku-tumbles-1028536145
285.0,9/24/2019 3:30:35 PM,10 Wonderful Companies Whose Valuations Aren’t Quite Fair,InvestorPlace,/news/stocks/10-wonderful-companies-whose-valuations-arent-quite-fair-1028550801
286.0,10/9/2019 11:15:46 AM,"3 Big Stock Charts for Wednesday: General Mills, Eli Lilly and Hartford Financial Services",InvestorPlace,/news/stocks/3-big-stock-charts-for-wednesday-general-mills-eli-lilly-and-hartford-financial-services-1028588734
287.0,10/18/2019 3:30:03 PM,3 Earnings Reports to Watch Next Week,InvestorPlace,/news/stocks/earnings-reports-to-watch-next-week-earnings-calendar-1028224242
288.0,10/24/2019 6:55:59 PM,K Stock Set to Gain If Kellogg Earnings Cooperate,InvestorPlace,/news/stocks/k-stock-gain-kellogg-earnings-cooperate-1028629303
289.0,10/28/2019 11:47:27 AM,"3 Big Stock Charts for Monday: Coca-Cola, L Brands, and General Mills",InvestorPlace,/news/stocks/3-big-stock-charts-monday-coca-cola-l-brands-general-mills-1028635348
290.0,10/29/2019 5:28:44 PM,7 Dividend Stocks That Could Struggle to Continue Payout Hikes,InvestorPlace,/news/stocks/7-dividend-stocks-payout-hikes-1028641102
291.0,11/7/2019 7:25:50 PM,3 Consumer Stocks with Safe Dividends,InvestorPlace,/news/stocks/3-consumer-stocks-with-safe-dividends-1028671211
292.0,11/14/2019 7:53:31 PM,7 Earnings Reports to Watch Next Week,InvestorPlace,/news/stocks/7-earnings-reports-to-watch-1028629299
293.0,11/18/2019 4:39:09 PM,9 Tantalizing Dividend Stocks for 2020,InvestorPlace,/news/stocks/9-tantalizing-dividend-stocks-for-2020-1028697526
294.0,11/18/2019 7:06:54 PM,Fill Your Bellies and Your Portfolios With These 8 Thanksgiving Stocks,InvestorPlace,/news/stocks/fill-your-bellies-and-your-portfolios-with-these-8-thanksgiving-stocks-1028697799
295.0,11/19/2019 1:20:10 PM,Avoid Beyond Meat Stock and the Rising Fake Meat Market,InvestorPlace,/news/stocks/avoid-beyond-meat-stock-and-all-fake-meat-1028700887
296.0,12/5/2019 12:19:06 PM,"3 Big Stock Charts for Thursday: Diamondback Energy, Mondelez, and Varian Medical",InvestorPlace,/news/stocks/3-big-stock-charts-for-thursday-diamondback-energy-mondelez-and-varian-medical-1028740639
297.0,12/13/2019 12:20:30 PM,"3 Big Stock Charts for Friday: J.M. Smucker, Ralph Lauren, and UDR",InvestorPlace,/news/stocks/3-big-stock-charts-for-friday-j-m-smucker-ralph-lauren-and-udr-1028762059
298.0,12/17/2019 11:05:37 AM,10 Small-Cap Stocks to Buy Before They Grow Up,InvestorPlace,/news/stocks/10-small-cap-stocks-to-buy-before-they-grow-up-1028395852
299.0,12/17/2019 3:01:15 PM,What Wall Street expects from General Mills's earnings,Markets Insider Automation,/news/stocks/general_mills-q2-quarterly-earnings-preview-1028768919
300.0,12/18/2019 1:04:53 PM,General Mills Q2 adjusted earnings Beat Estimates,RTTNews,/news/stocks/general-mills-q2-adjusted-earnings-beat-estimates-1028771807
301.0,12/18/2019 1:11:54 PM,General Mills misses quarterly sales estimates,Reuters,http://feeds.reuters.com/~r/reuters/companyNews/~3/fI208sMAPhE/general-mills-misses-quarterly-sales-estimates-idUSL4N28S2WI
302.0,12/18/2019 1:23:45 PM,"General Mills Q2 Profit Beats Estimates, Organic Sales Up 1%; Affirms Outlook ",RTTNews,/news/stocks/general-mills-q2-profit-beats-estimates-organic-sales-up-1-affirms-outlook-1028771899
303.0,12/18/2019 3:31:47 PM,General Mills Inc reports results for the quarter ended in November - Earnings Summary,Reuters,http://feeds.reuters.com/~r/reuters/companyNews/~3/gc0GDqiKtEo/general-mills-inc-reports-results-for-the-quarter-ended-in-november-earnings-summary-idUSL8N28S473
304.0,12/18/2019 7:29:53 PM,General Mills Earnings: GIS Stock Ticks 1% Higher on Q2 Beat,InvestorPlace,/news/stocks/general-mills-earnings-lift-gis-stock-up-1028773728
305.0,12/19/2019 8:49:06 PM,"4 Top Stock Trades for Friday: TSLA, RAD, GIS, MED",InvestorPlace,/news/stocks/4-top-stock-trades-for-friday-tsla-rad-gis-med-1028777293
306.0,12/19/2019 9:14:44 PM,Stock Market Today: Did Micron Lead a Bottom in Memory Stocks? ,InvestorPlace,/news/stocks/stock-market-today-did-micron-lead-a-bottom-in-memory-stocks-1028777574
307.0,12/26/2019 1:12:38 PM,"3 Big Stock Charts for Thursday: Boeing, General Mills, and Levi Strauss",InvestorPlace,/news/stocks/3-big-stock-charts-for-thursday-boeing-general-mills-and-levi-strauss-1028785014
308.0,1/2/2020 11:01:59 AM,Stock To Watch - General Mills ,RTTNews,/news/stocks/stock-to-watch-general-mills-1028790925
309.0,1/8/2020 10:50:00 PM,"General Mills, Inc. -- Moody's assigns Baa2 to General Mills €600 million notes offering",Moodys,/news/bonds/general-mills-inc-moody-s-assigns-baa2-to-general-mills-600-million-notes-offering-1028804517
310.0,1/16/2020 11:03:04 PM,A plant-based seafood startup just got a big boost from one of America's biggest and oldest food companies (GIS),Business Insider,https://www.businessinsider.com/general-mills-gathered-foods-good-catch-plant-based-seafood-2020-1
311.0,1/27/2020 5:18:04 PM,This online dashboard tracks the spread of the Wuhan coronavirus across the globe in real time,Business Insider,https://www.businessinsider.com/wuhan-coronavirus-outbreak-spread-tracked-in-johns-hopkins-dashboard-2020-1
312.0,2/14/2020 7:10:34 PM,"Up 900%, Teladoc Stock Still Has Tremendous Upside Ahead",InvestorPlace,/news/stocks/teladoc-health-tdoc-stock-still-has-tremendous-upside-1028907796
313.0,2/18/2020 1:05:02 PM,General Mills Reaffirms FY20 Outlook; Says Unable To Quantify Coronavirus Impact ,RTTNews,/news/stocks/general-mills-reaffirms-fy20-outlook-says-unable-to-quantify-coronavirus-impact-1028913078
314.0,2/20/2020 1:29:15 PM,Kraft Heinz Stock Is a Value Trap That Could Fall Further,InvestorPlace,/news/stocks/value-trap-khc-stock-could-fall-further-1028924389
315.0,3/2/2020 6:18:57 PM,Food stocks bid up after weekend rush at big retailers,Seeking Alpha,https://seekingalpha.com/news/3547609-food-stocks-bid-up-after-weekend-rush-big-retailers?utm_source=markets.businessinsider.com&utm_medium=referral
316.0,3/10/2020 5:06:36 PM,Retailers that are winning amid the coronavirus outbreak,Seeking Alpha,https://seekingalpha.com/news/3550232-retailers-are-winning-amid-coronavirus-outbreak?utm_source=markets.businessinsider.com&utm_medium=referral
317.0,3/11/2020 10:00:44 AM,Beyond Meat Stock Is a Buy … If Fake Meat Isn’t a Fad,InvestorPlace,/news/stocks/beyond-meat-stock-is-a-buy-if-fake-meat-isnt-a-fad-1028984705
318.0,3/12/2020 3:31:40 PM,Campbell Soup Company Stock Is a Tasty Coronavirus Remedy,InvestorPlace,/news/stocks/campbell-soup-company-stock-is-a-tasty-coronavirus-remedy-1028990967
319.0,3/15/2020 9:46:19 AM,Grocers are struggling to keep up with demand - WSJ,Seeking Alpha,https://seekingalpha.com/news/3551796-grocers-are-struggling-to-keep-up-demand-wsj?utm_source=markets.businessinsider.com&utm_medium=referral
320.0,3/17/2020 2:39:01 PM,Everyone-must-eat rally takes hold,Seeking Alpha,https://seekingalpha.com/news/3552535-everyone-must-eat-rally-takes-hold?utm_source=markets.businessinsider.com&utm_medium=referral
321.0,3/17/2020 3:35:39 PM,3 Stocks to Buy as Americans Prepare For Coronavirus Shutdowns,InvestorPlace,/news/stocks/3-stocks-buy-americans-stockpile-1029005260
322.0,3/17/2020 9:30:07 PM,General Mills Q3 2020 Earnings Preview,Seeking Alpha,https://seekingalpha.com/news/3552620-general-mills-q3-2020-earnings-preview?utm_source=markets.businessinsider.com&utm_medium=referral
323.0,3/17/2020 9:30:12 PM,Notable earnings before Wednesday's open,Seeking Alpha,https://seekingalpha.com/news/3552501-notable-earnings-wednesdays-open?utm_source=markets.businessinsider.com&utm_medium=referral
324.0,3/18/2020 11:02:35 AM,"General Mills EPS beats by $0.01, misses on revenue",Seeking Alpha,https://seekingalpha.com/news/3552815-general-mills-eps-beats-0_01-misses-on-revenue?utm_source=markets.businessinsider.com&utm_medium=referral
325.0,3/18/2020 12:06:21 PM,General Mills Q3 adjusted earnings Beat Estimates,RTTNews,/news/stocks/general-mills-q3-adjusted-earnings-beat-estimates-1029007722
326.0,3/18/2020 12:17:15 PM,General Mills raises adjusted profit forecast on coronavirus-driven demand,Reuters,http://feeds.reuters.com/~r/reuters/companyNews/~3/_JSL_zlxjsk/general-mills-raises-adjusted-profit-forecast-on-coronavirus-driven-demand-idUSL4N2BB3H1
327.0,3/18/2020 12:31:53 PM,General Mills Raises FY20 Earnings Targets - Quick Facts ,RTTNews,/news/stocks/general-mills-raises-fy20-earnings-targets-quick-facts-1029007858
328.0,3/18/2020 12:44:39 PM,UPDATE 1-General Mills raises adjusted profit outlook on virus-driven demand,Reuters,http://feeds.reuters.com/~r/reuters/companyNews/~3/VFG2Mh2mgrA/update-1-general-mills-raises-adjusted-profit-outlook-on-virus-driven-demand-idUSL4N2BB3IP
329.0,3/18/2020 3:49:32 PM,UPDATE 2-Cheerios maker General Mills forecasts coronavirus boost to profit,Reuters,http://feeds.reuters.com/~r/reuters/companyNews/~3/hX-wlC23fWI/update-2-cheerios-maker-general-mills-forecasts-coronavirus-boost-to-profit-idUSL4N2BB3IP
330.0,3/18/2020 6:52:22 PM,General Mills Earnings: GIS Stock Slumps on Mixed Q3,InvestorPlace,/news/stocks/general-mills-earnings-gis-stock-slumps-mixed-q3-1029010147
331.0,3/26/2020 6:56:05 PM,Restaurant and food stocks break higher,Seeking Alpha,https://seekingalpha.com/news/3555603-restaurant-and-food-stocks-break-higher?utm_source=markets.businessinsider.com&utm_medium=referral
332.0,3/27/2020 2:52:15 PM,Invest in America’s Most Trusted Brands With These 7 Stocks to Buy,InvestorPlace,/news/stocks/invest-in-americas-most-trusted-brands-with-these-7-stocks-to-buy-1028841376
333.0,4/1/2020 3:55:35 PM,General Mills Offers Daily Bonus For Plant Employees - Quick Facts ,RTTNews,/news/stocks/general-mills-offers-daily-bonus-for-plant-employees-quick-facts-1029054974
334.0,4/13/2020 5:56:00 PM,"General Mills Canada, Inc. -- Moody's announces completion of a periodic review of ratings of General Mills, Inc.",Moodys,/news/bonds/general-mills-canada-inc-moody-s-announces-completion-of-a-periodic-review-of-ratings-of-general-mills-inc-1029086349
335.0,4/15/2020 5:43:38 PM,General Mills and Campbell Soup expected to stay hot,Seeking Alpha,https://seekingalpha.com/news/3560987-general-mills-and-campbell-soup-expected-to-stay-hot?utm_source=markets.businessinsider.com&utm_medium=referral
336.0,4/22/2020 9:39:00 AM,Stock Alert: General Mills Still In Demand ,RTTNews,/news/stocks/stock-alert-general-mills-still-in-demand-1029116200
337.0,4/29/2020 3:12:38 PM,Investors move past stockpiling bets,Seeking Alpha,https://seekingalpha.com/news/3566105-investors-move-past-stockpiling-bets?utm_source=markets.businessinsider.com&utm_medium=referral
338.0,5/11/2020 2:17:41 PM,"General Mills Raises Q4, FY20 Outlook - Quick Facts ",RTTNews,/news/stocks/general-mills-raises-q4-fy20-outlook-quick-facts-1029187203
339.0,5/11/2020 3:19:22 PM,General Mills sees sales bump from surge in stay-at-home orders,Reuters,http://feeds.reuters.com/~r/reuters/companyNews/~3/cnFks-Fz6x4/general-mills-sees-sales-bump-from-surge-in-stay-at-home-orders-idUSL4N2CT36W
340.0,5/12/2020 8:21:00 PM,Stock Market Today: Grubhub Soars on Uber Rumors; Disney Plans to Reopen,InvestorPlace,/news/stocks/stock-market-today-grubhub-soars-on-uber-rumors-disney-plans-to-reopen-1029194491
341.0,5/21/2020 3:38:19 PM,Investors lose their appetite for food stocks,Seeking Alpha,https://seekingalpha.com/news/3576842-investors-lose-appetite-for-food-stocks?utm_source=markets.businessinsider.com&utm_medium=referral
342.0,5/28/2020 11:45:42 AM,7 Top-Tier Dividend Stocks for 2020,InvestorPlace,/news/stocks/7-top-tier-dividend-stocks-for-2020-1028780175
343.0,5/29/2020 5:01:38 PM,The InvestorPlace Q&A: ProShares Pet Care ETF Is a Treat for Investors,InvestorPlace,/news/stocks/the-investorplace-qa-proshares-pet-care-etf-is-a-treat-for-investors-1029264404
344.0,6/9/2020 11:00:56 AM,Why General Mills Got a Massive Boost During the Coronavirus Crisis,InvestorPlace,/news/stocks/why-gis-stock-got-a-massive-boost-during-the-coronavirus-crisis-1029292431
345.0,6/10/2020 5:49:27 PM,Don’t Overpay for Safety With General Mills,InvestorPlace,/news/stocks/dont-overpay-for-safety-with-general-mills-1029298246
346.0,6/18/2020 2:10:27 PM,These 7 Pet Care Stocks Will Reduce the Cost of Pet Ownership,InvestorPlace,/news/stocks/these-7-pet-care-stocks-will-reduce-the-cost-of-pet-ownership-1029322420
347.0,6/30/2020 3:59:38 AM,9 Food Stocks to Stuff Your Portfolio,InvestorPlace,/news/stocks/9-of-the-best-food-stocks-to-buy-right-now-1029032220
348.0,6/30/2020 3:01:28 PM,General Mills earnings preview: what Wall Street is expecting,Markets Insider Automation,/news/stocks/general_mills-quarter-earnings-preview-q4-1029354128
349.0,7/1/2020 1:13:46 PM,General Mills Q4 adjusted earnings Beat Estimates,RTTNews,/news/stocks/general-mills-q4-adjusted-earnings-beat-estimates-1029358486
350.0,7/1/2020 1:45:00 PM,General Mills Q4 Profit Tops Estimates; Organic Net Sales Up 16% ,RTTNews,/news/stocks/general-mills-q4-profit-tops-estimates-organic-net-sales-up-16-1029358585
351.0,7/1/2020 6:33:00 PM,General Mills Earnings: GIS Stock Dips 2% Despite Q4 Beats,InvestorPlace,/news/stocks/general-mills-earnings-dip-gi-stock-1029360590
352.0,7/8/2020 2:57:25 PM,7 Delicious Food ETFs to Buy Now,InvestorPlace,/news/stocks/there-arent-many-food-etfs-but-here-are-a-few-to-consider-1029377650
353.0,7/28/2020 6:23:45 PM,9 Stocks for Beginners to Buy to Start Their Investing Experience,InvestorPlace,/news/stocks/9-stocks-for-beginners-to-buy-to-start-their-investing-experience-1029440756
354.0,8/31/2020 5:44:15 PM,7 Hot Food Stocks to Buy for Tasty Returns,InvestorPlace,/news/stocks/7-hot-food-stocks-to-buy-for-tasty-returns-1029549619
355.0,9/8/2020 2:12:40 PM,General Mills Issues Business Update - Quick Facts ,RTTNews,/news/stocks/general-mills-issues-business-update-quick-facts-1029569279
356.0,9/15/2020 2:36:30 PM,General Mills Launches Keto Friendly Line Of Products - Quick Facts ,RTTNews,/news/stocks/general-mills-launches-keto-friendly-line-of-products-quick-facts-1029590118
357.0,9/22/2020 3:01:20 PM,General Mills earnings preview: what Wall Street is expecting,Markets Insider Automation,/news/stocks/general_mills-quarter-earnings-preview-q1-1029611036
