Unnamed: 0,datetime,title,source,link
728.0,11/6/2023 2:48:56 PM,These 3 Defensive Stocks Delivering High-Dividend Yields Are Recommended By Wall Street's Most Accurate Analysts,Benzinga,/news/stocks/these-3-defensive-stocks-delivering-high-dividend-yields-are-recommended-by-wall-street-s-most-accurate-analysts-1032781839
729.0,11/9/2023 2:10:38 PM,General Mills Announces Acquisition Of Fera Pets - Quick Facts ,RTTNews,/news/stocks/general-mills-announces-acquisition-of-fera-pets-quick-facts-1032800506
730.0,11/14/2023 2:42:45 PM,3 Blue-Chip Stocks to Buy for Safety Amid the Volatility,InvestorPlace,/news/stocks/3-blue-chip-stocks-for-market-volatility-1032818171
731.0,11/16/2023 11:35:27 PM,Hold Rating for General Mills Amidst Increased Promotions and Rising Labor Costs,TipRanks,/news/stocks/hold-rating-for-general-mills-amidst-increased-promotions-and-rising-labor-costs-1032830839
732.0,12/11/2023 6:00:20 PM,Evercore ISI Group Maintains In-Line Rating for General Mills: Here's What You Need To Know,Benzinga,/news/stocks/evercore-isi-group-maintains-in-line-rating-for-general-mills-here-s-what-you-need-to-know-1032890471
733.0,12/11/2023 6:00:47 PM,Expert Ratings for General Mills,Benzinga,/news/stocks/expert-ratings-for-general-mills-1032890464
734.0,12/12/2023 11:45:33 PM,General Mills: Hold Rating Justified by Volume Concerns and Mixed Sales Channel Performance,TipRanks,/news/stocks/general-mills-hold-rating-justified-by-volume-concerns-and-mixed-sales-channel-performance-1032896589
735.0,12/13/2023 11:19:11 AM,TD Cowen Reaffirms Their Hold Rating on General Mills (GIS),TipRanks,/news/stocks/td-cowen-reaffirms-their-hold-rating-on-general-mills-gis-1032898961
736.0,12/15/2023 12:36:52 PM,Piper Sandler Reaffirms Their Buy Rating on General Mills (GIS),TipRanks,/news/stocks/piper-sandler-reaffirms-their-buy-rating-on-general-mills-gis-1032906264
737.0,12/18/2023 11:00:16 AM,Wall Street Analysts Are Neutral on Top Consumer Goods Picks,TipRanks,/news/stocks/wall-street-analysts-are-neutral-on-top-consumer-goods-picks-1032910547
738.0,12/18/2023 12:15:34 PM,RBC Capital Sticks to Their Hold Rating for General Mills (GIS),TipRanks,/news/stocks/rbc-capital-sticks-to-their-hold-rating-for-general-mills-gis-1032910591
739.0,12/19/2023 3:01:13 PM,General Mills earnings: here's what Wall Street expects,Markets Insider Automation,/news/stocks/general_mills-stock-price-q2-earnings-preview-1032912454
740.0,12/19/2023 7:03:22 PM,General Mills Gears Up For Q2 Print; Here's A Look At Recent Price Target Changes By The Most Accurate Analysts,Benzinga,/news/stocks/general-mills-gears-up-for-q2-print-here-s-a-look-at-recent-price-target-changes-by-the-most-accurate-analysts-1032913722
741.0,12/20/2023 11:00:28 AM,"FedEx, General Mills And 3 Stocks To Watch Heading Into Wednesday",Benzinga,/news/stocks/fedex-general-mills-and-3-stocks-to-watch-heading-into-wednesday-1032915383
742.0,12/20/2023 1:05:26 PM,General Mills Q2 Profit Beats Estimates,RTTNews,/news/stocks/general-mills-q2-profit-beats-estimates-1032915651
743.0,12/20/2023 5:51:34 PM,"GIS Stock Earnings: General Mills Beats EPS, Misses Revenue for Q2 2024",InvestorPlace,/news/stocks/gis-stock-earnings-general-mills-for-q2-of-2024-1032917113
744.0,12/20/2023 8:24:47 PM,S&P 500 Edges Lower; General Mills Cuts Sales Forecast,Benzinga,/news/stocks/s-p-500-edges-lower-general-mills-cuts-sales-forecast-1032917266
745.0,12/20/2023 9:07:48 PM,General Mills Stock (NYSE:GIS): Don’t Get Hung Up on Its Dour Outlook,TipRanks,/news/stocks/general-mills-stock-nyse-gis-don-t-get-hung-up-on-its-dour-outlook-1032918505
746.0,12/20/2023 9:35:31 PM,General Mills Hold Rating Justified by Revenue Growth Concerns and Segment Pressures,TipRanks,/news/stocks/general-mills-hold-rating-justified-by-revenue-growth-concerns-and-segment-pressures-1032918564
747.0,12/20/2023 11:35:35 PM,Maintaining Neutral on General Mills: A Hold Rating with Modest Price Target Adjustment,TipRanks,/news/stocks/maintaining-neutral-on-general-mills-a-hold-rating-with-modest-price-target-adjustment-1032918822
748.0,12/21/2023 10:56:39 AM,General Mills: Hold Rating Maintained Amidst Revenue Guidance Recalibration and Margin Improvement Efforts,TipRanks,/news/stocks/general-mills-hold-rating-maintained-amidst-revenue-guidance-recalibration-and-margin-improvement-efforts-1032920753
749.0,12/21/2023 11:46:39 AM,"General Mills Struggles with Market Position and Growth, Earning a Sell Rating from Analyst Pamela Kaufman",TipRanks,/news/stocks/general-mills-struggles-with-market-position-and-growth-earning-a-sell-rating-from-analyst-pamela-kaufman-1032920796
750.0,12/21/2023 11:56:06 AM,General Mills: Balancing Near-Term Challenges with Long-Term Resilience,TipRanks,/news/stocks/general-mills-balancing-near-term-challenges-with-long-term-resilience-1032920792
751.0,12/21/2023 11:57:41 AM,General Mills (GIS) Gets a Hold from RBC Capital,TipRanks,/news/stocks/general-mills-gis-gets-a-hold-from-rbc-capital-1032920809
752.0,12/21/2023 11:57:48 AM,Goldman Sachs Keeps Their Sell Rating on General Mills (GIS),TipRanks,/news/stocks/goldman-sachs-keeps-their-sell-rating-on-general-mills-gis-1032920807
753.0,12/22/2023 8:02:42 PM,General Mills Has Limited Upside Amid Consumer Value Seeking and Soft Pet Segment Performance: Analyst,Benzinga,/news/stocks/general-mills-has-limited-upside-amid-consumer-value-seeking-and-soft-pet-segment-performance-analyst-1032923163
754.0,12/30/2023 2:00:00 PM,Consumer Staples Sector Outlook: 3 Major Shifts Anticipated in 2024,InvestorPlace,/news/stocks/consumer-staples-sector-outlook-3-major-shifts-anticipated-in-2024-1032933514
755.0,1/3/2024 6:47:03 PM,7 Most Undervalued Stocks to Buy Now,InvestorPlace,/news/stocks/undervalued-stocks-1031609433
756.0,1/5/2024 11:05:50 AM,General Mills: Hold Rating with a Focus on Strategic M&A and Challenges in Pet Segment,TipRanks,/news/stocks/general-mills-hold-rating-with-a-focus-on-strategic-m-a-and-challenges-in-pet-segment-1032947220
757.0,1/15/2024 9:32:08 PM,3 Top Dividend Stocks to Eat Up in 2024,InvestorPlace,/news/stocks/3-top-dividend-stocks-to-eat-up-in-2024-1032968436
758.0,1/31/2024 6:44:44 PM,3 Consumer Goods Stocks Defying Market Expectations,InvestorPlace,/news/stocks/3-consumer-goods-stocks-defying-market-expectations-1033016796
759.0,2/8/2024 9:18:02 AM,"General Mills Reshapes Leadership, Nudi Gains Expanded Role",TipRanks,/news/stocks/general-mills-reshapes-leadership-nudi-gains-expanded-role-1033045879
760.0,2/20/2024 1:49:21 PM,General Mills Backs FY24 Outlook; Says Confident In Accelerate Strategy ,RTTNews,/news/stocks/general-mills-backs-fy24-outlook-says-confident-in-accelerate-strategy-1033082885
761.0,2/20/2024 3:29:08 PM,Walmart rattles the retail sector by saying deflation trends slowed in Q4,Seeking Alpha,https://seekingalpha.com/news/4068923-walmart-rattles-the-retail-sector-by-saying-deflation-trends-slowed-in-q4?utm_source=businessinsider&utm_medium=referral&feed_item_type=news
762.0,2/21/2024 11:52:50 AM,Barclays Sticks to Their Hold Rating for General Mills (GIS),TipRanks,/news/stocks/barclays-sticks-to-their-hold-rating-for-general-mills-gis-1033088177
763.0,2/27/2024 11:01:14 AM,General Mills (GIS) Receives a Hold from Wells Fargo,TipRanks,/news/stocks/general-mills-gis-receives-a-hold-from-wells-fargo-1033107703
764.0,2/29/2024 6:00:00 PM,Sleep Well With These 3 Consumer Staples Stocks,InvestorPlace,/news/stocks/sleep-well-with-these-3-consumer-staples-stocks-1033120136
765.0,3/14/2024 9:15:19 AM,General Mills Hold Rating Maintained Amid Volume Pressures and Brand Challenges,TipRanks,/news/stocks/general-mills-hold-rating-maintained-amid-volume-pressures-and-brand-challenges-1033163700
766.0,3/15/2024 10:50:22 AM,Analysts Offer Insights on Consumer Goods Companies: General Mills (GIS) and The Hershey Company (HSY),TipRanks,/news/stocks/analysts-offer-insights-on-consumer-goods-companies-general-mills-gis-and-the-hershey-company-hsy-1033168239
767.0,3/15/2024 7:16:36 PM,"Catalyst Watch: Fed rates meeting, Nvidia CEO speaks at GTC 2024, Reddit IPO",Seeking Alpha,https://seekingalpha.com/news/4079763-catalsyt-watch?utm_source=businessinsider&utm_medium=referral&feed_item_type=news
768.0,3/17/2024 12:20:00 PM,"Earnings week ahead: FedEx, Nike, XPeng, Tencent, General Mills and more",Seeking Alpha,https://seekingalpha.com/news/4080035-earnings-week-ahead-fedex-nike-xpeng-tencent-general-mills-and-more?utm_source=businessinsider&utm_medium=referral&feed_item_type=news
769.0,3/19/2024 10:45:08 AM,General Mills (GIS) Receives a Hold from RBC Capital,TipRanks,/news/stocks/general-mills-gis-receives-a-hold-from-rbc-capital-1033176704
770.0,3/19/2024 2:26:14 PM,Notable earnings before Wednesday's open,Seeking Alpha,https://seekingalpha.com/news/4081249-notable-earnings-before-wednesdays-open?utm_source=businessinsider&utm_medium=referral&feed_item_type=news
771.0,3/19/2024 5:51:39 PM,General Mills Q3 2024 Earnings Preview,Seeking Alpha,https://seekingalpha.com/news/4081233-general-mills-q3-2024-earnings-preview?utm_source=businessinsider&utm_medium=referral&feed_item_type=news
772.0,3/20/2024 7:15:47 AM,Barclays Keeps Their Hold Rating on General Mills (GIS),TipRanks,/news/stocks/barclays-keeps-their-hold-rating-on-general-mills-gis-1033179706
773.0,3/20/2024 7:45:43 AM,General Mills Likely To Report Higher Q3 Earnings; Here Are The Recent Forecast Changes From Wall Street's Most Accurate Analysts,Benzinga,/news/stocks/general-mills-likely-to-report-higher-q3-earnings-here-are-the-recent-forecast-changes-from-wall-street-s-most-accurate-analysts-1033178866
774.0,3/20/2024 7:47:16 AM,Fear & Greed Index Remains In 'Greed' Zone Ahead Of Fed's Interest Rate Decision,Benzinga,/news/stocks/fear-greed-index-remains-in-greed-zone-ahead-of-fed-s-interest-rate-decision-1033178865
775.0,3/20/2024 11:01:35 AM,"General Mills Non-GAAP EPS of $1.17 beats by $0.12, revenue of $5.1B beats by $130M",Seeking Alpha,https://seekingalpha.com/news/4081488-general-mills-non-gaap-eps-of-1_17-beats-0_12-revenue-of-5_1b-beats-130m?utm_source=businessinsider&utm_medium=referral&feed_item_type=news
776.0,3/20/2024 11:21:52 AM,"General Mills gains after organic sales top expectations, margins improve",Seeking Alpha,https://seekingalpha.com/news/4081494-general-mills-gains-after-organic-sales-top-expectations-margins-improve?utm_source=businessinsider&utm_medium=referral&feed_item_type=news
777.0,3/20/2024 12:05:35 PM,"General Mills Q3 Profit Increases, beats estimates",RTTNews,/news/stocks/general-mills-q3-profit-increases-beats-estimates-1033179858
778.0,3/20/2024 1:19:00 PM,"4 stocks to watch on Wednesday: MU, MBLY and more",Seeking Alpha,https://seekingalpha.com/news/4081574-4-stocks-to-watch-on-wednesday-mu-mbly-and-more?utm_source=businessinsider&utm_medium=referral&feed_item_type=news
779.0,3/20/2024 3:52:55 PM,"GIS Stock Earnings: General Mills Beats EPS, Beats Revenue for Q3 2024",InvestorPlace,/news/stocks/gis-stock-earnings-general-mills-for-q3-of-2024-1033181515
780.0,3/20/2024 3:53:45 PM,US Stocks Edge Lower Ahead Of Fed's Decision; General Mills Earnings Top Views,Benzinga,/news/stocks/us-stocks-edge-lower-ahead-of-fed-s-decision-general-mills-earnings-top-views-1033180936
781.0,3/20/2024 4:16:02 PM,Assessing General Mills: A Sell Rating Amid Mixed Performance and Margin Challenges,TipRanks,/news/stocks/assessing-general-mills-a-sell-rating-amid-mixed-performance-and-margin-challenges-1033182091
782.0,3/20/2024 9:35:21 PM,General Mills: A Cautious Hold Amidst Uncertain Volume Improvements and Market Headwinds,TipRanks,/news/stocks/general-mills-a-cautious-hold-amidst-uncertain-volume-improvements-and-market-headwinds-1033182523
783.0,3/20/2024 11:15:27 PM,General Mills: A Cautious Hold Amid Short-Term Gains and Long-Term Uncertainties,TipRanks,/news/stocks/general-mills-a-cautious-hold-amid-short-term-gains-and-long-term-uncertainties-1033182588
784.0,3/21/2024 10:16:08 AM,General Mills Hold Rating: A Balancing Act of Growth Prospects and Market Caution,TipRanks,/news/stocks/general-mills-hold-rating-a-balancing-act-of-growth-prospects-and-market-caution-1033184774
785.0,3/21/2024 10:26:22 AM,Maintaining Hold on General Mills Amid Q3 Outperformance and Anticipated Q4 Headwinds,TipRanks,/news/stocks/maintaining-hold-on-general-mills-amid-q3-outperformance-and-anticipated-q4-headwinds-1033184754
786.0,3/21/2024 11:05:13 AM,RBC Capital Sticks to Their Hold Rating for General Mills (GIS),TipRanks,/news/stocks/rbc-capital-sticks-to-their-hold-rating-for-general-mills-gis-1033185045
787.0,3/21/2024 11:27:08 AM,Piper Sandler Sticks to Its Buy Rating for General Mills (GIS),TipRanks,/news/stocks/piper-sandler-sticks-to-its-buy-rating-for-general-mills-gis-1033185107
788.0,3/21/2024 7:56:31 PM,General Mills Analysts Increase Their Forecasts After Upbeat Earnings,Benzinga,/news/stocks/general-mills-analysts-increase-their-forecasts-after-upbeat-earnings-1033186398
789.0,3/22/2024 12:51:39 PM,These 3 Risk Off Stocks With Over 3% Dividend Yields Are Recommended By Wall Street's Most Accurate Analysts,Benzinga,/news/stocks/these-3-risk-off-stocks-with-over-3-dividend-yields-are-recommended-by-wall-street-s-most-accurate-analysts-1033188283
790.0,3/22/2024 6:12:31 PM,Seven S&P 500 names beat on EPS this week; Micron gets Street cred for its AI prospects - Earnings Scorecard,Seeking Alpha,https://seekingalpha.com/news/4082912-seven-sp-500-names-beat-on-eps-this-week-micron-gets-street-cred-for-its-ai-prospects-earnings-scorecard?utm_source=businessinsider&utm_medium=referral&feed_item_type=news
791.0,4/2/2024 9:32:26 AM,Analysts Offer Insights on Consumer Goods Companies: General Mills (GIS) and Performance Food Group (PFGC),TipRanks,/news/stocks/analysts-offer-insights-on-consumer-goods-companies-general-mills-gis-and-performance-food-group-pfgc-1033214776
792.0,4/4/2024 10:00:00 AM,The Secret Sauce Fueling Palantir Stock’s Meteoric Rise,InvestorPlace,/news/stocks/the-secret-sauce-fueling-palantir-stocks-meteoric-rise-1033221703
793.0,4/9/2024 1:39:07 PM,General Mills goes ex dividend today,Seeking Alpha,https://seekingalpha.com/news/4088219-general-mills-inc-declares-missing-dividend?utm_source=businessinsider&utm_medium=referral&feed_item_type=news
794.0,4/11/2024 9:35:09 AM,Wells Fargo Sticks to Its Hold Rating for General Mills (GIS),TipRanks,/news/stocks/wells-fargo-sticks-to-its-hold-rating-for-general-mills-gis-1033240879
795.0,4/16/2024 12:38:28 PM,Ibotta boosts IPO size as investors eye the AI-enhanced digital marketing play,Seeking Alpha,https://seekingalpha.com/news/4090006-ibotta-boosts-ipo-size-as-investors-eye-the-ai-enhanced-digital-marketing-play?utm_source=businessinsider&utm_medium=referral&feed_item_type=news
796.0,4/17/2024 10:15:00 AM,3 Defensive Stocks to Buy for Increased Volatility in April,InvestorPlace,/news/stocks/3-defensive-stocks-to-buy-for-increased-volatility-in-april-1033257072
797.0,4/18/2024 6:04:16 PM,Ibotta IPO jumps as investors continue to buy into AI hype (update),Seeking Alpha,https://seekingalpha.com/news/4091058-ibotta-jumps-investors-continued-to-buy-ai-hype?utm_source=businessinsider&utm_medium=referral&feed_item_type=news
798.0,4/19/2024 2:40:16 PM,Ibotta slips below opening price following IPO,Seeking Alpha,https://seekingalpha.com/news/4091527-ibotta-slips-below-opening-price-following-ipo?utm_source=businessinsider&utm_medium=referral&feed_item_type=news
799.0,4/22/2024 10:30:00 AM,7 Deadly Dividend Stocks to Avoid at All Costs: April 2024,InvestorPlace,/news/stocks/7-deadly-dividend-stocks-to-avoid-at-all-costs-april-2024-1033270353
800.0,4/22/2024 11:45:13 AM,Stifel Nicolaus Reaffirms Their Buy Rating on General Mills (GIS),TipRanks,/news/stocks/stifel-nicolaus-reaffirms-their-buy-rating-on-general-mills-gis-1033271779
801.0,4/25/2024 10:00:00 AM,7 Stocks That Will Keep Going Up During the Next Downturn,InvestorPlace,/news/stocks/7-stocks-that-will-keep-going-up-during-the-next-downturn-1033286964
802.0,4/26/2024 6:29:00 PM,General Mills explores selling $2B North America yogurt business - Reuters,Seeking Alpha,https://seekingalpha.com/news/4095094-general-mills-explores-selling-2b-north-america-yogurt-business-reuters?utm_source=businessinsider&utm_medium=referral&feed_item_type=news
803.0,4/29/2024 9:46:34 AM,Barclays Sticks to Their Hold Rating for General Mills (GIS),TipRanks,/news/stocks/barclays-sticks-to-their-hold-rating-for-general-mills-gis-1033300084
804.0,4/30/2024 6:59:24 AM,"Analysts Offer Insights on Consumer Goods Companies: Darling Ingredients (DAR), General Mills (GIS) and Wilmar International (OtherWLMIF)",TipRanks,/news/stocks/analysts-offer-insights-on-consumer-goods-companies-darling-ingredients-dar-general-mills-gis-and-wilmar-international-otherwlmif-1033305121
805.0,5/5/2024 8:00:00 PM,Turbulent Times: 3 Stocks That Could Outperform in a Market Crash,InvestorPlace,/news/stocks/turbulent-times-3-stocks-that-could-outperform-in-a-market-crash-1033329725
806.0,5/29/2024 4:15:06 AM,J.P. Morgan Keeps Their Hold Rating on General Mills (GIS),TipRanks,/news/stocks/j-p-morgan-keeps-their-hold-rating-on-general-mills-gis-1033430367
807.0,5/30/2024 7:06:43 PM,Want Better Returns? Don't Ignore These 2 Consumer Staples Stocks Set to Beat Earnings,Benzinga,/news/stocks/want-better-returns-don-t-ignore-these-2-consumer-staples-stocks-set-to-beat-earnings-1033437428
808.0,6/12/2024 10:43:27 AM,Wells Fargo Keeps Their Hold Rating on General Mills (GIS),TipRanks,/news/stocks/wells-fargo-keeps-their-hold-rating-on-general-mills-gis-1033472878
809.0,6/12/2024 10:47:32 AM,Analysts Offer Insights on Consumer Goods Companies: General Mills (GIS) and Kroger Company (KR),TipRanks,/news/stocks/analysts-offer-insights-on-consumer-goods-companies-general-mills-gis-and-kroger-company-kr-1033472862
810.0,6/12/2024 10:53:41 AM,Analysts’ Opinions Are Mixed on These Consumer Goods Stocks: General Mills (GIS) and Keurig Dr Pepper (KDP),TipRanks,/news/stocks/analysts-opinions-are-mixed-on-these-consumer-goods-stocks-general-mills-gis-and-keurig-dr-pepper-kdp-1033472843
811.0,6/17/2024 9:38:30 PM,Will Top Line Contraction Hinder Jabil's Q3 Earnings?,Benzinga,/news/stocks/will-top-line-contraction-hinder-jabil-s-q3-earnings-1033485016
812.0,6/18/2024 1:45:40 AM,RBC Capital Remains a Hold on General Mills (GIS),TipRanks,/news/stocks/rbc-capital-remains-a-hold-on-general-mills-gis-1033485614
813.0,6/18/2024 1:20:05 PM,Analysts Offer Insights on Consumer Goods Companies: Conagra Brands (CAG) and General Mills (GIS),TipRanks,/news/stocks/analysts-offer-insights-on-consumer-goods-companies-conagra-brands-cag-and-general-mills-gis-1033488143
814.0,6/19/2024 7:08:12 PM,The Kroger Co. Queues for Q1 Earnings: Is a Beat Likely?,Benzinga,/news/stocks/the-kroger-co-queues-for-q1-earnings-is-a-beat-likely-1033490919
815.0,6/21/2024 10:33:00 AM,7 Undervalued Stocks to Buy and Hold Forever: June 2024 Edition,InvestorPlace,/news/stocks/7-undervalued-stocks-to-buy-and-hold-forever-june-2024-edition-1033495533
816.0,6/21/2024 10:40:06 AM,"Analysts Are Neutral on Top Consumer Goods Stocks: General Mills (GIS), The Hershey Company (HSY)",TipRanks,/news/stocks/analysts-are-neutral-on-top-consumer-goods-stocks-general-mills-gis-the-hershey-company-hsy-1033496092
817.0,6/21/2024 7:00:42 PM,"Catalyst Watch: Nike earnings, Datadog event, Norfolk Southern decision, and an oil field-crypto IPO",Seeking Alpha,https://seekingalpha.com/news/4117981-catalyst-watch-nike-earnings-datadog-event-norfolk-southern-decision-and-an-oil-field-crypto-ipo?utm_source=businessinsider&utm_medium=referral&feed_item_type=news
818.0,6/23/2024 12:00:00 PM,"Earnings week ahead: FedEx, Nike, Carnival, Micron, BlackBerry, Walgreens Boots, and more",Seeking Alpha,https://seekingalpha.com/news/4117947-earnings-week-ahead-fedex-nike-carnival-micron-blackberry-walgreens-boots-and-more?utm_source=businessinsider&utm_medium=referral&feed_item_type=news
819.0,6/24/2024 9:58:59 PM,Will General Mills Top Estimates in Q4 Earnings Release?,Benzinga,/news/stocks/will-general-mills-top-estimates-in-q4-earnings-release-1033501506
820.0,6/24/2024 9:59:27 PM,Here's How BlackBerry is Placed Ahead of Q1 Earnings,Benzinga,/news/stocks/here-s-how-blackberry-is-placed-ahead-of-q1-earnings-1033501497
821.0,6/25/2024 3:01:13 PM,General Mills earnings preview: what Wall Street is expecting,Markets Insider Automation,/news/stocks/general_mills-q4-earnings-preview-stock-1033503639
822.0,6/25/2024 3:13:48 PM,Notable earnings before Wednesday's open,Seeking Alpha,https://seekingalpha.com/news/4119038-notable-earnings-before-wednesdays-open?utm_source=businessinsider&utm_medium=referral&feed_item_type=news
823.0,6/25/2024 4:19:36 PM,General Mills Q4 2024 Earnings Preview,Seeking Alpha,https://seekingalpha.com/news/4119072-general-mills-q4-2024-earnings-preview?utm_source=businessinsider&utm_medium=referral&feed_item_type=news
824.0,6/26/2024 7:15:20 AM,General Mills (GIS) Gets a Hold from Barclays,TipRanks,/news/stocks/general-mills-gis-gets-a-hold-from-barclays-1033506910
825.0,6/26/2024 11:01:33 AM,"General Mills Non-GAAP EPS of $1.01 beats by $0.02, revenue of $4.71B misses by $150M",Seeking Alpha,https://seekingalpha.com/news/4119364-general-mills-non-gaap-eps-of-1_01-beats-0_02-revenue-of-4_71b-misses-150m?utm_source=businessinsider&utm_medium=referral&feed_item_type=news
826.0,6/26/2024 11:28:02 AM,General Mills sheds 4% after its organic sales tally disappoints,Seeking Alpha,https://seekingalpha.com/news/4119385-general-mills-sheds-4-after-its-organic-sales-tally-disappoints?utm_source=businessinsider&utm_medium=referral&feed_item_type=news
827.0,6/26/2024 1:04:00 PM,"4 stocks to watch on Wednesday: MU, WHR and more",Seeking Alpha,https://seekingalpha.com/news/4119490-4-stocks-to-watch-on-wednesday-mu-whr-and-more?utm_source=businessinsider&utm_medium=referral&feed_item_type=news
828.0,6/26/2024 1:05:03 PM,"General Mills Q4 Profit Decreases, But Beats Estimates ",RTTNews,/news/stocks/general-mills-q4-profit-decreases-but-beats-estimates-1033507033
829.0,6/26/2024 1:08:36 PM,General Mills raises dividend by 1.7% to $0.60,Seeking Alpha,https://seekingalpha.com/news/4119491-general-mills-raises-dividend-by-17-to-060?utm_source=businessinsider&utm_medium=referral&feed_item_type=news
830.0,6/26/2024 1:25:37 PM,General Mills Hold Rating Affirmed Amid Subdued Financial Outlook and Market Cautiousness,TipRanks,/news/stocks/general-mills-hold-rating-affirmed-amid-subdued-financial-outlook-and-market-cautiousness-1033508710
831.0,6/26/2024 2:45:00 PM,General Mills hosts conference call for investors,Markets Insider Automation,/news/stocks/general_mills_conference-1029579477
832.0,6/26/2024 3:52:48 PM,"GIS Stock Earnings: General Mills Beats EPS, Misses Revenue for Q4 2024",InvestorPlace,/news/stocks/gis-stock-earnings-general-mills-for-q4-of-2024-1033508562
833.0,6/26/2024 8:15:00 PM,"Wall Street Wavers, Nvidia Resumes Losses, Tesla Eyes 4-Month High Close, Amazon Hits $2 Trillion Value: What's Driving Markets Wednesday?",Benzinga,/news/stocks/wall-street-wavers-nvidia-resumes-losses-tesla-eyes-4-month-high-close-amazon-hits-2-trillion-value-what-s-driving-markets-wednesday-1033508930
834.0,6/27/2024 12:15:50 AM,General Mills: A Balanced Outlook with Pricing Strength Amidst Cost Pressures and Competitive Challenges,TipRanks,/news/stocks/general-mills-a-balanced-outlook-with-pricing-strength-amidst-cost-pressures-and-competitive-challenges-1033509476
835.0,6/27/2024 1:17:51 AM,General Mills: Balancing Near-Term Challenges with Medium-Term Growth Opportunities,TipRanks,/news/stocks/general-mills-balancing-near-term-challenges-with-medium-term-growth-opportunities-1033509713
836.0,6/27/2024 9:45:24 AM,General Mills: A Cautious Hold Amidst Market Share Struggles and Margin Pressures,TipRanks,/news/stocks/general-mills-a-cautious-hold-amidst-market-share-struggles-and-margin-pressures-1033511311
837.0,6/27/2024 10:50:22 AM,Analysts Offer Insights on Consumer Goods Companies: General Mills (GIS) and Metcash Limited (OtherMCSHF),TipRanks,/news/stocks/analysts-offer-insights-on-consumer-goods-companies-general-mills-gis-and-metcash-limited-othermcshf-1033511597
838.0,6/27/2024 3:04:56 PM,Micron To Rally Over 12%? Here Are 10 Top Analyst Forecasts For Thursday,Benzinga,/news/stocks/micron-to-rally-over-12-here-are-10-top-analyst-forecasts-for-thursday-1033511321
839.0,6/28/2024 12:26:48 PM,Evercore ISI Sticks to Their Hold Rating for General Mills (GIS),TipRanks,/news/stocks/evercore-isi-sticks-to-their-hold-rating-for-general-mills-gis-1033515880
840.0,6/29/2024 6:45:00 PM,Earnings Scorecard: Nike loses air after shocker results send shares sliding,Seeking Alpha,https://seekingalpha.com/news/4120757-earnings-scorecard-nike-loses-air-after-shocker-results-send-shares-sliding?utm_source=businessinsider&utm_medium=referral&feed_item_type=news
841.0,7/10/2024 10:25:44 AM,General Mills: A Balanced View of Stability and Challenges Ahead,TipRanks,/news/stocks/general-mills-a-balanced-view-of-stability-and-challenges-ahead-1033543325
842.0,7/10/2024 7:31:28 PM,WK Kellogg Faces Grim Outlook: BofA Analyst Downgrades Stock Amid Persistent Volume Challenges,Benzinga,/news/stocks/wk-kellogg-faces-grim-outlook-bofa-analyst-downgrades-stock-amid-persistent-volume-challenges-1033544509
843.0,7/11/2024 5:23:10 PM,The 3 Most Undervalued S&P 500 Stocks to Buy in July 2024,InvestorPlace,/news/stocks/the-3-most-undervalued-sp-500-stocks-to-buy-in-july-2024-1033548274
844.0,7/15/2024 4:31:04 PM,3 Spinoff Stocks You Should Buy Now: July 2024,InvestorPlace,/news/stocks/3-spinoff-stocks-you-should-buy-now-july-2024-1033556404
845.0,7/16/2024 8:30:00 PM,3 Blue-Chip Stocks to Buy at a 52-Week Low in July,InvestorPlace,/news/stocks/3-blue-chip-stocks-to-buy-at-a-52-week-low-in-july-1033560858
