Unnamed: 0,datetime,title,source,link
0.0,7/17/2007 4:36:00 PM,"/C O R R E C T I O N -- Tyler Technologies, Inc./",PR Newswire,/news/stocks/c-o-r-r-e-c-t-i-o-n-tyler-technologies-inc-1029041441
1.0,12/7/2016 11:56:05 PM,BRIEF-Tyler provides update on Odyssey court case management implementation (TYL),Reuters,http://www.businessinsider.com/r-brief-tyler-provides-update-on-odyssey-court-case-management-implementation-2016-12
2.0,2/8/2017 10:38:09 PM,BRIEF-Tyler Technologies Q4 earnings per share $0.80 (TYL),Reuters,http://www.businessinsider.com/r-brief-tyler-technologies-q4-earnings-per-share-080-2017-2
3.0,3/9/2017 3:46:22 PM,"BRIEF-Tyler Technologies signs $6.9 mln deal with Clayton County, Georgia (TYL)",Reuters,http://www.businessinsider.com/r-brief-tyler-technologies-signs-69-mln-deal-with-clayton-county-georgia-2017-3
4.0,4/25/2017 3:51:06 PM,"BRIEF-Tyler Technologies signs $36 mln agreement with Cook County, Illinois, for Odyssey solution (TYL)",Reuters,http://www.businessinsider.com/r-brief-tyler-technologies-signs-36-mln-agreement-with-cook-county-illinois-for-odyssey-solution-2017-4
5.0,4/26/2017 11:21:11 PM,BRIEF-Tyler Technologies reports Q1 earnings per share $0.83 (TYL),Reuters,http://www.businessinsider.com/r-brief-tyler-technologies-reports-q1-earnings-per-share-083-2017-4
6.0,5/30/2017 7:56:05 PM,BRIEF-TYLER TECHNOLOGIES ACQUIRES MODRIA (TYL),Reuters,http://www.businessinsider.com/r-brief-tyler-technologies-acquires-modria-2017-5
7.0,7/24/2017 3:32:06 PM,BRIEF-Tyler Technologies signs deal to provide mass appraisal solution to Philadelphia (TYL),Reuters,http://www.businessinsider.com/r-brief-tyler-technologies-signs-deal-to-provide-mass-appraisal-solution-to-philadelphia-2017-7
8.0,7/26/2017 10:58:08 PM,BRIEF-Tyler Technologies Q2 non-GAAP earnings per share $0.91 (TYL),Reuters,http://www.businessinsider.com/r-brief-tyler-technologies-q2-non-gaap-earnings-per-share-091-2017-7
9.0,8/2/2017 6:52:13 PM,BRIEF-Tyler Technologies acquires Digital Health Department Inc (TYL),Reuters,http://www.businessinsider.com/r-brief-tyler-technologies-acquires-digital-health-department-inc-2017-8
10.0,10/25/2017 10:22:26 PM,BRIEF-Tyler Technologies reports Q3 earnings per share $0.97 (TYL),Reuters,http://www.businessinsider.com/r-brief-tyler-technologies-reports-q3-earnings-per-share-097-2017-10
11.0,11/11/2017 1:01:00 AM,"Lifshitz & Miller LLP Announces Investigation of Calpine Corporation, Deltic Timber Corporation, FactSet Research Systems Inc., Intel Corporation, Norwegian Cruise Line Holdings Ltd., ResMed Inc.",PR Newswire,/news/stocks/lifshitz-miller-llp-announces-investigation-of-calpine-corporation-deltic-timber-corporation-factset-research-systems-inc-intel-corporation-norwegian-cruise-line-holdings-ltd-resmed-inc-1007609056
12.0,11/29/2017 3:37:03 PM,BRIEF-Tyler Technologies Acquires Radio 10-33 (TYL),Reuters,http://www.businessinsider.com/r-brief-tyler-technologies-acquires-radio-10-33-2017-11
13.0,12/14/2017 3:37:03 PM,BRIEF-Tyler Technologies Has Signed An Agreement With Ohio Court Of Claims For Tyler's Modria Online Dispute Resolution Solution (TYL),Reuters,http://www.businessinsider.com/r-brief-tyler-technologies-has-signed-an-agreement-with-ohio-court-of-claims-for-tylers-modria-online-dispute-resolution-solution-2017-12
14.0,4/18/2018 12:47:57 PM,BRIEF-Tyler Technologies To Acquire Socrata,Reuters,http://feeds.reuters.com/~r/reuters/companyNews/~3/02QjFhw1KEY/brief-tyler-technologies-to-acquire-socrata-idUSASC09W8Y
15.0,5/10/2018 3:18:56 PM,BRIEF-Tyler Technologies Announces CEO Transition,Reuters,http://feeds.reuters.com/~r/reuters/companyNews/~3/QHAt5nfS8ug/brief-tyler-technologies-announces-ceo-transition-idUSASC0A1H8
16.0,7/24/2018 3:02:12 PM,Tyler Technologies is about to announce its earnings — here's what to expect,Markets Insider Automation,/news/stocks/tyler_technologies-stock-price-quarter-earnings-preview-q2-1027394169
17.0,8/2/2018 8:32:00 PM,"SuperMoose Borrower, LLC -- Moody's assigns B3 CFR to SuperMoose; B2 to first lien facilities and Caa2 to second lien loan; outlook stable",Moodys,/news/bonds/supermoose-borrower-llc-moody-s-assigns-b3-cfr-to-supermoose-b2-to-first-lien-facilities-and-caa2-to-second-lien-loan-outlook-stable-1027427441
18.0,10/29/2018 3:02:58 PM,Here's what to expect from Tyler Technologies's earnings report,Markets Insider Automation,/news/stocks/tyler_technologies-q3-quarterly-earnings-preview-stock-1027666209
19.0,2/18/2019 3:01:37 PM,Here's what Wall Street expects from Tyler Technologies's earnings report,Markets Insider Automation,/news/stocks/tyler_technologies-stock-quarter-earnings-preview-q4-1027960624
20.0,4/29/2019 3:02:37 PM,Here's what to expect from Tyler Technologies's earnings,Markets Insider Automation,/news/stocks/tyler_technologies-q1-quarterly-earnings-preview-1028148612
21.0,7/29/2019 3:02:47 PM,Here's what to expect from Tyler Technologies's earnings report,Markets Insider Automation,/news/stocks/tyler_technologies-q2-earnings-preview-1028393795
22.0,8/5/2019 9:18:00 PM,"CentralSquare Technologies, LLC -- Moody's downgrades CentralSquare's CFR to Caa1; outlook is negative",Moodys,/news/bonds/centralsquare-technologies-llc-moody-s-downgrades-centralsquare-s-cfr-to-caa1-outlook-is-negative-1028418654
23.0,1/3/2020 11:11:45 AM,Stock Alert: Shares Of Tyler Technologies Inc. (TYL) Hit 52-Week High ,RTTNews,/news/stocks/stock-alert-shares-of-tyler-technologies-inc-tyl-hit-52-week-high-1028792923
24.0,2/11/2020 3:02:13 PM,Here's what Wall Street expects from Tyler Technologies's earnings,Markets Insider Automation,/news/stocks/tyler_technologies-q4-quarterly-earnings-preview-stock-1028893532
25.0,2/11/2020 10:35:45 PM,Tyler Technologies Q4 2019 Earnings Preview,Seeking Alpha,https://seekingalpha.com/news/3540601-tyler-technologies-q4-2019-earnings-preview?utm_source=markets.businessinsider.com&utm_medium=referral
26.0,4/8/2020 6:13:19 PM,7 Companies That Deserve to Be S&P 500 Stocks,InvestorPlace,/news/stocks/7-companies-that-deserve-to-be-sp-500-stocks-1029077621
27.0,4/28/2020 3:02:13 PM,What Wall Street expects from Tyler Technologies's earnings,Markets Insider Automation,/news/stocks/tyler_technologies-stock-q1-earnings-preview-1029138324
28.0,4/28/2020 9:35:47 PM,Tyler Technologies Q1 2020 Earnings Preview,Seeking Alpha,https://seekingalpha.com/news/3565477-tyler-technologies-q1-2020-earnings-preview?utm_source=markets.businessinsider.com&utm_medium=referral
29.0,5/13/2020 3:34:20 PM,"ANSYS, Tyler Tech positioned for outperformance - Benchmark",Seeking Alpha,https://seekingalpha.com/news/3573976-ansys-tyler-tech-positioned-for-outperformance-benchmark?utm_source=markets.businessinsider.com&utm_medium=referral
30.0,6/12/2020 10:11:00 PM,Quarterly S&P rebalancing spurs several late movers,Seeking Alpha,https://seekingalpha.com/news/3582812-quarterly-s-and-p-rebalancing-spurs-several-late-movers?utm_source=markets.businessinsider.com&utm_medium=referral
31.0,7/28/2020 3:01:59 PM,Here's what Wall Street expects from Tyler Technologies's earnings,Markets Insider Automation,/news/stocks/tyler_technologies-stock-price-quarter-earnings-preview-q2-1029438807
32.0,11/3/2020 10:35:03 PM,Tyler Technologies Q3 2020 Earnings Preview,Seeking Alpha,https://seekingalpha.com/news/3630656-tyler-technologies-q3-2020-earnings-preview?utm_source=markets.businessinsider.com&utm_medium=referral
33.0,11/3/2020 10:35:22 PM,Notable earnings after Wednesday's close,Seeking Alpha,https://seekingalpha.com/news/3630529-notable-earnings-after-wednesdays-close?utm_source=markets.businessinsider.com&utm_medium=referral
34.0,11/4/2020 8:29:45 PM,"Datadog, DocuSign stocks among software gainers as election could table tax hikes",Seeking Alpha,https://seekingalpha.com/news/3631434-datadog-docusign-stocks-among-software-gainers-election-table-tax-hikes?utm_source=markets.businessinsider.com&utm_medium=referral
35.0,1/12/2021 2:43:59 PM,"Tyler Technologies’ appraisal software and services selected by Jackson County, MO",Seeking Alpha,https://seekingalpha.com/news/3650723-tyler-technologies-appraisal-software-and-services-selected-jackson-county-mo?utm_source=markets.businessinsider.com&utm_medium=referral
36.0,2/8/2021 3:02:01 PM,What Wall Street expects from Tyler Technologies's earnings,Markets Insider Automation,/news/stocks/tyler_technologies-quarter-earnings-preview-q4-1030055351
37.0,2/9/2021 10:35:44 PM,Tyler Technologies Q4 2020 Earnings Preview,Seeking Alpha,https://seekingalpha.com/news/3660132-tyler-technologies-q4-2020-earnings-preview?utm_source=markets.businessinsider.com&utm_medium=referral
38.0,2/9/2021 10:35:50 PM,Notable earnings after Wednesday's close,Seeking Alpha,https://seekingalpha.com/news/3660030-notable-earnings-after-wednesdays-close?utm_source=markets.businessinsider.com&utm_medium=referral
39.0,2/10/2021 11:54:14 AM,"Tyler Technologies EPS misses by $0.03, misses on revenue",Seeking Alpha,https://seekingalpha.com/news/3660410-tyler-technologies-eps-misses-0_03-misses-on-revenue?utm_source=markets.businessinsider.com&utm_medium=referral
40.0,2/10/2021 12:02:18 PM,NIC gains on acquisition by Tyler Technologies for $2.3B,Seeking Alpha,https://seekingalpha.com/news/3660424-nic-gains-on-acquisition-by-tyler-technologies-for-23b?utm_source=markets.businessinsider.com&utm_medium=referral
41.0,2/10/2021 1:04:59 PM,Tyler Technologies To Acquire NIC For About $2.3 Bln - Quick Facts ,RTTNews,/news/stocks/tyler-technologies-to-acquire-nic-for-about-2-3-bln-quick-facts-1030065921
42.0,2/10/2021 3:48:17 PM,"Tyler Misses On Q4 Earnings, Sets To Acquire NIC For $2.3B In Cash",Benzinga,/news/stocks/tyler-misses-on-q4-earnings-sets-to-acquire-nic-for-2-3b-in-cash-1030067277
43.0,3/5/2021 10:45:09 AM,Tyler Technologies raises $525M through debt offering,Seeking Alpha,https://seekingalpha.com/news/3669813-tyler-technologies-raises-525m-through-debt-offering?utm_source=markets.businessinsider.com&utm_medium=referral
44.0,3/5/2021 1:24:08 PM,"MRO, FLGT, VET and CPE among premarket gainers",Seeking Alpha,https://seekingalpha.com/news/3669884-mro-flgt-vet-and-cpe-among-premarket-gainers?utm_source=markets.businessinsider.com&utm_medium=referral
45.0,3/11/2021 4:02:44 PM,"Benzinga's Top Ratings Upgrades, Downgrades For March 11, 2021",Benzinga,/news/stocks/benzinga-s-top-ratings-upgrades-downgrades-for-march-11-2021-1030174008
46.0,3/18/2021 7:23:40 PM,Tyler Technologies case management suite goes live at Mendocino Superior Court,Seeking Alpha,https://seekingalpha.com/news/3674182-tyler-technologies-case-management-suite-goes-live-at-mendocino-superior-court?utm_source=markets.businessinsider.com&utm_medium=referral
47.0,3/31/2021 1:42:30 PM,Tyler Technologies buys DataSpec,Seeking Alpha,https://seekingalpha.com/news/3678078-tyler-technologies-buys-dataspec?utm_source=markets.businessinsider.com&utm_medium=referral
48.0,4/1/2021 2:42:08 PM,10 Biggest Price Target Changes For Thursday,Benzinga,/news/stocks/10-biggest-price-target-changes-for-thursday-1030268939
49.0,4/5/2021 1:49:49 PM,Tyler Technologies buys ReadySub,Seeking Alpha,https://seekingalpha.com/news/3679158-tyler-technologies-buys-readysub?utm_source=markets.businessinsider.com&utm_medium=referral
50.0,4/26/2021 3:02:04 PM,What Wall Street expects from Tyler Technologies's earnings,Markets Insider Automation,/news/stocks/tyler_technologies-stock-price-quarter-earnings-preview-q1-1030345522
51.0,4/27/2021 9:35:40 PM,Notable earnings after Wednesday's close,Seeking Alpha,https://seekingalpha.com/news/3686207-notable-earnings-after-wednesdays-close?utm_source=markets.businessinsider.com&utm_medium=referral
52.0,4/27/2021 9:35:44 PM,Tyler Technologies Q1 2021 Earnings Preview,Seeking Alpha,https://seekingalpha.com/news/3686210-tyler-technologies-q1-2021-earnings-preview?utm_source=markets.businessinsider.com&utm_medium=referral
53.0,6/3/2021 4:24:46 PM,Tyler Technologies To Buy Cloud-based Software Provider VendEngine For $84 Mln Cash - Quick Facts ,RTTNews,/news/stocks/tyler-technologies-to-buy-cloud-based-software-provider-vendengine-for-84-mln-cash-quick-facts-1030491990
54.0,6/4/2021 7:30:04 PM,Seeking Alpha Catalyst Watch,Seeking Alpha,https://seekingalpha.com/news/3703423-seeking-alpha-catalyst-watch?utm_source=markets.businessinsider.com&utm_medium=referral
55.0,6/7/2021 11:54:40 AM,Tyler Tech boosts FY21 guidance,Seeking Alpha,https://seekingalpha.com/news/3703607-tyler-tech-boosts-fy21-guidance?utm_source=markets.businessinsider.com&utm_medium=referral
56.0,6/7/2021 3:54:16 PM,"Tyler Technologies Cuts FY EPS View, But Lifts FY Adj. EPS Outlook ",RTTNews,/news/stocks/tyler-technologies-cuts-fy-eps-view-but-lifts-fy-adj-eps-outlook-1030499953
57.0,6/8/2021 2:06:15 PM,10 Biggest Price Target Changes For Tuesday,Benzinga,/news/stocks/10-biggest-price-target-changes-for-tuesday-1030503150
58.0,6/22/2021 12:01:00 PM,SafeGraph Announces Official Partnership with Tyler Technologies,PR Newswire,/news/stocks/safegraph-announces-official-partnership-with-tyler-technologies-1030542000
59.0,7/16/2021 1:43:51 PM,Tyler Technologies enters pact with NREL to expand solar energy access,Seeking Alpha,https://seekingalpha.com/news/3715983-tyler-technologies-enters-pact-with-nrel-to-expand-solar-energy-access?utm_source=markets.businessinsider.com&utm_medium=referral
60.0,7/26/2021 3:01:46 PM,Here's what to expect from Tyler Technologies's earnings,Markets Insider Automation,/news/stocks/tyler_technologies-stock-q2-earnings-preview-1030644846
61.0,7/27/2021 9:35:17 PM,Notable earnings after Wednesday's close,Seeking Alpha,https://seekingalpha.com/news/3719682-notable-earnings-after-wednesdays-close?utm_source=markets.businessinsider.com&utm_medium=referral
62.0,7/28/2021 8:51:21 PM,"Tyler Technologies EPS beats by $0.22, beats on revenue",Seeking Alpha,https://seekingalpha.com/news/3720996-tyler-technologies-eps-beats-0_22-beats-on-revenue?utm_source=markets.businessinsider.com&utm_medium=referral
63.0,7/29/2021 2:44:24 PM,10 Biggest Price Target Changes For Thursday,Benzinga,/news/stocks/10-biggest-price-target-changes-for-thursday-1030662458
64.0,8/31/2021 5:44:32 PM,"Benzinga's Top Ratings Upgrades, Downgrades For August 31, 2021",Benzinga,/news/stocks/benzinga-s-top-ratings-upgrades-downgrades-for-august-31-2021-1030770439
65.0,9/13/2021 4:17:54 PM,"Benzinga's Top Ratings Upgrades, Downgrades For September 13, 2021",Benzinga,/news/stocks/benzinga-s-top-ratings-upgrades-downgrades-for-september-13-2021-1030796097
66.0,9/13/2021 7:01:10 PM,Where Tyler Technologies Stands With Analysts,Benzinga,/news/stocks/where-tyler-technologies-stands-with-analysts-1030796400
67.0,10/25/2021 3:02:03 PM,What Wall Street expects from Tyler Technologies's earnings,Markets Insider Automation,/news/stocks/tyler_technologies-stock-q3-earnings-preview-1030894727
68.0,10/26/2021 9:35:59 PM,Notable earnings after Wednesday's close,Seeking Alpha,https://seekingalpha.com/news/3758173-notable-earnings-after-wednesdays-close?utm_source=markets.businessinsider.com&utm_medium=referral
69.0,10/27/2021 9:35:07 PM,Notable earnings after Thursday's close,Seeking Alpha,https://seekingalpha.com/news/3759032-notable-earnings-after-thursdays-close?utm_source=markets.businessinsider.com&utm_medium=referral
70.0,10/28/2021 1:07:44 PM,Tyler Technologies trades lower following Q3 report; boosts FY21 outlook,Seeking Alpha,https://seekingalpha.com/news/3760041-tyler-technologies-trades-lower-following-q3-report-boosts-fy21-outlook?utm_source=markets.businessinsider.com&utm_medium=referral
71.0,10/29/2021 1:32:23 PM,10 Biggest Price Target Changes For Friday,Benzinga,/news/stocks/10-biggest-price-target-changes-for-friday-1030914892
72.0,1/9/2022 7:24:46 PM,"Roblox, Starbucks and Block make BTIG's top picks list: Sector Watch",Seeking Alpha,https://seekingalpha.com/news/3786428-roblox-starbucks-and-block-make-btigs-top-picks-list-sector-watch?utm_source=markets.businessinsider.com&utm_medium=referral
73.0,2/8/2022 2:29:56 PM,Tyler Technologies acquires US eDirect to offer all-in-one outdoor recreation solution,Seeking Alpha,https://seekingalpha.com/news/3797221-tyler-technologies-acquires-us-edirect-to-offer-all-in-one-outdoor-recreation-solution?utm_source=markets.businessinsider.com&utm_medium=referral
74.0,2/15/2022 3:01:13 PM,Tyler Technologies earnings preview: what Wall Street is expecting,Markets Insider Automation,/news/stocks/tyler_technologies-q4-earnings-preview-1031195763
75.0,2/15/2022 10:35:06 PM,Notable earnings after Wednesday's close,Seeking Alpha,https://seekingalpha.com/news/3800129-notable-earnings-after-wednesdays-close?utm_source=markets.businessinsider.com&utm_medium=referral
76.0,2/15/2022 10:35:33 PM,Tyler Technologies Q4 2021 Earnings Preview,Seeking Alpha,https://seekingalpha.com/news/3800288-tyler-technologies-q4-2021-earnings-preview?utm_source=markets.businessinsider.com&utm_medium=referral
77.0,2/16/2022 9:27:56 PM,"Tyler Technologies Non-GAAP EPS of $1.75 beats by $0.01, revenue of $433.5M in-line",Seeking Alpha,https://seekingalpha.com/news/3801052-tyler-technologies-non-gaap-eps-of-1_75-beats-0_01-revenue-of-433_5m-in-line?utm_source=markets.businessinsider.com&utm_medium=referral
78.0,2/17/2022 6:29:16 PM,Tyler Technologies falls 7% after guiding FY22 below consensus,Seeking Alpha,https://seekingalpha.com/news/3801582-tyler-technologies-falls-7-after-guiding-fy22-below-consensus?utm_source=markets.businessinsider.com&utm_medium=referral
79.0,3/14/2022 4:03:08 PM,"Benzinga's Top Ratings Upgrades, Downgrades For March 14, 2022",Benzinga,/news/stocks/benzinga-s-top-ratings-upgrades-downgrades-for-march-14-2022-1031278356
80.0,3/15/2022 4:16:56 PM,"Benzinga's Top Ratings Upgrades, Downgrades For March 15, 2022",Benzinga,/news/stocks/benzinga-s-top-ratings-upgrades-downgrades-for-march-15-2022-1031282157
81.0,3/15/2022 7:01:32 PM,Expert Ratings For Tyler Technologies,Benzinga,/news/stocks/expert-ratings-for-tyler-technologies-1031282612
82.0,4/18/2022 4:04:01 PM,"Benzinga's Top Ratings Upgrades, Downgrades For April 18, 2022",Benzinga,/news/stocks/benzinga-s-top-ratings-upgrades-downgrades-for-april-18-2022-1031361238
83.0,4/25/2022 4:07:25 PM,"Benzinga's Top Ratings Upgrades, Downgrades For April 25, 2022",Benzinga,/news/stocks/benzinga-s-top-ratings-upgrades-downgrades-for-april-25-2022-1031380608
84.0,4/25/2022 10:01:39 PM,Where Tyler Technologies Stands With Analysts,Benzinga,/news/stocks/where-tyler-technologies-stands-with-analysts-1031381366
85.0,4/26/2022 3:01:13 PM,Here's what to expect from Tyler Technologies's earnings report,Markets Insider Automation,/news/stocks/tyler_technologies-quarter-earnings-preview-q1-1031384775
86.0,4/26/2022 9:35:20 PM,Tyler Technologies Q1 2022 Earnings Preview,Seeking Alpha,https://seekingalpha.com/news/3827008-tyler-technologies-q1-2022-earnings-preview?utm_source=markets.businessinsider.com&utm_medium=referral
87.0,4/26/2022 9:35:28 PM,Notable earnings after Wednesday's close,Seeking Alpha,https://seekingalpha.com/news/3826818-notable-earnings-after-wednesdays-close?utm_source=markets.businessinsider.com&utm_medium=referral
88.0,4/27/2022 8:33:01 PM,"Tyler Technologies Non-GAAP EPS of $1.90 beats by $0.22, revenue of $456.1M beats by $31.12M",Seeking Alpha,https://seekingalpha.com/news/3828056-tyler-technologies-non-gaap-eps-of-1_90-beats-0_22-revenue-of-456_1m-beats-31_12m?utm_source=markets.businessinsider.com&utm_medium=referral
89.0,5/10/2022 4:17:40 PM,"Benzinga's Top Ratings Upgrades, Downgrades For May 10, 2022",Benzinga,/news/stocks/benzinga-s-top-ratings-upgrades-downgrades-for-may-10-2022-1031442728
90.0,5/31/2022 1:31:26 PM,Tyler Technologies acquires Quatred,Seeking Alpha,https://seekingalpha.com/news/3843949-tyler-technologies-acquires-quatred?utm_source=markets.businessinsider.com&utm_medium=referral
91.0,6/6/2022 4:00:00 PM,Nearmap location data integrated into workflows of America's largest provider of Computer Assisted Mass Appraisals for properties,PR Newswire,/news/stocks/nearmap-location-data-integrated-into-workflows-of-america-s-largest-provider-of-computer-assisted-mass-appraisals-for-properties-1031511156
92.0,6/7/2022 2:55:58 PM,Where Tyler Technologies Stands With Analysts,Benzinga,/news/stocks/where-tyler-technologies-stands-with-analysts-1031513479
93.0,6/7/2022 4:14:59 PM,"Benzinga's Top Ratings Upgrades, Downgrades For June 7, 2022",Benzinga,/news/stocks/benzinga-s-top-ratings-upgrades-downgrades-for-june-7-2022-1031513895
94.0,6/10/2022 2:12:43 PM,3 Undervalued Stocks to Buy That Are Preparing to Rocket in 2022,InvestorPlace,/news/stocks/3-undervalued-stocks-to-buy-that-are-preparing-to-rocket-in-2022-1031522407
95.0,6/13/2022 4:42:50 PM,Tyler Technologies dips as Executive Chairman sells shares worth $2.2M,Seeking Alpha,https://seekingalpha.com/news/3848121-tyler-technologies-dips-as-executive-chairman-sells-shares-worth-22m?utm_source=businessinsider&utm_medium=referral
96.0,6/13/2022 4:48:37 PM,Tyler Technologies dips as Executive Chairman sells shares worth $2.2M,Seeking Alpha,https://seekingalpha.com/news/3848123-tyler-technologies-dips-as-executive-chairman-sells-shares-worth-22m?utm_source=businessinsider&utm_medium=referral
97.0,7/5/2022 6:09:15 PM,6 Analysts Have This to Say About Tyler Technologies,Benzinga,/news/stocks/6-analysts-have-this-to-say-about-tyler-technologies-1031568112
98.0,7/12/2022 2:10:51 PM,Apple To $173? Here's The Biggest Price Target Changes For Tuesday,Benzinga,/news/stocks/apple-to-173-here-s-the-biggest-price-target-changes-for-tuesday-1031581001
99.0,7/25/2022 9:27:01 PM,"Enterprise Software Firms Like Coursera, Five9, Teladoc Health And More Will 'Bake Looming Macro Slowdown Into Guidance,' Cautions This Analyst",Benzinga,/news/stocks/enterprise-software-firms-like-coursera-five9-teladoc-health-and-more-will-bake-looming-macro-slowdown-into-guidance-cautions-this-analyst-1031612558
100.0,7/26/2022 3:01:13 PM,What Wall Street expects from Tyler Technologies's earnings,Markets Insider Automation,/news/stocks/tyler_technologies-stock-price-quarter-earnings-preview-q2-1031615391
101.0,7/26/2022 9:35:37 PM,Notable earnings after Wednesday's close,Seeking Alpha,https://seekingalpha.com/news/3860550-notable-earnings-after-wednesdays-close?utm_source=businessinsider&utm_medium=referral
102.0,7/27/2022 8:29:48 PM,"Tyler Technologies Non-GAAP EPS of $1.88 beats by $0.06, revenue of $468.69M beats by $10.19M",Seeking Alpha,https://seekingalpha.com/news/3861774-tyler-technologies-non-gaap-eps-of-1_88-beats-0_06-revenue-of-468_69m-beats-10_19m?utm_source=businessinsider&utm_medium=referral
103.0,7/28/2022 8:32:41 PM,Expert Ratings for Tyler Technologies,Benzinga,/news/stocks/expert-ratings-for-tyler-technologies-1031627074
104.0,10/12/2022 11:03:35 AM,Strong dollar will be the new earnings excuse; these stocks look insulated,Seeking Alpha,https://seekingalpha.com/news/3890228-strong-dollar-will-be-the-new-supply-chain-in-earnings-excuses-these-stocks-look-insulated?utm_source=businessinsider&utm_medium=referral
105.0,10/18/2022 10:50:50 AM,"Analysts Offer Insights on Technology Companies: Tyler Technologies (TYL), Airbus Group SE (OtherEADSF) and Nagarro SE (OtherNGRRF)",TipRanks,/news/stocks/analysts-offer-insights-on-technology-companies-tyler-technologies-tyl-airbus-group-se-othereadsf-and-nagarro-se-otherngrrf-1031812833
106.0,10/19/2022 5:20:24 AM,"Analysts Are Bullish on These Technology Stocks: Tyler Technologies (TYL), Paycor HCM (PYCR)",TipRanks,/news/stocks/analysts-are-bullish-on-these-technology-stocks-tyler-technologies-tyl-paycor-hcm-pycr-1031816175
107.0,10/25/2022 3:01:13 PM,Here's what to expect from Tyler Technologies's earnings,Markets Insider Automation,/news/stocks/tyler_technologies-quarter-earnings-preview-q3-1031832773
108.0,10/26/2022 8:28:10 PM,"Tyler Technologies GAAP EPS of $1.26 beats by $0.37, revenue of $473.2M beats by $1.69M",Seeking Alpha,https://seekingalpha.com/news/3895918-tyler-technologies-gaap-eps-of-1_26-beats-0_37-revenue-of-473_2m-beats-1_69m?utm_source=businessinsider&utm_medium=referral
109.0,10/27/2022 5:56:32 AM,Tyler Technologies (TYL) Receives a Buy from BTIG,TipRanks,/news/stocks/tyler-technologies-tyl-receives-a-buy-from-btig-1031841938
110.0,10/27/2022 10:25:30 AM,Tyler Technologies (TYL) Gets a Buy from Needham,TipRanks,/news/stocks/tyler-technologies-tyl-gets-a-buy-from-needham-1031842615
111.0,10/27/2022 12:36:03 PM,Tyler Technologies to acquire payment platform Rapid Financial in $68M deal,Seeking Alpha,https://seekingalpha.com/news/3896435-tyler-technologies-to-acquire-payment-platform-rapid-financial-in-68m-deal?utm_source=businessinsider&utm_medium=referral
112.0,10/28/2022 5:02:06 AM,"Analysts Offer Insights on Technology Companies: Tyler Technologies (TYL), Zendesk (ZEN) and Shopify (SHOP)",TipRanks,/news/stocks/analysts-offer-insights-on-technology-companies-tyler-technologies-tyl-zendesk-zen-and-shopify-shop-1031847110
113.0,10/31/2022 4:21:02 AM,"Analysts Offer Insights on Technology Companies: Caci International (CACI), Tyler Technologies (TYL) and Autodesk (ADSK)",TipRanks,/news/stocks/analysts-offer-insights-on-technology-companies-caci-international-caci-tyler-technologies-tyl-and-autodesk-adsk-1031850836
114.0,11/2/2022 12:44:03 PM,"Analysts’ Opinions Are Mixed on These Technology Stocks: Gartner (IT), Tyler Technologies (TYL) and Paycom (PAYC)",TipRanks,/news/stocks/analysts-opinions-are-mixed-on-these-technology-stocks-gartner-it-tyler-technologies-tyl-and-paycom-payc-1031863997
115.0,11/3/2022 5:51:21 PM,7 Tech Stocks Set to Soar From 52-Week Lows,InvestorPlace,/news/stocks/7-tech-stocks-set-to-soar-from-52-week-lows-1031871951
116.0,11/10/2022 3:11:32 PM,"Benzinga's Top Ratings Upgrades, Downgrades For November 10, 2022",Benzinga,/news/stocks/benzinga-s-top-ratings-upgrades-downgrades-for-november-10-2022-1031898964
